,body,author_flair_text,score,created_utc,link_id
4053,Imgur doesn’t do videos do they? I just saw the weirdest local commercial and want to share,Cowboys,3,1576447946,eb4jgo
4054,I literally said you guys should be allowed to get the ball. I take it back now though,Eagles,1,1576447942,eb4jgo
4055,Bah god that's the Flyer's music!,Redskins,1,1576447942,eb4jgo
4056,Now that was your best one yet!,Eagles,0,1576447941,eb4jgo
4057,Who received the ball at the start of the game?,,1,1576447940,eb4jgo
4058,"I think his first answer was defense, then he said kick this way after the ref asked again. It just seemed like he knew the rule to me",,1,1576447933,eb4jgo
4059,"""Clearly what they said"" except for the fact they said ""Kick"" which is making a decision, and thus ""not deferring"", and never said ""Defer"". 

""BUT THE REFS ARE BAD"" groupthink at it again.",Eagles,0,1576447929,eb4jgo
4060,"You're joking right lmao. We are probably going to have a 12 win team in a Wild Card spot, at BEST our Wildcard candidate will be 8-8",Eagles,3,1576447922,eb4jgo
4061,"Man those screen passes are impossible to defend against, maybe we should use some",Cowboys,3,1576447920,eb4jgo
4062,How they fuck up? He said defer?,Cowboys,6,1576447920,eb4jgo
4063,"Even when interpreted correctly, Dak fucked up. You can’t say defer and kick. When you defer, the rams decide if they want to receive or kick. You can’t pick for the rams, that’s not deferring",Texans,2,1576447917,eb4jgo
4064,USA has a uniform hard on. It's a huge problem.,,1,1576447911,eb4jgo
4065,"Sure, but the ref only turned to the Rams after he said Defer.",Buccaneers,1,1576447908,eb4jgo
4066,cant wait for result of next week so this trash division can be decided and i don't have to hear about it anymore,Eagles,6,1576447904,eb4jgo
4067,I hate that we say this like it's an acceptable answer.,Cowboys,1,1576447902,eb4jgo
4068,"“Lets kick. Let’s kick. Defense. Defense. Kick it that way. We want defense.”  

“You want to kick?”

“We defer to the second half”

I do think it’s slightly bullshit because the ref asked him to clarify and he said defer and then ref said hey chose to kick. But also think ref didn’t need to ask him to clarify in the first place and he shouldn’t need to “listen for 30 seconds” when all you have to do is say either Kick. Receive. That way. Or defer",Steelers,0,1576447901,eb4jgo
4069,Us tooooooooo,Seahawks,1,1576447900,eb4jgo
4070,wrestling is weird,Colts,5,1576447894,eb4jgo
4071,Our corners play way too soft that screens always get good yards,Cowboys,1,1576447891,eb4jgo
4072,Because they have no lives. They also look up to the better team while we don’t really care about them.,Cowboys,1,1576447885,eb4jgo
4073,"Nah because “coin flips aren’t reviewable” lmao

Who knew the refs could fuck you over before the game even starts",Cowboys,1,1576447881,eb4jgo
4074,Typical cowboys want a redo because they fucked up.,Rams,-10,1576447878,eb4jgo
4075,It's also normal for us to just get ass blasted then play well.  This team is a mess.,Cowboys,2,1576447877,eb4jgo
4076,"It's not about whether or not I know what a meter is, but about how fucking stupid it is to use them in a field measured in yards.",Rams,1,1576447875,eb4jgo
4077,Walt has no common sense.,Cowboys,1,1576447871,eb4jgo
4078,Opening kickoff penalty will be on Zuser’s radar for sure in the next episode,Cowboys,1,1576447868,eb4jgo
4079,"But then the ref asked for clarification, “You want to kick?” At which point Dak said, “we want to defer to the second half.” And then the ref just totally ignored Dak saying that?",Cowboys,2,1576447867,eb4jgo
4080,"walt: you've won the coin toss  
dak: Jerry is a cracker",,2,1576447867,eb4jgo
4081,Thank you :),Rams,2,1576447865,eb4jgo
4082,When you remember Jan from the Toyota commercials was also the secretary for Sabre in the Office.,Cowboys,2,1576447860,eb4jgo
4083,There's enough fans of 9-1-1 to support a spin off?,Cowboys,2,1576447859,eb4jgo
4084,"This team. I swear. Big play? Flag. A 1st down? Think its a flag and its Randall Cobbs shoes. Nope flag

Im drunk",Cowboys,1,1576447858,eb4jgo
4085,"I know, but it still sounds like BOOOOOOO",Bengals,1,1576447858,eb4jgo
4086,"hence why I said ""thanks anyway Atlanta"" in the 2nd quarter.",Seahawks,1,1576447858,eb4jgo
4087,"Actually when the ref asked him to clarify,  and dak did by saying defer,  yes. It's on the refs.",Cowboys,0,1576447855,eb4jgo
4088,"&gt; Answer wasn’t changed though. 

It was. He clearly said kick first. Sorry!",Eagles,1,1576447855,eb4jgo
4089,Ditto,Cowboys,0,1576447854,eb4jgo
4090,We are soooo bad at stopping screens,Cowboys,1,1576447854,eb4jgo
4091,[removed],,1,1576447854,eb4jgo
4092,That... is not inaccurate.,Cowboys,1,1576447854,eb4jgo
4093,"""We want to kick"" and ""we want to defer"" are two different choices, ""we want to kick""= Cowboys kick, and Rams get to choose how to start the second half (which they'd obviously likely take the ball) ""we want to defer"" = Rams choose whether to take it or kick at the coin toss and then the Cowboys get to choose to kick or take the ball when the second half starts. Basically the way the ref interpreted it means the Rams will get the ball at the start of both halves when the Cowboys wanted it at the second half.  At least that's how I understand it based on their explanation",,1,1576447853,eb4jgo
4094,Marinelli playbook all prevent D,Cowboys,1,1576447853,eb4jgo
4095,"Yeah they dug up some really old rule that doesn't even apply to this situation, but still since we're the cowboys it gets called against us",Cowboys,1,1576447846,eb4jgo
4096,Our defense just gets destroyed by screens every game,Cowboys,3,1576447846,eb4jgo
4097,[deleted],,1,1576447845,eb4jgo
4098,Teams should just run screen passes against us at least half the time. I’d bet our defense averages something like 15+ yards allowed on screen passes.,Cowboys,1,1576447841,eb4jgo
4099,Because the weather is probably nice over there right now so they leave it open. The sun coming in from the top isn't the problem. It's when it's setting is when it sucks because it comes in through the side windows and shines right into the players eyes.,Cowboys,1,1576447839,eb4jgo
4100,No. One team wins the toss. They choose to either kick first or after the half. That’s what the rule should be.,Cowboys,1,1576447831,eb4jgo
4101,Fuck. I've been  working so much and have missed a ton of games.,Cowboys,1,1576447827,eb4jgo
4102,You dummies are in here talking shit whether or not you win,Cowboys,1,1576447826,eb4jgo
4103,Yo cowboys fans are a trip lmfao,Eagles,9,1576447826,eb4jgo
4104,Well Dak isn't overpaid yet.,Cowboys,1,1576447826,eb4jgo
4105,lol no. The best the Cowboys can finish is 9-7 which isn't enough to get in. So you either gotta win the division or you guys are out,Buccaneers,2,1576447824,eb4jgo
4106,Oh fuck right off.,Seahawks,1,1576447822,eb4jgo
4107,No. Its division or bust,Cowboys,2,1576447819,eb4jgo
4108,"On the other hand, if the Rams win. They'll give it all against the 49ers.",Seahawks,1,1576447818,eb4jgo
4109,"Lol just screen every pass play, they can't stop it.",Rams,9,1576447817,eb4jgo
4110,[deleted],,1,1576447816,eb4jgo
4111,Don’t worry. Next time you’ll see it is when we’re 3rd and 5+ and you’ll see it coming haha.,,2,1576447816,eb4jgo
4112,I'd be surprised if the Rams didn't do the right thing and give the Cowboys the ball to start the half tbh,Eagles,1,1576447814,eb4jgo
4113,"You can either choose wheter to kick or receive, choose which goal to defend, or choose to defer. Dak choose all three. ""We want to kick it that way. Defer to the second half""",Rams,12,1576447809,eb4jgo
4114,Came right at #53,Cowboys,1,1576447809,eb4jgo
4115,Just run screens we don’t have any clue how to stop them.,Cowboys,3,1576447808,eb4jgo
4116,"To me Dak said defer to the 2nd half, then reiterated himself by saying ""yeah, we wanna kick"" (as in kick now). Then the ref misinterpreted this as him saying he wants to defer AND kick off the 2nd.",Seahawks,7,1576447803,eb4jgo
4117,Atlanta isn't winning that shit. They are ass.,,0,1576447802,eb4jgo
4118,Didn’t he not say defer until the ref asked him three times?,Steelers,2,1576447795,eb4jgo
4119,[removed],,1,1576447795,eb4jgo
4120,"Yeah they wont, they'll still be the eagles",Rams,12,1576447794,eb4jgo
4121,Witt was singing “you make me feel so young” to Dak in the huddle before his TD play,Cowboys,4,1576447792,eb4jgo
4122,Giant glass windows on both ends of the stadium.,Cowboys,2,1576447791,eb4jgo
4123,This but with the punters,,2,1576447788,eb4jgo
4124,"After he said a different legal, valid option twice.",Rams,1,1576447788,eb4jgo
4125,Lol,NFL,2,1576447785,eb4jgo
4126,"&gt; Dak just never said the word defer

Umm... about that...",Cowboys,3,1576447783,eb4jgo
4127,Cuz Dak fucked up,Bills,-1,1576447782,eb4jgo
4128,Is this sarcasm,Panthers,5,1576447782,eb4jgo
4129,Don't bitch about it if you can't be be smart enough to know how far meters are. In 9th grade maybe you'll learn.,Cowboys,0,1576447781,eb4jgo
4130,Screen passes...why can’t we defend screen passes? We INVENTED screen passes!!!,Cowboys,10,1576447777,eb4jgo
4131,"Some businesses are run really well.  Top to bottom good leadership, common sense decisions, ethical or unethical you have to applaud their strategic decision making.

Some make a product that is so loved and so eagerly purchased that despite a complete lack of basic common sense or logic they still thrive despite shooting themselves in the head constantly.",,1,1576447777,eb4jgo
4132,Except we have clear evidence that Dak said the n word... Wait...,Cowboys,2,1576447777,eb4jgo
4133,"It's coming in from the big ass windows at the end of the field, dome is closed.",Cowboys,2,1576447777,eb4jgo
4134,Sean Lee looks like a gym teacher who takes his job just a little too seriously,Bears,4,1576447776,eb4jgo
4135,Sure but he needs more snaps on passing downs.,Cowboys,1,1576447774,eb4jgo
4136,Really? wow,Bears,1,1576447774,eb4jgo
4137,Those are windows,Cowboys,2,1576447771,eb4jgo
4138,So he said kick and defer?,Steelers,2,1576447771,eb4jgo
4139,Damn. What an odd set of misunderstandings. I don't think I've ever seen that happen before.,Texans,2,1576447771,eb4jgo
4140,Bruh you really think anyone from the NFC East is gonna get a wild card spot,Cowboys,5,1576447769,eb4jgo
4141,He said it too late. Sorry.,,-5,1576447766,eb4jgo
4142,Then you don't watch enough Cowboys games,,0,1576447766,eb4jgo
4143,I am still impressed with that Jason Witten TD. I saw his jersey number but did not understand how he moved a lot younger than how he has been playing.,Titans,4,1576447766,eb4jgo
4144,[removed],,1,1576447766,eb4jgo
4145,He could do it in the pro bowl,Patriots,1,1576447761,eb4jgo
4146,Why are we always terrible against screen passes?,Cowboys,5,1576447761,eb4jgo
4147,Just like during the cowboys packers game and the 3rd interception.,Cowboys,1,1576447760,eb4jgo
4148,Great work on the screen,Rams,1,1576447760,eb4jgo
4149,Yes because the refs would have to go back on their initial decision which has been seemingly fucking impossible this year,Cowboys,1,1576447759,eb4jgo
4150,http://www.youtube.com/watch?v=nfHOQAT0-Mk&amp;t=0m11s,Cowboys,2,1576447756,eb4jgo
4151,[removed],,2,1576447754,eb4jgo
4152,[removed],,2,1576447754,eb4jgo
4153,Jarwin is a shit blocker,Cowboys,1,1576447753,eb4jgo
4154,Wait what? I thought if you choose kick you still get to receive second half? That's fucked up,Patriots,1,1576447751,eb4jgo
4155,They feeling themselves since they just squeaked one out against the ‘skins.,Cowboys,2,1576447751,eb4jgo
4156,Answer wasn’t changed though. Very obviously just building on his previous answer.,Cowboys,0,1576447749,eb4jgo
4157,Dak deferred the kick off and then he gave the rams the choice for the second half so they elected to receive lol,Saints,-1,1576447748,eb4jgo
4158,All our linebackers are ded,Cowboys,1,1576447747,eb4jgo
4159,"Dak said that we were gonna kick, we’re gonna defer to the second half

But since he said kick first apparently that means we have to kick both halfs",Cowboys,1,1576447746,eb4jgo
4160,Why isn't the dome closed to block the sun,Rams,0,1576447746,eb4jgo
4161,[deleted],,1,1576447745,eb4jgo
4162,Its at a net 0 atm tbh. That coin toss thing is egregious.,,0,1576447744,eb4jgo
4163,"Wait. So we are not in the wild card hunt?

Edit: /s",Cowboys,2,1576447743,eb4jgo
4164,Can Zeke play linebacker?,Cowboys,2,1576447738,eb4jgo
4165,Something. No one knows. Especially not the refs,NFL,2,1576447738,eb4jgo
4166,Holding like a motherfucker on the outside there,,2,1576447738,eb4jgo
4167,Damn that play developed from nothing,Rams,1,1576447734,eb4jgo
4168,ya,,2,1576447734,eb4jgo
4169,[removed],,2,1576447733,eb4jgo
4170,[removed],,4,1576447729,eb4jgo
4171,https://twitter.com/quirkyresearch/status/1205125155523121153?s=21 PAtriots apparently did it intentionally once,Bears,2,1576447729,eb4jgo
4172,"When you defer you have to give the rams the opportunity to say what they want to do to open the half. 

You can’t say you want to kick and defer. Dak fucked up, it’s on him to make his intentions clear. The refs aren’t here to bail out Dak for his inability to do that",Texans,7,1576447729,eb4jgo
4173,Anytime now LVE. It would be nice to have you.,Cowboys,1,1576447725,eb4jgo
4174,[removed],,1,1576447725,eb4jgo
4175,[removed],,3,1576447724,eb4jgo
4176,[removed],,3,1576447724,eb4jgo
4177,"Lol so Dak pooed his pants when faced with communicating their decision, and the ref brain-farted in response to listening to Dak poo his pants.",,-7,1576447722,eb4jgo
4178,It seems like the ref was a little quick to say kick. I heard Prescott say “defer to second half” which is exactly right according to the rule posted in this thread,,5,1576447722,eb4jgo
4179,Right? He said it twice and then said something else. His third statement shouldn't be the deciding choice,Rams,1,1576447721,eb4jgo
4180,Nice,Cowboys,3,1576447717,eb4jgo
4181,"So?

The Ref only turns around to tell the Rams after he says Defer.",Buccaneers,1,1576447716,eb4jgo
4182,Because of some odd semantical argument the rams also get to receive the second half,Cowboys,1,1576447711,eb4jgo
4183,Lol Philly won't be the Cowboys next week,Cowboys,-2,1576447710,eb4jgo
4184,Can't change your answer. Sorry!,Eagles,0,1576447709,eb4jgo
4185,It would make too much sense to just have the rams kick after half. Can’t do it. It’s written in stone.,Cowboys,3,1576447708,eb4jgo
4186,Uhhh... sounds like BOOOOOO to me,Bengals,0,1576447708,eb4jgo
4187,[removed],,1,1576447708,eb4jgo
4188,Thanks anyway Atlanta.,Seahawks,1,1576447708,eb4jgo
4189,[removed],,2,1576447707,eb4jgo
4190,God I hate joe buck,Saints,1,1576447706,eb4jgo
4191,Ok boomer,Cowboys,1,1576447705,eb4jgo
4192,We're getting low on linebackers.,Cowboys,1,1576447705,eb4jgo
4193,"“Coin flips are not reviewable”

Well they should be when your trash ass refs screw it up",Cowboys,1,1576447705,eb4jgo
4194,[removed],,0,1576447704,eb4jgo
4195,I want us to lose our just so we go 6-9,Cowboys,3,1576447703,eb4jgo
4196,Actually that's only the second half of the year.   Early on it was get beat early and make a furious comeback.,Cowboys,1,1576447702,eb4jgo
4197,"Cowboys get jobbed by refs, cowboys get carried by refs ... Let's see how this plays out",Buccaneers,5,1576447700,eb4jgo
4198,"He only may have killed one person, not 42",Eagles,1,1576447700,eb4jgo
4199,Why do the rams get the ball to start the half?,Eagles,1,1576447699,eb4jgo
4200,All the Cowboys LB injured and the Rams still won’t be able to get any yardage on the ground,Rams,1,1576447696,eb4jgo
4201,Pass ISSSSSSSSSSSSSSSSSSSSSSSSS caught,Saints,7,1576447693,eb4jgo
4202,"Because now the ref has said that Dak didn't say defer, so that the Rams get the ball first in BOTH halves",Cowboys,1,1576447691,eb4jgo
4203,The players are obligated to answer questions after the game it should be the same for the refs,,7,1576447690,eb4jgo
4204,Because the Rams got the ball to start the game and are also going to get the ball to start the second half.,Bears,1,1576447688,eb4jgo
4205,"He said it tho, if he didn't say it thats one thing but he did say defer",Cowboys,-1,1576447684,eb4jgo
4206,[removed],,-16,1576447681,eb4jgo
4207,"I wouldn't say he's a lock, but he's a candidate.",Ravens,2,1576447679,eb4jgo
4208,"So, if that logic is true, does that mean if team A defers to the 2nd half, team b can choose to kick and not receive? Thus giving Team A the ball to start the game?",Buccaneers,3,1576447679,eb4jgo
4209,MAybe we should get the refs some hearing aids and glasses they clearly need help,Cowboys,2,1576447678,eb4jgo
4210,"Forgo the kickoff for the 2nd half.

Jump ball at the 50 yard line for possession.",Eagles,10,1576447678,eb4jgo
4211,Kick...kick...defer. That coin toss is mind boggling,Eagles,3,1576447678,eb4jgo
4212,Well everyone knows you run on 2nd and long only,Rams,2,1576447678,eb4jgo
4213,good god you have a fat neck Hank,Cowboys,1,1576447674,eb4jgo
4214,/s tags are for bitches,Rams,0,1576447674,eb4jgo
4215,"You don't have to let us know, we're already aware.",Eagles,1,1576447672,eb4jgo
4216,And there were some dropped interceptions on the rams drive. Except you don’t count them BECAUSE THEY WERENT CAUGHT. Fuckin smoothbrained 3head.,Cowboys,0,1576447672,eb4jgo
4217,I wonder if the cowboys will get suggs,Patriots,1,1576447671,eb4jgo
4218,[Jason Garrett trying to challenge the kickoff](https://giphy.com/gifs/nfl-sports-football-sport-MZ3QYEuLcM4zoyAht3),Cowboys,5,1576447671,eb4jgo
4219,"I wouldn’t have given a shit even if he had neglected to use the word “defer,” the Cowboys are getting fucked. Why the hell would anyone choose to kick at the start of both halves? A new low point for NFL refs and that’s saying something.",Patriots,2,1576447670,eb4jgo
4220,God forbid the refs listen for 30 seconds,Cowboys,1,1576447668,eb4jgo
4221,I agree though like why was the coin flipping ref so rushed. Like if you don’t understand slow your roll,NFL,10,1576447667,eb4jgo
4222,"Refs are not only blind, but deaf too. This proves it.",,7,1576447665,eb4jgo
4223,He literally said “we defer to the second half”,Cowboys,3,1576447664,eb4jgo
4224,Gifford is out? What the fuck,Cowboys,2,1576447662,eb4jgo
4225,someone pull all the vince young coin flips. you know he f'd that up once,,2,1576447660,eb4jgo
4226,Pretty accurate tbh.,Cowboys,2,1576447659,eb4jgo
4227,They hate the Cowboys like the rest of us?,,2,1576447656,eb4jgo
4228,[deleted],,-3,1576447655,eb4jgo
4229,Maybe if they employed refs that weren't 80 years old shit like this wouldn't happen every weekend.,Seahawks,8,1576447655,eb4jgo
4230,The battle of the overpaid QBs,Cowboys,-1,1576447653,eb4jgo
4231,Rams are going to get the ball at the start of the second half as well because the official said that Dak didn't say defer,,7,1576447652,eb4jgo
4232,It's okay guys. We will get an apology from the NFL tomorrow. No biggie.,Cowboys,8,1576447650,eb4jgo
4233,They need us to lose more than they want to win,Cowboys,1,1576447649,eb4jgo
4234,Because the rams are receiving it in the second half,Eagles,4,1576447646,eb4jgo
4235,Easy first ballot,Cowboys,0,1576447646,eb4jgo
4236,the real question is why are they all screaming jumbled words at the coin toss like they’re on cocaine,Steelers,-1,1576447645,eb4jgo
4237,"Refs ""didn't hear"" him say defer so now Cowboys have to kick both halves",Cowboys,5,1576447643,eb4jgo
4238,Haven’t heard Dak this flustered since the Pardon My Take crew asked him if likes porn lol,,-1,1576447642,eb4jgo
4239,NFL refs don't have common sense. They're always out to fuck somebody over. Guilty till proven innocent.,Cowboys,4,1576447641,eb4jgo
4240,Rams are getting the ball to start both halves.,Cowboys,5,1576447641,eb4jgo
4241,Rams get the ball in the second half too because Walt said he didn't say defer.,Cowboys,4,1576447639,eb4jgo
4242,Walt Anderson is new #1 on ref shit list,Cowboys,8,1576447636,eb4jgo
4243,"&gt; eagles don't have that treatment

https://www.teamrankings.com/nfl/stat/opponent-penalties-per-game",Cowboys,1,1576447636,eb4jgo
4244,I can’t do it. I’ll wait another week to clinch the playoffs if I can watch the cowboys lose,NFC,1,1576447634,eb4jgo
4245,They clearly wanted to defer and that’s what they said. Leave your fandom at the door.,Panthers,9,1576447630,eb4jgo
4246,Cause we won today and would like to talk some trash on the trash Cowboys and their fans. That okay with you fella?,Eagles,1,1576447628,eb4jgo
4247,Remember guys the rhetoric is that Dak is stupid not the refs /s,Cowboys,4,1576447627,eb4jgo
4248,What happened with the coin toss? Just tuned in,Patriots,2,1576447625,eb4jgo
4249,Yes he got lucky they were dropped. He threw 3 passes right to defenders that drive. And the TD was not a good throw either,Eagles,1,1576447625,eb4jgo
4250,"Well, they'll be in MY hall of fame 😏",Cowboys,2,1576447624,eb4jgo
4251,"""Game rigged for Cowboys"" 

Refs ""btw even though he said defer, uh, Rams get ball twice""",Cowboys,28,1576447623,eb4jgo
4252,Right this isn’t a video game nobody is trying to play on the hardest difficulty possible.,Cowboys,2,1576447623,eb4jgo
4253,No no didn’t you hear? Jerry Jones’ check to the ref cleared again.,Cowboys,2,1576447623,eb4jgo
4254,did dak say defer is the new did Rudolph use the n word,,5,1576447622,eb4jgo
4255,[removed],,-1,1576447622,eb4jgo
4256,Um 2 times you mean? God forbid the refs listen for 30 seconds,Cowboys,0,1576447621,eb4jgo
4257,Absolutely,Cowboys,1,1576447618,eb4jgo
4258,It’s not too late to delete this...,Patriots,1,1576447618,eb4jgo
4259,"They're like roaches, man.",Cowboys,3,1576447615,eb4jgo
4260,Lol if they don't give us the ball at the half after this shit,Cowboys,5,1576447611,eb4jgo
4261,Go up and make a tackle Byron what the fuck,Cowboys,1,1576447611,eb4jgo
4262,Fuck the refs,Cowboys,4,1576447611,eb4jgo
4263,Secondary actually looks half decent tonight,Cowboys,1,1576447611,eb4jgo
4264,"What's the controversy? Dak said defer and they kicked.
 Why are people calling the ref stupid?",Broncos,0,1576447610,eb4jgo
4265,Just retroactively fix it. Let Dallas receive in the 2nd half. Is that so hard?,Chiefs,13,1576447608,eb4jgo
4266,"Yes they are. Apparently because of the perceived (now debunked) misspeak, they technically waived any option to receive a kick off.",Cowboys,3,1576447607,eb4jgo
4267,[removed],,1,1576447607,eb4jgo
4268,Refs now confirmed blind AND deaf,Saints,12,1576447606,eb4jgo
4269,Dak audibles in Boomhauer,Cowboys,3,1576447605,eb4jgo
4270,"Cowboys won the toss. Dak stuttered a bit. First said kick, then said defense, then said, ""We defer to the second half."" Ref said, ""You're kicking?"" Dak said, ""Yes."" Rams get the ball to start both halves.",Cowboys,3,1576447605,eb4jgo
4271,"He said defer, but in the bunch of confudsed rambling. ""Defense defense, we want to kick it that way"".",Rams,6,1576447601,eb4jgo
4272,Lmaoooo and y’all was all calling Dak a dumbass for that cointoss lol.,Cowboys,12,1576447599,eb4jgo
4273,There's still time to fix this kickoff debacle,Rams,5,1576447599,eb4jgo
4274,Look at us abandoning the run again early because it hasn’t worked yet.,Rams,2,1576447598,eb4jgo
4275,"I despise dem boys as much as everyone else, but they're getting fucked on this coin toss bullshit. Completely ridiculous they cant just say, ""you're right, our bad"".",Packers,9,1576447598,eb4jgo
4276,This is the most stale take. Pretty trash when refs can cause a two possession swing with one call.,,1,1576447594,eb4jgo
4277,Greasy lmao,Eagles,1,1576447594,eb4jgo
4278,They put OJ in the all time team thing they’re doing so..,Chiefs,2,1576447593,eb4jgo
4279,"I mean, he literally said ""Defer"" There's no reason to not let Dallas have to ball to start the 2nd half.",Seahawks,15,1576447593,eb4jgo
4280,Coooooooooooooooop!!  Just like the old days with Mooooooooooooose.,,-1,1576447592,eb4jgo
4281,"lmao literally no reason to not let them receive the ball in the second half, but rules are rules. Cowboys should have to kick every time for the rest of the season. No take backs.",Eagles,9,1576447589,eb4jgo
4282,Perriera must have beef with Walt Anderson for him to call him out lol,Cowboys,3,1576447588,eb4jgo
4283,So Dak did say differ. I don’t get it.,Cowboys,6,1576447588,eb4jgo
4284,"I actually think that the ref did that right. Dak clearly said kick twice and it's not Walt's job to keep Dak from fucking up. Kick is one of the legal four choices. 

It's stupid, but it's a lesson that I bet Dak will remember",Cowboys,1,1576447588,eb4jgo
4285,defergate,Eagles,10,1576447587,eb4jgo
4286,"""Cowboys should be given a pass even though the ref asked twice""

fucking whatever

EDIT: In order to ""Defer"", you cannot make a decision as to whether or not you're kicking or receiving in the first half. If you choose ""Kick"", you're making a decision, and not ""Deferring"" the choice to the second half. They opted to kick twice, yet also indicated they wanted the ball in the 2nd half somehow, making two decisions. 

""But the refs are bad!"" Motherfucker asked twice.",Eagles,-11,1576447586,eb4jgo
4287,"I'm just saying that it took them a long time to find that audio, enough time to make a deep fake. These refs are experts, we should trust what they heard on the field.",Rams,-4,1576447585,eb4jgo
4288,Ray Lewis still got in,Cowboys,2,1576447585,eb4jgo
4289,"Oh shit the Cowboys did get fucked there....

They should change that shit.. Dak was clearly trying to defer.",Saints,8,1576447585,eb4jgo
4290,"Aight, surrender your TD drive then.",Rams,2,1576447583,eb4jgo
4291,RUN THE GOD DAMN BALL,Rams,0,1576447582,eb4jgo
4292,I like how it’s the ref’s job to make sure Dak is speaking correctly and not Dak’s job to speak correctly,Texans,-4,1576447581,eb4jgo
4293,Pretty sure it’s booing.,Bengals,-1,1576447581,eb4jgo
