,body,author_flair_text,score,created_utc,link_id
280,CMC stat padding with the tackle.,Panthers,1,1575832148,e7wj95
281,"Our two first-round pass rushers and multiple first-round offensive linemen have literally all been busts, and the only OC willing to work for us that actually knew how to use our weapons decided to bail to be a head coach",Falcons,2,1575832114,e7wj95
282,"Yeah, #80 should have caught that, but he shoveled it to a defender instead.",Steelers,0,1575832097,e7wj95
283,"Extend Bradberry and Cockrell, trade Jackson, cut Reid, consider keeping Boston.",Panthers,2,1575832094,e7wj95
284,I had to come back here even though there are less people. r/panthers is all insufferable complaining.,Panthers,2,1575832090,e7wj95
285,And we thank you.,Falcons,3,1575832055,e7wj95
286,We lost our QB1 and our two best DTs. What's y'alls excuse? Hahaha,Panthers,-1,1575832023,e7wj95
287,Through the years our secondary has been insanely dedicated to making sure Matt Ryan gets to the hall of fame.,Panthers,5,1575831999,e7wj95
288,I would rather get waterboarded than watch Flirtydancing.,Panthers,2,1575831977,e7wj95
289,That moment when you realize that the Falcons defense played better against the Saints than the 49ers right now,Falcons,2,1575831975,e7wj95
290,"This division has sent so many teams to the NFCCG over the last ten years, how the FUCK has it reached the point where the BUCCANEERS are 2nd place?!",Falcons,3,1575831945,e7wj95
291,"God dammit, come on panthers.",Falcons,1,1575831831,e7wj95
292,"Bradberry has played well against Jones. Jones doesn't really have big games against him.

The problem is Jackson on Ridley",Panthers,1,1575831819,e7wj95
293,Reid looks like absolute shit today,Panthers,1,1575831815,e7wj95
294,"Ok, Eric Reid has been bad. I feel like he started the year pretty good.",Panthers,2,1575831760,e7wj95
295,Not that it matters but this team fucking sucks. Blow it all to hell tepper,Panthers,1,1575831748,e7wj95
296,Donte Jackson might be a bust.,Panthers,1,1575831738,e7wj95
297,I feel like Julio has made that exact catch like 20 times against the Panthers,Falcons,5,1575831718,e7wj95
298,Haha this is my new favorite analogy!,Panthers,1,1575831709,e7wj95
299,There should be a rule that the Falcons are allowed to play Julio Jones for only one of the Panthers vs Falcons game.,Panthers,3,1575831708,e7wj95
300,"Get in the end zone, stupid!",Steelers,0,1575831698,e7wj95
301,Yup,Falcons,1,1575831662,e7wj95
302,Matt Ryan thought his TE was 12' tall.,Steelers,0,1575831626,e7wj95
303,Guess he is lol,Panthers,1,1575831622,e7wj95
304,Julio Jones just went AAAAHHHH! and caught a deep pass.,Steelers,1,1575831592,e7wj95
305,Is Julio playing today?,Bills,2,1575831512,e7wj95
306,40+ year old me thought it looked pretty damn cool,Vikings,1,1575831473,e7wj95
307,We are so fucking average it hurts,Panthers,1,1575831448,e7wj95
308,"Technically, the Redskins are worse than y'all, and we gave them 300 rushing yards.",Panthers,1,1575831444,e7wj95
309,"I mean honestly who gives a shit what we do, we suck ass either way lol",Panthers,1,1575831440,e7wj95
310,"I mean, he's locked in for 3 more years, and came into the league the biggest project of the 2019 draft, among all positions.

This is essentially trying to pad Allen's stats so we can tender him then possibly trade him in the offseason.",Panthers,2,1575831374,e7wj95
311,"""Allen does have a big arm.""

EXCUSE ME. WHAT!?!?",Panthers,6,1575831373,e7wj95
312,Can Allen make it 3 almost interceptions in a row?,Panthers,1,1575831332,e7wj95
313,The one time Allen actually steps up into the pocket,Panthers,2,1575831319,e7wj95
314,Let Grier develop before he gets sent out to die.,Panthers,3,1575831317,e7wj95
315,[deleted],,0,1575831297,e7wj95
316,Yes but we have had one of the worst running games I’ve ever seen up until today. Last time we played y’all we could barely move the ball on the ground,Falcons,1,1575831248,e7wj95
317,It’s just to see what we have in him. We already know Kyle Allen is bad,Panthers,1,1575831217,e7wj95
318,[deleted],,1,1575831193,e7wj95
319,"This game is like watching 2 T-rexes in a boxing match

E: tHaNkS fOr ThE sIlVeR kInD sTrAnGeR",Falcons,11,1575831184,e7wj95
320,Everyone clamoring for Grier reminds me of people wanting Armanti Edwards at QB in 2010. I wonder how much overlap there is.,Panthers,2,1575831027,e7wj95
321,Bowle can’t believe he just got a td. Lol sorry wrong thread,,1,1575830963,e7wj95
322,"Heinz, I hope.",Steelers,2,1575830954,e7wj95
323,"Lmao, it also helps you're playing against one of the worst run defenses of the past few decades.",Panthers,4,1575830937,e7wj95
324,"Shaq, earnin fat stacks",Panthers,2,1575830926,e7wj95
325,"Our running game has been really good today, I think getting Lindstrom back has been helpful tbh. Freeman looks a lot better",Falcons,2,1575830885,e7wj95
326,That’s why we paid the man lol,Panthers,3,1575830877,e7wj95
327,"He is slow, doesn’t wrap up, gets burnt 24/7

Tries to shoulder tackle, it’s laughable",Panthers,1,1575830861,e7wj95
328,I just saw Devonta Freeman get blowt the fuck up behind the line.,Steelers,1,1575830847,e7wj95
329,SHAQ ATTACK,Panthers,2,1575830826,e7wj95
330,It’s kinda crazy how incompetent we are at ya killing and stopping the run,Panthers,1,1575830810,e7wj95
331,Luke might be the only person on the team who can tackle with regularity.,Panthers,1,1575830798,e7wj95
332,because people dont put all that bs aside,Panthers,1,1575830778,e7wj95
333,Maybe we'll finally draft a real safety after this year,Panthers,1,1575830776,e7wj95
334,"Eric Reid is an average player at best. Not sure why people still support him.

All that bs aside, just talking about him as a player",Panthers,2,1575830736,e7wj95
335,"Ha, try keeping those trousers wrinkle-free if we throw players into the coaches.",Saints,1,1575830728,e7wj95
336,Put in Grier,Panthers,1,1575830521,e7wj95
337,7 year old me would be all about that Lego show.,Panthers,1,1575830521,e7wj95
338,The media really wants Cam Newton on another team.,Panthers,0,1575830462,e7wj95
339,glad to know im not the only one living in North Carolina who eats his steak with ketchup,Panthers,1,1575830436,e7wj95
340,"I think he’s been a better CB2 option than Jackson, we might have to revisit corner in the draft",Panthers,1,1575830422,e7wj95
341,I thought it was a sausage. Still weird though.,Panthers,3,1575830266,e7wj95
342,"Keep flashing, Thomas 🤗",Panthers,4,1575830238,e7wj95
343,Well he is a yankee🤷🏼‍♂️,Panthers,1,1575830228,e7wj95
344,The Panthers owner eats steak with ketchup. Gross.,,1,1575830183,e7wj95
345,Was the Panthers owner eating steak with ketchup? 😅,,1,1575830170,e7wj95
346,\#80 for the Panthers just ran for another 10 yards while pushing a defender downfield.,Steelers,3,1575830149,e7wj95
347,"4 Straight Wins Behind Kyle Allen

Yeah, alright. Not like CMC was playing out of his goddamn mind.",Panthers,3,1575830141,e7wj95
348,"Yeah, I was just trying to think if I zoned out and missed another 4 yard drive haha.",Panthers,4,1575829942,e7wj95
349,Hell yeah,Panthers,1,1575829933,e7wj95
350,Panthers north is holding their own against the ravens!,Panthers,1,1575829932,e7wj95
351,"Fellow fan of two NFCS teams, what’s up",Panthers,1,1575829899,e7wj95
352,Ross Cockrell has had some nice plays this season.,Panthers,2,1575829885,e7wj95
353,Yes. The playcalling was ass so we got burned quick.,Panthers,3,1575829867,e7wj95
354,"if you can call 3 runs for 5 yards a possession, yes",Panthers,4,1575829858,e7wj95
355,"I think so lol, the rest has been us",Falcons,2,1575829835,e7wj95
356,Have we only had one possession on offence so far?,Panthers,3,1575829816,e7wj95
357,GET FUCKIN SET,Falcons,3,1575829803,e7wj95
358,[deleted],,1,1575829792,e7wj95
359,Yeah he really stepped up when KK went down.,Panthers,2,1575829716,e7wj95
360,Ugh,Panthers,1,1575829714,e7wj95
361,goddamn he threw him down hard lmao,Panthers,1,1575829711,e7wj95
362,"Same, it’s fun watching my favorite team with zero expectations. When I thought Allen threw that pick at the end of the r words game I just laughed",Panthers,1,1575829687,e7wj95
363,What if neither happens?,Falcons,1,1575829676,e7wj95
364,Same I guess. Only because I lived in charlotte for a decade.,Falcons,1,1575829672,e7wj95
365,He's been good this year. I think we re-sign him.,Panthers,2,1575829669,e7wj95
366,i was wondering why the field looked like shit,Panthers,2,1575829664,e7wj95
367,You never know,Falcons,1,1575829645,e7wj95
368,Vernon Butler,Panthers,2,1575829619,e7wj95
369,This game is a win - win for me. Either the falcons lose or our draft pick gets better.,Panthers,2,1575829611,e7wj95
370,I don’t expect him to reply right away. He is currently not on Reddit I believe.,Falcons,1,1575829556,e7wj95
371,Congratulations Matt,Falcons,2,1575829509,e7wj95
372,"The falcons pre-game meeting: we shall run, meeting adjourned.",Panthers,1,1575829506,e7wj95
373,I imagine if it does end early we'll get the Saints Niners game,Panthers,2,1575829499,e7wj95
374,I don't understand why every team didn't just run on every play all season. We'd easily be 0-12 if they had.,Panthers,3,1575829499,e7wj95
375,The Fewell way,Panthers,1,1575829470,e7wj95
376,glad to see our run game is still trash,Panthers,4,1575829459,e7wj95
377,This is going to be a quick game with the Falcons running the ball every play. As they should.,Panthers,5,1575829440,e7wj95
378,[removed],,1,1575829435,e7wj95
379,I was pleased with last night’s outcome (Georgia Tech alum),Falcons,2,1575829423,e7wj95
380,Blake sucks. 2 penalties now.,Falcons,2,1575829384,e7wj95
381,"Hello 50,000 passing yards for Ryan",Falcons,1,1575829358,e7wj95
382,Our playcalling is still atrocious,Panthers,1,1575829325,e7wj95
383,I think i could be worse. Just sayin,Falcons,1,1575829319,e7wj95
384,Is it too late to blow for joe?,Panthers,1,1575829304,e7wj95
385,Eric Reid is quite possibly the worst tackler in NFL history.,Panthers,-1,1575829289,e7wj95
386,We called it first. No take backs.,Falcons,3,1575829257,e7wj95
387,No! I don’t think we will,Panthers,2,1575829247,e7wj95
388,No we need a higher pick we're rebuilding,Panthers,1,1575829230,e7wj95
389,"Nah I want y'all to win. ""Coachless team beats Dan Quinn"" would help us out with our own coaching problem.",Falcons,2,1575829193,e7wj95
390,I’d rather a loss honestly. Can y’all step up your game please?,Falcons,1,1575829190,e7wj95
391,"There are more Eagles fans than Falcons fans here

This sucks more than our team",Falcons,2,1575829156,e7wj95
392,Same calls different Turner,Panthers,2,1575829154,e7wj95
393,"It’s Scott now, not Norv lol",Panthers,3,1575829097,e7wj95
394,It's [only on in our markets](https://506sports.com/). You'd probably have to be a fan in exile (like me) to bother streaming it.,Panthers,2,1575829094,e7wj95
395,Anybody else rooting for a 0-0 tie?,Panthers,1,1575829083,e7wj95
396,"I have never seen such a ""We give up."" series from the Panthers this early in a game.",Panthers,7,1575829077,e7wj95
397,Norv really scraping bottom for new plays,Panthers,2,1575829026,e7wj95
398,We earned that #28 spot on third down conversions alright lol,Panthers,1,1575829019,e7wj95
399,I see our playcalling has only gotten worse,Panthers,3,1575828989,e7wj95
400,What was that?,Panthers,1,1575828974,e7wj95
401,The Falcons and Panthers are playing on the same carpet the Bulldogs lost on last night. :(,Steelers,2,1575828948,e7wj95
402,"This thread is equally dead, lmao.",Panthers,2,1575828916,e7wj95
403,"Welp, saints already up by 7",Panthers,1,1575828888,e7wj95
404,Jet Fewell,Panthers,1,1575828865,e7wj95
405,"That's still terrible. God, I hate the Falcons.",Panthers,3,1575828857,e7wj95
406,"Yes. Im watching the bills and ravens. Because, well, LJ and Josh Allen. But, frankly, I'd be watching most any other game too.",Panthers,2,1575828852,e7wj95
407,"Thanks, Falcons.",Panthers,1,1575828833,e7wj95
408,"December 28th, 2014. So actually 5 years.",Panthers,2,1575828822,e7wj95
409,Is this the least watched game of the week?,Panthers,4,1575828809,e7wj95
410,I am here now. Expectations 0. BAC &gt; 0.,Panthers,1,1575828737,e7wj95
411,Holy shit. Really?,Panthers,2,1575828709,e7wj95
412,"Well yes but Matt Ryan is a real gym rat, an intellectual leader of men.",Panthers,3,1575828674,e7wj95
413,"Apparently it's been 6 years since we last won in Atlanta. And people wonder why Rivera had to go.

Edit: December 28th, 2014. Funny enough, it was the game that won is the division that year. So actually it was 5 years.",Panthers,6,1575828642,e7wj95
414,Matt Ryan playing how Cam haters think Cam plays.,Panthers,2,1575828617,e7wj95
415,If I’m the Falcons I’m not calling a single pass the rest of the game. They’ll win by 40.,Panthers,4,1575828569,e7wj95
416,RIP Juice Wrld,Eagles,-2,1575828526,e7wj95
417,I don't know they're up against a top 32 defense today,Panthers,3,1575828521,e7wj95
418,"My TV gives me the choice between Ravens/Bills and Panthers/Falcons, so I guess I'll do like the stadium attendance and stay away from this one.",Saints,-1,1575828497,e7wj95
419,Falcons 30th in rushing this year. So obviously they're gonna break out today.,Panthers,2,1575828469,e7wj95
420,i heard rappers,,1,1575828456,e7wj95
421,GEORGIA RAPTORS! GEORGIA RAPTORS! GEORGIA RAPTORS!,Panthers,1,1575828431,e7wj95
422,Is Georgia raptors the call for a false start? Genius!,Panthers,3,1575828429,e7wj95
423,I believe there is a mathematical chance but it's very low,Panthers,1,1575828394,e7wj95
424,Damn that place is empty. Not that I blame people for staying home... I probably wouldn't pay to see this game either.,Panthers,2,1575828353,e7wj95
425,"Damn, this stadium is empty. Wouldn't be upset if the Falcons went and played some fake crowd noise for this game.",Panthers,3,1575828323,e7wj95
426,That stadium is empty.,Panthers,2,1575828283,e7wj95
427,"Stadium so empty, lol. Just like ours last week.",Panthers,2,1575828278,e7wj95
428,Do we have any chance of a wild card game or are we doa ?,Panthers,1,1575828274,e7wj95
429,He hit the crossbar!,Panthers,1,1575828254,e7wj95
430,This is going to be really weird without Ron.,Panthers,1,1575828249,e7wj95
431,"Freeman is the biggest waste of money in Atlanta. After the whole agent drama screaming he is a top 3 back, I'm through. Never forget that freemen missed a block assignment in the Superbowl that essentially cost the Falcons the game.",Falcons,1,1575828199,e7wj95
432,I’m gonna hate the outcome of this game no matter what. I think my best case scenario is we dominate the game but get robbed by reffing and don’t sacrifice any draft position,Panthers,2,1575828191,e7wj95
433,"I hope everybody plays their hardest but we're going into a rebuild so that pick would be sweet.

But I still hope we win cause I like winning",Panthers,1,1575828172,e7wj95
434,That will be cool to see for Ryan!,Panthers,1,1575827879,e7wj95
435,Atlanta can't look at the 9ers without a bit of wistfulness wondering what might have been if Shanny had stayed with us.,Falcons,2,1575827843,e7wj95
436,Dan Quinn to hire Ron Rivera as OC.,Falcons,4,1575827733,e7wj95
437,Both teams without their head coach,Falcons,4,1575827454,e7wj95
438,"One without a head coach and one with, well a coach if you can even call him that.",Falcons,1,1575827311,e7wj95
439,"2 reasons to watch:

1. Matt Ryan needs 34 yards for 50,000 in his career.
2. Julio Jones needs 50 yards for his 6th straight 1,000 yards season.",Falcons,5,1575826941,e7wj95
440,"One thing we can all agree on today: Fuck the Saints, let's go Niners",Panthers,6,1575826799,e7wj95
441,This ought to be interesting,Panthers,2,1575826339,e7wj95
