,body,author_flair_text,score,created_utc,link_id
270,And that's game,Raiders,3,1575849217,e7zbio
271,Damn nail in coffin,Titans,2,1575849216,e7zbio
272,Get a fucking life,Raiders,2,1575849206,e7zbio
273,ight imma head out,Raiders,6,1575849205,e7zbio
274,How much blow have you been doing,Titans,2,1575849203,e7zbio
275,Well good thing he hasn’t played in 2 months,Titans,1,1575849175,e7zbio
276,Raiders need to punt Carr and Guenther into orbit,Raiders,-4,1575849174,e7zbio
277,"My baby Henry is a top 5 RB in the league, ain’t he? 😍",Eagles,7,1575849171,e7zbio
278,Why? He's right. Just keep chucking it downfield against that loose butthole of a secondary.,Raiders,1,1575849170,e7zbio
279,"Regardless who you blame, the Derek Carr Junk time stat padding portion of the game has begun!",Raiders,0,1575849166,e7zbio
280,I'm watching this game in a London hotel room and I feel like that's the reason all this is happening.,Titans,3,1575849155,e7zbio
281,K,Raiders,3,1575849138,e7zbio
282,"&gt;I've been a Tits fan for far too long to think we've got this game locked

Found Mitch Trubisky's Reddit account.",Raiders,2,1575849136,e7zbio
283,Keep Henry out until we need that final drive. If it’s a two possession game then there’s no point of him playin,Titans,8,1575849132,e7zbio
284,Titans bills AFCCG would make me very erect.,Bills,7,1575849130,e7zbio
285,You guys made my early game watching that much more enjoyable,Titans,6,1575849127,e7zbio
286,Hahahahaha trash raiders losing again Hahahaha lose your team to Las Vegas,Chiefs,-8,1575849122,e7zbio
287,Go easy on me I got up at 5am this morning.,Broncos,2,1575849118,e7zbio
288,90% chance Raiders defense gives up a first down on third down. Not that impressive.,Raiders,1,1575849101,e7zbio
289,[deleted],,1,1575849094,e7zbio
290,Yeah because Carr is definitely the reason we lost this game.,Raiders,0,1575849092,e7zbio
291,"Hey now, don’t you go acting all defeated. There’s plenty of football left to play",Titans,2,1575849088,e7zbio
292,"The mighty, mighty Titans, even",,1,1575849082,e7zbio
293,I fucking love Tannehill dude.,Titans,9,1575849079,e7zbio
294,thank you for ending mariota's Titan career,Titans,4,1575849078,e7zbio
295,Andddd game. Ugh,Raiders,1,1575849077,e7zbio
296,[deleted],,2,1575849075,e7zbio
297,This titans offense is so weird to me.,Titans,6,1575849074,e7zbio
298,you did smash us to be fair,Titans,3,1575849073,e7zbio
299,I gotta hand it to CBS. They sure know how to make shows I have absolutely zero interest in ever watching.,Raiders,5,1575849070,e7zbio
300,"Well you smashed us and the texan me 


But no problem",Titans,3,1575849062,e7zbio
301,Our defense being incapable of making a stop is the issue.,Raiders,1,1575849056,e7zbio
302,I've been a Tits fan for far too long to think we've got this game locked,Titans,3,1575849048,e7zbio
303,Why is our secondary such shit year in and year out,Raiders,1,1575849048,e7zbio
304,I'm starting to hope we sign him.,Raiders,1,1575849047,e7zbio
305,You mean Houston?  And yes thank you for that,Titans,2,1575849039,e7zbio
306,We are the titans though,Titans,1,1575849037,e7zbio
307,You really waited for the team to go up a couple of scores 😂,Raiders,1,1575849034,e7zbio
308,No. Pls sleep. I love how no one is talking about us,Titans,4,1575849025,e7zbio
309,20/26 for 386 yds and 3 TDs with a quarter left....,Titans,2,1575849024,e7zbio
310,Raiders are trash get em Titans!,Chiefs,2,1575849021,e7zbio
311,I miss Pro Bowl safety Reggie Nelson.,Raiders,1,1575849020,e7zbio
312,“Find out just *why* he loves basketball in this 6 part mini series.”,Titans,1,1575849012,e7zbio
313,"Tennessee, we did you a solid by smashing the Texans. Thank you for returning the favour.",Broncos,11,1575849001,e7zbio
314,"Man, you are insufferable.",Raiders,6,1575849000,e7zbio
315,This whole team stinks right now.,Raiders,1,1575848986,e7zbio
316,"And that's the game. GG, Titans. Please keep the Steelers out of the playoffs.",Raiders,6,1575848985,e7zbio
317,Against most defenses yes. Ours not so much,Raiders,3,1575848984,e7zbio
318,"you're right, I got caught up in the emotionality of the ""fuck the refs"" thing",Titans,1,1575848979,e7zbio
319,"Yeah and the hosts live in Gallatin

Pretty funny I'd recommend it",Ravens,1,1575848977,e7zbio
320,[removed],,1,1575848975,e7zbio
321,And now it’s time for Derek Carr’s signature junk time stat padding!,Raiders,4,1575848973,e7zbio
322,What a fucking snag by Jonnu there,Titans,2,1575848970,e7zbio
323,Ryan “Patrick Mahomes” Tannehill,Titans,4,1575848970,e7zbio
324,"Hell of a catch.

Fuck everyone in our secondary",Raiders,2,1575848965,e7zbio
325,oh god let's hope not,Titans,1,1575848962,e7zbio
326,It would be nice if our offense can pull the horseshoe out of its ass and score some points,Raiders,2,1575848956,e7zbio
327,Don’t sleep on the Titans right now,Titans,7,1575848953,e7zbio
328,"Pay tannehill. Pay Henry. 

Do not go cheap on us.",Titans,11,1575848948,e7zbio
329,Now that is pretty cool,Titans,4,1575848948,e7zbio
330,Defense strikes again,Raiders,2,1575848948,e7zbio
331,"GG Titans bros! 


Its been a fun one today!",Raiders,5,1575848947,e7zbio
332,[deleted],,1,1575848945,e7zbio
333,#TOUCHDOWN TITANS! x5,Titans,6,1575848942,e7zbio
334, Tannehill is so good x3,Titans,7,1575848941,e7zbio
335,I dont think so. I did a quick google search and I'm assuming it's a podcast?,Raiders,1,1575848941,e7zbio
336,#TANNEGOAT,Rams,6,1575848937,e7zbio
337,"When Ryan fucking Tannehill would be a massive upgrade, you do not have a franchise quarterback.",Raiders,0,1575848936,e7zbio
338,JONNU SMITH,Titans,3,1575848929,e7zbio
339,"“Why does billion dollar movie star Adam Sandler still play pickup basketball with strangers? What a great question!”

Because he loves playing pickup basketball? Fuck off, 60 Minutes.",Raiders,3,1575848927,e7zbio
340,Ryan “Fuck It Chuck It” Tannehill,Lions,12,1575848907,e7zbio
341,Haha damn.,Raiders,1,1575848906,e7zbio
342,JONNU TIME,Titans,6,1575848903,e7zbio
343,[deleted],,1,1575848903,e7zbio
344,Steelers went for a fake punt on their side of the field lol. They trying their hardest to blow that game.,Titans,3,1575848892,e7zbio
345,Tannehill is having fun.,Titans,5,1575848875,e7zbio
346,"10 points now. I feel sick to my stomach rooting for the Pats. But it helps our playoff odds. Nothing persona-

Nvm lol. :)",Raiders,2,1575848875,e7zbio
347,Jonnu!,Titans,3,1575848875,e7zbio
348,AJ Brown is my wife’s boyfriend,Titans,2,1575848871,e7zbio
349,Oh my god that was a stupidly dangerous throw,Titans,3,1575848869,e7zbio
350,LOOK AT THAT PLAY DESIGN BRO. WE ARE THE NEW RAMS,Titans,1,1575848866,e7zbio
351,Tanny the Red Viper confirmed?,Titans,1,1575848856,e7zbio
352,im still shook from that tackle tannehill threw onto The Mountain after he got intercepted back in the first quarter,Titans,3,1575848797,e7zbio
353,Is it REALLY a good question to ask for 60 Minutes?  Are any of them really good?,Titans,3,1575848797,e7zbio
354,Time to go watch the chiefs pats game lol,Raiders,2,1575848783,e7zbio
355,[deleted],,6,1575848758,e7zbio
356,[Titans Radio](http://www.1045thezone.com/) is top tier entertaining IMO. Mute the TV and listen to them instead.,Titans,1,1575848749,e7zbio
357,It’s time for the same weekly post since last season: FIRE GUENTHER,Raiders,1,1575848736,e7zbio
358,You’re good,,2,1575848714,e7zbio
359,"Its like, you're a wizard or something",Raiders,1,1575848709,e7zbio
360,JUST FUCKING STOP THEM ONCE YOU STUPID SHITS,Raiders,2,1575848709,e7zbio
361,Give this man a new contract - I’m down for some tannehill domination of the AFC South,49ers,7,1575848690,e7zbio
362,"Delete this, nephew.",Titans,2,1575848686,e7zbio
363,"We have rage threads over winning, to be fair.",Dolphins,2,1575848684,e7zbio
364,Good play by Lawson. Now time to give up a 3rd down.,Raiders,8,1575848652,e7zbio
365,boi coulda just ran for the 1st,Titans,1,1575848651,e7zbio
366,And of course we let them convert on 3rd down... this game is over,Raiders,1,1575848648,e7zbio
367,"Oh I know. We went though the same with Mariota. We made the change and it's worked out, but some of the stuff our fanbase blamed him for was ridiculous",Titans,2,1575848644,e7zbio
368,Still don't know how Henry makes it through those holes. Backs who are 5'9 180 don't even make it though those,Titans,2,1575848571,e7zbio
369,You're missing a few,Raiders,1,1575848559,e7zbio
370,"Get Henry out

We can win this without him",,2,1575848534,e7zbio
371,"This type of shit is what we deal with week in and week out. Most toxic fanbase on here, I swear.",Raiders,4,1575848528,e7zbio
372,[removed],,1,1575848523,e7zbio
373,Oh ffs.,Raiders,2,1575848523,e7zbio
374,You listen to yks?,Ravens,1,1575848522,e7zbio
375,This announcer makes a good play depressing.,,2,1575848520,e7zbio
376,Mister 3rd down himself LETS GO TAJAE,Titans,3,1575848504,e7zbio
377,i mean a screen toss to the los on 3rd and 5? ....it'd be one thing if that wasn't the normal,Raiders,1,1575848496,e7zbio
378,/u/mrrabsho /u/rabshowasright,Raiders,3,1575848488,e7zbio
379,Henry’s been making Harris his bitch all game,Raiders,4,1575848470,e7zbio
380,Dude is fucking cancer. Has no life other than posting negative shit about a team he 'supports'.,Raiders,4,1575848446,e7zbio
381,Got you guys on the laptop I watch during commercials and between plays.,Chiefs,2,1575848441,e7zbio
382,I like how our trash ass defense can’t keep people in front of the sticks on 3rd down,Raiders,2,1575848439,e7zbio
383,Tanny out here dime and dealing,Titans,4,1575848434,e7zbio
384,His hair is on your face and in your hole at the same time?,Jaguars,1,1575848429,e7zbio
385,"agreed he is not a play-maker any more. It's almost as if every snap he already knows who he is going to throw it to pre-snap.

DC from years ago looked so much different.",Raiders,2,1575848429,e7zbio
386,"If the Titans score on this drive, the game is over.",Raiders,3,1575848413,e7zbio
387,Our second last game ever in Oakland and Carr has managed to get the fans to boo him,Raiders,0,1575848409,e7zbio
388,"You too, thanks.",,2,1575848406,e7zbio
389,I don't think Jesus is special enough for that,Texans,1,1575848404,e7zbio
390,I literally went to pee and came back to a punt. Wtf?,Raiders,1,1575848394,e7zbio
391,Gruden has some of the stupidest 3rd and short calls ever. Not even the del Rio offenses were this stupid on 3rd.,Raiders,1,1575848393,e7zbio
392,Why is this being downvoted? He’s right!,Raiders,2,1575848379,e7zbio
393,Yeah I really like how Carr missed that block on the corner.,Titans,5,1575848358,e7zbio
394,"Bro, he's got Fitzpatrick. He's good.",Raiders,2,1575848348,e7zbio
395,Carr has had a pretty decent game I think.,Titans,2,1575848344,e7zbio
396,God youre an unpleasant person.,Raiders,2,1575848338,e7zbio
397,"I wouldnt say that.

He's a good QB I just dont know about frqnchise",Titans,5,1575848336,e7zbio
398,I was talking about how everyone seems to love them now,,1,1575848332,e7zbio
399,"You are a sad strange little man, and you have my pity",Raiders,4,1575848331,e7zbio
400,Lol cry more,Raiders,6,1575848328,e7zbio
401,"""This is a must win for both of these teams if they want to still have a hope for the playoffs"" (paraphrased)

Uhh...Houston lost today and we still play them twice.",Titans,3,1575848323,e7zbio
402,That’s something I wish I hadn’t read.,,5,1575848292,e7zbio
403,Carr is utter fucking trash,Raiders,-3,1575848291,e7zbio
404,"Sike, there's no one in here",Raiders,3,1575848285,e7zbio
405,queue flagrant interception throw in 3....2....,Raiders,0,1575848282,e7zbio
406,Don't you have a beatdown to watch?,Raiders,2,1575848278,e7zbio
407,Nope we all see it. And you need Jesus,Titans,5,1575848268,e7zbio
408,"This thread is moving so fast nobody will know that when I masturbate I think of Henry’s hair slapping me on the face and gently, yet firmly, penetrating my supple hole.",Titans,8,1575848233,e7zbio
409,"&gt;~~Carr~~ Our defense makes Tannehill look like Peyton Manning crossed with Lamar Jackson.


That's better.",Raiders,7,1575848190,e7zbio
410,"Ok, Oilers",Raiders,1,1575848178,e7zbio
411,"Because Carr covers receivers? You’re a fucking moron, dude",Raiders,6,1575848147,e7zbio
412,Kid from Vandy. We picked him up off of Vikings practice squad,Titans,1,1575848139,e7zbio
413,"Tanny and Brown laughing at the Raiders secondary, Henry doing Henry things.",Titans,1,1575848139,e7zbio
414,Well I mean we been averaging 30 so it's not just you,Titans,1,1575848100,e7zbio
415,"This defense couldn’t stop a peewee team, what the fuck",Raiders,2,1575848094,e7zbio
416,Fuck this defense. Unbelievably bad.,Raiders,4,1575848072,e7zbio
417,Hes trying to be the rushing leader this season,Titans,1,1575848069,e7zbio
418,Carr makes Tannehill look like Payton Manning crossed with Lamar Jackson,Raiders,-5,1575848068,e7zbio
419,Comeback Carr on deck,Raiders,2,1575848062,e7zbio
420,DeRrIcK hEnRy HaS pOoP hAiR,Raiders,6,1575848054,e7zbio
421,Hasn't just been this game though,Titans,2,1575848053,e7zbio
422,"You’ll get a guy like Tanny one day, don’t worry friendo",Titans,7,1575848026,e7zbio
423,"Blasingame.

However it’s spelled. New FB from Minnesota.",Titans,2,1575848025,e7zbio
424,Frieeeeends foreverrrrrr!!!,Titans,1,1575848022,e7zbio
425,"Everytime. I never stop saying out loud ""what a bad motherfucker"" 

Every single game",Titans,1,1575848010,e7zbio
426,Derrick Henry and getting second half TDs. Name a more iconic duo.,Chiefs,3,1575848008,e7zbio
427,When you argue your way back into a game and then back it up.,Dolphins,7,1575848008,e7zbio
428,"Don't get too excited this is one of the worst pass defenses in the league, if not the worst",Raiders,1,1575848004,e7zbio
429,Apologize for my erection.,Raiders,1,1575847998,e7zbio
430,softest defense NA,Raiders,2,1575847995,e7zbio
431,Tannehill is fuckin slingin it lately,Lions,4,1575847995,e7zbio
432,Some weird ass running,Titans,3,1575847972,e7zbio
433,Tannehill is the real deal.,Dolphins,7,1575847963,e7zbio
434,Yeee,Titans,2,1575847962,e7zbio
435,"It's so refreshing that when teams dare us to pass,  we actually can",Titans,6,1575847961,e7zbio
436,King Henry,Titans,2,1575847958,e7zbio
437,"Some things and some stuff. 


But mostly things.",Raiders,2,1575847956,e7zbio
438,henry is hurt?,Titans,1,1575847944,e7zbio
439,"Oh whatever, the defense is playing like a high school team and the receivers are playing like they're stuck in mud. Carr cant make the rest of the team do their jobs.",Raiders,3,1575847932,e7zbio
440,"Alexa, play Tractorcito",Titans,6,1575847932,e7zbio
441,Delete this,Raiders,1,1575847923,e7zbio
442,This defense is so trash,Raiders,1,1575847922,e7zbio
443,"It's been beaten to death, but you're not wrong.",Titans,7,1575847912,e7zbio
444,Everything,Titans,4,1575847906,e7zbio
445,He’s got a real blasin’ game about him,Titans,3,1575847896,e7zbio
446,Collins👀👀,Raiders,0,1575847876,e7zbio
447,Carr is always without blame in the eyes of his groupies.,Raiders,0,1575847868,e7zbio
448,The turd tail is well documented,,5,1575847857,e7zbio
449,im liking this blasinge guy,Titans,4,1575847854,e7zbio
450,That cute laugh 😭,Raiders,1,1575847845,e7zbio
451,"Cry. 


I cry.",Raiders,1,1575847823,e7zbio
452,just got here. what have I missed so far?,Titans,7,1575847811,e7zbio
453,Raiders fans getting such a retirement tour treatment lmao,,5,1575847802,e7zbio
454,"Nice catch, 41!!  Who's 41?",Titans,1,1575847799,e7zbio
455,We're holding hands on my couch right now.,Raiders,2,1575847792,e7zbio
456,"I apologise if this has been beaten to death,this is my first time visiting a Titans thread. But Derrick Henry's hair looks like a baby Hutt is residing under his helmet with it's tail sticking out.",Vikings,2,1575847776,e7zbio
457,The recievers who didn't get open,Raiders,1,1575847766,e7zbio
458,"bruh thats marcell, how u gon ask dat",Raiders,2,1575847761,e7zbio
459,It was Reece,Raiders,2,1575847719,e7zbio
460,After watching the 9ers game and watching Carr he seems so clunky...again,Raiders,1,1575847710,e7zbio
461,[deleted],,3,1575847705,e7zbio
462,I feel like it was a way bigger deal when the Rams and the Chargers moved.,Titans,1,1575847695,e7zbio
463,Now kith.,Titans,1,1575847689,e7zbio
464,Carr makes some stupid faces when he's on the move,Browns,2,1575847674,e7zbio
465,WHERE ARE YOU THROWING IT DEREK WHERE,Raiders,2,1575847652,e7zbio
466,[deleted],,1,1575847647,e7zbio
467,[deleted],,0,1575847643,e7zbio
468,Wow. Small world for sure,Raiders,1,1575847643,e7zbio
469,"Yeah, JRob just texted my grandma to asked if her hip would be go to go next week as she'll be starting at DB.",Titans,2,1575847636,e7zbio
470,What about the throw after that? Who fell and is to blame?,Raiders,2,1575847629,e7zbio
471,He’s doing it for you 😏,Titans,6,1575847618,e7zbio
472,Happy birthday to the ground,Raiders,2,1575847602,e7zbio
473,"Whoa... why does Carr do that with his tongue while he runs. 

I’d like him to stop immediately.",Titans,6,1575847592,e7zbio
474,Went from an offensive to a defensive game real quick,Falcons,5,1575847587,e7zbio
475,Who was that to?,Raiders,0,1575847564,e7zbio
476,DWash fell but if you listen hard enough you will hear people blaming that on Carr,Raiders,2,1575847563,e7zbio
477,Cause DRAMA,Raiders,3,1575847553,e7zbio
478,And just like that it’s a defensive struggle...,Titans,2,1575847532,e7zbio
479,Mark Davis looks like a burn victim.,49ers,1,1575847532,e7zbio
480,A stop!  That's two this game!!,Titans,0,1575847531,e7zbio
481,"""Our job is not to bring justice to America's most wanted. Our job is to bring America's most wanted to justice.""

What the fuck does that even mean? How are these not the exact same thing?",Raiders,4,1575847522,e7zbio
482,"We went neck and neck with the Bills, only it was all defense. And our kicking game fucked us then, too.",Titans,0,1575847515,e7zbio
483,who was that with Mark? Can he catch?,Raiders,2,1575847513,e7zbio
484,Yep!,Raiders,2,1575847475,e7zbio
485,PLEASE TITANS,Titans,0,1575847474,e7zbio
486,This is incorrect.,Raiders,2,1575847443,e7zbio
487,Was that Reece sitting with Mark?,Raiders,4,1575847440,e7zbio
488,Haha I went to Gallatin High School. We probably neighbors. Small world I guess,Titans,2,1575847417,e7zbio
489,Was that Shane o Mac,Titans,2,1575847398,e7zbio
490,Am I crazy or does Mike Vrabel look like Jim Tomsula? (Before he got rid of the stache),Raiders,3,1575847390,e7zbio
491,Titans coach looks like the villain in an early Schwarzenegger movie.,Raiders,4,1575847380,e7zbio
492,I feel for the city considering they lost the Warriors and the Raiders at pretty much the same time.,Titans,1,1575847375,e7zbio
493,"I live in Gallatin, went to high school in Murfreesboro like 10 years ago. I love tennessee it's a lot more laid back than the west coast.",Raiders,3,1575847370,e7zbio
494,"It helps the Raiders have moved to LA and back already, plus everyone knows Davis can't build a stadium by himself in Oakland and the city wasn't willing to help pay for it.",Raiders,3,1575847325,e7zbio
495,Havent seen a game this neck and neck in quite a while,Titans,1,1575847316,e7zbio
496,No because I wanna be tied for first at the end of this.,Titans,0,1575847303,e7zbio
497,Dead af,Raiders,1,1575847218,e7zbio
498,[deleted],,1,1575847171,e7zbio
499,Jags down by four touchdowns. We technically control the division.,Titans,1,1575847164,e7zbio
500,How you like it in Nashville?  I was born and raised here it feels like almost everybody I talk to is a transfer haha.,Titans,1,1575847152,e7zbio
501,Maybe we shouldn't speculate and just wait for the official word,Raiders,2,1575847114,e7zbio
502,I mean if we keep losing players like its ww2 than idk if we can do anything.,Titans,3,1575847089,e7zbio
503,3rd quarter Raiders are in full effect.,Raiders,2,1575847078,e7zbio
504,[deleted],,1,1575847061,e7zbio
505,"Who cares about field position? It's not like we'll be stopping them anyway.

Edit: what?",Raiders,6,1575847022,e7zbio
506,[deleted],,1,1575847012,e7zbio
507,"I grew up watching them in LA. I give zero shits about the city of Oakland. Currently live in Nashville, easier to travel to Vegas for games if I want to go.",Raiders,3,1575847003,e7zbio
508,Sackkkkkkkk,Titans,0,1575846995,e7zbio
509,#SAAAAAAAACKKK,Titans,2,1575846983,e7zbio
510,What’s going on with this defense man wtf,Titans,1,1575846953,e7zbio
511,Fuck this game. Way too many injuries on both sides. Can we just call it a tie so our teams can survive until next week?,Titans,3,1575846948,e7zbio
512,So fucking excited about Jeffery Simmons and his future.,Titans,1,1575846948,e7zbio
513,And that groin is torn,Rams,2,1575846918,e7zbio
514,Al Davis pulling some strings beyond the grave,Raiders,1,1575846918,e7zbio
515,"Oh shit, Moreau that looks like it hurt",Raiders,3,1575846902,e7zbio
516,Our secondary getting thiner and thiner...,Titans,1,1575846897,e7zbio
517,TEN are you going to seize the moment or are you gonna let Gruden earn his 10 mil against you?,Steelers,5,1575846846,e7zbio
518,[deleted],,2,1575846839,e7zbio
519,[deleted],,2,1575846832,e7zbio
520,Crazy to me how the Raiders announced they are moving and no raiders fans seem to give a shit. Guess it shows the strength of the brand.,Titans,-3,1575846823,e7zbio
521,That much is obvious.,Titans,1,1575846823,e7zbio
522,Blasphemy 😂,Raiders,1,1575846792,e7zbio
523,What we had until 3 weeks ago.,Titans,2,1575846773,e7zbio
524,It's a conspiracy,Raiders,1,1575846752,e7zbio
525,[deleted],,-1,1575846704,e7zbio
526,I'm more impressed you have a winning record with that.,Lions,2,1575846704,e7zbio
527,So weird.,Titans,1,1575846659,e7zbio
528,I’d take either one tbh,Titans,2,1575846655,e7zbio
529,A what?,Raiders,2,1575846630,e7zbio
530,'member in the first half when we had to decline a defensive hold to get the gain? Here they just tacked it on.,Titans,3,1575846626,e7zbio
531,What is that?,Raiders,3,1575846624,e7zbio
532,[deleted],,0,1575846594,e7zbio
533,I miss having a good defense,Titans,3,1575846594,e7zbio
534,oi oi oi oi,Titans,1,1575846577,e7zbio
535,Kolton Millers shoes are stressing me the fuck out. I keep thinking there are flags on the field.,Raiders,2,1575846557,e7zbio
536,Melanie Collins is fine as hell.,Seahawks,6,1575846537,e7zbio
537,"“We have to outscore them”
🤯🤯🤯🤯🤯🤯",Titans,4,1575846511,e7zbio
538,Why ask coaches anything.,Raiders,2,1575846505,e7zbio
539,"I miss real game and play analysis during the game instead of ""here's a 30 second commercial!""",Titans,3,1575846426,e7zbio
540,[deleted],,2,1575846416,e7zbio
541,The commentators have talked more about the weather than anything else.  Was ready to watch the game on mute by mid 2nd qtr.,Raiders,4,1575846257,e7zbio
542,It gave our defense a chance to stop it.,Titans,3,1575846229,e7zbio
543,How is it even possible we're kicking under 50% through the season?,Titans,3,1575846212,e7zbio
544,There have been more penalties accepted against the titans than the raiders. Idk what the hell youve been watching,Titans,1,1575846137,e7zbio
545,Any updates on Henry tho? Without him we are in trouble,Titans,2,1575846127,e7zbio
546,"Its crazy how much you take good kicking for granted, until you no longer have it.",Titans,3,1575846119,e7zbio
547,It was a great tackle but it really didn't save anything.,Titans,1,1575846109,e7zbio
548,"There have been 2 penalties on the raiders, go look at the box score",Titans,-1,1575846082,e7zbio
549,Dude heard that too. So sad,Titans,2,1575846070,e7zbio
550,Have they said what happened to Henry?,Cowboys,2,1575846068,e7zbio
551,"I wanna be pissed at our secondary but we're starting 2 street free agents and getting zero pass rush, what the hell can I except?",Titans,4,1575846051,e7zbio
552,"We have some really good young players to be excited about, regardless of if we make the post season or not. Feelsgoodman.jpg",Titans,1,1575846021,e7zbio
553,"I still trust the Titans D over the Raiders D. If not for a tipped pick, and a missed FG, Titans may have scored every drive of the half. But knowing these teams I could also see a 3-6 second half.",Titans,5,1575846000,e7zbio
554,Both offenses playing well and both defenses playing like trash. Stop looking for moral victories where there are none.,Raiders,1,1575845998,e7zbio
555,Meaningful December Raiders football in Oakland makes me so hard. Ive missed this. I'll miss this.,Raiders,4,1575845976,e7zbio
556,With our luck we are going to sqeak into the playoffs as the 6 seed and play the 3 seed 12-4 Patriots in Foxborough,Titans,1,1575845964,e7zbio
557,So sick of incompetent kickers. Tannehill did everything he could on that short drive and gets rewarded with a shank!,Titans,2,1575845958,e7zbio
558,"Watching the NYJ/MIA game earlier when NY had 7 FGs they brought up Bironas' 8 FG game and I genuinely was instantly saddened.

RIP",Titans,4,1575845946,e7zbio
559,Hopefully he turns it around.,Titans,1,1575845932,e7zbio
560,Before the season started I knew that A. Brown would have a big role in this game,Raiders,8,1575845917,e7zbio
561,Tbh without JJ playing i was excited to watch Henry (who doesn't love bruising kick your ass running backs?) I'd be kinda bummed if he was out.,Raiders,2,1575845893,e7zbio
562,You’re not wrong. Everyone we’ve brought in has been abysmal,Titans,1,1575845893,e7zbio
563,"https://imgur.com/a/iBHFyVR

""outside"" the pocket

Free 4 points",,5,1575845886,e7zbio
564,I look at it as a makeup call for missing the intentional grounding,Titans,3,1575845881,e7zbio
565,The Grammys suck,Titans,1,1575845879,e7zbio
566,We’ve had too many games fuck us cause of fg kicking,Titans,1,1575845852,e7zbio
567,I'm aware.   And he is 1/5 on field goals since his return.,Titans,2,1575845850,e7zbio
568,Then fucking cut him and bring someone who can make something other than an extra point,Titans,3,1575845839,e7zbio
569,"Tannehill at the half:

13/15, 263 yds, 2 TDs, 1 INT (And 1 monster TD saving tackle)",Titans,1,1575845834,e7zbio
570,Oh darn.,Raiders,1,1575845822,e7zbio
