,body,author_flair_text,score,created_utc,link_id
0,"as much as I wish Lock was the solution, I don't think he is",Broncos,1,1575244135,e11i3w
1,"Bruce is that kinda guy where you have to ask before showing up to watch the game ""Is Bruce gonna be there?"", and finding an excuse not to go if the answer is yes. 

It's either that or gathering with everyone else around the snack table just to get away from him screaming miserable shit and bad jokes at the tv,  whether we're winning or losing, for a while.  

Not that I've been to one too many houses on a Sunday where this exact kind of dude was there or anything...",,2,1574630472,e11i3w
2,Time for the Cowpokes.,Bills,2,1574629681,e11i3w
3,I'm not happy about it either.,Bills,1,1574629556,e11i3w
4,Catch ya next sunday! Cheers!,Broncos,2,1574629533,e11i3w
5,*vomits,Bills,2,1574629408,e11i3w
6,"Time to go home for me, I done drank way too much coffee and not slept, fuck the primetime games.",Broncos,1,1574629366,e11i3w
7,Now I have to root for the cowboys to smack the Pat's around.,Bills,3,1574629329,e11i3w
8,Since like 03 or 04 at least.,Broncos,1,1574629326,e11i3w
9,Pls,Broncos,3,1574629280,e11i3w
10,GG Denver bros,Bills,3,1574629265,e11i3w
11,Digital camo has been the standard on fatigues for most of this century.,Bills,3,1574629240,e11i3w
12,"It's the broncos.  Our defense is good but our offense is laughable, y'all better have been feeling good especially at home.  In Denver it may have been a 9-3 game dammit.",Broncos,1,1574629222,e11i3w
13,damn I thought we had it there the whole time,Broncos,6,1574629221,e11i3w
14,"GG broncos fans, it was nice to share this thread with you all. Also, I'd love to live in Denver some day",Bills,8,1574629217,e11i3w
15,💪 keeping up with it bro! GG man and thanks for the suggestion will be doing it next week,Bills,2,1574629213,e11i3w
16,GG Bills.  Please beat the Pats.,Broncos,7,1574629208,e11i3w
17,You must be a young'un to not remember Tom Rouen.,Broncos,1,1574629200,e11i3w
18,That was satisfying. 8-3 boys and girls!!!,Bills,2,1574629191,e11i3w
19,Good game Bills. Hope y’all get to create some waves in the playoffs.,Broncos,8,1574629189,e11i3w
20,Why run if we aren't even calling timeouts?,Broncos,1,1574629182,e11i3w
21,Just shy of 250 yards rushing.,Bills,1,1574629174,e11i3w
22,I was fully expecting anxiety and stress from the *number 4 defense* but jesus.,,1,1574629156,e11i3w
23,"A SUCCESSFUL HARD COUNT FROM THE BILLS?

A MCDERMOTT CHALLENGE WON?

THE END REALLY IS NEAR",Bills,7,1574629155,e11i3w
24,I hope Gore reaches 2nd all time in this game.,Broncos,1,1574629152,e11i3w
25,Let's be honest. That penalty is better than punting and risking injuries,Broncos,1,1574629149,e11i3w
26,It fucking worked. Genius level play calling.,Bills,3,1574629136,e11i3w
27,Stop... *stop*... we're already dead.,Broncos,4,1574629126,e11i3w
28,HA how did that finally work,Bills,1,1574629123,e11i3w
29,That 8-bit camo is something else.,Bills,1,1574629122,e11i3w
30,lol how do you fall for that.,Bills,5,1574629119,e11i3w
31,Lamo the fucking hard count worked',Bills,2,1574629111,e11i3w
32,No point with flags at this point in the game. Just let us die.,Broncos,1,1574629087,e11i3w
33,Lmao got em,,3,1574629065,e11i3w
34,Ouch.,Bills,1,1574629051,e11i3w
35,I don't know anyone who hates Fitz.,Bills,1,1574629035,e11i3w
36,What is this feeling of not having my butthole clenched this late in the 4th quarter?,Bills,5,1574629015,e11i3w
37,but it was funny tho,Bills,2,1574629015,e11i3w
38,or the Harbaugh Philosophy.,Bills,1,1574629001,e11i3w
39,"Just moved to Boston a few months ago, spent my whole life in Buffalo. This game is making me homesick.",,2,1574628984,e11i3w
40,2nd week in a row we were in control the entire game. We've been playing at a high level.,Bills,6,1574628984,e11i3w
41,"That song hasn't been hype sine the late 2000s I though.  But I guess for family venues (mafia is family friendly right?), I could see it.",Broncos,2,1574628983,e11i3w
42,"Dang with this win, the Bills’ record hasn’t happened since I was 2 years old... glad I can watch it this time!",Bills,2,1574628976,e11i3w
43,Drr blss merk mah wanba shayyt,Bills,2,1574628968,e11i3w
44,Audio guy is a total Boomer with that song,Bills,5,1574628962,e11i3w
45,Vikings might jump us with the Bye Week,Bills,3,1574628941,e11i3w
46,"At least the Broncos were able to contribute to a decent football team's record/playoff hopes today.  Is that a silver lining?

Anyway, time to drink.",Broncos,6,1574628931,e11i3w
47,Me too.  Scary thing is I'm not really near the stadium.,Bills,2,1574628922,e11i3w
48,The refs weren't great today,Broncos,1,1574628913,e11i3w
49,Lol Forever Young,Bills,7,1574628907,e11i3w
50,Lol I could do without the rod Stewart.,Bills,3,1574628901,e11i3w
51,LOL @ FOREVER YOUNG,Bills,9,1574628881,e11i3w
52,"Man I'm loving comfy 4th quarter wins, I can get used to this.",Bills,12,1574628863,e11i3w
53,Lol that music into commercial,,6,1574628851,e11i3w
54,Looking forward to Tuesday when we move up from 12 to 11 in the power rankings.,Bills,5,1574628847,e11i3w
55,"Feed some of this energy to the Sabres, please.",Bills,5,1574628846,e11i3w
56,"Well, good game. Hopefully no one gets injured on these last few meaningless snaps",Broncos,5,1574628842,e11i3w
57,The good news is we have the good Allen,Bills,3,1574628835,e11i3w
58,Bills put up more than 19 points! Pleased with it but we def had more opportunities to score,Bills,3,1574628825,e11i3w
59,"Hoping there's a slightly annoyed, but sober, person in the front seat.",Bills,2,1574628823,e11i3w
60,No one.,Bills,2,1574628815,e11i3w
61,Please end this.,Broncos,4,1574628794,e11i3w
62,How many different ways are they going to pronounce star lotulelei's name today?,Bills,3,1574628787,e11i3w
63,Shhhhh,Bills,2,1574628778,e11i3w
64,There's no good reason not to go for it on 4th. It's the Marrone Philosophy reprise.,Bills,1,1574628777,e11i3w
65,"We pretty much got a new team, didn’t we?",Bills,4,1574628772,e11i3w
66,I love how the Shout song gets more and more off key/tempo the drunker the fans get lol,Bills,5,1574628767,e11i3w
67,"Ah, I see. I'm so tired of hearing it.

There's *so many* hype songs but nope, play the same one a million times a game.",Bills,2,1574628755,e11i3w
68,Lol I was thinking the same thing,Bills,3,1574628755,e11i3w
69,You lost $10 congrats,Bills,2,1574628720,e11i3w
70,"I know it doesn't matter much, but Kroft just had an illegal motion the refs flat out ignored.",Bills,6,1574628717,e11i3w
71,Cringe,Vikings,-4,1574628702,e11i3w
72,"The bar I'm at is playing every game, but ours isn't on audio.  I live in AZ btw and thank God the vikings snowbirds aren't around this week.",Broncos,2,1574628695,e11i3w
73,Maybe they were asking for directions to Duffs.,Bills,3,1574628690,e11i3w
74,They're more successful actually going for it on 4th down this year.,Bills,1,1574628681,e11i3w
75,"No one is going to talk about the Allen invasion? Three starting quarterbacks are all 'Allen's, when will they all be Allens? Pretty soon Allen Nation after the Allenpocalypse. Just look at this game, Allen v Allen already.  They are even fighting themselves. The [Gray Goo](https://en.wikipedia.org/wiki/Gray_goo) of Allens has begun.",Broncos,7,1574628676,e11i3w
76,Remember not to drink and drive everyone!,Bills,5,1574628663,e11i3w
77,I really like Thielen!,Bills,4,1574628606,e11i3w
78,Drunk Bills fans leaving early.  Just heard a car full of guys driving down the street screaming.,Bills,9,1574628600,e11i3w
79,"Potential safeties: 2 
potential touchdowns: 0",Broncos,6,1574628599,e11i3w
80,That's 100 yards for Singletary.,Bills,8,1574628584,e11i3w
81,No one cares.,Bills,8,1574628554,e11i3w
82,Reeeeeee,AFC,1,1574628551,e11i3w
83,What do you mean unless? Do you think we're going to cut him this year?,Bills,2,1574628545,e11i3w
84,Ok. I'm only so much of a masochist. I'm gonna give myself a couple hundred papercuts to pass the time instead.,Broncos,3,1574628519,e11i3w
85,"Lmao, I think frank gore is the only player who is loved by every team tbh",Vikings,3,1574628510,e11i3w
86,It's going to be amazing to watch Gore play with his grandson.,Bills,9,1574628475,e11i3w
87,"$10 -&gt; $560, 8 team teaser, and Broncos +11 is going to be the only leg to ruin it. Mf.",Vikings,-6,1574628456,e11i3w
88,Unless he wins a superbowl somewhere else he probably retires a 49er and goes into the HOF as a 49er.,Bills,0,1574628453,e11i3w
89,I mean yeah...  But odds are unless Barry Sanders comes out of retirement the record will eventually hold  lol,Bills,2,1574628437,e11i3w
90,Can we just call it a game now?,Broncos,7,1574628420,e11i3w
91,Can we just kneel the rest of the game?,Broncos,7,1574628398,e11i3w
92,I want an Ed Oliver safety,Bills,4,1574628385,e11i3w
93,"Remember 5 years ago when Frank Gore was washed up so the 49ers let him go?

I hope Baalke trips and face plants on a parking meter.",49ers,3,1574628378,e11i3w
94,Was that a shot at McCoy?,Bills,1,1574628373,e11i3w
95,"I'd like to say.  Like this entire year, our defense was doing well.  We just can't get 2 halves together and finish out games, and obviously the offense isn't helping out.  Good win bills, please upset this Dunkin loving fucks and channel some PAC12 after dark energy.",Broncos,3,1574628354,e11i3w
96,"It did cause a couple of false starts, so technically it does.",Bills,1,1574628295,e11i3w
97,Congrats to Gore!,Broncos,8,1574628292,e11i3w
98,Hell nah. Gore is one of the best.,Broncos,2,1574628289,e11i3w
99,Wtf that graphic lol.,Bills,3,1574628288,e11i3w
100,I’m glad he did that at a home game,Bills,3,1574628288,e11i3w
101,[deleted],,2,1574628286,e11i3w
102,Good god,Bills,3,1574628280,e11i3w
103,I'm shocked they didn't run it.....,Bills,1,1574628272,e11i3w
104,If Gore lost yards would he go back to #4? Lol,Bills,4,1574628272,e11i3w
105,Can we stop this fake play bullshit already.,Bills,3,1574628255,e11i3w
106,That is never going to work if you don't ever snap it,Bills,3,1574628254,e11i3w
107,STOP WITH THAT BS HARD COUNT CRAP YOU AINT FOOLING ANYONE,Bills,2,1574628253,e11i3w
108,Who doesn't? Gotta cultivate that mass,Broncos,1,1574628253,e11i3w
109,Frank's Red Hot,Bills,6,1574628251,e11i3w
110,Gore 😁😁😁😁😁,Bills,2,1574628247,e11i3w
111,Welp... That's enough football for me today.,Broncos,1,1574628245,e11i3w
112,GORE!!!!,Bills,3,1574628235,e11i3w
113,GRATS GORE!,Broncos,5,1574628231,e11i3w
114,"With six games left, I think only the Bengals are truly guaranteed a top ten pick at this point in time.",Broncos,1,1574628219,e11i3w
115,Great Photoshopping there,Bills,3,1574628215,e11i3w
116,Salty ass Broncos trying extra hard to keep gore from hitting #3,Bills,-1,1574628214,e11i3w
117,I'm sorry. I just assume everyone is a troll. Ask this in a non game day thread I'm sure you'd get a better answer!,Bills,1,1574628214,e11i3w
118,You obviously need more HGH.,Bills,1,1574628212,e11i3w
119,The knowledge that it'd be better for the long term plan of the franchise to have a top 5 pick. Jets gonna J-E-T-E.,Bills,1,1574628209,e11i3w
120,Didn't want raiders aids or someshit.,Broncos,1,1574628208,e11i3w
121,This season you never know which Jets team is gonna show up.,Bills,1,1574628196,e11i3w
122,Derek Carr was benched?,Broncos,1,1574628181,e11i3w
123,"Back to third all time, save the graphic in case we need it again",Bills,2,1574628173,e11i3w
124,GORE BABY #3,Bills,3,1574628169,e11i3w
125,FRANK THE TANK,Broncos,3,1574628169,e11i3w
126,ataboy Gore,Bills,3,1574628168,e11i3w
127,We gave up,Broncos,1,1574628160,e11i3w
128,GORE YAYYYYYY ❤️❤️❤️,Bills,2,1574628156,e11i3w
129,Unbelievable that Wadman wasn’t cut in the offseason,Broncos,3,1574628155,e11i3w
130,Why are our games on TV.  Even I don't want to watch this,Broncos,2,1574628152,e11i3w
131,History for Gore!,Bills,2,1574628152,e11i3w
132,Have we ever had a good punter? I feel like we either have a fucking awful punter or he's on HGH,Broncos,3,1574628141,e11i3w
133,I could kick it farther lol,Bills,1,1574628139,e11i3w
134,"""The wind will move itself.""

Move over scientists, Rich is here.",Bills,6,1574628131,e11i3w
135,I thought we fired McCoy and Dennison,Broncos,1,1574628126,e11i3w
136,Come on gore!!!,Bills,1,1574628126,e11i3w
137,Yeah punt that shit,Bills,1,1574628124,e11i3w
138,Wadman blew it,Bills,1,1574628122,e11i3w
139,Unbelievable choice to punt there,Bills,3,1574628122,e11i3w
140,"I mean go bills, but they're seriously not going for it?",Broncos,2,1574628118,e11i3w
141,"Understand, but people will treat you fair and well if you're not obnoxious even when wearing your team gear.",Bills,2,1574628116,e11i3w
142,"True, probably buying him extra time",,1,1574628113,e11i3w
143,Fire Wadman.,Broncos,1,1574628101,e11i3w
144,Just a general football question....I like football,,1,1574628100,e11i3w
145,They’re punting?!??? They just gave up. Game over.,Steelers,3,1574628096,e11i3w
146,Get Frankie his record,Bills,1,1574628094,e11i3w
147,What got into the Jets?,Bills,2,1574628094,e11i3w
148,That might be the best field position we've had all year.,Bills,2,1574628083,e11i3w
149,It's another rEbUiLdInG yEaR,Broncos,1,1574628081,e11i3w
150,"no, top 10 wr maybe. No way overall",Bills,1,1574628080,e11i3w
151,Need 3 yards and run a shitty screen. Classic,Broncos,5,1574628077,e11i3w
152,"13 yards with the wind, oof",Bills,1,1574628076,e11i3w
153,13 yard punt lmao,Broncos,4,1574628072,e11i3w
154,We've dropped a few picks today,Bills,1,1574628064,e11i3w
155,"imagine a world where White could catch, dude would never get thrown at.",Bills,1,1574628057,e11i3w
156,Do you not hear the crowd singing along to it every 3 minutes?,Bills,5,1574628047,e11i3w
157,Tre White is better than Gilmore. Don’t @ me,Bills,6,1574628045,e11i3w
158,omg imagine punting here,Bills,2,1574628033,e11i3w
159,That song is still around?,Broncos,2,1574628023,e11i3w
160,"I see it as them getting a worse pick, so theres that.",Bills,2,1574628018,e11i3w
161,"Not gonna lie ... I got a bit misty-eyed. Haven't been back to B-lo since 2004 for any respectable amount of time, haven't been to a GAME since 1991, and damn if that song doesn't bring me to tears.",Bills,2,1574628015,e11i3w
162,Tre could have four interceptions today,Bills,1,1574628010,e11i3w
163,"if fantasy draft were today, is john brown a top 10 overall pick?",Bills,1,1574628008,e11i3w
164,Just in I gotta give a stat about how bad the bills have been that somebody just told me.,Bills,1,1574627998,e11i3w
165,I am so fucking sick of Seven-Nation Army.,Bills,3,1574627988,e11i3w
166,Into the wind tho,Bills,1,1574627986,e11i3w
167,Sometimes it's a tactical squib,Bills,1,1574627986,e11i3w
168,We're decided he is the False Horse God.,Broncos,2,1574627986,e11i3w
169,The problem is our ownership is such a disaster that there's no one to find a replacement right now. He should stay until that gets figured out.,Broncos,1,1574627985,e11i3w
170,It was intentionally intentional,Bills,1,1574627985,e11i3w
171,"I'd love to watch a game at Ralph Wilson, but I'm glad I didn't choose this one.",Broncos,1,1574627981,e11i3w
172,Not easy into this wind.,Bills,1,1574627981,e11i3w
173,Why would we care,Bills,1,1574627967,e11i3w
174,But still fuck the Jete,Bills,2,1574627967,e11i3w
175,I think most of the people are arguing about doing away with challenges where Riveron refuses to contradict the call on the field like PI. Like if there's a better chance of being struck by lightning than having it overturned why bother giving coaches the option to throw away a TO.,Bills,1,1574627966,e11i3w
176,stating the obvious: Tre is so fucking good.,Bills,4,1574627952,e11i3w
177,Thanksgiving came early because we are FEASTING,Bills,2,1574627948,e11i3w
178,Orchard Park is rockin. Nothing more fun than a bills game during a successful season!,Bills,4,1574627930,e11i3w
179,I love you Mr. Brown &lt;3,Bills,1,1574627929,e11i3w
180,Raiders getting fuckin rocked is awesome too.,Bills,5,1574627926,e11i3w
181,Getting old,Broncos,1,1574627922,e11i3w
182,Probably not. Getting close though I would imagine,Broncos,1,1574627912,e11i3w
183,Oof bad kick there.  Gotta kick those just a little harder.,Bills,1,1574627910,e11i3w
184,"The stadium is Bills' loud, jesus",,7,1574627904,e11i3w
185,[deleted],,2,1574627904,e11i3w
186,The Ralph is rocking,Bills,5,1574627900,e11i3w
187,"Broncos fans seriously asking. Do you guys want Elway fired?

I know he got a superbowl but the teams have been completely non competitive since. He has gone thru a bad head coach hire, multiple failed QB evaluations, and has now skipped drafting a QB in a QB heavy draft.

And his current draft pick at QB can't get on the field.

Am I wrong in how you guys feel?",,1,1574627897,e11i3w
188,Broncos!!!,Chiefs,1,1574627892,e11i3w
189,That is the worst idea I've ever heard. Challenges have made every sport better,Bills,1,1574627891,e11i3w
190,I like how that guy keeps his jersey above his gut...Future goals!,Bills,2,1574627874,e11i3w
191,"I won't upvote it, but fair.  Fair.  Go and not win the Lamar hunt trophy again, k thx.  And send me some Joe's while you are at it.",Broncos,2,1574627870,e11i3w
192,Are we guaranteed a top-10 draft pick now?,Broncos,2,1574627867,e11i3w
193,That dude knows his stuff then.,Bills,2,1574627867,e11i3w
194,So THAT'S why we wanted the wind in our faces...,Bills,1,1574627866,e11i3w
195,He's been throwing long on the deep ball all season. Let's install some high powered fans in the stadium quick!,,2,1574627865,e11i3w
196,"MCDERMOTT WON A CHALLENGE

THE END IS NEAR

MAKE PEACE WITH YOUR GODS",Bills,7,1574627862,e11i3w
197,I am so fucking proud of that crowd being so loud all game ❤️,Bills,1,1574627859,e11i3w
198,"lol I have it on mute watching taskmaster instead, didn't even realize they called it incomplete",Broncos,1,1574627849,e11i3w
199,Hopefully this rebuilds his confidence on the deep ball and we see more success,Bills,1,1574627845,e11i3w
200,To the people who want to do away with challenges (WGR AHEM) imagine not being able to challenge that,Bills,1,1574627826,e11i3w
201,That stadium is LOUD wish I went today,Bills,3,1574627821,e11i3w
202,Hell yeah TD,Bills,3,1574627809,e11i3w
203,"All season in great weather allen cant hit the broad side of a barn. 

In 30 mile an hour swirling winds he drops in it the bucket",Bills,7,1574627804,e11i3w
204,That's like McDermott's third ever successful challenge.,Bills,6,1574627802,e11i3w
205,Looked like the ball might have touched the ground while Brown was cradling it against his body. I could see why he called it but don't see a reason for the decision to hold up upon review.,Bills,2,1574627795,e11i3w
206,I love CHJ but he’s been burned often this season after talking a big game. We’ve got to move on from him.,Broncos,4,1574627795,e11i3w
207,He wanted to be a special boy and show he had super good eyes and could make incredible calls. He doesn't have any of that though so he just guessed and hoped to get lucky,,2,1574627780,e11i3w
208,Twitter says it's overturned,Bills,1,1574627779,e11i3w
209,Chris Harris been getting burned a lot recently,Vikings,4,1574627778,e11i3w
210,CHJ is a burn machine these days,Broncos,6,1574627764,e11i3w
211,They got it right on a challenge. Good job nfl,Bills,2,1574627760,e11i3w
212,You answered your own question.,Bills,1,1574627759,e11i3w
213,[Live look at Josh Allen.](https://media.giphy.com/media/XGBAmjqA0RJyU/giphy.gif),Bills,6,1574627749,e11i3w
214,What the fuck is a catch if that's not ruled one. Brown had full control,Bills,1,1574627741,e11i3w
215,"I'm so horny, please don't fuck this up NFL and call that no catch",Bills,2,1574627734,e11i3w
216,"/u/The_Punniest, how're the reps going?",Broncos,2,1574627727,e11i3w
217,Damn right it's a touchdown.,Bills,5,1574627723,e11i3w
218,Refs are fucking stupid how do you have to review this?,Chiefs,4,1574627715,e11i3w
219,"nobody puts baby gore in the corner

4 straight losses and a first round exit inbound calling it now",Chiefs,1,1574627714,e11i3w
220,What did the ref see to rule that incomplete?,Broncos,3,1574627712,e11i3w
221,Perfect throw,Bills,5,1574627712,e11i3w
222,That has to be a td,Vikings,3,1574627710,e11i3w
223,"Imagine being a ref lmao waking up every morning and drinking your lead paint milkshake, strapping on that extra chromosome and going to work every Sunday. What a life",,15,1574627708,e11i3w
224,he beat the dolphins today. Were going to get a whole new year of them now!,Broncos,1,1574627707,e11i3w
225,What blind ref called that incomplete?,Bills,3,1574627697,e11i3w
226,obvious replays make me so fucking nervous,Bills,3,1574627695,e11i3w
227,Normally Josh overthrows that but with the wind blowing it back it was perfect,Bills,2,1574627694,e11i3w
228,If they don’t overturn this I’m never watching football again,Bills,6,1574627682,e11i3w
229,We all know this is gonna be upheld as no catch right guys? Because integrity....and making sure no one really knows what a catch is,Bills,5,1574627677,e11i3w
230,HOW THE FUCK CAN THAT BE RULED INCOMPLETE,Bills,5,1574627676,e11i3w
231,"No way that’s not a TD

Which means the call probably gets upheld",Steelers,5,1574627675,e11i3w
232,"Yeah, that's a catch. TD Buffalo",,3,1574627667,e11i3w
233,Joshy 4th quarter,Bills,6,1574627663,e11i3w
234,How did they call that incomplete?,49ers,5,1574627662,e11i3w
235,How did they not rule that a TD on the spot?,Bills,2,1574627661,e11i3w
236,"If Josh starts making those consistently, I'm going to need some new shorts.",Bills,8,1574627659,e11i3w
237,He hit on a long ball.  I almost don't believe it.,Bills,7,1574627658,e11i3w
238,If that doesn't get counted as a TD I'm gon be pissed,Bills,3,1574627657,e11i3w
239,"Of course it's ruled incomplete! Fucking morons.   
Great pass by Josh and finally connects on the deep ball.",Bills,5,1574627657,e11i3w
240,That was a catch.,Bills,3,1574627650,e11i3w
241,Obvious touchdown. How the hell do you miss that?,Bills,7,1574627640,e11i3w
242,4th Quater Josh Allen has entered the chat.,Bills,7,1574627633,e11i3w
243,Hero ball work!!!,Bills,3,1574627633,e11i3w
244,Holy damn that was a throw and a catch!,Bills,5,1574627633,e11i3w
245,But he said something mean to him!,Bills,1,1574627631,e11i3w
246,This pleases my fantasy and my fandom,Bills,3,1574627628,e11i3w
247,How the fuck was that ruled incomplete!? Clearly a catch!,Bills,7,1574627627,e11i3w
248,Clear TD,Bills,3,1574627627,e11i3w
249,Obvious touchdown.,Bills,4,1574627622,e11i3w
250,What a throw,Chiefs,4,1574627620,e11i3w
251,There's that deep ball baby,Bills,3,1574627619,e11i3w
252,These refs are a joke,Bills,3,1574627606,e11i3w
253,I'm dead.,Broncos,3,1574627605,e11i3w
254,"Hit the ground but he clearly had control, that's a touchdown",Broncos,5,1574627596,e11i3w
255,"Goodbye liver.  It was a good run surviving southern AZ, ASU, and Portland, added on with the broncos last few years, but I think our time to split is finally upon us.",Broncos,6,1574627595,e11i3w
256,That's a definite td,Bills,4,1574627591,e11i3w
257,That's a fucking catch god dammit,Bills,6,1574627588,e11i3w
258,Lol refs are so bad,,7,1574627588,e11i3w
259,That defender better have been apologizing to Gore like it looked like.,Bills,2,1574627584,e11i3w
260,Johnson felt bad keeping Gore from his record. Straight up apologized to him lol,Broncos,3,1574627583,e11i3w
261,What kind of drunk ass ref called that not a td,Bills,15,1574627577,e11i3w
262,"It’s a TD, no need to review it",Broncos,4,1574627576,e11i3w
263,"You weren’t, it’s just fun to watch division rivals suffer",Chiefs,2,1574627574,e11i3w
264,JOSH!!!!!!,Bills,3,1574627567,e11i3w
265,OVER 9000,Bills,5,1574627563,e11i3w
266,Alabama Bills Backers?,Bills,2,1574627553,e11i3w
267,Not as dumb as hitting someone in the head with their own helmet,Bills,4,1574627552,e11i3w
268,AH MY GOD A DEEP bALL,Bills,3,1574627546,e11i3w
269,The whole world knew that play was coming dude.....holy shit nice throw into the wind!,Bills,4,1574627545,e11i3w
270,FINALLY THE DEEP BALL CONNECTS!,Bills,3,1574627535,e11i3w
271,"""Big day coming for those guys"" :(",Bills,4,1574627535,e11i3w
272,JOHN BROWNS BODY,Bills,3,1574627530,e11i3w
273,Lol imagine if they allowed it. People fireman carrying a small rb 20 yards for a safety.,Broncos,1,1574627529,e11i3w
274,Lol acting like we were a threat.,Broncos,5,1574627525,e11i3w
275,THAT'S WHAT BROWN CAN DO FOR YOU,Bills,3,1574627524,e11i3w
276,Oh we know.,Bills,1,1574627522,e11i3w
277,Tastes of mediocrity,Broncos,2,1574627518,e11i3w
278,Back to fourth all time lol,Bills,3,1574627499,e11i3w
279,Ed Oliver today https://imgur.com/s74y01Z.jpg,Bills,4,1574627491,e11i3w
280,How dumb can you be to 15 yards for fighting when down by 10?,Bills,3,1574627478,e11i3w
281,that squirrel was thickk AF,Bills,1,1574627470,e11i3w
282,Amateur hour TV production for sure,,1,1574627459,e11i3w
283,There was a receiver in the vicinity. It wasn't catchable but you never see that called.,Bills,1,1574627458,e11i3w
284,Can we please stop with the baker mayfield commercials,Bills,4,1574627457,e11i3w
285,"It's intentional.  They don't like the scrutiny th refs are getting online, and are doing their best to hide it. 

Tin Foil Hat on.",Bills,1,1574627452,e11i3w
286,"He got touched at like the 1, doesn't matter if you drive him back.",Broncos,1,1574627433,e11i3w
287,Ya dumb?,Bills,2,1574627426,e11i3w
288,I'm pissed off we're losing.  I'm gonna make it harder to win!,Bills,1,1574627418,e11i3w
289,What a beautiful bye week this has been,Chiefs,2,1574627395,e11i3w
290,"But the hit was out of the endzone, forward progress puts him at the 1 no matter what",Broncos,1,1574627395,e11i3w
291,He's probably talking about Carolina's QB,Bills,2,1574627388,e11i3w
292,Get that good trash smoke flavor,Bills,2,1574627380,e11i3w
293,Cut yiadom strait up,Broncos,3,1574627377,e11i3w
294,yikes.  ya damn sure ya can't do that.,Bills,1,1574627370,e11i3w
295,What is Yiadom doing? He hardly gets any play time as is,Broncos,3,1574627369,e11i3w
