,body,author_flair_text,score,created_utc,link_id
296,He was wrapped up for a two count before they blew it dead. And they'd call forward progress anyway. You can't tackle a guy backwards to make them lose yards.,Bills,1,1574627367,e11i3w
297,It did look like holding but everyone throws their arms up to try and draw that.,Bills,1,1574627362,e11i3w
298,Dude they are terrible at the replays today,Bills,3,1574627362,e11i3w
299,He would've had forward progress otherwise.,,1,1574627362,e11i3w
300,🐎🐓🔒,Broncos,1,1574627356,e11i3w
301,What a weird name tho,Bills,1,1574627340,e11i3w
302,Make s'mores?,Bills,2,1574627335,e11i3w
303,"Missed plays happen.  There was a clear (well on replay) illegal hands to the face way earlier in the game, shit in the trenches is always missed.",Broncos,1,1574627333,e11i3w
304,That raiders game has been a beauty to behold,Chiefs,2,1574627333,e11i3w
305,Clear holding in the endzone there. Should be a safety,,2,1574627332,e11i3w
306,Yiadom sucks,Broncos,4,1574627312,e11i3w
307,Jesus I thought we cut Yiadom that dude is the worst player in the league,Broncos,5,1574627306,e11i3w
308,Contact started out of the endzone,49ers,3,1574627304,e11i3w
309,Our fans look like Buffalo lol.,Bills,2,1574627294,e11i3w
310,I miss Trevor Simein.,Packers,3,1574627283,e11i3w
311,Ya Dumb,Bills,2,1574627281,e11i3w
312,"blew it dead too early, then.

EDIT: Apparently I don't know anything about safeties.

Makes sense, they're rare as hell.",Bills,1,1574627276,e11i3w
313,Gonna warm my cold dead heart on the trash fire that is the Broncos this year.,Broncos,4,1574627272,e11i3w
314,How dare yo.... oh wait.,Bills,8,1574627261,e11i3w
315,[deleted],,1,1574627255,e11i3w
316,That should be a hold in the end zone for a safety. Dude's arm was choking out our pass rusher.,Bills,2,1574627239,e11i3w
317,...wat?,Broncos,2,1574627238,e11i3w
318,"Yo, that is absolutely fucking intentional grounding.",Bills,3,1574627237,e11i3w
319,How the hell was that not a safety!?,Bills,3,1574627228,e11i3w
320,"Missed a hold in the endzone too, should have been a safety",Bills,4,1574627213,e11i3w
321,They blew it dead long before he got spun in.,Bills,3,1574627209,e11i3w
322,Yeah Allen sucks,Broncos,4,1574627206,e11i3w
323,Rode him like a Bronco!,Bills,2,1574627202,e11i3w
324,Eddie!!!,Bills,2,1574627179,e11i3w
325,Great replay there CBS,Bills,3,1574627171,e11i3w
326,How was that not a safety,Bills,6,1574627168,e11i3w
327,"Putting that ""no 4thQ TD in 6 games"" stat up seems like an invitation for them to get 3 this game. Lol",Bills,2,1574627167,e11i3w
328,Ahhhhh that should have been picked,Bills,2,1574627161,e11i3w
329,at least our only blowout this season was to the chiefs and not the jets,Broncos,5,1574627160,e11i3w
330,Almost!,Bills,2,1574627143,e11i3w
331,Risner got abused,Bills,2,1574627136,e11i3w
332,Maybe they are saving it for when they actually need it to win. Have a bunch of tape saying you never snap it so teams prepare for it not being snapped and are caught flat-footed when they decided to actually run a play.,Bills,2,1574627133,e11i3w
333,"Oh damn, great sack Ed!",Bills,2,1574627133,e11i3w
334,Just throw the ball at the fucking ground,Broncos,2,1574627125,e11i3w
335,Idk how that wasn't a safety.....,Broncos,4,1574627125,e11i3w
336,Unless Peyton is bluffing. Dude could get a wheelchair bound guy to jump.,Broncos,1,1574627112,e11i3w
337,Billie Elish is insufferable.,Bills,1,1574627109,e11i3w
338,The Pats' favorite TV show is Young Sheldon.,Bills,5,1574627101,e11i3w
339,Half joking but gore could’ve definitely gotten that 4th down,,1,1574627094,e11i3w
340,Oh true I got that backwards. Since Cole has the n-word pass he has to react how a black man would when a white guy says that. It's the only way to keep the pass.,Bills,1,1574627089,e11i3w
341,He's the reason why there was an offensive holding call,Broncos,1,1574627058,e11i3w
342,Hasn't worked yet this year and we try it like 8 times a game.,Bills,2,1574627056,e11i3w
343,You don't change your gameplan in a game just to get a record. Would it be cool? Yeah and they probably will at some point. But you don't change your player set,,2,1574627056,e11i3w
344,"Also tell Allen to stop sounding exactly the same on the hard count, too.

The entire league knows what his fake hike sounds like, as it's exactly the same every time.",Bills,1,1574627050,e11i3w
345,Maybe waiting for a red zone attempt so he can get it with a TD?,Bills,1,1574627045,e11i3w
346,Bluffing on 4th only works if you actually run a play.  Otherwise everyone knows your bluffing,Bills,1,1574627039,e11i3w
347,Cody ford bb,,1,1574627015,e11i3w
348,They have a two score lead. Why risk giving the Broncos good field position when they have been struggling on Offense?,Bills,1,1574627001,e11i3w
349,"why the fuck aren't they giving gore the ball?

one yard away from #3 all time rushing yards. ONE.",Bills,4,1574626994,e11i3w
350,Is Von playing today?,Bills,1,1574626992,e11i3w
351,Yeah of course. Josh Allen is legit,Vikings,1,1574626987,e11i3w
352,Someone should tell mcdermot that you can't do that every time and expect it to work. Though he did get them to use a timeout somehow when anyone who has watched any of our games could have told you we were hard counting until the quarter ran out,Bills,1,1574626971,e11i3w
353,He also uses the reverse claw grip when putting.,Bills,1,1574626970,e11i3w
354,"yea, the fake plays are never going to work unless some of them are actually real",Bills,3,1574626970,e11i3w
355,"Players are actually playing under Fang, even if we are losing.",Broncos,2,1574626945,e11i3w
356,Bills should have gone for it,Broncos,5,1574626940,e11i3w
357,"I'm so done with the fake snap plays, how about you actually have some balls and go for it from the fucking 36 you fucking coward",Bills,11,1574626908,e11i3w
358,"just go for it ffs

PLAY FEARLESS THEY SAID..",Bills,2,1574626901,e11i3w
359,Should have gone for it for real,Bills,3,1574626888,e11i3w
360,Cowards.,Bills,2,1574626887,e11i3w
361,John Brown is having a quiet day. Not very good for my fantasy team.,Bills,1,1574626886,e11i3w
362,"I mean I'd probably die, and I'd rather that then his voice mixed with my height and other physical features.",Broncos,2,1574626884,e11i3w
363,But the question is did the guy who's helmet Cole knocked off have one.,Bills,1,1574626880,e11i3w
364,"His first year in the league was with McCoy as his RB, he probably was influenced by the crazy way he holds the ball.",Bills,1,1574626876,e11i3w
365,That's good,Bills,2,1574626838,e11i3w
366,Lol wat,Broncos,1,1574626828,e11i3w
367,That's one of those good problems to have.,Bills,1,1574626823,e11i3w
368,Boger has been eating the scented erasers again.,Bills,1,1574626822,e11i3w
369,[deleted],,1,1574626819,e11i3w
370,"Hey, Allen, maybe don't smoke it to a guy 5 yards away unless you can put it in the numbers.",Bills,1,1574626809,e11i3w
371,So Josh Allen is wicked fun to watch but the way he holds the ball while scrambling gives me anxiety.,Broncos,2,1574626805,e11i3w
372,Tom Brady and Dildos,Bills,5,1574626798,e11i3w
373,Is he playing? I haven't heard his name.,Bills,2,1574626795,e11i3w
374,Flacco on IR,Broncos,1,1574626790,e11i3w
375,The only W we'll be taking today,Broncos,1,1574626767,e11i3w
376,"And if you don’t then you have a great story and no speech impediment, plus some confidence if you don’t die",,2,1574626758,e11i3w
377,At least Lee Smith isn't fucking up today,Bills,2,1574626748,e11i3w
378,"Holding, on the offense, and buffalo. Name a more iconic duo",Bills,4,1574626744,e11i3w
379,"Oh shit, South Park commercial during football making fun of God Emperor Cheeto Man??",,4,1574626743,e11i3w
380,Hoeding,Bills,2,1574626735,e11i3w
381,"When was the last time the announcers said the word ""Broncos"" without also saying ""struggle"" in the same sentence?",Broncos,2,1574626734,e11i3w
382,I don't know why anyone would question calling a TO so the 3rd quarter Bills get another play and chance to implode. That's a real big brain data nerd call. Expert Analytics.,Bills,2,1574626705,e11i3w
383,Why the timeout?,Bills,2,1574626689,e11i3w
384,"Tried running out the quarter so that we're in a less favorable wind direction, Broncos said 'not so fast!'",Bills,2,1574626688,e11i3w
385,I guess I was referring to redzone D. They stopped those 2 1st drives cold.,Bills,1,1574626682,e11i3w
386,"Fangio didn't want Josh to pick up that 1st down to start the 4th, knowing it could trigger the level-up to 4th Quarter Josh Allen. Good time out.",Bills,3,1574626660,e11i3w
387,That’s nice of those guys to pull Raiders fans out of that river,,1,1574626659,e11i3w
388,You got it champ. Only because you asked nicely.,Chiefs,0,1574626654,e11i3w
389,What the fuck Fangio,Broncos,2,1574626653,e11i3w
390,Kitchens is the best coach. Still salty about that game.,Bills,1,1574626641,e11i3w
391,I still think Fangio is better than Vance Joseph...but uhhhh not by much lol.,Broncos,2,1574626632,e11i3w
392,Accurately roasted.,Bills,3,1574626627,e11i3w
393,Thanks for the the free play,Bills,2,1574626626,e11i3w
394,So fuck off,Broncos,-1,1574626617,e11i3w
395,John Elway needs to be fired.,,4,1574626612,e11i3w
396,"Maybe If I take a timeout, they'll think I'm doing something.",Bills,3,1574626598,e11i3w
397,These are the best coaches in the world,Bills,2,1574626590,e11i3w
398,Don't ask. Just sit back and enjoy.,Bills,1,1574626582,e11i3w
399,but upvotes are actually objectively worthless?,Chiefs,0,1574626571,e11i3w
400,Denver baby what is you doing,Bills,4,1574626555,e11i3w
401,Uh wut?,Bills,2,1574626553,e11i3w
402,"Finally, a play call to fit the situation. Nice catch, Mac.",Bills,1,1574626551,e11i3w
403,End-of-half Bills level clock management there,Broncos,11,1574626543,e11i3w
404,Bears were penalized twice before the attempt,Broncos,3,1574626542,e11i3w
405,what a horrible time out.,Broncos,1,1574626541,e11i3w
406,"C’mon coach, the time was winding down anyways",Broncos,1,1574626540,e11i3w
407,Allen_shrug.gif,Bills,4,1574626523,e11i3w
408,A timeout?,Broncos,5,1574626509,e11i3w
409,I'm gonna pay you an upvote to fuck off,Broncos,-2,1574626508,e11i3w
410,The actual shock in the announcer's voice when they call timeout lmao.,Bills,7,1574626506,e11i3w
411,"Uh, a timeout? Why?",Bills,3,1574626503,e11i3w
412,"Lol what the fuck, a timeout for what?",Broncos,6,1574626499,e11i3w
413,Wait a 48 yard PAT?,Bills,2,1574626497,e11i3w
414,"I go with the punch. He hits me and I'll likely get a speech impediment anyway, so I might as well get a cool story out of it.",Broncos,5,1574626491,e11i3w
415,What the hell was that timeout for LOL,Bills,2,1574626488,e11i3w
416,"Glad we got it in cap space, we should pay it.",Bills,3,1574626475,e11i3w
417,C'mon Joshy 4th quarter,Bills,2,1574626470,e11i3w
418,BBQ chicken for Shaq.,Bills,3,1574626460,e11i3w
419,Shaq Lawson is gonna cost us a couple bucks to re-sign.,Bills,6,1574626437,e11i3w
420,By whalloping the Raiders. It's a happy turn of events.,Broncos,1,1574626432,e11i3w
421,Im going to assume you mean Brandon Allen,Bills,1,1574626426,e11i3w
422,Would you rather get punched in the face by Mike Tyson or sound like Mike Tyson?,Bills,3,1574626416,e11i3w
423,"In other news, the Bears just missed a 48-yard PAT.",Broncos,3,1574626413,e11i3w
424,We saw Josh Allen just throw the ball at the ground when a play broke earlier. It would be awesome if our QBs could learn that seemingly unattainable skill,Broncos,3,1574626407,e11i3w
425,We HAVE to get the ball back fast and pray offense can do something.  Our defense is doing decent but offense is not for shit against this Defense.,Broncos,3,1574626403,e11i3w
426,"I wish Denver would quit being little bitches and stand down to let Gore get a 10 yard gain.

But Broncos gonna Donkey",Chiefs,-1,1574626401,e11i3w
427,"I could have made that sack, nobody felt like touching him",Bills,1,1574626400,e11i3w
428,Well bad run defense. Y'all have about 200 yards rushing.,Broncos,3,1574626393,e11i3w
429,Give the ball to gore!!!!,Bills,1,1574626392,e11i3w
430,Blue collar aka untalented,,1,1574626385,e11i3w
431,Is Flacco hurt or did he get benched for Allen?,Bills,0,1574626379,e11i3w
432,Double team that DT and still let him through fuck.....,Broncos,1,1574626366,e11i3w
433,Their comeuppance,Broncos,2,1574626362,e11i3w
434,Shaq killin em,Bills,2,1574626355,e11i3w
435,*Shaq Lawson...Like a RUNAWAY freight train!*,Bills,2,1574626355,e11i3w
436,B. Allen had no hope there against Shaq.,Bills,1,1574626349,e11i3w
437,Not sure how to react...,Bills,3,1574626346,e11i3w
438,[deleted],,1,1574626336,e11i3w
439,Learn to fucking tackle jfc.,Bills,1,1574626326,e11i3w
440,What's going on with the Raiders? Golly.,Bills,1,1574626319,e11i3w
441,I heard that Jerome Bettis is from Detroit.,Bills,1,1574626288,e11i3w
442,"Displaying an increased risk of recurrence and “rest of ones life” is not the same remotely and it’s important to separate the two.   Not to mention a ton of other modifiers that decide recurrence as well as proper rehab.  It’s also important to denote their evaluation of recurrence seems to be two weeks here. Which is an issue in itself since some of the studies they reference are shoddy as hell. 

Is there an increased risk of injury? Absolutely. This is the same for basically any msk injury especially in professional sports. But lifetime? There’s no evidence here.",Bills,1,1574626276,e11i3w
443,Allen is not an nfl caliber qb,Vikings,-1,1574626270,e11i3w
444,[deleted],,1,1574626245,e11i3w
445,Justin Simmons just does not miss tackles.,Broncos,1,1574626243,e11i3w
446,we swapped 3rd and 4th quarter play,Bills,1,1574626220,e11i3w
447,Our LBs are getting toasted in the pass game and our rush defense has been awful,Broncos,3,1574626219,e11i3w
448,They don't play til 430.,Bills,1,1574626210,e11i3w
449,So a 5 yard pattern on a 3rd and 7? It worked! We got 5 yards.,Bills,2,1574626204,e11i3w
450,O,Bills,1,1574626204,e11i3w
451,It's a 4 o'clock game,Bills,1,1574626180,e11i3w
452,It should have been 14-0 though,Bills,1,1574626177,e11i3w
453,I’ve seen enough of Brandon Allen,Broncos,2,1574626164,e11i3w
454,Allen didn't fumble!,Bills,1,1574626153,e11i3w
455,That wasn’t unnecessary roughness?,Broncos,3,1574626151,e11i3w
456,Actually the Jets are helping our chances today,Bills,2,1574626134,e11i3w
457,You misspelled JETE,Bills,2,1574626132,e11i3w
458,Bad defense? Come on man.,Bills,2,1574626132,e11i3w
459,Haven't checked that's game how's it looking?,Bills,1,1574626128,e11i3w
460,"Have faith, brother.",Bills,2,1574626111,e11i3w
461,Well the Raiders too so there's a silver lining right?,Bills,2,1574626091,e11i3w
462,Is it windy? Lol,Bills,1,1574626088,e11i3w
463,I sure hope Zeke doesn't go for 160 against us.,Bills,2,1574626081,e11i3w
464,did Fitz go to Harvard? Do TEs play basketball?,Bills,1,1574626070,e11i3w
465,This is the worst game I’ve seen us have in a long ass time. Bad offense and defense,Broncos,5,1574626068,e11i3w
466,White people,Bills,2,1574626049,e11i3w
467,Starting to think the Broncos playoff chances are in jeopardy,Broncos,6,1574626037,e11i3w
468,Go fuck yaself,Bills,1,1574626034,e11i3w
469,You'll get a slight nod.,Bills,3,1574626024,e11i3w
470,"The uprights are swaying, so yes it is windy",Bills,2,1574626006,e11i3w
471,If Frank Gore is relegated to a fucking footnote on the SNF daily recap for passing Barry Sanders I say we all riot.,Chiefs,4,1574625976,e11i3w
472,"Boomers, and like still only a subsection of them.",Broncos,3,1574625974,e11i3w
473,"Earlier when it was going to a commercial he said ""Denver getting the job done holding the Bills to 6""

...it was 6-0",Bills,1,1574625964,e11i3w
474,Is it windy out there? I feel like the announcers don't mention this enough,Broncos,7,1574625962,e11i3w
475,Can I get a go Jets in here?,Broncos,3,1574625941,e11i3w
476,Laugh out loud,Broncos,2,1574625940,e11i3w
477,I'm pretty hyped for that and Ford/Ferrari,Bills,1,1574625935,e11i3w
478,Let’s go Jete!!!,Bills,2,1574625924,e11i3w
479,Who the fuck watches these cbs shows?,Bills,3,1574625916,e11i3w
480,CBS's coverage sucks today.,Bills,2,1574625880,e11i3w
481,The LAST 4 games lol,Bills,1,1574625873,e11i3w
482,YO 34-3 JETS OVER RAIDERS CURRENTLY WHAT?!,Broncos,5,1574625857,e11i3w
483,This movie looks good.,Bills,3,1574625837,e11i3w
484,No interceptions in our last 4 games? What about the one earlier?,Broncos,4,1574625804,e11i3w
485,Can be said for that and the last play for both teams. Decent amount of boneheaded moves today,,2,1574625801,e11i3w
486,[deleted],,2,1574625800,e11i3w
487,"If the hands aren't a good spot to catch the ball, what is?",Broncos,2,1574625794,e11i3w
488,"Your stadium looks on point, if I would have moved to NY I bet I would have loved it there.",Broncos,1,1574625792,e11i3w
489,"“Hits him in a bad spot, right in the hands”

What the heck is a good spot then? Haha",Packers,2,1574625791,e11i3w
490,"I mean, this isn't really that, it's just a culmination of his career. Doesn't really matter who it's against",Broncos,1,1574625790,e11i3w
491,"Allen. You've had some really tragic throws today. Not unusual, but some of these are bad bad.",Bills,1,1574625759,e11i3w
492,You have to make that play,Broncos,2,1574625737,e11i3w
493,Lol that deleted comment.,Broncos,1,1574625736,e11i3w
494,Yuck. Not the best sequence we've had today.,Bills,1,1574625712,e11i3w
495,"""hits him in a bad spot, right in the hands""",Bills,8,1574625710,e11i3w
496,Stop that Allen,Bills,2,1574625707,e11i3w
497,That pick would have helped,Broncos,2,1574625705,e11i3w
498,Go play Fallen Order and do it. You'll be a pro bodybuilder after Oggdo Bogdo.,Broncos,1,1574625703,e11i3w
499,"Oof, bad throw Josh. Got lucky there.",Bills,1,1574625697,e11i3w
500,I'd probably tear every tendon that's not fucked up already.,Broncos,2,1574625692,e11i3w
501,Joshy what is you doing,Bills,2,1574625689,e11i3w
502,ONE MORE YARD FRANK!!!,49ers,1,1574625668,e11i3w
503,"yea, fuck showing us the penalty, show us a list of RBs",Bills,1,1574625662,e11i3w
504,I just want Gore to get all the records. What an incredible player.,Broncos,1,1574625651,e11i3w
505,How do we always give up huge records?,Broncos,1,1574625638,e11i3w
506,Has there been a worse 8-3 team in NFL history?,Bills,3,1574625635,e11i3w
507,Lol the Raiders are getting BTFO by the Jets,Broncos,3,1574625600,e11i3w
508,"Lol I wish I did that when I started Dark Souls. I died probably 40 times on the first boss. 

Maybe I'll make a routine for Modern Warfare since that's what I have been playing recently. Something for every gun/level upgrade and every loss or below 1.0 K/D ratio.",Bills,1,1574625598,e11i3w
509,Fuckin penalties,Bills,1,1574625567,e11i3w
510,J-E-T-E,Bills,1,1574625560,e11i3w
511,"Good guy Broncos, trying to let Gore break that record",Broncos,4,1574625555,e11i3w
512,Go Gore go!!!,Bills,1,1574625552,e11i3w
513,"Holy fuck, this bills run game is insane.  Way better than the vikings.",Broncos,1,1574625542,e11i3w
514,It's fantastic.,Bills,3,1574625538,e11i3w
515,"Or the ol Dark Souls Circuit. Every death is 10 Pushups, 15 Situps, 5 Burpees, 5 Squats. Git Gud or Git Swol. Either way it's a win.",Broncos,2,1574625489,e11i3w
516,It's beautiful right?,Broncos,3,1574625479,e11i3w
517,How many times can you say we’re bad?,Broncos,4,1574625478,e11i3w
518,Denver's kicker has a pretty majestic mustache.,Bills,3,1574625474,e11i3w
519,I dont care about separation i care that he has grear hands. 5 for 5 on passes thrown his way. Hes a guy allen can throw the ball up and he'll come down with it,Bills,1,1574625466,e11i3w
520,I have two family members who played professional euro soccer and pulled their hammy multiple times. They are in their 50s and cant even play tennis.  These were world class athletes with world class sports medicine and they still couldn't get it fixed.,Bills,2,1574625442,e11i3w
521,Let’s match that with a TD please. Game ain’t over yet.,Bills,1,1574625421,e11i3w
522,Watch the onside kick right here!,Bills,1,1574625400,e11i3w
523,"Alright, we avoided the shutout!

Things are so much better when you lower your expectations.",Broncos,4,1574625397,e11i3w
524,This doesn't feel like a two possession game at all,Broncos,3,1574625392,e11i3w
525,"Also something like that when gaming.  I used to do increasing pullups for ever 3 made in 2k.  So first 3, 1 pull up.  2nd, 2.  Etc etc and since I suck at that game and breaking every three point record ever, I was doing a lot of pullups every game.",Broncos,2,1574625367,e11i3w
526,Fair! I got chest day today so I'm keeping it light on the pushups,Broncos,2,1574625334,e11i3w
527,Get out of here with your logic,Broncos,1,1574625325,e11i3w
528,Brandon McManus looks like B-roll of a cop sitting at a bar trying not to look like a cop.,Bills,5,1574625320,e11i3w
529,"Hey, he made it this time",Broncos,1,1574625298,e11i3w
530,McD with the McDumbass timeout,Bills,8,1574625290,e11i3w
531,Did the Broncos just bluff us out of a Timeout?,Bills,8,1574625290,e11i3w
532,The uprights are always shaking in the Buffalo wind,Bills,1,1574625288,e11i3w
533,"That's our whole season. Just a slow creeping ""Oh God we're really bad""",Broncos,1,1574625278,e11i3w
534,"https://www.ncbi.nlm.nih.gov/pmc/articles/PMC4223289/

Hamstring strain injuries (HSI) are among the most common injuries in the active population, and are notorious for their high rates of re‐injury. In the American National Football League for example, HSIs have been reported to account for 12%1 of all primary injuries, and their recurrence rate is remarkable, at 32%.",Bills,1,1574625274,e11i3w
535,"Screw it, why not? Hahaha",Packers,1,1574625270,e11i3w
536,If you’re going to go for it on 4th maybe try to gain some yards on 3rd first,Steelers,2,1574625269,e11i3w
537,That was a pathetic pass on 3rd down,Bills,1,1574625269,e11i3w
538,I’m strait up not having a good time,Broncos,2,1574625258,e11i3w
539,I'm gonna switch the sit-ups and push-ups I think though,Bills,1,1574625246,e11i3w
540,The odds aren’t good and I’m not liking it,Broncos,4,1574625210,e11i3w
541,That was one of the worst play design/  calls I’ve ever seen,Steelers,3,1574625205,e11i3w
542,I really like phillip Lindsay's story,Bills,2,1574625178,e11i3w
543,Team agnostic also. Just whenever either happens!,Broncos,3,1574625164,e11i3w
544,"These screen plays, I swear",Broncos,6,1574625141,e11i3w
545,Will do!,Bills,3,1574625118,e11i3w
546,Yeah not a great look for us. Sorry.,Bills,6,1574625084,e11i3w
547,Not a good look Ed,Bills,5,1574625075,e11i3w
548,"Ed, what are you doing?",Bills,3,1574625073,e11i3w
549,"Yo what's up workout buddy. Try this

Score = 10 situps

Turnover and end of quarter = 15 Pushups

Sack = 5 Burpees

Flag = 5 Squats.",Broncos,7,1574625060,e11i3w
550,Hey Jets: keep winning k?,Bills,3,1574625053,e11i3w
551,Tremaine I'd a grown ass man,Bills,2,1574625046,e11i3w
552,Not ok Oliver.,Bills,3,1574625043,e11i3w
553,Bills coach looks like George-Michael when he wears that muscular body suit,AFC,1,1574625031,e11i3w
554,[deleted],,0,1574625028,e11i3w
555,Phil isn't white lol,Broncos,2,1574625022,e11i3w
556,That's a joke the guy was still fighting to get away...,,-1,1574625019,e11i3w
557,"I guess a Bills win is bad for the Raiders, so there's that",Broncos,1,1574625007,e11i3w
558,Dirty ass hit. Way late.,Broncos,2,1574624999,e11i3w
559,Very very dumb penalty to take there,Bills,2,1574624987,e11i3w
560,I’ve seen tons of Broncos stuff here and I’ve only lived here for 4 months,Broncos,1,1574624976,e11i3w
561,Lindsey isn't white though. . .,Broncos,4,1574624976,e11i3w
562,Every Bills TD I do 30 push-ups. Get me in shape guys,Bills,3,1574624957,e11i3w
563,Bills scored a TD in the third? That’s illegal.,Bills,1,1574624950,e11i3w
564,[deleted],,0,1574624938,e11i3w
565,The wind is playing db,Bills,1,1574624936,e11i3w
566,Y'all have stuffed our run game a lot this game.,Broncos,1,1574624925,e11i3w
567,I hate that shit so much. People ignore that hes had multiple 300 yard games but they only care about the passing yards,Bills,1,1574624910,e11i3w
568,Cole has a n-word pass tho,Bills,1,1574624890,e11i3w
569,"Our run defense is trash. Thank god the league is a passing league, mostly.",Bills,2,1574624881,e11i3w
570,Every RB is Frank Gore against us. Guaranteed 4 yards or more.,Bills,1,1574624878,e11i3w
571,"Don’t start sleeping, Defense",Bills,3,1574624847,e11i3w
572,The Broncos military sideline gear is on point.,Bills,4,1574624833,e11i3w
573,How many Bronco fans live on an island?,Bills,1,1574624832,e11i3w
574,I got off work at 0530 Arizona time and didn't go to bed for this lolol.,Broncos,2,1574624816,e11i3w
575,"Is it a little weird that Poyer plays special teams? Like I get that he's good at it, but still",Bills,2,1574624801,e11i3w
576,I feel so bad for you living in a literal paradise. You must have it so bad having to get up a bit early to watch football on a beach.,Bills,0,1574624796,e11i3w
577,What? No. That’s not how it works.,Bills,1,1574624750,e11i3w
578,Thats a hit right there,Bills,3,1574624747,e11i3w
579,"Damn, Poyer!!",Bills,2,1574624745,e11i3w
580,If nothing else I’ll be satisfied today if the jets hang on to there lead over the raiders,Broncos,3,1574624742,e11i3w
581,Words cannot explain how happy I am to have harlan announcing this game after what we've had. makes the sunday so much better,Bills,4,1574624728,e11i3w
582,Fuck Zuck,Bills,3,1574624688,e11i3w
583,Just play Beatsaber. It is a far better VR and Lightsaber experience and it's available on Vive.,Broncos,2,1574624687,e11i3w
584,Yea we fucked if the last few weeks adjustments are anything to base it off of.,Broncos,2,1574624665,e11i3w
585,Same but I woke up at 7:10!!!,Broncos,2,1574624649,e11i3w
586,I've never actually listened to Cole's Rap before. It's not as terrible as I had been led to believe.,Bills,2,1574624639,e11i3w
587,We got the Bills right where we want them,Broncos,8,1574624634,e11i3w
