,body,author_flair_text,score,created_utc,link_id
0,It’s funny to hear a female talk about pricks,Falcons,1,1575856776,e7wj95
1,Yeah it's outrageous,Falcons,1,1575840819,e7wj95
2,"Yea obv. Unless you were being sarcastic with your original comment, insinuating that our 2014 and 2018-2019 teams weren’t very talented which I agree with.",,1,1575840807,e7wj95
3,Meh,Panthers,1,1575840161,e7wj95
4,[removed],,1,1575839817,e7wj95
5,Why do the Saints always seem to have games like this scheduled at home?,Falcons,4,1575839793,e7wj95
6,"Bonus coverage, let's all gather around and watch the Saints hopefully lose.",Falcons,3,1575839699,e7wj95
7,Zeebs bail out the Saints.  15 feet over his head.,Falcons,4,1575839690,e7wj95
8,That wasn't very nice.,Falcons,2,1575839664,e7wj95
9,This announcing is a train wreck...,Panthers,1,1575839653,e7wj95
10,Vintage 7-9 Quinn season still in reach!,Falcons,2,1575839652,e7wj95
11,Perry and Scott Turner were obviously shit choices and apart of the problem in Carolina.,Panthers,1,1575839647,e7wj95
12,You mean those years where the team went 12-4 and 15-1? hmmmmmmmmmmmmmm,Panthers,1,1575839629,e7wj95
13,"God, Matt Ryan just has the mannerisms of a prick.",Panthers,-2,1575839609,e7wj95
14,"Schaub's coming in, you Panthers are in deep trouble now!!!",Falcons,3,1575839539,e7wj95
15,Dude 2015 and 2013 were our most talented teams,,0,1575839516,e7wj95
16,*sad trombone*,Falcons,3,1575839405,e7wj95
17,"&gt;talented rosters 


&gt;2014


&gt;2018-2019",Panthers,-1,1575839358,e7wj95
18,"Jokes on you Falcons, you will never get a good draft pick as long as you get to play us twice a year.",Panthers,7,1575839340,e7wj95
19,"A few minutes in, like I don't know after the first quarter, I was hoping you guys weren't going to hang a 50 burger on us",Panthers,1,1575839330,e7wj95
20,It’s about fucking time,Panthers,1,1575839328,e7wj95
21,"I know, I'm just as perplexed.",Falcons,1,1575839294,e7wj95
22,We can't do anything right!!,Falcons,2,1575839197,e7wj95
23,"Fewell probably wants to win so he can win the job. Grier likely isn’t going to be better, but we still want to see to be sure.",Panthers,1,1575839196,e7wj95
24,But still.,Falcons,1,1575839190,e7wj95
25,Yeah I guess rehab time would probably improve but I feel like having Cam on the sidelines might be good for team morale.,Falcons,1,1575839166,e7wj95
26,[deleted],,1,1575839125,e7wj95
27,"Also, even if by some miracle he is there when our number is up the only way Tua succeeds is if he rides the bench for a year like Mahomes.",Panthers,1,1575839084,e7wj95
28,"Well, yeah obviously. How else will we ensure we don't get a good draft pick?",Falcons,3,1575839063,e7wj95
29,lol these guys have no clue how stats/analytics are used,Panthers,2,1575839035,e7wj95
30,[deleted],,2,1575838990,e7wj95
31,"Listen to these dumbfucks. 

They also said Kyle Allen has a great arm.",Panthers,2,1575838920,e7wj95
32,Plus that hip will be compromised forever.,Falcons,2,1575838895,e7wj95
33,Probably. Falcons were like 1-7 and almost beat the Hawks with Matt Ryan's backup. With the NFC South you never know,Falcons,1,1575838857,e7wj95
34,Have you seen our O Line? Also he missed some games due to injury.,Falcons,5,1575838815,e7wj95
35,Same with the Saints,Falcons,1,1575838721,e7wj95
36,Dude I thought I read it was Freeman's first TD on the ground. Holy shit how is that even possible for an RB1 to not have a TD until this late in the season??,Falcons,5,1575838701,e7wj95
37,Tua is made of glass. No thanks,Panthers,4,1575838688,e7wj95
38,Absolutely. Tua has glass ankles and our problem is the O line.,Panthers,4,1575838650,e7wj95
39,"Get rid of kyle allen right the fuck now. Let Grier develop with some actual game experience. Our season has been over for weeks so the stakes are low, no reason to not put him in",Panthers,4,1575838622,e7wj95
40,"Seriously. At this point both teams should be able to call it a season but no, we have to finish so Vegas and fantasy football get their stats.",Panthers,1,1575838602,e7wj95
41,Why haven’t they given Will Grier a shot over Kyle Allen?,Giants,1,1575838589,e7wj95
42,SMASH THAT LIKE BUTTON,Panthers,4,1575838580,e7wj95
43,"Not saying yall will be trading Cam but if yall are top 10 in the draft and Tua is available, yall skipping over him?",Falcons,1,1575838553,e7wj95
44,Ron had 3 winning seasons out of 9 with a talented roster,,5,1575838550,e7wj95
45,There is no plan to trade Cam. It's click bait garbage by Rapoport.,Panthers,1,1575838519,e7wj95
46,Everyone remember to like and subscribe to Cam's youtube channel.,Panthers,4,1575838506,e7wj95
47,The Falcons really gonna put up 40 points in a meaningless game aren't they?,Falcons,8,1575838482,e7wj95
48,"We remember, too :D",Falcons,3,1575838469,e7wj95
49,"If the Panthers choose to have more of this instead of Cam Newton next season, it really tells you all you need to know about how they feel Cam's future is going to pan out.",Bears,1,1575838451,e7wj95
50,"Same. My first season going to college games was Cam's year at Auburn. I live in Atlanta, and love the falcon's. At the same time I really wanted to see Cam dancing on the sidelines like old times.",Falcons,2,1575838435,e7wj95
51,We aren't thinking about trading Cam. It is just a clickbait generator.,Panthers,5,1575838385,e7wj95
52,He’s rehabbing I think.  Honestly not sure.  No point to travel with the team if you can’t play.  I’d just have him rehab on game days,Panthers,1,1575838363,e7wj95
53,"Thinking about trading Cam away, just fired your HC for no reason, getting blown out by Falcons again, wtf happened lol?",NFL,3,1575838315,e7wj95
54,We were putrid with Keanu Neal.,Falcons,0,1575838275,e7wj95
55,"Okay so let me get this straight: you fire the head coach who is without arguably the centerpiece of his scheme and what has made him so successful, plan to trade said centerpiece who has won you mannnny games over the years, largely ignore the best workhorse in the NFL that you have at RB, and then kick a field goal when you're down 23 with 7 minutes left in the game?  

Holy shit, sorry Carolina bros",Bills,2,1575838267,e7wj95
56,I remember you guys were the 1 in the 15-1,Panthers,6,1575838174,e7wj95
57,I highly doubt it.,Panthers,5,1575838073,e7wj95
58,The wet swish of a basketball is up there too,Falcons,2,1575838072,e7wj95
59,"Nah, we will for no reason at all beat them.",Panthers,2,1575838039,e7wj95
60,A fucking field goal?!? This team is nauseating,Panthers,3,1575838031,e7wj95
61,i would too,Panthers,1,1575838019,e7wj95
62,"Idk why it is but for some reason we tend to play the Panthers really, really well regardless of how good either team is.",Falcons,7,1575838019,e7wj95
63,Yeah they need three scores... with 2  2pt conversions... you can't go for 3 here.,Falcons,2,1575838004,e7wj95
64,our interim about to be fired as well,Panthers,1,1575837999,e7wj95
65,We got the Seahawks next week. They are going to eat us alive.,Panthers,1,1575837987,e7wj95
66,love our redzone offense so much,Panthers,2,1575837975,e7wj95
67,Kyle Allen literally just gave up.,Panthers,2,1575837967,e7wj95
68,"FG atttempt.  ""I give up.""",Falcons,3,1575837940,e7wj95
69,I think in the spring there is a lingerie league of womens football. So thats something.,Panthers,1,1575837913,e7wj95
70,"excuse me, it's the Aints",Panthers,1,1575837889,e7wj95
71,[deleted],,1,1575837889,e7wj95
72,i couldn't give a fuck if we score,Panthers,2,1575837800,e7wj95
73,Because neither team matters to the playoffs or the current meta.,Falcons,5,1575837753,e7wj95
74,2015 was fine. Problem is we average 9 offensive linemen injuries a season.,Panthers,1,1575837752,e7wj95
75,I can't wait until the XFL starts so I can root for a real team.,Panthers,3,1575837708,e7wj95
76,Pillow fight doubleheader.,Falcons,6,1575837700,e7wj95
77,"He may be the NFL's wealthiest owner, but he looks like the bomb guy from die hard 3",Panthers,2,1575837646,e7wj95
78,Wow I just realized we play you guys in basketball today too,Panthers,1,1575837640,e7wj95
79,Every other game thread in r/NFL is in the thousands of comments. We aren't even at 400 here.,Panthers,5,1575837634,e7wj95
80,Damnit take my upvote,Panthers,1,1575837628,e7wj95
81,Wealthiest man in the world and can't buy a win against the lowly Falcons.,Falcons,-1,1575837609,e7wj95
82,"Nah, the sweet spot of a wooden bat hitting a ball is the best.",Panthers,2,1575837580,e7wj95
83,there's field mics right next to them,Panthers,2,1575837577,e7wj95
84,Get fucked nfl. We have the wealthiest owner.,Panthers,4,1575837564,e7wj95
85,Damn are the posts mic'd up or are they really that loud?,Panthers,1,1575837539,e7wj95
86,"IT'S Young **HOE**, PUT SOME FUCKING RESPECT IN THE NAME",Panthers,6,1575837521,e7wj95
87,He should've been benched when didn't even throw it up for grabs last week at the end.,Falcons,2,1575837502,e7wj95
88,"Maybe I'm weird, but the ""DOINK"" of a football bouncing off the uprights and still going in is probably the most SATISFYING sound effect in sports.",Falcons,3,1575837496,e7wj95
89,"Out of all games, this is the one I had to attend",Panthers,1,1575837458,e7wj95
90,Young hoe forever! &lt;3,Falcons,6,1575837457,e7wj95
91,Moving on up that draft board and pushing the falcons down. Just as planned.,Panthers,1,1575837448,e7wj95
92,Time to fire more people Mr. Tepper,Panthers,1,1575837437,e7wj95
93,Kyle Allen is doo doo,Panthers,1,1575837425,e7wj95
94,The media hates Cam Newton. All the commentators get erections every time they talk shit about Cam.,Panthers,5,1575837331,e7wj95
95,Man I wish I tracked all the Kyle Allen media pushfrom a month ago,Panthers,2,1575837254,e7wj95
96,Fucking yes it's his fault.,Panthers,9,1575837238,e7wj95
97,I expect nothing and I’m still disappointed.,Panthers,2,1575837191,e7wj95
98,am I going to get drunk at noon? looks like it,Panthers,1,1575837186,e7wj95
99,So I'm not watching the game but I see Kyle Allen isn't doing so hot. Is it his fault?,,2,1575837186,e7wj95
100,Not much. He struggles against good teams.,Falcons,2,1575837177,e7wj95
101,We don't. The media does.,Panthers,6,1575837163,e7wj95
102,"god no, those are just rumors",Panthers,4,1575837144,e7wj95
103,Hey I know it's been a pretty horrendous season for most of us in the NFCS but I do appreciate you fine folks beating the brakes of Allen for us. Respect.,Panthers,1,1575837142,e7wj95
104,"For real. Playoff hopes are all but gone, give Grier some real playing time if you’re trying to develop him into a starter.",Panthers,1,1575837142,e7wj95
105,Literally?,Falcons,2,1575837123,e7wj95
106,That happened like 7 games ago.,Panthers,1,1575837122,e7wj95
107,Damn this is painful to watch Lmaoooo. I think imma go smoke some ribs and enjoy the rest of my Sunday haha.,Panthers,4,1575837115,e7wj95
108,https://i.imgur.com/enVrxzQ.jpg,Panthers,1,1575837113,e7wj95
109,[deleted],,1,1575837082,e7wj95
110,You want to get rid of cam for this guy!,Falcons,2,1575837071,e7wj95
111,HOT TAKE: This game proves that Allen is not the answer.,Jets,2,1575837066,e7wj95
112,LMAO. Allen is fucking unreal.,Panthers,1,1575837060,e7wj95
113,Kyle Allen being the nicest bro after hearing the Cam trade rumors.,Eagles,3,1575837059,e7wj95
114,I was just thinking the same thing,,3,1575837050,e7wj95
115,WE WANT GRIER,Panthers,2,1575837050,e7wj95
116,"Same for ""Hotlanta"".  No one in Atlanta actually says that.",Falcons,5,1575837047,e7wj95
117,Allen is god awful.,Falcons,1,1575837023,e7wj95
118,Wtf I love the Panthers now,Falcons,1,1575837022,e7wj95
119,Okay. Put in Grier. I just don't care anymore.,Panthers,2,1575837021,e7wj95
120,alright lets see what Grier has,Panthers,2,1575836996,e7wj95
121,[removed],,1,1575836976,e7wj95
122,WE WANT GRIER and a better oline,Panthers,2,1575836970,e7wj95
123,"I don't think I've ever heard someone say ""I-85 rivalry"" other than national broadcasters",Panthers,8,1575836950,e7wj95
124,We literally own the Carolina Panthers.,Falcons,1,1575836941,e7wj95
125,I'm so glad we spent a 3rd on Will Grier,Panthers,3,1575836906,e7wj95
126,True,Panthers,1,1575836822,e7wj95
127,Our O-line has been an issue since we ran Gross off,Panthers,2,1575836637,e7wj95
128,That makes a lot more sense than him not coming out. Didn’t know that.,Falcons,1,1575836628,e7wj95
129,How much fun would Takk be on a decent defense,,1,1575836605,e7wj95
130,FUCK ALLEN,Panthers,2,1575836580,e7wj95
131,PUT IN GRIER,Panthers,2,1575836574,e7wj95
132,Cancel the rest of the season,Panthers,2,1575836552,e7wj95
133,"Ohhhh

Nah, he just had surgery like yesterday or Friday I think.",Panthers,1,1575836511,e7wj95
134,"This ref is friggin cut.

That's a svelte old dude.",Panthers,2,1575836491,e7wj95
135,You know the Panthers have given up when Vic Beasley is living in the backfield,,1,1575836486,e7wj95
136,Nice,Panthers,3,1575836457,e7wj95
137,Carolina getting Koo’d.,Jaguars,2,1575836447,e7wj95
138,"We lost Cam which was a bigger deal than /r/NFL wants to admit. We lost KK Short so our run defense went to hell. 

Ron Rivera foolishly changed us from a 4-3 to a 3-4 so there are aches and pains from that. 

Our o-line has been terrible all season long.",Panthers,4,1575836441,e7wj95
139,"Ummm, we didn’t have our QB1...",Panthers,1,1575836440,e7wj95
140,That mans Olamide Zaccheaus. Put some respect on the name,,1,1575836428,e7wj95
141,"Remember though that Carolina’s first-string coach is out this week.  Once he comes back, the Panthers should improve.",Eagles,6,1575836409,e7wj95
142,You. Cam. DO IT! [🙌🙌](https://media0.giphy.com/media/3o6ZteduZDJv64UL9m/giphy.gif?cid=790b7611dc657fc555acbaf6f87e127a1a60eb0da5b9ecae&amp;rid=giphy.gif),Panthers,1,1575836406,e7wj95
143,My old hoe crazy but my Younghoe Koo,,6,1575836356,e7wj95
144,So are we!  Yea!!!!,Falcons,2,1575836355,e7wj95
145,ha good one,Panthers,1,1575836348,e7wj95
146,How did Carolina go to so much shit in one year? Damn,Cowboys,2,1575836336,e7wj95
147,CUZ YALL ALL EN BRO,Falcons,3,1575836320,e7wj95
148,"I hate this season. Cut Dortch, cut Kyle Allen. This is all some bullshit.",Panthers,5,1575836308,e7wj95
149,"Knew he was out, thought he might still be traveling with the team though.",Falcons,3,1575836300,e7wj95
150,This Saints 49ers game is wild,Falcons,3,1575836290,e7wj95
151,"legtimate question, why don't we put Grier just to see what he can do?",Panthers,3,1575836288,e7wj95
152,"I WANT A NICE YOUNGHOE, KOO",Falcons,2,1575836281,e7wj95
153,"It was a while ago, I’m over it now. But thanks, that’s very kind of you!",Panthers,1,1575836263,e7wj95
154,Has he not been traveling with the team?,Falcons,1,1575836263,e7wj95
155,Best 3-9 team out there,,1,1575836209,e7wj95
156,I wish my name was Younghoe,Cardinals,4,1575836180,e7wj95
157,Ryan just broke that camera lol,Panthers,2,1575836161,e7wj95
158,That’s just really sad :(,Panthers,1,1575836155,e7wj95
159,God I love when kickers get hyped.,Patriots,3,1575836133,e7wj95
160,Bout to buy one.,Falcons,4,1575836133,e7wj95
161,"If it makes you feel better, my dad left my mom during my finals senior year.",Panthers,1,1575836118,e7wj95
162,David Tepper is calling his bank right now to see if he can cancel his purchase,Panthers,3,1575836117,e7wj95
163,This would be comical if it weren't against the Falcons. Now it's just sad.,Panthers,1,1575836113,e7wj95
164,"This game is amazing lmao, all Ryan haters can get fucked.",Falcons,4,1575836106,e7wj95
165,"So, basically a walk-on rando just gave MR his career-long and immediately after our new kicker gets a fumble recovery.",Falcons,7,1575836094,e7wj95
166,If I was a Falcons fan there's no way I wouldn't have a Koo jersey,49ers,12,1575836081,e7wj95
167,holy shit that was like 51 or 52 air yards for the TD pass.,Falcons,2,1575836076,e7wj95
168,"We're going to finish 5-11, aren't we?",Panthers,2,1575836068,e7wj95
169,That’s my kicker,Falcons,7,1575836062,e7wj95
170,Koo was gonna try and return it too.,Falcons,12,1575836052,e7wj95
171,It’s cool guys we’re just trying to get a better draft pick,Panthers,2,1575836047,e7wj95
172,Bal hok koo,Falcons,3,1575836046,e7wj95
173,YOUNGHOE OUT HERE WILDIN,Falcons,18,1575836018,e7wj95
174,a real comedy of errors,Panthers,3,1575836008,e7wj95
175,Damn let’s put another 7 up!,Falcons,5,1575835978,e7wj95
176,"I don't think you need to hope for that hahahahahahaha

Kill me",Panthers,1,1575835962,e7wj95
177,"I didn't want us to win, but if we're gonna win at least it's going to be enjoyable lmao.",Falcons,4,1575835938,e7wj95
178,Are Falcons fans just now realizing Cam is out for the year?,Panthers,2,1575835930,e7wj95
179,"Welp. I’m gonna go study for my last college final ever.

It’s been real, hopefully we lose out the rest of the season",Panthers,2,1575835922,e7wj95
180,No riverboat ron or cam... yeah....,,1,1575835917,e7wj95
181,Well that's embarrassing as fuck lol,Panthers,2,1575835894,e7wj95
182,Damn it I love our passing game when it actually plays as well as it should,Falcons,2,1575835881,e7wj95
183,Lmao,Panthers,2,1575835879,e7wj95
184,"Eat dirt Donte

that was fucking awful",Panthers,2,1575835878,e7wj95
185,Haha who even is that,Falcons,3,1575835870,e7wj95
186,Fucking hang me,Panthers,1,1575835861,e7wj95
187,hahaha we suck,,1,1575835845,e7wj95
188,No,Panthers,1,1575835837,e7wj95
189,Just out of hand now.  Yikes,Panthers,1,1575835814,e7wj95
190,Is Cam Newton at this game? I’m in the stadium and I haven’t seen anything suggesting he is.,Falcons,1,1575835697,e7wj95
191,.... by turning his head and not standing there staring at one side of the field from the moment he gets the ball? Literally the way 95% of the QBs in the NFL are aware when the protection on their blind side fails?,Panthers,1,1575835470,e7wj95
192,"They keep cutting to commercial before the replay is really over.  When they were showing Allen’s fumble, the cut before the recovery.",,1,1575835408,e7wj95
193,The announcer even said it today. It's absurd.,Panthers,1,1575835336,e7wj95
194,"Yeah, maybe hold the ball closer you your chest so you can fall on it, I can see that.",Panthers,1,1575835312,e7wj95
195,"He was hit directly behind him, how could he see the defender coming?",Panthers,1,1575835273,e7wj95
196,"You can definitely avoid fumbling.  The sack, maybe not",Panthers,1,1575835153,e7wj95
197,Well sticking with Allen would accomplish that,Panthers,2,1575835141,e7wj95
198,I fucking hope not!  Another failed season next year and a rebuild will suck.  Waste of CMC smh,Panthers,1,1575835109,e7wj95
199,People are still saying he has an arm,Panthers,1,1575835104,e7wj95
200,Don’t pay attention to it.  It’s just Rapsheet speculation again.  There has been no word or change from the team since a month ago.,,2,1575835003,e7wj95
201,Move.,Panthers,1,1575834992,e7wj95
202,Big if true!,Panthers,1,1575834966,e7wj95
203,I had one in 2002 and loved it,Panthers,1,1575834854,e7wj95
204,[removed],,1,1575834848,e7wj95
205,Thank you!,Falcons,1,1575834824,e7wj95
206,"I used to drive an f150 and hate kyle allen.

Don’t hate on a great truck",Panthers,1,1575834803,e7wj95
207,For real.  I like 9ers and Panthers.  I should watch that lol,Panthers,1,1575834773,e7wj95
208,"🎶They tried to get me to go to rehab but I won’t go, go, go🎵",Panthers,1,1575834720,e7wj95
209,How was he supposed to even prevent that?,Panthers,0,1575834690,e7wj95
210,Wait who's saying we should trade Cam and stick with Kyle Allen? I thought it was trade Cam and tank for a year to draft a QB #1 overall.,Panthers,1,1575834690,e7wj95
211,"And there is a report saying we are open to trading Cam?  Are you fucking kidding me?!!


Come on man!  fml",Panthers,8,1575834628,e7wj95
212,I'm glad I can watch this game without any hopes or expectations,Panthers,1,1575834601,e7wj95
213,That’s what she said.,Falcons,2,1575834590,e7wj95
214,Lies. Utter lies.,Falcons,3,1575834567,e7wj95
215,Harder next time!!,Panthers,1,1575834536,e7wj95
216,[removed],,0,1575834529,e7wj95
217,"LOL.

Zero pocket awareness. Guy is a fucking scrub

So is our LT",Panthers,4,1575834528,e7wj95
218,Vic Beasley got a sack?!?!,Falcons,4,1575834523,e7wj95
219,"No, he is in rehab.",Panthers,2,1575834504,e7wj95
220,No,Panthers,1,1575834486,e7wj95
221,It's not Samuel's fault Allen can't hit him in stride.,Panthers,1,1575834480,e7wj95
222,Please won't somebody fade me,Panthers,3,1575834477,e7wj95
223,Kyle Allen fumbled again. What's new?,Panthers,2,1575834476,e7wj95
224,#PaNtHeRs ShOuLd TrAdE cAm,Panthers,5,1575834474,e7wj95
225,Why is Jennifer Aniston doing sideline reporting?,Falcons,1,1575834393,e7wj95
226,"With these top plays commercials, I can't even avoid Collinsworth's obnoxious ass voice watching Fox broadcasts",Panthers,1,1575834194,e7wj95
227,"Minor nitpick.  Their feet got tangled.

Either way, no DPI.",Panthers,1,1575834099,e7wj95
228,"Right now we're winning with the most sucky ass game, with our game thread only having 210 comments. Close behind us is the Jets/Dolphins game at 221 comments.",Panthers,2,1575833734,e7wj95
229,"I'm at the game, and I can't spot Cam. Is he here?",Falcons,2,1575833686,e7wj95
230,"I wish I didn't care about this game so I could watch the 9ers Saints, that game looks amazing.",Panthers,3,1575833510,e7wj95
231,Use all 3 timeouts. Who gives a shit?,Panthers,1,1575833484,e7wj95
232,Garbage tier time management by Matt Ryan,Panthers,0,1575833451,e7wj95
233,Nice of Fox to immediately cut away from that facemask on Burns as soon as they noticed it,Panthers,5,1575833444,e7wj95
234,Not at all. Just funny seeing such an obvious effect that doesn't appear on his stat line.,Panthers,1,1575833405,e7wj95
235,The panther's secondary is obsessed with making Calvin Ridley look amazing.,Panthers,1,1575833358,e7wj95
236,Let's not get too crazy,Panthers,1,1575833228,e7wj95
237,Can you blame the defense?,Panthers,2,1575833221,e7wj95
238,Yup. Good no-call.,Panthers,1,1575833146,e7wj95
239,Mccaffery took 4 defenders with him on with the play action on the touchdown pass.,Panthers,2,1575833140,e7wj95
240,Goal line scores are legal? Next you're gonna tell me you're allowed to have back to back winning seasons.,Panthers,2,1575833134,e7wj95
241,"So if this is the norm for Thomas, I feel a little more comfortable when Greg decides to go",Panthers,2,1575833124,e7wj95
242,"If Olsen does hang them up next year, I'm pretty content with us moving forward with Thomas as our TE1. He was my favorite pick in 2018.",Panthers,2,1575833121,e7wj95
243,Yeah on replay you can tell he just fell lol,Falcons,0,1575833104,e7wj95
244,We're gonna pass twice and ignore CMC and then kick a field goal.,Panthers,1,1575833041,e7wj95
245,oh wow we got a touchdown in the redzone!,Panthers,1,1575833034,e7wj95
246,Yall crazy. No dpi there. If thats dpi then football is done for.,Panthers,3,1575833020,e7wj95
247,In the slow mo replay you can see he fell himself,Falcons,5,1575832979,e7wj95
248,Should have been interference there. Also fuck Atlanta,Panthers,-2,1575832944,e7wj95
249,Hmmmm so you can DPI if you just look at the ball right before you tackle the receiver,Panthers,1,1575832920,e7wj95
250,[deleted],,0,1575832900,e7wj95
251,Yeah. Year of the Pickle.,Panthers,1,1575832836,e7wj95
252,Was that the year we went through 4 or 5 quarterbacks?,Panthers,1,1575832783,e7wj95
253,If we get rid of Cam this off season it means we're putting all our chips in Tank for Trevor next year.,Panthers,2,1575832771,e7wj95
254,It would be 2010 over and over and over and over.,Panthers,1,1575832700,e7wj95
255,How does CMC always make the first guy miss? Every. Single. Time.,Panthers,2,1575832662,e7wj95
256,"This looks so bad, if we get rid of Cam we're going to be a losing team for a long, long time",Panthers,2,1575832652,e7wj95
257,Please no injuries. Bless the knees. This game is not important enough for anyone to get injured.,Panthers,2,1575832635,e7wj95
258,Oh no. I jinxed Luke 😞,Panthers,2,1575832630,e7wj95
259,We need line help waaaayyyyyy more. We need iOL and iDL desperately. I hope we go line heavy in this draft.,Panthers,1,1575832614,e7wj95
260,Agreed. And also draft a corner in rd 2,Panthers,2,1575832538,e7wj95
261,Julio eats our lunch every year.,Panthers,1,1575832498,e7wj95
262,Chase Young szn boys....,Falcons,1,1575832485,e7wj95
263,Luke gonna fuck around and get 20 tackles,Panthers,1,1575832479,e7wj95
264,"Maybe if the Falcons start to blow us out enough, Fox might end our misery by switching to the 49ers/Saints game",Panthers,2,1575832454,e7wj95
265,Move us back to where he went down then tack on the 15 yards for the facemask on the second tackle,Falcons,1,1575832405,e7wj95
266,"I don't get why people have been shitting on Peloton's elitism and positioning... it's a premium product, no shit it's for wealthy people. What I do understand is people shitting on them for that one weird ad campaign with the lady who gets it as a gift.",Panthers,3,1575832399,e7wj95
267,"Right? I guess people are just upset and venting, but you shouldnt be surprised when this team is bad with the injuries we have.",Panthers,2,1575832331,e7wj95
268,what a Matt Ryan interception,Falcons,1,1575832301,e7wj95
269,Give our o-linemen time. Wouldn't call them busts yet. We'll see next season.,Falcons,1,1575832283,e7wj95
270,"Yeah we suck now, but the future always matters",Panthers,1,1575832268,e7wj95
271,Good recovery and pursuit by CMC. I swear he is perfect at football.,Panthers,1,1575832248,e7wj95
272,That's rough lol,Panthers,1,1575832222,e7wj95
273,"We've had our fair share of that over on r/falcons, too.",Falcons,1,1575832221,e7wj95
274,Lol ive considered us faded for like 3 weeks now.,Panthers,1,1575832212,e7wj95
275,Why? What are we expecting?,Panthers,1,1575832177,e7wj95
276,Of course one of Allen's best throws ends up as an INT. This season's hilarious in a soul crushing way,Panthers,2,1575832171,e7wj95
277,"Well, I guess that’s why we didn’t play him more.",Panthers,1,1575832171,e7wj95
278,We really about too make our draft stock worse.,Falcons,1,1575832166,e7wj95
279,Lol fucking fade us,Panthers,1,1575832149,e7wj95
