,body,author_flair_text,score,created_utc,link_id
1647,Something we agree on,Chiefs,1,1576436228,eb1r02
1648,"All these broncos fans saying this isn’t a fun game..

I’m enjoying this game",Chiefs,8,1576436228,eb1r02
1649,The common denominator is that broadcast television blows.,Chiefs,1,1576436226,eb1r02
1650,"I feel like it's not enough snow, makes the injuries more prevalent than if they were playing on clouds of snow.",Chiefs,1,1576436223,eb1r02
1651,"Dafuq?

Kittle has an argument, but to flat out say Kelce isn't the the best TE in the game is fucking stupid.",Chiefs,3,1576436219,eb1r02
1652,"It's gotta be frustrating after watching the No Fly Zone.

Which is why KC is nice and just sucks against the run every year. That way we all know what to expect.",Chiefs,1,1576436215,eb1r02
1653,NO IT ISN'T.,Broncos,1,1576436207,eb1r02
1654,Well according to recent news the Hallmark channel might be more up your alley.,,1,1576436199,eb1r02
1655,"""He is the best in the game"" woah hold on there might be 49ers fans around here",Chiefs,18,1576436190,eb1r02
1656,"Happy to host a couple of big Derrick Thomas fans at Arrowhead. Welcome to mecca, Drew Lock and Von Miller.",Chiefs,4,1576436187,eb1r02
1657,"The field is heated Foutts. The turn isn’t frozen. 

Idiot.",Chiefs,6,1576436187,eb1r02
1658,Well this isn't quite as much fun as I wanted it to be.,,1,1576436172,eb1r02
1659,"Damn, players dropping like flys out here",Chiefs,3,1576436172,eb1r02
1660,Obviously you’re not a golfer.,Chiefs,1,1576436161,eb1r02
1661,Darwin Thompson looking solid again,Chiefs,3,1576436158,eb1r02
1662,"Love Kelce but he's not the best TE in the game.

edit: He heard me, lol.",Chiefs,-14,1576436155,eb1r02
1663,"Snow good.

Injuries bad.",Chiefs,10,1576436150,eb1r02
1664,Shit we’re too close again,Chiefs,3,1576436149,eb1r02
1665,"Trying to watch this game and also scroll through the hilarious comments in the Pat's cheating thread, I need more eyes!",Saints,2,1576436146,eb1r02
1666,Awesome that Watkins (knock on wood) has played a mostly healthy season so far. Always been great and talented and its great to see him getting some clout this season,Chiefs,2,1576436145,eb1r02
1667,DTRAIN!!!!!,Chiefs,1,1576436142,eb1r02
1668,Man I hate Patrick Mahomes so much,Broncos,-1,1576436139,eb1r02
1669,"I just want us to do one thing right, pls.",Broncos,1,1576436135,eb1r02
1670,"Ian Eagle calls it a ""loft""

Dan Fouts calls it a ""line drive fastball""

Well which is it, guys?",Chiefs,5,1576436135,eb1r02
1671,Hill is almost off sides two plays in a row where he lined up,Chiefs,-1,1576436133,eb1r02
1672,The snow forces you to play zone and that’s mahomes specialty.,Cowboys,2,1576436117,eb1r02
1673,"""He is the best in the game.""

I'm told by 9er fans that NO ONE but Chief fans say Kelce is the best TE in the game.",Chiefs,15,1576436111,eb1r02
1674,Not very observant and/or depends on how long ago that was.,Broncos,2,1576436107,eb1r02
1675,"Lol what secondary?

FML",Broncos,1,1576436103,eb1r02
1676,New England is purposefully losing 10-7 to the Bengals to convice everyone that they didn't cheat to beat the Bengals.,Broncos,3,1576436094,eb1r02
1677,Our secondary is a joke,Broncos,4,1576436087,eb1r02
1678,"104 sacks, 2011 AP Rookie DPOY, 2015 SB MVP, 3x AP All-Pro 1st team, 4x AP All-Pro 2nd team. He's probably in if he doesn't play another snap.",Chiefs,1,1576436082,eb1r02
1679,Who is this Sammy Watkins guy?,Chiefs,1,1576436080,eb1r02
1680,A walrus in his natural habitat...,Chiefs,2,1576436061,eb1r02
1681,It's like the broncos are playing in bowling shoes.,Broncos,5,1576436045,eb1r02
1682,Mahomes is distributing the ball really well today. Everyone getting involved.,Chiefs,6,1576436044,eb1r02
1683,Big Shelb,Broncos,1,1576436037,eb1r02
1684,"2nd that. As much as I hated the Chargers playing against him, dude is legit and his super bowl performance spoke for itself.",Chargers,2,1576436031,eb1r02
1685,You're doing the lord's work,Chiefs,5,1576436023,eb1r02
1686,"On one hand, Denver should be excited to see how Lock plays when they're behind.

On the other hand, you can't really evaluate much of anything in this weather

On the other, other hand, fuck Denver.",Chiefs,11,1576436021,eb1r02
1687,"I’d say keep it up! I’m not superstitious, but I am a little stitious.",Chiefs,5,1576436020,eb1r02
1688,Old white people dying so they are angling for old minorities now too.,Ravens,3,1576436013,eb1r02
1689,SHELBY,Broncos,1,1576436009,eb1r02
1690,"The big thing with rookies is confidence. The Texans allowed a rookie to get confidence and if a rookie gunslinger feels like he’s playing with house money, you could be in for a very bad time. Get them in their heads and they will look like rookies.",Chiefs,2,1576436009,eb1r02
1691,The camera angle on that punt was awesome. They need to show that more,Steelers,2,1576435968,eb1r02
1692,"The Pats may be struggling at this point in the season, but no one could or should be surprised if they manage to somehow churn out another SB appearance.  God I hate the fucking Patriots.",Broncos,3,1576435965,eb1r02
1693,CBS promoting two shows that primarily feature interracial relationships so you know how progressive they are.,Broncos,4,1576435962,eb1r02
1694,LETS GO BENGALS *clap clap clapclapclap*,Jets,2,1576435961,eb1r02
1695,Not really. The dude is good at football. I prefer this to Baker commercials,,1,1576435941,eb1r02
1696,"""Wadman didn't get all of that one""

Yes he did",Broncos,1,1576435917,eb1r02
1697,"Please stop with the dumb camera angles, CBS",Broncos,1,1576435907,eb1r02
1698,its cuz all the pats fans are in their own game thread every timeslot where they arnt playing is toxic,Chiefs,1,1576435898,eb1r02
1699,Lock is starting to show his rookieness.,Broncos,3,1576435895,eb1r02
1700,Keep ‘em coming bud! Love the updates!,Chiefs,3,1576435893,eb1r02
1701,We keep going and we will be signing guys off the street to START on our defense for the playoffs...,Chiefs,1,1576435888,eb1r02
1702,"Where do people live in and around Denver? When I was a kid, we drove through on I-70 and I only remember driving past downtown and it just seemed like a dense collection of buildings on some flat ground that came before the mountains and that was it. I don't remember seeing anything else around that collection of buildings. Looking out, all I saw was plains and a big airport.

Was 12 year old me not very observant?",Chiefs,2,1576435887,eb1r02
1703,Can’t afford to lose Thornhill. Dudes been balling out hopefully just a stinger,Chiefs,8,1576435876,eb1r02
1704,"I think we can all agree, that this game is not as important as Bengals winning over Patriots is.",Chiefs,5,1576435873,eb1r02
1705,We don't get enough shit for drafting him then letting another team claim him off waivers,Panthers,1,1576435869,eb1r02
1706,Ayy I agree with this.,Broncos,1,1576435866,eb1r02
1707,[deleted],,1,1576435865,eb1r02
1708,And a RT.,,1,1576435861,eb1r02
1709,"Since the Chiefs can't put away the competition, I expect it to degrade in the 4th.",,1,1576435856,eb1r02
1710,"“How’d you do that Russ?!”

Lockett- :’/",Chiefs,2,1576435848,eb1r02
1711,I think everyone is trying to spread a little Christmas cheer.,Chiefs,2,1576435845,eb1r02
1712,"🚨🚨 Update: 10-7 Bengals over the Pats. Pats just went for it on 4th, Bengals take the ball near mid-field 🚨🚨

(*if this is annoying, I understand, but when Bengals tied the game I posted the update here and they've been doing great things since and I feel like a superstitious good luck charm that can will a Bengals win over the Pats into existence*)",Chiefs,22,1576435840,eb1r02
1713,So they removed the “champ is heeah” song from the commercial?,Chiefs,2,1576435839,eb1r02
1714,Hes gonna be doubled every time,Chiefs,1,1576435823,eb1r02
1715,Honestly I'd rather lose the game than lose Thornhill. He's been a stabilizing player for this defense.,Chiefs,9,1576435783,eb1r02
1716,I expect nothing at all but the lowest of the low from Raiders fans... That's why I said someone has already talked shit for something so small.,Broncos,1,1576435779,eb1r02
1717,"UCCCCCCCCCCCCCCHHHHHHHHHHHHHHHHH

We turned back into the Broncos again. Why do we keep doing that??",Broncos,-2,1576435775,eb1r02
1718,"I think both fan bases know what's up. They are in the playoffs, we aren't, and most importantly, it's a snow game and everyone loves a snow game!",Broncos,4,1576435774,eb1r02
1719,Anyone else getting tired of these Amazon commercials straight sucking Russell Wilson off?,Steelers,0,1576435772,eb1r02
1720,We may win this game but not without cost... That's 2 defensive players down now,Chiefs,8,1576435768,eb1r02
1721,That was a hard collision.,Chiefs,7,1576435768,eb1r02
1722,He looks hurt. Bad. Repeatedly clenching his hand and not adjusting the awkward position he was lying in are bad signs.,Chiefs,1,1576435764,eb1r02
1723,2 Legit 2 Quitt,Chiefs,3,1576435764,eb1r02
1724,"Fuck. Thornhill has been awesome the past few weeks too, would be tough to lose him",Chiefs,10,1576435756,eb1r02
1725,"Fuck, more injuries",Chiefs,9,1576435747,eb1r02
1726,I hope this upcoming draft has some good guards and a LT.,Broncos,2,1576435745,eb1r02
1727,Juan got his clock cleaned :-/,Chiefs,2,1576435745,eb1r02
1728,"Oh no, not another one :(",Chiefs,4,1576435739,eb1r02
1729,He's a pretty good dude.,Chiefs,1,1576435738,eb1r02
1730,We objectively suck.,Broncos,1,1576435732,eb1r02
1731,"jesus, that looked like a rough hit, friendly fire.",Saints,7,1576435717,eb1r02
1732,Fuck Elijah Wilkinson SO hard.,Broncos,3,1576435707,eb1r02
1733,Oh fuck. Thornhill...,Chiefs,6,1576435706,eb1r02
1734,Well that Raiders fans for you.  What do you really expect?,Chiefs,2,1576435702,eb1r02
1735,This thread... Is far less saltier than I imagined it would be.,Broncos,3,1576435695,eb1r02
1736,"4th &amp; 4 CIN 35 
11:24 
T.Brady pass incomplete short middle to M.Sanu Sr..",Ravens,4,1576435691,eb1r02
1737,These backups are killing me,Broncos,1,1576435662,eb1r02
1738,Should be kelce zone,Chiefs,3,1576435648,eb1r02
1739,gonna keep nominating him till he wins,Chiefs,9,1576435638,eb1r02
1740,Yes.,Chiefs,1,1576435636,eb1r02
1741,Maybe I'll donate to Andy Dalton's charity if they knock Pats off.   Helps Chiefs 1st round bye chances.,Chiefs,1,1576435629,eb1r02
1742,Yes.,Broncos,7,1576435619,eb1r02
1743,"Correct me if I'm wrong, but hasn't Colquitt been very consistently our Man of the Year candidate.",Chiefs,13,1576435598,eb1r02
1744,Now OKAFOR is out. damnit.,Chiefs,3,1576435555,eb1r02
1745,I'd make an argument for him.  I think he's done enough in his career for that honor.,Chiefs,6,1576435552,eb1r02
1746,"yes, he just needs to play out his career and he’s in",Broncos,5,1576435542,eb1r02
1747,They said chest. He fell awkwardly.,Chiefs,2,1576435540,eb1r02
1748,Raiders fans have talked much more shit for far less.,Broncos,15,1576435530,eb1r02
1749,Shouldn't they already be pissed off? They lost 2 straight,Chiefs,1,1576435525,eb1r02
1750,Something definitely looked wrong after that sack he had.,Chiefs,2,1576435505,eb1r02
1751,My god Margot Robbie in the movie....SHEEESH,Broncos,4,1576435498,eb1r02
1752,"No, I don't agree with you.  You're a salty Bronco.",Chiefs,0,1576435493,eb1r02
1753,This should be where Watkins feasts but he disappears randomly.,Chiefs,2,1576435484,eb1r02
1754,What happened?,Chiefs,2,1576435481,eb1r02
1755,Yep. Fuck em. I want the home playoff game.,Chiefs,3,1576435480,eb1r02
1756,Did he get hurt on the sack?,Chiefs,2,1576435479,eb1r02
1757,Except that was the kind of hit that the rule is designed to protect against. It wasnt international but it was forceful.,Chiefs,0,1576435477,eb1r02
1758,Shoulder? Looked awkward,Chiefs,2,1576435473,eb1r02
1759,Is Von Miller a hall of famer?,Chiefs,4,1576435462,eb1r02
1760,"It doesn't matter if the defender didn't kill him, you still can't hit the face.  I don't know what you don't understand about that. lol  Sit down.",Chiefs,0,1576435453,eb1r02
1761,I will always have respect for Von.  He's such a great player and an even better person.  He does so much for the community around Denver.,Chiefs,8,1576435440,eb1r02
1762,Okafor ruled out :(,Chiefs,4,1576435389,eb1r02
1763,We were about 10 yards too close to score,Chiefs,7,1576435388,eb1r02
1764,"I was ready to shit talk, but I realized that nobody in history has likely ever talked shit after a 2nd quarter field goal

That said; suck a cock Denver",Chiefs,28,1576435368,eb1r02
1765,https://i.imgur.com/NizKItK.jpg,Chiefs,2,1576435366,eb1r02
1766,"If you're pissed and suck, you still suck.",Chiefs,4,1576435362,eb1r02
1767,Doesnt really matter what qualifiers you put on he is indeed amazing,Chiefs,1,1576435361,eb1r02
1768,[deleted],,1,1576435361,eb1r02
1769,Butker is a god,Chiefs,5,1576435341,eb1r02
1770,"The Chiefs are so bad in the RedZone and it's gonna bite them in the postseason.

But I'll give them a pass this game",Chiefs,5,1576435337,eb1r02
1771,"My streams a little late but s/o to Mr. Von Miller for the good sportsmanship helping Mahomes up. Real recognize real, and I respect that a lot.",Chiefs,20,1576435329,eb1r02
1772,"No, luck retired.",Chiefs,2,1576435328,eb1r02
1773,I don't think it adheres to the markings as evenly as it does to regular grass.,Chiefs,1,1576435317,eb1r02
1774,Yes.,Chiefs,4,1576435303,eb1r02
1775,i believe they do,Chiefs,3,1576435303,eb1r02
1776,It has warm water circulation system,Chiefs,5,1576435298,eb1r02
1777,Yup!,Chiefs,3,1576435294,eb1r02
1778,Yea the field is heated,Chiefs,2,1576435293,eb1r02
1779,I’ll take that every time,,2,1576435288,eb1r02
1780,Are we gonna try a field goal?,Chiefs,1,1576435286,eb1r02
1781,Got em!,Broncos,2,1576435286,eb1r02
1782,"He's pretty good other times too, but yeah, amazing in those conditions.",Chiefs,2,1576435284,eb1r02
1783,Yes,Chiefs,3,1576435282,eb1r02
1784,Sure does. I think they fixed that a year or two ago.,Chiefs,2,1576435279,eb1r02
1785,yes,Ravens,2,1576435278,eb1r02
1786,It does,Chiefs,2,1576435274,eb1r02
1787,Holy shit that WR got murdered back to the LoS,Saints,2,1576435274,eb1r02
1788,"New HC, they needed signals.

Plus cheating is habitual. You can't just not cheat if you're a cheater.

Thems the takeaways I'm going with if they actually lose.",Chiefs,4,1576435273,eb1r02
1789,Calm down butler,Steelers,-1,1576435273,eb1r02
1790,Yes the field is heated,Chiefs,4,1576435269,eb1r02
1791,Yes,Chiefs,3,1576435265,eb1r02
1792,It's not the worst feeling in the world.,Chiefs,6,1576435262,eb1r02
1793,That hit didn't look right. Good to see Mahomes get up okay.,Steelers,6,1576435246,eb1r02
1794,Does Arrowhead have heating elements under the turf?  The melt pattern is oddly uniform.,49ers,5,1576435241,eb1r02
1795,"and literally no one else

and he’s injured",Broncos,3,1576435207,eb1r02
1796,I don't give a shit if they are pissed or benign.  Fuck em.,Chiefs,13,1576435195,eb1r02
1797,I didn’t mean luck like that.,Cowboys,6,1576435182,eb1r02
1798,Watching a snow bowl week before christmas when you've already got postseason to look forward to must feel good,Giants,9,1576435173,eb1r02
1799,True. You should let us take Von off your hands.,Chiefs,3,1576435166,eb1r02
1800,Man mahomes is fucking amazing when he has 10 seconds to throw and wide open receivers 🍆🍆🍆,,-13,1576435164,eb1r02
1801,"Y'all talking about Cincinnati beating New England right now. But that's the last thing the NFL needs before the playoffs, a pissed off Patriots team.",Chiefs,1,1576435136,eb1r02
1802,"Exactly, Hardman made some big plays against NE because they didn't have much tape on him + had their hands full deciding to work on shutting down Hill/Kelce as much as possible.",Chiefs,1,1576435135,eb1r02
1803,"Bengals knew they were spying, are playing 8-D chess",Chiefs,3,1576435128,eb1r02
1804,I haven't been watching most of your games. But it def looks good today. Or maybe it's the weather making it hard to pass rush?,Ravens,1,1576435128,eb1r02
1805,"Not lucky.  We traded up to get him.  They saw the future in him, and we have had Andy and Alex to help develop him.  That's not luck.",Chiefs,4,1576435126,eb1r02
1806,*has Von Miller,Chiefs,0,1576435109,eb1r02
1807,The interior OL has not played well this season even with all 3 starters. Broncos DL is beat up. Our tackles are very good though.,Chiefs,1,1576435108,eb1r02
1808,Hell yeah brother. Cheers from Iraq.,Broncos,1,1576435105,eb1r02
1809,Yep this it the reason. Our oline has gotten rocked inside all year. Mahomes has had developing happy feet this year which stinks because he just doesn’t trust those guys sometimes.,Chiefs,1,1576435102,eb1r02
1810,Every game thread is happier without Pat's fans,,3,1576435098,eb1r02
1811,that's about the best logic I have on it?,Steelers,2,1576435096,eb1r02
1812,"Always nice to see a Walrus in its natural habitat, so majestic.",Broncos,9,1576435088,eb1r02
1813,I feel like he will be the breakout receiver in playoff wins if they happen. Teams selling out to double on kelce or hill will make the checkdowns be open and his speed will be insane,,3,1576435084,eb1r02
1814,Chiefs are so damn lucky to have mahomes. I’m jealous.,Cowboys,7,1576435062,eb1r02
1815,Plz,Chiefs,10,1576435054,eb1r02
1816,:D,Ravens,2,1576435048,eb1r02
1817,When they are all healthy we have one of the best for pass protection. We have like the 4th least sacks given up.,Chiefs,5,1576435035,eb1r02
1818,When healthy?  Yes it's one of the better ones in the league.,Chiefs,3,1576435035,eb1r02
1819,Die Hardman?,Broncos,2,1576435031,eb1r02
1820,How do you lose to the team you spied on?,Chiefs,6,1576435030,eb1r02
1821,Kelce didn't slip in the snow - he was tryna break dance.,Panthers,7,1576435028,eb1r02
1822,Watching these guys slipping all over the field... I'm just praying for no injuries,Chiefs,6,1576435009,eb1r02
1823,Walrus looks at home in the snow.,,6,1576435009,eb1r02
1824,Go Bengals!!,Chiefs,6,1576435007,eb1r02
1825,"🚨🚨 Bengals take the lead on the Pats! 🚨🚨

What are the chances you think BB would kill a reporter live on television today if Bengals miraculously win and someone asks him about the tapes after losing 3 straight? I place the likelihood around 92.4%",Chiefs,56,1576435004,eb1r02
1826,Guys... is our O-Line good?,Chiefs,9,1576435001,eb1r02
1827,we also have no pass rush,Broncos,3,1576434995,eb1r02
1828,Any one have that clip of kc wolf diving in the snow?,Chiefs,9,1576434985,eb1r02
1829,did we just run engage eight,Broncos,2,1576434970,eb1r02
1830,Oh god this is fantastic,Chiefs,2,1576434959,eb1r02
1831,All the women around Denver has plenty of depth...,Chiefs,-1,1576434957,eb1r02
1832,KC o line is no joke. Mahomes has so much time on most of his throws.,Ravens,4,1576434953,eb1r02
1833,Slippery AF out thur,Chiefs,3,1576434948,eb1r02
1834,"Thank God, flash has been blocked in chrome since March by the way.  HTML 5 made flash obsolete.",Chiefs,1,1576434944,eb1r02
1835,"Wow, hell of a catch in these conditions, in any conditions anyway.",Saints,8,1576434938,eb1r02
1836,Every time I see this name I think its a pseudonym.,49ers,1,1576434937,eb1r02
1837,"You know, I'm glad he didn't try get up and fight for one yard after that. Just own it and go next. Always ends up fumbling when people do that shit.",Chiefs,7,1576434937,eb1r02
1838,"Hardman is going to be a star soon. He's been so underrated this year, which is understandable with Watkins, Hill, and Kelce around.",Chiefs,11,1576434933,eb1r02
1839,snow snakes will get ya,Broncos,4,1576434931,eb1r02
1840,This is a much happier game thread than last week.,Chiefs,12,1576434928,eb1r02
1841,"BENGALS: 10

PATRIOTS: 7

ME: EXCITE",Chiefs,29,1576434927,eb1r02
1842,"LMAO. Guess New England needed that footage after all:

Currently losing 10-7 to the Bengals.",Panthers,16,1576434923,eb1r02
1843,"""Denver's 'depth' is being tested.""

DON'T MAKE ME LAUGH",Broncos,6,1576434907,eb1r02
1844,That's my favorite summary of a tight end.,Ravens,3,1576434906,eb1r02
1845,Great throw,Chiefs,3,1576434904,eb1r02
1846,"""We've decided it's now 2:00 left in the 4th.""",Chiefs,3,1576434903,eb1r02
1847,really lucky to get a gain on that play,Chiefs,2,1576434900,eb1r02
1848,What a catch!,,1,1576434899,eb1r02
1849,[deleted],,1,1576434891,eb1r02
1850,Mahomes just put up a devastating block,Chiefs,2,1576434890,eb1r02
1851,Patrick Mahomes with the lead block. Just how you draw it up,Chiefs,4,1576434889,eb1r02
1852,Tacking him prior to him being able to catch it is pass interference?  Who knew?,Chiefs,3,1576434882,eb1r02
1853,I would respect the ref more if he said that.,Chiefs,2,1576434879,eb1r02
1854,The Antonio Gates position.,Chiefs,3,1576434874,eb1r02
1855,"If Ward's play last game was PI, that was definitely PI",Chiefs,2,1576434870,eb1r02
1856,Table Monster!,Chiefs,2,1576434864,eb1r02
1857,God is there anything better than a snow game??,,2,1576434857,eb1r02
1858,"Check out BlueMaxima's Flashpoint. It's 10/10 
:3",Ravens,2,1576434849,eb1r02
1859,Kelvin Benjamin.,Steelers,1,1576434845,eb1r02
1860,He's also very tall,Chiefs,1,1576434844,eb1r02
1861,This is not going well.,Broncos,3,1576434839,eb1r02
1862,Well it's not illegal until the ball is snapped.,Broncos,3,1576434829,eb1r02
1863,That sure didn’t work,Chiefs,2,1576434824,eb1r02
1864,Who said anything about baseball?,,0,1576434821,eb1r02
1865,"It's true, Andy Lock is a massive dude.",Chiefs,1,1576434818,eb1r02
1866,Not gonna argue that,Chiefs,2,1576434815,eb1r02
1867,yeah you would assume its like false start,Chiefs,1,1576434810,eb1r02
1868,Kelce just got 1000 yards. First TE to get 4 straight seasons of 1000+ yards.,Chiefs,9,1576434804,eb1r02
1869,I love Eddie Murphy and the Dolemite movie was fun,Chiefs,1,1576434802,eb1r02
1870,“Penalties will offset. I’m freezing my tits off. Replay first down.”,Chiefs,12,1576434798,eb1r02
1871,Clete looking like he's in fucking pain in that cold.,Chiefs,3,1576434796,eb1r02
1872,Isaac Yiadom is useless,Broncos,2,1576434795,eb1r02
1873,"you, my dear human, are a damned liar.",Steelers,1,1576434792,eb1r02
1874,"You guys know whats sad.

Chrome won't use flash anymore after 2020. No more flash games (ಥ﹏ಥ)",Chiefs,6,1576434789,eb1r02
1875,"Wouldn't have mattered, but would've been nice to call that hold too",Broncos,2,1576434785,eb1r02
1876,"Disneys got em shook, subscribers are down. Bout to get juicy in the streaming game...Netflix is throwing a hail mary with these big budget originals all dropping around the same time",Chiefs,1,1576434785,eb1r02
1877,"Kelce is just a fat wide receiver, change my mind",Broncos,7,1576434775,eb1r02
1878,Beast,Chiefs,2,1576434773,eb1r02
1879,"Ooof, please don't run today Patrick.

I'm very afraid of you slipping.",Chiefs,1,1576434768,eb1r02
1880,I'm not driving in this snow so I'm drinking during a noon game.,Chiefs,1,1576434753,eb1r02
1881,you are just jelly about evans hair jelly,Ravens,2,1576434748,eb1r02
1882,HAIR CLOSE-UPS,Steelers,1,1576434739,eb1r02
1883,Fucking penalties. We're killing ourselves.,,2,1576434734,eb1r02
1884,I liked it. It was a funny bit,Chiefs,3,1576434725,eb1r02
1885,HAIR HIGHLIGHTS,Chiefs,3,1576434725,eb1r02
1886,interesting that an illegal shift isn't a dead ball foul.,Steelers,4,1576434723,eb1r02
1887,He really did it!!! (sniffle),Chiefs,2,1576434715,eb1r02
1888,Dolemite.,Broncos,1,1576434706,eb1r02
1889,That's the record!,Chiefs,3,1576434705,eb1r02
1890,no i want them to go to another commercial,Chiefs,2,1576434704,eb1r02
1891,"Patrick ""Lamar Jackson"" Mahomes",Chiefs,5,1576434698,eb1r02
1892,Kelce did it.,Chiefs,9,1576434683,eb1r02
1893,"No flair, but that statement applies to both teams.",Chiefs,1,1576434683,eb1r02
1894,Zoom in on some guy's hairline for some reason.,Broncos,5,1576434679,eb1r02
1895,"Travis Kelce! First TE to 4 straight 1,000 yard seasons!",Chiefs,10,1576434665,eb1r02
1896,OMFG no one cares about your sideline analyst's hair. Talk about football.,Chiefs,11,1576434665,eb1r02
1897,"Put him with your in-laws, it's the perfect seating arrangement",Chiefs,1,1576434661,eb1r02
1898,The King was great imo,Chiefs,1,1576434646,eb1r02
1899,That's the record.,Chiefs,6,1576434631,eb1r02
1900,Have you seen the Christmas chronicles yet?,,1,1576434607,eb1r02
1901,Same here. It would help Lock and imagine Lindsay with a strong O Line..good times,Broncos,2,1576434606,eb1r02
1902,I want Dan Fouts to be at my wedding and sit him with all the rejects and tell stories about rib joints in Tuscaloosa,Ravens,5,1576434600,eb1r02
1903,We have to get them off the field on third down. That sucks.,Broncos,2,1576434598,eb1r02
1904,Drew’s biggest problem at Mizzou was getting really flustered after a sack or two. He needs to stay confident.,Chiefs,1,1576434595,eb1r02
1905,And now Fouts is talking about sliding into 2nd and 3rd.,Broncos,1,1576434594,eb1r02
1906,I still dont like the call but it worked soooooo,Packers,2,1576434582,eb1r02
1907,What do you recommend?,Chiefs,1,1576434554,eb1r02
1908,Really hope we put a lot of draft stock into the o line this off season.,,3,1576434543,eb1r02
1909,"Survivor is still going on.

I remember when it was first going on, they were in the South China Sea.

That's how fucking old I am.",Bills,1,1576434543,eb1r02
1910,I remember McCoy being pretty good in snow games,Steelers,3,1576434525,eb1r02
1911,Shady in the snow.,Chiefs,3,1576434524,eb1r02
1912,"See, you're missing the point that calling ""roughing the passer"" is meant to protect the QB but calling it when someone doesn't actually attempt to harm the QB or even come close to it is weak. 

You just saying ""the rules are the rules"" makes me think you probably agree with me but can't bring yourself to say it.",Broncos,-1,1576434524,eb1r02
1913,Another thing we all agree on,Broncos,1,1576434510,eb1r02
1914,"Ugh, this is gonna be another one of those ""let's put a more interesting football game on in the background"" days, isn't it?

*starts checking schedule*",Broncos,3,1576434495,eb1r02
1915,"5 &lt; 8, that math checks out.",Chiefs,5,1576434489,eb1r02
