,body,author_flair_text,score,created_utc,link_id
0,"The game-opening kickoff landed legit out of bounds. The second one bounced out, but it wasn't a bad bounce.",Saints,1,1576578577,eb4jgo
1,i don’t know what u said but i think it makes me happy,Cowboys,1,1576520346,eb4jgo
2,ReNt FrEe,Eagles,1,1576519956,eb4jgo
3,/r/suddenlygay,Cowboys,1,1576515143,eb4jgo
4,And you still haven't.,,1,1576513359,eb4jgo
5,Keep thinking that bud,Cowboys,1,1576484836,eb4jgo
6,Only one thing will save his job this year,,1,1576479210,eb4jgo
7,I feel pretty good that 9-7 will save his job. I guess we'll see.,Jaguars,1,1576478901,eb4jgo
8,Ok? That’s not too far fetched. Garrett is not getting retained unless he wins the super bowl. I’ve already said this.,,1,1576477674,eb4jgo
9,I'm betting Dallas goes 9-7 to finish the season and makes the playoffs. Please remember.,Jaguars,1,1576477219,eb4jgo
10,"I’ll make sure to send you the article of Dallas not retaining Garrett this offseason. Shoot, might even be as early as next week if they lose to Philly.",,1,1576476607,eb4jgo
11,The mental gymnastics going on here.,Jaguars,0,1576476260,eb4jgo
12,Was after a punt return where the Rams punted the Ball,Cowboys,1,1576473271,eb4jgo
13,What do you expect him to say to the media? Sounded like a political answer to me.,Cowboys,1,1576472690,eb4jgo
14,Idk..both our teams can end up throwing it,Cowboys,1,1576470850,eb4jgo
15,You and I both know the odds of that are low.,Eagles,1,1576470565,eb4jgo
16,http://www.nfl.com/news/story/0ap3000001088655/article/jerry-jones-believes-big-things-could-still-be-in-store-for-cowboys,Jaguars,1,1576470365,eb4jgo
17,http://www.nfl.com/news/story/0ap3000001088655/article/jerry-jones-believes-big-things-could-still-be-in-store-for-cowboys,Jaguars,1,1576470354,eb4jgo
18,http://www.nfl.com/news/story/0ap3000001088655/article/jerry-jones-believes-big-things-could-still-be-in-store-for-cowboys,Jaguars,1,1576470350,eb4jgo
19,[removed],,1,1576467381,eb4jgo
20,Handsome Jared Goff,Vikings,1,1576462835,eb4jgo
21,fuck the flashbacks,Cowboys,3,1576462015,eb4jgo
22,Word,Rams,1,1576461988,eb4jgo
23,strange downvoted comment,Cowboys,1,1576461962,eb4jgo
24,When who what where why,Cowboys,1,1576460662,eb4jgo
25,"Dallas ""The Wildcard"" Cowboys",Cowboys,1,1576460574,eb4jgo
26,Garrett Revenge Clap 2019,Cowboys,1,1576460489,eb4jgo
27,Just don't open the box.,Cowboys,1,1576459125,eb4jgo
28,Yeah that was a big waste of peoples time. Game was over. They'd still have to pull off that 3 more times with less than 40 seconds and hit 2.pt conversions.,Cowboys,5,1576459023,eb4jgo
29,Technically Dallas can lose and still win the east.,Cowboys,1,1576458903,eb4jgo
30,"But some how this will be spun.

The Rams lost to the Cowboys. They obviously just not have beat a good team",Cowboys,2,1576458629,eb4jgo
31,lmao you have too much optimism.,Jaguars,1,1576458605,eb4jgo
32,Yeah ok,Jaguars,1,1576458595,eb4jgo
33,"I wasn't looking at either kick off. 

Did he just get some bad bounces \ rolls?",Cowboys,1,1576458577,eb4jgo
34,"Sometimes it’s weird when you talk to your doctor about ED. Luckily my dad is my doctor, because that makes it less awkward, right?",Cowboys,1,1576458338,eb4jgo
35,Yay!!,Seahawks,1,1576458319,eb4jgo
36,As long as they don't have to go up against r/the_darnold and crew,,6,1576457987,eb4jgo
37,Lmao if they play like this against you you guys are screwed anyway,,1,1576457864,eb4jgo
38,Honestly surprised the Rams dropped an L in this game. They got whooped.,Packers,11,1576457706,eb4jgo
39,"Diamonds are such a huge marketing gimmick. I would agree, if people would just stop buying diamonds. However, if they are set on it, I will always encourage buying lab-created (preferably from a non-DeBeers entity).",Cowboys,1,1576457519,eb4jgo
40,"Well I guess I should clarify. I would rather not support DeBeers as a company. However, if you don't support DeBeers, there's a good chance you are buying Russian Diamonds (either by Mine or By Company).",Cowboys,1,1576457460,eb4jgo
41,My fantasy team needed that garbage,Lions,2,1576457357,eb4jgo
42,There was no reason to even run that play. Just kick,,0,1576457322,eb4jgo
43,They've lost some weird games but that offense is legit scary. And dak has been good. Even great at times. I'll admit I had some doubts after the bears loss but this team is going to put up a fight in the playoffs,Lions,3,1576457316,eb4jgo
44,No? He shouldn't have been calling timeouts and extending the game at all.,Packers,0,1576457292,eb4jgo
45,Superbowl confirmed. Dak get ms 40 mil+ a year and Garret gets a 4 year extension,Lions,1,1576457164,eb4jgo
46,And you without Garret have been ass for all but one year your entire franchise....,Cowboys,0,1576457153,eb4jgo
47,"""Jason Garrett is our Head Coach.""

-Jerruh Jones",Panthers,5,1576457064,eb4jgo
48,"&gt;	Not that they just blanket dislike the Cowboys lmao

Uh, I think you’re underestimating the Cowboys hatred.",Cowboys,1,1576457002,eb4jgo
49,Amazingly,Cowboys,1,1576456988,eb4jgo
50,Hey at least the lakers are on top again,Rams,-3,1576456971,eb4jgo
51,Brees also lost to the Falcons in a worse performance,Cowboys,8,1576456963,eb4jgo
52,And just shit the bed vs. the powerhouse of the South known as the Atlanta Falcons.,Panthers,5,1576456938,eb4jgo
53,Schrödinger's team. Simultaneously the best and worst team in the league.,Cowboys,1,1576456926,eb4jgo
54,"I mean, he went off against the Saints in a shootout. I wouldn't count them out",Cowboys,8,1576456902,eb4jgo
55,So if it was a “human being” who wasn’t a first stringer they would matter less?,,1,1576456895,eb4jgo
56,"""After all that, no onside kick."" Says a bored, slightly frustrated Aikman speaking for us all.",Cowboys,18,1576456872,eb4jgo
57,So final score would be 34 to 21?,Cowboys,1,1576456864,eb4jgo
58,"The human being who got hurt lol.

You serious?",Packers,2,1576456845,eb4jgo
59,[removed],,1,1576456830,eb4jgo
60,"LOL ""Welcoming in a new audience"" 

They even switched to this game from an ended game. It's all about money, my dude.",Cowboys,2,1576456824,eb4jgo
61,The falcons are a very confusing team,Bears,1,1576456823,eb4jgo
62,We beat a team over .500 boys!!,Cowboys,26,1576456818,eb4jgo
63,Cowboys looked like we all thought they were at the beginning of the season: A legit scary contender.,Saints,28,1576456813,eb4jgo
64,"I hate garbage time stats so much, I hate when we do it, I hate when other teams do it. It's basically asking for players to get hurt since they're obviously not going to be going 100 percent while the other side obviously is.",Cowboys,13,1576456811,eb4jgo
65,Do photographers train to shoulder check one another like that?,,3,1576456792,eb4jgo
66,What a game boys. What a games,Cowboys,9,1576456780,eb4jgo
67,NFC Least indeed,Cowboys,11,1576456778,eb4jgo
68,Their season is over regardless who cares,,1,1576456775,eb4jgo
69,"49ers won't be doing much with Garropolo as their QB.

Downvote all ya like - doesn't change the fact that he's the weakest link on the team at such a crucial position.",Panthers,3,1576456770,eb4jgo
70,"I didn't understand a thing he said, I'll wait for the highlights.",Cowboys,5,1576456764,eb4jgo
71,He’s got Goff on his fantasy team and he’s trying to win his consolation bracket.,Cowboys,3,1576456754,eb4jgo
72,We coming for that ass Philly,Cowboys,17,1576456752,eb4jgo
73,"I’m glad the crowd is booing the fuck out of this garbage time shit. 

The defense has played too damn too good give up 2 extra TDs.",Cowboys,13,1576456740,eb4jgo
74,And then he kicks it deep...,,3,1576456739,eb4jgo
75,"""We welcome in a new audience... please go do pretty much anything else with your time""",Packers,4,1576456737,eb4jgo
76,Honestly I'm scared Cooks won't last in the NFL.,Patriots,3,1576456737,eb4jgo
77,thanks to Bennett it woild be an offside kick,Cowboys,4,1576456732,eb4jgo
78,"I was half paying attention this quarter, just playing mh4u lol",Cowboys,1,1576456728,eb4jgo
79,This is horrific coaching by McVay,Patriots,4,1576456726,eb4jgo
80,New audience for the Landry Shift.,Cowboys,8,1576456726,eb4jgo
81,Glad hes okay that didnt need to happen,Cowboys,5,1576456725,eb4jgo
82,I thought the Refs were going to screw Atlanta lol,Cowboys,1,1576456723,eb4jgo
83,We missed an epic ending in the Falcons game for this shit.,Steelers,8,1576456710,eb4jgo
84,Fuck Fox,Packers,2,1576456709,eb4jgo
85,Landry Shift incoming,Cowboys,3,1576456705,eb4jgo
86,Sean mcvay is overrated as fuck as s coach after they sucked his dick all last season,Panthers,1,1576456704,eb4jgo
87,"Damn I hope he’s okay, Sean really needs to let the game finish and take out key players",Cowboys,2,1576456701,eb4jgo
88,haha same here.,Steelers,1,1576456700,eb4jgo
89,I’d much rather play the Seahawks over the 49ers in the playoffs.,Cowboys,4,1576456699,eb4jgo
90,They prolly wanna go home and just aren't calling simple shit anymore.,Cowboys,1,1576456695,eb4jgo
91,wtf is up with the NFC playoffs,Cowboys,8,1576456694,eb4jgo
92,"**There ya go, McVay. Let's try and score in a meaningless game and get your Stars injured. Good job, Kindergarten Coach.**",Panthers,14,1576456689,eb4jgo
93,March has actually looked really great in pass coverage.,Cowboys,4,1576456689,eb4jgo
94,Mcvay you fucking moron,,10,1576456682,eb4jgo
95,Yoooo the 49ers lost to the Falcons lmao,Panthers,11,1576456682,eb4jgo
96,Good on Joe and Troy for calling out McVay for calling TOs and risking his starters.,Eagles,17,1576456681,eb4jgo
97,"lol jared goff

lol sean mcvay",Patriots,5,1576456679,eb4jgo
98,"Usually coaches aren't aiming to pad stats, but McVay bucking that trend",Steelers,8,1576456679,eb4jgo
99,[deleted],,1,1576456678,eb4jgo
100,"The Rams are managing their players like my 16 year old brother does in Madden


Calling a timeout with your starters in for a garbage time touchdown LOL And now Cooks is hurt



It's hard to believe that coaches at this level make those dumb decisions. Must be ego I suppose",Chiefs,10,1576456674,eb4jgo
101,I have never seen less reaction to a TD and lol a pick on the 2 points as I was typing this,Vikings,3,1576456674,eb4jgo
102,That hit happened right after “Hit Me with Your Best Shot” started playing in the restaurant I’m in.,Cowboys,3,1576456673,eb4jgo
103,even joe buck is takin shots at mcvay lol,Patriots,7,1576456673,eb4jgo
104,Lol Garbage time Goff just got me to the fantasy finals. Classic,,3,1576456672,eb4jgo
105,[deleted],,1,1576456672,eb4jgo
106,"lol, now you guys are stuck with Garrett for another 5 years!",Buccaneers,-1,1576456664,eb4jgo
107,Wow these commentators can give no fucks about this game at this point,Patriots,6,1576456662,eb4jgo
108,Stupid as fuck. Just let the time run out you idiot.,,7,1576456662,eb4jgo
109,This is making me lose respect for Sean Mcvay,Colts,9,1576456661,eb4jgo
110,Seriously what the fuck is Mcvay doing right now.,Cowboys,11,1576456659,eb4jgo
111,absolutely pointless injury because mcvay wanted to go for 2 for no reason,Cowboys,9,1576456659,eb4jgo
112,Sean McVay is me when down 30 in Madden,Cowboys,6,1576456658,eb4jgo
113,[deleted],,3,1576456658,eb4jgo
114,Lmao Atlanta won,Jets,4,1576456654,eb4jgo
115,Lmao no way Julio,Cowboys,6,1576456653,eb4jgo
116,Does that mean we still have a chance?,Rams,2,1576456651,eb4jgo
117,Why are you risking starters in a lost game,Cowboys,11,1576456650,eb4jgo
118,Johnny Hekker still has a higher QB rating in this game than Jared Goff.,Cowboys,5,1576456647,eb4jgo
119,FAlcons beat 49ers!,Vikings,3,1576456644,eb4jgo
120,cooks looks hurt too,Patriots,6,1576456639,eb4jgo
121,Damn that was a big hit,Vikings,2,1576456636,eb4jgo
122,AMeRiCa’s TeAmmmMMm!!!,,0,1576456636,eb4jgo
123,Thats what happens when you keep going for it. Hope he's okay,Cowboys,17,1576456635,eb4jgo
124,Holy shit nice at least we can share our hatred of SF,Cowboys,2,1576456630,eb4jgo
125,McVay what are you doing dude?,Cowboys,18,1576456627,eb4jgo
126,"So fitting to have an injury playing starters when the game has been over for 4 minutes. 

Mcvay not looking so hot this year.",,12,1576456626,eb4jgo
127,Mcvay is being a fucking idiot,Cowboys,10,1576456625,eb4jgo
128,[deleted],,1,1576456625,eb4jgo
129,"This injury was the most predictable outcome ever.

Let the game end",Packers,13,1576456625,eb4jgo
130,Only for them to crash out in the first round. That's why it's said... Not that they just blanket dislike the Cowboys lmao,Patriots,-2,1576456620,eb4jgo
131,I tried to tell you Sean.,Cowboys,9,1576456619,eb4jgo
132,Nobody knows,Cowboys,4,1576456616,eb4jgo
133,"Yea this is just dumb, why have the starters out there like that",Rams,11,1576456615,eb4jgo
134,Lol that literally happened in the Vikings game today too. Gotta get them garbage time stats.,Vikings,2,1576456615,eb4jgo
135,That’s on McVay,Cowboys,18,1576456612,eb4jgo
136,Cooks needs to retire.,Cowboys,1,1576456611,eb4jgo
137,Hundreds of fantasy semi finals just got turned because of the TD,,4,1576456611,eb4jgo
138,"Cooks has already had more than enough injuries, you hate to see it. He should hang up the cleats.",Jets,1,1576456609,eb4jgo
139,Donovan Wilson is gonna be pretty good,Cowboys,3,1576456609,eb4jgo
140,[removed],,1,1576456609,eb4jgo
141,"If you find out I, too, would like to know.",Cowboys,3,1576456607,eb4jgo
142,That's good flame.,Saints,1,1576456605,eb4jgo
143,McVay take your fucking starters out you moron.,Patriots,11,1576456604,eb4jgo
144,I hope you dont really believe this....,Cowboys,1,1576456603,eb4jgo
145,ow,Vikings,1,1576456603,eb4jgo
146,"This is why ""playing it out"" is completely idiotic.",Cowboys,12,1576456599,eb4jgo
147,That’s why you take a knee,Cowboys,6,1576456593,eb4jgo
148,[deleted],,7,1576456591,eb4jgo
149,Hooray garbage time stats,Eagles,5,1576456590,eb4jgo
150,You just got cooks some broken ribs you dumbass,,13,1576456585,eb4jgo
151,Fuck injuries I hope Cooks is ok,Cowboys,3,1576456584,eb4jgo
152,Why is Goff on the field?,Vikings,1,1576456583,eb4jgo
153,"Did they?  I didn't think so,",Cowboys,3,1576456583,eb4jgo
154,Daaaaamn. Cooks got cooked,Cowboys,5,1576456581,eb4jgo
155,If he dies he dies,Cowboys,1,1576456579,eb4jgo
156,It shows how much the NFL loves Dallas when this game is still on national TV,Jets,3,1576456573,eb4jgo
157,"No idea, but they way they haven't been utilized this year and the amount of money they're tying up - they're definitely gone.",Panthers,1,1576456572,eb4jgo
158,Holy shit Sean just let it die,Cowboys,11,1576456571,eb4jgo
159,We were 3 inches away from winning that game. 1 play made a 14 point swing. Texans were better.,Titans,1,1576456568,eb4jgo
160,wow sf just lost,Rams,3,1576456565,eb4jgo
161,It's absolutely unbelievable that Fox never switched from this game to the Falcons/49ers.,NFL,5,1576456563,eb4jgo
162,Goff crawling hard for that paycheck.,Cowboys,3,1576456561,eb4jgo
163,The Eagles also played a team vying for a top 5 pick.,Cowboys,3,1576456550,eb4jgo
164,What even is dallas,Lions,7,1576456548,eb4jgo
165,Omg these commentators LOL,Rams,2,1576456544,eb4jgo
166,"can't wait for ""lol now your gonna resign Garrett. I love when the cowboys win"" from people who hate it when the cowboys win",Cowboys,6,1576456537,eb4jgo
167,"Apparently not McVay, and we scored that Pollard TD right after he called a timeout.",Cowboys,3,1576456537,eb4jgo
168,"With that sf game ending the way it is,  even I wish we'd cut over.",Cowboys,8,1576456520,eb4jgo
169,Lol Bennett looked offsides again but I think the refs just feel bad for him at this point.,Cowboys,8,1576456514,eb4jgo
170,I think at the half Gurley had 0.4 ypa,Cowboys,2,1576456513,eb4jgo
171,Running backs depreciate fast and their contracts don’t. He’s a toxic asset,,1,1576456512,eb4jgo
172,What team they’ll be on?,Jets,1,1576456512,eb4jgo
173,It's over Sean. Let us go home.,Cowboys,10,1576456509,eb4jgo
174,"What's the point of that timeout, this isn't Madden.",Cowboys,1,1576456506,eb4jgo
175,Just checking in... 44?!  Smh,Rams,1,1576456505,eb4jgo
176,No it wouldn't. You guys did not show up to play,Cowboys,1,1576456501,eb4jgo
177,The Eagles looked better today though,Jets,-13,1576456500,eb4jgo
178,"So America, we're going to keep showing you this turdfest while we talk about what's happening in a more exciting game.",Packers,3,1576456497,eb4jgo
179,Fuck McVays garbage time shit,,7,1576456491,eb4jgo
180,"You think when games are over like this both teams just think, “hey can we just call it a day?”",Cowboys,9,1576456491,eb4jgo
181,"Why are you taking a timeout, you're losing by fucking 29. Jesus",Cowboys,6,1576456489,eb4jgo
182,Should be fun. See you next week!,Cowboys,2,1576456488,eb4jgo
183,For real,Saints,1,1576456485,eb4jgo
184,"fox staying on this game is weird, its been over for 2 hours",Eagles,4,1576456481,eb4jgo
185,Gurley and Cooks won't be back for the Rams next year.,Panthers,1,1576456476,eb4jgo
186,"Hahaha stumbled, got up then stumbled again",Cowboys,3,1576456476,eb4jgo
187,They had no success running early then fell behind.,Cowboys,2,1576456472,eb4jgo
188,can they just take a knee or something,Colts,4,1576456456,eb4jgo
189,To add to it. They knocked us out of the playoffs last year now we returned the favor.,Cowboys,1,1576456454,eb4jgo
190,10 15 BOZO,Patriots,1,1576456449,eb4jgo
191,"I think the score is the most surprising aspect of it, theres winning, and then theres this",Cowboys,1,1576456446,eb4jgo
192,"Well, to be fair, every week there’s always the anamoly. Houston lost to the Broncos last week at home, and now Dallas won a game against a quality team.",Jets,3,1576456444,eb4jgo
193,"We don’t even have cheerleaders...

This game doesn’t matter in my opinion. Packers are locks for the playoffs. Bears aren’t getting in.",Packers,1,1576456443,eb4jgo
194,I’d rather die than face packers in playoffs again,Cowboys,4,1576456440,eb4jgo
195,"formerly March-Lillard, a ST player mostly",Cowboys,3,1576456425,eb4jgo
196,"Jerome Bettis.   5 carries,  3 yards, 3 1 yard touchdowns.",Cowboys,1,1576456424,eb4jgo
197,Brett Maher got Fired!! How did I know hear about this!?,Vikings,3,1576456421,eb4jgo
198,Peak nephew. It doesn't get more nephew than this.,Cowboys,1,1576456419,eb4jgo
199,Why has Goff thrown over 40 times today? Has their ground game really been that bad?,Chiefs,3,1576456419,eb4jgo
200,if the refs would've followed the rules this would've been a completely different game,Rams,-5,1576456418,eb4jgo
201,o no,Cowboys,4,1576456412,eb4jgo
202,[removed],,1,1576456405,eb4jgo
203,"Jerry: ""Division heart hands!""

Dallas fans: ""But what about Garrett?""

Jerry: ""Just take the division!""",Patriots,12,1576456404,eb4jgo
204,"We all are, my dude.",Cowboys,3,1576456399,eb4jgo
205,Whoda fook is dat guy?,Cowboys,5,1576456395,eb4jgo
206,Why the hell haven’t we switched over to the 49ers game?,Steelers,8,1576456383,eb4jgo
207,"Jets &gt; Cowboys &gt; Rams, I guess...",Cowboys,4,1576456382,eb4jgo
208,"Even Joe Buck wants Bortles, GIVE US BORTLES!!!",Rams,9,1576456379,eb4jgo
209,"Unfortunately, this is not a scorigami. One other game had a score of 44-15. The 49ers beat the Bears in the 1995 Divisional playoffs.",Cowboys,3,1576456377,eb4jgo
210,We. Want. Bama.,Cowboys,6,1576456375,eb4jgo
211,Yes. And more than zeke as well,Cowboys,1,1576456373,eb4jgo
212,Who da fuq is March??,,3,1576456360,eb4jgo
213,"Thanks Mr CockSwing, I’ll be working but knowing you’re nut is going to good puts my mind at ease",,2,1576456360,eb4jgo
214,I like you,Cowboys,2,1576456359,eb4jgo
215,&gt;YosemiteSam.exe,,3,1576456349,eb4jgo
216,It's the toliet bowl next week. Wtf do you expect.,Cowboys,2,1576456345,eb4jgo
217,But if there's still a shit ton of people watching and they want that revenue from advertising. That's why,Cowboys,1,1576456344,eb4jgo
218,That's awesome. Fuck LA.,Cowboys,2,1576456344,eb4jgo
219,"Good point. They deserve punishment for losing to the Pats in the Superbowl I guess.

Jk, I forgot that they knocked you guys out of it last year.",Broncos,1,1576456344,eb4jgo
220,Jason Garrett isnt going anywhere,Seahawks,-1,1576456338,eb4jgo
221,The Trade,Cowboys,1,1576456338,eb4jgo
222,when a game finishes with a score that hasnt happened before,Cowboys,3,1576456332,eb4jgo
223,"It shouldn't be, I believe Fox can block it from being flexed.",Cowboys,1,1576456323,eb4jgo
224,I’m surprised the Cowboys won.,Jets,-6,1576456320,eb4jgo
225,Ikr! Let's calm down a little bit,Cowboys,2,1576456314,eb4jgo
226,[Mood](https://i.imgur.com/cK0IcWO.gif),Cowboys,6,1576456311,eb4jgo
227,It didn’t matter before. I still hate changing what’s been working all game to give your opponent easy points and padded stats.,Cowboys,1,1576456309,eb4jgo
228,"Rams remind me of the Good looking popular kid in High School that had everything going for him,  but his social anxiety would never allow him to round first base with the head Cheer Leader that was DTF.",Titans,2,1576456295,eb4jgo
229,Unique scores that have never been produced,Cowboys,2,1576456283,eb4jgo
230,The garbage time points I’m getting from the rams are insane,Patriots,3,1576456283,eb4jgo
231,A final score that’s the first of its kind.,Cowboys,1,1576456282,eb4jgo
232,"I am so satisfied by this win, it takes care of my need to nut tonight. I’m just gonna make some tea, read a book and go get comfy in bed.",Cowboys,16,1576456276,eb4jgo
233,"""If Goff gets a career-ending injury, do we still have to pay him?""

-Sean McVay",Panthers,6,1576456276,eb4jgo
234,should have been roughing the passer on the cowboys,Jets,-6,1576456270,eb4jgo
235,At the time it looked brilliant though.,Saints,0,1576456266,eb4jgo
236,"Can someone check on Goff, please?",Cowboys,3,1576456261,eb4jgo
237,It doesn’t matter now,Cowboys,1,1576456258,eb4jgo
238,Goff is getting killed.,Cowboys,5,1576456251,eb4jgo
239,Delete,Cowboys,3,1576456249,eb4jgo
240,I'm going to assume sarcasm here.,Cowboys,1,1576456248,eb4jgo
241,"Dallas fans- All is Forgiven!

Everybody else- they still suck",Vikings,-1,1576456247,eb4jgo
242,Yup. It didn't make sense at the time and it doesn't make sense now.,Cowboys,3,1576456245,eb4jgo
243,We still aren’t good. So let’s tone that down,Cowboys,7,1576456243,eb4jgo
244,Rams FG or pick six for scorigami,,3,1576456242,eb4jgo
245,"Dude can hit from 45, I'm happy",Cowboys,4,1576456240,eb4jgo
246,All these fucks in our division stand in awe of our mighty 7-7 record,Cowboys,9,1576456239,eb4jgo
247,Kronkmeme.jpg,Cowboys,1,1576456239,eb4jgo
248,"44-15 is pretty fucking weird on its own, but I guess 44-18 is weirder.",Cowboys,1,1576456237,eb4jgo
249,Yeah I get the cowboys have huge ratings but it's freaking 44-15. Garbage.,Patriots,1,1576456235,eb4jgo
250,"So IRL, all those kids would be playing a video game and not be outside",Rams,2,1576456234,eb4jgo
251,[removed],,0,1576456230,eb4jgo
252,I fucking hate the prevent defense.,Cowboys,6,1576456229,eb4jgo
253,Goff should not be in there,Vikings,2,1576456226,eb4jgo
254,A score that has never happened in the history of the NFL,Cowboys,1,1576456226,eb4jgo
255,Yeah why the fuck is Goff still in there...,Colts,4,1576456225,eb4jgo
256,"Peterson won a Super Bowl, but yeah, he got rid of the wrong QB, that's for sure.",Panthers,4,1576456223,eb4jgo
257,"Ooof... well, I'm glad somebody is...",Seahawks,1,1576456220,eb4jgo
258,Who is the true butthurt one here?,Cowboys,1,1576456220,eb4jgo
259,"

https://nflscorigami.com/",,2,1576456216,eb4jgo
260,We have more touchbacks this game than we've had all season.   I don't know why Maher couldn't kick deep on kickoffs.,Cowboys,0,1576456208,eb4jgo
261,Is the offense better with Cooper Rush behind center? It certainly seems so.,Cowboys,6,1576456205,eb4jgo
262,The amount of Rams fans that would turn off the game versus Cowboys fans...,Cowboys,1,1576456194,eb4jgo
263,It's when a game ends with a score that has never happened before,Rams,1,1576456192,eb4jgo
264,when a game ends in a score that has never happened before,Cowboys,1,1576456191,eb4jgo
265,Gurley looked like he ducked that ball lmao,Cowboys,3,1576456186,eb4jgo
266,"Hell yeah brother, cheers from St. Louis.",,3,1576456183,eb4jgo
267,That Ramsey trade was so fucking stupid,Packers,15,1576456183,eb4jgo
268,Imagine hearing you're out of the playoffs even though you have 8 wins...,Cowboys,19,1576456177,eb4jgo
269,[deleted],,1,1576456175,eb4jgo
270,Doug Pederson too. Both guys have struggled big tjme,Cowboys,3,1576456172,eb4jgo
271,Don't be that guy,Cowboys,15,1576456170,eb4jgo
272,We got you fam! I was just as pissed as that shit as you were. Drew Brees is awesome and we got robbed of seeing him in another SB.,Cowboys,4,1576456167,eb4jgo
273,As long as the motherfucker boots through the uprights he can start and finish the next two games by kicking out of bounds. Fuck it. Maher can't hurt me anymore.,Cowboys,24,1576456166,eb4jgo
274,[deleted],,2,1576456160,eb4jgo
275,Last week I think,Vikings,1,1576456157,eb4jgo
276,"Those Dallas Cowgirls make me realize why they say ""God Bless Texas.""",Panthers,2,1576456155,eb4jgo
277,[removed],,0,1576456152,eb4jgo
278,"Well they haven't till now, it why y'all got a 6-7 record",Rams,4,1576456147,eb4jgo
279,How about the male Cowboys cheerleaders.,Packers,-1,1576456146,eb4jgo
280,Dilly dilly fuck philly?,Colts,15,1576456144,eb4jgo
281,Scorigami with Rams FG,,2,1576456144,eb4jgo
282,The Cowboys have sucked pretty much my entire life so I don't have any Cowboy hate. Hope they make some noise in the playoffs this year and knock out whatever juggernaut wildcard team they face (if they win the division) for the sake of chaos,Chiefs,11,1576456141,eb4jgo
283,Serious question: what the hell is scorigami?,Vikings,1,1576456141,eb4jgo
284,I see that now haha,Vikings,2,1576456140,eb4jgo
285,How about the male Cowboys cheerleaders.,Packers,0,1576456139,eb4jgo
286,Lmfao this is the dumbest take,Cowboys,3,1576456139,eb4jgo
287,Pollard must be a Reddit guy.,Cowboys,2,1576456137,eb4jgo
288,man the salt is real,Giants,1,1576456136,eb4jgo
289,why has fox not switched the game?,Eagles,0,1576456134,eb4jgo
