,body,author_flair_text,score,created_utc,link_id
1834,We’re really going to lose to a team that might win 4 total games this season?,Saints,9,1573417444,duedcw
1835,Alright.,Falcons,3,1573417443,duedcw
1836,No. They're TERRIBLE,Patriots,2,1573417439,duedcw
1837,[deleted],,2,1573417434,duedcw
1838,This is so sloppy it's disgusting,Saints,6,1573417434,duedcw
1839,"Calling it now, saints hold them, but then some bullshit call after the play gives them a first down.",Saints,-11,1573417434,duedcw
1840,probably tired of saints fans complaining about something on every single play,Falcons,10,1573417433,duedcw
1841,A dog commercial should know to not put a fucking doorbell in it,Saints,4,1573417433,duedcw
1842,Hold on 70,Saints,-1,1573417432,duedcw
1843,AJ Klein in pass coverage getting smoked as usual,Saints,-2,1573417431,duedcw
1844,Cam's health has a lot to do with that.,Saints,2,1573417429,duedcw
1845,Literally no one has a hard on for the Falcons. Even ex Falcons players shit on them in the booth.,Falcons,3,1573417428,duedcw
1846,YESSSSS FALCONSSSS,,3,1573417428,duedcw
1847,wew,Vikings,1,1573417428,duedcw
1848,[removed],,0,1573417426,duedcw
1849,"oh look, you're downvoted as well. ugh.

Edit: lmao",Saints,-8,1573417424,duedcw
1850,Holy shit Atlanta is fucking legit. They've had their struggles but they've always been talented. They are clicking now.,,1,1573417422,duedcw
1851,That was pathetic,Saints,1,1573417421,duedcw
1852,I was told the Saints were good?  Lol....,Patriots,0,1573417421,duedcw
1853,AHHHHHH,Falcons,4,1573417418,duedcw
1854,How do you not sack him right there,Saints,2,1573417415,duedcw
1855,Touchdown..... wow!!!,,1,1573417409,duedcw
1856,Good stuff ATL,Packers,1,1573417406,duedcw
1857,Called it,Saints,2,1573417404,duedcw
1858,Wow we are really fucking bad,Saints,-2,1573417399,duedcw
1859,Bro who cares about downvotes,Saints,12,1573417397,duedcw
1860,I remember that one play a while back where a team had to challenge a completed pass by their own receiver so that they can negate a fumble. Catch rules and challenges are hilarious.,Saints,1,1573417390,duedcw
1861,PUT TEDDY BACK IN,Giants,-1,1573417380,duedcw
1862,"Pretty damn good, he's made some mistakes but he's better than PJ Williams our starting NCB, has good potential, really glad we got him and playing well above his draft spot.",Saints,1,1573417379,duedcw
1863,Yeah when the challenge came in and the other angle was shown I couldn’t believe they called that a catch,Saints,1,1573417375,duedcw
1864,Why are falcons fans downvoting people calling out the no call false start? Ridley flinched so hard,Saints,-7,1573417365,duedcw
1865,Don’t be shocked if there is a TD first play back. It’s a third down after all,Saints,3,1573417362,duedcw
1866,"Not true. The 1 game Ryan was out, Schaub threw for multiple TDs and 460 yards 

Our offense was never the problem this year",Falcons,1,1573417359,duedcw
1867,"I like what I'm seeing. I'm just not being hopeful. Because every time this team gives me a reason to hope, it says ""nah, but it's cute you thought that""",Falcons,4,1573417359,duedcw
1868,His madden commentary sucks dick for everyone but the player.,Panthers,3,1573417358,duedcw
1869,We need a 4th quarter defense too. Hope they find some reserves in the tank,Saints,3,1573417354,duedcw
1870,Meanwhile we haven’t won since 2016 😒,Panthers,2,1573417354,duedcw
1871,"I mean they arent that good right now.  Reffing has gotten them a number of first downs.  Not only that, they aren't calling things like ridley intentionally elbowing apple in the face, or hooper holding downfield.",Saints,0,1573417351,duedcw
1872,[deleted],,1,1573417351,duedcw
1873,Agreed. I think OSU is gonna spank this year though.,Saints,1,1573417345,duedcw
1874,It's fucking overdue.,Saints,2,1573417339,duedcw
1875,Wut,Falcons,9,1573417338,duedcw
1876,"was thinking the same thing in reverse in the first half

dude is not a good commentator",Falcons,5,1573417327,duedcw
1877,[removed],,1,1573417324,duedcw
1878,Falcons deserve a lot of credit win or lose. Don’t be stupid. This team has plenty of time to pull it out.,Saints,1,1573417323,duedcw
1879,Our d line is playing like crap,Saints,3,1573417317,duedcw
1880,Here comes fourth quarter offense,Saints,-1,1573417317,duedcw
1881,Yo is it racist that they gave the asian kicker Micheal Vick's number?,Cowboys,-12,1573417313,duedcw
1882,Why tank for Tua or Bomb for Burrows? They have Matt. No need to crash and burn on purpose when your biggest needs are O line and defense,Bears,1,1573417304,duedcw
1883,You just don't wanna lose to them again the the postseason.,Saints,8,1573417302,duedcw
1884,How has CGJ been? Was one of my favorites at UF and would have loved for the Falcons to draft him.,Falcons,1,1573417294,duedcw
1885,"We always lose at least one game to both the falcons and bucs, so this would be just about right to lose this game",Saints,2,1573417294,duedcw
1886,Yea bc it wasn’t holding,Saints,6,1573417293,duedcw
1887,It’s the truth man we look like shit!,Saints,2,1573417293,duedcw
1888,He always has a hard on for Atlanta,Saints,-2,1573417293,duedcw
1889,Gotta watch out for our standout dual threat qb,Falcons,6,1573417278,duedcw
1890,No,Falcons,3,1573417273,duedcw
1891,Nah,Falcons,2,1573417272,duedcw
1892,I mean we are no dolphins but....,Panthers,1,1573417270,duedcw
1893,[deleted],,-6,1573417269,duedcw
1894,I'm stuck in this eternal feeling of waiting for the other shoe to drop,Falcons,3,1573417261,duedcw
1895,Are you fucking sorry?,Falcons,1,1573417258,duedcw
1896,Did Charles Davis play for the Falcons or something?  Is he married to Matt Ryan?  Did Drew Brees fuck his wife?,Saints,-3,1573417253,duedcw
1897,Has falcons O line been this good throughout the season?,Saints,2,1573417251,duedcw
1898,Holy shit haha,Falcons,3,1573417247,duedcw
1899,Rooting for the saints to go 1-7 while the Falcons go 7-1 to end the season.,Seahawks,-7,1573417245,duedcw
1900,uncalled holding on hooper.,Saints,-4,1573417235,duedcw
1901,We played all but 1 game with ryan. We just sucked all year,Falcons,4,1573417234,duedcw
1902,Dennis Allen is calling blitzes on every down when we need help in coverage without our best corner,Saints,1,1573417234,duedcw
1903,So dumb. We lost Lattimore against Julio Jones. Of course this is gonna happen.,Saints,3,1573417232,duedcw
1904,"That was not a hold,",Saints,5,1573417229,duedcw
1905,How are we letting a 33 year old qb with a bad ankle scramble around in the pocket? Are we really that fucking sorry?,Saints,5,1573417228,duedcw
1906,Yeah there were more changes but I dont recall,Falcons,1,1573417223,duedcw
1907,Oh it's you again. Fuck off.,Saints,2,1573417223,duedcw
1908,I’ll take 1 turnover please,Saints,5,1573417222,duedcw
1909,I put the blame on the Saints coaches. they needed to cut the hands off all the defensive players at half time,Falcons,7,1573417222,duedcw
1910,Please stop then this time defense with no penalties,Saints,2,1573417216,duedcw
1911,Division games are weird for the gazillionth,Packers,4,1573417200,duedcw
1912,No lies detected,Falcons,3,1573417190,duedcw
1913,Thanks. At game and didn’t even see him come out.,Saints,1,1573417186,duedcw
1914,[deleted],,5,1573417184,duedcw
1915,Ryan was slow as hell &amp; still picked up the 8 yards smh,Saints,4,1573417181,duedcw
1916,Toradol shot and go baby,,1,1573417180,duedcw
1917,"Technically, we're playing worse than that 1-7 team.",Saints,9,1573417180,duedcw
1918,I'm rooting for you guys!,,6,1573417171,duedcw
1919,"LSU beat Bama yesterday. Saints losing to 1-7 Falcons at home off a bye...This is 2019

(Yes I know Atlanta plays the Saints tough)",Panthers,8,1573417170,duedcw
1920,There was no hold on that lol,Falcons,2,1573417169,duedcw
1921,[removed],,1,1573417168,duedcw
1922,Same. We are actually playing football for once,Falcons,4,1573417165,duedcw
1923,Such a sloppy sloppy game by the Saints,Saints,5,1573417158,duedcw
1924,"or ya know, the missed false start on 2nd down there haha",Saints,-1,1573417158,duedcw
1925,"Naw, falcons are just way better with Ryan than without. Seems obvious but feels like it's being forgotten",Bears,3,1573417153,duedcw
1926,Sorry about that,Falcons,1,1573417144,duedcw
1927,"Falcons are only 4/10 on third down

Feels like they are 30/40 

I guess that doesn’t include penalties though",Saints,11,1573417143,duedcw
1928,Because they suck!,Saints,-7,1573417141,duedcw
1929,No holding on Hooper... ofcourse,Saints,-1,1573417134,duedcw
1930,We’re playing like a 1-7 team,Saints,6,1573417131,duedcw
1931,Mostly hands to the face,,7,1573417126,duedcw
1932,We don’t. Our D is gassed.,Saints,3,1573417126,duedcw
1933,"Man, I still can't imagine us winning this game, but these three quarters have been the only moment of enjoyment I've had this season since the first game.",Falcons,9,1573417126,duedcw
1934,Yeah they don’t give a fuck on third down. Defensive line is probably completely gassed,,1,1573417124,duedcw
1935,I thought I was watching a slow motion replay.,Saints,2,1573417124,duedcw
1936,Falcons have been good on 3rd down this season despite their record.,Saints,4,1573417123,duedcw
1937,They are letting hooper hold wtf.,Saints,2,1573417123,duedcw
1938,He makes Vick and Lamar look slow,Falcons,3,1573417121,duedcw
1939,He made Jalen Ramsey his bitch. Wish lattimore was still in so y'all couldn't make these excuses,Falcons,1,1573417120,duedcw
1940,Color commentators are now called black commentators? I missed that memo.,Steelers,2,1573417119,duedcw
1941,Hell of a play by daddyport there,Saints,1,1573417118,duedcw
1942,You're forgetting Tom Bradys run against miami,Patriots,3,1573417112,duedcw
1943,We fucking suck bro just straight up,Saints,-10,1573417107,duedcw
1944,2nd team all-pro you could say,Saints,0,1573417104,duedcw
1945,matt ryan runs like a newborn giraffe,Falcons,11,1573417104,duedcw
1946,Part of me is upset and the other part is happy they are trying to ruin there draft position.,Saints,0,1573417100,duedcw
1947,Yes,Saints,1,1573417100,duedcw
1948,3rd downs are free first downs again for this defense. They should just throw the ball away the first two plays and have Matt scramble and they’ll get free yards,Saints,4,1573417094,duedcw
1949,Hamstring,Saints,2,1573417090,duedcw
1950,Yea. Questionable to return,Saints,2,1573417083,duedcw
1951,Yes,Saints,1,1573417082,duedcw
1952,man what are we doing on 3rd down,Saints,5,1573417079,duedcw
1953,Slowest 8 yard run ever.,Falcons,13,1573417074,duedcw
1954,Throwback Vick run,Seahawks,6,1573417074,duedcw
1955,Matt “Lamar Jackson” Ryan,Falcons,8,1573417072,duedcw
1956,Ryan is obviously slower on these scrambles.,Falcons,6,1573417071,duedcw
1957,They should check where that ball was in his hand when he went out of bounds.,Steelers,3,1573417071,duedcw
1958,Wow that’s awful complete garbage effort all around on defense,Saints,1,1573417070,duedcw
1959,Slowest 8 yard run I've seen in a while lolol,Panthers,7,1573417067,duedcw
1960,"Charles Davis, and they prefer to be called black, not colored",Colts,2,1573417066,duedcw
1961,[deleted],,0,1573417059,duedcw
1962,Matt Ryan so fast,Broncos,5,1573417055,duedcw
1963,Is Lattimore hurt?,Saints,2,1573417055,duedcw
1964,I wonder what it feels like to have two solid recievers,Saints,3,1573417053,duedcw
1965,That's the price you pay when you don't account for the ability of a dual-threat QB like Matt Ryan,Falcons,5,1573417051,duedcw
1966,"Matt ""Michael Vick"" Ryan",Falcons,8,1573417051,duedcw
1967,Lattimore needs to get some painkillers or something ffs,Saints,0,1573417050,duedcw
1968,Hey I still think the Steelers caught that ball years ago and we woulda probably lost if it was called right,Patriots,1,1573417049,duedcw
1969,Fucking awful. Who was spotting him?,Saints,2,1573417046,duedcw
1970,Can Jordan has been to quiet today man..,Saints,1,1573417045,duedcw
1971,Julio has been insanely good for so long...,Saints,1,1573417041,duedcw
1972,When he isn't going against the CB1,Saints,-4,1573417041,duedcw
1973,Thermonuclear take.,Packers,1,1573417038,duedcw
1974,$latt RYAN SCRAMBLIN OUT,Falcons,3,1573417036,duedcw
1975,Oh good the announcers are saying what I've been noticed,Saints,1,1573417033,duedcw
1976,Pure speed,Vikings,3,1573417030,duedcw
1977,3rd down and free first watch,Saints,1,1573417025,duedcw
1978,Our defense without their best corner  has done a fine job against a top 5 offense,Saints,1,1573417023,duedcw
1979,DENNIS ALLEN STOP FUCKING BLOTZING,Saints,2,1573417005,duedcw
1980,Lol that one was a catch,Falcons,3,1573417000,duedcw
1981,"Julio, this brotha is somethin SPECIAL",,5,1573416997,duedcw
1982,[deleted],,0,1573416994,duedcw
1983,"and another false start not called on their WR, sigh.",Saints,-4,1573416983,duedcw
1984,Who is the color commentator? He's already getting on my nerves and I just turned the game on.,Steelers,4,1573416982,duedcw
1985,Same fucking play lmfao,Saints,1,1573416982,duedcw
1986,"Made a typo, meant to write it wasn’t a catch",Falcons,0,1573416982,duedcw
1987,4 of the falcons 6 penalties are obvious false starts lol,Saints,1,1573416979,duedcw
1988,Kevin Ridley’s at 3 to 28 idc,,0,1573416976,duedcw
1989,Missed false start,,2,1573416967,duedcw
1990,not having Lattimore completely changed this game,Saints,5,1573416967,duedcw
1991,Why do that when you can fit in an extra commercial,Falcons,2,1573416966,duedcw
1992,"CGJ is better in man to man than PJ, sigh.",Saints,4,1573416964,duedcw
1993,"Julio said, ""Fine, I'll catch it again""",Panthers,10,1573416962,duedcw
1994,Jones is fucking amazing,,6,1573416961,duedcw
1995,K that was pointless,Saints,3,1573416959,duedcw
1996,"Sure they do. If it benefits your team (or the team you want to win), it's a catch. Otherwise it's not.",Saints,1,1573416959,duedcw
1997,FUCK COMMERCIALS,Saints,2,1573416953,duedcw
1998,Hey he’s trying reeeeeeealy hard to be relevant!,Saints,2,1573416951,duedcw
1999,The Saints are the better team though.,Saints,1,1573416951,duedcw
2000,Once the falcons realize Julio is easy every play they will win this game. Marshon was clamping for the most part but now that’s he’s gone it’s 🤷‍♂️🤷‍♂️,Saints,7,1573416950,duedcw
2001,Julio Jones terrifies me.,,6,1573416938,duedcw
2002,Julio said Ill do it again then,Falcons,8,1573416935,duedcw
2003,The Saints just don't look good this week.  Atlanta came to play and got in the Saints' heads.,Saints,2,1573416933,duedcw
2004,All that and he ended up in the same spot lol,Seahawks,9,1573416924,duedcw
2005,Not a neutral but it might be tough to overturn since his arm was never not under the ball.,Falcons,0,1573416924,duedcw
2006,Inevitable,Falcons,6,1573416916,duedcw
2007,Hahahahahaha,Falcons,4,1573416911,duedcw
2008,Thats such crap,Falcons,-1,1573416909,duedcw
2009,[removed],,1,1573416905,duedcw
2010,"They might argue that the ground moved the ball, idk",,1,1573416904,duedcw
2011,just burned myself on this take,Falcons,4,1573416901,duedcw
2012,They are making shit up.  The back judge was spawned from Gary Cavaletto's Anus.,Saints,1,1573416899,duedcw
2013,i wish they would show the announcments wtf,Saints,9,1573416894,duedcw
2014,They need to require a conference championship to get in. Bama shouldn’t get rewarded for losing by giving them a bye before the playoffs.,Saints,2,1573416892,duedcw
2015,Latti is out,Saints,2,1573416892,duedcw
2016,Does teddy play defense?,Saints,3,1573416891,duedcw
2017,falcons aren’t the only ones great at losing in the playoffs lol,,2,1573416886,duedcw
2018,not a catch but it wont be overturned,,0,1573416879,duedcw
2019,huh? okay dude.,Saints,-1,1573416879,duedcw
2020,This is the facts here,,3,1573416877,duedcw
2021,[deleted],,1,1573416873,duedcw
2022,"Dumb challenge, because yeah it might be incomplete but not worth wasting the timeout",Saints,4,1573416873,duedcw
2023,I think. But who fucking knows with the nfl,Falcons,1,1573416872,duedcw
2024,Can't place the blame solely on pj Williams here. He's put in a bad situation. It's Julio fucking Jones. It's just an unlucky break.,Saints,2,1573416871,duedcw
2025,"I’m shocked they called it incomplete, they will still get another first down",Saints,2,1573416869,duedcw
2026,Wot,Falcons,1,1573416867,duedcw
2027,Better than 25 point meme,Saints,1,1573416866,duedcw
2028,Yes it was.  I’m completely neutral,Panthers,-2,1573416864,duedcw
2029,Bears fans can't talk shit about saints fans foh,Saints,1,1573416863,duedcw
2030,WHISTLE MEME TEAM,Falcons,2,1573416862,duedcw
2031,Have to maintain control to the ground.,Saints,7,1573416861,duedcw
2032,Yea it’s gotta be.,Falcons,1,1573416860,duedcw
2033,Only the rest of the world. Obvious af.,Saints,2,1573416858,duedcw
2034,I say no catch,Vikings,4,1573416851,duedcw
2035,That doesn't matter...,Saints,1,1573416850,duedcw
2036,Doesnt have to “survive the ground” anymore,Falcons,2,1573416849,duedcw
2037,[deleted],,3,1573416847,duedcw
2038,"Lets keep it real, NOBODY knows if thats a catch based on the NFL rules and the refs",Patriots,12,1573416847,duedcw
2039,TBF falcons are also off the bye and fighting for their coach,Saints,3,1573416846,duedcw
2040,28-3 28-3 28-3 28-3 28-3 28-3 28-3 28-3 28-3 28-3 28-3 28-3 28-3,Saints,1,1573416843,duedcw
2041,"Dang, didn’t expect him to run off, hopefully just a stinger",Packers,1,1573416841,duedcw
2042,Clearly not or else Julio should be targeted EVERY PLAY,Saints,1,1573416840,duedcw
2043,yup.  prob coming back,Falcons,1,1573416839,duedcw
2044,It wasn’t a catch,Panthers,6,1573416837,duedcw
2045,WHISTLE MEME TEAM,Falcons,-2,1573416836,duedcw
2046,Idk but four legit hands to the face calls in one game is absolutely pathetic,Falcons,0,1573416836,duedcw
2047,It’s a win-win either way. Beat the Aints in their house? WIN. Lose today? ALSO WIN,Falcons,1,1573416836,duedcw
2048,"Have to survive the ground on catch, incomplete

Lol nice edit",,1,1573416832,duedcw
2049,Seems like you're having trouble against a 1 win team. Sorry about that.,Falcons,1,1573416829,duedcw
2050,Isn't he down though? Pretty much all the way on the ground when it bobbles out.,Packers,3,1573416827,duedcw
2051,Clear drop,Saints,3,1573416826,duedcw
2052,It’s a clear drop,Saints,-1,1573416820,duedcw
2053,Yeah we got it you dont have to keep saying it,Saints,1,1573416817,duedcw
2054,What’s the old rule? Ball touched the ground without possession,Saints,2,1573416813,duedcw
2055,Can a neutral fan tell me if that was a catch?,Saints,9,1573416810,duedcw
2056,Didn't your guy literally elbow and hit our guy in the face earlier?,Saints,2,1573416807,duedcw
2057,"Idk if thats illegal hands then thats every single play, little accidental head grabs are a constant.",Saints,4,1573416806,duedcw
2058,Falcons came to play. Saints did not. Should be a crime for the Saints to lose this game especially come off the bye.,Saints,3,1573416805,duedcw
2059,We would be winning this game with teddy playing.,Saints,-9,1573416802,duedcw
2060,Leftover homemade chili and a dos equis amber to knock out the hangover....ahhhhhh,Rams,1,1573416802,duedcw
2061,Who knows at this point,,3,1573416801,duedcw
2062,Okay if this stands we know 100% what’s going on,Saints,-4,1573416796,duedcw
2063,It's a difference of 3 penalties...,Panthers,1,1573416795,duedcw
2064,We already know,Falcons,1,1573416794,duedcw
2065,[deleted],,1,1573416794,duedcw
2066,No way refs overturn this...,Saints,2,1573416793,duedcw
2067,Why can’t the 7-1 Saints defense stop the 1-7 Falcons offense?,Saints,0,1573416793,duedcw
2068,I saw that ball come out in real time,Saints,-3,1573416792,duedcw
2069,Yeah just call it on time and there would be a lot less skepticism,,1,1573416789,duedcw
2070,Not a catch,Panthers,3,1573416788,duedcw
2071,They salty about the rules being changed by a specific team.,Saints,3,1573416785,duedcw
2072,Especially while winning...,Saints,1,1573416785,duedcw
2073,[deleted],,3,1573416782,duedcw
2074,Pj 1 on 1 with julio. No safety help.,Saints,3,1573416781,duedcw
2075,That is incomplete I think,Saints,3,1573416778,duedcw
2076,They had to slow it down and zoom in to find it,Saints,3,1573416778,duedcw
2077,[deleted],,-8,1573416772,duedcw
2078,pj williams is pure unfiltered ass,Saints,-2,1573416772,duedcw
2079,NEW NICKNAME FOR AINTS = **WHISTLE MEME TEAM**,Falcons,-12,1573416772,duedcw
2080,"""Moved a bit""  thanks mr commentator",Rams,-1,1573416772,duedcw
2081,Too high,Saints,2,1573416772,duedcw
2082,Dats incomplete. It'll stand tho bet,Saints,2,1573416767,duedcw
2083,Good throw by Ryan there.,Saints,3,1573416763,duedcw
2084,That is not a catch. Good challenge.,Saints,-3,1573416760,duedcw
2085,$latt RYAN killing the game,Falcons,1,1573416759,duedcw
2086,Incomplete.,Saints,2,1573416758,duedcw
2087,Thats not a catch,Saints,0,1573416757,duedcw
2088,He dropped that ball,Saints,1,1573416756,duedcw
2089,Wouldn’t be shocked if this play stands,Saints,3,1573416753,duedcw
2090,"Just like your mothers filthy asshole

EDIT: You downvoting fucks mother's also have filthy assholes.",Saints,-4,1573416751,duedcw
2091,Anybody else see that ball pop out on the Julio catch?,Saints,7,1573416749,duedcw
2092,"No catch

Clear and obvious",Saints,-1,1573416749,duedcw
2093,If you can’t touch the face like that then it is a penalty. It’s really simple. Don’t touch it. Each replay has shown they do.,Falcons,0,1573416747,duedcw
2094,Refs have the Saints under a giant microscope,Saints,1,1573416747,duedcw
2095,Replay shows it clearly,Panthers,9,1573416747,duedcw
2096,I'm fine with 3-13 if the wins are against these fuckers,Falcons,6,1573416734,duedcw
2097,I’m glad the falcons haven’t realized completely that Marshon is out of the game. I think they are finding out tho,Saints,9,1573416731,duedcw
2098,Let’s go refs! Woooooooooo,Panthers,8,1573416730,duedcw
2099,"""That was questionable""

No fucking shit",Saints,1,1573416722,duedcw
2100,Thats a perfect ball right there,Falcons,0,1573416720,duedcw
2101,Refs haven’t been calling this game consistently at all,,0,1573416719,duedcw
2102,I mean he clearly grabbed dude’s facemask there. Saints are just shooting themselves in the foot.,Panthers,0,1573416718,duedcw
2103,My heart wants this win but my brain wants chase young.,Falcons,3,1573416716,duedcw
2104,Stop with the fucking blitzes Dennis Allen it's not working,Saints,1,1573416712,duedcw
2105,That was a terrible call..,Saints,3,1573416704,duedcw
2106,No.,Falcons,1,1573416703,duedcw
2107,"Lol

I mean come on

Refs are EAGLE EYED today but only on one side lmfao",Saints,6,1573416703,duedcw
2108,It prolly is,Panthers,2,1573416702,duedcw
2109, Nothing.  This is bullshit,Saints,-2,1573416700,duedcw
2110,Yea Charles Davis is a moron,Falcons,2,1573416698,duedcw
2111,What in the fuck is this hands to the face shit god damnit,Saints,3,1573416698,duedcw
2112,I mean you're not wrong,Falcons,2,1573416695,duedcw
2113,This is ridiculous,Saints,0,1573416695,duedcw
2114,Why you always lyin',Falcons,0,1573416694,duedcw
2115,WHAT THE FUCKING FUCK,Saints,2,1573416690,duedcw
2116,Don't let other NFC South or Rams fans catch you saying that,Saints,3,1573416689,duedcw
2117,"You love blowing leads, so keep that up.",Saints,3,1573416689,duedcw
2118,Try not putting hands to the face if you dont like the penalties,Rams,16,1573416685,duedcw
2119,Lol the Saints playing dirty as fuck,Falcons,-19,1573416683,duedcw
2120,"You can do this Atlanta, you don't want a top 5 pick",Dolphins,12,1573416680,duedcw
2121,That Bears fan that some douchey Saints fan almost tripped.... yeah he's a Ref. Think about your actions people!,,1,1573416678,duedcw
2122,This announcer obviously hasn't watched the NFL in about 20 years.,Steelers,1,1573416675,duedcw
2123,HOOPER JUST BLOCKED THAT GUY DOWNFIELD BEFORE THE PASS,Texans,6,1573416675,duedcw
2124,how the fuck does the back judge see that,Saints,4,1573416674,duedcw
2125,Tell me that wasn't soft as fuck I'll call you a liar,Saints,8,1573416667,duedcw
2126,This is fucking pathetic.,Dolphins,2,1573416667,duedcw
2127,AJ Green also plays no games period lol,Falcons,0,1573416667,duedcw
2128,Stop shoving your hands into faces!,Falcons,2,1573416666,duedcw
2129,Is it so hard to NOT put your hands to the face?,Saints,14,1573416656,duedcw
2130,What the fuck,Saints,4,1573416655,duedcw
2131,It was make believe,Saints,2,1573416655,duedcw
2132,Super dope name.,Saints,1,1573416654,duedcw
2133,These fucking refs do not want us to win.,Saints,-3,1573416653,duedcw
2134,"If they can give first to the Falcons on a 3rd down, by God they’re gonna do it",Saints,3,1573416652,duedcw
2135,That was uhhhh rather late,Saints,0,1573416650,duedcw
2136,Good call,Saints,6,1573416645,duedcw
2137,"He never touched him in the face
Edit: Nevermind was looking at the wrong player on the first replay",Saints,-4,1573416645,duedcw
2138,Oh come the fuck on with the fucking flags,Saints,0,1573416641,duedcw
2139,Saints love these hands to the face today,Falcons,3,1573416640,duedcw
2140,Refs bet Atlanta to cover the spread,Texans,-1,1573416637,duedcw
2141,"There is no way this is 4 down territory for the falcons on the Saints 40, dumbass announcers",Texans,4,1573416636,duedcw
2142,Ryan looks like he is really struggling with the ankle,Falcons,3,1573416631,duedcw
2143,Make believe bullshit,Saints,-4,1573416630,duedcw
2144,thats ridiculous,Saints,0,1573416628,duedcw
2145,I honestly expected it close but a bit higher scoring. Though these two teams do tend to score on each other late when the defenses are tired.,Saints,1,1573416624,duedcw
2146,AJ Green plays no games when blocking.,Bears,2,1573416617,duedcw
2147,I cannot stress enough the bullshit the refs have been calling on the most important downs for the Saints,Texans,7,1573416616,duedcw
2148,Right? When we work it with kamara everyone loves it lol,Saints,1,1573416614,duedcw
2149,Again with this shit,Saints,5,1573416614,duedcw
2150,Jesus aints. Hands off faces!,Falcons,-1,1573416601,duedcw
2151,Another flag. Another hands to the face call.,Saints,8,1573416599,duedcw
