,body,author_flair_text,score,created_utc,link_id
512,Holy shit Kelce is just ABUSING the Broncos.  It's fun!,Chiefs,10,1576441054,eb1r02
513,Kelce is a fucking stud,Chiefs,9,1576441053,eb1r02
514,Snow games are so fun to watch but I wish this one was more competitive.,49ers,1,1576441052,eb1r02
515,"Not always, you can still tie and lose due to SOS.",Broncos,1,1576441044,eb1r02
516,Kelce is a snowman,Chiefs,5,1576441037,eb1r02
517,Bullshit call into another int. You love to see it.,Chiefs,6,1576441035,eb1r02
518,Kelce is the best TE in the NFL.,Chiefs,7,1576441031,eb1r02
519,"""Kittle is the best TE this year - no question.""

Fucking LOL",Chiefs,30,1576441029,eb1r02
520,I’m having a hard time right now boy’s...,Broncos,5,1576441028,eb1r02
521,What a dickbutt,Chiefs,1,1576441021,eb1r02
522,After the first quarter...,Chiefs,0,1576441019,eb1r02
523,[deleted],,1,1576441017,eb1r02
524,Good try,Chiefs,1,1576441013,eb1r02
525,The reigning MVP baby,Chiefs,7,1576441011,eb1r02
526,"Man, what a catch. Kelce is nuts",Chiefs,9,1576441008,eb1r02
527,Horse cock shriveling in the cold.,Chiefs,3,1576441006,eb1r02
528,God I love Kelce,,7,1576441006,eb1r02
529,Zeus,Chiefs,2,1576441003,eb1r02
530,What a fucking throw and catch,Chiefs,5,1576441003,eb1r02
531,locks just playing fair 🙂,Broncos,1,1576440994,eb1r02
532,Mile High is in that stretch about 15 miles where it doesn't get a lot of snow in early winter.,Broncos,2,1576440994,eb1r02
533,The ball dont lie,Texans,2,1576440989,eb1r02
534,Hahaha ball dont lie. What a weak ass holding call anyway. If Fouts was on our side it's a bad call.,Chiefs,4,1576440987,eb1r02
535,This is why I go to these threads,Ravens,1,1576440986,eb1r02
536,Broncos have left the thread.,Chiefs,3,1576440985,eb1r02
537,"No doubt.  I just hate what his son has done, and hate that's the first thing that comes to mind.  Winslow Sr was AMAZING as a TE.",Chiefs,1,1576440981,eb1r02
538,I understand that but it is a possibility and I was just curious in-case.,Chiefs,1,1576440978,eb1r02
539,[deleted],,1,1576440977,eb1r02
540,"back to back picks, I guess I'm alright with that questionable call now",Chiefs,1,1576440976,eb1r02
541,Darwin is looking nice recently,Chiefs,3,1576440974,eb1r02
542,"So, INT anyways, but a touch back instead of getting it at like the 10.

Good thinking with that hold, Ward.",Chiefs,20,1576440971,eb1r02
543,Lock certainly is playing like a cock,Chiefs,2,1576440963,eb1r02
544,"No, Fouts is much dumber.",Chiefs,2,1576440959,eb1r02
545,More Thompson.,Chiefs,1,1576440958,eb1r02
546,Oh boy...rookie throw there,Broncos,1,1576440956,eb1r02
547,Umm you know every division winner is in the playoffs,Chiefs,0,1576440954,eb1r02
548,DTRAIN TIME,Chiefs,3,1576440953,eb1r02
549,Lol back to back INTs. Juan has 2 in the last 3 games I think,Chiefs,5,1576440951,eb1r02
550,"that's fair, chiefs should have had an INT anyways",Broncos,10,1576440951,eb1r02
551,Typical of a Mizzew QB,Chiefs,12,1576440950,eb1r02
552,Thank you refs 😂😂😂,,0,1576440950,eb1r02
553,Welp...alrighty then,Broncos,2,1576440949,eb1r02
554,Impossible... for Lock,Chiefs,1,1576440949,eb1r02
555,We can bitch about both,Chiefs,2,1576440949,eb1r02
556,Oh well. Ball don’t lie,Chiefs,2,1576440948,eb1r02
557,I know it doesn't matter now but he didn't hold.,Chiefs,1,1576440947,eb1r02
558,Why'd you all have to start talking about the refs being good?,Chiefs,2,1576440945,eb1r02
559,nice try refs,Chiefs,1,1576440944,eb1r02
560,Tannehill had a decade on that last TD,Chiefs,1,1576440944,eb1r02
561,"First he said something about optics, and then I guess tried to walk his way back from it",Ravens,1,1576440944,eb1r02
562,"Pick:  Called back.
Pick:  Okay, we'll keep this one.",Chiefs,4,1576440942,eb1r02
563,"That was such a weak holding call, but damn if I didn’t laugh my ass off at another interception",Chiefs,7,1576440939,eb1r02
564,Now we get the pick after phantom holding. Ball don't lie,Chiefs,6,1576440938,eb1r02
565,BALL DON'T LIE BITCH ASS ZEBRAS,Chiefs,5,1576440937,eb1r02
566,Maybe don’t order the gold blazer for Lock just yet.,,1,1576440936,eb1r02
567,"Thornhill out here making plays since I momentarily thought he might have died in the first half.

Love this fucking playmaking defense now. You know I love the offense. No matter where we go, I'll always love this fucking team.",Chiefs,5,1576440934,eb1r02
568,"Got another weak call for us, now?",Chiefs,2,1576440934,eb1r02
569,He wasn’t already???,Chiefs,1,1576440934,eb1r02
570,Ball don't lie,,4,1576440933,eb1r02
571,Ball don’t lie,Chiefs,3,1576440933,eb1r02
572,hahaha sorry Broncos,Chiefs,1,1576440933,eb1r02
573,"Goodell: ""Shut 'em down, we need a ball game here.""",Saints,2,1576440932,eb1r02
574,Lol well I guess the penalty didn't matter,Chiefs,1,1576440929,eb1r02
575,[deleted],,1,1576440928,eb1r02
576,"Oh well, that’s just as good",Chiefs,1,1576440925,eb1r02
577,Thornhill&gt; lock.,Chiefs,4,1576440924,eb1r02
578,"Yeh, nah that wasnt a flag lol",Broncos,3,1576440919,eb1r02
579,Ball don't lie,Chiefs,3,1576440917,eb1r02
580,Is Fouts the next Buck?,,3,1576440914,eb1r02
581,Thompson time.,,1,1576440913,eb1r02
582,Lock pls,,2,1576440913,eb1r02
583,Stupid flag,Chiefs,1,1576440913,eb1r02
584,[deleted],,4,1576440912,eb1r02
585,"""That's rookie on rookie""  LOL What is he even trying to convey here?",Chiefs,3,1576440911,eb1r02
586,Ball don’t lie.,Chiefs,6,1576440911,eb1r02
587,Weakest hold call I’ve seen on us this year.,,1,1576440911,eb1r02
588,What a bullshit holding call. So sick of the nfl and their trash refs,Chiefs,4,1576440910,eb1r02
589,What the fuck was that refs,Chiefs,4,1576440909,eb1r02
590,Smh Matthieu stat padding just drop the INT on 4th down.... Wait nvm,Chiefs,2,1576440908,eb1r02
591,Thought the refs did Lock a favor there. Actually just made him look worse :/ tough one,Chiefs,6,1576440906,eb1r02
592,Jesus,Broncos,1,1576440906,eb1r02
593,Yea call another phantom flag on that,Chiefs,3,1576440904,eb1r02
594,i think the microwave was on popcorn setting,Ravens,1,1576440903,eb1r02
595,I’m not about to bitch about that call after last week.,Chiefs,1,1576440903,eb1r02
596,"Goofy: 



WE WILL FUCKING DO IT AGAIN",Chiefs,9,1576440902,eb1r02
597,Well that was lame,Chiefs,1,1576440900,eb1r02
598,Holy shit that was soft,Chiefs,2,1576440900,eb1r02
599,Ball don't lie.,Chiefs,1,1576440898,eb1r02
600,Well that worked out.,Chiefs,1,1576440893,eb1r02
601,Bad call but I’ll take it,Broncos,1,1576440891,eb1r02
602,"Even Drew Lock thought that bailout call was too much.

Edit: words",49ers,2,1576440890,eb1r02
603,"Fuck you refs, get some.",Chiefs,1,1576440889,eb1r02
604,Ball don't lie still the worst phrase in sports.,Chiefs,2,1576440889,eb1r02
605,Ball don’t lie,Chiefs,1,1576440889,eb1r02
606,"Ball don't lie, I guess",Chiefs,4,1576440889,eb1r02
607,Well that works I guess,Chiefs,4,1576440888,eb1r02
608,Or even your teammate!,Chiefs,1,1576440887,eb1r02
609,This is what happens when you try to alter the timeline. Some things are historically inevitable.,Chiefs,4,1576440886,eb1r02
610,actually medium rare? or lava-hot-spots + ice?,Chiefs,1,1576440884,eb1r02
611,try to call that one back,,2,1576440884,eb1r02
612,BALL DONT LIE FUCK THE REFS,Chiefs,3,1576440883,eb1r02
613,3 INTs in 4 games honey badger is in his goddamn prime,Chiefs,2,1576440883,eb1r02
614,Call that one back bitches,Chiefs,4,1576440882,eb1r02
615,Ball don't lie,Chiefs,2,1576440882,eb1r02
616,Ball don't lie,Chiefs,5,1576440879,eb1r02
617,"""man, they called holding on ward there?""

*time passes*

""man""",Ravens,14,1576440878,eb1r02
618,"Something something ""optics"" then ""germaphobe"" then ""grip"" then ""that's why I like working with you."" Is he having a stroke?",Ravens,1,1576440877,eb1r02
619,Throw a flag on that you fucking zebras!!!,Chiefs,3,1576440877,eb1r02
620,Weak ass call,Chiefs,1,1576440877,eb1r02
621,"Game!

Edit: fuck",Chiefs,1,1576440876,eb1r02
622,Doesn't mean you made the playoffs.,Broncos,1,1576440874,eb1r02
623,lol we'll just do it again!,Chiefs,6,1576440874,eb1r02
624,Lmao. Gotta keep the game interesting I guess.,Chiefs,4,1576440874,eb1r02
625,Hahahahahahaha Lock Picked!,Chiefs,2,1576440874,eb1r02
626,Ball don't lie,Chiefs,6,1576440873,eb1r02
627,Throw a flag on that one assholes,Chiefs,1,1576440873,eb1r02
628,LOL omg,Broncos,1,1576440873,eb1r02
629,The Snowy Badger got 'em.,Panthers,3,1576440871,eb1r02
630,Lmao,Chiefs,3,1576440870,eb1r02
631,Lmao,Chiefs,4,1576440870,eb1r02
632,Haha LMFAO... Fuck you refs,Chiefs,2,1576440870,eb1r02
633,Ball don't lie.,Chiefs,7,1576440869,eb1r02
634,Ball don't lie,Chiefs,10,1576440868,eb1r02
635,The football gods said nah fuck you refs.,Chiefs,5,1576440867,eb1r02
636,Ball don't lie.,Chiefs,5,1576440867,eb1r02
637,Fuck you refs.,Chiefs,6,1576440867,eb1r02
638,"Defender in general area of receiver, five yard penalty.",Chiefs,3,1576440865,eb1r02
639,Get fucked donkeys,Chiefs,11,1576440864,eb1r02
640,Woooow,,3,1576440862,eb1r02
641,Fucking lol,Chiefs,2,1576440862,eb1r02
642,Oof. Not on the same page or bad throw,Broncos,2,1576440862,eb1r02
643,It's actually pretty dry out there.  High elevation and most of the moisture comes from the gulf of Mexico.,Chiefs,1,1576440861,eb1r02
644,“Ball don’t lie”,Chiefs,6,1576440861,eb1r02
645,Stats don't look as good then lol,Chiefs,1,1576440861,eb1r02
646,"Lol, ball dont lie.",,5,1576440860,eb1r02
647,Lmao. Karma,Chiefs,2,1576440858,eb1r02
648,"Wow, you wanna complain about any more calls?",Chiefs,5,1576440858,eb1r02
649,ThE rEfS aRe HeLpInG tHe ChIeFs,Chiefs,12,1576440857,eb1r02
650,"It used to always do it when I lived in Aurora.. Maybe it was just me.
I loved Colorado though, easily one of my top places I wanna go back to.",Ravens,1,1576440845,eb1r02
651,Phantom hold,Chiefs,4,1576440844,eb1r02
652,What,Chiefs,4,1576440842,eb1r02
653,That’s a horrible call,Chiefs,5,1576440841,eb1r02
654,Not great vs to the past 2 weeks i mean. But yeh drops and  couple miscues.,Broncos,1,1576440840,eb1r02
655,Weak call,Broncos,5,1576440840,eb1r02
656,Weak call,Chiefs,3,1576440839,eb1r02
657,Something about how he doesn't like being helped up. Then tried to play it off as germs.  And I probably made it sounds smarter than what he actually said.,Chiefs,1,1576440836,eb1r02
658,OMG it was a blitz and he got rid of the ball instantly how in the fuck did you hold.,Chiefs,4,1576440836,eb1r02
659,Weak ass call,Chiefs,5,1576440836,eb1r02
660,Oof...,Chiefs,0,1576440835,eb1r02
661,wait what the fuc ???,Broncos,1,1576440834,eb1r02
662,Worst Announcer in football,Chiefs,1,1576440833,eb1r02
663,[deleted],,1,1576440831,eb1r02
664,[deleted],,1,1576440824,eb1r02
665,I thought he was going the route of officials shouldn’t be helping players up like it’s a favoritism thing. But no hes worried about dingleberries on people’s hands.,Cowboys,1,1576440824,eb1r02
666,Jinx!,Chiefs,2,1576440821,eb1r02
667,Oh... fuck you.,,3,1576440814,eb1r02
668,Lol lost 15 yards with the pick. Just knock it down.,Chiefs,4,1576440807,eb1r02
669,Booger &gt; Fouts,Chiefs,1,1576440806,eb1r02
670,Honey Badger is a beast. He has changed the mentality of our D.,Chiefs,5,1576440801,eb1r02
671,How'd they miss the offsides there?,Broncos,-1,1576440800,eb1r02
672,Honey. Badger.,Chiefs,2,1576440800,eb1r02
673,We in garbage time yet?,Broncos,1,1576440800,eb1r02
674,HONEY BADGER,Chiefs,1,1576440797,eb1r02
675,🍯 🦡,Chiefs,1,1576440794,eb1r02
676,lol oh no 😔,Broncos,1,1576440790,eb1r02
677,"Basically said you don't want the nasty ref to touch you, ever.",Chiefs,1,1576440788,eb1r02
678,Yes Dan. Hands will mess up your grip. Not the 4 inches of snow. Hands.,Chiefs,3,1576440786,eb1r02
679,Matheiu is so great to watch.  Reminds me of a slightly lesser Berry.,Chiefs,1,1576440780,eb1r02
680,Steak and cheese is 🔥,Chiefs,1,1576440774,eb1r02
681,I can't stand Dan Fouts...,Chiefs,3,1576440771,eb1r02
682,We are improving and things look bright for 2020.,Broncos,0,1576440768,eb1r02
683,"not at all, its medium rare",Ravens,2,1576440768,eb1r02
684,"He's looked solid to me, to be honest. But yeah, doesn't help when your receivers drop the ball",Chiefs,1,1576440763,eb1r02
685,What did I just hear come out of Fouts mouth?,Chiefs,4,1576440761,eb1r02
686,What’d I miss?,Chiefs,1,1576440756,eb1r02
687,Ok Fouts,Broncos,3,1576440755,eb1r02
688,[deleted],,2,1576440755,eb1r02
689,i like s and m,Ravens,2,1576440747,eb1r02
690,"Can't tip, stuff on their hands.",Chiefs,3,1576440741,eb1r02
691,He seems to have curbed his chiefs hatred today at least.  Stupid commentary aside.,Chiefs,1,1576440741,eb1r02
692,What a stupid reason to refuse to be helped up,Chiefs,7,1576440740,eb1r02
693,What the fuck drugs did these announcers take?,Chiefs,7,1576440733,eb1r02
694,Fouts is so terrible smh,Chiefs,3,1576440731,eb1r02
695,That sounds wonderful.,Broncos,2,1576440727,eb1r02
696,plaid and 4 cheese,Ravens,2,1576440723,eb1r02
697,Denver doesn't get that much snow before January. It usually stays in the mountains.,Broncos,1,1576440721,eb1r02
698,"If someone has so much shit on their hands that you can't clap after they help you up, something is fucking wrong with them",,3,1576440721,eb1r02
699,It's not unheard of.,Chiefs,1,1576440719,eb1r02
700,My god is Fouts chocolate wasted there?,Chiefs,6,1576440717,eb1r02
701,how badly did you burn your mouth with the first bite?,Chiefs,2,1576440713,eb1r02
702,Fouts is the type to have a $100 dinner and not tip,Chiefs,8,1576440712,eb1r02
703,4 cheese pizza. its ok. i don't like hot pockets much,Ravens,3,1576440708,eb1r02
704,That has legitimately been a viable strategy against us.,Chiefs,3,1576440708,eb1r02
705,Are you in KC? Didn't k ow you could get Toppling Goliath there,Chiefs,1,1576440707,eb1r02
706,Holy delay of game.,Chiefs,0,1576440707,eb1r02
707,What flavor of hot pocket and what color of underwear?,,2,1576440706,eb1r02
708,"Could it be that last week was such a shitshow by comparison that we have readjusted??  

(But seriously it’s been great today)",Chiefs,2,1576440704,eb1r02
709,I’m pretty sure that’s KCs game plan to. Get a demanding lead and blow it in the 4th,Chiefs,1,1576440697,eb1r02
710,Fouts is such a moron,Chiefs,10,1576440688,eb1r02
711,Why do you have a fork in your underwear?,Chiefs,3,1576440681,eb1r02
712,I blame the broncos.,Chiefs,4,1576440680,eb1r02
713,Why do you have a fork in your underwear?,Chiefs,2,1576440679,eb1r02
714,Did you burn your tongue on the first bite?,Cowboys,1,1576440677,eb1r02
715,I want this rivalry to be good again,Broncos,3,1576440675,eb1r02
716,Why keep a fork in your underwear? Does it hurt?,Chiefs,2,1576440674,eb1r02
717,What flavor?,Chiefs,2,1576440673,eb1r02
718,What flavor?,Chiefs,2,1576440671,eb1r02
719,amen to that,Chiefs,3,1576440670,eb1r02
720,"Before Shannon Sharpe/Tony G, Kellen Winslow was by far the best TE ever.

Now all we can think about is his sex offender son",Chiefs,2,1576440658,eb1r02
721,It's all in the game plan...get Chiefs to think they have the game in the bag and come back in the 4th...,Broncos,1,1576440653,eb1r02
722,https://www.reddit.com/r/nfl/comments/e82922/grathoff_the_kansas_city_chiefs_have_clinched_the/?utm_medium=android_app&amp;utm_source=share,Chiefs,0,1576440644,eb1r02
723,What did any of us do to end up with these shit announcers.,Texans,22,1576440642,eb1r02
724,Well currently the Bills aren't even winning their own division so...,Chiefs,1,1576440640,eb1r02
725,"Lock hasn’t been that great, but fuck man the drops dont help",Broncos,3,1576440636,eb1r02
726,"Ah yeah, you're probably right",Chiefs,1,1576440620,eb1r02
727,It really doesn't snow that much. Most days it's cold but sunny.,,3,1576440612,eb1r02
728,"Broncos fans have turned into some cool people in this thread, and I appreciate it. SD is ???, Raiders are getting better but with Lock and some acquisitions you'll be right there with us again at the top of Everest. See you there. It's going to happen sooner than later and it pisses me off. lol",Chiefs,2,1576440593,eb1r02
729,im currently eating a hotpocket with a fork in my underwear. AMA,Ravens,8,1576440592,eb1r02
730,They aren’t allowed to grasp the facemask,Chiefs,2,1576440590,eb1r02
731,I genuinely have no idea where they are on the field. It's great,Steelers,4,1576440572,eb1r02
732,Probably the endzone paint.,Chiefs,3,1576440564,eb1r02
733,Imagine being so dumb you see a team up by 20 and complain about their offense.,Chiefs,1,1576440550,eb1r02
734,They aren’t allowed to wrap the fingers like he did.,Chiefs,3,1576440536,eb1r02
735,No we are in because we clinched the division last week,Chiefs,1,1576440534,eb1r02
736,I appreciate you.,Chiefs,3,1576440516,eb1r02
737,Reid gets itchy with a good lead and lots of time left. Gotta let his foot off the gas.,Chiefs,2,1576440513,eb1r02
738,"I was hoping someone know off-hand who currently holds the tie-breaker between the Bills and Chiefs, but thanks.",Chiefs,2,1576440498,eb1r02
739,McGovern looks like he has a bunch of blood on his jersey but it's probably just from a Chiefs jersey,Chiefs,1,1576440495,eb1r02
740,Dr. Pavel. I'm CIA.,Saints,2,1576440487,eb1r02
741,How does Denver not do better in the snow? Like 9 times out of 10 you're getting snow due to the Rockies.,Ravens,2,1576440484,eb1r02
742,"The last af record got pretty good critical acclaim. Yes it sounds way different than af 1, but kinsella has changed significantly from when he was 18–both as a musician and as a person",,1,1576440476,eb1r02
743,why do I let the Broncos make me sad every fucking week?,Broncos,1,1576440472,eb1r02
744,I'd like to see lock make some adjustments and score some points. Let's make it a game again.,,1,1576440463,eb1r02
745,Its unfortunate,Broncos,1,1576440455,eb1r02
746,Good luck in the wasteland.,Chiefs,6,1576440450,eb1r02
747,Lmao he's been a good noodle,Chiefs,2,1576440449,eb1r02
748,I was thinking the same thing.,Chiefs,0,1576440437,eb1r02
749,Hell yea...watch out cuz here we come,Broncos,1,1576440434,eb1r02
750,"🚨🚨 I come to you with a heavy heart. The Bengals are now losing to the Pats 27-10. As you're probably already aware, life ain't fair sometimes. Sirens go out at the moment, but here's hoping the Bills nephew them next week.",Chiefs,8,1576440432,eb1r02
751,"You haven't made the playoffs, you are going to tie and not make it due to SOS.",Broncos,1,1576440423,eb1r02
752,"""Pringle getting a little salty.""

Fuck you.",Bills,12,1576440416,eb1r02
753,Just like last year lol.,Chiefs,2,1576440412,eb1r02
754,"This is a huge drive here for Denver. If they don’t score a TD, that’s game and I can exchange my headphones at target.",Chiefs,7,1576440407,eb1r02
755,loaded and ready to go,Dolphins,2,1576440400,eb1r02
756,Perfect attendance,Chiefs,6,1576440398,eb1r02
757,Should’ve been illegal contact to the head on the Broncos as well.,Chiefs,2,1576440392,eb1r02
758,What a horrible play safe drive by the chiefs,Patriots,-5,1576440380,eb1r02
759,They’ve got each other........,Chiefs,2,1576440377,eb1r02
760,I got downvoted for pointing out the actual rule. They're pretty salty about it.,Chiefs,2,1576440374,eb1r02
761,Called Mahomes for that last game and missed Robinson facemask earlier but sure,Chiefs,6,1576440372,eb1r02
762,Weird rule but ballcarriers are allowed,Chiefs,5,1576440372,eb1r02
763,oh he got jokes huh,Dolphins,3,1576440370,eb1r02
764,"Pringle getting salty 

Pick your flavor.

Yeah, he's been saving those...",Chiefs,8,1576440368,eb1r02
765,[removed],,1,1576440359,eb1r02
766,He has the headset.  One on defense captain too.,Chiefs,1,1576440347,eb1r02
767,No division record. Doesn’t matter that we’re in different divisions IIRC.,Chiefs,3,1576440334,eb1r02
768,You know we are in the playoffs and won the division already right?,Chiefs,2,1576440325,eb1r02
769,nflbite.com,Chiefs,1,1576440324,eb1r02
770,"Means he's wearing a mic to talk to the sideline. 

A defender will have one, too.",Chiefs,4,1576440322,eb1r02
771,Once you pop youuu can't facemask.,Broncos,3,1576440316,eb1r02
772,No i was born in 2016.  Did the Broncos used to win games against us?,Chiefs,-1,1576440315,eb1r02
773,Lol they both did it but okay.,Chiefs,14,1576440314,eb1r02
774,Just giving them more tape,Chiefs,1,1576440314,eb1r02
775,[deleted],,0,1576440313,eb1r02
776,Alright here comes the comback! Right!?......right?? Guys?,Broncos,5,1576440313,eb1r02
777,He's calling his own plays now.,Chiefs,1,1576440313,eb1r02
778,I think it means that it has a radio in it so he can get the play calls.,,2,1576440310,eb1r02
779,Means he has a radio.,Broncos,2,1576440307,eb1r02
780,Indicates it's the player on the field with a radio in their helmet.,Chiefs,2,1576440305,eb1r02
781,"It means he has a headset to hear play call,",Chiefs,2,1576440304,eb1r02
782,"Only the 3rd quarter but the game already feels over, Broncos coming out flat.",Broncos,9,1576440289,eb1r02
783,"donkeys in some threads are complaining about the helmet-to-helmet against Kelce, but yeah its been fine",Chiefs,1,1576440283,eb1r02
784,"We have to fucking punt?

WHAT THE FUCK?",Chiefs,9,1576440279,eb1r02
785,Only one really questionable call comes to mind.,Chiefs,6,1576440271,eb1r02
786,What's the green sticker om Mahomes helmet?,Chiefs,2,1576440261,eb1r02
787,"Tiebreakers... 

Apply division tie breaker to eliminate all but the highest ranked club in each division prior to proceeding to step 2.

Head-to-head, if applicable. (For ties among three or more teams, this step is only applied if there is a head-to-head sweep; i.e., if one club has defeated each of the others or if one club has lost to each of the others.)

Best won-lost-tied percentage in games played within the conference.

Best won-lost-tied percentage in common games, minimum of four.

Strength of victory (record of all the teams they defeated that season).

Strength of schedule (record of all the teams they played that season).

Best combined ranking among conference teams in points scored and points allowed.

Best combined ranking among all teams in points scored and points allowed.

Best net points in conference games.

Best net points in all games.

Best net touchdowns in all games.",Chiefs,1,1576440248,eb1r02
788,"I’m not getting the game. At first it was this weird show, and it’s Pro Fishing.",Rams,2,1576440239,eb1r02
789,Kebert Xela,Chiefs,3,1576440236,eb1r02
790,[deleted],,0,1576440211,eb1r02
791,This has been a really clean game officiating-wise.,Chiefs,7,1576440200,eb1r02
792,[deleted],,1,1576440191,eb1r02
793,Yeah no chance we beat teams like the Pats or Ravens this year.,Chiefs,6,1576440190,eb1r02
794,Is SOS the first tie breaker?,Chiefs,0,1576440190,eb1r02
795,That'll be a great NFL films shot,Chiefs,1,1576440189,eb1r02
796,"It's not exactly meant for snow, especially at these rates. The grass would fry if it got hot enough to melt snow.",,3,1576440184,eb1r02
797,My robe doesn't have super powers,,-2,1576440183,eb1r02
798,Buffalo you're our only hope,Chiefs,2,1576440176,eb1r02
799,Random question: Who are they gonna get to replace Alex Trebek?,Bills,1,1576440149,eb1r02
800,What if Buffalo wins the East and ties with the Chiefs. Who would get the #2 seed then?,Chiefs,1,1576440137,eb1r02
801,Yea saw your ninja edit. Wonder if any other teams do this.,Steelers,1,1576440135,eb1r02
802,"*IMO* 
My top 5 would be..  Antonio Gates, Jason Witten, Heath Miller *says alot as a Ravens fan*

Ozzie Newsom for making the Browns look good. 
And
Dave Casper.",Ravens,1,1576440134,eb1r02
803,How long y’all plan on rebuilding?,Chiefs,2,1576440131,eb1r02
804,"Flicked the frenulum for a bit there in the first quarter, then hung us out to dry.",Chiefs,3,1576440130,eb1r02
805,Gonna be fun when you go one and done again,Broncos,-2,1576440128,eb1r02
806,Were you born last year?,Broncos,1,1576440128,eb1r02
807,"Ha. I see what you mean, but the purpose isn’t to keep the snow off, it’s to keep the turf from becoming like concrete.",Chiefs,3,1576440110,eb1r02
808,"Give it time, he'll be in soon enough.",Panthers,11,1576440107,eb1r02
809,We have the excuse of a rebuilding year. You don't.,Broncos,-1,1576440098,eb1r02
810,"Death, taxes and the Chiefs kicking the Broncos ass.",Chiefs,1,1576440092,eb1r02
811,But you’ll win as many playoff games as the Broncos.,Broncos,-4,1576440091,eb1r02
812,Yeah Booker getting a carry is a bad look.,Broncos,2,1576440088,eb1r02
813,🤯,Chiefs,3,1576440088,eb1r02
814,*Vikings hang their head in disgrace*,Chiefs,5,1576440078,eb1r02
815,At least we will be playing in the playoffs.,Chiefs,4,1576440070,eb1r02
816,I'm excited for you guys not to be in the playoffs again.,Chiefs,3,1576440056,eb1r02
817,*yet,Chiefs,10,1576440051,eb1r02
818,Yet.,Chiefs,10,1576440035,eb1r02
819,So glad to see the defense coming together at the right time of year,Chiefs,6,1576440032,eb1r02
820,"🤔🤔🤔


You might have a point",Chiefs,3,1576440029,eb1r02
821,Been looking better each game for the past few weeks.,Chiefs,6,1576440023,eb1r02
822,I would've killed for a heated bench in highschool,Chiefs,2,1576440021,eb1r02
823,"Phew, Kelce still holding a slight 120 - 119 total yardage lead over the entire Broncos team.",Chiefs,16,1576440019,eb1r02
824,Entirety. I believe they shovel the hash/sideline/numbers,Chiefs,2,1576440013,eb1r02
825,It happened well before him.  Look up Kelce’s career stats.  Kelce averages like 150 and a TD against Denver,Chiefs,3,1576440011,eb1r02
826,Bungles gonna Bungle,Chiefs,3,1576440005,eb1r02
827,Lmao at least we arent getting shredded by matt fucking moore,Broncos,21,1576440001,eb1r02
828,I wasn't thinking about Winslow (his son unfortunately has tarnished that name).  But you are 100% correct.  AFC West is the breeding ground for HOF TEs.,Chiefs,4,1576440001,eb1r02
829,It's either Kelce or Hill. Hill can make bigger plays with his speed.,Chiefs,2,1576439993,eb1r02
830,Useless fucking Bungles.,Bills,5,1576439984,eb1r02
831,I’m excited for you guys to go one and done again in the playoffs,Broncos,-6,1576439967,eb1r02
832,"*Dinkleb- I mean, Sutton*",Chiefs,2,1576439966,eb1r02
