,body,author_flair_text,score,created_utc,link_id
0,It was Alex Smith pretty much every year he was here. (I think he never got the credit he deserved for that. His charity is incredibly moving.) And it been Colquitt since then,Chiefs,1,1576519568,eb1r02
1,"Ohhh, you're a gamer. No wonder; you have the, brain of a child. Never mind, forget everything I said.",,1,1576498211,eb1r02
2,"You did beat us once, but that was before the transformation so i'm curious on how it will go this time around. :3",Ravens,1,1576491874,eb1r02
3,It is known!,Chiefs,1,1576478955,eb1r02
4,"He's a winner. Ultimately, that's all that matters.",,0,1576469992,eb1r02
5,Not if you don't require them to aim anybody in particular as long as it's another cameraman. That's basically what was happening on screen.,Chiefs,1,1576468472,eb1r02
6,"His beard may get in the way of his tusks, no beard please",Chiefs,1,1576465116,eb1r02
7,See you in the playoffs... you are terrifying,Chiefs,2,1576465059,eb1r02
8,"If you only beat us once every 5 years, I’m good with that",Chiefs,1,1576464994,eb1r02
9,"If the result of that play stood, the game is all but over. There was nothing to lose by throwing the challenge so he took the very low percentage chance that could keep him in the game.",,1,1576447017,eb1r02
10,"Yep, just a  hail mary situation for the coach. Nothing to lose if you fail and a ton to gain but a very low probability chance.",,1,1576446900,eb1r02
11,Good point. Have an internet point,Chiefs,1,1576445942,eb1r02
12,GG and props to Lock,Chiefs,3,1576445887,eb1r02
13,Rod smith?,Chiefs,1,1576445631,eb1r02
14,"But fouts was a qb, wtf",Chiefs,2,1576445413,eb1r02
15,Sounds like a metal band / album name.,Chiefs,2,1576445013,eb1r02
16,"*Next year comes around.* ""GG Chiefs I meant we will get you **next** year, I SWEAR!""",Chiefs,11,1576444848,eb1r02
17,He is already a super model tho.,Chiefs,1,1576444667,eb1r02
18,Yeh i get it,Broncos,1,1576444550,eb1r02
19,"Less an indictment of him, more how he got knocked down on almost every drop back in the fourth quarter. You could tell he just looked defeated in his face toward the end there.",Chiefs,1,1576444358,eb1r02
20,"It's not a tantrum or anything. I'm just speaking my mind man. And as usual, if it dissents from group-think it's me who might have a problem. If you take your time to downvote something, it's pettiness plain and simple. I've never in my time on this site downvoted anybody no matter what they've said to me or others and I just don't understand why other people do I suppose. Oh well, you do you I guess",Chiefs,1,1576444146,eb1r02
21,GG Chiefs we will get you next year I promise.,Broncos,5,1576444102,eb1r02
22,I hope Lock is good it would such an awesome rivalry for the next decade. Better than eyeliner wearing crazy inconsistent Carr or no cursewords Rivers.,Broncos,5,1576444056,eb1r02
23,yeah lp3 wasn't bad but i'm bitter over lp2 forever,Broncos,1,1576444005,eb1r02
24,Your body betrays you friend,Chiefs,1,1576443932,eb1r02
25,"GG Denver, stoked to see if Lock turns out to be the guy y'all need to move forwad.",Chiefs,8,1576443781,eb1r02
26,only seeing one tantrum here,Broncos,1,1576443743,eb1r02
27,Fair,Chiefs,1,1576443720,eb1r02
28,GGs frens.,Ravens,4,1576443680,eb1r02
29,I've only been able to half watch but it seems like a ton of passes were bouncing right off the numbers,Broncos,2,1576443645,eb1r02
30,"They should have just called this game in the 1st quarter so everybody could go home and get warm.

Denver never even surpassed our first score.",Chiefs,4,1576443637,eb1r02
31,And subsequently dropped.,,2,1576443636,eb1r02
32,[deleted],,1,1576443620,eb1r02
33,I don't give a flying fuck or I wouldn't post this LOL I just picture tantrum throwing children when I see downvotes. It's a sign of pettiness imo so I pointed it out,Chiefs,-1,1576443615,eb1r02
34,"Broncos fans, I hope Lock continues to improve and be a good QB for you guys. Didn't look bad today at all, considering the conditions on the field.",Chiefs,8,1576443608,eb1r02
35,"That’ll do it, boys. GG Denver see you next year.",Chiefs,2,1576443594,eb1r02
36,Good Game Donkeys!  Hopefully all injuries for both teams are minor and the rest of the season is successful.,Chiefs,3,1576443578,eb1r02
37,[deleted],,2,1576443574,eb1r02
38,At this point the most important thing is Lock getting reps.,Chiefs,2,1576443566,eb1r02
39,Risner has been our best linesman and it's not really close. All rookie and pro bowl level i think. Dude is just alone lol,Broncos,1,1576443557,eb1r02
40,We were actually able to get first downs at the end of the game on the ground.,Chiefs,2,1576443551,eb1r02
41,"I mean, for all your talk of  “owning the west” there sure is a lack of playoff succes to go along. I think it’s a legit smack talk argument lol",Broncos,0,1576443549,eb1r02
42,But like do we seriously need to be reminded that it is still snowing?,Chiefs,1,1576443516,eb1r02
43,"More importantly, quit caring that you're being downvoted.  It's the internet, internet points don't actually matter.",Broncos,6,1576443510,eb1r02
44,GG Donkeys.,Chiefs,4,1576443501,eb1r02
45,You will play the titans and lose on their QB catching his own deflection. And you will like it lol,Broncos,1,1576443482,eb1r02
46,I've been here over a year and have yet to go out of my way to downvote anything. It just seems childish,Chiefs,-4,1576443480,eb1r02
47,It's because we're not throwing bombs down the field every play because our defense is giving up 30+ points a game like last year.,Chiefs,1,1576443473,eb1r02
48,[deleted],,3,1576443467,eb1r02
49,[deleted],,2,1576443444,eb1r02
50,"My stream is going to shit, much like the Broncos 2019 season",Broncos,3,1576443440,eb1r02
51,"When he had time to get the ball out, he was hitting receivers in the numbers..",NFL,5,1576443404,eb1r02
52,I just want every announcer to be a Romo clone.,,3,1576443397,eb1r02
53,"Has Risner still been solid? I had classes with that dude, he was great",Chiefs,1,1576443394,eb1r02
54,"Which is funny, because you'd THINK that's what McCoy was going to do for us, but I guess the nervousness about the fumbles played into it.",Chiefs,2,1576443391,eb1r02
55,"Still better than watching Flacco.  

Hope we spend all 5 early picks on massive O linemen",Broncos,8,1576443385,eb1r02
56,I don’t care who we play in the playoffs as long as it’s not the Titans.,Chiefs,5,1576443365,eb1r02
57,"Yeah, it's obvious the answer is ""no.""",Chiefs,1,1576443356,eb1r02
58,You must be new here.,Chiefs,6,1576443355,eb1r02
59,[deleted],,2,1576443353,eb1r02
60,Yeah. Totally worth the risk of injuries.,,1,1576443351,eb1r02
61,Oh 100%. We brought him in to do what he's doing now. Hammer it down when we need a 3 yard pick up in a stacked box.,Chiefs,2,1576443343,eb1r02
62,Well duh it was kinda a joke,Chiefs,1,1576443329,eb1r02
63,A little low brow.,,1,1576443328,eb1r02
64,- man who only watches offensive numbers,Chiefs,2,1576443309,eb1r02
65,Man how does dan fouts still have a job?,Chiefs,6,1576443298,eb1r02
66,If you downvote any post or comment on this entire website you're petty,Chiefs,-19,1576443298,eb1r02
67,Seriously. This o line is such a huge liability. McGovern and Risner are pretty much the only guys worth keeping atm.,,1,1576443294,eb1r02
68,Secret weapon for Denver?,Chiefs,3,1576443293,eb1r02
69,I know he's a Miracle boy whos been sent to the Kingdom as our Messiah but kinda SHOCKED to hear on the radio he still managed 300 yards in this weather bullshit lol.,Chiefs,6,1576443290,eb1r02
70,I tried to read your comment but it is too cold here and it was intercepted.,Chiefs,1,1576443287,eb1r02
71,I'm honestly a little disappointed we didn't get to see vintage McCoy,Broncos,1,1576443284,eb1r02
72,"::holds up the SB Trophy from #4::

::reminds them who went to the first SB::",Chiefs,5,1576443278,eb1r02
73,Because they got behind early and were ineffective at running the ball when they tried?,Chiefs,8,1576443265,eb1r02
74,[deleted],,2,1576443262,eb1r02
75,I think its a W y’all!,,5,1576443252,eb1r02
76,WHY 👏 IS 👏 MAHOMES 👏 IN 👏 THE 👏 GAME 👏 ANDY,Chiefs,12,1576443244,eb1r02
77,Beside K. Hunt and a periodically injured OLine this team is better than last year's in almost every way.,Chiefs,2,1576443244,eb1r02
78,What’s Jeff Allen up to?,Chiefs,4,1576443235,eb1r02
79,I mean yeah I get it. Just a weird play to call it on. Probably better places to throw that but idk.,Chiefs,1,1576443227,eb1r02
80,i can’t wait to go on twitter and see all the broncos posting pics of their super bowl trophies.. GeT sOMe oF tHeSe tHen TaLk,Chiefs,8,1576443226,eb1r02
81,"Well, he's demonstrated that he can block, and he already knows the offense, so it's really more depth than anything.  (And we'll feed 'em the ball sometimes to keep 'em happy, I don't see anything hugely bad about it.)

As long as we're not trying to make him the feature back, then I think we're fine 'ere.",Chiefs,2,1576443224,eb1r02
82,Idk; they just seem way less impressive than last year for whatever reason,Chiefs,0,1576443224,eb1r02
83,Blizzard of sadness.  Flurry of discontent.,Broncos,8,1576443219,eb1r02
84,Don't say those cursed words,Chiefs,5,1576443212,eb1r02
85,"Nah man, it's close, like 16, maybe 17 players away",Broncos,2,1576443211,eb1r02
86,My prediction is NO.  I might be bias though...,Chiefs,2,1576443197,eb1r02
87,Why did they make Lock throw 40 times in a snow game?,NFL,8,1576443196,eb1r02
88,What?,Chiefs,1,1576443189,eb1r02
89,Gag,Chiefs,6,1576443184,eb1r02
90,I think y’all are better than last year,Cowboys,1,1576443183,eb1r02
91,Hell at this point even we're good with a stress free game,Broncos,1,1576443177,eb1r02
92,FUCK INJURIES!,Chiefs,5,1576443170,eb1r02
93,FUCK,Chiefs,4,1576443164,eb1r02
94,What? Mahomes and an improving D? I actually like this team better than last year's team.,Chiefs,3,1576443162,eb1r02
95,Well that's a stupid question.,,3,1576443158,eb1r02
96,Christ just pull the starters,Chiefs,8,1576443156,eb1r02
97,"You're out of your mind. Most injured, maybe, but overall this team is way better than last year's",Chiefs,3,1576443144,eb1r02
98,"Start with The Last Wish and Sword of Destiny, that’s mostly what the first season will be based on, they’re gonna touch on some extra background stuff and some things from the 3rd book too, Blood of Elves.",Broncos,1,1576443133,eb1r02
99,Secret weapon cam Erving inbound,Chiefs,8,1576443131,eb1r02
100,"Look, I like ware, He's done a lot for us in the past. But calling it a valuable pick up right now might be a stretch.",Chiefs,4,1576443116,eb1r02
101,We better draft Oline in the 1st like 4 rounds next year,Broncos,5,1576443114,eb1r02
102,[deleted],,11,1576443113,eb1r02
103,"I'm fine with it after last week's game against the ~~Potatoes~~ Patriots

My phone autocorrected Patriots to potatoes. I'm leaving it.",Chiefs,2,1576443110,eb1r02
104,Yo might want to warn people the second link is a photo of a dead animal.,Chiefs,3,1576443109,eb1r02
105,Who cares at that point though it's not like you can keep them,Broncos,2,1576443108,eb1r02
106,Christ another injury,Chiefs,1,1576443105,eb1r02
107,[deleted],,4,1576443099,eb1r02
108,"He was going on and on about how QBs shouldn’t get helped up from the ground. Not from refs, not from *teammates* for some reason. Cuz they might have something on their hands? Lasted about a minute, while Ian Eagle was vocally dumbfounded.",Chiefs,1,1576443099,eb1r02
109,Will Mahomes ever lose to Denver?,Chiefs,8,1576443088,eb1r02
110,Wearing shorts when it's 25 and snowing. not even I'm that bold.,Chiefs,2,1576443087,eb1r02
111,Looks like 38 people on this thread support abuse.. about what I expected.,,0,1576443086,eb1r02
112,"Go for a Saunders TD, would be awesome.",Chiefs,1,1576443082,eb1r02
113,I'll sound spoiled but this feels like one of the worst Chiefs teams with double digit wins since 2010,Chiefs,-18,1576443077,eb1r02
114,"Carson Wentz the bed once again in crunch time.

44th lost fumble since 2016 - most in the NFL, 7th this year.

Skins in FG range, and Doug Peterson looking like Ron Rivera out there.",Panthers,2,1576443075,eb1r02
115,Why is Mahomes still on the field,Chiefs,4,1576443067,eb1r02
116,Fade me fam,Broncos,2,1576443065,eb1r02
117,Kelce and Mahomes is such a deadly combo idk why we didn't double Kelce more. I really hope Denver fans don't go apeshit on Lock for this game he's been getting hammered and our receivers are dropping passes left and right.,Broncos,5,1576443058,eb1r02
118,SIT MAHOMES ALREADY,Broncos,7,1576443058,eb1r02
119,[removed],,-1,1576443051,eb1r02
120,"C'mon, no more Mahomes, send in the Moore.",Chiefs,2,1576443046,eb1r02
121,I like the yeet challenge,Broncos,1,1576443041,eb1r02
122,Time to run it up on Denver,Chiefs,0,1576443040,eb1r02
123,"He makes plays but he's a flag-magnet.

Ward is such an underdog story and has become such an amazing player. He's my fav rn.",Chiefs,1,1576443036,eb1r02
124,Ulyou may be on to something,Chiefs,5,1576443034,eb1r02
125,See: Andrew Luck.,Chiefs,4,1576443034,eb1r02
126,Ennh. Rookie on his 3rd start in shit condition with a basically non existent oline and a bunch of drops. Think he did pretty decent,Broncos,0,1576443032,eb1r02
127,Any way to check how many dropped passes our WRs have this game? Has to be 5+,Broncos,3,1576443032,eb1r02
128,"Things that chiefs and Broncos fans can both agree on

&gt;Can Dan Fouts just please retire from the booth?",Chiefs,20,1576443023,eb1r02
129,Time for another NT jump pass I guess.,Chiefs,5,1576443016,eb1r02
130,"It ain't much, but it's honest work.",Colts,1,1576443010,eb1r02
131,"I definitely need to read through them, especially since there's stuff in the show that might go over my head that are from the books.",Chiefs,1,1576443006,eb1r02
132,Ehh.... Everyone else around him has been good. He has been ok at best.,Chiefs,0,1576443002,eb1r02
133,i was hoping for at least a touchdown 😞,Broncos,2,1576443001,eb1r02
134,"Will it be reversed? Will it stand?

Literally no one knows.",Chiefs,2,1576442979,eb1r02
135,"They don't have any chance anyway, lol.",Chiefs,1,1576442968,eb1r02
136,"This kind of shit is what lead to poe throwing a TD, Andy was tired of this shit.",Chiefs,6,1576442963,eb1r02
137,Holy fuck that second image  lol.,Chiefs,2,1576442957,eb1r02
138,"And Lock gets hit AGAIN. all the offensive pieces can be good but if your qb tastes dirt every play, you can't expect them to succeed.",,7,1576442943,eb1r02
139,What an unbelievable loser move,,7,1576442942,eb1r02
140,"We all want it, but it's been that way with all great QBs.  They want every snap.",Chiefs,1,1576442941,eb1r02
141,I know. I'll never understand why NFL coaches are so timid to bench their QBs in blowouts.,Chiefs,1,1576442936,eb1r02
142,"On D it's: 

Mathieu 

Jones

Thornhill

Breeland",Chiefs,2,1576442936,eb1r02
143,Waste of a flag but whatever you lose em if you don’t use em,Chiefs,8,1576442935,eb1r02
144,As desperation settles in.,Chiefs,5,1576442935,eb1r02
145,There was absolutely no DPI on that play. At all.,Chiefs,7,1576442932,eb1r02
146,I'm subbed to his channel 🤣,Chiefs,1,1576442928,eb1r02
147,Not sure what Vic was possibly seeing there but I guess you got nothing to lose,Chiefs,7,1576442927,eb1r02
148,What are you? The snow angel police? /S,Chiefs,3,1576442925,eb1r02
149,Thornhill,Chiefs,2,1576442922,eb1r02
150,I think just getting his reps in with his hand.,Chiefs,2,1576442920,eb1r02
151,[deleted],,5,1576442919,eb1r02
152,You really challenging this in garbage time in a blizzard Fangio?  Lmao,Chiefs,7,1576442917,eb1r02
153,"Everyone talking about they wish this snow game was competitive so it would be epic.

I’m good with a stress free beating of the broncos",Chiefs,5,1576442916,eb1r02
154,I've been considering this for about 4 years now and I think the Chiefs may just have the better team at this point.,Broncos,14,1576442915,eb1r02
155,… Nah.,Bills,3,1576442908,eb1r02
156,"A challenge, really? The game's over",Chiefs,3,1576442908,eb1r02
157,"Eh, that's fair.",Chiefs,1,1576442901,eb1r02
158,That was NOT DPI.,Chiefs,1,1576442898,eb1r02
159,He's been solid tho,Chiefs,1,1576442897,eb1r02
160," [](https://i.imgur.com/IZvQE9Y.jpg)
[](https://imgur.com/fkCNO81)",Chiefs,4,1576442892,eb1r02
161,Fuck em,Chiefs,3,1576442885,eb1r02
162,"Not at all.

I appreciate his effort most games though.  He isn't the best, but he gives it his all.",Chiefs,1,1576442876,eb1r02
163,Love his show either way,Chiefs,3,1576442876,eb1r02
164,Why is Mahomes still coming out... Sit his ass down,Chiefs,6,1576442869,eb1r02
165,Ain't no way in hell they overturn this. Which means they will,Chiefs,3,1576442862,eb1r02
166,Longshot here but they don't have any chance if it doesn't get called DPI,Chiefs,2,1576442861,eb1r02
167,Yeah you need something to make you guys happy for being a speedbump for more notable teams for 40 years.,Broncos,0,1576442854,eb1r02
168,[deleted],,2,1576442846,eb1r02
169,"""That will be double digit wins.""

Inb4 the Broncos storm down the field and score 3 TDs in quick succession.",Bills,2,1576442844,eb1r02
170,It's a shame this game isnt even remotely competitive. A close game in all of this snow wouldve been epic af,,2,1576442844,eb1r02
171,This is definitely Drew Lock’s “welcome to the NFL moment”,Chiefs,9,1576442839,eb1r02
172,Bad take.,,6,1576442833,eb1r02
173,"I understand your take from a hometown-perspective. As a Chiefs fan, though, I don't want them to score any more.",Chiefs,7,1576442831,eb1r02
174,I'm with ya. Garbage time td.,,-2,1576442825,eb1r02
175,Nope,Chiefs,6,1576442819,eb1r02
176,Enjoy it while you can. Won't last forever. The tides of time go back and forth.,,0,1576442818,eb1r02
177,"Welcome to Thatsgoodsports I am Brandon ""My 🐎🐓🔒 t-shirt sales just took a dive harder than the Broncos"" Perna, and we just got swept by the Chiefs....again.",Chiefs,10,1576442815,eb1r02
178,Is Breeland anybody else's favorite player?,Chiefs,3,1576442808,eb1r02
179,[deleted],,1,1576442797,eb1r02
180,So many almost picks I've been given blue balls,Chiefs,8,1576442775,eb1r02
181,"They are having too much fun with those snow angels.

Can't blame them.",Chiefs,5,1576442775,eb1r02
182,I’m getting a 🍯 🦡 jersey,Chiefs,9,1576442771,eb1r02
183,[deleted],,4,1576442771,eb1r02
184,"Now Snow, of Informer fame, would LOVE to be out there!",Chiefs,1,1576442761,eb1r02
185,Andy Walrus Reid in his natural habitat with pounding snow and cold.,Chiefs,1,1576442755,eb1r02
186,So much pressure. He's on the ground what seems like every play.,,2,1576442746,eb1r02
187,"No. You missed the pick. You don't get a snow angel, Mathieu.",Colts,2,1576442739,eb1r02
188,No,Chiefs,9,1576442733,eb1r02
189,"They've been letting them play, so I'm not too mad",Chiefs,1,1576442729,eb1r02
190,"I kinda hope Lock is able to get a TD on this drive, it'd be mean a lot for the kid to get a TD as an NFL Quarterback, in Arrowhead.",Chiefs,-6,1576442718,eb1r02
191,New York. Boston teams at least do well enough to warrant the entitlement.,Broncos,0,1576442713,eb1r02
192,"He said ""in recent memory."" Which says to me that he hasn't recently thought about someone better... not that the signing was recent.",Chiefs,1,1576442692,eb1r02
193,"Good for you, getting over 1k yards.

I probably couldn't even do that in Madden.",Bills,1,1576442665,eb1r02
194,Taking care of business,Chiefs,1,1576442662,eb1r02
195,Lol shut up announcers. Lock's dream was to play for the chiefs. He wanted to be drafted by us and was disappointed when we grabbed Mahomes.,Chiefs,1,1576442661,eb1r02
196,"I'm sorry people but I'm still not over ""Vanilla ice would love to be apart of this one""

Quite possibly the most bizarre thing I've ever heard a commentator say. What a way to throw to commercial.",Chiefs,5,1576442660,eb1r02
197,A little miffed since that Clark jump is what Miller always gets called offsides for doing perfectly...,Broncos,-1,1576442655,eb1r02
198,Broncos o line is pretty atrocious. So glad we got Risner in the draft.,,2,1576442655,eb1r02
199,😏,Ravens,1,1576442655,eb1r02
200,Boston easily,Chiefs,4,1576442623,eb1r02
201,"Aw man, I think they outgained Kelce again.  We're totally gonna march Mahomes out there again to get another 40 yards to him, aren't we.",Chiefs,5,1576442607,eb1r02
202,Sutton better still be playing hard after all that shit he talked all week.,Chiefs,8,1576442598,eb1r02
203,Donkeys and garbage time yardage. Name a more iconic duo.,Chiefs,2,1576442596,eb1r02
204,Feels like a turnover drive,Chiefs,2,1576442575,eb1r02
205,Boston and it’s not close.,Chiefs,6,1576442574,eb1r02
206,"&gt; No more Philly cheese steaks :(

Sorry nephew, he spent one day with KC BBQ and *hasn't looked back*",Chiefs,3,1576442569,eb1r02
207,[deleted],,1,1576442560,eb1r02
208,Good to know. Yeah Toppling Goliath is really good. I van find it occasionally here in New York,Chiefs,2,1576442554,eb1r02
209,"Christ 35, just going to watch your teammates do your fuckin job???

Is Gaines back on the team???",Chiefs,-4,1576442549,eb1r02
210,Holy shit I don't know how Frank got there that fast without being offsides.,Chiefs,2,1576442544,eb1r02
211,Don't worry too much. This is his M.O. He'll have some games that are awesome but every once in a while just be... off. Plus the snow. It's something you hope he'll improve on with good coaching.,Chiefs,3,1576442533,eb1r02
212,"Fuck this dry shit, i'm going to Mary Browns.",Bills,3,1576442527,eb1r02
213,Boston for the past decade.,Chiefs,9,1576442524,eb1r02
214,I'm pretty confident its going to Lamar Jackson this season.,Chiefs,3,1576442511,eb1r02
215,Boston.,Chiefs,6,1576442505,eb1r02
216,"Brandon ""My 🐎🐓🔒 t-shirt sales just took a dive harder than the Broncos"" Perna.",Chiefs,1,1576442504,eb1r02
217,I really want to donate and make him say he loves the chiefs.,Chiefs,1,1576442502,eb1r02
218,Keep going. If you complain just a little bit more I'm sure the score will reverse.,Chiefs,1,1576442493,eb1r02
219,Maybe if cbs would stop blasting this CHIEFS OWN THE WEST 25-3 8-1 it wouldn’t make us pull the playoff chokers card lol,Broncos,0,1576442489,eb1r02
220,"Lol is 26 years ago ""recent""?",Chiefs,3,1576442486,eb1r02
221,[deleted],,1,1576442483,eb1r02
222,MATT NAGY DESERVES TO BE FIRED.  YESTERDAY.,Chiefs,4,1576442482,eb1r02
223,"But then if he was no longer tailgating then the victim would have no reason to still be looking behind him. Also, mayhem was only 2 or 3 inches away which isn't enough time to get over.",Patriots,1,1576442474,eb1r02
224,"""I have a lot of questions.""

""We cant answer them, you are tripping on acid, kid.""",Bills,5,1576442471,eb1r02
225,Drew getting swallowed before he has a chance,NFL,6,1576442467,eb1r02
226,No more Philly cheese steaks :(,Eagles,0,1576442465,eb1r02
227,The best Missouri Tiger ever in the NFL.  I remember being disappointed Jr. Didn't go to Missouri..  so glad he didn't now,Chiefs,2,1576442463,eb1r02
228,Great jump by Clark there.,Chiefs,5,1576442459,eb1r02
229,I would say its the best since Priest.,Chiefs,2,1576442453,eb1r02
230,"""Hooray, KFC came to the door-- wait, 20 bucks....are...are you asking me to pay for this?  But you brought it!  WAS THIS AN AD?!?""",Chiefs,5,1576442452,eb1r02
231,This feels like it should be more than a 23-3 game...,Chiefs,6,1576442451,eb1r02
232,"I liked 1, one of my favorites.  Not a fan of the gravel mouf of the 3rd one. 
I like the young and unexperienced Geralt moar.",Ravens,1,1576442446,eb1r02
233,"Who’s the more entitled fan base? 

New York or Boston?",Chiefs,3,1576442444,eb1r02
234,At least you agree he's not as soft as you are,Chiefs,3,1576442442,eb1r02
235,"He’s been fine. Hurt by the Broncos drops, helped by the dropped INTs.

Been under constant pressure, too.",Chiefs,3,1576442439,eb1r02
236,What?,Chiefs,3,1576442437,eb1r02
237,That would be a difficult daisy chain.  Usually it's five guys on one side to two.  I suppose with the handheld on the field you could work something out.,Chiefs,1,1576442436,eb1r02
238,You don't belong in here foh,Chiefs,1,1576442427,eb1r02
239,Mahomes and MVPs,Chiefs,1,1576442426,eb1r02
240,My fantasy team would appreciate,Broncos,1,1576442423,eb1r02
241,He already lost a good chunk of weight since coming here.,Chiefs,3,1576442422,eb1r02
242,"Given the circumstances he's been very good. Just two bad decisions leading to INTs, but down big you gotta take some risks.

The receivers are why his numbers are disappointing more than him.",Chiefs,3,1576442421,eb1r02
243,"Dear whoever made that Old Navy commercial,

FIRST OFF, FUCK YO BITCH AND THE CLIQUE YOU CLAIM!",Bills,3,1576442405,eb1r02
244,What’s yall playoff rec ? If beating us every year is somehow the bad juju that makes yall choke in the playoffs i’ll take that every year lol,Broncos,-6,1576442404,eb1r02
245,AFCW losing to the Chiefs.,Chiefs,3,1576442395,eb1r02
246,Just trying be a good neighbor and de-ice out sidewalks.,Chiefs,1,1576442394,eb1r02
247,"Yes.   I typically find Psuedo sue, Dorothys lager Pompei and Golden Nugget.  South lees summit seems to get it at Price Chopper and HyVees.    Ive had luck at Lucas Liquor on state line as well.   Hyvee on 291 and Rice rd has King Sue currently.   Its my #1 beer right now.",,1,1576442394,eb1r02
248,Wit her 3 has officially replaced Skyrim as my second favorite game of all time. It's just so much fun.,,1,1576442385,eb1r02
249,"Yes, because seeing what happened is a big requirement for nfl refs",Chiefs,3,1576442369,eb1r02
250,And... why not?,Chiefs,1,1576442356,eb1r02
251,Matt Nagy deserves to be fired. Yesterday.,Panthers,3,1576442352,eb1r02
252,I agree. Plus there’s been some bad drops. Lock has been standing tall and delivering some good throws.,Chiefs,10,1576442342,eb1r02
253,Colquitt and a punt inside the 20.  Name a more iconic duo,Chiefs,8,1576442327,eb1r02
254,"Lock has the ability to thrive if you guys improve your offensive line. He had trouble w/ pressure at mizzou too, but if he has time he's electric.",Chiefs,8,1576442324,eb1r02
