,body,author_flair_text,score,created_utc,link_id
588,I pulled a hammy as a young kid and it was agony just waiting for it to be good enough to sprint on. I can't imagine going from a world class athlete to someone who can't run normally anymore. Just the worst. All the best to Foster.,Broncos,2,1574624629,e11i3w
589,BUT HOW MANY 300YARD PASSING GAMES??,Bills,7,1574624622,e11i3w
590,I live in Hawaii and I woke up at 7:30 in the morning for this.,Broncos,3,1574624601,e11i3w
591,Too bad oculus is owned by Facebook now. Star wars is a sure fire way to get me into VR,Bills,5,1574624599,e11i3w
592,They look like that all the time. At least when it matters.,Broncos,1,1574624595,e11i3w
593,"Wait, why is 4th quarter Josh playing in the 3rd?",Bills,1,1574624595,e11i3w
594,"Nah, I heard that guy called him the N-word. Totally justified. Just ask Browns fans.",Bills,1,1574624593,e11i3w
595,[deleted],,1,1574624585,e11i3w
596,He's inactive today. Does anyone know what his injury is?,Bills,1,1574624577,e11i3w
597,Josh Allen is fun to watch,Vikings,2,1574624575,e11i3w
598,PBR it’s what I have left in the fridge gonna clean it out today before traveling this week,Broncos,1,1574624571,e11i3w
599,I really like the Bills. They play with a lot of toughness that I don't always see in other teams.,Seahawks,7,1574624569,e11i3w
600,allen is playing fearless😈,Bills,1,1574624559,e11i3w
601,"Who knows, at this pace we might start playing well all 4 quarters at some point.",Bills,1,1574624552,e11i3w
602,Josh Allen is 6th in total TDs this season btw,Bills,8,1574624548,e11i3w
603,Davontae Harris has given up like 4 TDs over the last 3 games,Broncos,3,1574624548,e11i3w
604,It was worth it.,Bills,1,1574624547,e11i3w
605,https://youtu.be/QZzvjnQYNgU,Bills,3,1574624542,e11i3w
606,"Time to see all those ""adjustments"" the Broncos made to their offense since the half.

Lol.",Broncos,2,1574624541,e11i3w
607,There's still 10 minutes to disappoint. I'm holding my breath.,Bills,1,1574624538,e11i3w
608,I don’t get to start that until 5:00 when the sabres start playing lol,Bills,1,1574624527,e11i3w
609,"This Thanksgiving, I am thankful for Cole Beasley.",Bills,4,1574624517,e11i3w
610,There we go!!!,Bills,3,1574624507,e11i3w
611,Josh got rocked there too lol,Bills,1,1574624507,e11i3w
612,What are you drinking? Rum and coke here,Bills,3,1574624499,e11i3w
613,Waaaaay ahead of you brother,Broncos,2,1574624494,e11i3w
614,So glad Cole Beasley wasn't injured too badly. He always seems to get open.,Bills,6,1574624488,e11i3w
615,"LFG. 

Where was that all game ??",Bills,2,1574624486,e11i3w
616,Cole hit that dude's helmet off. Indefinite suspension incoming.,Bills,3,1574624476,e11i3w
617,"Bills scored in the 3Q last week too, wtf is happening",,2,1574624474,e11i3w
618,We sacrificed the second quarter for it,Bills,3,1574624473,e11i3w
619,Why do I even watch this garbage,Broncos,0,1574624468,e11i3w
620,And now I start drinking lol,Broncos,6,1574624458,e11i3w
621,Cole is fucking nasty from the slot with y'all.  God damn,Broncos,1,1574624457,e11i3w
622,It seems like it but who knows what goes on in those piles lol,Bills,5,1574624455,e11i3w
623,Goddddddamn Beasley. That was sick,Bills,3,1574624442,e11i3w
624,Wait. A TD on our first drive of the 3rd quarter!? That's allowed!?,Bills,7,1574624430,e11i3w
625,That was much needed.,Bills,2,1574624429,e11i3w
626,[deleted],,1,1574624417,e11i3w
627,Easy Bease TD squeezey,Bills,9,1574624406,e11i3w
628,That was super badass but isn't that holding?  He kind of throttled the dude.,49ers,4,1574624405,e11i3w
629,BEASTLY,Bills,4,1574624403,e11i3w
630,That plus once you pull a hamstring you are going to keep pulling it for the rest of your life.,Bills,1,1574624394,e11i3w
631,BEASLEY!!! That's the RZ offense we're looking for!,Bills,3,1574624392,e11i3w
632,Finally! Holy hell that red zone D is no joke,Bills,6,1574624391,e11i3w
633,Fuck....,Broncos,1,1574624389,e11i3w
634,Holy shit that was a beaut,Bills,2,1574624389,e11i3w
635,Fuck yeah I love cole Beasley,Bills,3,1574624384,e11i3w
636,SWOLE BEEZNUTS,Bills,3,1574624380,e11i3w
637,Didn’t know we were going international our defense is looking Swiss today,Broncos,2,1574624371,e11i3w
638,COLE!!!!,Bills,1,1574624369,e11i3w
639,Damn i wonder how much Singletary squats,Bills,1,1574624367,e11i3w
640,This is the worst I’ve seen our defense play in a really long time,Broncos,2,1574624353,e11i3w
641,I honestly don't get everyone's love for him. He just can't separate at all. You can't be one dimensional as a receiver in this league anymore,,1,1574624318,e11i3w
642,There were two pushes... one on his leg immediately before he grabbed his hamstring,49ers,1,1574624302,e11i3w
643,Most WRs should be able to get open on a linebacker. It’s dumb defense.,Broncos,1,1574624296,e11i3w
644,"I don't get whyMcD is so conservative with new players, look how long it took Singletary to get real playtime.",Bills,2,1574624294,e11i3w
645,"That's a hammy, that could be the season if it's a bad pull",Bills,1,1574624272,e11i3w
646,To be fair not many lbs can cover foster across the field like that.  He can really fly.,Bills,1,1574624257,e11i3w
647,He took another 5 steps well after the push. It was a freak occurrence.,Broncos,0,1574624249,e11i3w
648,He's my power animal,Broncos,1,1574624242,e11i3w
649,Pulled Hamstrings suck because once you're past the initial pain it feels like you're totally normal. Except you're not and it hurts the moment you feel like you're back to speed. Frustrating.,Broncos,2,1574624232,e11i3w
650,It absolutely was lol,,0,1574624222,e11i3w
651,He has been inactive the last few games,Bills,1,1574624220,e11i3w
652,dumb coaches,Bills,1,1574624219,e11i3w
653,Well maybe not duke williams will get a shot.,Bills,2,1574624218,e11i3w
654,Looking forward to seeing Brady throw up noodle-armed ducks to the Cowboys D in that wind.,Bills,2,1574624202,e11i3w
655,Our defensive game plan of covering WRs with linebackers isn’t working. Surprising,Broncos,3,1574624201,e11i3w
656,I really hope that's a cramp.  If not hes likely done until the last few weeks of the season.,Bills,2,1574624199,e11i3w
657,wake me up when you get to 30,49ers,1,1574624195,e11i3w
658,"Of course it was, not saying it was inappropriate to push him though, but that is surely what caused it to happen",49ers,6,1574624165,e11i3w
659,Hopefully just a cramp!! Fingers crossed but doesn’t look good :(,Bills,5,1574624148,e11i3w
660,Fuck,Bills,1,1574624142,e11i3w
661,God damn foster is so fast. I don't get why he wasn't used much this year,Bills,2,1574624136,e11i3w
662,"Sigh, great run after catch, and of course a blown hamstring",Bills,3,1574624120,e11i3w
663,"Wasn't because of the push, come on now",Broncos,3,1574624118,e11i3w
664,Lol the commentators saying that drop by Beasley is bad ball placement...it hit him in the hands and was lead...,,8,1574624118,e11i3w
665,Gotta catch that,Bills,1,1574624108,e11i3w
666,Hope that's only a cramp !,Steelers,2,1574624107,e11i3w
667,"""we"" lol 1 person with no upvotes from anyone else",,0,1574624103,e11i3w
668,does this mean we just saved our good half for the 2nd half?,Broncos,1,1574624098,e11i3w
669,Foster just pulled his quad there,49ers,1,1574624084,e11i3w
670,No Foster ;_;,Bills,4,1574624067,e11i3w
671,"Beasley, I'm glad you're healthy. Catch that shit though.",Bills,3,1574624062,e11i3w
672,LOL. Sweet summer child,Bills,4,1574624047,e11i3w
673,Nice not starting inside the 20 for once,Bills,3,1574624046,e11i3w
674,Waiting for a block in the back on Zo.,Bills,2,1574623964,e11i3w
675,Rookie numbers,Browns,2,1574623958,e11i3w
676,I really meant that specific stretch of pre snap penalties.,Bills,1,1574623930,e11i3w
677,You're right. I can't math after 3 beers.,Bills,1,1574623860,e11i3w
678,"We got three instead of seven, so scoring that touchdown would mean four more points.",Bills,1,1574623847,e11i3w
679,The entire WNY region has empathy for this concept.,Bills,3,1574623841,e11i3w
680,Yeah it's been a fun game to me so far.,Bills,1,1574623798,e11i3w
681,Lol only 3 sessons,Bills,10,1574623783,e11i3w
682,"Yea, we got a FG from that.",Bills,2,1574623759,e11i3w
683,"This is now my third straight season of watching football not out of thrill or joy, but instead a morbid sense of duty and/or obligation.",Broncos,7,1574623739,e11i3w
684,I wanna workout to live not workout to die bruh,Broncos,3,1574623736,e11i3w
685,He’s trying to work out not die!,Bills,3,1574623705,e11i3w
686,I was talking about a few drives ago when we were right on the goal line and got brought back.,Bills,1,1574623688,e11i3w
687,Bill Cowher is literally Lindy Ruff,Bills,1,1574623594,e11i3w
688,"4 points, no guarantee for a FG even if the half didn't end in flames.",Bills,1,1574623579,e11i3w
689,We hate you being a Bills fan too bud,Bills,1,1574623550,e11i3w
690,5 burpees every commercial.,Bills,3,1574623538,e11i3w
691,"Nah, don't just repeat what you've seen others seen on Reddit if you don't understand it. Embarrassing yourself like that. Our inability to score is absolutely going to kill us in the playoffs. That's a fact you can't just dismiss.",,1,1574623531,e11i3w
692,"Did he ust say he hasnt seen him run that fast since....""running from the cops?....",Bills,2,1574623518,e11i3w
693,That’s what happens when you go out there and don’t win any football games,Bills,3,1574623497,e11i3w
694,It's interesting too since this year they have tried limiting his running most games in order for him to improve as a pocket passer.,Bills,1,1574623469,e11i3w
695,We need clean up these penalties. We should have 7 more points on the board.,Bills,3,1574623456,e11i3w
696,"I think considering how he looked last year, I am okay with okay and yeah his running is ridiculous. Thank you for the response.",Bills,1,1574623444,e11i3w
697,Lots of low scores today.,Bills,1,1574623434,e11i3w
698,Is it just me or should the Bills have gone for a Hail Mary after the run?,49ers,3,1574623428,e11i3w
699,Broncos coach looks like George Sr from arrested development.,Bills,2,1574623364,e11i3w
700,The Jets are doing more to put the Bills in the playoffs rn than the Bills are.,Bills,3,1574623354,e11i3w
701,Just noticed the Bengals eliminated before Thanksgiving.Shit that's bad.,Bills,3,1574623338,e11i3w
702,"Skipped the gym to watch this disappointment of a game. Decided to spice it up.

Points are 10 situps

Flags are 5 Squats

Turnovers and end of a quarters are 15 pushups

Sacks are 5 Burpees.

After 2 quarters I need to go to the gym still.",Broncos,4,1574623324,e11i3w
703,The feeling's mutual.,Bills,2,1574623302,e11i3w
704,"Mother fucker has some legs.  I've seen him before, but every time I'm still impressed.",Broncos,2,1574623297,e11i3w
705,"I mean he looked okay, best plays were him running the ball.",Broncos,2,1574623284,e11i3w
706,they were on their own 35 after all the penalties after the run it would have been a 60+ yard try,Bills,1,1574623281,e11i3w
707,Just using Bide until the fourth quarter like usual. I hope.,Bills,2,1574623269,e11i3w
708,Man. Our offense has a lot of work to do if we're gonna avoid being embarrased on national TV on thursday.,Bills,1,1574623257,e11i3w
709,What a bizarre ending to an enjoyable first half. Two good defenses going at it; Broncos in bend but don't break mode. Would have liked TDs instead of FGs obviously but I'll take the points.,Bills,2,1574623255,e11i3w
710,if we lose the raiders will fall 2 games to the bills in wildcard because jets are killing it. go bills!,Broncos,1,1574623253,e11i3w
711,Vic Fangio looks like he hasn't had a solid bowel movement in 20 years.,Bills,8,1574623253,e11i3w
712,"Defensively it's pretty fucking good.  Sacks, INTs, TFLs (mostly from y'all though, we only have a few).  I'm enjoying it.",Broncos,2,1574623245,e11i3w
713,Going into the locker room wondering wtf just happened there...,Bills,2,1574623239,e11i3w
714,Buffalo I swear to Christ you fuckers better get Frank those  yards today.,49ers,1,1574623238,e11i3w
715,Why would you do a hard count with 10 seconds to go in the game ? We really want those 5 yards back?,Bills,1,1574623237,e11i3w
716,"Bad wind, if it gets picked they have a chance to run it back. Incredibly low % play with high risk",,1,1574623236,e11i3w
717,"Go home arrow, you're drunk",Bills,1,1574623224,e11i3w
718,Spoke too soon,Bills,2,1574623222,e11i3w
719,We are throwing away an alarming amount of points between redzone fails and that end of half debacle,Bills,4,1574623208,e11i3w
720,"Fucking pathetic. I hate being a bills fan, it's so frustrating",,-5,1574623203,e11i3w
721,"TF, why not call the timeout and try the FG",,0,1574623197,e11i3w
722,That was a very dumb half of football,Broncos,2,1574623193,e11i3w
723,Boy that was sloppy as fuck.,Bills,4,1574623189,e11i3w
724,[removed],,1,1574623189,e11i3w
725,BUFFALO ALL THE WAY THIS TIME,Bills,3,1574623183,e11i3w
726,Good lord,Bills,2,1574623181,e11i3w
727,bird brain football,Bills,2,1574623178,e11i3w
728,Why would you not try the hail Mary there?!,Vikings,2,1574623175,e11i3w
729,"lol unreal how bad that half ended. penalties, wasted time, lack of any aggression at all...gimme some killer instinct.",Bills,3,1574623170,e11i3w
730,"6 points on the road.  I'll take it, hopefully Vic can adjust and we'll come out strong for another 30 minutes.

*Liver looks on nervously*",Broncos,1,1574623159,e11i3w
731,Oof,Broncos,1,1574623159,e11i3w
732,This is not compelling football,Bills,1,1574623152,e11i3w
733,take the knee,Bills,1,1574623150,e11i3w
734,That gave me literal cancer,Bills,0,1574623143,e11i3w
735,Wtf is this lmao,Bills,3,1574623132,e11i3w
736,This game is like a soggy bologna sandwich.,,4,1574623131,e11i3w
737,WTF?  Timeout due to poor time management,Bills,2,1574623124,e11i3w
738,Fuck off announcers. It's not Allen's fault the skill guys keep jumping.,Bills,9,1574623114,e11i3w
739,Guy thinks he’s Aaron Rodgers out there,AFC,-9,1574623093,e11i3w
740,but from wherever did it come from!?,Broncos,1,1574623083,e11i3w
741,So...the hard count works. Oops.,Bills,6,1574623072,e11i3w
742,Wow just take a knee.,Bills,3,1574623067,e11i3w
743,and this is where our coaching fails,Bills,2,1574623065,e11i3w
744,This is embarrassing lol,Bills,4,1574623064,e11i3w
745,Jesus just end the half now,Bills,3,1574623061,e11i3w
746,Lmao this is comical,49ers,4,1574623060,e11i3w
747,Oof. I don't think that's a good idea.,Patriots,1,1574623038,e11i3w
748,Lol that arrow drawing the wind,Bills,8,1574623031,e11i3w
749,"Broncos fans, thoughts on how our Allen is looking? We're biased and looking for improvement wherever we can find it.",Bills,3,1574623023,e11i3w
750,Bills are so bad right before half,Bills,1,1574623017,e11i3w
751,Almost would've been better to take the delay of game than use the last timeout,Broncos,1,1574623016,e11i3w
752,I like that we're actually going for these points for once,Bills,2,1574623013,e11i3w
753,This drive went from interesting to dumpster fire real fast.,Bills,2,1574623005,e11i3w
754,"The dude is a bulldozer, but holy FUCK he cannot just run through somebody and gets his hands gripped up so fucking much",Broncos,2,1574622998,e11i3w
755,Would have rather lost the yards than the time out. Just run the half out now.,Bills,3,1574622997,e11i3w
756,"5 yards forward,  5 yards back..",Bills,3,1574622992,e11i3w
757,Wow. Great time management,Bills,3,1574622974,e11i3w
758,The hard count giveth and it taketh away :(,Bills,5,1574622972,e11i3w
759,"There it is, Kroft",,1,1574622967,e11i3w
760,"Josh Allen, elite hard count?",Bills,4,1574622962,e11i3w
761,"That was my thinking it's just too perfect.  But then I figured, these guys have been putting it on their whole lives themselves right?  Maybe its just second nature.  

But you are probably right.",Bills,1,1574622951,e11i3w
762,Spear?,Bills,1,1574622950,e11i3w
763,Bolles about to get called for defensive holding from the sideline,,2,1574622936,e11i3w
764,What do you want from them? Replays?! They need dollar bills yo,Patriots,1,1574622923,e11i3w
765,"They're contracted to put in a certain amount of ad time, and this game is just flying back.",Bills,1,1574622915,e11i3w
766,Gotcha von miller 🤭,Bills,0,1574622909,e11i3w
767,We didn't actually want the free 5 yards.,Bills,2,1574622905,e11i3w
768,I'll never get that one right,49ers,1,1574622901,e11i3w
769,[deleted],,1,1574622900,e11i3w
770,Lotta impatient players this game.,Bills,1,1574622898,e11i3w
771,relax hes making a joke at both qbs which are warrented,Bills,1,1574622896,e11i3w
772,This is going to be a long 25 seconds at this pace,Bills,3,1574622895,e11i3w
773,"Josh, they're never gonna give you a free play when the defender is three steps from you.",Bills,4,1574622884,e11i3w
774,Time out,Bills,1,1574622880,e11i3w
775,False start on lee smith,Bills,1,1574622872,e11i3w
776,Guys someone keeps putting in football during my commercials :(,Bills,4,1574622868,e11i3w
777,Hard count worked for the first time ever.,Bills,2,1574622867,e11i3w
778,classy,49ers,1,1574622865,e11i3w
779,Subtle.  But sick as hell,Bills,1,1574622864,e11i3w
780,throw a bomb to robert foster,Bills,2,1574622864,e11i3w
781,Three defensive players to tackle the qb sheesh,Broncos,1,1574622863,e11i3w
782,Is this why we aren’t getting any replays? Commercials being stuffed into literally every stoppage?,Bills,2,1574622854,e11i3w
783,why are you running your qb to get hit in dead time?,Broncos,3,1574622852,e11i3w
784,Ok lets get some points going into the next half,Bills,2,1574622849,e11i3w
785,Nah,Bills,1,1574622844,e11i3w
786,CBS 4th tier,Bills,3,1574622841,e11i3w
787,"Def a trainer does, shits always lined up perfectly.",Broncos,1,1574622835,e11i3w
788,Gotta have these fucking garbage PiP ads instead.,Bills,1,1574622835,e11i3w
789,It's terrible,Broncos,2,1574622834,e11i3w
790,"Really, another commercial with 20 seconds left in the half? man CBS really juicing the money outta this one",Bills,4,1574622829,e11i3w
791,Life is pain.,Broncos,2,1574622829,e11i3w
792,same goes for that int by your safety. Just 2 really bad throws by both qbs,Bills,2,1574622825,e11i3w
793,[removed],,1,1574622824,e11i3w
794,Aggressively going to commercial today.,Bills,4,1574622816,e11i3w
795,Jesus Christ can somebody fucking spear that QB when he breaks out of the pocket please?,Broncos,-4,1574622813,e11i3w
796,Fuck off with all these commercials CBS,Broncos,7,1574622810,e11i3w
797,Singletary breaking ankles.  Oof,Bills,1,1574622810,e11i3w
798,They don't waste a second when it comes to stuffing in commercials,Bills,2,1574622809,e11i3w
799,"&gt; Garrapolo

Garoppolo",49ers,1,1574622799,e11i3w
800,"It's his potential out year, he'll cost us only 5 mil of dead cap vs keeping him for 20 mil.  I'd much rather cut him, we don't really even need anyone to fill in with Harrison coming back.",Bills,1,1574622798,e11i3w
801,Our Allen's were cosplaying as each other,Bills,2,1574622792,e11i3w
802,Wow this tackling though,Broncos,3,1574622792,e11i3w
803,Never lol. This is CBS,Patriots,1,1574622789,e11i3w
804,"That was a nasty little move, Singletary",Bills,2,1574622789,e11i3w
805,Is one Allen playing on both teams?,Broncos,2,1574622787,e11i3w
806,"""Intercepted and picked off by White""  lol",Bills,2,1574622787,e11i3w
807,Does anyone else love how they side by side while nothing is going on but skip replays of key penalties to go to a full ad?,Bills,4,1574622780,e11i3w
808,What the fuck is this broadcast. Not showing any replays,Broncos,2,1574622775,e11i3w
809,These teams clearly need to switch Allens,,2,1574622770,e11i3w
810,Timely pic,Bills,1,1574622769,e11i3w
811,Blessed be the name of Allen.,Bills,2,1574622762,e11i3w
812,That looked like the once per game Garrapolo brain fart,49ers,1,1574622762,e11i3w
813,Best field position all day.,Bills,2,1574622759,e11i3w
814,"Phew, looked like our defensive end was lined up in the neutral zone.",Bills,1,1574622758,e11i3w
815,Tre ma boy,Bills,3,1574622755,e11i3w
816,Whatever give me Andrew Thomas I’m over it,Broncos,1,1574622752,e11i3w
817,Allen's int was just as easy as Allen's int,Bills,5,1574622747,e11i3w
818,WHAT A TACKLE MCGOVERN,Broncos,2,1574622745,e11i3w
819,Both Allen's just threw equally bad ints.,Bills,5,1574622737,e11i3w
820,Sutton and Allen weren't on the same page after seeing the replay.  Can't do that against this Defense,Broncos,2,1574622737,e11i3w
821,How's your QB future looking?,Bills,1,1574622732,e11i3w
822,"So.... QBs named Allen like to make bone headed throws, got it",Bills,4,1574622728,e11i3w
823,Never throw to tre white,Bills,3,1574622724,e11i3w
824,Okay now we're even,Bills,5,1574622723,e11i3w
825,That wasn't so much an interception by White as he fucking threw it directly to White.,Broncos,3,1574622720,e11i3w
826,"Stupid question... 

Do you think there's a specific person on the staff who puts on the eye black?  Or is it just each player doing it if they want to.",Bills,4,1574622717,e11i3w
827,This game is going by fast.,Bills,4,1574622716,e11i3w
828,"I'm always amused about how he reacts like I imagine the dude has a lazy sounding deep voice saying ""man I didn't do anything. Why you pick on me?""",Patriots,2,1574622715,e11i3w
829,Both QBs are throwing to Darnold's ghost.,Bills,8,1574622711,e11i3w
830,That was just as bad as the other pick lmao,Broncos,2,1574622710,e11i3w
831,Now the Allens are even,Bills,2,1574622709,e11i3w
832,Not a great day for Allen overthrowing it for INTs today.,Bills,3,1574622705,e11i3w
833,"Allen giveth, Allen giveth back",Bills,6,1574622700,e11i3w
834,Goddamn it,Broncos,1,1574622693,e11i3w
835,Wow we really needed that one there!,Bills,1,1574622692,e11i3w
836,"holy shit you're probably right, lol 2 minutes in left in the half at 2:10",Bills,1,1574622686,e11i3w
837,It's a Tre day!,Bills,2,1574622685,e11i3w
838,It’s ok Tre got his back!,Bills,1,1574622683,e11i3w
839,"Two Allens,
2 ints",Bills,4,1574622682,e11i3w
840,"That was a good route, IF IT WAS A FUCKING BRONCO",Broncos,5,1574622680,e11i3w
841,Allen interception bowl!,Patriots,1,1574622676,e11i3w
842,Show it,Broncos,2,1574622675,e11i3w
843,Wow a holding on 72? Was that his first of the year?,Broncos,3,1574622673,e11i3w
844,Yea this is a weird penalty,Bills,1,1574622672,e11i3w
845,10 yards is closer to pushing them out of field goal position.,Bills,1,1574622671,e11i3w
846,FUCK,Broncos,1,1574622668,e11i3w
847,Holdor does it again,Broncos,4,1574622667,e11i3w
848,Yeah baby!!,Bills,1,1574622666,e11i3w
849,One interception deserves another.,Bills,1,1574622664,e11i3w
850,should have declined that buff,Broncos,2,1574622660,e11i3w
851,TRE!,Bills,1,1574622659,e11i3w
852,I think I'd rather have 2nd and 15 than 1st and 20.,Bills,2,1574622644,e11i3w
853,Imagine how much you could save on car insurance! Or buy some video chatting service! Or a fancy schmancy doorbell! Or miss out on a billion cop show or weirdly racially insensitive shows! You wouldn't want to miss out on any of these wonderful things!,Patriots,1,1574622614,e11i3w
854,"Why accept that Penalty? Take the loss of 3 and loss of down, cmon",Bills,3,1574622603,e11i3w
855,Bolles holding on a run?  Shocked I tell ya.,Broncos,3,1574622599,e11i3w
856,"For fucks sake Boles, held and his assignment still got the ball carrier.",Broncos,3,1574622596,e11i3w
857,"That interception honestly looked like Allen expected his receiver to cut up field, there was a giant empty pocket in that area",,3,1574622559,e11i3w
858,"Well, we're notoriously bad at stopping screens.",Bills,2,1574622555,e11i3w
859,"Dammit other Allen, don't run for firsts",Bills,2,1574622546,e11i3w
860,Flacco would have been murdered there.,Broncos,1,1574622542,e11i3w
861,STOP PLAYING BOOKER,Broncos,1,1574622535,e11i3w
862,Star cost too much cut.,Bills,0,1574622520,e11i3w
863,well maybe... he wanted to throw it behind the safety ?,Broncos,1,1574622497,e11i3w
864,The bills are all at the line and we’re throwing screens.,Broncos,3,1574622485,e11i3w
865,3rd and 6?  I'm not liking these odds.,Broncos,2,1574622463,e11i3w
866,"announcers on 3rd and long: TIME IS THE ISSUE HERE. Yeah Steve, they have a lot of young players on this team!

thanks",Broncos,3,1574622461,e11i3w
867,Damn that train must be loud af to hear it over the stadium noise.,,1,1574622453,e11i3w
868,I hope so.,Bills,1,1574622442,e11i3w
869,I heard about it in the second but not in the first when it happened,,1,1574622422,e11i3w
870,Miscommunications of the WR option?,Bills,1,1574622416,e11i3w
871,Nah they'd rather squeeze in more commercials,Bills,5,1574622413,e11i3w
872,Patrick Ramsay-esque was that throw.,Bills,1,1574622356,e11i3w
873,That's what I thought but on the sideline it looks like they disagreed on the called route,Bills,3,1574622340,e11i3w
874,"It was into the wind, so probably not.",Bills,2,1574622333,e11i3w
875,"We agree on at least two things today, then.",Broncos,1,1574622309,e11i3w
876,The wind took it  ....right?,Bills,3,1574622279,e11i3w
877,Horrible angle on the replay of the pick. Show something where we can see the whole field. You suck CBS production team,,9,1574622278,e11i3w
878,"Sad to hear he died, RIP.",Patriots,1,1574622277,e11i3w
879,"Honestly I've always hated Muppets, ever since I was a kid. I hate them even more as an adult now, they are just annoying as hell.  They are supposed to be funny right? But they aren't.",49ers,6,1574622273,e11i3w
880,They talked about him going down like 5 separate times,Broncos,2,1574622272,e11i3w
881,Naughty naughty!,Bills,1,1574622266,e11i3w
882,What interception?,Bills,2,1574622264,e11i3w
883,Yikes. That was probably the easiest int of his career.,Bills,3,1574622258,e11i3w
884,idek thats the worst throw ive seen since last season,Bills,1,1574622246,e11i3w
885,I really hope getting up to the box is what changes things for Daboll. So far it seems that way,Bills,2,1574622246,e11i3w
886,"That was one of the worst throws I’ve ever seen in my life. This is why you are still looked at skeptically, Josh.",Bills,3,1574622244,e11i3w
887,MANY PASSES,Broncos,1,1574622240,e11i3w
