,body,author_flair_text,score,created_utc,link_id
0,"Davis has been injured all year, not to mention he is a known commodity in the NFL and is therefore getting more attention. I shudder to think what he and Brown can put up when teams respect both of them",Titans,1,1575889489,e7zbio
1,Inside their own 10 sir,Titans,1,1575889237,e7zbio
2,Yeah no one could have predicted that shit,Raiders,1,1575860528,e7zbio
3,Yeah but Broncos &gt; Chargers so not really,Titans,2,1575857001,e7zbio
4,Mines practically glued shut.,Titans,2,1575856792,e7zbio
5,"That's basically what I was trying to say without being like, ""You motherfuckers have had it easy.""

Before 2016 I believe we had the longest active playoff drought. And that seems to be a flash in the pan.",Raiders,1,1575853052,e7zbio
6,Bring it!!!,Texans,2,1575852497,e7zbio
7,I think the Ravens walk through the AFC.,Raiders,1,1575852244,e7zbio
8,"With Tony Dungy's defense, no less. As hard as being a Titans fan has been over the years, I can't say I envy y'all's experience much.",Titans,2,1575852237,e7zbio
9,I can't handle this lol.,Chiefs,2,1575852164,e7zbio
10,ngl he's a handsome man.,Titans,1,1575852160,e7zbio
11,"He should've thrown it to whoever was on the 1.

Anything but a fade to a short white guy.

Honestly thought he was gonna run for a TD before he slid.",Raiders,1,1575852125,e7zbio
12,Better now. LOL. Damn.,Chiefs,2,1575852092,e7zbio
13,"So where is Mariotta ending up? 

Cause Tannehill ain’t going anywhere for the next decade or so...",,2,1575852017,e7zbio
14,[They learned it from watching L.A.](https://media.giphy.com/media/qxtxlL4sFFle/giphy.gif),Browns,1,1575851976,e7zbio
15,You doing alright? How's the heart?,Raiders,1,1575851731,e7zbio
16,"Yeah at least you guys were only a half yard away.

We got publicly gang-raped by our former head coach while the world cheered.",Raiders,1,1575851675,e7zbio
17,Holy fuck.,Patriots,1,1575851494,e7zbio
18,"Hah not as abnormally high as our offensive production, amirite?",Titans,1,1575851280,e7zbio
19,Yes Meanwhile Steph chucks full court shots twice a game and doesnt give a fuck,Raiders,1,1575851227,e7zbio
20,Agreed on all. Having a QB playing like this is just so freaking weird.,Titans,1,1575851199,e7zbio
21,Oof yeah we feel ya dude. I still remember that AFCCG from back in the day.,Titans,2,1575851091,e7zbio
22,Derrick Henry is the biggest motherfucker in the league wow,Titans,3,1575851088,e7zbio
23,That shit is like KD refusing to take last second half-court heaves because he doesn't want to lower his shooting %,,2,1575851078,e7zbio
24,Was that James Corden as a Raiders O-liner talking to Gruden?,Titans,2,1575851023,e7zbio
25,"Or, ya know, if they still had Amari.",Titans,0,1575850947,e7zbio
26,"No, I've been me for 32 years. So I've seen the Titans in as many Superbowls as the Raiders in my life.",Raiders,1,1575850915,e7zbio
27,Good to know. We have a bit of a rivalry forming with the Raiders... if you can call it that.,Bears,3,1575850905,e7zbio
28,You're losing to trash then.,Titans,1,1575850903,e7zbio
29,He's got double eyelashes or some weird thing.,Titans,1,1575850883,e7zbio
30,Yeah not trying to hate on the guy.  Was a big fan of his. Just happy to see Tannehill do his thing.,Titans,1,1575850852,e7zbio
31,Gotta think about those fantasy points,,5,1575850847,e7zbio
32,pretty sure this is the first bear flair ive seen today,Titans,8,1575850845,e7zbio
33,Ryan Tannehill might be a bit better than Marcus Mariota dont @ me,,7,1575850830,e7zbio
34,I like the way this turtle foreskin thinks.,Titans,13,1575850805,e7zbio
35,Carr is the only NFL quarterback that throws the ball away on 4th down rather than taking a chance and risking a INT. He also refuses to throw a Hail Mary for the same reason. Absolutely pathetic.,Raiders,7,1575850787,e7zbio
36,we're finally seeing what happens when you dont go cheap,Titans,3,1575850772,e7zbio
37,GG RAIDERS. Hope y’all finish the season 3-0,Titans,9,1575850769,e7zbio
38,Have my fellow Bears fans been running their mouths in this thread? Not being snarky. Just curious.,Bears,3,1575850761,e7zbio
39,This is why we have Lewis. Can't ask Henry to bulldoze entire defenses *every* game if you want him to be productive late in the season and into the playoffs.,Titans,3,1575850734,e7zbio
40,Fuuuuck no. However if he fell to us then hell yes,Raiders,1,1575850730,e7zbio
41,All this game tells me is that Adam Gase is a terrible terrible coach and every Jets fan should pray he should be fired for Darnolds sake,49ers,3,1575850721,e7zbio
42,"I'm just here to say I'm a ""Tanneshill"" and have been for 8 years and I knew he was fucking capable of this and every stupid mother fucker that said we didn't have a franchise QB in him to suck my chode.

Best revenge ever and I hope Tennessee makes a deep fucking playoff run and win a Superbowl with Tannehill too.",Dolphins,20,1575850719,e7zbio
43,And so he bloody well should.,Raiders,6,1575850713,e7zbio
44,Tannehill saving plays by becoming the RB,,7,1575850706,e7zbio
45,"Dion Lewis wasn’t completely useless. 

Give that man the gameball",Titans,7,1575850696,e7zbio
46,"*booker t voice* 

TEXANS! We comin for you!",Titans,3,1575850668,e7zbio
47,Much deserved at this point.,Raiders,5,1575850661,e7zbio
48,My butthole already tight,Titans,3,1575850657,e7zbio
49,There are some dudes in Miami that feel so vindicated that Tannehill is actually good.,Rams,8,1575850648,e7zbio
50,Carr is going to catch hell for that 4th down toss.,Titans,5,1575850642,e7zbio
51,Mannehill doin it all,Titans,2,1575850634,e7zbio
52,Gruden and Mayock will know who to draft. I’m not sure if Tua is the answer we need.,Raiders,2,1575850614,e7zbio
53,Yup. Like a fucking moron.,Raiders,4,1575850608,e7zbio
54,Next week for 1st in the AFC south baby!,Titans,6,1575850601,e7zbio
55,He did,,4,1575850600,e7zbio
56,"The NFL really have the Titans and Texans playing their 2 match-ups in the last 3 games of the season as their records are even. 

Scripted league confirmed.",Titans,8,1575850597,e7zbio
57,"At least the first half was exciting. Oh well, heres to hoping we beat the Chargers and Broncos and finish the season on a high note.",Raiders,4,1575850591,e7zbio
58,It looks like poop,Broncos,1,1575850582,e7zbio
59,God no. We have holes EVERYWHERE. Drafting a QB is a reach trading up for one is dumb.,Raiders,1,1575850576,e7zbio
60,I missed what down it was because I was just barely watching on Redzone. Did Carr throw it away on 4th down?,Broncos,6,1575850572,e7zbio
61,Damn. Carr bein exposed,Titans,1,1575850562,e7zbio
62,lewis looking like henry out there,Titans,2,1575850560,e7zbio
63,"Shhh bby no more tears, only dreams",Titans,1,1575850560,e7zbio
64,Damn Dion,Titans,1,1575850551,e7zbio
65,Raider fans haven’t been this disappointed and booed as much since MATT FUCKING FLYNN.,Raiders,2,1575850541,e7zbio
66,"Raiders fans, would you be opposed to trading up for a QB, like Tua? I know he's hurt but there are still plenty of teams that want him bad and will take chances",,3,1575850522,e7zbio
67,"As a NFL fan, gonna miss the Raiders being in Oakland.  Oakland fans are fucking nuts.",Titans,6,1575850521,e7zbio
68,"OK.  That was the worst 4th down play I ever saw.  Yes your guy is covered, but it's 4th fucking down and you're down by 3 scores.  Throw the ball, who cares if it's an INT?",49ers,7,1575850516,e7zbio
69,Derek Carr looks like he's always wearing eyeliner.,Titans,1,1575850511,e7zbio
70,This motherfucker did indeed do that,Titans,4,1575850507,e7zbio
71,"LOOOOL defend that Carr groupies, 4th down and he throws it away so he doesn't risk an INT. He does that shit all the time.",,4,1575850502,e7zbio
72,What's the point of running it and getting hurt,Titans,1,1575850500,e7zbio
73,Carr throwing it away on 4th down. Rather than throw a pick. Classic Carr. All about his stats.,Raiders,3,1575850499,e7zbio
74,Uh...ok,,1,1575850486,e7zbio
75,"Yep, nailed it.",Raiders,5,1575850482,e7zbio
76,"Ready for post game presser Carr and Gruden, “we left a lot of points on the board”, “I’m just gunna let coach make those decision”, “it starts with me”",Raiders,4,1575850481,e7zbio
77,Did this mutherfucker just throw it away on 4th and goal????,Raiders,19,1575850464,e7zbio
78,"I mean, it wouldn’t matter, but did Carr just throw away a pass on 4th and goal...?",Titans,13,1575850455,e7zbio
79,Carr’s mad but he didn’t give anyone a chance to make a play.,NFL,8,1575850451,e7zbio
80,"cmon Carr, at least fumble it out of the endzone!",Raiders,2,1575850449,e7zbio
81,That...was delicious.,Titans,2,1575850435,e7zbio
82,Holy fuck Carr is a moron,,5,1575850431,e7zbio
83,"Uh oh, stinky",Titans,3,1575850426,e7zbio
84,Was that him again?? Fucking awesome. Love it when guys like him and Raymond step up for huge plays.,Titans,1,1575850392,e7zbio
85,Tbh if AB had panned out you woulda been in the playoffs. So Gruden tried at least,Titans,8,1575850371,e7zbio
86,Did this announcer play football or something?,NFL,2,1575850334,e7zbio
87,"I wanted to say remember Nnamdi Asomugha, but I forgot about everyone else in that secondary still got torched.",Titans,2,1575850322,e7zbio
88,"At the very least we need to take a QB high in the draft to make Carr a little uncomfortable. He's been acting way too comfortable in his role with the team since getting paid, and he hasn't produced close to his salary since 2016",Raiders,2,1575850305,e7zbio
89,RemindMe! 23 days,Titans,2,1575850302,e7zbio
90,Any chance Butler could come back if we make the playoffs?,Titans,1,1575850291,e7zbio
91,"I’m just glad we are/were in contention for the playoffs this year. This year was about showing if we had any spirit. The future is looking good for us. Gruden will make a strong playoff team. Our secondary, LB, and receivers are just not good enough. IMO Carr works miracles with this offense.",Raiders,7,1575850279,e7zbio
92,We about to see a classic Carrbage time performance.,Raiders,5,1575850275,e7zbio
93,"You know how you got 6-1 and consistently score 30+?

You have to slowly destroy a number 2 pick over half a decade.

Totally worth it",Titans,6,1575850266,e7zbio
94,Hold me accountable,Chargers,2,1575850263,e7zbio
95,[deleted],,0,1575850261,e7zbio
96,ah darn steelers take it,Titans,1,1575850260,e7zbio
97,[removed],,1,1575850241,e7zbio
98,I see you,Raiders,3,1575850209,e7zbio
99,Honestly I’ve been supporting Carr since day one. But all the good QBs make their supporting cast look good. Josh Jacobs has been carrying this offense on his back and him not 100% these past couple of weeks shows. Time for a new QB.,Raiders,4,1575850209,e7zbio
100,Kyler....stop shitting your pants,,1,1575850207,e7zbio
101,"Bring back Asomugha, Woodson, and Reggie Nelson.",Raiders,0,1575850193,e7zbio
102,We winning the division. Won't matter.,Titans,4,1575850189,e7zbio
103,Lmao. Did FPC post Rabsho's draft profile and I miss it? Can he play CB?,Raiders,2,1575850178,e7zbio
104,"If the titans make the playoffs I’m going to let you buy me one, too.",Titans,3,1575850148,e7zbio
105,Have you been scoring bitches at an abnormally high rate?,Titans,1,1575850147,e7zbio
106,"Reading isn't your strong suit, I said when he's the direct cause of it he blames someone else.",,1,1575850146,e7zbio
107,What’re they selling?,Titans,1,1575850136,e7zbio
108,Same. We finally got consistent.,Titans,2,1575850132,e7zbio
109,yea kyler is shitting his pants we arent getting any help guys,Titans,0,1575850119,e7zbio
110,How has our secondary been garbage for two decades. We’ve been shit in Oakland and we’ll be shit in Vegas. Gruden will be out by year 4 of his contract.,Raiders,1,1575850106,e7zbio
111,Kyler murray with a chance to beat the steelers. Please,Titans,3,1575850079,e7zbio
112,Derrick Henry's hair reminds me of the chocolate lady from Spongebob.,Packers,2,1575850071,e7zbio
113,CMON KYLER,Titans,1,1575850063,e7zbio
114,I don't think that's true.,Titans,5,1575850053,e7zbio
115,If the Titans make the playoffs I will buy a Ryan Tannehill jersey.,Chargers,6,1575850051,e7zbio
116,"Lol, dudes celebrating",Titans,1,1575850043,e7zbio
117,He read his scouting report.,Raiders,2,1575850041,e7zbio
118,Right? Its been weeks now and I'm still not used to it.,Titans,2,1575850026,e7zbio
119,"
&gt;The Titans are walking away with the ~~division~~ conference if Tannehill started all year",Raiders,1,1575850025,e7zbio
120,"To be fair I think it was his injuries, particularly post-Miami last year. That nerve damage can do some funky shit. He *did* get us our first playoff win in 14 years.",Titans,1,1575850008,e7zbio
121,Come on kyler. Steal this game from the Steelers,Titans,5,1575850002,e7zbio
122,"If anything, that's probably contributing to the ill-will from people in the stands.",NFL,3,1575850000,e7zbio
123,Lmao,Titans,2,1575849977,e7zbio
124,Wait a second.. God friended someone else??? Wtf I thought I was special.,Titans,2,1575849968,e7zbio
125,Ryan tannehill is who everyone thought mariota was.,NFL,4,1575849957,e7zbio
126,I’ve been waiting for the regression for weeks and it still hasn’t come. Still waiting though dammit this isn’t the Titans I know and agonize over,Titans,3,1575849955,e7zbio
127,Put mariota in and watch him dick this raiders defense,Titans,2,1575849955,e7zbio
128,Are y'all us for the last 12 years?,Titans,1,1575849950,e7zbio
129,Kinda weird we are high powered,Titans,3,1575849938,e7zbio
130,He stopped running,Raiders,2,1575849937,e7zbio
131,Depends if we put Tannehill back in,Titans,1,1575849925,e7zbio
132,You literally just commented about how he is too soft when someone turns it over lol,Raiders,2,1575849920,e7zbio
133,"No, no, no. Ryan. Fitzpatrick.",Raiders,1,1575849919,e7zbio
134,"Both sides are on the wrong, Jones stopped on the route. But where Carr threw it didn't seem likely Jones had a chance at it regardless.",Raiders,1,1575849913,e7zbio
135,Carr overthrowing another pass then blaming his receiver textbook.,Raiders,5,1575849903,e7zbio
136,Really hoping the Cards pull out a comeback. Would be HUGE for the Titans,Titans,4,1575849895,e7zbio
137,Nice football analysis lol.,Raiders,3,1575849894,e7zbio
138,Carr is more shit than his shitty brother was.,Titans,-1,1575849891,e7zbio
139,He gave up on the route at like the 15,Raiders,1,1575849887,e7zbio
140,Feels weird to see the offense do this well.,Titans,3,1575849877,e7zbio
141,I remember going to home games as a kid and Raiders fans always showed up in fuckin force. Stuck with me more than any other team besides the Packers.,Titans,1,1575849874,e7zbio
142,As much as I would love to see that. Mariota will never play for the tits again. Weve been up by multiple scores in the 4th and they wont even give him a chance. He's done,Titans,1,1575849869,e7zbio
143,thats fair,Titans,1,1575849869,e7zbio
144,Rockwell is simply amazing.,Titans,2,1575849867,e7zbio
145,Carr wear eye mascara.,Cardinals,0,1575849865,e7zbio
146,"Man, Carr's yeah. If only Carr threw an 83 yard bomb for a TD every time he touched the ball, Oakland wouldn't be losing rn.

We should trade him and a first rounder for Nick Foles.",Raiders,2,1575849862,e7zbio
147,These last few weeks are gonna be fuckin wild in your division,49ers,1,1575849860,e7zbio
148,you're gonna make /r/oaklandraiders cry stop it,,-1,1575849859,e7zbio
149,We banged.,Raiders,1,1575849853,e7zbio
150,lol okay Carr give him the lip when you overthrew his ass. Sick of that shit every game. Dude's not a leader.,,1,1575849838,e7zbio
151,Yeah man I thought Mariota was all right. But uh... Guess not,49ers,1,1575849834,e7zbio
152,Especially when it's one of their last games in that stadium.,Titans,3,1575849827,e7zbio
153,Like Renfrow some weeks ago.,Raiders,1,1575849822,e7zbio
154,"I like to see some fire out of Carr, but every time I see his fire, he looks like he's throwing a tatrum. I like the guy, but his leadership and playstyle just scream soft.",Raiders,6,1575849820,e7zbio
155,"Yeah, they've always had amazing fans.",Titans,3,1575849819,e7zbio
156,[deleted],,1,1575849806,e7zbio
157,Clint Eastwood the real MVP,Titans,2,1575849793,e7zbio
158,"Our Defense could make a wet piece of paper look decent...

But for real though you guys look good and I hope y’all make the playoffs",Raiders,1,1575849791,e7zbio
159,Have we got a single first down this half before the junk time??,Raiders,1,1575849790,e7zbio
160,"I'm used to us inexplicably beating great teams in the regular season, but now we're handling a competitive/good team?",Titans,1,1575849785,e7zbio
161,I’ll watch anything directed by Clint Eastwood. Especially if Sam Rockwell is in it. Cant wait for Richard Jewell.,Raiders,5,1575849783,e7zbio
162,Carr looks pretty unhappy there 😔,Titans,1,1575849773,e7zbio
163,Gotta love Oakland fans. They're not as deluded as online Carr groupies,Raiders,3,1575849764,e7zbio
164,It hurts my heart when a team gets booed at home,,3,1575849756,e7zbio
165,My Carrbages!,Titans,1,1575849744,e7zbio
166,Jesus Carr - You’re somehow screwing up RB dump offs down 21 pts.,49ers,5,1575849742,e7zbio
167,The Vols and the Titans both turned their seasons around at about the same time. Been fucking loving these past 2 months.,Titans,2,1575849728,e7zbio
168,Carr looks like he’s about to throw a tantrum.,Titans,2,1575849726,e7zbio
169,Carr almost got Washington killed,Raiders,6,1575849710,e7zbio
170,it better be mariota time,Titans,3,1575849700,e7zbio
171,I feel bad for Raiders fans. Team looks like it could be pretty good in a year or two and it’s getting ripped away to Vegas. Such a shame.,Titans,7,1575849700,e7zbio
172,I think the reason is both sides are right.,Raiders,2,1575849683,e7zbio
173,All four of these late games are going as awfully as humanly possible,Raiders,5,1575849676,e7zbio
174,The key to success is just draft enormous physical freaks at the HB/WR/K positions and let them run over people.,Titans,2,1575849665,e7zbio
175,Thanks Hipple!,Titans,1,1575849662,e7zbio
176,I would rather that then be Phil Rivers and freaking the fuck out,Raiders,1,1575849652,e7zbio
177,Carrbage time is now!,Raiders,6,1575849643,e7zbio
178,"Idk, man. What are his stats this game?",Titans,1,1575849640,e7zbio
179,Lmao,Titans,1,1575849625,e7zbio
180,We were down 14 before that play.,Raiders,1,1575849624,e7zbio
181,"I mean, ok but then we've made literally Tannehills whole day easy for him if that's how we want to spin it.",Raiders,6,1575849621,e7zbio
182,[removed],,1,1575849613,e7zbio
183,"Rosen, come on down!",Raiders,5,1575849595,e7zbio
184,Always good to see someone talking about *our* lineage.,Titans,6,1575849589,e7zbio
185,They've been trash since the first movie.,Raiders,1,1575849588,e7zbio
186,It's amazing how much consistent QB play has done for this team.,Titans,1,1575849587,e7zbio
187,It feels like watching us argue about Mariota again,Titans,1,1575849579,e7zbio
188,Just checking in and yep it looks like Derrick Henry continues to be good at playing running back in the National Football League.,Titans,5,1575849577,e7zbio
189,Crazy isn’t it?!,Titans,1,1575849574,e7zbio
190,We were down 14 at that point thanks to Carr's check-downs. Don't act like that play lost us the game.,Raiders,0,1575849573,e7zbio
191,steelers convert 3rd and 13. 1st and goal with 2 minutes FUCK,Titans,2,1575849573,e7zbio
192,Exactly fam it's so fucking tiring,Raiders,3,1575849572,e7zbio
193,[removed],,1,1575849561,e7zbio
194,He meant for the season,Titans,2,1575849553,e7zbio
195,"I bet you weak af irl, prolly timid, and shy, bet you keep real quiet in public spaces.",Raiders,1,1575849540,e7zbio
196,The Titans are 6 points away from making me kill myself. Pls no 48-21,Raiders,3,1575849537,e7zbio
197,Me too.  :’),Dolphins,2,1575849532,e7zbio
198,"I mean, I hate hearing both sides of this shit.",Raiders,4,1575849529,e7zbio
199,[removed],,1,1575849526,e7zbio
200,Oakland doesnt deserve this shitshow,Raiders,2,1575849513,e7zbio
201,Ohhhh the shade. Showing the new stadium,Titans,3,1575849507,e7zbio
202,They gonna get that stadium open by next season?  Looks like its gonna he cutting close.,Titans,2,1575849505,e7zbio
203,"I'm not hating on Carr raider fans, but we definitely made the first 14 points easy for him",Titans,4,1575849500,e7zbio
204,"We are fighting for the division lead. We’ll be tied with 2 games left against them.

The Titans are walking away with the division if Tannehill started all year",Titans,5,1575849495,e7zbio
205,I can tell you from personal experience that you actually just want the Dolphins QB,Titans,7,1575849491,e7zbio
206,I'll need a second opinion here but I think this might hurt Raiders' playoffs chances,,2,1575849490,e7zbio
207,Who cares. I would be erect,Bills,1,1575849489,e7zbio
208,"Bro had he thrown it better to Waller, he wouldn't have fumbled. Get this guy outta here.",Raiders,2,1575849478,e7zbio
209,But really Tanne is just good,Titans,3,1575849474,e7zbio
210,"Ah, fortunately none, as I slept until 6pm GMT today (my [remote] work schedule is highly abnormal).",Titans,1,1575849474,e7zbio
211,Top 1,Titans,3,1575849472,e7zbio
212,"I can't believe what I've been watching the last 7 weeks!

POINTS!!!!",Titans,5,1575849466,e7zbio
213,"I really hate Carr's look after a turnover that's not his. He doesn't even look pissed, he's just like ""it's okay sweety we'll get em next time"".

Then when he causes a direct turnover he's always blaming someone else.",,1,1575849462,e7zbio
214,The networks and league in general would hate that,Titans,3,1575849453,e7zbio
215,That's because were......consistent now?,Titans,3,1575849450,e7zbio
216,They haven't disowned Banthas yet so fuck Disney,Raiders,2,1575849449,e7zbio
217,Sit Jacobs the rest of the way and draft a quarterback,Raiders,3,1575849449,e7zbio
218,Disney ruins everything nowadays,Titans,1,1575849434,e7zbio
219,TITAN UP WOOOOOOOOOOOOOOOOO,Titans,3,1575849429,e7zbio
220,"you aint winning against the ravens, ya'll fuckin trash",Raiders,-1,1575849429,e7zbio
221,Cant wait to hear about how Carr caused that fumble.,Raiders,3,1575849425,e7zbio
222,steelers have ball at ARI 25 with 3:30 left,Titans,2,1575849424,e7zbio
223,"Dude if we somehow beat the ravens we should take the whole fucking thing lol.

I dont see anyone taking down the ravens but the Pat's and they looking weak rn",Titans,1,1575849422,e7zbio
224,Derek Carr is such a loser look at him allowing 42 points what a fool.,Raiders,3,1575849416,e7zbio
225,That ball knew what it was doing. Just look at it just sitting there spinning. It was asking for it. That dirty little ball wanted a TD,Titans,9,1575849410,e7zbio
226,Trash Star Wars. What have they done?,Dolphins,3,1575849408,e7zbio
227,Yeah turns out Mariota was even worse than we thought it was.,Titans,4,1575849399,e7zbio
228,"Yes, I remember those 5 years quite well",Titans,6,1575849390,e7zbio
229,Yep,Titans,2,1575849383,e7zbio
230,I want to die.,Raiders,7,1575849379,e7zbio
231,"Welp, that's the season. We are still a team on the up though, with some nice pieces. See ya in Vegas.",Raiders,2,1575849372,e7zbio
232,I had so much faith in Mariota. But I'm happy the coaching staff knows a hell of alot more about football than me,Titans,4,1575849370,e7zbio
233,Year out.,Raiders,6,1575849370,e7zbio
234,Two top 15 picks. See you next draft fellas.,Raiders,1,1575849363,e7zbio
235,I defended Mariota for way too long...turns out he just didn't have it here,Titans,3,1575849361,e7zbio
236,[deleted],,1,1575849358,e7zbio
237,Year in.,Raiders,6,1575849353,e7zbio
238,Once they started talking about us last year we started to tank 😭,Titans,2,1575849351,e7zbio
239,It did look weak early. Need to get healthy.,Titans,2,1575849347,e7zbio
240,This cycle of depression.,Raiders,6,1575849346,e7zbio
241,This game was pretty great until about 8 mins ago lol,Raiders,4,1575849334,e7zbio
242,wtf the Refs forgot to blow the play dead?,Patriots,3,1575849332,e7zbio
243,Watch how it just spins.,Raiders,8,1575849332,e7zbio
244,Wow. Switch out Mariota and now the Titans are likely to be fighting the Texans for the division lead. Absolutely incredible,49ers,8,1575849331,e7zbio
245,GG,,2,1575849330,e7zbio
246,That fucking ball is EVIL look at that spin. FUCK YOU BALL,Raiders,13,1575849327,e7zbio
247,Damn we actually look like a legit team even with our banged up secondary,Titans,6,1575849325,e7zbio
248,#ANOTHER TOUCHDOWN TITANS!!!!,Titans,6,1575849314,e7zbio
249,Gruden face 🤣🤣🤣🤣,Titans,3,1575849310,e7zbio
250,Keep Henry and aj brown out for the rest of the game,Titans,11,1575849310,e7zbio
251,TYE SMITH THE FUMBLE GOD!,Titans,7,1575849303,e7zbio
252,SCOOP AND SCORE!!!!!!!!,Titans,5,1575849300,e7zbio
253,OOHHHHH YEEEEEEEEAHAHHH,,3,1575849289,e7zbio
254,If you're going to be a troll at least be funny,Buccaneers,5,1575849285,e7zbio
255,"Even if we score 2 touchdowns quickly, this D is hot trash. Titans would need an epic meltdown to lose this game.",Raiders,3,1575849281,e7zbio
256,"And that's the season, the last one in Oakland. Fuck.",,6,1575849273,e7zbio
257,Dagger.,Raiders,6,1575849268,e7zbio
258,lol of course that would happen,Raiders,5,1575849265,e7zbio
259,"Remember when we struggled to put up 20 week in and week out? 


We’re fuckin explosive",Titans,16,1575849264,e7zbio
260,Raiders should relocate after this performance smh,Titans,3,1575849263,e7zbio
261,You first,Raiders,4,1575849262,e7zbio
262,I fucking love this team!!,Titans,6,1575849261,e7zbio
263,LET’S GOOOO,Titans,7,1575849256,e7zbio
264,"I was actually making dinner, I know it seems like a convenient coincidence, but it's true.",Titans,1,1575849254,e7zbio
265,It's over. GG,Titans,4,1575849251,e7zbio
266,Rip Raiders hopes and dreams,49ers,11,1575849230,e7zbio
267,"Welp, that was the dagger.",Raiders,10,1575849229,e7zbio
268,Are.. are we good now? I keep waiting for the betrayal but it's not happened yet.,Titans,9,1575849227,e7zbio
269,I’m a homer. I think we’re the team that can beat the ravens in the playoffs. Well probably lose the following week but we match up well,Titans,7,1575849227,e7zbio
