,body,author_flair_text,score,created_utc,link_id
571,"It’s a weird feeling knowing that someone is going to miss a kick. I would’ve bet anything he was going to miss it, and he did. It goes beyond just doubt and cynicism to an almost supernatural ability to just know things about the Titans",Titans,2,1575845821,e7zbio
572,Damn succup and defense are killing us. Can’t force a punt to save our lives,Titans,3,1575845820,e7zbio
573,Raiders just went on a streak of 16 penalties to 0... don't talk about horrible reffing to me.,Raiders,-1,1575845815,e7zbio
574,You're nuts if you don't think we were the better team so far.,Titans,-1,1575845800,e7zbio
575,"Act like yall gonna do anything if you made the playoffs, when you cant even hit a 40 yard FG. Sit down and enjoy the game",Raiders,0,1575845800,e7zbio
576,"If you want to argue this, he didn't fully extend his arm. Channeling his inner Hopkins",Titans,2,1575845796,e7zbio
577,"Can’t put him back on IR, would have to cut him

Which we probably should do",Titans,8,1575845791,e7zbio
578,"Just like everyone predicted, Carr and Tannehill lighting it up and looking unstoppable.",Raiders,2,1575845786,e7zbio
579,You could field a decent team with our combined injury report.,Raiders,1,1575845781,e7zbio
580,He's missed most of the season. Only been back for a few games.,Titans,1,1575845719,e7zbio
581,[deleted],,1,1575845713,e7zbio
582,Bring me Blankenship,Titans,2,1575845709,e7zbio
583,Even if the other 31 teams have the same FG conversion rates ours is so bad that it would hurt the league average,Titans,3,1575845702,e7zbio
584,"sigh

Bro we better win this game",Titans,5,1575845698,e7zbio
585,Just put Succop on the season ending IR already. This is fucking stupid,Titans,6,1575845694,e7zbio
586,And the half ends with a doink. A fitting end because this game makes no sense.,Raiders,7,1575845692,e7zbio
587,"The reffs called like 16 straight penalties on us and 0 on our opponents, Tits fans I know that was a horrible call, I sympathize - but lets not pretend we're in bed with the refs here",Raiders,4,1575845690,e7zbio
588,Only us bud.,Raiders,1,1575845687,e7zbio
589,Let’s not be the colts. Let’s move on from a bad kicker,Titans,7,1575845685,e7zbio
590,Interceptions are normal football plays. Nothing flukey about it. If a blown coverage is a fluke than every defensive snap of ours is a fluke. Stop pretending you're the Patriots,Raiders,2,1575845678,e7zbio
591,Kickers.,Titans,5,1575845667,e7zbio
592,This game should be 31 to fucking 7 right now. Fucking garbage flukes and horrible reffing,Titans,-2,1575845657,e7zbio
593,"Are there any other stadiums where teams have to take the same corridor to the locker rooms, or is that just a Coliseum thing?",Raiders,1,1575845635,e7zbio
594,Succop bailed us out a few times but I think it's time to say thanks and goodbye.,Titans,3,1575845634,e7zbio
595,I think that intentional grounding was a little makeup for the abomination that was last week.,Raiders,0,1575845633,e7zbio
596,was a very short time ago when our FG unit was a point of pride. sigh,Titans,3,1575845626,e7zbio
597,Is it just me or does it seem like across the entire NFL there are a lot of missed kicks this year?,Titans,1,1575845625,e7zbio
598,"You know how the refs love the Raiders.

. . .",Raiders,2,1575845617,e7zbio
599,Bring back parkey,Titans,2,1575845616,e7zbio
600,Kinda wished we wouldve just keeper Parkey.,Titans,2,1575845612,e7zbio
601,I'm so glad I did all my errands yesterday.  This has been one good-ass football day so far.,49ers,2,1575845608,e7zbio
602,Doink,Raiders,0,1575845607,e7zbio
603,Gotta cut Succop at half time,Titans,1,1575845604,e7zbio
604,Thanks holder very cool,Raiders,1,1575845604,e7zbio
605,"He has ""Succ"" in his name what else did you expect",Titans,1,1575845602,e7zbio
606,"Man, our kicking game has pulled a real 360",Titans,3,1575845600,e7zbio
607,Honestly we should’ve kept parkey,Titans,1,1575845587,e7zbio
608,Succup is hot ass these days. Draft a kicker in the 4th fuck it,Titans,3,1575845587,e7zbio
609,Tannehill is a great example of why QB success can be so dependent on the situation of the roster and the coaches around them,Seahawks,1,1575845583,e7zbio
610,Went into the locker room. Apparently he's had a sore leg all game so they went to work on it a bit before halftime came.,Titans,1,1575845581,e7zbio
611,Succop is toast. Damn shame.,Titans,1,1575845581,e7zbio
612,Refs kicked that wide,Raiders,-4,1575845572,e7zbio
613,I miss Mr. Money Succop under 50,,2,1575845567,e7zbio
614,Hamstring is acting up,49ers,1,1575845563,e7zbio
615,We never play defense though.,Raiders,3,1575845558,e7zbio
616,"hamstring, questionable for next half I guess",Titans,1,1575845553,e7zbio
617,Ngl we got serious help there. I feel a mix of excited and dirty kinda like sleeping with your friends gfs in high school.,Raiders,0,1575845553,e7zbio
618,ThE ReFs,Raiders,2,1575845551,e7zbio
619,"I'm honestly impressed he was close enough to hit the upright

Seriously who the fuck doesnt practice from more than 40 yards",Titans,6,1575845550,e7zbio
620,"Whelp. 

We still have made less than 50% of our FGs this year...",Titans,3,1575845540,e7zbio
621,Succop is done,49ers,1,1575845538,e7zbio
622,Tannehill has looked so good this year and has proved me incredibly wrong,Titans,3,1575845538,e7zbio
623,somethings up with kicking in the nfl this year man,Titans,1,1575845537,e7zbio
624,[deleted],,1,1575845523,e7zbio
625,"Actually, I've sort of had a crush on him since The Shield, I sort of have a thing for weaselly looking rednecky guys.",Raiders,1,1575845513,e7zbio
626,Confidence level: 0,Titans,3,1575845500,e7zbio
627,Tf????,Seahawks,1,1575845500,e7zbio
628,What happened to Derrick Henry?,Vikings,1,1575845499,e7zbio
629,"That's Raider D, baby.",Raiders,1,1575845480,e7zbio
630,TANNETHRILL,,3,1575845479,e7zbio
631,nobody playing any defense today i guess,Titans,4,1575845474,e7zbio
632,Greta actor though,Raiders,2,1575845472,e7zbio
633,The one game the officials actually help us out a bit we're still gonna blow it somehow,Raiders,2,1575845455,e7zbio
634,*HE’s* the unicorn?,Titans,1,1575845446,e7zbio
635,And still better than our D,Raiders,1,1575845444,e7zbio
636,"So, a make up call or? Can we know who it was on?",Raiders,2,1575845441,e7zbio
637,👀 firks with the pushoff,Titans,4,1575845440,e7zbio
638,[deleted],,1,1575845429,e7zbio
639,Tight first half,Raiders,1,1575845425,e7zbio
640,Sheesh. What a goddamn throw.,Titans,1,1575845407,e7zbio
641,"There was no reciever in the area and he wasn't outside of the pocket when he threw it out of bounds, he intentionally grounded the ball to avoid the sack.",,4,1575845405,e7zbio
642,Oh no! Rene Aberjonois(sp?)?,Raiders,2,1575845369,e7zbio
643,"Y'all had a nice drive at the end there, but the interception was flukey, and the other score was a blown coverage. The points still count though, and I look forward to the rest of a good game.",Titans,-1,1575845353,e7zbio
644,Thank you,Raiders,2,1575845352,e7zbio
645,We'll somehow give up a TD here,Raiders,4,1575845349,e7zbio
646,Does anyone actually find Walton Goggins attractive? That’s one ugly unicorn.,NFL,3,1575845337,e7zbio
647,IT'S VERY RARE IM EXCITED,Raiders,3,1575845330,e7zbio
648,NOOOOOOOOO,49ers,2,1575845322,e7zbio
649,"Well the D has been shaky so far, but it's hard to be mad at them for giving up that one with the Raiders getting 1000 chances in the red zone",Titans,1,1575845310,e7zbio
650,He was well inside the tackle box. He can't throw it to an area without a receiver.,,3,1575845310,e7zbio
651,It's so nice not to be the ones getting screwed for once,Raiders,3,1575845308,e7zbio
652,I maybe wrong but I feel like ref mistakes didn't cost us as much as the opponent throughout the season so I can't get mad if we're on the wrong side once in a while.,Titans,3,1575845307,e7zbio
653,What an odd comment to be downvoted on,Raiders,2,1575845293,e7zbio
654,Injured secondary and zero pass rush is a tough combo,Titans,3,1575845291,e7zbio
655,He was still in the pocket. Doesn't matter where the ball lands if there's no receiver in the area,Titans,3,1575845291,e7zbio
656,It’s because he was in the pocket.,Titans,5,1575845285,e7zbio
657,Making up for last week.,Raiders,3,1575845281,e7zbio
658,Past the LOS and out of the pocket to not get called for grounding.,Rams,5,1575845278,e7zbio
659,😂😂😂,Raiders,2,1575845274,e7zbio
660,"How dare he like players on his favorite team, the audacity. Might as well burn him at the stake.",Raiders,2,1575845274,e7zbio
661,Obvious intentional grounding which would have been a 10 yard loss. Didn't call it and they scored the very next play,Titans,0,1575845268,e7zbio
662,"Well, that sucks. Still don’t feel terrible though. Our offense is moving the ball at will, and like 14 of Oakland’s points have come on a fluky INT, and a no-call on intentional grounding. 

Hopefully the defense can get it together in the 2nd half.",Titans,1,1575845264,e7zbio
663,"Nah, Carr gets the shit kicked out of him routinely and gets no help from the refs.",Raiders,3,1575845263,e7zbio
664,"Alright let's try to end this quick, The refs ain't calling it for my team, the refs ain't calling it for your team. They're fucking trash and they have been trash all season. And they will continue to be trash every game until Goodell grows some balls.",Raiders,1,1575845263,e7zbio
665,Carr got away with a grounding. Next play your lbs left over te wide open,Raiders,5,1575845259,e7zbio
666,"Why wasn't that intentional grounding a couple of plays ago? 

Is there something I'm missing?",Titans,3,1575845257,e7zbio
667,Odo from Deep Space Nine has passed away :(,Raiders,3,1575845257,e7zbio
668,an obvious Intentional Grounding was not called against the raiders at the goalline,Titans,3,1575845254,e7zbio
669,Nope. They gave us that one.,Raiders,3,1575845252,e7zbio
670,Y'all ain't that good. Calm your tits.,Raiders,-4,1575845244,e7zbio
671,They got away with an intentional grounding on the one yard line.  Should’ve forced a field goal instead of giving them another chance at the one yard line.,Titans,2,1575845243,e7zbio
672,"The refs kinda forgot about the pocket.

NFL by D&amp;D",Titans,3,1575845242,e7zbio
673,You getting the benefit? Lmao,Titans,0,1575845240,e7zbio
674,We're getting out gamed by refs and raiders offensive coordinator,Titans,-2,1575845240,e7zbio
675,So its intentional grounding to throw it out of bounds? I thought it just had to cross the line of scrimmage. Fill me in because I'm lost lol,Raiders,0,1575845239,e7zbio
676,He left the half early...not sure what's up,Titans,2,1575845236,e7zbio
677,"Carr intentionally grounded, wasn't called, they scored next play.",Titans,2,1575845233,e7zbio
678,Play before the td should’ve been intentions grounding,Titans,2,1575845218,e7zbio
679,"But I bet if Carr got blasted in the knee, refs would've said he was in the pocket and thrown a flag.",Rams,6,1575845217,e7zbio
680,tbh with all the bitching we do about the officials i feel kinda dirty.,Raiders,3,1575845217,e7zbio
681,"They dick us all the time, but they are trash in general. It's so frustarting, I feel you.",Raiders,3,1575845216,e7zbio
682,This is such a fluky tie,Titans,5,1575845198,e7zbio
683,Secondary is injured as hell.,Titans,7,1575845197,e7zbio
684,"To be fair we've had a rough go with the refs this season. That being said, agreed, that was grounding.",Raiders,3,1575845195,e7zbio
685,"Just tuning in, howd we get hosed as per the comments in here?",Titans,2,1575845182,e7zbio
686,"""The pocket"" is subjective.",Titans,7,1575845181,e7zbio
687,Hell ya,Raiders,-2,1575845180,e7zbio
688,WELCOME TO THE FUCKING CLUB,Raiders,2,1575845180,e7zbio
689,I love refs missing easy ass calls which ends up costing us.,Titans,8,1575845168,e7zbio
690,Where is our fucking defense?  What is going on?,Titans,3,1575845168,e7zbio
691,"I mean I'm not a fan of either team, and for the most part I just wanna watch this game sense its fye so far, but lowkey I wanna see Henry go for 100+ to be #1 in rushing yards",Falcons,10,1575845164,e7zbio
692,Fuck these garbage ass refs,Titans,13,1575845141,e7zbio
693,I'm not mad they didnt call intentional grounding.  Just genuinely confused.,Titans,21,1575845135,e7zbio
694,Take that TD instead,Raiders,-10,1575845134,e7zbio
695,Misspelled refs,Titans,5,1575845132,e7zbio
696,Fucking jobbed us,Titans,8,1575845131,e7zbio
697,Refs just bent us over and fucked us raw,Titans,14,1575845126,e7zbio
698,Why don't we just get rid of the intentional grounding rule if they don't call it,,15,1575845112,e7zbio
699,"What a first half

Titans 21

Raiders 14

Refs 7",Titans,13,1575845107,e7zbio
700,We just got hosed,,9,1575845106,e7zbio
701,That was intentional grounding like a motherfucker,Titans,15,1575845104,e7zbio
702,"That's intentional grounding, he can't be out of the pocket in 2 steps.",Titans,15,1575845103,e7zbio
703,"Okay raiders fans,  no complaining about the refs for you this game",Titans,15,1575845098,e7zbio
704,Made em work for it!,Titans,3,1575845089,e7zbio
705,How the hell is that not grounding what the fuck,,17,1575845086,e7zbio
706,These refs are a joke...how the fuck was that not grounding??,Titans,17,1575845083,e7zbio
707,Credit to the refs for putting at least 4 points on the board for the Raiders there,Panthers,20,1575845076,e7zbio
708,REF BALL,Titans,13,1575845068,e7zbio
709,I fucking love our rookies,Raiders,2,1575845066,e7zbio
710,Refs blessed them with a td,Titans,11,1575845064,e7zbio
711,That was 100% intentional grounding...,Titans,9,1575845061,e7zbio
712,"um, how was he out of the pocket?",Titans,9,1575845050,e7zbio
713,"Grounding doesn't exist anymore, cool",Panthers,14,1575845047,e7zbio
714,That’s intentional grounding like a mf,Titans,9,1575845046,e7zbio
715,That’s grounding. That’s fucking grounding. He’s in the pocket.,Titans,12,1575845019,e7zbio
716,"Everyone named Brown in this game is having an excellent day.  
  
If Antonio hadn't been such a crazy shitbag, he could be rocking like 200 yards today.",Lions,4,1575844988,e7zbio
717,"Idk if it was lucky, I think he did a hell of a job reading the play",Raiders,7,1575844983,e7zbio
718,That was a lucky tackle but damn did it look good,Titans,3,1575844947,e7zbio
719,Almost to halftime. Gives them more time to check him out during halftime and hopefully figure out if he can come back in the 2nd half.,Titans,1,1575844946,e7zbio
720,Damn what the fuck Jayon.,Titans,4,1575844941,e7zbio
721,What an awful play call. Everyone knew what it was.,,4,1575844935,e7zbio
722,That was a nice play,Raiders,3,1575844929,e7zbio
723,Motherfucker channeled his inner Polamalu,Raiders,12,1575844915,e7zbio
724,Holy shit what a play,Titans,6,1575844908,e7zbio
725,"Excuse me, my son is also named Defense Looks Terrible Today.",Titans,6,1575844906,e7zbio
726,When did Jayon turn into Palamalu?,Titans,6,1575844893,e7zbio
727,that's awesome! surprising that any f1 driver is into american football at all lol,Titans,3,1575844879,e7zbio
728,Haven't watched F1 in a while cause of how predictable it is.  Should be better now that Penske bought Petronas Mercedes,Titans,3,1575844869,e7zbio
729,"Great! Now Lando Norris too?


That’s just the icing on the cake! Fuck this game!",Titans,3,1575844864,e7zbio
730,Holy fuck Jayon.,Titans,5,1575844859,e7zbio
731,"I expect yall to get the 6 seed. Even at my most optimistic, I saw a loss to yall this game. I think yall finish 10-6.",Raiders,2,1575844859,e7zbio
732,"Heard that, brotha",Raiders,6,1575844856,e7zbio
733,I'm beginning to think that I shouldn't have bet on the under.,Packers,7,1575844852,e7zbio
734,holy shit,Titans,5,1575844847,e7zbio
735,Jayon... god damn son.,Titans,4,1575844837,e7zbio
736,TRUST ME it could be much worse,Raiders,2,1575844834,e7zbio
737,"WTF, is this actually going to be a shoot out in the 2nd half?",Raiders,3,1575844833,e7zbio
738,"Going by his eyeliner, I assume he's more of a white claw kinda guy.",Lions,2,1575844823,e7zbio
739,Defense looks terrible today.,Titans,7,1575844821,e7zbio
740,Crazy how far our secondary has fallen due to injuries,Titans,4,1575844816,e7zbio
741,To have as long as possible to work on that hamstring,Titans,2,1575844801,e7zbio
742,Especially after a massive fuckup. There was so much meme potential during the Chiefs game.,Raiders,1,1575844784,e7zbio
743,[deleted],,3,1575844777,e7zbio
744,I mean Logan Ryan just got burnt.,Titans,1,1575844759,e7zbio
745,Our secondary is dookie,Titans,1,1575844751,e7zbio
746,[deleted],,2,1575844748,e7zbio
747,[deleted],,0,1575844746,e7zbio
748,Just a really long running start.,Lions,2,1575844729,e7zbio
749,Cheers to you both,Titans,2,1575844722,e7zbio
750,The Titans are missing a lot of tackles,Titans,1,1575844710,e7zbio
751,Gruden’s face will always make me smile. Always. It’s just so funny looking.,Titans,2,1575844710,e7zbio
752,I'm shocked 😂,Raiders,1,1575844699,e7zbio
753,Likewise fibula bro. Likewise.,Titans,3,1575844679,e7zbio
754,"Surprising they're playing a soft zone, Jon Gruden's pass offense is almost exclusively 5 yard routes.",Raiders,2,1575844676,e7zbio
755,Just headed into the locker room,Raiders,1,1575844675,e7zbio
756,perfect for dinking and dunking,Raiders,1,1575844663,e7zbio
757,CBS is sure to make a big deal about every big man on the field.,Titans,1,1575844647,e7zbio
758,"Titans, our friend and enemy I wish you good fortune in the games to come",Raiders,2,1575844621,e7zbio
759,It's hilarious how Trent green said he doesn't have one this season too,Titans,1,1575844614,e7zbio
760,We gonna need Derrick Henry to win this game.,Titans,1,1575844613,e7zbio
761,"I played Henry because I was sure he's murder the Raiders, but AJ Brown is now the only weapon Tennessee needs. I guess I'm happy with his 50+1TD though.",Lions,1,1575844605,e7zbio
762,fuck why is derrick henry running to the locker room,Titans,1,1575844594,e7zbio
763,"LMAO, I expected 6 wins max this year since it's the 2nd year of a rebuild. But then they went 6-4 and I raised my expectations and now I'm being let down. But the future is bright.",Raiders,1,1575844593,e7zbio
764,Seeing Jerry Rice in a raiders uniform makes me cringe. And I'm not even a 49ers fan.,Titans,1,1575844590,e7zbio
765,"Disclaimer: I love Carr and defend him at every corner I can. 


With that being said, I wish he wouldn't bitch out of runs so often. I mean I get hes trying not to get injured at all but I'd like to see him go through for the 1st just a little bit more. Id like to believe that he isn't so fragile that doing that once or twice a game won't kill him.",Raiders,1,1575844587,e7zbio
766,[deleted],,2,1575844543,e7zbio
767,Fuck it we going to win the division.,Titans,4,1575844537,e7zbio
768,update for Titans fans. Cardinals are tied with the Steelers 10-10. Would be great if the Cardinals win so we are better in Wild Card contention,Titans,8,1575844501,e7zbio
769,"You're not the only one.  Maybe our rifts can compete and put us back in the correct timeline.

You know, the one where got that one extra yard.",Titans,1,1575844490,e7zbio
770,"It’s embarrassing, Carr sitting back there drinking a tall boy and checking it down.",Titans,4,1575844487,e7zbio
771,"Not that I disagree, but they've also had success throwing it deep",Titans,3,1575844485,e7zbio
772,we really miss jacobs,Raiders,3,1575844475,e7zbio
773,Storming like a mofo in norcal and cloud cover heading south quick,Raiders,2,1575844475,e7zbio
774,Gunna dink and dunk their way to a 300 yard passing game with this soft-ass zone we seem to always play,Titans,4,1575844464,e7zbio
775,drinking and drunking*,Lions,3,1575844440,e7zbio
776,all this dinking and dunking should open up Waller on a deep seam.,Raiders,2,1575844430,e7zbio
777,"Derek Carr, hold still you shifty bastard.

Edit: It’s crazy to me how similar Carr’s game is to Mariota’s. He’s just got a better arm.",Titans,3,1575844415,e7zbio
778,"Our two starting safetys are hurt, fwiw",Raiders,1,1575844395,e7zbio
779,ok dude,Titans,1,1575844377,e7zbio
780,Still better than the Texans :/,Texans,2,1575844352,e7zbio
781,wtf the colts and texans lost lmao,Titans,2,1575844338,e7zbio
782,"If it gets out first downs who cares. The end goal is to score, the current goal is to move the chains",Titans,1,1575844295,e7zbio
783,AJB has been extremely good all year.,Titans,3,1575844282,e7zbio
784,"He fucked my team's chances, which is worse.",Raiders,-1,1575844266,e7zbio
785,Mayocks last draft was great. Yall are going to be spooky for years to come,Titans,2,1575844260,e7zbio
786,Fuck AB. (The other AB. Y'alls AB is cool.),Raiders,2,1575844240,e7zbio
787,Moreau is a big man,Raiders,1,1575844239,e7zbio
788,"&gt;Oakland &gt; San Francisco
&gt;
&gt;~~I'm talking cities, not teams~~


Ftfy",Raiders,3,1575844239,e7zbio
789,Oakland is having way to much success drinking and dunking. Titans need to play up.,Titans,5,1575844236,e7zbio
790,he aint shit,Raiders,0,1575844234,e7zbio
791,Got to get some semblance of a pass rush going. Carr has all day.,Titans,4,1575844229,e7zbio
792,[deleted],,2,1575844227,e7zbio
793,"You mean, these abs? *lifts up my shirt to unveil an unstable, wobbly mass of flesh with a grid of sharpie marks on it*",Titans,1,1575844222,e7zbio
794,Put Mo Hurst at safety hes shown ball hawk skills.,Raiders,3,1575844208,e7zbio
795,"Well the plethora of other good games are also good pieces of evidence. The talent, size, and speed also help the argument",Titans,2,1575844207,e7zbio
796,They had their one good year and they blew it. Back to irrelevance they go. Good riddance.,Titans,2,1575844202,e7zbio
797,"As bad as our defense is, I'd rather watch a prime time show about it than bob loves abishola",Raiders,3,1575844196,e7zbio
798,We need to get to Carr at some point,Titans,2,1575844194,e7zbio
799,I hope you’re able to do this.,Titans,2,1575844193,e7zbio
800,AJ Brown has been our top receiver all season.,Titans,3,1575844184,e7zbio
801,"I loved San Fran when I visited, but holy shit it is fucking dirty.",Titans,6,1575844182,e7zbio
802,Didnt we just draft a CB in the second round this year? WTF happened.,Raiders,1,1575844166,e7zbio
803,And to think we also got Simmons in the same draft,Titans,1,1575844165,e7zbio
804,[deleted],,1,1575844158,e7zbio
805,"We're excited. Forgive us, more often than not our existence is pretty bleak.",Titans,2,1575844154,e7zbio
806,If we win today and every other team in the division loses I will fuckin' nut so hard a rift will be torn in the space time continuum.,Titans,4,1575844145,e7zbio
807,I haven't seen anyone being really all that toxic at all.,Raiders,2,1575844131,e7zbio
808,"The next Julio Jones

^I ^hope",Titans,3,1575844114,e7zbio
809,Your radio guy is probably my favorite in the league. He's got ridiculous pipes,Raiders,1,1575844106,e7zbio
810,"you think cause hes having a good day vs one of the worst defnsive secondaries in the NFL with multiple injuries on an already bad D. Ya boy, what a steal",Raiders,-4,1575844099,e7zbio
811,😭😢😕😏🙂😂,Titans,2,1575844096,e7zbio
812,The one true AB,Titans,4,1575844096,e7zbio
813,"Oakland &gt; San Francisco

I'm talking cities, not teams",49ers,4,1575844096,e7zbio
814,Could use Tannehill back there,Titans,2,1575844096,e7zbio
815,It’s a shootout!  My heart cannot handle it,Titans,3,1575844090,e7zbio
816,One of our 1sts better be a LB,Raiders,1,1575844082,e7zbio
817,[deleted],,5,1575844076,e7zbio
818,AB!!!!!,Titans,1,1575844068,e7zbio
819,If you can't take the heat dude,Raiders,7,1575844067,e7zbio
820,[deleted],,1,1575844064,e7zbio
821,"Alright, if tradition holds Oakland should score in 5 plays",Titans,2,1575844056,e7zbio
822,Then I can't wait to see what bullshit Sal pulls before this is all over.,Titans,2,1575844047,e7zbio
823,"Corners haven't been able to tackle AJ all year, don't feel too bad.",Titans,1,1575844042,e7zbio
824,The hump is hurt this week though 😔,Titans,3,1575844033,e7zbio
825,This defense is embarrassing. Clean house on the secondary this offseason,Raiders,3,1575844022,e7zbio
826,You hate to see it...,Titans,6,1575844016,e7zbio
827,Good receivers? I remember those.,Raiders,3,1575844008,e7zbio
828,Rookie out of Ole Miss. Dude is seriously talented.,Titans,5,1575844001,e7zbio
829,Lol,Titans,2,1575844001,e7zbio
830,Jacksonville down 21-3.,Titans,14,1575843999,e7zbio
831,What if it IS Murr?,Titans,2,1575843996,e7zbio
832,I see our plan to not cover AJ Brown is going well.,Raiders,5,1575843993,e7zbio
833,He’s our 2nd round rookie this year.,Titans,5,1575843984,e7zbio
834,Getting AJ Brown in the 2nd round was a fucking steal.,Titans,9,1575843972,e7zbio
835,Rookie we drafted in the second round from Ole Miss. He’s big and fast and doesn’t give a fuck.,Titans,6,1575843970,e7zbio
836,[deleted],,-8,1575843969,e7zbio
837,AJ Brown is a grown man,Titans,4,1575843961,e7zbio
838,"In my eyes we took Aj at number 5, and Corey in the 2nd 


Still love you Corey",Titans,6,1575843961,e7zbio
839,"We def winning this game, Raider only scoring TD off of fluky INT and a blown coverge",Titans,2,1575843957,e7zbio
840, 3rd &amp; 3 or 3rd &amp; 13 doesn't matter with this defense.,Raiders,1,1575843950,e7zbio
841,AJ Brown is a fucking monster.,Titans,4,1575843940,e7zbio
842,He came back in and caught a td pass,Titans,1,1575843938,e7zbio
843,"AJ Brown, Corey Davis, Humphries in the slot.

We have good receivers now and it feels weird.",Titans,7,1575843933,e7zbio
844,Easier said than done.,Titans,6,1575843926,e7zbio
845,BALL DON'T LIE,Titans,5,1575843920,e7zbio
846,"Who the fuck is AJ Brown? I'd never heard of him, but he is ridiculous this game.",Lions,7,1575843916,e7zbio
847,#TOUCHDOWN TITANS!,Titans,5,1575843914,e7zbio
848,"Did Derek Carr fuck your wife? You are obsessed, bro.",Raiders,2,1575843906,e7zbio
849,"A touchdown so nice, we scored it twice.",Titans,7,1575843900,e7zbio
850,I think someone should cover AJ Brown maybe,Giants,9,1575843899,e7zbio
851,subscribe,Titans,8,1575843897,e7zbio
