,body,author_flair_text,score,created_utc,link_id
429,friendly reminder that Derwin's back,Chargers,5,1575841342,e7z1lh
430,"Oh yeah this season they really haven’t, there’s just typically a huge disparity between how they could potentially play.",Chargers,2,1575841328,e7z1lh
431,This is the game where we mostly talk about how great the other games are and trashing ours,Jaguars,5,1575841314,e7z1lh
432,Now you're just trolling. You and I both know that most of Fournette's runs have first contact within the first yard.,Jaguars,1,1575841304,e7z1lh
433,"Dude. We choked to the Lions,",Chargers,1,1575841295,e7z1lh
434,(H) Rivers is such a whiny crybaby,Chargers,2,1575841283,e7z1lh
435,That was not very cash money of Westbrook...,Jaguars,1,1575841282,e7z1lh
436,You obviously haven't been watching us. If 2 teams expect a heartbreaking loss the chargers have been the ones to be right on hose expectations.,Chargers,2,1575841227,e7z1lh
437,"“Philip Rivers don’t give a care about that”
-Ronde Barber (I think)
u/kdiuro13",,3,1575841219,e7z1lh
438,That audi commercial's a little bullshit. Town I'm in rn has 1 charging station in the whole place and it's at a local pizza joint.,Jaguars,1,1575841181,e7z1lh
439,"dropped balls, missed tackles, penalties...",,2,1575841154,e7z1lh
440,"I see you've entered a Chargers game thread.

Would you like to comment:

(A) Looks like 80% [Other Team] fans

(B) Fuck Dean Spanos!

(C) L.O.L. the ref/announcer said San Diego!

(D) Rivers has so many kids! Haha!

(E) Love those powder blues

(F) Chargers should have stayed in SD

(G) Listen to how loud [Other Team]'s fans are!",Texans,2,1575841154,e7z1lh
441,His yards after contact says you're wrong.,Jaguars,1,1575841145,e7z1lh
442,"They haven't looked like world beaters at any point this season.  World beaters have pass protection.  This is what a team with elite position players (QB, WR, TE, RB) looks like when the front office and coaching staff forgot that their Offensive Line was terrible in the previous season, and did nothing to fix it.",49ers,3,1575841116,e7z1lh
443,"Yeah, but I can't help but feel like that is just because every set of downs for us has two run plays. On a yards per attempts basis Fournette is just barely above average. (Some cursory Googling has him at 14th among RBs that see many attempts a game)",Jaguars,1,1575841112,e7z1lh
444,Hes like the final boss of the trailer park level,Texans,1,1575841099,e7z1lh
445,"Also, why stop running on 3rd and 1???

The playcalling makes no sense.",Jaguars,2,1575841092,e7z1lh
446,can't blame Rivers for that drive at all,Chargers,5,1575841062,e7z1lh
447,"Legitimately couldn’t tell you, they could look like world beaters they could look like utter garbage. It’s really just a roulette.",Chargers,6,1575841015,e7z1lh
448,Phillip Rivers likes to Yeet the football deep,Chargers,4,1575841009,e7z1lh
449,"Hey! I just wanted to let you guys know [the Chiefs/Pats game](https://www.reddit.com/r/nfl/comments/e7zbi0/game_thread_kansas_city_chiefs_84_at_new_england/) is also on. If you prefer to watch this game, that's totally cool. I just wanted to let you guys know just in case. See you guys over there, or see you for Sunday night!",Vikings,-2,1575840986,e7z1lh
450,"I don't get why we never come in with a balanced game plan. Today I guess it's going to be mostly running, whereas the past few weeks we've just pretended running isn't allowed.  I like Marrone a lot, but at this point, I'm even on board with a full coaching staff replacement.",Jaguars,3,1575840986,e7z1lh
451,Lol the worst part is I'm concerned because LA has an early lead. If they were losing rn I'd be less worried about Minshew memeing out a win.,Texans,2,1575840983,e7z1lh
452,"Nah, you're good",Jaguars,2,1575840952,e7z1lh
453,"&gt;Your running game has absolutely sucked all year

huh? Are you still in 2018?",Jaguars,1,1575840932,e7z1lh
454,Heartbreak,Chargers,5,1575840903,e7z1lh
455,"I have an absolute buttload of revised and 4th edition. Made some killer decks with them back in the day, a bit over powered for the modern game though. 

I really should sell my dual lands at some point....got a few bayou and plateaus tucked away",Seahawks,1,1575840877,e7z1lh
456,"As a Chargers fan, what should I expect for this game?",Texans,3,1575840871,e7z1lh
457,DRAWWWWW PLAYYYYY,Chargers,2,1575840861,e7z1lh
458,We have one of the top rushing games in the league...,Jaguars,3,1575840820,e7z1lh
459,his office is in a gym,,3,1575840796,e7z1lh
460,Backup QB is something we need to address this off-season. Ours traded his playbook for the Bible!,Jaguars,2,1575840780,e7z1lh
461,"Jesus, George Kittle is a bad dude.",Jaguars,6,1575840748,e7z1lh
462,Gus Bradley got the better end of this deal it seems...,Jaguars,3,1575840686,e7z1lh
463,That doctor looks super sketch.,Chargers,5,1575840601,e7z1lh
464,[deleted],,0,1575840521,e7z1lh
465,Minshew is our starter. Foles is our backup.,Jaguars,7,1575840450,e7z1lh
466,Run run pass. Brilliant!,Jaguars,3,1575840424,e7z1lh
467,Any of you guys play mtg specifically edh? I wouldnt mind a meetup for some edh games.,Jaguars,3,1575840407,e7z1lh
468,"Naw, you guys are playing a backup QB so by this seasons' rules you guys have to humiliate us",Chargers,3,1575840375,e7z1lh
469,"We're going to lose. Wash has had ample time to see how teams have been dealing with the Chargers and his answer was to not do any of that and just keep doing what hasn't worked, repeatedly.",Jaguars,4,1575840307,e7z1lh
470,AJ Bomaye!,Chargers,2,1575840192,e7z1lh
471,"Well sure, because Bouye knew he was beat and held onto Allen's jersey, lol.  

You could see Bouye admitting to Allen that he got beat after the play.",49ers,2,1575840152,e7z1lh
472,"Chargers going to mess around and win the ""best team not to make the playoffs"" award again",,5,1575840140,e7z1lh
473,"Well that was painful

Not as painful as hearing this play by play guy constantly butcher the name Bouye",Jaguars,5,1575840116,e7z1lh
474,Chargers should just play the Jags every week,Patriots,1,1575840104,e7z1lh
475,wow we scored a td on our opening drive?,Chargers,4,1575840087,e7z1lh
476,Haha our plan is to get their defense right back on the field so they will be gassed.,Jaguars,1,1575840079,e7z1lh
477,"Bullshit, that ball was not catchable.",Jaguars,2,1575840026,e7z1lh
478,Are we sure Todd Wash is human and not some sort of stand-in? This is pathetically stupid.,Jaguars,1,1575840024,e7z1lh
479,lol our defense is so bad.,Jaguars,1,1575840018,e7z1lh
480,"LF: Gets 5 yards.

Everyone against our defense: Gets 30 yards",Jaguars,1,1575840002,e7z1lh
481,It's like quizlet flashcards,Jaguars,1,1575839995,e7z1lh
482,Did y'all's equipment get to NE?,Jaguars,3,1575839963,e7z1lh
483,"Well that was a fun, long drive

Good to have you back, Minshew",Jaguars,2,1575839867,e7z1lh
484,Sure. Why not?,Jaguars,1,1575839836,e7z1lh
485,Hmm never heard of it,Jaguars,1,1575839777,e7z1lh
486,I'm here just to watch Minshew. I brought beer. Can I hang for a bit?,Chiefs,6,1575839763,e7z1lh
487,I know the feeling well,Jaguars,1,1575839753,e7z1lh
488,"Do you use cram app? I like it because you can upload your own pictures for free and study in bed or whenever.

It was a life saver esp if you take the time to edit the pics to blank out information.",Jaguars,1,1575839750,e7z1lh
489,Got the game on mute while studying for my Chem final wish me luck boys,Jaguars,1,1575839705,e7z1lh
490,Ah such a bad throw by minshew. Fournette was abt to be hung out to dry if he caught it.,Jaguars,1,1575839648,e7z1lh
491,Reminder people thought Foles was better than that.,Jaguars,2,1575839624,e7z1lh
492,1000 YARDS,Jaguars,1,1575839401,e7z1lh
493,I get to see Derwin James and Nick O'Leary?? Yes.,Jaguars,1,1575839346,e7z1lh
494,Wash = Gus,Jaguars,1,1575839200,e7z1lh
495,ARE YOU GUYS READY FOR THE MOST IRRELEVANT FOOTBALL GAME EVER!?,Jaguars,2,1575839158,e7z1lh
496,Time to die inside again.,Chargers,2,1575839151,e7z1lh
497,"Honestly I just want an entertaining game where the jags ""accidently"" blow it to lose for draft position.

Or we could just be terrible.",Jaguars,1,1575839058,e7z1lh
498,Game of the week right here,Bears,1,1575839008,e7z1lh
499,"Man, why does Saints/49ers have to be so good? I almost don't care about our game. Almost.",Jaguars,1,1575838903,e7z1lh
500,Yet.,Jaguars,3,1575838787,e7z1lh
501,Chargers never lose by more than a score,Chargers,7,1575838245,e7z1lh
502,Minshew Mania is back on the menu boys,Eagles,5,1575838060,e7z1lh
503,"This is a winnable game for us, but we've lost so many of those that I'm not sure what a winnable game even looks like anymore",Chargers,5,1575837934,e7z1lh
504,I am ready to get Minshewed,Chargers,3,1575837801,e7z1lh
505,"We can't lose! If we win, its a win (obviously
), but if we lose, it's draft position!",Jaguars,6,1575837658,e7z1lh
506,L,Jaguars,1,1575837599,e7z1lh
507,Sure😂,Jaguars,2,1575837591,e7z1lh
508,Lol nope,Broncos,-10,1575837402,e7z1lh
509,Jags win 17-38,Jets,2,1575837388,e7z1lh
510,tanking time 😈,Chargers,1,1575837372,e7z1lh
511,Nothing like a battle of two of the most elite 4-8 teams in the league,,15,1575837343,e7z1lh
