,body,author_flair_text,score,created_utc,link_id
852,Our tackling is so bad,Raiders,2,1575843896,e7zbio
853,AJ Brown is a fucking stud,Titans,10,1575843894,e7zbio
854,God damn can our defense be more useless?,Raiders,3,1575843893,e7zbio
855,Aj Brown is motherfucking us.,Raiders,7,1575843876,e7zbio
856,AJ must have just gotten some mud in his shoe.,Titans,2,1575843874,e7zbio
857,Subscribe.,Titans,12,1575843874,e7zbio
858,"IT DONT FUCKIN MATTER 


HOLDING, FALSE START. It don’t matter. They can’t hold the titans",Titans,7,1575843874,e7zbio
859,Okay,Raiders,2,1575843864,e7zbio
860,Does the ref look a little bit like Murr from Impractical Jokers?,Titans,3,1575843862,e7zbio
861,What is defense?,Raiders,3,1575843857,e7zbio
862,Whoever is covering AJ Brown should uhh.... ask for help.,Titans,7,1575843848,e7zbio
863,Very much so. Or a perfect offensive playcall to take advantage of the defensive playcall,Titans,1,1575843843,e7zbio
864,Tennessee may never lose again,Rams,25,1575843841,e7zbio
865,Our defense is UNSPEAKABLY BAD,Raiders,5,1575843835,e7zbio
866,Hold my ass,Titans,6,1575843830,e7zbio
867,Ticky tack holding call IMO.,Titans,6,1575843830,e7zbio
868,LETS GO,Titans,1,1575843829,e7zbio
869,"FIRKSER TIME

NEVERMIND",Titans,3,1575843823,e7zbio
870,Damn AJ,Titans,1,1575843821,e7zbio
871,Touchdown!,Titans,1,1575843814,e7zbio
872,AJ BROWN IN THIS BITCH,Titans,2,1575843810,e7zbio
873,its pretty funny in retrospect how we scapegoated hium,Titans,1,1575843798,e7zbio
874,AJ BROWN IS SAFE,Titans,3,1575843794,e7zbio
875, W E A K,Titans,1,1575843786,e7zbio
876,"I was born in the early 70s, so I grew up with Sesame Street and the Muppet Show, and I recently re-watched The Muppet Movie in the theater for its 40th anniversary, and it was so wonderful and subversive, and it saddens me that whomever owns the Muppets now is shilling for Facebook. :(",Raiders,2,1575843784,e7zbio
877,Bummer. Bummer. Bummer.,Titans,1,1575843772,e7zbio
878,WELCOME BACK HERO,Titans,1,1575843770,e7zbio
879,He walked off but that's all they've updated.,Raiders,1,1575843769,e7zbio
880,[removed],,1,1575843748,e7zbio
881,Fuck that guy,Raiders,0,1575843732,e7zbio
882,No AJ or Hump. Time to shine Davis.,Titans,1,1575843726,e7zbio
883,He’s fine I think.,Titans,2,1575843718,e7zbio
884,He walked off the field on his own,Raiders,1,1575843716,e7zbio
885,[removed],,1,1575843715,e7zbio
886,"The only reason raiders are in this is cause of silly mistakes. 

Let’s clean it the fuck up and win",Titans,1,1575843708,e7zbio
887,Hamstring issues... we’re just full of Yancy Thigpens again,Titans,1,1575843703,e7zbio
888,Welcome to the Black Hole ;p,Titans,2,1575843699,e7zbio
889,"Look, Christmas is just around the corner and payday is next Friday. We can all get corners after that okay? Now sit down or I'm turning this draft around",Raiders,1,1575843693,e7zbio
890,"Size him up, and if you can take him kick his ass

If you can't, punch him in the dick and run like hell",Titans,1,1575843685,e7zbio
891,Also Titans and Hamstring issues O_O,Titans,1,1575843674,e7zbio
892,Doesnt look serious. You never know though.,Titans,2,1575843660,e7zbio
893,NO AJ NOOOOOO,Titans,2,1575843656,e7zbio
894,"&gt;at the risk of sounding hyperbolic, tannehill is definitely the greatest of this or any other generation



There we go",Titans,1,1575843647,e7zbio
895,Every fanbase has bad eggs.,Titans,3,1575843647,e7zbio
896,NOW IS NOT THE TIME KERMIT,Titans,3,1575843636,e7zbio
897,No class. Anybody that hopes for injury is trash.,Titans,3,1575843632,e7zbio
898,Why is it always against us AWS?,Rams,1,1575843631,e7zbio
899,The slipping has begun,Raiders,1,1575843616,e7zbio
900,How bad was the injury to brown. It said he was injured on ESPN.,Bills,3,1575843614,e7zbio
901,OH GOD AJ,Titans,3,1575843604,e7zbio
902,ah fuck,Titans,2,1575843602,e7zbio
903,Aj Brown being good definitely helps him.,Titans,1,1575843592,e7zbio
904,"Fuck. Now AJ is hurt, f my life.",Titans,2,1575843588,e7zbio
905,"its Vegas, if there is one thing they are really good at it is getting large buildings built.",,2,1575843583,e7zbio
906,I don't know who has a worse defense than us,Raiders,3,1575843580,e7zbio
907,NOOO NOT AJ,Titans,3,1575843578,e7zbio
908,The spice.,Titans,3,1575843563,e7zbio
909,"yikes, hopefully his hamstring doesn't get worse, we really rely on him",Titans,4,1575843555,e7zbio
910,Lol the raiders fan next to me just said hopefully he broke his leg... Fuck this,Titans,7,1575843555,e7zbio
911,Your boy is trash. These are his last games in Silver and Black,Raiders,0,1575843545,e7zbio
912,Ok done with setting up the outdoor decorations.  What did I miss?,Titans,1,1575843534,e7zbio
913,Henry is just stupid big.,NFL,2,1575843531,e7zbio
914,"at the risk of sounding hyperbolic, tannehill is definitely the greatest quarterback of this or any other generation",Giants,6,1575843530,e7zbio
915,"Young Sheldon is actually quite complex, you see, Sheldon is the only member of his family without a southern accent because he sees it as a indication of low intelligence, this is a reference to the fact that adult Sheldon judges people on superficial attributes and is a racist.",Titans,3,1575843525,e7zbio
916,Henry is a beast but that hair looks like a giant poop log,Vikings,1,1575843517,e7zbio
917,God dammit. Everyone please stop getting hurt.,Titans,5,1575843515,e7zbio
918,"Redditors: ""49ers Saints is the game of the week""  
  
Titans and Raiders: ""Hold my beer.""",Lions,8,1575843488,e7zbio
919,Tannehill is a dual threat quarterback.,Titans,3,1575843485,e7zbio
920,This game should NOT be close,Titans,2,1575843460,e7zbio
921,"I still think Davis is a good receiver, but he clearly isn’t explosive like Brown.",Titans,2,1575843459,e7zbio
922,Receivers named Brown fucking the Raiders all year.,Raiders,5,1575843453,e7zbio
923,Might want to cover AJ Brown just sayin',Raiders,4,1575843448,e7zbio
924,"Yeah, as an employee of Hollywood Park Casino, which is building the Rams stadium out back, I'm gonna say good luck getting it done that fast.",Browns,1,1575843443,e7zbio
925,"Those shoes are hilarious.


Pediatric Brain Tumors- *justdoit*",Titans,1,1575843431,e7zbio
926,Aj Brown is who I thought Davis would be.,Titans,1,1575843420,e7zbio
927,Adoree is supposed to come back ain't he?,Titans,2,1575843381,e7zbio
928,Gafford is a HOFer.,Raiders,1,1575843369,e7zbio
929,And its not like they get any better with time,Raiders,1,1575843363,e7zbio
930,I love AJ Brown.,Titans,2,1575843356,e7zbio
931,"The fucking Up music does it to me.

I'm crying.",Titans,1,1575843348,e7zbio
932,I guess this is about to be a shootout.,Titans,1,1575843334,e7zbio
933,We wished it first though,Titans,1,1575843326,e7zbio
934,Whoever writes these trash new shows needs to be executed for crimes against humanity,49ers,6,1575843314,e7zbio
935,I like how Gafford couldn't quite make the jump into the stands so some fan [grabbed him by the taint and hauled him up.](https://thumbs.gfycat.com/BlushingRadiantAlligatorgar-small.gif),Browns,3,1575843309,e7zbio
936,"*You don’t know what you’ve got, till it’s gone!*",Titans,1,1575843298,e7zbio
937,"next year, as of current time line",Raiders,3,1575843291,e7zbio
938,caRr CaNt ThRoW dEeP,Raiders,2,1575843290,e7zbio
939,Can we please just get 1 of our 3 injured CBs back for next week?,Titans,3,1575843283,e7zbio
940,[removed],,1,1575843272,e7zbio
941,"I mean, I know.

Logan Ryan and whoever that was still fucked up big time.",Titans,1,1575843268,e7zbio
942,When does the Vegas stadium finish up?,Titans,3,1575843263,e7zbio
943,So this is what leads to those stabbings.,Rams,1,1575843257,e7zbio
944,Stay salty,Raiders,2,1575843252,e7zbio
945,Enjoy every moment whining about him and nothing else.,Raiders,3,1575843252,e7zbio
946,man our defense sure has been hot garbage since butler went out,Titans,2,1575843248,e7zbio
947,Is that not how Ds usually play?,Raiders,1,1575843244,e7zbio
948,Butler I miss you 😭,Titans,2,1575843243,e7zbio
949,Seriously we just scored and now im sad,Raiders,3,1575843239,e7zbio
950,Well shit,Titans,3,1575843227,e7zbio
951,D U N K E D ON,Raiders,1,1575843225,e7zbio
952,This is Carr's last season. Enjoy every snap while you still can,Raiders,-1,1575843224,e7zbio
953,The last 2 touchdowns were wild. At least the game is exciting,Raiders,3,1575843222,e7zbio
954,Top 2 corners are out....,Titans,1,1575843219,e7zbio
955,So two huge mistakes equals two raiders TDs......,Titans,3,1575843200,e7zbio
956,Omg fuck this apple commercial man. It kills me.,Titans,3,1575843196,e7zbio
957,Sounds like you're jealous lol.,Titans,2,1575843182,e7zbio
958,[deleted],,8,1575843177,e7zbio
959,"This game's motto: ""Fuck defense go deep""",Eagles,3,1575843177,e7zbio
960,Where my Carr haters at? u/Rabsho??,Raiders,6,1575843169,e7zbio
961,Our patchwork CB group is starting to show.,Titans,4,1575843164,e7zbio
962,[removed],,-2,1575843163,e7zbio
963,Shit this game is surprisingly exciting,Titans,5,1575843159,e7zbio
964,WTF this is 49ers-Saints all over again.,Rams,4,1575843158,e7zbio
965,What the fuck was that,Titans,4,1575843154,e7zbio
966,YEAHHHHH,Raiders,3,1575843147,e7zbio
967,Lol how ?,Titans,3,1575843144,e7zbio
968,It's rare as fuck you see a guy that wide open in the NFL.,Titans,6,1575843142,e7zbio
969,The MADMAN THREW IT DEEP.,Raiders,5,1575843139,e7zbio
970,Us too...,Raiders,2,1575843138,e7zbio
971,"So that's the kind of game it's going to be, huh?",Raiders,3,1575843132,e7zbio
972,I DIDNT EVEN KNOW YOU WERE ON THE TEAM BUT WOOOOO LETS GO GAFFORD,Raiders,3,1575843128,e7zbio
973,"Delete this, shithead",Raiders,2,1575843124,e7zbio
974,"Gonna be a shootout, just like everyone predicted",Titans,3,1575843120,e7zbio
975,Man I wish we had or 1 2 or 4 CB,,4,1575843117,e7zbio
976,Shootout?,Titans,2,1575843110,e7zbio
977,Who can he throw to though? Great QBs tend to have great receivers.,Raiders,1,1575843101,e7zbio
978,[removed],,1,1575843097,e7zbio
979,"You are a sad strange little man, and you have my pity.",Raiders,1,1575843096,e7zbio
980,[deleted],,3,1575843096,e7zbio
981,Our secondary decided to return the favor.,Titans,6,1575843085,e7zbio
982,"Carr putting on a dink and dunk clinic

Edit: damn",Raiders,3,1575843076,e7zbio
983,Bombs everywhere,Raiders,3,1575843070,e7zbio
984,How do Titans fans feel about Tannehill? Resign him or flash in the pan?,,3,1575843067,e7zbio
985,"I don’t know, actually. I guess what I meant was “Miss you Tanny!”",Dolphins,2,1575843026,e7zbio
986,"Were very balanced on offense with weapons that can create big plays. 

Our front 7 is great. Secondary is injured. 


We have the best punter in the fuckin league. 

Were physical as fuck. 

Were one of the best teams in the nfl at the moment",Titans,-3,1575843025,e7zbio
987,lol,Titans,3,1575842998,e7zbio
988,"I've always been pretty tepid and indifferent in regards to the Titans existence, but this Tannehill Renaissance has me solidly in their camp.",Vikings,6,1575842976,e7zbio
989,Mariota really held this offense back so much that a 31 year old FA QB is the future of the team,Giants,3,1575842951,e7zbio
990,Carr is so trash,Raiders,-1,1575842933,e7zbio
991,nice tackle,Titans,1,1575842928,e7zbio
992,[deleted],,2,1575842919,e7zbio
993,Who the hell is hating on this man?,Titans,3,1575842916,e7zbio
994,"Dude, you could have cut back for like 12 more yards",Raiders,2,1575842910,e7zbio
995,OMG I love AJ Brown!!! He’s the best AB EVER!!,Titans,3,1575842906,e7zbio
996,"That was an incredible throw, but he needs to take less hits.",Titans,2,1575842906,e7zbio
997,Me too fam,Titans,2,1575842894,e7zbio
998,"I love when Redzone is showing a team in the red zone (Steelers/Cardinals) then goes ""let's cut in to the titans inside their own 20"" cause you just know it's about to be something good",Eagles,9,1575842888,e7zbio
999,Tannehill is a ficking beast man. Resign this man.,Titans,4,1575842886,e7zbio
1000,Tannehill haters are just jealous.,Dolphins,4,1575842864,e7zbio
1001,"Im just trying to needle the people who were downplaying the interception earlier. Take the sack, kick the field goal, and it’s a three score game instead of one.",Titans,0,1575842858,e7zbio
1002,Lmaooooo,Titans,1,1575842846,e7zbio
1003,why does auto refresh tab chrome extension not let this page load,Titans,1,1575842838,e7zbio
1004,Why doesn’t the Titans kicker get a running start on the kick off? Looked like he was kicking a field goal,Titans,1,1575842828,e7zbio
1005,Someone tell our defense our offense cant get into shootouts,Raiders,5,1575842823,e7zbio
1006,I hate this D with a passion.,Raiders,3,1575842823,e7zbio
1007,I've shit on Tannehill for years but now I feel bad I think he was just stuck in Dolphins purgatory,Buccaneers,14,1575842815,e7zbio
1008,That was a very very impressive throw. Took a hit and on a dime,,5,1575842810,e7zbio
1009,...I dont think thats how it works.,Raiders,2,1575842807,e7zbio
1010,Tanny an absolute baller,Ravens,4,1575842803,e7zbio
1011,"Man, Tannehill just threw that shit fifty yards without even getting to step into it. Color me impressed.",,19,1575842802,e7zbio
1012,These State Farm commercials are getting worse by 1000x each new commercial.,Raiders,2,1575842789,e7zbio
1013,AJB is my dad?,Titans,3,1575842789,e7zbio
1014,My god what the fuck is this year,Titans,6,1575842780,e7zbio
1015,"I was expecting that response, that’s why I included the fight me part, lol.",Titans,1,1575842776,e7zbio
1016,"LOCK UP TANNEHILL
LOCK UP HENRY
BOYS GOING WILD IN OAKLAND",Titans,7,1575842776,e7zbio
1017,I can believe it... god our defense is fucking trash,Raiders,2,1575842773,e7zbio
1018,BRING BACK REGGIE NELSON,Raiders,3,1575842769,e7zbio
1019,i love having a qb that will take hits and still make the throw,Titans,6,1575842768,e7zbio
1020,Tannehill doing that shit while Carr dumping it off in 3rd and long,Raiders,10,1575842755,e7zbio
1021,Wrong. Mason.,Titans,6,1575842751,e7zbio
1022,That was straight out of the NFL Blitz playbook.,Steelers,7,1575842741,e7zbio
1023,This game is sad,,1,1575842740,e7zbio
1024,"What a fucking play, holy shit.",Titans,9,1575842739,e7zbio
1025,Guenther has to be gone after today right,Raiders,2,1575842730,e7zbio
1026,Pssst... it should be 17-0.,Titans,4,1575842728,e7zbio
1027,Oh I'm certain he was.,Falcons,1,1575842726,e7zbio
1028,Your 2019 Oakland Raiders everybody,Raiders,3,1575842724,e7zbio
1029,TANNY DIMES BABY,Titans,7,1575842721,e7zbio
1030,Wowowowowow,,5,1575842718,e7zbio
1031,"I don't believe it,  but I love it",Titans,10,1575842718,e7zbio
1032,"Sometimes I think cocaine, sometime CTE",Titans,6,1575842716,e7zbio
1033,"AJ Brown is the best receiver the titans have ever had. 

Fight me.




*please don’t, I’m small*",Titans,9,1575842705,e7zbio
1034,[deleted],,1,1575842702,e7zbio
1035,This is a fun team to watch now.,Titans,10,1575842697,e7zbio
1036,I had no expectations for this defense and yet I’m still disappointed,Raiders,3,1575842694,e7zbio
1037,"Sheesh, the Oakland secondary biffed that one.",Titans,4,1575842693,e7zbio
1038,THEIR LONGEST TOUCHDOWN PASS IN OVER FIVE YEARS,Titans,9,1575842692,e7zbio
1039,I have... an erection,Titans,6,1575842683,e7zbio
1040,Lololololol HELL YEAH,Titans,6,1575842654,e7zbio
1041,"Okay, then eat it lol",Titans,1,1575842635,e7zbio
1042,Why didnt Vrabel decline that penalty?,Titans,3,1575842609,e7zbio
1043,Miss you CJ2K,Titans,4,1575842603,e7zbio
1044,"&amp;#x200B;

Even with mack, we were never shit defensively. Maybe if we kept it close, we could have him end the game, but we were still getting toasted. If you think Mack on this defense would save us, with his 7ish sacks this season, idk what to tell you.",Raiders,1,1575842600,e7zbio
1045,Alot of QBs would've let that turn into a pick6,Raiders,3,1575842590,e7zbio
1046,Enough commercial s you fucks,Raiders,3,1575842564,e7zbio
1047,That's on the defense and weak position and momentum.,Titans,3,1575842536,e7zbio
1048,Does he play safety now?,Raiders,2,1575842464,e7zbio
1049,[Is this the bad man who touched you?](https://i.imgur.com/v5D1sEL.jpg),Titans,2,1575842430,e7zbio
1050,I feel like that Alexa TV commercial is low key Jeff Bazos in his meetings,Raiders,2,1575842417,e7zbio
1051,Its a screen theres no other option,Raiders,2,1575842389,e7zbio
1052,"Ah yes, Brandon Fucking Parker",Raiders,3,1575842345,e7zbio
1053,Don't worry they made up for it,Raiders,3,1575842298,e7zbio
1054,Yes. Exactly lol.,Titans,1,1575842266,e7zbio
1055,He's got over 150 yards in three straight games,Titans,2,1575842232,e7zbio
1056,Pro Bowler Reggie Nelson?,Raiders,2,1575842210,e7zbio
1057,[deleted],,1,1575842202,e7zbio
1058,"Wait....the striped man said the other team did something bad, not us. Is that allowed?",Raiders,6,1575842200,e7zbio
1059,You had Mack....,Titans,-3,1575842168,e7zbio
1060,They scored 2 plays later.,Titans,-2,1575842156,e7zbio
1061,He’s staring him right in the face lol. Just tries to throw it through him.,Titans,1,1575842136,e7zbio
1062,Kept it from being a pick 6 though. No one else was going to get past those defenders blocking for him.,Titans,5,1575842125,e7zbio
1063,It's the raiders defense,,2,1575842103,e7zbio
1064,"Yeah, especially when you throw it right into the d-lineman that you’re staring at lol.",Titans,2,1575842103,e7zbio
1065,It was a tipped ball lol,,5,1575842083,e7zbio
1066,I mean it wasn't good but tipped passes happen,Titans,2,1575842065,e7zbio
1067,They’re gonna pick on Smith all day.,Titans,1,1575842041,e7zbio
1068,Everyone going to jizz over the Tannehill tackle... Guys he threw an awful interception before it.,Titans,-7,1575842018,e7zbio
1069,[deleted],,1,1575841947,e7zbio
1070,"We need a real sideline to sideline mauler.

We must bring back Reggie Nelson",Raiders,9,1575841941,e7zbio
1071,Categorically stunning!,Raiders,3,1575841934,e7zbio
1072,Part of it is I feel like we've been the same team in a lot of ways for the last few years,Titans,2,1575841916,e7zbio
1073,[deleted],,0,1575841907,e7zbio
1074,"Yo, I want to see if his mom and dad are fucking huge too.",Lions,5,1575841903,e7zbio
1075,"Appreciate that, we're in a weird humble space rn tho...we are dicks when we're good",Dolphins,3,1575841887,e7zbio
1076,"This is some of the sorriest defense I've ever seen, Running is about who wants it, and all year after kujos injury this team dont want it. Just a husk of a defense.",Raiders,5,1575841866,e7zbio
1077,I'll be happy if this game is just close.,Raiders,4,1575841864,e7zbio
1078,"I'm not saying he's total booty, but I think Corey Davis's Wiki will someday read ""Most notable for being the last MAC player to ever be taken in the top 5 of the NFL Draft.""",,6,1575841863,e7zbio
1079,"I'm just gonna say it, no back is playing better right now than Derrick Henry",Titans,5,1575841857,e7zbio
1080,[what about them?](https://i.imgur.com/38DkyY9.jpg),Bears,5,1575841856,e7zbio
1081,"He was 6'3"" 240 in highschool. So yeah, probably.",Raiders,7,1575841848,e7zbio
1082,[deleted],,4,1575841830,e7zbio
1083,"I need him to crack like 35 points to save my season, praying",,1,1575841817,e7zbio
1084,Jesus Christ someone stop the bad man from running it up our ass and down our throats,Raiders,4,1575841805,e7zbio
1085,Thre Braves usually wait until the postseason to choke. I'm not sure if that's better or worse,Titans,4,1575841804,e7zbio
1086,"10-0 would've been nicer right now, but w/e",Titans,2,1575841803,e7zbio
1087,Tanny is good for a tipped ball int every once in awhile,Dolphins,2,1575841790,e7zbio
1088,mAsCaRrA,Raiders,3,1575841759,e7zbio
1089,What about those crazy eyes?,Raiders,4,1575841752,e7zbio
1090,Honestly probably used to it this point,Titans,3,1575841741,e7zbio
1091,GET THE TRACTOR GOING,Titans,6,1575841741,e7zbio
1092,"Historical undertones aside, dude is a specimen. They've probably heard that shit his entire life.",Dolphins,8,1575841735,e7zbio
1093,;),Titans,3,1575841706,e7zbio
1094,M E T R I C U L A T I O N,Raiders,3,1575841705,e7zbio
1095,Dude just went inside the 1st down marker lmao,Lions,3,1575841689,e7zbio
1096,EASY,Titans,0,1575841686,e7zbio
1097,TRACTORCITO,Titans,8,1575841680,e7zbio
1098,Derrick Henry is a fantasy god.,Titans,6,1575841672,e7zbio
1099,THE BOOOOOOOOOOOY,,4,1575841666,e7zbio
1100,"Ah, sounds like Henrys hair is your guys 'Carrs eyelashes'",Raiders,9,1575841647,e7zbio
1101,Poor Will. :(,Titans,3,1575841641,e7zbio
1102,"Yeah me too, even worse for the Braves",Titans,6,1575841637,e7zbio
1103,HAHAHA LOVE YOU COMP &lt;3,,3,1575841632,e7zbio
1104,Pretty sure that's 14 straight flags thrown on the Raiders.  Chiefs went all game last week without one penalty.  That has to be some sort of record.,Raiders,6,1575841632,e7zbio
1105,Rookie FB baby,,2,1575841621,e7zbio
1106,Caught that all over THE BOYYY,Titans,7,1575841617,e7zbio
1107,you think henry's family finds its weird when people are talking about his body all the time,Titans,8,1575841611,e7zbio
1108,BLASINGAME ❤❤,Titans,2,1575841587,e7zbio
1109,I just bought a knockoff Crosby jersey to wear at the game in LA week 16!,Raiders,1,1575841586,e7zbio
1110,"That’s not a catch.

Edit: Scratch that. It is.",Titans,2,1575841557,e7zbio
1111,Henry is so sick,Raiders,6,1575841551,e7zbio
1112,"He bounced off and outran everyone, not sure if you've heard but he used to play WR in college.",Dolphins,2,1575841546,e7zbio
1113,You know... one of these days people won’t talk about Henry’s hair. Today is not that day.,Titans,8,1575841539,e7zbio
1114,Storms coming in and out for 2 weeks.,Raiders,6,1575841530,e7zbio
1115,[deleted],,3,1575841507,e7zbio
1116,You guys have weird sunlight in Oakland,Titans,8,1575841481,e7zbio
1117,"I don't know if it's just me, but no matter how much the media talks about how great my team is, I have absolutely no faith in them

This also applies to me being an Oregon fan.",Titans,14,1575841456,e7zbio
1118,I blame him for that pick. Dude was right in his face. Just eat it.,Titans,2,1575841452,e7zbio
1119,"I'm late to post, but I don't blame Tannehill for that pick and I commend him for making a huge hit on an enormous man",Titans,3,1575841424,e7zbio
1120,I love Maxx so much,Raiders,4,1575841410,e7zbio
1121,They should show a quick procession of clips of Aaron Rodgers throwing the ball away when his agent says he doesn't play it safe.,Lions,2,1575841409,e7zbio
1122,"If you think about it, your entire life is just edging.",Titans,2,1575841407,e7zbio
1123,Art Smith is drawing up a stinker right now.,Titans,2,1575841407,e7zbio
1124,Those game plans suck.,Steelers,1,1575841400,e7zbio
1125,"He always does. He's not an idiot doing the Ricky Williams thing with dreads hanging out of his helmet long enough to cover up the name tag, just so people can tackle him with his hair.",Titans,1,1575841397,e7zbio
1126,Nah we got this in the bag,Titans,2,1575841371,e7zbio
1127,That sucked,Titans,1,1575841370,e7zbio
1128,You couldn’t pay me to return a kick in the NFL. Shit must be terrifying,Titans,2,1575841370,e7zbio
1129,The fins are cool too,Raiders,4,1575841346,e7zbio
1130,Its weird that Tannehill got the tackle. Cant you just truck the ever living shit out of a QB in that situation?,Raiders,2,1575841335,e7zbio
1131,BLUSTERING IN FROM SEA,Raiders,2,1575841329,e7zbio
1132,Hey this is neat,Raiders,2,1575841313,e7zbio
1133,It's very aesthetically pleasing.,Raiders,2,1575841302,e7zbio
1134,"Started out poorly last week too, I'm not worried.",Titans,3,1575841288,e7zbio
1135,Every week some smart ass has to talk about his hair,Titans,2,1575841281,e7zbio
1136,"Wait until you meet 3rd Quarter Oakland Raiders, you havent seen a shitshow like that all year.",Raiders,3,1575841279,e7zbio
1137,Well then.,Titans,2,1575841271,e7zbio
1138,would be cool if we could start a game with a good drive just 1 time,Titans,3,1575841259,e7zbio
1139,Carr must've dropped his bible and sold his soul to the devil to give us this W to make it up for us ty Derek,Raiders,-1,1575841258,e7zbio
1140,Fuck yeah bishes,Raiders,1,1575841253,e7zbio
1141,"Indy and Houston both lost, that means we have a chance to really make strides in the division.

[This would be peak Titans](https://i.kym-cdn.com/photos/images/newsfeed/001/497/040/471.jpg)",Titans,5,1575841251,e7zbio
1142,I like it.,Raiders,1,1575841249,e7zbio
1143,Why do we have to suck so much on opening drives ? :(,Titans,5,1575841240,e7zbio
1144,[tuning into this game right now as a Titans fan](https://m.imgur.com/gallery/zGHQb4O),Titans,1,1575841240,e7zbio
1145,Do you think we’re going to lose that badly?,Titans,3,1575841228,e7zbio
1146,Howdy ho!,Raiders,1,1575841228,e7zbio
1147,"hmm, good one. hey, you guys heard this one before? cuz this is funny",Titans,3,1575841220,e7zbio
1148,THE AUTUMN WIND IS A PIRATE,Raiders,3,1575841211,e7zbio
1149,LETS FUCKING GO.,Raiders,3,1575841210,e7zbio
1150,I'm just here to ask how did they not block Tannehill on that int return?,Redskins,3,1575841201,e7zbio
1151,Not ideal,Titans,3,1575841200,e7zbio
1152,"That was the perfect angle drill tackle.  Head to the front of the belly, shoulder in the side, arms wrap with lift.  His Pop Warner coach gotta be stoked.  Gotta teach this shit to the defense.",Raiders,2,1575841191,e7zbio
1153,Ok.,Raiders,1,1575841185,e7zbio
1154,"Jokes on you, I'm watching redzone",,1,1575841184,e7zbio
1155,the anger.,Titans,2,1575841180,e7zbio
1156,Derrick Henry's got Mr. Hankey The Christmas Poo sticking out the back of his helmet,Cowboys,0,1575841179,e7zbio
1157,"My boy D-Wash, come on Oakland do us a favor and win this game",Texans,2,1575841169,e7zbio
1158,I knew we were going to shit the bed! Let’s get drunk,Titans,1,1575841166,e7zbio
1159,Damn. Gotta change my prediction to 35-7 now,Titans,4,1575841165,e7zbio
1160,Titans fans seem like the only other reasonable gamethread fans besides Detroit.,Raiders,10,1575841161,e7zbio
1161,Team’s playing like their backs are against the wall.,Raiders,1,1575841157,e7zbio
1162,ha. never noticed this before.,Titans,7,1575841155,e7zbio
