,body,author_flair_text,score,created_utc,link_id
263,I don’t want to overreact but Matt Haack might be the best punter in nfl history,Dolphins,2,1576436451,eb1r0m
264,What a punt,Giants,3,1576436423,eb1r0m
265,Fire Shurmur Fire betcher and fire our oline coach tonight.,Giants,1,1576436333,eb1r0m
266,Gesicki!,Dolphins,1,1576436232,eb1r0m
267,"It was getting there early.  It wasn't very early, but the refs called us for one too.  They are calling a tight game.",Giants,2,1576436219,eb1r0m
268,"Our run stuffing NT - 3.5 sacks this season

Leonard Williams - 0",Giants,4,1576436194,eb1r0m
269,No clue where they called that DPI but I guess it doesnt matter. The slot corner bumping him maybe? It was like 3-5 yards out tho and didn't really move into Tate. Honestly I thought it was a great play by the outside corner to cut over and get a piece of it,Giants,1,1576436115,eb1r0m
270,Lol my maaan.,Giants,2,1576436081,eb1r0m
271,"He changed directions, and then did a 180 backward taunt to 180 touchdown",,1,1576436048,eb1r0m
272,Tate’s highlight reel of dunking on people gets a new addition.,,1,1576436015,eb1r0m
273,"Lol seriously, it was totally unnecessary. I love it",Dolphins,3,1576436010,eb1r0m
274,Good old fashioned Eli magic,Giants,1,1576435989,eb1r0m
275,Sick catch by tate. Gonna be a good game :),,1,1576435984,eb1r0m
276,What is this game lmao,Giants,1,1576435981,eb1r0m
277,He changed direction just so he could get that done,,3,1576435981,eb1r0m
278,No kidding. Stupid but nice play lol.,Giants,4,1576435978,eb1r0m
279,Incredible recovery but Golden Tate you are not that fast to be playing around bruh..,Giants,2,1576435975,eb1r0m
280,So...how’s it going?,Giants,1,1576435969,eb1r0m
281,Dude hasn't scores a TD facing forward his whole career,Giants,1,1576435965,eb1r0m
282,Lol what the hell was that back pedal Tate? Love him,Dolphins,5,1576435942,eb1r0m
283,Why didn’t they replay that taunt? That was hilarious.,,1,1576435930,eb1r0m
284,lmao tate always taunting.,Giants,3,1576435925,eb1r0m
285,What’s Tate doing?!,Giants,1,1576435919,eb1r0m
286,Slayton kinda clutch with Eli slinging it,Giants,1,1576435880,eb1r0m
287,LOL He dragged it out just to mock the DBs,,1,1576435878,eb1r0m
288,These giant's receivers with cement for hands...,Giants,2,1576435872,eb1r0m
289,I saw that....please no,Giants,1,1576435800,eb1r0m
290,Yeah unless he stays at OSU another year. Then who,Giants,1,1576435728,eb1r0m
291,Only if they continuously massage my head,Giants,1,1576435715,eb1r0m
292,Chase Young season,Giants,1,1576435694,eb1r0m
293,Hahah,Giants,2,1576435684,eb1r0m
294,Dolphin fan here. What team am I watching? That pass was not fitz this is an animal,,2,1576435669,eb1r0m
295,Much like your edges.. faded.,Giants,3,1576435649,eb1r0m
296,"We got the tiniest fullback in the league, dude looks like he’s about 150 pounds.",,1,1576435630,eb1r0m
297,"Ruined? We still getting Tua out of this, so job done.",Dolphins,1,1576435622,eb1r0m
298,"what else you want him to do. 

cbs gotta have a short memory",,1,1576435602,eb1r0m
299,[removed],,1,1576435601,eb1r0m
300,Guys.. it's normal.,Giants,1,1576435596,eb1r0m
301,"Odell is better than all of them, but he was on a boat once.",Giants,1,1576435572,eb1r0m
302,"LOL stay at the barbershop, bro",,5,1576435554,eb1r0m
303,"Fitz looked like a madman after that TD, which is fitting considering the way he’s ruined this perfect tank job over the last few games",Chargers,1,1576435549,eb1r0m
304,Usual.,Giants,1,1576435536,eb1r0m
305,God DAMN that was a perfect pass!!,49ers,0,1576435528,eb1r0m
306,"I shouldn't laugh at ""started the gay"" but I did",Dolphins,0,1576435523,eb1r0m
307,lol.,Giants,1,1576435519,eb1r0m
308,"Hope people are rethinking their opinions on cutting Jenkins. He may not have been the best, but past him this secondary is unbelievably bad",,3,1576435509,eb1r0m
309,"Dolphins best AFC team, change my mind.",,1,1576435488,eb1r0m
310,Looks like Wilson's getting back to his form,Dolphins,1,1576435481,eb1r0m
311,we're so much better equipped for a 4-3.,,2,1576435459,eb1r0m
312,I want Fitzpatrick to play the Gunslinger in the next Dark Tower movie.,49ers,2,1576435446,eb1r0m
313,We need to get a new DC.  Anyone from any nearby high school that can teach our D to tackle would be an improvement.,Giants,4,1576435446,eb1r0m
314,Dolphins playing playoff football,,2,1576435426,eb1r0m
315,I’m at the barbershop. How we lookin boys?,Giants,6,1576435423,eb1r0m
316,[deleted],,1,1576435414,eb1r0m
317,I have never seen such a fierce battle on a football field before. Both teams are playing like they're on fire. The Battle for Chase Young is one to watch for the ages,,2,1576435389,eb1r0m
318,Miami should probably just put a WR at RB,Bills,2,1576435375,eb1r0m
319,Swiss cheese has holes. This line is cream cheese.,Giants,1,1576435300,eb1r0m
320,Lol why wont the refs just let Harry flex.,Patriots,1,1576435299,eb1r0m
321,No way! Fitz is their leading rusher lol.,Giants,2,1576435296,eb1r0m
322,3-4 with no LB's to close out sacks.,Giants,5,1576435284,eb1r0m
323,The Dolphins don’t get embarrassed anymore.,,1,1576435255,eb1r0m
324,I hate how baker celebrates every little play. Posts all good plays on his ig story and deletes all negative comments.,Giants,2,1576435224,eb1r0m
325,Good job missing another sack Leonard Williams.,Giants,1,1576435213,eb1r0m
326,[deleted],,1,1576435189,eb1r0m
327,"I think I lost this every single week, but shurmur inability to come up with ways to get saquon the ball in space is criminal. Just keeps running him up the middle behind this Swiss cheese Oline.",Giants,2,1576435173,eb1r0m
328,Fitzpatrick is an absolute savage. I’d trade Eli for him in a heartbeat right now.,Giants,-3,1576435171,eb1r0m
329,Has there been any talk about the Giants getting Burrows and then using him for trade(s).,Giants,1,1576435167,eb1r0m
330,Not the most physical team at wideout and when we are they call OPI.,Giants,1,1576435149,eb1r0m
331,slayton is better than both shepard and tate.,Giants,1,1576435145,eb1r0m
332,Retire? He’ll be the Dolphins QB next year.,,1,1576435144,eb1r0m
333,The unstoppable Dolphins offense!,,2,1576435093,eb1r0m
334,Sucks for Eli. He was right at .500 and he’ll prob retire under .500.,Giants,3,1576435047,eb1r0m
335,You reacted 7 minutes later.,Giants,0,1576434920,eb1r0m
336,I cant even blame the coach that was a half back drive and the god damn half back was massive .. no reason we dont get 1 yard,,1,1576434662,eb1r0m
337,What a shit show this game is.  Both these organizations should be embarrassed.,Giants,4,1576434629,eb1r0m
338,C'mon dolphins...,Giants,1,1576434616,eb1r0m
339,[deleted],,1,1576434582,eb1r0m
340,I don't like that play,Dolphins,1,1576434570,eb1r0m
341,This game is 4-12 bullshit,Dolphins,2,1576434563,eb1r0m
342,"Of course right after I say that we get a 4th down stop, but I stand by my comment for 99% of the season",Giants,2,1576434513,eb1r0m
343,Dude enjoys himself no matter what. I wish I could have that attitude.,NFL,2,1576434484,eb1r0m
344,Qb sneak,,1,1576434468,eb1r0m
345,15 weeks of having a completely embarrassing offense.  Seeing so much distance between our players and the football on every play is ridiculous.,Giants,3,1576434385,eb1r0m
346,Fitzy is so much fun,Bills,7,1576434377,eb1r0m
347,lmao ogletree,Giants,2,1576434370,eb1r0m
348,"Alec Ogletree, get out of my life.",Giants,3,1576434331,eb1r0m
349,Lol what are you watching? I swear some people just run with a narrative and dont understand the game.,Giants,3,1576434325,eb1r0m
350,Does Fitzy know he can slide?,,2,1576434292,eb1r0m
351,"Definitely shouldn’t ever argue in Gettleman’s favor, you’re guaranteed to lose.",Giants,0,1576434276,eb1r0m
352,Shouldnt even argue after reading your username. Enjoy the match,Giants,1,1576434225,eb1r0m
353,"Trolls getting players cut is where it's at.

He was worth a 3rd last year tho didn't trade him so w/e.",Giants,1,1576434198,eb1r0m
354,Cinci!,Dolphins,3,1576434194,eb1r0m
355,"It is not worse than it was, it just isnt right",Giants,3,1576434190,eb1r0m
356,Remember when it was fun to watch Barkley?,NFL,1,1576434189,eb1r0m
357,This is bad football,Giants,2,1576434179,eb1r0m
358,"Yeah, nothing is ever on Gettleman. The OL he put together and the coaches he hired are somehow Reese’s fault, im sure.",Giants,1,1576434172,eb1r0m
359,That one aint on gettleman. he tried to improve it but our OL Coach has less than 1 working braincell,Giants,1,1576434117,eb1r0m
360,Absolutely embarrassing how many resources Gettleprick has poured into this OL only to make it worse.,Giants,1,1576434071,eb1r0m
361,I know it's said every year but goddamn I feel  like this season has been out of hand with the poor officiating in games.,Giants,1,1576434025,eb1r0m
362,"""Solder just doesn't play the game right""

LMAO",Dolphins,8,1576433985,eb1r0m
363,This O-line sure is offensive.,Giants,4,1576433980,eb1r0m
364,goddamn solder. just get out of new york,Giants,3,1576433957,eb1r0m
365,"""Sacked"" was a generous term there. Manning just kinda fell down.",Dolphins,0,1576433907,eb1r0m
366,the checkdown king 3li is back.,Giants,-2,1576433893,eb1r0m
367,Whatever,Giants,1,1576433879,eb1r0m
368,lmao ok.,NFL,1,1576433868,eb1r0m
369,"There was no push off, but there was massive holding to protect Eli, so I think it balances out.",Dolphins,4,1576433842,eb1r0m
370,pot meet kettle,Cowboys,1,1576433809,eb1r0m
371,This is definitely a game between 2 and 3 win teams,Giants,7,1576433801,eb1r0m
372,LMAO refs man this league is an embarrasment,Raiders,4,1576433799,eb1r0m
373,I can't describe how much it hurts to see their 3 to our 2,Giants,1,1576433603,eb1r0m
374,not at all. Daniel jones is the only shining light. It's different for you guys as flores seems like a really good coach and has the team playing with passion at least.,Giants,2,1576433584,eb1r0m
375,Commentator sounds so much like the guy off Children's Hospital,Giants,0,1576433567,eb1r0m
376,Perfect first drive for a loss,Dolphins,1,1576433522,eb1r0m
377,"Weird season man, you guys enjoying it?",Dolphins,1,1576433491,eb1r0m
378,[removed],,1,1576433479,eb1r0m
379,same.,Giants,3,1576433452,eb1r0m
380,Back in college the announcers mentioned Gesicki played volleyball multiple times a game. Is that still a thing?,NFL,1,1576433409,eb1r0m
381,Empty stands lmao,Giants,1,1576433406,eb1r0m
382,"The Dolphins are somehow going to win. Michael Francesa is going to harshly criticize Gettleman and Shurmur on twitter, again. Life goes on.",Rams,2,1576433329,eb1r0m
383,Stream it,Dolphins,2,1576433152,eb1r0m
384,I want to lose but I think I want to win more,Dolphins,1,1576433136,eb1r0m
385,Dolphins gonna win 24-17,Giants,1,1576433126,eb1r0m
386,Got gashed with screen plays last week yet we haven't learned a dam thing,Giants,2,1576433120,eb1r0m
387,"I can't believe I get this garbage on TV instead of Texans@Titans, Christ.",NFL,1,1576432922,eb1r0m
388,THE CHASE FOR CHASE,Giants,3,1576432907,eb1r0m
389,"Dolphins fans, ready for Fitzpatrick to look like Aaron Rodgers?",Giants,2,1576432882,eb1r0m
390,Fuck I can't believe I'm here for this bullshit,Giants,5,1576432740,eb1r0m
391,I hope Eli leads the Giants to a victory this game so they lose out on Chase Young,,1,1576432625,eb1r0m
392,Flores is 10 times the man shurmur will ever be.,Giants,3,1576432600,eb1r0m
393,GO DOLPHINS #FINSUP,Vikings,2,1576432599,eb1r0m
394,Dolphins honestly got a tough path for the draft.  They play hard so they might end up with 5 wins,Giants,1,1576432476,eb1r0m
395,*Muffled Roundball Rock plays in the distance*,Redskins,1,1576432315,eb1r0m
396,Now it's a fair fight.,Giants,3,1576432314,eb1r0m
397,holy shit this is a game lol,Panthers,1,1576432242,eb1r0m
398,"You’re right, I think that works unless that defense gives up 2122 points",Giants,1,1576431797,eb1r0m
399,THE CHASE YOUNG BOWL LADIES AND GENTLEMEN....... START YOUR TANKS!,Giants,5,1576431792,eb1r0m
400,Lol oh okay. Whoosh on me,Giants,1,1576431736,eb1r0m
401,&gt; It's a beautiful day in the neighborhood..,Giants,1,1576431711,eb1r0m
402,Lmaoooooooooooooooooooooo,Titans,2,1576431688,eb1r0m
403,He's pointing out your typo. 303 TDs would probably win the game,,3,1576431667,eb1r0m
404,dont let this game distract you from the fact that the pats are still dirty cheating fuckbags,Dolphins,19,1576431646,eb1r0m
405,"I still think 2,121 points will be good enough",Cowboys,3,1576431616,eb1r0m
406,"Miami's starting guards last week are both out. I didn't know their names. They're replaced by two other people I've never heard of. Half this team is UDFAs and practice squad players. Good luck, Giants.",Dolphins,4,1576431562,eb1r0m
407,I mean Giants had 3 games already with 300+ passing yards and 4 TDs and they lost two of them. So I don’t know if it’ll be enough,Giants,1,1576431554,eb1r0m
408,"&gt;300 TDs and 3 TDs

I think that'll seal the win. Maybe",Cowboys,2,1576431310,eb1r0m
409,"Best case scenario for Giants:

Eli throws for 300 TDs and 3 TDs. Giants still lose lol

EDIT: 300 yards and 3 TDs lol",Giants,8,1576431231,eb1r0m
410,CRIPPLE FIGHT!,Eagles,4,1576431163,eb1r0m
411,I’m ready to be hurt again.,Giants,1,1576431118,eb1r0m
