,body,author_flair_text,score,created_utc,link_id
3030,Because his butt is full of poop,,3,1573413464,duedcw
3031,KooMatic,Falcons,3,1573413461,duedcw
3032,The Younghoe!!!,Raiders,3,1573413460,duedcw
3033,Respect man. Despite the hate no one should hope for injuries. Bless the knees.,Saints,5,1573413453,duedcw
3034,Matt Ryan and red zone sacks -- name a better duo,Falcons,6,1573413450,duedcw
3035,Drilled it,Falcons,1,1573413450,duedcw
3036,Started Alvin kamara against the falcons on my fantasy team this week. Who'd have thought he'd be sucking dick so far,Falcons,3,1573413447,duedcw
3037,That his career will be wasted if he doesn't leave ATL?,Saints,2,1573413447,duedcw
3038,What? Who that’s fuxked up,Panthers,2,1573413446,duedcw
3039,at least you arent cheering for nola,Falcons,1,1573413445,duedcw
3040,Dat younghoe koo 😔,Saints,1,1573413444,duedcw
3041,"World's most pathetic showing at WP. 

Never seen so many millennials who want free college and guaranteed jobs when they can't find them in the free market",Panthers,-3,1573413443,duedcw
3042,Cause he's full of shit,Panthers,6,1573413439,duedcw
3043,Uh 0?,Falcons,4,1573413425,duedcw
3044,Why does Sean Peyton look constipated,Falcons,6,1573413416,duedcw
3045,Literally none of us,Falcons,3,1573413414,duedcw
3046,Matt Ryan is that weak ?,Saints,3,1573413409,duedcw
3047,We desperately needed that,Saints,4,1573413403,duedcw
3048,Man that wind from the arm swing must have been really strong.,Texans,7,1573413396,duedcw
3049,Finally a good play for us,Saints,2,1573413395,duedcw
3050,About fucking time....,Saints,2,1573413390,duedcw
3051,Check how many Falcons in this thread are making Katrina jokes and you'll see why we hate them.,Saints,-3,1573413389,duedcw
3052,:),Saints,1,1573413383,duedcw
3053,Sad falcon noises,Falcons,2,1573413381,duedcw
3054,Pretty much seeing that result right now.,Saints,1,1573413378,duedcw
3055,DAVIS,Saints,0,1573413376,duedcw
3056,I can't believe I need to cheer for Atlanta to win right now. I feel so fucking gross.,Panthers,2,1573413376,duedcw
3057,That was a hell of a sack,Browns,1,1573413370,duedcw
3058,I mean obviously Taysom but anyone else is fine too.,Saints,1,1573413344,duedcw
3059,"Yes yes but you're still a falcon. 

Dylan don't spit hot fire wit no N E ME",Panthers,1,1573413331,duedcw
3060,Matt ryan waits for the ball in the shotgun like he's about to birth a cow,Panthers,10,1573413330,duedcw
3061,"“He can’t do shit with lattimore on him”

And that still stands as of now.",Saints,4,1573413330,duedcw
3062,here comes another td,Saints,0,1573413329,duedcw
3063,Literally our starting corner just got hurt. Don’t be ignorant lmao,Saints,3,1573413328,duedcw
3064,no one on the saints can guard Julio except Lattimore and he’s hurt so uh oh,Vikings,-1,1573413322,duedcw
3065,"Its all you got and its all this team has. They will play hard to fuck with the Saints. Hell, if the dirty birds win two, carolina can take the NFC south and NOLA MAY get the wild card depending on how the nfc west/north shakes out.",Saints,1,1573413316,duedcw
3066,Before our cb went to the locker room,Saints,5,1573413315,duedcw
3067,What a frustrating fucking game.,Saints,5,1573413313,duedcw
3068,"Ngl lattimore was annoying the fuck out of me but this game isn't the same without the best guys out there. Hope he gets well soon, the guy is a star.",Falcons,5,1573413309,duedcw
3069,Our best corner Jesus fuck,Saints,1,1573413306,duedcw
3070,Wasn’t expecting this but I’m to drained after the LSU game to be emotionally invested in this one.,Saints,3,1573413306,duedcw
3071,Lattimore isn't on the field,Saints,6,1573413297,duedcw
3072,"where? literally link me you lying shit stirrer, so annoying with your strawmen, jesus shut up.",Saints,2,1573413295,duedcw
3073,Saint's and running into their own teammates where have I heard this before??,Falcons,2,1573413294,duedcw
3074,So is MT...didnt stop it then.,Falcons,1,1573413294,duedcw
3075,"Trufant is also out, so it's even now. You don't hear falcons fans complaining about Thomas",Falcons,-1,1573413287,duedcw
3076,(I was just rhyming with you),Falcons,1,1573413286,duedcw
3077,"Is Shon hurt?
*edit, fuck.",Saints,1,1573413283,duedcw
3078,Jjjjuuuuullllliiiiooooo,Panthers,1,1573413281,duedcw
3079,so wtf happened to lattimore?,Falcons,1,1573413280,duedcw
3080,[removed],,1,1573413276,duedcw
3081,Maybe they accidentally mixed up the defenses’ jerseys by accident in the laundry before the game,Cardinals,2,1573413274,duedcw
3082,Only good for the next 2.15 quarters.,Panthers,1,1573413262,duedcw
3083,"All it took was for lattimore to get hurt 

Can’t beat our best lol",Saints,3,1573413261,duedcw
3084,Everyone should’ve known this was a trap game for the Saints...looking ahead to the game against the Bucs.,Rams,6,1573413261,duedcw
3085,"Wait, what were Saint's fans saying about Julio a few minutes ago??",Falcons,-5,1573413255,duedcw
3086,Normally Marsh eats Julio's lunch every time they play.,Saints,1,1573413253,duedcw
3087,Oh fuck me Lattimore is out,Saints,4,1573413244,duedcw
3088,jUlIo lOoKs OlD,Falcons,1,1573413241,duedcw
3089,He’s such a fucking animal,Falcons,1,1573413238,duedcw
3090,Saints are going to lose this with apple in coverage,Saints,5,1573413238,duedcw
3091,it would be ironic if you didnt expect me to complain. complaining about complaints isnt irony.,Saints,0,1573413237,duedcw
3092,I care. The Raiders get to play the hapless Bengals next week lol.,Raiders,2,1573413233,duedcw
3093,Julio has the exclusive right to make me his gay lover,Falcons,2,1573413232,duedcw
3094,"he's playing against our CB2, don't get cocky lmao",Saints,-1,1573413227,duedcw
3095,You heard it y’all. 2nd half called off it’s over,Saints,4,1573413226,duedcw
3096,At least it was only brought up to highlight that you're winning the first half here.,Saints,1,1573413224,duedcw
3097,Jones quiet until Lattimore goes out,Saints,6,1573413221,duedcw
3098,Secretariat!!,Patriots,3,1573413217,duedcw
3099,JULIOOOOOO,Falcons,2,1573413215,duedcw
3100,That's why he's the BEST,Falcons,1,1573413210,duedcw
3101,Great route,Seahawks,2,1573413209,duedcw
3102,That's the Julio I know,Falcons,2,1573413206,duedcw
3103,"Well, we're down our CB1, this is bound to happen.",Saints,1,1573413205,duedcw
3104,That fuck em chuck em shit,Falcons,1,1573413204,duedcw
3105,Oh looky here saints fans blaming the refs,,1,1573413200,duedcw
3106,Straight into my veins,Panthers,0,1573413198,duedcw
3107,Both. Why not both?,Panthers,1,1573413189,duedcw
3108,Good thing the Aints got their celebrations against Julio in early lmao,Falcons,-1,1573413184,duedcw
3109,That’s a pretty hot take,Falcons,0,1573413181,duedcw
3110,Ill take it 😂,Patriots,1,1573413179,duedcw
3111,"Last I checked he hasn’t been our DC for like 8 years

Why don’t you go into the Jets game threads and talk shit to them since they are ACTIVELY EMPLOYING HIM

Also if you think your team wasn’t also encouraging hard hits that knocked players out of the game you are extremely naive lol",Saints,0,1573413170,duedcw
3112,Christian Blake. Straight fucking cake. Comes to expose the saints as fake,Panthers,1,1573413168,duedcw
3113,Tryna eat too many Dubs makes em slow,Saints,1,1573413163,duedcw
3114,Wow,,1,1573413163,duedcw
3115,Yeah cause either way you're losing to a 1-7 team in your own dome,Falcons,1,1573413162,duedcw
3116,"Ravens 28 - Bengals 3

Just fyi",Saints,2,1573413162,duedcw
3117,Julioooooooo,Falcons,2,1573413159,duedcw
3118,Jerry Rice,Falcons,1,1573413147,duedcw
3119,"I was told there would be 

CHOPPA STYLE",Lions,1,1573413145,duedcw
3120,"Sounds like a monster, he deserves an extension!!",Falcons,2,1573413143,duedcw
3121,These types of shows are suuuuper cheap to make.,49ers,1,1573413141,duedcw
3122,The only people who think this is an upset are people who have never watched New Orleans football.,Saints,7,1573413140,duedcw
3123,"Hope we do, mans got talent and seems like a really nice guy in interviews",Patriots,2,1573413139,duedcw
3124,I'm gonna root against y'all except every play that Sanu gets targeted tbh,Falcons,1,1573413137,duedcw
3125,He was born doing the first down signal. 100% first down conversion rate when targeted. Get that jersey to Canton,Saints,1,1573413123,duedcw
3126,"Gah, this game has been the ugliest games they’ve played of the year",Saints,1,1573413122,duedcw
3127,*salty,Panthers,1,1573413120,duedcw
3128,It’s not that much of an upset. They’re a top 5 team and we’re the best team with top 5 draft position. Pretty equal.,Falcons,1,1573413117,duedcw
3129,I ❤️ Sanu,Falcons,2,1573413114,duedcw
3130,hypocrisy and irony aren’t the same thing BRO!!,Saints,1,1573413109,duedcw
3131,"Sanu is a team favorite.

Hard working, great personality, and is really dependable",Falcons,1,1573413109,duedcw
3132,It's why I just got in this thread. What the fuck is this game?,Saints,1,1573413104,duedcw
3133,"im just ready for halftime adjustments, and to shake off that bye week rust",Saints,3,1573413103,duedcw
3134,You guys have been saying this since forever lmao,Falcons,1,1573413102,duedcw
3135,Even if they went up something like 18 more points I wouldn't be worried.,Saints,0,1573413095,duedcw
3136,"True, we're p angry this season tbh.",Saints,1,1573413087,duedcw
3137,He is an American football wide receiver if Wikipedia is to be believed,,1,1573413084,duedcw
3138,Lmaoo the irony,Falcons,1,1573413077,duedcw
3139,"Remember your former defensive coordinator, Gregg Williams, head hunting opposing QBs? Remember your head coach, Sean Payton, covering for him and trying to bury any evidence of it?

I, for one, am enjoying the irony.",Panthers,0,1573413076,duedcw
3140,jerry jeudy incoming,Falcons,1,1573413068,duedcw
3141,Take care of the Sanu canoe,Falcons,7,1573413064,duedcw
3142,He was with us in the preseason. Been on the practice squad,Falcons,2,1573413063,duedcw
3143,And play who? Lol Lattimore is on the sidelines.,Saints,1,1573413061,duedcw
3144,"Oh yeah, I forgot to mention Falcons fans are also happy to make fun of a tragedy that killed thousands of people.",Saints,1,1573413060,duedcw
3145,"Come on man, you dont pick on the slow kid",Panthers,4,1573413059,duedcw
3146,"In other obvious updates, the Bears Lions game still doesn't have a touchdown.",Packers,1,1573413056,duedcw
3147,No,Falcons,1,1573413054,duedcw
3148,"I’m numb to choking games, at this point it’s expected",Falcons,1,1573413054,duedcw
3149,"Julio, do you need a Snickers, you’re not yourself when you’re hungry",Falcons,8,1573413046,duedcw
3150,Who the fuck is Christian Blake lol,Falcons,12,1573413039,duedcw
3151,"Falcons fans, Im rootin for yall cause you gave us Sanu and saw some of your fans rooting for him to do well in the pats game",Patriots,9,1573413033,duedcw
3152,"Going 3-13 with 2 wins against the saints, and a top draft pick to get chase young, that's my ideal end to the season",Falcons,1,1573413032,duedcw
3153,I will laugh when y’all blow the game.,Saints,1,1573413030,duedcw
3154,"Real talk, Brees to Jones would be insane.",Saints,6,1573413017,duedcw
3155,Okay so who’s Christian Blake,Falcons,8,1573413003,duedcw
3156,Both?,Saints,1,1573413002,duedcw
3157,so victor oladipo has something to do while rehabbing,Falcons,5,1573412989,duedcw
3158,Damn...digging for dirt...the salt is thick!,Panthers,1,1573412983,duedcw
3159,Lamar Jackson is a fucking monster,Vikings,2,1573412981,duedcw
3160,A really shitty piece of coal,Panthers,1,1573412970,duedcw
3161,yeah nfcs allowed,Saints,4,1573412963,duedcw
3162,Some of these throws feel a little slow.,Falcons,2,1573412961,duedcw
3163,Get PJ fucking Williams off the field.,Saints,5,1573412952,duedcw
3164,Must be hanging out with Brees,Falcons,10,1573412950,duedcw
3165,"If there’s one thing we can all agree on, the bucs suck.",Saints,13,1573412944,duedcw
3166,Everyone taking a turn pushing Julio's shit in lol,Saints,7,1573412941,duedcw
3167,"Bruh, it’s been rough",Falcons,2,1573412938,duedcw
3168,The irony of this comment lol,Falcons,0,1573412927,duedcw
3169,Damn Julio... What's happening old man??,Saints,7,1573412924,duedcw
3170,Why does the masked singer exist,Saints,13,1573412917,duedcw
3171,Thomas Jefferson should have left New Orleans out of the deal.,Falcons,1,1573412914,duedcw
3172,Next drive : 3 yards saints penalty 5 yards Saints penalty 8 yards Saints penalty touchdown,Saints,4,1573412909,duedcw
3173,"lol Apple just beat Julio, for all of you who keep making fun of Apple here.",Saints,9,1573412909,duedcw
3174,I think we are obligated to be here....,Panthers,5,1573412908,duedcw
3175,I love when the announcers explain with examples just how shitty we are,Falcons,2,1573412908,duedcw
3176,"Shhhh let me win this one, it’s all I have",Falcons,1,1573412903,duedcw
3177,We'll see what you do next time your city is underwater again,Falcons,1,1573412902,duedcw
3178,When you low key wanna shit talk your own team on a sock puppet account just to stir shit.,Saints,6,1573412900,duedcw
3179,Lattimore on sideline with no helmet...not good,Saints,6,1573412895,duedcw
3180,"Outscored 144-50 in the first half, lmao wow Falcons",Falcons,3,1573412888,duedcw
3181,"Never have I ever pulled for the Falcons 

_drinks_",Panthers,3,1573412886,duedcw
3182,It was one fan lol. Everyone thought it was dumb as fuck and it was dismissed.,Saints,1,1573412884,duedcw
3183,144-50 Jesus christ lol,Saints,5,1573412882,duedcw
3184,"will this abortion of a season be worth it if we can embarrass the saints in NOLA?  not really, but it'll make me feel better",Falcons,2,1573412874,duedcw
3185,Damn fuckin right we are,Falcons,1,1573412871,duedcw
3186,FUCK YEAH THIS IS FOOTBALL BABY,Falcons,1,1573412865,duedcw
3187,I am not Clapping for this.,Saints,1,1573412863,duedcw
3188,Right?,Panthers,1,1573412854,duedcw
3189,"Score update: Ravens lead the Bengals 28-3

In case anyone cares",Patriots,6,1573412852,duedcw
3190,soft ass non-saints/falcons fans: no one cares that you dont know or appreciate how to talk shit. go eat some mayonnaise casserole or whatever the fuck your mom made for after church lunch today and stop whining about other team’s fans,Saints,5,1573412851,duedcw
3191,Imagine getting sacked by the falcons lmfao,Falcons,6,1573412848,duedcw
3192,Yes,Saints,11,1573412847,duedcw
3193,"To be fair, we’ve played like literal garbage all season. The record is very well deserved. Would’ve been 0-8 if it wasn’t for a dropped TD.",Falcons,3,1573412844,duedcw
3194,"I mean it's the saints.

These games are always nuts regardless of records",,3,1573412840,duedcw
3195,"Okay saints fans, what did the refs do this time",Falcons,0,1573412836,duedcw
3196,Nah y'all just squatting,Saints,1,1573412836,duedcw
3197,"Convinced the NFL to implement replay review because of 1 bad call, and now countless teams have thrown challenge flags over similarly bad calls and ended up wasting a timeout only to watch the call stand.",Falcons,2,1573412834,duedcw
3198,Peat is getting rocked tonight,Saints,1,1573412834,duedcw
3199,Yes. They really do. It’s stupid. We always play tough.,Saints,3,1573412833,duedcw
3200,I mean Ridley got away with throwing elbows to the face after the play was over.  looks like garbage to me.,Saints,1,1573412830,duedcw
3201,"Oh no, I totally agree! But there's a difference between being upset and thinking every flag against you is a conspiracy or being whiney if something doesn't go your way.",,1,1573412825,duedcw
3202,"At this point I can't tell if Atlanta is playing good, or New Orleans is playing bad...",Falcons,6,1573412824,duedcw
3203,"I mean to be fair if you have one of the worst missed calls in the history of the sport that literally costs you a super bowl you would be a cry baby too.

That call was maybe the WORST blown call and it was literally the difference between winning and losing - assuming lutz makes the 30 yarder with 20 seconds and the rams don’t hit on a Hail Mary we win 

I’ll be salty for the rest of my life",Saints,1,1573412818,duedcw
3204,Division games. It's always like this. Doesn't matter if you're 0-8 or 8-0,Saints,1,1573412818,duedcw
3205,Lololololol. SSS Saints So Shitty,Panthers,-1,1573412816,duedcw
3206,2 sacks in one half? That's illegal.,Falcons,4,1573412816,duedcw
3207,They out there making our defense look good. Unbelievable,Falcons,2,1573412812,duedcw
3208,"I'm not going to name names, but somebody is playing like a peat of shit thus far.",Saints,4,1573412809,duedcw
3209,FORMER worst pass rush until next week,Falcons,1,1573412805,duedcw
3210,"🤯🤯🤯 (but to be fair, he did call the plays during our superbowl season).",Falcons,1,1573412803,duedcw
3211,Peat is getting destroyed,Saints,5,1573412800,duedcw
3212,do people seriously think records matter in divisional games?,Saints,10,1573412796,duedcw
3213,Yeah can’t say I’m worried yet lol.,Saints,4,1573412792,duedcw
3214,What is going on honestly,Falcons,3,1573412791,duedcw
3215,"There's more of you complaining about complainers than actual complainers, it's actually pretty funny.",Saints,1,1573412789,duedcw
3216,wasn't actually sure that was allowed,Falcons,2,1573412788,duedcw
3217,Not really fair that the Falcons are suddenly allowed to get sacks against us,Saints,10,1573412786,duedcw
3218,You can laugh when you take the lead,Falcons,-2,1573412786,duedcw
3219,Lol,Falcons,4,1573412778,duedcw
3220,Holy shit. Why are we playing like an almost competent team?,Falcons,5,1573412776,duedcw
3221,Just woke up from a coma. Do the falcons have the best defense in the NFL???,Vikings,3,1573412773,duedcw
3222,"Nope, and we don’t give a fuck if we do.",Saints,1,1573412766,duedcw
3223,"Verizon fucked up my bill and made me wait for 2 hours on hold

but they won’t put me in the commercial",Cardinals,6,1573412765,duedcw
3224,Imagine giving up a sack to the Falcons lol,Falcons,9,1573412762,duedcw
3225,Lolololol,Saints,5,1573412759,duedcw
3226,Why do you shitheads constantly come into our threads just to insult our fan base?,Saints,1,1573412757,duedcw
3227,Now we’re gonna fuck around and miss the playoffs at 9-7 /s,Falcons,3,1573412756,duedcw
3228,"Love y’all, even if I hate y’all",Falcons,2,1573412752,duedcw
3229,worst pass rush in the league is killing us,Saints,5,1573412751,duedcw
3230,[deleted],,1,1573412747,duedcw
3231,man screw this silly game sometimes,Saints,3,1573412745,duedcw
3232,D'aawwww,Saints,-1,1573412742,duedcw
3233,Oof,Saints,3,1573412742,duedcw
3234,The cowboys.,Saints,2,1573412740,duedcw
3235,holy shit. tackling the QB before he throws to the open man is such a good idea. why dont we do that all the time,Falcons,12,1573412739,duedcw
3236,We've tried telling everyone how dumb they are but nobody listens.,Falcons,-1,1573412737,duedcw
3237,"That’s what your supposed to do. 

And y’all are giving us the ringer rn",Saints,2,1573412737,duedcw
3238,"Thanks, I'll try that.",Falcons,1,1573412736,duedcw
3239,SACKLANTA,49ers,7,1573412726,duedcw
3240,[deleted],,6,1573412725,duedcw
3241,"Wait, you're allowed to tackle the quarterback? What is this nonsense? I've never seen it before",Falcons,6,1573412722,duedcw
3242,Strong words for someone without a flair,Saints,7,1573412717,duedcw
3243,Lol exactly what I was thinking of,Falcons,1,1573412715,duedcw
3244,"Imagine giving up two sacks to the falcons, lol the saints are trash!",Falcons,5,1573412709,duedcw
3245,"Quinn: stops calling plays

Defense: Improves",Falcons,20,1573412706,duedcw
3246,Southern hate is a different beast. I've settled on never setting foot in Atlanta over a football rivalry,Saints,2,1573412705,duedcw
3247,I think any franchise would be upset about being robbed of a SB appearance though tbh,Saints,8,1573412704,duedcw
3248,“Virtually sackless all year” lol damn from the top rope,Saints,11,1573412702,duedcw
3249,Go Falcons!,Seahawks,3,1573412701,duedcw
3250,Yeah that sack was the cutest thing I've ever seen.,Falcons,0,1573412699,duedcw
3251,[removed],,1,1573412696,duedcw
3252,We've equaled over 1/4 of our total season sack count today...with 2...,Falcons,9,1573412694,duedcw
3253,Atlanta might win,Texans,1,1573412693,duedcw
3254,I'm loving it,Patriots,1,1573412689,duedcw
3255,"If you're on a PC using chrome or firefox, try Ctrl+F5 or Ctrl+Shift+R.

Should clear out CSS cache and may fix flairs.",Saints,1,1573412687,duedcw
3256,Fucking sackless huh? Lol,Raiders,3,1573412685,duedcw
3257,This is the best the Falcons D has played all year. This remind me of the 15’ Panthers game a bit,Falcons,5,1573412680,duedcw
3258,Clayborn gets his first sack in 10 years lmao.,Saints,3,1573412679,duedcw
3259,"“I hope the saints run defense is terrible when we play them” -u/pugsl

“Why are Saints fans downvoting me😭” -u/pugsl",Saints,3,1573412675,duedcw
3260,Another. Teddy is better than Ryan.,Saints,1,1573412671,duedcw
3261,"Those ""coaching changes"" were largely just to make it seem like they're changing something. Do they really think that affects anything?",Falcons,1,1573412668,duedcw
3262,"The fact that the game is even close is what’s funny, we should be down 30",Falcons,5,1573412666,duedcw
3263,[removed],,1,1573412666,duedcw
3264,[removed],,-3,1573412661,duedcw
3265,"Gotta love the Reddit tactic of pretending to be stupid so you can misrepresent the other person's point. 

At least I hope you're pretending.",Saints,1,1573412661,duedcw
3266,The kraken dreads strike again.,Packers,1,1573412660,duedcw
3267,"Lol ""sackless""",,2,1573412655,duedcw
3268,"Remember when Thomas Davis went head hunting on Jimmy Graham after an INT?

I do",Saints,2,1573412655,duedcw
3269,Wtf is this game,Saints,5,1573412654,duedcw
3270,And sacked! Wohoo,Falcons,1,1573412648,duedcw
3271,"And they move right the fuck back, sounds like a city that doesn't give up to me.",Saints,1,1573412639,duedcw
3272,General Sherman had the right idea about Atlanta.,Saints,8,1573412636,duedcw
3273,Sure ya will bud,Saints,1,1573412635,duedcw
3274,So I'm not crazy? The North has its share of petty shit but this is pretty bad.,Packers,0,1573412634,duedcw
3275,The fact we even have a lead right now is hilarious,Falcons,5,1573412634,duedcw
3276,I would 😩,Saints,-1,1573412634,duedcw
3277,These threads are so fun lol,Saints,4,1573412632,duedcw
3278,"I'm I simple man. I see Falcons/Panthers/Bucs flair, I downvote.",Saints,6,1573412630,duedcw
3279,Weve really had 5 punters?,Falcons,1,1573412628,duedcw
3280,How quickly Saints’ fans forget about Greg Williams.,Bengals,1,1573412624,duedcw
3281,Zach Line never breaks any tackles,Saints,2,1573412620,duedcw
3282,I love the fear of us this year!,Saints,4,1573412616,duedcw
3283,so cute!,Saints,2,1573412613,duedcw
3284,Yes. More Kamara please.,Vikings,2,1573412612,duedcw
3285,[removed],,1,1573412611,duedcw
3286,Drew and Mike just gonna play catch on this drive,Saints,2,1573412606,duedcw
3287,We are talking mad shit even though we suck lol,Falcons,4,1573412601,duedcw
3288,[deleted],,1,1573412587,duedcw
3289,"/r/nfl, I hope you realize how much these teams fans hate each other. The trash talking and whining is glorious 😤",Falcons,11,1573412583,duedcw
3290,Well the rent is a lost 1-7 season lol,Saints,5,1573412581,duedcw
3291,That Michael Thomas is pretty good,Saints,7,1573412578,duedcw
3292,You should know how sensitive they are by now,Falcons,-3,1573412577,duedcw
3293,Injury from overuse,Saints,1,1573412568,duedcw
3294,feels good man,Saints,6,1573412563,duedcw
3295,"Damn Saints fan, yall something else in these threads. I thought my team has some bitchy fans lol",Patriots,7,1573412555,duedcw
3296,You can see people’s votes? Da fuq,Saints,8,1573412555,duedcw
3297,Thanks. I’m glad you reminded me after I decided to watch this game instead.,Bengals,3,1573412542,duedcw
3298,[removed],,1,1573412540,duedcw
3299,Free rent.,Falcons,0,1573412535,duedcw
3300,Total piece of garbage you are huh?,Saints,2,1573412533,duedcw
3301,swear to god 😂😂😂,Vikings,-4,1573412527,duedcw
3302,Subreddit flair not working for me makes trash talking much harder.,Falcons,1,1573412518,duedcw
3303,By your logic there should never be any penalties called because they happen on every play. Glad we cleared that up!,Falcons,1,1573412515,duedcw
3304,"Saints rings: 1
Falcons rings: 0",Saints,1,1573412515,duedcw
3305,so edgy,Saints,6,1573412514,duedcw
3306,And God sent Sherman to cleanse your city with fire but we don't bring it up all the time like assholes.,,4,1573412513,duedcw
3307,What is the matter with you,Falcons,4,1573412505,duedcw
3308,"Nice - lets make light of a tragedy where thousands died

Piece of shit

Can mods get a ban please?",Saints,9,1573412503,duedcw
3309,"28-3

13-1

Your city’s legacy is literally catastrophic failure",Saints,4,1573412502,duedcw
3310,No way bro those 1-7 falcons are UNDERRATED,Saints,1,1573412502,duedcw
3311,"I’m gonna kick your 7-1 ass with my 1-7 ass, fight me",Falcons,3,1573412491,duedcw
3312,"Thought we were talking currently here, now you wanna start going way back hmmmm as if falcons weren't shit in the past too.",Saints,3,1573412489,duedcw
3313,there is a difference between dirty and legal play and non-sports-play liek elbowing to the face,Saints,1,1573412484,duedcw
3314,It wasnt a punch it was an elbow,Saints,3,1573412482,duedcw
3315,Chicago game is 28x0 to 3 rn,49ers,1,1573412480,duedcw
3316,Cant Guard Mike.,Saints,4,1573412477,duedcw
3317,Yo saints fans why y’all downvoting everything 😂,Panthers,-1,1573412476,duedcw
3318,yes,Vikings,2,1573412476,duedcw
3319,"Yes, however a Super Bowl choke when your mvp quarterback is up by four scores is insanely laughable.",Saints,1,1573412475,duedcw
3320,Not cool my guy,Falcons,6,1573412464,duedcw
3321,"he elbowed a guy to the face and threw a punch, he should be ejected for that",Saints,5,1573412462,duedcw
3322,New Orleans Michael Thomas’s,Saints,10,1573412455,duedcw
3323,Falcons fans talking trash this year is so adorable lmao,Saints,9,1573412453,duedcw
