,body,author_flair_text,score,created_utc,link_id
264,True. It was ticky tack and unnecessary so I'd be a great ref,Falcons,1,1574622997,e11i34
265,"What exactly are they seeing? Looks like a clear catch, stop wasting challenges.",Falcons,2,1574622970,e11i34
266,Winston is just a conundrum. We can never really defend him,Falcons,3,1574622958,e11i34
267,If that pass is accurate thats a TD,Buccaneers,3,1574622949,e11i34
268,It's a catch,Falcons,2,1574622937,e11i34
269,"Dan Quinn and meaningless challenges, what a duo that will never die.",Falcons,6,1574622928,e11i34
270,Barley got that second foot in,Buccaneers,1,1574622923,e11i34
271,Nice to see Perriman doing what he was signed for.,Buccaneers,2,1574622910,e11i34
272,Did Quinn go back to calling the defense again?,Falcons,2,1574622905,e11i34
273,This game sucks. Total snooze fest,Falcons,1,1574622855,e11i34
274,WHAT A BOMB!,Buccaneers,2,1574622825,e11i34
275,https://i.imgur.com/5lqlFa4.jpg,Buccaneers,1,1574622803,e11i34
276,Because there is too much shit to do in the facility so people don't hang out in the stands religiously. Atlanta United is much more electrifying.,Falcons,5,1574622778,e11i34
277,"The missed XP will cost us, as is tradition.",Buccaneers,1,1574622764,e11i34
278,"We have no business being up in this game. But that’s us 🤷🏾‍♂️. 

We lose some odd way in the 4th though.",Buccaneers,3,1574622680,e11i34
279,We warned you,Buccaneers,4,1574622648,e11i34
280,Between the stutter and the lunge forward that has to have been a flag,Falcons,4,1574622628,e11i34
281,Well that was offsides,Falcons,4,1574622615,e11i34
282,Why’s our stadium always so quiet 😕,Falcons,6,1574622600,e11i34
283,He didn’t pass the ball before it was snapped.,Buccaneers,1,1574622563,e11i34
284,"To be fair, you are playing the Falcons.",Falcons,1,1574622560,e11i34
285,Devin white is doing what Vita did last year get hurt early but dominate later in the year,Buccaneers,3,1574622550,e11i34
286,God this team fucking sucks. Fuck you Koetter. This offense has about as much life as a corpse.,Falcons,3,1574622539,e11i34
287,https://i.imgur.com/EzYI1Sp.png,Buccaneers,1,1574622533,e11i34
288,This offensive line is hot garbage,Falcons,1,1574622509,e11i34
289,How was that not offsides???,Falcons,5,1574622500,e11i34
290,Devin is so good.,Buccaneers,2,1574622498,e11i34
291,**SACKED!!**,Buccaneers,1,1574622462,e11i34
292,Still living off that 1-2 matchup on 2006.,Falcons,2,1574622426,e11i34
293,Our offense is one of the best this year?,Buccaneers,1,1574622378,e11i34
294,"On an unrelated note, Wentz has been pretty ass this year",Buccaneers,2,1574622341,e11i34
295,[Missing XPs: A Tampa Bay Tradition](https://i.imgur.com/ZajTBq5.png),Buccaneers,1,1574622326,e11i34
296,"""best rivalry in college football"" isnt the rivalry where Michigan has like one win over OSU in the last two decades. That's not even a rivalry.",Falcons,8,1574622323,e11i34
297,Godwins going to reach 1000 yds today. Evans probably not...coming into this game Godwin needed 120 and Evans needed 7 lol.,Buccaneers,3,1574622312,e11i34
298,Bill and McDaniels would make him elite,Patriots,1,1574622308,e11i34
299,I heard he was going to NE when tb retires.,Falcons,1,1574622272,e11i34
300,You're not wrong,Falcons,2,1574622267,e11i34
301,I think the Allstate mascot Mayhem plays for Tampa Bay,Buccaneers,1,1574622264,e11i34
302,Had to do it to em one time #ballocaust,Buccaneers,5,1574622247,e11i34
303,".....you sure about that?

You know he was the DC for their two titles.....",Buccaneers,1,1574622224,e11i34
304,"Nobody's going to care about that catch because of our teams, but that degree of difficulty was insane. Godwin is a beast",Falcons,5,1574622190,e11i34
305,Yes please.  As a dawg fan I would love his d at Florida.,Falcons,1,1574622186,e11i34
306,"DYK - There's a bikini wax called ""the Hitler?""",Buccaneers,1,1574622185,e11i34
307,And he almost his first XP earlier today. Cmon Matt.,Buccaneers,1,1574622185,e11i34
308,Godwin is elite.,Buccaneers,4,1574622184,e11i34
309,"Well, our game is making rookie QBs look like 10 year veterans. We're both terrible",Buccaneers,1,1574622180,e11i34
310,If Sheffield doesn't hit him that ball hits the ground... Jesus Christ come on,Falcons,1,1574622162,e11i34
311,Because you have one of the worst coaches in the NFL probably.,Patriots,1,1574622160,e11i34
312,Ahh yes the real Atlanta has shown up. Nice to see.,Falcons,1,1574622149,e11i34
313,"It was a good pass, it was deflected around the half yard line",Buccaneers,2,1574622143,e11i34
314,Still #gay4gay,Buccaneers,1,1574622127,e11i34
315,wow what a catch,Falcons,1,1574622119,e11i34
316,godwin deserves winston's game check today,Falcons,10,1574622117,e11i34
317,Anytime someone brings up Hitler Godwin gets a TD,49ers,2,1574622114,e11i34
318,Quinn come back to Gainesville and be our DC.,Buccaneers,1,1574622099,e11i34
319,Chris fucking Godwin,Buccaneers,4,1574622092,e11i34
320,Fuck yeah Chris Godwin,Buccaneers,4,1574622088,e11i34
321,"awful throw, amazing catch",Buccaneers,4,1574622087,e11i34
322,Fuck kickers,Buccaneers,3,1574622077,e11i34
323,12 szn.,Buccaneers,1,1574622076,e11i34
324,That's a bingo,Buccaneers,1,1574622070,e11i34
325,We are making the Bucs look like world beaters right now. Why do we always do this?,Falcons,2,1574622060,e11i34
326,#FIRE THE CANNONS SIX TIMES AT MY SHITTY FF LEAGUE,Buccaneers,3,1574622057,e11i34
327,wtf how.,Buccaneers,3,1574622053,e11i34
328,LOL WHAT A CATCH,Buccaneers,3,1574622046,e11i34
329,How the fuck did he catch that,49ers,3,1574622035,e11i34
330,HOW DID HE CATCH THAT,Buccaneers,3,1574622009,e11i34
331,[**TOUCHDOWN!**](https://i.imgur.com/t8FXNYn.gifv),Buccaneers,2,1574622009,e11i34
332,Everybody loves Chris.,Buccaneers,3,1574621999,e11i34
333,Aye Godwin and Winston!,Buccaneers,2,1574621961,e11i34
334,[deleted],,1,1574621917,e11i34
335,Godwin is so damn good,Buccaneers,3,1574621907,e11i34
336,https://i.imgur.com/Z8FQQgS.jpg,Buccaneers,1,1574621867,e11i34
337,Byron Leftwich has the look of a grown man who eats Laffy Taffy during team meetings,Buccaneers,2,1574621825,e11i34
338,You mean pad your INT stats?,Buccaneers,3,1574621790,e11i34
339,Kutty secretly throwing the game to his former team ,Falcons,1,1574621782,e11i34
340,I hope Jameis stays as a starter in the league  he’s so entertaining to watch,Patriots,5,1574621715,e11i34
341,I hate when I forget to switch over to Red Zone during commercial breaks.,Buccaneers,1,1574621700,e11i34
342,If there was any egregious issue that should get TD fired it should be our turd of an O-line that has been a consistent and glaring issue since 2016.,Falcons,4,1574621683,e11i34
343,Outside of the first two plays our defense is playing well. Jameis needs to calm down,Buccaneers,1,1574621668,e11i34
344,"Arians will probably leave. He's found the first QB that can't be taught anything apparently. However, the 3 are a package deal. 

I'm pretty sure that Licht has been told that if Winston is a bust, then Licht is gone, so he's been doing EVERYTHING he can to make it work. The last ditch effort was coaxing a retired coach out of retirement, ""To possibly make another great QB."" And Arians thought he could do it. However it's evident they can't. Don't be surprised if Winston doesn't get another contract, Arians leaves as a result and Licht gets the boot....not necessarily in that order.",Buccaneers,1,1574621644,e11i34
345,"I’m ok with keeping Quinnnof the team win out and do so convincingly, but for the love of god we need to let Koetter walk. The offense looks so predictable and out right disoriented at times.",Falcons,2,1574621626,e11i34
346,"lmao 3rd and long better run from shotgun, no one has every thought of that before.",Buccaneers,2,1574621615,e11i34
347,who would have thought our defense is competent when it doesnt have to worry about a ridiculously short field post turnover,Buccaneers,2,1574621589,e11i34
348,Jake Matthews is overrated,Falcons,1,1574621571,e11i34
349,Sack Barrett!!,Buccaneers,1,1574621566,e11i34
350,"Ah yes, this is the Falcons offense I know this year.",Falcons,4,1574621547,e11i34
351,Whose defense is this?,Buccaneers,2,1574621533,e11i34
352,*SACK BARRETT*,Buccaneers,2,1574621525,e11i34
353,i feel like that's what our coaches/coordinators have to remind jameis after walking off on a 3 and out,Buccaneers,2,1574621513,e11i34
354,Truly a generational talent,Falcons,1,1574621501,e11i34
355,"Both Dirk and Raheem are on your staff?

That's why you guys are 3-7 lmaooo",Buccaneers,4,1574621457,e11i34
356,"Announcer: Punting is better than a turnover

More at 11",Falcons,2,1574621430,e11i34
357,good stop,Falcons,2,1574621405,e11i34
358,"Here we can trade, you can suck every year. Forever.",Buccaneers,2,1574621396,e11i34
359,Both suck and both are busts. Jameis can actually move the ball though.,Buccaneers,5,1574621387,e11i34
360,i mean potato pototo,Buccaneers,2,1574621387,e11i34
361,"I should have gone to the game. It would have been a nice, quiet place to study and watch the Falcons play lol",Falcons,5,1574621372,e11i34
362,"I understand where you are coming from and I understand why you would want to embrace the tank. I want my team to win, though. I feel that in my bones. I don't care about that other stuff as much as I care about my team functioning as a team.",Falcons,1,1574621341,e11i34
363,Surface tablet,Falcons,5,1574621332,e11i34
364,[removed],,1,1574621306,e11i34
365,Why are we comparing two busts? Jameis might throw ints but at least he throws something.,Buccaneers,4,1574621306,e11i34
366,"Personally, I still like watching the Falcons win.",Falcons,1,1574621282,e11i34
367,jameis starin at the ipad like hes watchin tv lmao,Buccaneers,3,1574621281,e11i34
368,"I just wonder what the hell he was thinking with jump pass.  All that talent, he is so like Jeff George.",Falcons,2,1574621272,e11i34
369,[Replace Broncos with Bucs](https://i.imgur.com/K16hYbC.jpg),Buccaneers,2,1574621247,e11i34
370,"So far in their NFL careers

Jameis: 108 INTs in 67 games

Mariotta: 44 INT in 62 games",Buccaneers,1,1574621246,e11i34
371,This is seriously like watching a different team,Falcons,4,1574621156,e11i34
372,[deleted],,1,1574621152,e11i34
373,Jameis so far has thrown 20 INTs in 10 games and 1 quarter,Buccaneers,4,1574621131,e11i34
374,all i want for christmas is bruce arians and jason licht to be fired,Buccaneers,2,1574621080,e11i34
375,"I hate this franchise lol. Falcons may win out, miss the playoffs, end up with a middling draft pick that this front office will botch and Quinns awful ass will be back here next season and his seat will no longer be hot. Such a Atlanta sports thing to do, go from 1-7 and a shot at Chase Young to winning out for no fucking reason at all",Falcons,-11,1574621079,e11i34
376,"According to Winston's pattern, this drive should be another touchdown...",Falcons,7,1574621039,e11i34
377,Jesus Jameis is terrible. How did anyone see anything worthy in film or at the combine? I wonder if the team has lost faith and it's starting to get pissed. He nearly every game on our defenses shoulders with the amount of turnovers he makes...,Buccaneers,2,1574621030,e11i34
378,Are fumbles ok?,Falcons,5,1574621019,e11i34
379,Please Jameis don’t get intercepted,Buccaneers,3,1574620993,e11i34
380,"To be fair, we're winning right now despite throwing more ints than completions. They're not reflecting our current success in this game...yet.",Buccaneers,1,1574620958,e11i34
381,"Here comes the 81 yard TD to Mike, followed by another absolutely hilarious interception.",Buccaneers,4,1574620933,e11i34
382,"Jameis has interceptions

Matty Ice has converting 3rd downs with his legs",Falcons,1,1574620895,e11i34
383,He’s football’s answer to baseballs three true outcomes hitters,Bengals,2,1574620882,e11i34
384,Matty Vick baby!,Falcons,5,1574620878,e11i34
385,So who should we be drafting as our next qb bust?,Buccaneers,2,1574620867,e11i34
386,Schrodinger's Jameis,Buccaneers,2,1574620847,e11i34
387,"Jesus, look at that Matt Ryan speed, makes Mike Vick look slow",Falcons,3,1574620847,e11i34
388,God speed,Packers,5,1574620837,e11i34
389,But I was told Jameis only throws INTs because he throws the ball 50 times a game or he's unlucky.,Buccaneers,4,1574620825,e11i34
390,Now THAT is a stat line.,Falcons,3,1574620811,e11i34
391,Say what you will about Jameis but he provides the most number of exciting plays in the NFL,Seahawks,4,1574620797,e11i34
392,"Am i surprised? No. But disappointed? Sure.

I'm taking a shot everytime Winston throws a pick.",Buccaneers,5,1574620787,e11i34
393,Man I feel bad for Jameis. Straight up just feel bad for the man.,Falcons,4,1574620778,e11i34
394,🙄😂🙄,Buccaneers,1,1574620775,e11i34
395,How is it possible for a player to be so good and and yet twice as bad,Giants,3,1574620774,e11i34
396,Is Kaepernick still in Atlanta?,Buccaneers,3,1574620773,e11i34
397,"100 turnovers in 67 games, I'm not an expert but, wtf?",Broncos,7,1574620773,e11i34
398,"Screw the hates!

Jameis Winston is the answer!

The question is ""Which QB shouldn't be given another chance?""",Buccaneers,0,1574620757,e11i34
399,"Jameis so far, it's either a touchdown or an interception, nothing in between.",Falcons,2,1574620754,e11i34
400,Let's hope we can do something with the ball this time,Falcons,2,1574620744,e11i34
401,I hate him I hate him I hate him I hate him I hate him I hate him I hate him I hate him I hate him I hate him I hate him I hate him I hate him I hate him I hate him I hate him I hate him I hate him I hate him I hate him I hate him I hate him I hate him I hate him,Buccaneers,3,1574620742,e11i34
402,It's a Bucs life..,Buccaneers,4,1574620738,e11i34
403,No drops!,Jaguars,6,1574620735,e11i34
404,This game is peak Jameis.,Buccaneers,4,1574620730,e11i34
405,The duality of Jameis on full display,Redskins,5,1574620729,e11i34
406,Uninterceptable objects vs interceptable force,Falcons,5,1574620723,e11i34
407,Leeeeeesssssss goooooooo,Falcons,2,1574620717,e11i34
408,It's a bucs life,Buccaneers,2,1574620708,e11i34
409,Is he 1/3 with 2 INTS and a TD? WTF,Buccaneers,12,1574620708,e11i34
410,Lol,Jaguars,2,1574620704,e11i34
411,who was posting about turnovers not being a reflection of a quarterbacks success?,Buccaneers,2,1574620697,e11i34
412,2 Madden-like INTs from Winston.  Not good.,,2,1574620691,e11i34
413,#I want to get off Mr. Jameis' Wild Ride,Buccaneers,5,1574620679,e11i34
414,Hahahahahahaahahahahahahahhahahahahahahahahahahahahahahahahahahahahahahahahahahahahahahahah!!!!!,Buccaneers,6,1574620665,e11i34
415,"Division game, it blows my mind that our own fans thought this was going to be give me.  
We won 3 games, guys...  
This will be another grinder.",Falcons,4,1574620664,e11i34
416,WINSTON SUCKS,Buccaneers,4,1574620647,e11i34
417,Jameis giveth and Jameis taketh away...,Buccaneers,4,1574620646,e11i34
418,Hopefully this just means we know the season is over so the coaching staff put all their effort into game planning for the saints on Thanksgiving,Falcons,1,1574620645,e11i34
419,Oh no...  It keeps happening.,Falcons,2,1574620643,e11i34
420,Winston is historically bad,Buccaneers,3,1574620572,e11i34
421,Dean is a fucking STUD,Buccaneers,3,1574620559,e11i34
422,Oh no we suck again!,Falcons,5,1574620514,e11i34
423,.,Falcons,1,1574620505,e11i34
424,Neither does ours,Falcons,1,1574620491,e11i34
425,.,Jaguars,2,1574620474,e11i34
426,Deep voice ref,Buccaneers,3,1574620440,e11i34
427,Can someone please block 58 please.,Falcons,1,1574620416,e11i34
428,We need to draft a rb,Falcons,2,1574620392,e11i34
429,JULIOOOOOOOOOOOOOOOO,Falcons,4,1574620346,e11i34
430,That’s my Julio,Falcons,4,1574620293,e11i34
431,Here we go... the shootout begins,Buccaneers,1,1574620279,e11i34
432,I really like the film analysis from this broadcast. I wish we had more of that,Buccaneers,1,1574620273,e11i34
433,[deleted],,1,1574620228,e11i34
434,Godwin absolutely crushing it in my flex spot this year.,Browns,1,1574620222,e11i34
435,And a 71 yard touchdown on his fourth.  I still don't know what we should do with him.,Buccaneers,1,1574620184,e11i34
436,Ultimate coin flip offense and defense,Buccaneers,1,1574620147,e11i34
437,Nah that was an amazing pass. Our guys did their job.,Falcons,4,1574620129,e11i34
438,Get this man more alcohol!,Buccaneers,7,1574620122,e11i34
439,"That’s an absolutely disgusting pitch and catch by Winston and Godwin lol. 

The ups and downs continue.",Buccaneers,6,1574620094,e11i34
440,"That was a beautiful pass, hope he keeps it up",Buccaneers,2,1574620075,e11i34
441,I poured a shot and the Bucs scored...,Buccaneers,6,1574620064,e11i34
442,Our team doesn't make any fucking sense.,Buccaneers,7,1574620057,e11i34
443,Jameis please just be either bad or good I cant take this shit anymore lol,Buccaneers,7,1574620055,e11i34
444,"I need Jameis to end the year with 5000 yards, 35 tds and 30 ints",Patriots,5,1574620045,e11i34
445,Fuckin Winston. Why can't you just play like that every time?,Buccaneers,5,1574620037,e11i34
446,Of course it's going to be to the Buccs lol,Falcons,5,1574620032,e11i34
447,Wow and all of a sudden they have the lead,Falcons,5,1574620018,e11i34
448,That was sick.,Buccaneers,3,1574620017,e11i34
449,And the defense we all know and love is back.,Falcons,3,1574620015,e11i34
450,"Jameis, you're a god damn enigma.",Buccaneers,5,1574620010,e11i34
451,Good pass Jameis!,Buccaneers,4,1574620009,e11i34
452,Still a stupid ass throw.,Buccaneers,-2,1574620007,e11i34
453,Biscuit baby!,Buccaneers,4,1574619989,e11i34
454,Holy shit,Buccaneers,5,1574619983,e11i34
455,That was beautiful,Steelers,5,1574619978,e11i34
456,"I feel like our offense is nothing but outs, ins and hitches and we just toss it to mike or Godwin and hope they make a play regardless of what the defense is doing.",Buccaneers,2,1574619948,e11i34
457,[**FIRE THE CANNONS!**](https://i.imgur.com/JOJ8L1c.jpg),Buccaneers,4,1574619943,e11i34
458,The streak... is over.,Falcons,4,1574619926,e11i34
459,Sounds about right,Buccaneers,3,1574619713,e11i34
460,We will lose on a last second fg again,Buccaneers,2,1574619702,e11i34
461,I’ll allow it.,Falcons,3,1574619684,e11i34
462,[deleted],,1,1574619663,e11i34
463,No I have him in my fantasy line up 😂,Buccaneers,0,1574619655,e11i34
464,1 TD with 4 INTs,Buccaneers,8,1574619652,e11i34
465,How many TDs?,Falcons,2,1574619616,e11i34
466,Nice stop by the D. I can’t remember the last time I’ve seen a reciever false start like that lol,Buccaneers,3,1574619609,e11i34
467,Winston will still throw for 400 yards,Buccaneers,5,1574619579,e11i34
468,"In no man's land, go for it",Falcons,2,1574619553,e11i34
469,Same as in London. Their opening script must have something that isnt changing and teams have it figured out.,Buccaneers,1,1574619547,e11i34
470,Wao,NFL,2,1574619531,e11i34
471,"Announcers spent about five minutes leading up to it talking about how bad he is with turnovers. First throw, interception.",Jaguars,2,1574619519,e11i34
472,Yes,Falcons,3,1574619509,e11i34
473,I mean honestly would Kaepernick be that much of a downgrade from him,Saints,1,1574619499,e11i34
474,Our run blocking is so trash,Falcons,3,1574619498,e11i34
475,We held the saints to 0 touchdowns,Falcons,5,1574619498,e11i34
476,Brees is such a good QB. Did you see how he excellently handed the ball to Murray. Such a talent,Falcons,1,1574619469,e11i34
477,Winston threw a pick on his first throw?,NFL,8,1574619425,e11i34
478,"I've fucking tried, but I can't defend Jameis anymore. This is fucking absurd.",Jaguars,3,1574619410,e11i34
479,Lmao you're playing the bucs shut up,Buccaneers,-1,1574619396,e11i34
480,"Someone should tell Christmas is one day in December, not everyday from September to December",Falcons,3,1574619381,e11i34
481,"I’d rather have confidence in this team’s talent and (new) coaching than a TD high draft pick. Therefore, I want to win games",Falcons,3,1574619354,e11i34
482,[removed],,1,1574619346,e11i34
483,I think that's happened multiple times too.,Buccaneers,1,1574619332,e11i34
484,I’m starting to believe he is at this point.,Falcons,2,1574619331,e11i34
485,"Our D is legit.

 I've held off believing that for the past few games because we always seem to ""rise up"" to the level of the team we are playing. This is for real, though.",Falcons,5,1574619314,e11i34
486,"Death, taxes, Jameis ints.",Browns,4,1574619310,e11i34
487,As if TD can do anything with good draft picks anyway,Falcons,1,1574619302,e11i34
488,Anotha One,Cowboys,1,1574619284,e11i34
489,Does he do it on purpose lol,Patriots,3,1574619283,e11i34
490,"Miami, can we have Fitz back?",Buccaneers,2,1574619267,e11i34
491,"As soon as I tune into the game a pick by Jamies, lol",Falcons,11,1574619265,e11i34
492,First throw too.,Falcons,2,1574619251,e11i34
493,Maybe I should have played the Falcons D this week in Fantasy..,Falcons,2,1574619249,e11i34
494,That’s not even defendable,Buccaneers,1,1574619247,e11i34
495,Truuuu!,Falcons,3,1574619242,e11i34
496,Lmfao we’re going to win 5 out of the next 6 and barely miss the playoffs and not even get a good draft pick,Falcons,6,1574619237,e11i34
497,[removed],,1,1574619224,e11i34
498,Lmao I'm dead,Falcons,7,1574619217,e11i34
499,Fucking bench him lmao.,Buccaneers,7,1574619216,e11i34
500,Wtf,Buccaneers,2,1574619199,e11i34
501,Jameis consistently throwing a pick on our opening drive is basically a meme at this point.,Buccaneers,9,1574619198,e11i34
502,Peterman with a cannon,Buccaneers,2,1574619189,e11i34
503,Winston is trash.,Buccaneers,3,1574619178,e11i34
504,[deleted],,1,1574619170,e11i34
505,🙁,Buccaneers,1,1574619170,e11i34
506,17 turnovers in 5 games is ridiculous and horrible.,Buccaneers,6,1574619126,e11i34
507,"Camera work absolutely sucks, they only panned to the endzone following the thrown ball.  
Show what the receivers and secondary are doing as the play unfold maybe?",Falcons,2,1574619043,e11i34
508,How does white not know to drop deep middle in cover two,Buccaneers,1,1574619031,e11i34
509,Our defense is so ducking weird and bad,Buccaneers,2,1574618969,e11i34
510,That's a TD of he passed it to Gage,Falcons,2,1574618958,e11i34
511,"Our Kicker is named Gay, the Falcons Young hoe lol",Buccaneers,5,1574618880,e11i34
512,Held them to a FG,Buccaneers,1,1574618850,e11i34
513,"Jeeze, ref, could you let him hold Shaq a little longer?",Buccaneers,1,1574618839,e11i34
514,We suck,Buccaneers,1,1574618823,e11i34
515,What is this play calling?,Falcons,1,1574618758,e11i34
516,There's the bucs defense,Falcons,1,1574618753,e11i34
517,I already don't like this game.,Buccaneers,4,1574618729,e11i34
518,Good point.,Falcons,1,1574618726,e11i34
519,That’s so weird I was thinking the exact same thing.,Falcons,3,1574618706,e11i34
520,Let’s go Bucs!,Buccaneers,1,1574618681,e11i34
521,"What is coverage? 

-Bucs D",Buccaneers,3,1574618676,e11i34
522,Game hasn't started yet and shit-talk is pointless since we can see each other's record this season.,Falcons,5,1574618648,e11i34
523,"Wow, thread has been open half an hour and has less than 15 comments.",Falcons,2,1574618392,e11i34
524,Football.,Buccaneers,2,1574618311,e11i34
525,Packed house for this NFC South pillow fight.,Falcons,4,1574618202,e11i34
526,https://i.imgur.com/xcaxICS.png,Buccaneers,0,1574618118,e11i34
527,Battle of the bowels.,Falcons,2,1574618083,e11i34
528,Same,Falcons,1,1574618059,e11i34
529,"Another Sunday, another which JW is going to show up today...",,1,1574617597,e11i34
530,https://i.imgur.com/KPsyizd.jpg,Buccaneers,0,1574617300,e11i34
531,no,Buccaneers,1,1574617249,e11i34
532,"I hate this team, why am I here.",Buccaneers,8,1574617242,e11i34
533,**TAMPAAAAAAAAAAAA**,Buccaneers,2,1574617209,e11i34
534,fuck the refs!,Raiders,2,1574617007,e11i34
535,Can u watch on phone,,1,1574616925,e11i34
536,Lets do this fellas,Falcons,1,1574616688,e11i34
