,body,author_flair_text,score,created_utc,link_id
2807,"lmao shut the hell up, you beat the Redskins",Cowboys,7,1576450437,eb4jgo
2808,Lol sure,Cowboys,7,1576450437,eb4jgo
2809,I’d rather pay Dak,Cowboys,1,1576450435,eb4jgo
2810,god the rams fucking suck,Giants,1,1576450434,eb4jgo
2811,Just making sure their new kicker gets lots of reps. What a leader!,Cowboys,1,1576450434,eb4jgo
2812,Wether he’s worth that much or not I’m glad he got it. Really fun to watch play.,Cowboys,1,1576450434,eb4jgo
2813,Eagles fans are malding in their basement right now,Cowboys,-1,1576450434,eb4jgo
2814,Aikman nutting on air over the Cowboys performance.,Broncos,3,1576450434,eb4jgo
2815,We still gotta kick off the second half after already kicking off the first. Feels shitty despite the score.,Cowboys,1,1576450433,eb4jgo
2816,Haha they had to come from behind to win their game... against the redskins.,Cowboys,1,1576450432,eb4jgo
2817,Troy just finished.,NFL,0,1576450431,eb4jgo
2818,Imagine losing to an NFC East team.,Eagles,15,1576450431,eb4jgo
2819,[deleted],,2,1576450431,eb4jgo
2820,[deleted],,1,1576450431,eb4jgo
2821,"that kid got a game ball from zeke, what a legendary experience that must be",Cowboys,3,1576450431,eb4jgo
2822,I love you Cowboys! Now if you'll excuse me I'm going to go vomit.,Seahawks,4,1576450430,eb4jgo
2823,Not even a little bit.,Cowboys,1,1576450430,eb4jgo
2824,Would you take SB in exchange for 10 more years of garrett?,Cowboys,3,1576450430,eb4jgo
2825,Lolrams,Seahawks,3,1576450429,eb4jgo
2826,[deleted],,-1,1576450428,eb4jgo
2827,This better be the halftime speech of the decade,Eagles,2,1576450427,eb4jgo
2828,[deleted],,1,1576450426,eb4jgo
2829,We came to play today... Still hope Garrett gets fired.,Cowboys,10,1576450425,eb4jgo
2830,This is strange and I don't know what to think or feel.,Cowboys,8,1576450424,eb4jgo
2831,I know Philly isn't home to the smartest people but are you actually watching,Texans,1,1576450423,eb4jgo
2832,you can see why they didn't pay Dak yet.,Patriots,-1,1576450423,eb4jgo
2833,[removed],,1,1576450423,eb4jgo
2834,When your boss humiliates you at work so you go home and take out your anger and frustration on your son. That's this game.,Vikings,3,1576450422,eb4jgo
2835,Eagles fans in shambles,Cowboys,6,1576450420,eb4jgo
2836,"Can’t figure out if Dallas decided to be really good this week or if the Rams decided to be really bad this week.

I guess it could be both.",Texans,3,1576450419,eb4jgo
2837,37-10,Cowboys,8,1576450416,eb4jgo
2838,Cowboys should surprise onside kick to start the 2nd half.,Bills,3,1576450416,eb4jgo
2839,Can’t wait to beat the brakes off the eagles next week,Cowboys,1,1576450416,eb4jgo
2840,Damn the Rams are bad.,Eagles,-2,1576450415,eb4jgo
2841,Elliott was right there lol. It's not intentional grounding if the ball is by a receiver.,Cowboys,2,1576450415,eb4jgo
2842,Where has this team been all year,Cowboys,3,1576450414,eb4jgo
2843,Perchance this might quell those people saying that the NFCE doesn’t deserve a playoff spot and should just hand it to whoever has the best record.,Cowboys,1,1576450414,eb4jgo
2844,So they called back a Dak interception and a third down stop lmao. Imagine thinking this isn't fixed,Eagles,-25,1576450414,eb4jgo
2845,Its been too long of sucking and I can’t tell. I live in LA so I am gonna say : Are we sure the Rams are good?!,Cowboys,2,1576450414,eb4jgo
2846,Sooo maybe the rams probably want their first back,Packers,1,1576450413,eb4jgo
2847,"r/cowboys: Zeke is washed up, Pollard should be starting",Cowboys,2,1576450413,eb4jgo
2848,He was literally grabbing his facemask,Cowboys,1,1576450413,eb4jgo
2849,Jerry will use this game as an excuse to extend The Clapper until 2025.,Patriots,1,1576450412,eb4jgo
2850,Any update on the 2nd half kickoff?,Cowboys,2,1576450412,eb4jgo
2851,"What a concept, we run, we score. Why did it take them 4 plays to call a run? Get it Zeke!",Cowboys,1,1576450410,eb4jgo
2852,WOOOOOOOOOOOOOOOOO!!!!!!,Cowboys,1,1576450410,eb4jgo
2853,Lol he handled it better than me and Im in my 20s,Cowboys,1,1576450410,eb4jgo
2854,CoWbOyS aRenT tAlEnTeD,Patriots,5,1576450408,eb4jgo
2855,Naw he’s still gone,Cowboys,3,1576450407,eb4jgo
2856,See you soon!,Cowboys,4,1576450407,eb4jgo
2857,The Cowboys season starts right now.,Ravens,3,1576450405,eb4jgo
2858,[deleted],,-15,1576450403,eb4jgo
2859,That kid is going to be the talk of Mrs. Baker's kindergarten class this week.,Steelers,3,1576450403,eb4jgo
2860,You love to see it,,3,1576450403,eb4jgo
2861,Wait what,Cowboys,2,1576450403,eb4jgo
2862,"Game over man, game over",Cowboys,0,1576450402,eb4jgo
2863,"I know the sub and all, but I feel like Zeke is making some fantasy football players pretty damn happy",Cowboys,0,1576450401,eb4jgo
2864,I guess there isn’t as many eagles fans here now after that amazing victory of theirs,Cowboys,6,1576450400,eb4jgo
2865,It's about fucking time.,Cowboys,2,1576450400,eb4jgo
2866,Way to go rams. You ruined everybody's day,Eagles,8,1576450400,eb4jgo
2867,yeah it should be fun,Eagles,2,1576450399,eb4jgo
2868,Dak chose to kick because he knew it would be a beat down anyways,Cowboys,2,1576450398,eb4jgo
2869,I don't.,Bears,2,1576450398,eb4jgo
2870,People are going to complain about ReFs but like you can’t do that shit lmao,Cowboys,5,1576450396,eb4jgo
2871,Rams are fucking pathetic. gg Cowboys,Eagles,2,1576450394,eb4jgo
2872,We are gonna embarrass the eagles next week,Cowboys,1,1576450394,eb4jgo
2873,Zeke was literally right there,Cowboys,0,1576450393,eb4jgo
2874,"Funny how as soon as unconfirmed meetings with Urban Meyer start happening, the Cowboys go up 28-7 in the first half against a good team.",Cowboys,3,1576450393,eb4jgo
2875,I had resigned myself to want the cowboys to lose out to get a better draft pick and fire garret and then they pull this shit. This team always disappoints me.,,2,1576450393,eb4jgo
2876,At least we have the Lakers amirite SoCal bros?,Lions,1,1576450392,eb4jgo
2877,They get the ball again 2nd half,,1,1576450392,eb4jgo
2878,"28-7, as expected",Cowboys,4,1576450391,eb4jgo
2879,Eagles fans slowly disappearing now,Cowboys,1,1576450391,eb4jgo
2880,Imagine having 28 points scored on you by the Cowboys? Lmao,Cowboys,12,1576450390,eb4jgo
2881,My 6-10 playoff team dreams :(,Chiefs,3,1576450388,eb4jgo
2882,Cowboys fans ready to talk shit when their most relevant wins of the past 20 years are all regular season,Eagles,-16,1576450387,eb4jgo
2883,Zeke was within five yards lmao,Cowboys,3,1576450387,eb4jgo
2884,Rams single handedly saving Garrett's job,Eagles,9,1576450384,eb4jgo
2885,That guys face lit up like a Christmas tree when Zeke gave that kid the ball.,Cowboys,6,1576450383,eb4jgo
2886,Would be nice to have a 21 point lead AND get the ball after halftime.,Cowboys,7,1576450382,eb4jgo
2887,"Cowboys said, ""Fuck it, have the ball to start both halves, you'll need it""",Cowboys,10,1576450380,eb4jgo
2888,Guess I can go back to watching season two of the Runaways on Hulu,,2,1576450380,eb4jgo
2889,What a dominant half from the cowboys..I was not expecting this at all,Eagles,6,1576450379,eb4jgo
2890,[deleted],,-13,1576450377,eb4jgo
2891,Let's play this way again next week and clinch the NFC East with an 8-7 record.,Cowboys,10,1576450377,eb4jgo
2892,wym watching goff be bad is always fun,Seahawks,4,1576450376,eb4jgo
2893,"See ya next weak cowboys!

Rams giving up two 1sts for Ramsey was an awful decision.",Eagles,3,1576450375,eb4jgo
2894,That was really nice of Zeke,Packers,6,1576450375,eb4jgo
2895,Def didn’t expect this,Cowboys,3,1576450374,eb4jgo
2896,Up 28-7 and we get the ball to start the 2nd half. Nothing can stop us...... oh wait.,Cowboys,8,1576450374,eb4jgo
2897,Troy is out of milk,Cowboys,2,1576450373,eb4jgo
2898,[deleted],,1,1576450372,eb4jgo
2899,I wonder when that single missed DPI call is going to stop resulting in the entire league of refs burying us in yellow.,Rams,3,1576450371,eb4jgo
2900,You ready for next week bby,Cowboys,5,1576450369,eb4jgo
2901,"So, question.  Are the Rams really this bad, or Dallas just FINALLY pulling their heads out of their asses and playing like they should have all year?",Cowboys,8,1576450367,eb4jgo
2902,They just drew a dick lol,Cowboys,2,1576450367,eb4jgo
2903,I thought they were gonna cal Roughing the passer on Matthews.,Eagles,2,1576450366,eb4jgo
2904,Dallas showed up to a game.,Patriots,7,1576450366,eb4jgo
2905,WHERE THE FUCK HAS THIS TEAM BEEN ALL YEAR LONG?!!,Cowboys,10,1576450365,eb4jgo
2906,As a buckeye I think Zeke was worth the contract. What do cowboys fans think right now?,,2,1576450363,eb4jgo
2907,"I mean, Did you really think Sean Lee had that in him. I have no idea if lee has been hurt or whatever, you would know more than me, I did not even see him doing that. It was majestic.",Titans,3,1576450363,eb4jgo
2908,Cute handoff there,Patriots,4,1576450361,eb4jgo
2909,Rams season looking to be over. How much did Goff make to be a bottom 15 QB again?,,3,1576450360,eb4jgo
2910,"So we're gashing them on the ground, and then we abandon it after Lee gifts us a beautiful int?",Cowboys,1,1576450360,eb4jgo
2911,Nice no flag on intentional grounding.,Giants,-11,1576450360,eb4jgo
2912,The kid was so indifferent lmao,Cowboys,2,1576450359,eb4jgo
2913,what a half Troy is unzipped,NFL,6,1576450357,eb4jgo
2914,That kid was SHOOK.,Patriots,10,1576450354,eb4jgo
2915,"I thought he was stopped. 
😮",Cowboys,3,1576450353,eb4jgo
2916,Goff is turrble,Eagles,4,1576450351,eb4jgo
2917,[deleted],,-1,1576450350,eb4jgo
2918,"What!?   
Weak call",Eagles,-11,1576450347,eb4jgo
2919,"You know that was an obvious hand to the face penalty right? Lmao, he was grabbing his facemask",Cowboys,6,1576450346,eb4jgo
2920,Eagles fans still high on barely beating Redskins?,Cowboys,7,1576450345,eb4jgo
2921,Literally the WWE lol,Eagles,3,1576450344,eb4jgo
2922,and then clear penalties were shown in the replay.,Cowboys,3,1576450344,eb4jgo
2923,r/nfl not having a good night tonight,Cowboys,20,1576450344,eb4jgo
2924,What is dead may never die,Cowboys,7,1576450343,eb4jgo
2925,So this is the talent they’ve been talking about.,Patriots,3,1576450343,eb4jgo
2926,Zeke “We don’t need the ball to start” Elliott,Cowboys,6,1576450341,eb4jgo
2927,Elliot! Elliott!!,NFL,1,1576450341,eb4jgo
2928,"No no no, we definitely do. When our game plan in the second half changes to running only twice, despite the big lead, we will definitely need that possession.",Cowboys,1,1576450341,eb4jgo
2929,Awwww,Cowboys,1,1576450341,eb4jgo
2930,[deleted],,3,1576450338,eb4jgo
2931,Fat Anderson can’t save you now,Cowboys,3,1576450338,eb4jgo
2932,LETS FUCKING GO!!!!,Cowboys,1,1576450338,eb4jgo
2933,That’s definitely hands to the face lol,Cowboys,5,1576450336,eb4jgo
2934,Rams are so fucking bad lmao,Eagles,4,1576450336,eb4jgo
2935,Lol Donald,Cowboys,1,1576450335,eb4jgo
2936,Does anyone know if the sun is visible from the field,,2,1576450334,eb4jgo
2937,Oh are the cowboys back?,Chiefs,3,1576450333,eb4jgo
2938,"Well, at least we get the ball in the second half",Rams,1,1576450330,eb4jgo
2939,ZEKE!!!!!!!,Cowboys,0,1576450330,eb4jgo
2940,Rams are downby 14 and about to be down more and kick off to start the 2nd half but for some reason they don't use timeouts in order to try to get a fg or something. So dumb,Titans,1,1576450325,eb4jgo
2941,They had hands to the face on two of our linemen you idiot,Cowboys,3,1576450322,eb4jgo
2942,"Don't worry Mr. Cameraman, if you don't like that shot I hear you can just delete it.",Cowboys,4,1576450322,eb4jgo
2943,Come on that penalty was obvious as fuck,Cowboys,4,1576450322,eb4jgo
2944,Tdddddd dallas,Cowboys,0,1576450321,eb4jgo
2945,"""Half the distance to the goal auto first down"" penalties never sit right with me.",Texans,5,1576450319,eb4jgo
2946,We have been inconsistent week to week all year. Nothing new here.,Rams,2,1576450315,eb4jgo
2947,Can’t wait to see how he reacts to that play.,Cowboys,1,1576450314,eb4jgo
2948,Didnt see it live so i was expecting a hold,Cowboys,1,1576450314,eb4jgo
2949,"Garret, I think we should kick",Cowboys,2,1576450312,eb4jgo
2950,Why does Fox think we like looking at the sun?,,2,1576450311,eb4jgo
2951,weak,Eagles,-2,1576450310,eb4jgo
2952,It’s like JJ Abrams designed it,Cowboys,5,1576450307,eb4jgo
2953,"Well, I guess Goff literally couldn't see",Rams,1,1576450305,eb4jgo
2954,That was the most dramatic running out of the clock I’ve ever seen,Cowboys,3,1576450304,eb4jgo
2955,Jerruh gave the refs a big ole paycheck tonight!,Eagles,-21,1576450300,eb4jgo
2956,honestly same. That number is absurd to me considering out track record,Cowboys,2,1576450299,eb4jgo
2957,[deleted],,-32,1576450293,eb4jgo
2958,I don't wanna hear anything about a better team missing out on a playoff spot after this,Eagles,5,1576450292,eb4jgo
2959,Get matthews out of there.,Rams,1,1576450290,eb4jgo
2960,"God, is that you?",,5,1576450287,eb4jgo
2961,That endzone camera not using hoodman is crazy but not even having the shade on the viewfinder is egregious.  I can’t believe that guy.   I use the shade even when it’s night,Cowboys,4,1576450286,eb4jgo
2962,we can never seem to do it but its always fun to see other teams show what goff really is,Seahawks,4,1576450285,eb4jgo
2963,It's probably good Goff didn't get a ring. He's the next Flacco,Packers,7,1576450285,eb4jgo
2964,You had to freaking say it... smh,,1,1576450284,eb4jgo
2965,lol at the fucking sun,,7,1576450283,eb4jgo
2966,Wowwwww,Cowboys,1,1576450282,eb4jgo
2967,So true LOL,Cowboys,5,1576450281,eb4jgo
2968,lol Rams wow,Cowboys,2,1576450281,eb4jgo
2969,This game is the exact reverse of last week. Cowboys definitely hungrier so far.,Seahawks,1,1576450278,eb4jgo
2970,More impressed that we got a takeaway.,Cowboys,3,1576450277,eb4jgo
2971,[deleted],,7,1576450269,eb4jgo
2972,Wow old town road that dj definitely doesn’t have a generic playlist at all definitely not no sir,Lions,1,1576450268,eb4jgo
2973,I hear expected to miss 2 weeks :( I live like 15 mins from the arena so I was thinking about going to the game too.,Cowboys,1,1576450268,eb4jgo
2974,It'd be nice to get the ball first after the half too,Cowboys,3,1576450266,eb4jgo
2975,I’m surprised it’s that many,Cowboys,1,1576450265,eb4jgo
2976,"So the Rams look like an all decade team against 10-2 Seattle and are now getting dumped on by a Cowboys team that's been terrible the last month or so.

Did Jeff Fisher sneak back in as coach?",49ers,9,1576450265,eb4jgo
2977,Yeah this is embarrassing. Especially after playing so well vs Hawks,Rams,1,1576450265,eb4jgo
2978,[deleted],,1,1576450260,eb4jgo
2979,"Garrett: ""I am inevitable.""",Cowboys,1,1576450256,eb4jgo
2980,[removed],,1,1576450255,eb4jgo
2981,"Now that Garrett's job is on the line, the Cowboys will make the Super Bowl. That man doesn't know how to get fired.",Bears,17,1576450251,eb4jgo
2982,"hey you get used to it, weve had 10 seasons ended by jason garrett...",Cowboys,2,1576450249,eb4jgo
2983,The amount of glare in that stadium is comical,Texans,9,1576450247,eb4jgo
2984,4 Down territory for Garret?,NFC,1,1576450242,eb4jgo
2985,Ahh yes The horse song,Cowboys,2,1576450238,eb4jgo
2986,One handed touch down catch form Witten and a pick by Sean Lee. Is it 2016?,,8,1576450237,eb4jgo
2987,Sean Lee pick.,Cowboys,2,1576450236,eb4jgo
2988,dont worry. the vikings are gonna lose their next two,Bears,1,1576450235,eb4jgo
2989,Wtf I can’t see,Patriots,3,1576450235,eb4jgo
2990,"Dak trying to be like Lamar our there with the sidearms, except his are shit",Cowboys,7,1576450230,eb4jgo
2991,Sean Lee is the 🐐,Cowboys,2,1576450228,eb4jgo
2992,Not really before or after,,9,1576450226,eb4jgo
2993,Guys don't get too excited but we might actually beat a team with a winning record,Cowboys,4,1576450224,eb4jgo
2994,"I think the people that are most impressed with Sean Lee's interception, is well Cowboy fans. Dude has been playing stiff all year.",Titans,0,1576450222,eb4jgo
2995,That sun though,Cowboys,1,1576450220,eb4jgo
2996,The fuck happened. How we get the ball back?,Cowboys,1,1576450216,eb4jgo
2997,Redemption game for the old guys Lee and Witten,Cowboys,4,1576450216,eb4jgo
2998,"6 INTs on the year for our defense. We're fuckin coming alive, boys",Cowboys,7,1576450216,eb4jgo
2999,Just run it god damn.,Cowboys,4,1576450211,eb4jgo
3000,Where you at u/scootermagruder,Cowboys,3,1576450208,eb4jgo
3001,"""Fuck your 2nd half kickoff"" - Cowboys, probably",Seahawks,8,1576450208,eb4jgo
3002,Jason Witten and Sean Lee are still my dads,Cowboys,6,1576450207,eb4jgo
3003,You love to see it,Cowboys,1,1576450206,eb4jgo
3004,Goff is one expensive liability.,,2,1576450200,eb4jgo
3005,Keel keel kill kill,Cowboys,1,1576450196,eb4jgo
3006,110 million guaranteed might've uh.. um. Might've been a bit much..,Cardinals,2,1576450196,eb4jgo
3007,If Lee didn't pick that off the next defender in line would have. What was Goff seeing on that play?,Rams,6,1576450193,eb4jgo
3008,the big brain cowboys have it figured out. if i were the rams i would simply move into the nfc east,Cowboys,1,1576450192,eb4jgo
3009,I will never get used to Clay Matthews in a rams jersey,Lions,2,1576450190,eb4jgo
3010,Holy shit Jared Goff is trash.,Cowboys,10,1576450184,eb4jgo
3011,Truth,Cowboys,13,1576450183,eb4jgo
3012,I love Sean Lee so much,Cowboys,5,1576450183,eb4jgo
3013,Thanks Rams!,Eagles,2,1576450183,eb4jgo
3014,Id rather our season not end with the fucking cowboys. I'd rather the Seahawks or Niners have taken us out. Not a fucking Jason Garrett led team.,Rams,5,1576450182,eb4jgo
3015,This is the power of 8-8,Cowboys,9,1576450180,eb4jgo
3016,Hot take: The Rams just suck and Dallas should be winning.,Packers,2,1576450180,eb4jgo
3017,This game is over.,Eagles,1,1576450179,eb4jgo
3018,[deleted],,1,1576450179,eb4jgo
3019,Dak going full Cam,Cowboys,1,1576450177,eb4jgo
3020,I thought turnovers were illegal,Cowboys,2,1576450175,eb4jgo
3021,Dude let the Rams have the ball again in the second half. They obviously need it lmao,Cowboys,4,1576450175,eb4jgo
3022,Sean Lee tryn'a remind a mo' fucka,Cowboys,2,1576450172,eb4jgo
3023,I read fans earlier saying Lee was done.,Cowboys,2,1576450171,eb4jgo
3024,Nice catch!,Eagles,2,1576450170,eb4jgo
3025,What a terrible throw.,Bears,1,1576450170,eb4jgo
3026,All of our old guys are making big plays today.,Cowboys,4,1576450170,eb4jgo
3027,"Is Sean Lee Playing?

Sean Lee’s playing!",Cowboys,6,1576450170,eb4jgo
3028,[deleted],,1,1576450165,eb4jgo
3029,Lee actually stole the pick from smith,Patriots,1,1576450164,eb4jgo
3030,Were Cobbs hands a problem at GB?,Cowboys,5,1576450162,eb4jgo
3031,"Holding on Whitworth again, oye vey",Cowboys,2,1576450161,eb4jgo
3032,SNAKE LEE BABY!,Cowboys,2,1576450160,eb4jgo
3033,Yikes. Terrible vision,Cowboys,2,1576450159,eb4jgo
3034,Horrible throw,Patriots,2,1576450157,eb4jgo
3035,[deleted],,1,1576450154,eb4jgo
3036,how did we lose to this team just last week?,Seahawks,2,1576450151,eb4jgo
3037,O_O and interception say whhhhhhhhhhhat,Cowboys,3,1576450151,eb4jgo
3038,Pass interference?,Cowboys,2,1576450149,eb4jgo
3039,"If Eagles and Cowboys fans can agree on 1 thing, it's that Jared Goff is not the best QB from the 2016 draft.",Eagles,63,1576450148,eb4jgo
3040,[removed],,0,1576450147,eb4jgo
3041,Fucking NICE,Cowboys,3,1576450146,eb4jgo
3042,"Holy FUCKING shit, LEE!!!!!!!!!",Cowboys,3,1576450146,eb4jgo
3043,lee with some TE moves,,3,1576450146,eb4jgo
3044,[deleted],,0,1576450143,eb4jgo
3045,old man pick,Cowboys,1,1576450141,eb4jgo
3046,SEAN LEE! WOW WHAT A PLAY YOU STILL GOT IT MAN!,Cowboys,2,1576450138,eb4jgo
3047,And.......... we suck,Rams,2,1576450136,eb4jgo
3048,SEAN LEE BABYYYY,Cowboys,3,1576450135,eb4jgo
3049,Just run it!!!,Cowboys,3,1576450134,eb4jgo
3050,"Thank you Sean Lee, very cool!",Cowboys,5,1576450133,eb4jgo
3051,Goff is sooooo  bad lol,Cowboys,4,1576450132,eb4jgo
3052,WHAT THE FUCK??? What's that called when the defense catches the ball???,Cowboys,8,1576450131,eb4jgo
3053,Lee an old school linebacker. A rare breed.,Buccaneers,6,1576450131,eb4jgo
3054,Dak pls stop with those side arm slings,,3,1576450131,eb4jgo
3055,lol LEE,Cowboys,1,1576450130,eb4jgo
3056,"Yeah.... Looks like he has been lighting up before the game the past few years. 

The man has my respect",Cowboys,1,1576450130,eb4jgo
3057,"Holy shit, Sean. Nifty run back. The old men are coming out to play today.",Cowboys,5,1576450130,eb4jgo
3058,Skip Bayless bout to go crazy tomorrow,Texans,2,1576450129,eb4jgo
3059,LEE!!,,1,1576450129,eb4jgo
3060,Nope,Cowboys,8,1576450128,eb4jgo
3061,Damn this is straight humiliating for the rams. Cowboys have been dead in the water for weeks,,6,1576450127,eb4jgo
3062,Wtf rams,Eagles,2,1576450126,eb4jgo
3063,"""In his first interception since two thousand""

*gasp*


""Seventeen""



aw, that's not that interesting",Cowboys,6,1576450125,eb4jgo
3064,Seriously lol. Felt the weirdest deja vu/Matrix type feeling,Steelers,1,1576450122,eb4jgo
3065,"Sean Lee, reminding all you fuckers who forgot",Broncos,7,1576450122,eb4jgo
3066,Skip Bayless just nutted,Saints,2,1576450122,eb4jgo
3067,"Dak: ""Defer deez nuts in your mouth""",Colts,3,1576450121,eb4jgo
3068,Rams gonna need more coin tosses.,Bears,3,1576450121,eb4jgo
3069,"Whenever anyone shits on Wentz contract, I can just retort that the Rams gave Goff more lol",Eagles,4,1576450120,eb4jgo
3070,[removed],,1,1576450120,eb4jgo
3071,DEM BOYS LET'S GO TEXAS,Texans,3,1576450119,eb4jgo
3072,C'mon Goff what was that,Eagles,2,1576450118,eb4jgo
3073,Is Sean Lee playing? Sean Lee IS playing,Saints,4,1576450118,eb4jgo
3074,Errrr... I meant Cowboys will get another TD before the half. I'd be worried Rams fans.,Cowboys,2,1576450115,eb4jgo
3075,Future Dallas Cowboys LB coach Sean Lee.,Cowboys,7,1576450115,eb4jgo
3076,"Honestly, it will be a silver lining for our season since you knocked us out last year.",Cowboys,1,1576450115,eb4jgo
3077, Jared Goof,Ravens,2,1576450115,eb4jgo
3078,"Witten and Lee!!!

The old white men came out to play today",Cowboys,2,1576450112,eb4jgo
3079,Damn if he was any faster that’s a td lol,Cowboys,7,1576450112,eb4jgo
3080,papa lee!,Cowboys,3,1576450111,eb4jgo
3081,SEANLEEEEEE,Cowboys,1,1576450111,eb4jgo
3082,Your tackle tackled Quinn,Cowboys,1,1576450110,eb4jgo
3083,100 million dollars,Bills,3,1576450109,eb4jgo
3084,Jared Goff is getting paid 134 million dollars,Packers,8,1576450109,eb4jgo
3085,Why did people think the Rams were good again?,Colts,3,1576450108,eb4jgo
3086,Goff is not the QB you want orchestrating a comeback.,Patriots,5,1576450108,eb4jgo
3087,Let’s fucking GOOOOOOO!!!!,Cowboys,5,1576450108,eb4jgo
3088,Has anyone been called for tripping since our game against the pats,Cowboys,25,1576450108,eb4jgo
3089,Goff done goofed,Texans,2,1576450106,eb4jgo
3090,Sean Lee returning to his old form,Cowboys,3,1576450105,eb4jgo
3091,Lee has been dreaming of that runback lmao,Cowboys,2,1576450105,eb4jgo
3092,wym,Cowboys,1,1576450104,eb4jgo
3093,Put Lee in as punt returner! That was nice!,Cowboys,2,1576450103,eb4jgo
3094, holy shit lee!!!!! Lets goooooooooo,Cowboys,2,1576450103,eb4jgo
3095,"And with the first pick of the NFL draft, the Los Angeles Rams select Jared Goff.",Cowboys,2,1576450099,eb4jgo
3096,No phantom DPI to bail us out? No?,Rams,-2,1576450097,eb4jgo
3097,"Hnnnnnggggggg


I say again:

Hnnnnnggggggg",Cowboys,4,1576450095,eb4jgo
3098,"wow, what a run back too",Saints,3,1576450094,eb4jgo
3099,Stephen A was absolutely correct,Bills,2,1576450093,eb4jgo
3100,[deleted],,1,1576450091,eb4jgo
3101,Rams passed on Wentz for this dude,Eagles,7,1576450091,eb4jgo
3102,It’s like a fucking Expendables movie out there,Lions,2,1576450090,eb4jgo
3103,Sean lee thinks he's ed reed,Colts,2,1576450089,eb4jgo
3104,OLD MAN SEAN LEE HELL YES,Cowboys,3,1576450088,eb4jgo
3105,RIP slim playoff hopes,Rams,4,1576450088,eb4jgo
3106,[deleted],,2,1576450085,eb4jgo
3107,Mr. Glass is up your ass,Cowboys,2,1576450085,eb4jgo
3108,Goff is so bad,Eagles,3,1576450083,eb4jgo
3109,Ernestine getting it from skip tonight,Patriots,3,1576450081,eb4jgo
3110,[removed],,1,1576450081,eb4jgo
3111,SEAN LEE I LOVE YOU BABY,Cowboys,0,1576450080,eb4jgo
3112,Rams are laying a goose egg out here today.,Eagles,3,1576450079,eb4jgo
3113,Well gg been a fun season.,Rams,2,1576450079,eb4jgo
3114,I missed Sean Lee’s picks so much,,1,1576450079,eb4jgo
3115,"Hot damn!!

IS SEAN LEE STILL IN THE GAME!?!?",Cowboys,1,1576450078,eb4jgo
3116,General Lee taking back his post,Cowboys,1,1576450078,eb4jgo
3117,SEAN LEE,Cowboys,1,1576450078,eb4jgo
3118,I guess you haven’t been paying attention. Cowboys screwed up the toss so the rams get the ball to start the second half,Cowboys,1,1576450077,eb4jgo
3119,[deleted],,3,1576450077,eb4jgo
3120,Booo this man,Cowboys,1,1576450074,eb4jgo
3121,Wow what team is this?,Cowboys,3,1576450074,eb4jgo
3122,I will always love Sean Lee,Cowboys,1,1576450073,eb4jgo
3123,DEFENSIVE TURNOVER!!!!!! WHAT IS HAPPENING?!!!!,Cowboys,2,1576450073,eb4jgo
3124,SEAN LEEEEEEEEE YESSSSSSSSSS,Cowboys,3,1576450072,eb4jgo
3125,WHAT A BALLHAWK!!!,,6,1576450071,eb4jgo
3126,"Good Rams, Bad Rams. Bad Rams showed up today .",Steelers,3,1576450071,eb4jgo
3127,Sean Lee with the spin move.,Cowboys,2,1576450070,eb4jgo
3128,Pass isssssssssssssssss,,1,1576450070,eb4jgo
3129,General Lee!,Cowboys,2,1576450069,eb4jgo
3130,GENERAL LEEEEE,Cowboys,3,1576450069,eb4jgo
3131,Lee wanted that TD bad.,Cowboys,6,1576450069,eb4jgo
3132,"How can I take a clock eating 97 yard drive and use it to shit on Elliot? Oh, I know",Cowboys,1,1576450068,eb4jgo
3133,General Lee!!!,Cowboys,1,1576450067,eb4jgo
3134,LETS FUCKING GO LEE,Cowboys,3,1576450066,eb4jgo
3135,"As much as I hate it, seeing Sean Lee like that actually made me smile",Rams,5,1576450065,eb4jgo
3136,You were saying :),,1,1576450065,eb4jgo
3137,Gaining yards on the cowboys.,Eagles,-7,1576450064,eb4jgo
3138,Jesus Rams!,Packers,1,1576450064,eb4jgo
3139,holding,Cowboys,3,1576450064,eb4jgo
3140,General Lee!,Cowboys,1,1576450063,eb4jgo
3141,"Call Andrew Whitworth, 877 false starttttttt",Cowboys,3,1576450053,eb4jgo
