,body,author_flair_text,score,created_utc,link_id
0,[deleted],,1,1576453341,e7z1lh
1,Everyone need to be fired 5 game in a row we allowed more than 35 points,Jaguars,1,1575851074,e7z1lh
2,"Jacksonville, TIAA Bank Field every sunday... Duh.",Jaguars,1,1575850144,e7z1lh
3,I am convinced that our horrible seasons have been cosmic penance for switching off IMO the best jerseys in the league.,Jaguars,1,1575850031,e7z1lh
4,I am genuinely upset the Chargers didn't go for 50 on us. WE NEED MARRONE FIRED!,Jaguars,2,1575849911,e7z1lh
5,Put up 50 you pussies.,Jaguars,3,1575849787,e7z1lh
6,The Chargers better put up 50 to increase the odds of Marrone being fired after this game.,Jaguars,4,1575849530,e7z1lh
7,Lol fuck off. This is my team and will be until I die.,Jaguars,3,1575849515,e7z1lh
8,Austin Ekeler is going to be sore tomorrow. Also Justin Jackson's head fakes always make me giggle.,Chargers,7,1575849469,e7z1lh
9,Agreed absolutely.,Texans,1,1575849403,e7z1lh
10,Well they're not big names because they havent made the plays that they shouldve based off their draft position. Maybe my reads of the draft were wrong but i thought minshew and Westbrook would be really good coming out of the draft and i still have hope for them. Allen and taylor too.,Texans,1,1575849384,e7z1lh
11,This team doesn't give a shit.,Jaguars,3,1575849308,e7z1lh
12,"Considering how much he costs, he still is.",Jaguars,1,1575849297,e7z1lh
13,Thank you for your sacrifice,Chargers,1,1575849266,e7z1lh
14,😂,Jaguars,3,1575849231,e7z1lh
15,A loss for the annals.,Chargers,5,1575849231,e7z1lh
16,Ooof I hope Chark is okay. Seems like one of the few bright spots on the Jags.,Chargers,7,1575849208,e7z1lh
17,Man it’ll be amazing how the Chargers lose this game,Bears,5,1575849121,e7z1lh
18,Minshew plays like his hair is on fire and the rest of the Jags need to catch up.,Chargers,10,1575849116,e7z1lh
19,he was,Patriots,1,1575849108,e7z1lh
20,Lol most of those young starters are only in because their starter got hurt.,Jaguars,8,1575849086,e7z1lh
21,"11 non-winning record seasons in 12 years

First team since the 86 Bucs to lose 5 straight by 17+

But at least this group of professional athletes is playing hard and not giving up

Give me a break, Schlereth",Jaguars,7,1575849061,e7z1lh
22,What I got from this game is that the Jaguars would be 10-3 if they were in the NFCN instead,Packers,4,1575849043,e7z1lh
23,Damn that was the first like absolutely whiffed tackle I've ever seen from Derwin James.,Chargers,7,1575849017,e7z1lh
24,"For those wondering and just blindly assuming this is proof Foles wasn't the problem;

1. Minshew takes less sacks

2. Minshew is more accurate

3. Minshew turns the ball over less often even with the fumbles

4. Minshew can run for a 1st down.",Jaguars,8,1575848994,e7z1lh
25,Didn’t y’all just lose to the broncos? And you’re fighting for a playoff spot? Yikes,Jaguars,5,1575848992,e7z1lh
26,Guys I know why were winning. I'm not watching the game. I'm willing to take a bullet and not watch all next season if you want,Chargers,7,1575848926,e7z1lh
27,"Foles was definitely a problem, though.",Jaguars,4,1575848887,e7z1lh
28,do us a favor and don't watch any charger games next year lol,Chargers,1,1575848865,e7z1lh
29,Baby Chark dooo doo dooo,Chargers,7,1575848852,e7z1lh
30,can't wait for Doug Moron to blame the QB again for his awfully undisciplined team and awful defense.,Patriots,1,1575848816,e7z1lh
31,Sucking against backups is how you know they did absolutely zero gameplanning.,Jaguars,3,1575848813,e7z1lh
32,You thought you were eating a Whopper?  Nope it was an IMPOSSIBLE WHOPPER YOU FUCKING IDIOT YOU ABSOLUTE IMBECILE,Chargers,11,1575848765,e7z1lh
33,Don't forget to vote for Ty Long to go to the pro bowl. The dude dubbed over as our kicker and did a good job given the circumstance.,Chargers,6,1575848655,e7z1lh
34,"\&gt;Wake up

\&gt;Be Jaguars fan",Texans,0,1575848647,e7z1lh
35,"wow the haters were right, Rivers really did get benched",Packers,12,1575848550,e7z1lh
36,This Guyton dude is struggling.,Chargers,4,1575848542,e7z1lh
37,I'm honestly kinda pissed this is the only game I've missed all season lol,Chargers,5,1575848521,e7z1lh
38,This is starting to feel like a preseason game.,Chargers,3,1575848519,e7z1lh
39,Still have a current market value of 9.1B rn which is absolutely ridiculous,Texans,2,1575848474,e7z1lh
40,Yea so sad for foles to win a super bowl and steal $50MM from a shit franchise. He and Eagles fans are the clear victims in this situation. Fuck us I guess lol,Jaguars,1,1575848405,e7z1lh
41,At least the Jag's punter had a fun play today..?,Chargers,10,1575848343,e7z1lh
42,"Minshew just hasn't had a chance to do anything today,",Chargers,9,1575848295,e7z1lh
43,Those 3 play calls has summed up the past 5 games of the season perfectly.,Jaguars,4,1575848278,e7z1lh
44,So...anyone play pubg mobile?,Jaguars,4,1575848267,e7z1lh
45,Bring back the old school Jaguar jerseys while you’re at it because those were amazing.,Chargers,2,1575848219,e7z1lh
46,"He's many drinks in, he's just trying to keep a grip on reality",Chargers,2,1575848215,e7z1lh
47,Yeesh Minshew has been on the run all day.,Chargers,8,1575848204,e7z1lh
48,"for God's sake, Minshew throw it away--Bosa's coming",Chargers,9,1575848188,e7z1lh
49,"If it helps, we're the best 4-8 team ever if you look at point differential. (I know it won't help the shitty feeling, just something to help you get over this game)",Chargers,10,1575848182,e7z1lh
50,"lol I heard on the radio that Peloton lost 1.5b in market value after they aired their ""husband buys skinny wife spin cycle"" ad",Chargers,5,1575848048,e7z1lh
51,More read options for Taylor plz. I wanna feel like the Ravens,Chargers,6,1575848028,e7z1lh
52,Getting blown out in back to back weeks by teams with the same back record as ours. That’s pathetic.,Jaguars,8,1575848019,e7z1lh
53,"Todd Wash is genuinely surprised every single time any team runs on us ever. Even if they want to run the clock out, he's still flabbergasted.",Jaguars,1,1575848011,e7z1lh
54,"""Their guys are the ones in black and our guys are the ones in white. You gotta cover the ones in white"" holy fuck",Vikings,6,1575848004,e7z1lh
55,"We murdered the Cardinals last year, I think it was 45-10 like this game.",Chargers,2,1575847992,e7z1lh
56,I think the jaguars have the worst defense in the league,,3,1575847972,e7z1lh
57,I don't give a fuck what anyone says. We **do** deserve to get a winning coach for once. Being cursed with incompetent coach after incompetent coach is horseshit and no team in the fucking league should be this unlucky. We can't even seem to get mediocre coaches because if they come here they just devolve.,Jaguars,5,1575847968,e7z1lh
58,Tyrod's cleats are fucking sick,Chargers,5,1575847963,e7z1lh
59,Oh boy winning meaningless games in December!,Chargers,8,1575847940,e7z1lh
60,Yup definitely,Chargers,5,1575847930,e7z1lh
61,There goes the 38 points for Rivers 38th birthday.,Chargers,3,1575847924,e7z1lh
62,Lol who had the line at River's birthday age &lt; LAC points?,Texans,3,1575847924,e7z1lh
63,"You’d think they’d just let him go at this point, it’s kinda a sunken ship at this point.",Chargers,1,1575847911,e7z1lh
64,[deleted],,2,1575847910,e7z1lh
65,"Lol Jesus, make it stop",Broncos,2,1575847892,e7z1lh
66,feels so wrong but it feels so good,Chargers,5,1575847890,e7z1lh
67,"Just tuned in. Phillip balled out today, it appears?",49ers,4,1575847888,e7z1lh
68,"Yes, what about them. They've consistently gotten better every year since 2013, and have been good the past few years.",Jaguars,0,1575847868,e7z1lh
69,Jesus christ dude. We're all fucking sick of Eagles fans. All of us. Nobody on this team wants Foles. Stop coming into these threads trying to tell **us** that you know more about **our** team. Go spew this shit on /r/eagles. Nobody fucking cares that the fanbase that owes him a blood oath thinks he can do no wrong.,Jaguars,0,1575847856,e7z1lh
70,"This team isn't great, but they're not get blown out by the Chargers and Bucs bad. Coaching staff gotta go.",Jaguars,6,1575847832,e7z1lh
71,Aw Foles looked so sad 😔,Chargers,5,1575847763,e7z1lh
72,"&gt;Minshew has had 1 good game since the Broncos game.

Even if all that other bullshit were true, that's still 1 more game than Foles.",Jaguars,1,1575847729,e7z1lh
73,So odd watching a read option play from our offense.,Chargers,9,1575847712,e7z1lh
74,"If we keep any of the big guns from this regime after the season, I give up",Jaguars,2,1575847696,e7z1lh
75,Tyrod!!,Broncos,4,1575847691,e7z1lh
76,He's been gone for months.,Jaguars,3,1575847687,e7z1lh
77,"You probably hadn't realized that Rivers has the perfect shit talking detector, can't really blame you for that.",Chargers,4,1575847664,e7z1lh
78,Lol at Taylor getting shoved in the backfield,Chargers,4,1575847657,e7z1lh
79,"If I were a Philip Rivers critic saying he's washed, I wouldn't pick the game against the worst-coached team in football filled with guys who know they're gone before next season as the proof edgewise.",Jaguars,5,1575847656,e7z1lh
80,"Jags coach is done. 

Marrone is maggone",Titans,3,1575847646,e7z1lh
81,"Tyrod ""Can Run"" Taylor",Chargers,5,1575847612,e7z1lh
82,"Because it makes me sad that you took our boy, gave him false promises about being a good team just needing an average qb to be contenders, and then completely suck and blame him for things like your defense giving up 20 yards per carry every week.

And it's extra sad because he probably blames himself for how terrible your whole team is, even though 90% of it isn't his fault.",Eagles,1,1575847592,e7z1lh
83,Somehow we always manage to play close games. I'm a new fan but that has been true in our great season last year and our shitty season this year,Chargers,2,1575847589,e7z1lh
84,Wtf jags. I was rootin for ya,Titans,2,1575847575,e7z1lh
85,Philip Rivers annihilating the Jags every time they play is karma for me calling him overrated that one time in high school 10 years ago. It just has to be,Jaguars,9,1575847575,e7z1lh
86,In theory. In practice IMO if you don't touch the rim its not a dunk.,NFL,2,1575847535,e7z1lh
87,"I mean, has Derwin ever actually made a tackle? Pretty much a 50/50 play",Chargers,4,1575847506,e7z1lh
88,"I know I said it before, but I'll say it again

I love Derwin James",Chargers,6,1575847472,e7z1lh
89,"Ah yes, throw to the guy that is covered by Derwin James and hope he misses the tackle, that’ll do it.",Chargers,6,1575847452,e7z1lh
90,"Looking at our record you may think so, but I really think our team could have played a couple of games like this.",Chargers,6,1575847433,e7z1lh
91,has anyone tried the chicken and waffles from kfc,Patriots,2,1575847415,e7z1lh
92,"hey Jags fans, has anyone ever showed up to a game cosplaying as King from Tekken?",Chargers,9,1575847345,e7z1lh
93,"So this has to be the most embarrassing AFCS loss of the day right?

^haha ^don't ^look ^at ^the ^Texans ^score",Texans,7,1575847278,e7z1lh
94,"I honestly am thinking the 2017/2018 Eagles were a bit of a 'perfect storm' scenario where the coaches and players just fit each other perfectly. Foles was good in his few games on the Chiefs under Andy Reid too, the Eagles lost Foles, Reich, and DeFilippo, and now basically everyone is struggling out on their own.

Basically they are all pieces that fit together but when you take each individual out of that support system and toss them onto an island by themselves...not so good.

All that said, Foles gave you guys; a good drive, a couple average games, and one bad game. The rest of the team (defense, coaching) is still horrible though and they had no chance from the beginning. We were *all* fooled.",Eagles,1,1575847273,e7z1lh
95,Nah; we're just that bad.,Jaguars,3,1575847191,e7z1lh
96,This game reminds me of an earlier AFC West vs AFC South game...,Cowboys,6,1575847136,e7z1lh
97,Peterman game? That's the last high scoring game I can think of but my memory is shit,Chargers,5,1575847118,e7z1lh
98,wow don't get to see Showcase drilling guys like that too often,Chargers,4,1575847110,e7z1lh
99,Why do you even give a shit?,Jaguars,1,1575847106,e7z1lh
100,"I will be honest, I still want the Chargers to keep scoring for 2 reasons. 1.  I was in Jacksonville for our playoff game a couple of years ago and y’all broke my heart. 2. I have Allen and Henry in fantasy playoffs and need them to do a little more, if that’s ok?",Bills,2,1575847041,e7z1lh
101,Why not? Have you seen Caldwell's track record with first round picks?,Jaguars,1,1575847032,e7z1lh
102,"Yeah, all the commentary about him being washed up was silly. Getting knocked around every game takes its toll and he wasn't getting any protection. 

But it also helps that the Jags can't stop the run either. More balance in the offense means the D can't sell out on the pass",49ers,5,1575846981,e7z1lh
103,No you can't.,Jaguars,1,1575846949,e7z1lh
104,and what a catch to pop that seal!,Chargers,3,1575846944,e7z1lh
105,When is the last time the chargers put up 35+ points?,Chargers,5,1575846937,e7z1lh
106,Which is weird because the Jags have a good d-line.,Chargers,4,1575846934,e7z1lh
107,Minshew needs reps he still is a rookie,Buccaneers,7,1575846916,e7z1lh
108,Mike Williams flagged for not playing basketball in college.,Chargers,7,1575846895,e7z1lh
109,"Doesn't every team wish they could play the jags every week?

We are so terrible lol",Jaguars,4,1575846894,e7z1lh
110,Probably time to start bringing out the backups if I’m the Jags... no point in any starters getting injured,Broncos,3,1575846882,e7z1lh
111,Dude he threw 7 picks in 3 games. Not counting all the stupid decisions he has made in the rest of our games. Maybe the rumor mill lit a fire under his ass this week. Also he’s 38. I hope to god we don’t sign him to an extension.,,1,1575846881,e7z1lh
112,lmao that was his first TD this season,Chargers,8,1575846869,e7z1lh
113,Phillip Rivers: That was such a fricken sick pass.,Dolphins,5,1575846854,e7z1lh
114,Happy Rivers makes me happy,Chargers,5,1575846850,e7z1lh
115,"If he can just continue putting up points, I’ll be satisfied.",Jaguars,2,1575846847,e7z1lh
116,Philcember,,6,1575846841,e7z1lh
117,I didn’t realize dunking was still outlawed. Weak.,Cardinals,5,1575846835,e7z1lh
118,"oh right you can still do the dunk celebration as long as you don't actually touch the uprights, right?",Chargers,4,1575846833,e7z1lh
119,Got home from work to see this. Maybe I should start missing the games more often,Chargers,4,1575846830,e7z1lh
120,I mean...it was pretty good coverage.,Jaguars,3,1575846816,e7z1lh
121,so can we transfer some of these points to our other games? We'd be 13-0,Chargers,7,1575846791,e7z1lh
122,Williams is insane sometimes.,Chargers,2,1575846790,e7z1lh
123,On the sideline with nagging injuries!,Chargers,6,1575846789,e7z1lh
124,It’s almost as if rivers is good because he’s had good protection this game🤔,Chargers,8,1575846774,e7z1lh
125,lol I like how they lock legs at the end,Chargers,3,1575846770,e7z1lh
126,Lol Jags defense... what is you doing,Broncos,3,1575846755,e7z1lh
127,Wooooooo. Minshew coming back on now!,Jaguars,4,1575846749,e7z1lh
128,WHERE HAS THIS BEEN ALL SEASON!?,Chargers,8,1575846735,e7z1lh
129,That's cool! Also I assume he chose football over golf because he didn't want to live in his grandpa's professional shadow lol.,Chargers,1,1575846733,e7z1lh
130,Mike williams might be the best 50/50 ball guy in the league,Patriots,6,1575846726,e7z1lh
131,#holy shit,Chargers,4,1575846725,e7z1lh
132,"oh baby!

max extension for Rivers make it happen",Cowboys,4,1575846722,e7z1lh
133,Who is this 15 guy?,,3,1575846701,e7z1lh
134,Yeah but there’s “having a few bad games” and “being the reason your team loses.” But today he’s the reason we are winning!,Chargers,1,1575846666,e7z1lh
135,"Foles is still terrible, you can have him back.",,5,1575846640,e7z1lh
136,"&gt;Minshew didn't lead to 21 points against the bucs

Yeah but he did against the Texans... 

Minshew was among the league leaders in turnovers when he was benched for Foles and had a bad QBR and PFF grades. Jags fans' obsession with Minshew is as bad as Eagles fans' obsession with Foles. Minshew has had 1 good game since the Broncos game.",Eagles,1,1575846606,e7z1lh
137,"Can you remind me quick how that London game went?

Edit: And Foles this year gave you one good drive (injured), then 2 average games (average QB play was supposed to be enough for your guys defense to win, remember?), and one bad game. Minshew gave you a bunch of average (good for a rookie, though) games, and one terrible game. Meanwhile your defense has done nothing but poop the bed non-stop.

The Jags are just...not a good team in any sense, they belong in the NFC East with how bad they are.",Eagles,0,1575846576,e7z1lh
138,That's O'Leary's thing. Never wore them at FSU. Also is Jack Nicklaus' grandson.,Jaguars,3,1575846543,e7z1lh
139,hey now that was some nice run defense,Chargers,3,1575846540,e7z1lh
140,"I'm ready for our play calling to become conservative, give up 21 points, and leave Phil with a full field with 2 minutes left.",Chargers,4,1575846497,e7z1lh
141,Just let them score so we can watch more Minshew.,Jaguars,3,1575846462,e7z1lh
142,"Dangit Foles, why are you ruining this team!

Oh wait...

Also hahaha, '4 carries 92 yards'. Good ol' Jags defense. Remember in the off-season when the defense was so elite and all they were supposed to need was average QB play to be contenders?",Eagles,-8,1575846459,e7z1lh
143,They benched him because they paid Nick Foles $88m. Once he had his three terrible starts they went back to the MOAT.,Jaguars,4,1575846436,e7z1lh
144,"They thought Foles gave us a better shot at the playoffs. Ironically, Foles tanked any potential playoffs.",Jaguars,2,1575846426,e7z1lh
145,"I feel you. I'm a homer, you know i gotta defend my boy lmao",Eagles,1,1575846417,e7z1lh
146,"Front office: We only lost by 21 points, guys. It's fine.",Jaguars,3,1575846399,e7z1lh
147,"I’ll admit, I’m just here because I have Allen and Henry in fantasy, but Minshew really is fun to watch sometimes. How come they benched him for Foles?",Bills,3,1575846393,e7z1lh
148,I really like that Ertz commercial.,Chargers,2,1575846371,e7z1lh
149,Yea there hasn't been enough flags in your favor today,Jaguars,1,1575846360,e7z1lh
150,Turning it over repeatedly is actively worse than simply not scoring,Jaguars,1,1575846342,e7z1lh
151,Not a chance. The whole reason he's on the field is because Foles was useless behind the Jags O-line.,Buccaneers,2,1575846337,e7z1lh
152,you speak like you don't already know the answer,Chargers,4,1575846325,e7z1lh
153,That took us 8:05 to get into the endzone. We're averaging a pace of like 3 yards a pass with Defillipo. You're fine Chargers.,Jaguars,5,1575846324,e7z1lh
154,This game seems similar to a previous AFC West vs AFC South game...,Cowboys,2,1575846324,e7z1lh
155,"It’s amazing how Kessler and Foles just stood there whenever there was any pressure and went down on first contact, and then Minshew seemingly makes everyone miss and does things like that",Jaguars,8,1575846307,e7z1lh
156,"If he was a couple seconds later that would have been an absolutely beautiful hit. Glad Dede wasn't injured though, scary hit when you are in the air.",Chargers,1,1575846290,e7z1lh
157,Damn that's like the first time I've seen a pass catching player not wear any sort of gloves.,Chargers,3,1575846287,e7z1lh
158,Even the fireworks sounded pathetic.,Jaguars,3,1575846263,e7z1lh
159,"This season may be miserable, but watching Minshew's elusiveness still provides a glimmer of hope.",Jaguars,4,1575846257,e7z1lh
160,He is not the problem rn,Jaguars,4,1575846257,e7z1lh
161,no,Jaguars,3,1575846246,e7z1lh
162,Looked like a good tackle to me,Chargers,6,1575846240,e7z1lh
163,There’s no way the Chargers can fuck this one up... right?,Broncos,4,1575846238,e7z1lh
164,make sure not to cover the guy in the endzone literally waiting for a td pass,Chargers,3,1575846231,e7z1lh
165,"""Jags couldn't possibly win this game""

Maybe, but we could always lose it ourselves",Chargers,5,1575846227,e7z1lh
166,Mebane shoulda had some Gatorade,Chargers,5,1575846215,e7z1lh
167,Is Minshew benched?,Cowboys,1,1575846209,e7z1lh
168,"&gt; Minshew didn't directly give 21 points to the bucs, though

he's not really scoring either. That's coaching",Eagles,1,1575846199,e7z1lh
169,Dede kinda got sacrificed for that one.,Jaguars,2,1575846178,e7z1lh
170,"This PI is the start of the comeback. 

Rivers down 3 with 1 minute in the 4th qtr.",Chargers,3,1575846164,e7z1lh
171,wait are we seeing a preview of how we lose this game,Chargers,6,1575846144,e7z1lh
172,Joey Bosa's spin move was dirty. Bummer it didn't lead to a sack.,Chargers,6,1575846139,e7z1lh
173,Man even when Foles isn’t playing they blame him for losing lol.,,2,1575846124,e7z1lh
174,Jags and Minshew deserved a break.,Chargers,4,1575846122,e7z1lh
175,Yeah but no flag on the obvious hold on Bosa? Nice awareness refs,Chargers,8,1575846111,e7z1lh
176,"&gt;rivers has a few bad games
&gt;""rivers is done""",Chargers,3,1575846090,e7z1lh
177,Might as well keep running the ball with all these short ass throws lol,Broncos,2,1575846080,e7z1lh
178,"3rd and 9, down 28, and THAT'S the play you call lmfaoooo.",Jaguars,2,1575846071,e7z1lh
179,"Personally I'd fire Coughlin first just because he's a shitstain but I'm sure they're willing to let him ""retire"" because of his legacy.",Jaguars,2,1575846070,e7z1lh
180,I legit didn’t think we would win another game this season. I’m almost upset we are winning because I’ve been telling everyone Rivers is done and we are tanking for a pick.,,2,1575846046,e7z1lh
181,can't blame minshew for this dumpster fire short play calling,Chargers,7,1575846037,e7z1lh
182,"I feel bad for Minshew. He's just running for his life every single play,",Chargers,3,1575846032,e7z1lh
183,"You could honestly argue the Rams will get more value out of Ramsey, than we will out of those draft picks, especially with Caldwell picking.

And Minshew hasn't proven he's anything more than decent.",Jaguars,2,1575846024,e7z1lh
184,second y'all benched minshew for foles was rip. bet he'd be doing much better with the experience if he played past 3 games,Chargers,6,1575845998,e7z1lh
185,Are you tanking?,Steelers,2,1575845986,e7z1lh
186,How many holdings is Cam Robinson up to for 2019? 50? 1000?,Jaguars,5,1575845973,e7z1lh
187,Rivers is having a good game. But Minshew has no time and is having pretty bad plays being called. Can't blame him for this game.,Chargers,3,1575845967,e7z1lh
188,SO MANY FUCKING PENALTIES,Jaguars,3,1575845933,e7z1lh
189,bahahahhahahaha,Buccaneers,-1,1575845926,e7z1lh
190,"""They had to practice that, don't you think?""

No you ding dong, the punter just fucking yolo'd it",Packers,3,1575845922,e7z1lh
191,Holding 74 x10 times a game,Jaguars,4,1575845922,e7z1lh
192,Getting dad dicked by Defilippo.,Jaguars,2,1575845905,e7z1lh
193,1 penalty called on the chargers...it was the soft block in the back call.,Jaguars,3,1575845900,e7z1lh
194,"Minshew didn't directly give 21 points to the bucs, though. You keep wanting to hope Foles doesn't suck but he took sacks for no reason and made shit reads all on his own. Minshew doesn't have those problems.",Jaguars,0,1575845890,e7z1lh
195,He gives us a better chance of winning than Winston ever will for you guys.,Chargers,4,1575845886,e7z1lh
196,We should have just mugged the gunner.,Chargers,3,1575845885,e7z1lh
197,Acting like Tyrod isn't anything more than a okay backup on his best day,Chargers,2,1575845882,e7z1lh
198,"Minshew Magic getting dad dicked by Old Man Rivers?

also, QB controversy with the punter",Cowboys,3,1575845867,e7z1lh
199,Our punter is a better QB than Foles,Jaguars,3,1575845861,e7z1lh
200,IDK why fleeced is in quotations and who is calling Minshew mediocre?,Jaguars,3,1575845855,e7z1lh
201,Everyone except the Chargers knew we weren't punting that. I mean c'mon.,Jaguars,5,1575845852,e7z1lh
202,"This season is a disaster, but hey. At least we ""fleeced"" the Rams and got a mediocre rookie QB in the 6th round.",Jaguars,3,1575845833,e7z1lh
203,Acting like those receivers dropping passes is on Rivers.,Chargers,2,1575845825,e7z1lh
204,Ya know what? I love fake special teams plays so I’m ok with giving that one up.,Chargers,4,1575845806,e7z1lh
205,"I bought into the offense when they were trying to make plays downfield. Now we have no fucking identity. We don't play a consistent short game for shit because our coaching staff has no fucking clue how to mix runs and passes. We don't play a big play game for shit because we're not dialing up any mid to long throws.

How can someone be so fucking incompetent at their career?",Jaguars,2,1575845796,e7z1lh
206,We run the same style of defense but JDF is drooling on his play sheet completely unable to understand what he needs to do.,Jaguars,3,1575845795,e7z1lh
207,Tranquill's been nothing but a blessing all season.,Chargers,5,1575845794,e7z1lh
208,"Fuck it, go for it",Broncos,3,1575845785,e7z1lh
209,im just sayin pump the breaks a lil,Buccaneers,-1,1575845780,e7z1lh
210,"He broke in the beginning of the game. 1,001yd with 4.5 ypc last i saw.",Jaguars,1,1575845769,e7z1lh
211,maybe your coaches had a hand in Foles losing those games just like how they have one in Minshew getting blown out right now,Eagles,2,1575845754,e7z1lh
212,Refs can't ref what's new :/,Chargers,5,1575845751,e7z1lh
213,"Yea, last year I was really hyped for him, but he does seem really bad at adjusting. Just gotta get a solid O-line and even if we lose Gordon we should still have a solid run game. 

We do perform much better with no expectations so I'm hoping next year is much better.",Chargers,1,1575845737,e7z1lh
214,Lmao acting like our backups aren't worse,Chargers,3,1575845729,e7z1lh
