,body,author_flair_text,score,created_utc,link_id
559,The one fucking time that the onside works.,Bills,10,1574018349,dxphzb
560,"Ballage with the legendary 6 carries, 0 yards and 1 TD statline",Dolphins,3,1574018344,dxphzb
561,What the fuck,Bills,6,1574018339,dxphzb
562,"Good stuff dabol, getting away from the run and going 3 and out flipped momentum.",Bills,1,1574018337,dxphzb
563,[removed],,1,1574018325,dxphzb
564,The Dolphins’ playoff run starts now.,,3,1574018316,dxphzb
565,MIAMI HAS THE DOLPHINS,Dolphins,6,1574018316,dxphzb
566,We ain’t gonna win kicking field goals and making shitty throws,Bills,3,1574018246,dxphzb
567,"Blow me shit can. That 3 and out just turned the momentum. 

All comes back to fucking dabol. Every fucking time",Bills,-1,1574018234,dxphzb
568,"The Bills and not putting away bad teams, name a better duo.",Bills,4,1574018233,dxphzb
569,Well that changed things quickly.,Bills,2,1574018227,dxphzb
570,That should have been a 15 yard pass...I think it was Hyde just randomly jumped and fell over instead of going for the tackle,,5,1574018209,dxphzb
571,[concerned Marge noise],Bills,3,1574018207,dxphzb
572,"Fitzmagic showed up late, but at least it showed up.",,3,1574018194,dxphzb
573,He's dying behind is own line now.,Packers,2,1574018193,dxphzb
574,They get a TD before half Dolphins are all the way back in it.,Bills,1,1574018188,dxphzb
575,Well this isn't ideal.,Bills,1,1574018171,dxphzb
576,Shut up dick.,Bills,1,1574018168,dxphzb
577,"Well, we meant to feed Peterman to the wolves instead of Allen, but that didn't even last a full game I don't think.",Bills,2,1574018162,dxphzb
578,"Fuuuuuuuuccuuuckckkkkkk

wtf D!???!",Bills,3,1574018154,dxphzb
579,"The current plan is actually to build a mall attached to the stadium cause it’s located basically in no mans land in a dirt lot.  Nothing to do except go to a game.  But yah I get the look, it looks better inside",Dolphins,1,1574018108,dxphzb
580,Fine before that series.,Bills,2,1574018099,dxphzb
581,"Three steaight throws dabol? Srsly ? The run game is setting everything up and working, better get away from it. Bald fat fucking moron",Bills,-1,1574018090,dxphzb
582,"Great until just now,",Bills,3,1574018070,dxphzb
583,You jinxed that drive,Bills,2,1574018047,dxphzb
584,"I get it, from a functional standpoint. I still think it looks boring, like a Mall.",Bills,1,1574018042,dxphzb
585,Just joined - how has he been otherwise?,Bills,2,1574018038,dxphzb
586,Tua would legit die behind this line,Dolphins,1,1574018031,dxphzb
587,"Jesus, couple terrible throws by Allen there.",Bills,7,1574018014,dxphzb
588,Jesus Josh. What a rough drive.,Bills,4,1574018002,dxphzb
589,Two awful passes in a row. Turn it around again.,Bills,3,1574018002,dxphzb
590,Bills should just blitz every down not like we can stop them,Dolphins,4,1574017993,dxphzb
591,Allen. Come on.,Bills,5,1574017934,dxphzb
592,They're probably take the Darnold/Allen/Rosen route and put him in a terrible situation his rookie year.,Bills,3,1574017909,dxphzb
593,It's not grounding if he's outside the pocket and throws beyond the line of scrimmage.,Bills,4,1574017869,dxphzb
594,Fitz was out of the pocket and got the ball to the line of scrimmage so there's no penalty there. If he either didn't get the ball to the line or made that play while in the pocket there would be a flag,Bills,2,1574017863,dxphzb
595,"Okay, got it. Accounting can be tough for people who don't have a numbers type of mind. It's like learning a new language but one you'll use throughout your career. You get better at it with more experience though. Good luck.",Bills,1,1574017855,dxphzb
596,They needed to renovate it in order for the SB to come back to Miami. Joe Robbie is an old stadium,Dolphins,1,1574017852,dxphzb
597,"Gotcha, that makes sense, thanks",Bills,3,1574017848,dxphzb
598,"Well by the looks of it they need to start drafting some O linemen, and they have enough picks to get it done.",Bills,2,1574017844,dxphzb
599,"yea thats what make it looks so awkward, Joe Robbie looked much better and it looked boring.",Bills,2,1574017815,dxphzb
600,If the qb is outside the pocket the ball just has to go past the line of scrimmage,Bills,5,1574017813,dxphzb
601,They've needed a new o-line since 2013 or so.,Dolphins,2,1574017813,dxphzb
602,[removed],,1,1574017801,dxphzb
603,We didn't lol,,2,1574017782,dxphzb
604,"Genuinely curious, because I don’t know the rules.  When do they call intentional grounding, because there wasn’t a single player even in frame when he threw that ball away",Bills,4,1574017773,dxphzb
605,I'm sooo fucking glad we came to play today.,Bills,4,1574017748,dxphzb
606,Jesus christ these blitzes are ruthless,Bills,1,1574017736,dxphzb
607,yeah I havent seen it either. some people in the gamthread are saying that Allen needs to get hit when he scrambles but i wouldn't say thats hoping he gets hurt,Dolphins,5,1574017736,dxphzb
608,Soooooo Miami needs an offensive line before they draft a new shiny QB,Bills,3,1574017717,dxphzb
609,Well that roof is new the original stadium didn’t have none.  It’s retractable so they can close it if it rains,Dolphins,2,1574017713,dxphzb
610,Will Rosen come in at any time this game?,Bills,1,1574017706,dxphzb
611,"A few posters maybe, who are getting downvoted. Rightfully so.",Dolphins,4,1574017695,dxphzb
612,"School. Not planning on being an accountant, but you have to take an accounting class for a business degree.",Bills,1,1574017694,dxphzb
613,“Fitz running for his life”,Bills,3,1574017684,dxphzb
614,"Too boxy maybe, looks like a Mall.",Bills,1,1574017674,dxphzb
615,My amusement.,Bills,3,1574017659,dxphzb
616,A part of the CPA exam or for school?,Bills,1,1574017654,dxphzb
617,Good the see the Ralph South is rocking for us.,Bills,7,1574017616,dxphzb
618,How so? 🤔,Dolphins,1,1574017613,dxphzb
619,"Ah, this has been a good weekend. Got a Gameboy Advance with Metroid, LOZ 2, and Nancy Drew. Got notified that I passed my accounting exam. Now, the Bills are putting up a solid performance against the dolphins. Life is good.",Bills,1,1574017586,dxphzb
620,"Where you reading this?  I would never want any player to get hurt, that’s messed up",Dolphins,6,1574017583,dxphzb
621,So who are the Dolphins going to tank for now?,Seahawks,1,1574017455,dxphzb
622,/r/FloridaFan,Bills,2,1574017455,dxphzb
623,That stadium looks so stupid.,Bills,2,1574017430,dxphzb
624,[deleted],,1,1574017416,dxphzb
625,Wishing an injury on any player is disgusting. Wishing a sudden case of the flu that takes you out of the game? That's a grey area.,,2,1574017415,dxphzb
626,"Also, water is wet. This is nothing new for them scumbags.",Bills,0,1574017407,dxphzb
627,Thank you its v good,Dolphins,1,1574017363,dxphzb
628,"Sorry porpoise bro, we aren’t anywhere near the level of the Pats, we’ve been struggling against some very mediocre teams this year :/",Bills,1,1574017356,dxphzb
629,"Hmm, the depends if Brady is off his game and Allen stops being scared of him.",Bills,1,1574017348,dxphzb
630,Anyone know where Duke is?,Bills,1,1574017309,dxphzb
631,"Yep, forgoing a few points last week killed us",Bills,3,1574017287,dxphzb
632,Dolphins Sub is wishing Allen gets injured. Totally classless fan base.,Bills,5,1574017275,dxphzb
633,Or tall receiver.,Bills,1,1574017270,dxphzb
634,I'll take Motor with 200 yards then.,Bills,1,1574017243,dxphzb
635,"The bengals are too shit to be stopped, and tua is now dead so draft position isn't huge",Dolphins,3,1574017238,dxphzb
636,"I would go for it, but points are points",Bills,3,1574017222,dxphzb
637,"Happy cake day, enjoy your Mac n cheese",Bills,2,1574017193,dxphzb
638,"As a fan of football, I hope you guys don't end up 8-8 because that would fuck you and also be a very lolphins thing to do.

As an AFC East fan, I don't know if I want you guys with the first pick so I hope you go 8-8.",Bills,2,1574017174,dxphzb
639,"Think we gonna have to make a play in the air in the redzone, which is difficult without a really physical receiver",Bills,2,1574017163,dxphzb
640,"I think 13-0  indicates a pretty one sided game, announcer man.",Bills,9,1574017117,dxphzb
641,D O I T,Dolphins,3,1574017111,dxphzb
642,I am less than confident.,Bills,2,1574017100,dxphzb
643,Lmao that Dolphins LB still playing the handoff while Allen literally runs behind him 10 yards downfield.,Bills,7,1574017041,dxphzb
644,"Well, fun while it lasted. You Bills better kick the Pats butts",Dolphins,9,1574017040,dxphzb
645,Did McCain just hurt himself missing a tackle?,Dolphins,3,1574017040,dxphzb
646,Didn’t he have an elbow injury for half of last season,Bears,5,1574016983,dxphzb
647,"Fingers crossed, but he had a 200 yard first half against the Giants I believe and then wasn't asked to do much for the second half",Bills,3,1574016978,dxphzb
648,"Might not be the focus, but it's nice seeing the o-line playing well.",Bills,6,1574016975,dxphzb
649,"My God, Gore is double cheeked! Look at dem thighs too! God, crush me daddy.",Bills,6,1574016974,dxphzb
650,Look at him goooo,Bills,5,1574016966,dxphzb
651,That fake to Singletary was so good the CBS camera fell for it initially.,Bills,5,1574016940,dxphzb
652,At this rate they'll just run out the clock for the entire second half.,Bills,3,1574016938,dxphzb
653,Josh Allen now has more touchdowns this year than all of last year!,Bills,6,1574016936,dxphzb
654,They use shit chicken for sure.,Bills,2,1574016925,dxphzb
655,Josh gonna get 300 today?,Bills,5,1574016868,dxphzb
656,"Man, Ballage gave up on that play before we even got to him.",Bills,2,1574016856,dxphzb
657,"Tbh if I'm at wild wings I'm getting boneless. Their bone in wings are shit, might as well have the chicken nuggets.",Bills,4,1574016827,dxphzb
658,Dirty.,Dolphins,1,1574016823,dxphzb
659,Ballage is averaging -1 yards per carry.  At least he is consistent,Dolphins,2,1574016768,dxphzb
660,B O N E L E S S,Bills,6,1574016762,dxphzb
661,"Look i know its just the fins, but we played them like shit at our place last time. Plz defense play like this the rest of the year",Bills,8,1574016708,dxphzb
662,Get over it.  Lawson shouldn't have held his legs.  The play is over let him go and get back to the huddle.,Bills,2,1574016704,dxphzb
663,Please stop giving it to Ballage. Please,Dolphins,1,1574016694,dxphzb
664,Tua would die behind this line.,Dolphins,4,1574016675,dxphzb
665,"That's one of the few times I've heard an announcer say a white guy made an ""athletic"" play.",Bills,1,1574016643,dxphzb
666,"Change those goalposts, karma god.",Bills,1,1574016638,dxphzb
667,"If a Dolphins player taunts, better get called. Guys taunt all game (dictionary definition). Either call them all or none. Dumb call.",Bills,-1,1574016615,dxphzb
668,Standing over him jawing while holding his legs? Are you really asking that question?,Bills,3,1574016568,dxphzb
669,Gotta help them out somehow,Bills,1,1574016566,dxphzb
670,Imagine taunting a team you're supposed to be beating lol,Dolphins,0,1574016554,dxphzb
671,"Not sure you wanna do that. I once blew a man named Joe, and his fun stick tasted like an expired tootsie roll.",Bills,3,1574016548,dxphzb
672,Presumably Shaq said something while he was standing over him.,Bills,2,1574016544,dxphzb
673,He was holding his legs.,Bills,2,1574016540,dxphzb
674,I picked him over Brees,Bills,1,1574016538,dxphzb
675,https://i.imgur.com/LymKqYX.jpg,Dolphins,3,1574016530,dxphzb
676,"Stupid penalty, don't do stupid stuff guys",Bills,1,1574016506,dxphzb
677,Wait? How was that taunting lol,,1,1574016503,dxphzb
678,Shaun Lawson?,Bills,1,1574016492,dxphzb
679,I would forgive you for recycling this in the eventual clip thread,Bills,1,1574016444,dxphzb
680,Accidentally started Josh Allen over Deshaun Watson today in fantasy.,Bills,1,1574016418,dxphzb
681,Don’t let up. Keep feed singletary,Bills,1,1574016409,dxphzb
682,Took less effort for him to do that than the Fitzmagic pass earlier. So happy we drafted this guy.,,2,1574016382,dxphzb
683,Okay liar.,Bills,2,1574016326,dxphzb
684,"Cmon Bills, keep that up!

Dolphins gotta #BlowForJoe",Dolphins,1,1574016309,dxphzb
685,"Nice, was looking forward to a touch down pass by Allen.",Eagles,2,1574016294,dxphzb
686,Also always bothered me that offsetting penalty cancel the play that happened,Bills,1,1574016290,dxphzb
687,"Hell, it's about damn time",Bills,1,1574016268,dxphzb
688,"Literally dont care about my karma. Its just sad to see lol

Edit: theres actually nothing in my previous comment that would ever lead someone to believe that I care about Reddit karma.",Dolphins,-4,1574016244,dxphzb
689,Thats that good stuff right there,Bills,4,1574016239,dxphzb
690,Woo!,Bills,1,1574016232,dxphzb
691,Holy fuck that laser,Bills,3,1574016225,dxphzb
692,Id like to take a moment to say I told yall,Bills,2,1574016221,dxphzb
693,WE HIT A CHUNK PLAY,Bills,4,1574016219,dxphzb
694,Now that is that deep ball we want Allen to make! He's improving!,Bills,3,1574016217,dxphzb
695,[deleted],,-4,1574016195,dxphzb
696,Imagine caring about karma and then mocking others for a perceived sad existence.,Bills,7,1574016172,dxphzb
697,"Guys, I don't think Josh Allen is very accurate /s",,5,1574016164,dxphzb
698,Wow that was gorgeous,Bills,4,1574016146,dxphzb
699,That's what Brown can do for you.,Bills,4,1574016136,dxphzb
700,"""The man they nicknamed Smoke"" OOOOOOOOOHHH MY DOG!",Bills,3,1574016098,dxphzb
701,Great read on the defense there.,Bills,2,1574016047,dxphzb
702,Stop generalizing shit dude,Bills,9,1574016026,dxphzb
703,Not like the browns oline is anything to write home about. Our d is playing like it did the first month.,Bills,4,1574016021,dxphzb
704,I read that part as referring to Fitz. He's the one who gives up arm strength in exchange for accuracy.,Bills,1,1574015992,dxphzb
705,"So was I, but he looks terrible this season. He was a walk on at Alabama and an undrafted free agent. Just doesn't have the tools to succeed and slim frame.

I don't know what it is exactly but he just can't keep up with the receivers.",,1,1574015921,dxphzb
706,Playing against better teams than the Dolphins mostly.,Bills,6,1574015914,dxphzb
707,Hey hey hey this is dolphins remember,Bears,1,1574015893,dxphzb
708,Holy fuck tone down the ads,Bills,4,1574015890,dxphzb
709,"We're not. I wasn't saying that, I was just making a small correction to what you were saying.


Allen is good. Especially since he corrected his turnover issues",Bills,1,1574015877,dxphzb
710,Bills fans have such a sad existence they feel like they have to downvote the sub of a team thats tanking lmao,Dolphins,-14,1574015875,dxphzb
711,"Thank you Dolphins, for making our defense look legit again.",Bills,7,1574015873,dxphzb
712,It's ok I got to make my dad's famous homestyle baked mac and cheese,Dolphins,1,1574015871,dxphzb
713,Where the fuck has this defense been for the last month !?,Bills,4,1574015850,dxphzb
714,"Okay, but how is that trading arm strength for accuracy. And last year he was fine on deep balls.",,1,1574015823,dxphzb
715,Our defense is good,Bills,2,1574015823,dxphzb
716,[A lot of substitution confusion ahead of that third down led to the timeout. One too many pass rushers were out there.](https://twitter.com/JoeBuscaglia/status/1196134008314355712),Bills,1,1574015700,dxphzb
717,"Keep up the pressure. Force Fitzpatrick to take a sack, run, or throw a quick short pass",Bills,1,1574015681,dxphzb
718,What happened between last year and this one? I was really confident in him coming into this year,Bills,1,1574015680,dxphzb
719,"He's inaccurate on deep balls, but on short and medium length throws, his arm is like a laser beam",Bills,1,1574015643,dxphzb
720,Lol,Bills,1,1574015581,dxphzb
721,SacksonBills,Bills,3,1574015559,dxphzb
722,Josh Allen isn't inaccurate though?,,1,1574015539,dxphzb
723,Glad we have to pull out all the stops to beat the Dolphins,Bills,3,1574015531,dxphzb
724,You kinda don’t realize how strong of an arm Allen has until an average QB like Fitz has to put everything into it to throw it half as hard. I guess that’s what you trade for accuracy.,Bills,0,1574015463,dxphzb
725,"Nice throw, but we should've kept up the pressure. They can't stop it, so force a sack or a quick short throw",Bills,1,1574015449,dxphzb
726,Ed's first real sack! Now let the floodgates open!!,Bills,4,1574015407,dxphzb
727,Hey look guys. It's Levi Wallace giving up another big play!,,1,1574015400,dxphzb
728,Excellent. Not the most difficult though!,Bills,2,1574015375,dxphzb
729,His first real sack :),,4,1574015321,dxphzb
730,"2-7 off suit, I’m all in boys. Let’s go Dolphins!",,1,1574015315,dxphzb
731,It's the ones where a player gets injured and they offset.  Those are the obnoxious ones.,Bills,1,1574015310,dxphzb
732,Come on. Who could possibly have a complaint about Daboll?,Bills,2,1574015309,dxphzb
733,Eddie O!,Bills,4,1574015303,dxphzb
734,"You don't look at your other options if the play isn't designed to. Blame the play call then, that is a timing throw.",,1,1574015222,dxphzb
735,Allen got cheeks tho,Bills,2,1574015215,dxphzb
736,Where's Duke?,Bills,2,1574015167,dxphzb
737,"That throw was clearly done to pull a pass interference.
I hope it doesn't matter that we didn't get it.",Bills,2,1574015145,dxphzb
738,"Not a bad time for a shot, but we need a receiver with a bit more height for shots like that.",Bills,2,1574015117,dxphzb
739,That's not how playing QB works lmao,Bills,2,1574015095,dxphzb
740,Pretty sure Josh had two people open to the right. I get that it was a quick timing play but at least glance at your other options,Bills,0,1574015066,dxphzb
741,“Right there” with his arm holding Brown down. Ridiculous.,Bills,-1,1574015047,dxphzb
742,"Yeah, we still need some real WR's. Good throw by Allen there",Bills,1,1574015042,dxphzb
743,Those shouldn’t offset. Coward push on a defenseless player.,Bills,1,1574015031,dxphzb
744,Fouls with different penalty enforcement should not offset. A 15 yard personal foul and a 5 yard block in the back should net to a 10 yard penalty against the defense.,Bills,7,1574015028,dxphzb
745,"Our team must talk a lot of shit, we always get into these small little fights.",Bills,1,1574015013,dxphzb
746,Tua soon?,Bills,3,1574015006,dxphzb
747,Do we have more runs than last week already?,Bills,1,1574015003,dxphzb
748,[deleted],,1,1574014974,dxphzb
749,"Bears, Steelers, Packers, Cowboys and Patriots fans travel incredibly well",Bears,1,1574014968,dxphzb
750,Why run that same play when it just didn’t work? Daboll is poor.,Bills,2,1574014967,dxphzb
751,Did we just run the same play on that repeat down?,Bills,1,1574014965,dxphzb
752,Well that sucks. 😐,,1,1574014934,dxphzb
753,Who is meth ref?,Raiders,1,1574014933,dxphzb
754,That was kinda ballsy.,Bills,1,1574014913,dxphzb
755,Do we really need anymore fights on the field after last week?,Bills,3,1574014899,dxphzb
756,"Well, at least the Dolphins can tank for Tua-

oh....",Bills,1,1574014865,dxphzb
757,so many people have moved out of Buffalo,Bills,2,1574014861,dxphzb
758,"Nothing hot about a popsicle girl, put some clothes on!",Chiefs,1,1574014860,dxphzb
759,announcer woke up horny,Dolphins,2,1574014859,dxphzb
760,I'm so tired of watching this offense. 3rd and 7? Run a 6 yard route,Bills,3,1574014835,dxphzb
761,"Alright, there's Gore.",Bills,1,1574014820,dxphzb
762,"""Josh Allen is a big, strapping young buck"" Someone put this in the shit announcers say thread",Bills,3,1574014777,dxphzb
763,[deleted],,0,1574014731,dxphzb
764,Sad I missed this.,Bills,1,1574014727,dxphzb
765,Thank god we didn’t give it to Gore.,Bills,2,1574014679,dxphzb
766,Is there any team that plays more home games every year than Buffalo? I swear we always have a ton of fans at our road games.,,1,1574014633,dxphzb
767,"Well, yeah.",Dolphins,1,1574014624,dxphzb
768,"Ballage stat line: 2 carries, - 5 yards.  Career high for him",Dolphins,1,1574014624,dxphzb
769,[removed],,1,1574014619,dxphzb
770,Always losing the AFC East?,Patriots,-6,1574014609,dxphzb
771,"I know right? Like, it's 60 degrees girl, and you still showing off that belly? Damn!",Bills,3,1574014588,dxphzb
772,But his name literally has Ball in it! How isn't he the best player?,Bills,2,1574014562,dxphzb
773,"What do The Bills, The Dolphins, and Solid Snake have in common? Hating the motherfucking Patriots!",Bills,6,1574014548,dxphzb
774,Holy shit our line is trash,Dolphins,1,1574014544,dxphzb
775,It’s 66 degrees.  Everyone is at home with the heater on,Dolphins,1,1574014490,dxphzb
776,"Stop giving the ball to Ballage, he sucks",Dolphins,1,1574014478,dxphzb
777,Oof.,Dolphins,1,1574014428,dxphzb
778,Can we go back to that jumping Bills girl? Damn,Patriots,8,1574014421,dxphzb
779,"Grew up in South Florida, can confirm",Bills,1,1574014419,dxphzb
780,Pick 6 here we go!,Bills,1,1574014414,dxphzb
781,"Divisional home game for Buffalo, I guess?",Bills,1,1574014408,dxphzb
782,RIP dolphins offense.,Bills,1,1574014405,dxphzb
783,[deleted],,1,1574014403,dxphzb
784,I’ll take a fg with all our injuries on defense,Dolphins,1,1574014386,dxphzb
785,"Almost a safety, wew.",Bills,1,1574014385,dxphzb
786,Travel? They move here.,Dolphins,4,1574014372,dxphzb
787,That was a telling replay of the 2nd down play. Our receivers were getting 0 separation against the man coverage.,Bills,1,1574014360,dxphzb
788,"I’d stay away from Knox, dude is huge",Dolphins,1,1574014276,dxphzb
789,Hau$hmoney took a break last week but he’s back at the bank,Bills,1,1574014263,dxphzb
790,"Good confidence builder for Haushka. As long as the defense plays even decently, I think we can easily escape this game with a 2 score lead.",Bills,3,1574014259,dxphzb
791,I'm more happy about not pulling out the pitchfork for Hau$ than I am about the 3 points.,Bills,2,1574014256,dxphzb
792,I’d like some touchdowns today. Maybe don’t have a 3rd down play where two receivers are five yards shy of the first down marker?,Bills,3,1574014225,dxphzb
793,"Yay, Hausmoney is back on the menu!",Bills,3,1574014203,dxphzb
794,The pick up of 4 yards on 3rd were huge.,Bills,1,1574014189,dxphzb
795,Don’t make Wilkins helmet bash you.,Dolphins,1,1574014164,dxphzb
796,"Haus status: Money.


(Thank god.)",Bills,3,1574014124,dxphzb
797,I bet there are entire sections that are going to just be transplants and snowbirds.,Bills,1,1574014061,dxphzb
798,Miami jawing like they want to throw hands on the first drive.,Bills,1,1574014054,dxphzb
799,[deleted],,1,1574013994,dxphzb
800,Welcome to Miami,Patriots,4,1574013973,dxphzb
801,What was the injury?,Patriots,1,1574013969,dxphzb
802,Imagine unironically tackling people,Dolphins,1,1574013964,dxphzb
803,Jaylon Smith got taken in the second with a worse potential career ending injury as a LB,Bills,1,1574013921,dxphzb
804,Can we start over we weren’t ready,Dolphins,4,1574013911,dxphzb
805,Wow...there is no one at this game,Bills,2,1574013902,dxphzb
806,"Given that I have also been playing Pokemon, I think this is actually a battle between the Nickel City Bouffalant and the Magic City....hang on, has there seriously not been a Pokemon based on a dolphin yet? I say once again: WTF GameFreak.


(I feel like Nickel City sounds more like a Pokemon city name than Queen City does)",Bills,2,1574013893,dxphzb
807,"TIL that Buffalo beat Miami in the last game of the 1960s, and the first of the 1980s, but not once between the two.",Dolphins,1,1574013862,dxphzb
808,66 is basically a snowstorm for Miami,Dolphins,1,1574013850,dxphzb
809,Let’s gooooooo! Keep it with Singletary!,Bills,1,1574013837,dxphzb
810,Amen. He is hitting 300 this game. I feel it.,Bills,1,1574013780,dxphzb
811,"It’s gotta happen sometime, right?",Bills,1,1574013745,dxphzb
812,^potential ^career ^ending ^injury.,Patriots,-3,1574013733,dxphzb
813,"Chilly today. I had to wear a windbreaker.


Shit got real",Dolphins,2,1574013733,dxphzb
814,That dude's teeth are still jacked up,Bills,1,1574013606,dxphzb
815,Saving this,Bears,2,1574013598,dxphzb
816,"I sense that this is gonna end badly because fuck me being happy, amirite?",Bills,1,1574013582,dxphzb
817,6th? 6TH?!,Dolphins,3,1574013560,dxphzb
818,"""the table is set""

announcers are foreshadowing",Bills,1,1574013504,dxphzb
819,#LET'S GO BUFFALO,Bills,2,1574013475,dxphzb
820,We appreciate that.,Bills,5,1574013469,dxphzb
821,"eh we've played Fitz a handful of times

He had a revenge game against us when he was on the Jets and torched us on TNF",Bills,1,1574013465,dxphzb
822,"Miami 67, Buffalo 3.   . Im keeping it close for Bills fans",Dolphins,4,1574013401,dxphzb
823,No thanks.  Did you miss the part where he suffered a potential career ending injury.  Pretty sure he could be taken somewhere in the 6th.,Patriots,-2,1574013391,dxphzb
824,Checks out.,Dolphins,2,1574013280,dxphzb
825,No Patriots fans. You can't have him with your low twenties pick.,Dolphins,3,1574013242,dxphzb
826,Welcome to my world.,Dolphins,3,1574013232,dxphzb
827,[deleted],,1,1574013222,dxphzb
828,"Josh Allen is finally going to connect on the deep ball today

I will accept your roasts in 4 hours if I am wrong",Bills,11,1574013217,dxphzb
829,Win for Eason,Dolphins,1,1574013174,dxphzb
830,If the Dolphins draft someone with a hip injury in the first round their gonna have a bad time.,Patriots,3,1574013018,dxphzb
831,Fully anticipating heartbreak.,Bills,5,1574012933,dxphzb
832,"This is the cycle.

Fitz comes in with a full magic meter, but it drains over time.",Bills,1,1574012816,dxphzb
833,"Now that the dolphins don't care about losing, Fitztragic will show up",Bills,5,1574012530,dxphzb
834,"Bills by 3 so I can win my pool, Miami +5.5, and the Bills get the dub",Bills,1,1574012314,dxphzb
835,The tank is over. We can get Tua with the Steelers pick. Time to win the Super Bowl.,Dolphins,3,1574012167,dxphzb
836,"Well now with Tua being injured, there really is no reason to hope for a loss (not that I was hoping for a loss anyway). Ready for some Fitzmagic!",Dolphins,1,1574012157,dxphzb
