,body,author_flair_text,score,created_utc,link_id
0,"It makes perfect sense though. The team that kicks the ball passed the end line doesn't get the ball back in soccer. 

Same principle a loose ball which exits the field of play past the end line becomes a turnover. A live loose ball exiting the end line always results in a turnover. It'd be super weird if all of a sudden the offense just got the ball back on what is currently a touchback but not what is currently a safety.",Bills,1,1574034650,dxphzb
1,"I couldn't hear it well because I was at a loud bar, but it seemed like they were talking shit about the Bills and Josh Allen like the whole game despite us leading by 2 scores most of the game and Josh Allen having a really good day outside of 2 hiccup drives.",Bills,1,1574026479,dxphzb
2,Okay surely we have a winner for funniest commentator statement of the season?,Bills,6,1574025874,dxphzb
3,Yup!  Dude just got himself fired.,,2,1574025863,dxphzb
4,"the usage of the phrase ""squeeze out"" was what really put the icing on the cake for me",Ravens,3,1574025855,dxphzb
5,Came here to ask the same. Sure sounded like it.,Saints,1,1574025842,dxphzb
6,Yes he did. One of the strangest things I've ever heard an announcer say. Like bro there are other names for mustaches don't say that.,Bills,5,1574025836,dxphzb
7,Someone needs to grab that sound byte,Patriots,3,1574025795,dxphzb
8,Holy mother did that dude just tell the world that he could squeeze out a dirty sanchez? What on earth...,Ravens,4,1574025785,dxphzb
9,Did he really say he could pull off a dirty sanchez? Does he know what that means?,Giants,4,1574025783,dxphzb
10,I came to this thread to double check that!,,2,1574025781,dxphzb
11,That’s what I heard. Someone please save a clip of it,Jets,2,1574025781,dxphzb
12,"Dirty Sanchez has been said.

...The announcers checked out at halftime.",Bills,5,1574025772,dxphzb
13,Hang on a minute we just going to pretend this dude didn't just say he could squeeze out a dirty Sanchez?,Chiefs,5,1574025769,dxphzb
14,GG everyone.,Bills,1,1574025769,dxphzb
15,Yup. I'm pretty sure he has no idea what that means.,Packers,2,1574025768,dxphzb
16,"Yes, yes he did.",Browns,2,1574025768,dxphzb
17,What did he say about a Dirty Sanchez?,Bills,1,1574025764,dxphzb
18,"Sure did, I thought I was hearing things for a second...",,3,1574025756,dxphzb
19,I'm not sure that announcer knows what a dirty sanchez is.,Bills,3,1574025754,dxphzb
20,I was looking for a comment about it.,AFC,6,1574025736,dxphzb
21,That ref’s fingers were in a whole different area code,Cowboys,2,1574025711,dxphzb
22,"Did this dude just say he could ""squeeze out a Dirty Sanchez""",Packers,31,1574025692,dxphzb
23,Bills with a good game. Nice to see more offense.,Bills,1,1574025673,dxphzb
24,[deleted],,1,1574025597,dxphzb
25,Last three games are away huh?,Bills,1,1574025577,dxphzb
26,Something I didn’t think about until now...,Dolphins,2,1574025490,dxphzb
27, #fearless,Bills,0,1574025409,dxphzb
28,"Under 3min, up 17, and they have no timeouts.",Bills,2,1574025368,dxphzb
29,Typical,Bills,0,1574025336,dxphzb
30,"Honestly, that wasn't bad. It was pretty obvious he was making a tongue in cheek joke.",Bills,0,1574025269,dxphzb
31,Didn't even try to get a first there...,Bills,3,1574025261,dxphzb
32,[deleted],,1,1574025249,dxphzb
33,I wonder if fits has had the same piece of gum in the whole game,Bills,6,1574025188,dxphzb
34,He's allowed to have an off moment..thankfully they are few and far between,Bills,1,1574025148,dxphzb
35,That wasnt even close to first down,Bills,7,1574025135,dxphzb
36,Then the color guy brags about helmet to helmeting motherfuckers and pretends it was ever a proper way to tackle. Even when it was allowed it was frowned upon in the 90s.,Bills,2,1574025120,dxphzb
37,OL had absolutely no push for that sneak.,Bills,4,1574025113,dxphzb
38,McDermott was a state champion wrestler though. Remember when he broke up that big brawl with the Jacksonville? Are coach came out of that looking like Popeye.,Bills,3,1574025039,dxphzb
39,It's hilarious the difference between Levi and Tre,Bills,5,1574025030,dxphzb
40,God I love Grant.,Dolphins,1,1574025027,dxphzb
41,Still feel bad?,Bills,1,1574025015,dxphzb
42,Dont see tre white get beat like that often.,Bills,1,1574024940,dxphzb
43,Fucking Fitzmagic,Bills,5,1574024937,dxphzb
44,*Kelvin Benjamin has entered the game*,Bills,3,1574024919,dxphzb
45,"""Look at that textbook tackle.""

As defender dives at the TE's knees.  God these commenters sucks.",Dolphins,5,1574024905,dxphzb
46,"If they score now, I'm blaming the guy who flushed his lucky poo",Bills,5,1574024900,dxphzb
47,Wtf white,Bills,1,1574024899,dxphzb
48,Cheeseburger ~~Eddie~~ Flores,Bills,1,1574024819,dxphzb
49,I just noticed the Dolphins’ uniforms have a built in tramp stamp.,Bills,5,1574024795,dxphzb
50,[removed],,1,1574024770,dxphzb
51,Today I learned I have something in common with Brian Flores.,Bills,1,1574024767,dxphzb
52,I would too but throwing 300 isn’t necessary,Bills,2,1574024767,dxphzb
53,Eh once they were out of bounds you usually should let go,,6,1574024710,dxphzb
54,Flores. Guy constantly looks like he wants to eat a cheeseburger. I imagine he would bite McDermotts skull in.,Bills,6,1574024595,dxphzb
55,"Allen, you don’t get to stiff arm someone on a pass attempt and then complain when the guy tries to finish a tackle on you.",Bills,7,1574024580,dxphzb
56,Lol Allen stiffarmed the fuck outta that guy,Bills,1,1574024558,dxphzb
57,"McD was a great wrestler, so I go with him from ground and pound",Bills,1,1574024550,dxphzb
58,[deleted],,0,1574024533,dxphzb
59,i'd like to see Josh get a 300 yrd game,Bills,5,1574024481,dxphzb
60,Who woud win in a fight Flores or McDermott,Bills,0,1574024466,dxphzb
61,You must be like 10 minutes behind,Bills,3,1574024421,dxphzb
62,I'd kind of like to see them sit Allen down and let Barkley play mop up at this point.,Bills,2,1574024416,dxphzb
63,What?,Bills,2,1574024414,dxphzb
64,They literally gushed over him on the halftime show.,Bills,5,1574024398,dxphzb
65,John Brown playing CB on that one.,Bills,2,1574024396,dxphzb
66,Now it's Brown playing dback,Bills,2,1574024393,dxphzb
67,"""the bills aren't good because they aren't blowing out bad teams""

Blows out bad team 

""eh who cares its a bad team""",Bills,3,1574024383,dxphzb
68,I mean they just won two in a row. And we scored 37...not 20 or 24...37,,1,1574024352,dxphzb
69,What is Bobby April doing these days?,Bills,2,1574024339,dxphzb
70,It be that way. We get it,Dolphins,1,1574024332,dxphzb
71,Bend over for the bills?,Bills,1,1574024277,dxphzb
72,No,Ravens,1,1574024268,dxphzb
73,[deleted],,-2,1574024264,dxphzb
74,Nothing is over when the Dolphins are playing the Bills.,,2,1574024229,dxphzb
75,"To be fair... it’s the Dolphins (sorry sea fairing buddies, no offense)",Bills,5,1574024218,dxphzb
76,I just hope the Ravens bring lube for what they're going to do the Bills.,Bills,2,1574024206,dxphzb
77,"For our opponents, yah",Bills,2,1574024206,dxphzb
78,I thought that was going to be a Ryan Fitzpatrick signature pick right there.,Bills,1,1574024182,dxphzb
79,I don’t,Bills,-1,1574024161,dxphzb
80,Quadruple coverage? Why not?,,3,1574024159,dxphzb
81,Tremaine saved that one!,Bills,1,1574024128,dxphzb
82,Next couple of games are gonna hard as fuck.,Bills,6,1574024117,dxphzb
83,Well we tried. The Tank rolls on,Dolphins,3,1574024115,dxphzb
84,No penalties to help Bills get there.,Bills,1,1574024107,dxphzb
85,The worst part about this game so far. Not a single national media member will talk about how good Allen has been this game,,2,1574024107,dxphzb
86,Daboll stays in the box from now on,Bills,3,1574024100,dxphzb
87,Don't jinx it!,Bills,1,1574024089,dxphzb
88,"Man, I love Fitz. I honestly feel bad for him today.",Bills,6,1574024079,dxphzb
89,Don't forget the king of The Meadowlands.,Bills,2,1574024042,dxphzb
90,Special teams coordinator new this year. Gonna have to fix this or it'll be a short tenure.,Bills,2,1574024031,dxphzb
91,It can turn momentum so easily. There’s a reason Belichick prioritizes ST play.,Bills,4,1574024010,dxphzb
92,Practice is gonna be hell for our special teams.,Bills,1,1574024008,dxphzb
93,Lol,Bills,0,1574024007,dxphzb
94,I think that's probably because most dolphins fans stopped caring after the first half.,Bills,3,1574023984,dxphzb
95,What’s with dudes flexing while they’re down by three scores?,Bills,2,1574023965,dxphzb
96,You hold that shit in. Just in case.,Bills,6,1574023943,dxphzb
97,"Gotta give the fins some credit. Given how terrible they started the season you'd expect them to be a pushover, but they do have some fight in them. Cheers 🍻",Bills,2,1574023921,dxphzb
98,Cold Front II,Bills,1,1574023920,dxphzb
99,"1. Julio
2. DHop
3. Evans
4. Michael Thomas
5. John Brown",Bills,1,1574023918,dxphzb
100,"Game's already over in their head, bud.",Bills,2,1574023913,dxphzb
101,If special teams were playing well I'd feel a lot better about this game. I hate watching the team play well but then ST allow a gigantic play,,2,1574023910,dxphzb
102,Fucking Christ. Kick it out of bounds at least. Giving it to them on the 40 is better than what we’ve done today.,Bills,2,1574023903,dxphzb
103,"I've been holding in a poo since the beginning of the game. Now that we have a 17 point lead, Imma go take a nice victory poo",Bills,2,1574023902,dxphzb
104,I legit thought they were gonna let Grant have it again. God.,Bills,1,1574023900,dxphzb
105,I thought he was going all the way again.,Bills,1,1574023897,dxphzb
106,Stop giving him returnable kicks! I'm gonna cry.,Bills,1,1574023884,dxphzb
107,[removed],,1,1574023824,dxphzb
108,"That was such a nice drive, damn.",Bills,3,1574023818,dxphzb
109,Every one of Buffalo’s defensive tackles have a sack.,Bills,7,1574023817,dxphzb
110,Oooooh shit. Allen might finally break 300 yards passing. 🐃,Bills,5,1574023817,dxphzb
111,It'll be nice to get a win that doesn't feel like we should have lost.,Bills,3,1574023804,dxphzb
112,In games like this I like to convince myself that the Bills are really good and we're competitive and not that the Bills are on the edge of good and were bad but trying hard.,Dolphins,9,1574023803,dxphzb
113,"Commentators low key throwing shade. ""Better to be lucky than good"". My guy, even if they dropped the pass, no way that was being intercepted unless the guy made a hell of a leap for the ball.",Bills,3,1574023792,dxphzb
114,This has been the best game I have seen Allen play,Bills,4,1574023770,dxphzb
115,Why not?,Bills,1,1574023767,dxphzb
116,Kick it out of the back of the endzone. Don't mess around with Miami special teams,Bills,2,1574023761,dxphzb
117,Notice no Dolphins fans blaming that TD on the refs?,,-3,1574023751,dxphzb
118,Allen looks like a legit QB today.,Bills,9,1574023723,dxphzb
119,John Brown is a #1 receiver I will not be taking questions.,Bills,6,1574023723,dxphzb
120,Was that deflected into his hands?  Amazing,Dolphins,2,1574023715,dxphzb
121,Ohhhhhh that was scary lol,Bills,1,1574023690,dxphzb
122,"I like this Bills fan, I hope they can start a run here. I know we're not great but I don't think we're as terrible as everyone thought either. Especially being a divisional game, Bills should be happy",Dolphins,4,1574023688,dxphzb
123,[deleted],,1,1574023680,dxphzb
124,4th quarter Josh Allen best quarter Josh Allen,,6,1574023671,dxphzb
125,THAT'S WHAT BROWN CAN DO FOR YOU,Bills,8,1574023647,dxphzb
126,Josh Allen is the king of Miami,Bills,4,1574023639,dxphzb
127,Allen looked good that drive,Bills,7,1574023628,dxphzb
128,BROWN ILY ❤️,Bills,4,1574023625,dxphzb
129,Who’d that skip off of?,,1,1574023624,dxphzb
130,Brown is having a hell of a day,Bills,3,1574023624,dxphzb
131,BOOM! TD John Brown is at it again!,Bills,1,1574023619,dxphzb
132,Commentators are clearly clueless to the fact that our offense usually goes cold late in the game when we’re up. Great move by them to stay aggressive.,,3,1574023616,dxphzb
133,He’s awful.,Bills,3,1574023606,dxphzb
134,Damn the offense looking HOT tonite.,Bills,2,1574023591,dxphzb
135,You either Doug Dimmado or Doug Dimmadon't,Bills,5,1574023590,dxphzb
136,Love that stiff arm by Singletary.,Bills,3,1574023585,dxphzb
137,As if that ever works for anyone in the AFCE,Dolphins,3,1574023583,dxphzb
138,Loving the up tempo pace. Play fearless. Score points,Bills,2,1574023579,dxphzb
139,John Brown letting the league know he is a legit #1,Bills,1,1574023567,dxphzb
140,Singletary runs with some mustard in those legs.,Bills,2,1574023565,dxphzb
141,All the more reason to give it a try.  Win or lose it's fun.,Dolphins,2,1574023558,dxphzb
142,"Yalls playcalling doesnt seem to acknowledge it though, it always seems accidental that Allen is fast.",Dolphins,1,1574023549,dxphzb
143,"Bruh, color commentators legit trying to get us to play not to lose",Bills,8,1574023539,dxphzb
144,Beasely tried to do a little too much,Bills,1,1574023492,dxphzb
145,is pretty much dominating a thing? I feel like either you dominated or you domididn't,Dolphins,10,1574023491,dxphzb
146,"Just get the fucking first down, Beasley. Don’t get cute.",Bills,4,1574023458,dxphzb
147,"They are talking about bleeding the clock. It's still a close game, play to score first. There is so much time left.",,3,1574023431,dxphzb
148,"Holding penalties are weird. Sometimes you lose a down, sometimes yardage.",Bills,1,1574023384,dxphzb
149,Brown's looking like a beast,Dolphins,3,1574023378,dxphzb
150,"This is a team that the FO is actively trying to make bad. 

And they are trying harder and doing better than teams who are trying their damnedest to be good right now.",Dolphins,2,1574023367,dxphzb
151,It started the game prior to our first Miami game,,2,1574023356,dxphzb
152,You did nothing but explain the rules.  That's not a reason why the rules should be the way they are.  I'm saying I disagree with the rule and it should be changed.,Bills,1,1574023310,dxphzb
153,Need a FG this drive,,1,1574023306,dxphzb
154,"We haven't played down as bad as other games. Offense has kept pace, and honestly, I really don't see Miami winning this. 10 point lead? Not been able to stop us from scoring atleast once in a quarter? We got this",Bills,1,1574023294,dxphzb
155,Ever since the last game against us the Dolphins have played much better,Bills,3,1574023273,dxphzb
156,Didn’t work the last time we tried it. And I think we had Ricky and Ronny back then.,,1,1574023263,dxphzb
157,"I mean, we scored 30 points. Special teams is failing hard",,2,1574023242,dxphzb
158,I ain't crying. I said I get it.,Bills,2,1574023230,dxphzb
159,Explain for what?,Bills,1,1574023222,dxphzb
160,*Real Wildcat Hours*,Dolphins,3,1574023220,dxphzb
161,"I notice you never have anything intelligent to say. Not surprising considering your username, but go ahead and try to explain why you're such an idiot.",Bills,1,1574023219,dxphzb
162,Bills Defense activates,Bills,0,1574023219,dxphzb
163,"Because the offensive team lost a loose football out of the endzone. If they lost it out their own endzone, it's a safety. If they possess it into the opposing end zone its a touchdown. If they fumble out the opposing end zone, it's a touckback. Same as if they'd kicked it out the back of the end zone.",Bills,1,1574023203,dxphzb
164,I've just accepted the Bills will always play down to their competition this season,Bills,-2,1574023202,dxphzb
165,"Great job stopping that 2-point, though.",Bills,3,1574023201,dxphzb
166,"I don't think we'll win, but damn I look at Washington and other bad teams feel and proud that this team is fighting hard.",Dolphins,6,1574023197,dxphzb
167,"Dolphins are now the only team to score over 20 points against the Bills twice. The only other team to score more than 20 points against the Bills are the Eagles

Edit: Nevermind, they didn't do extra point lol",Bills,4,1574023195,dxphzb
168,And you will continue to cry despite getting favorable calls all game,,-2,1574023191,dxphzb
169,Dumb penalties and bad tackling made that drive happen.,Bills,0,1574023135,dxphzb
170,Now the Bills fan will explain why the refs are to blame for that score.,,-1,1574023121,dxphzb
171,They utterly got pantsed by that wildcat.,Bills,2,1574023115,dxphzb
172,"Dolphins wildcat td, what year is it?",Bills,2,1574023112,dxphzb
173,"Oh ho ho, 4th quarter Fitzmagic

You know-o-o

Never believe he can't throw!

Fitzmagic

You know-o-o

Put him into the Pro Bowl!",Bills,3,1574023108,dxphzb
174,So wildcat rest of the year?,Dolphins,4,1574023106,dxphzb
175,Defense is asleep,Bills,0,1574023099,dxphzb
176,He hit Fitzy in the helmet with his helmet then landed on top of him *after* the pass was thrown LOL quit crying,,1,1574023077,dxphzb
177,"They always protect the older guys more heavily, pair that with that awful OL of course he's gonna be getting a lot of those calls",Bills,1,1574022992,dxphzb
178,Yea. Don’t grab the guy up high. I see why they called it too.,Bills,2,1574022991,dxphzb
179,[deleted],,1,1574022991,dxphzb
180,Josh hasn’t thrown an interception in the last what 4 games?,Bills,1,1574022985,dxphzb
181,that’s stupid,Dolphins,1,1574022970,dxphzb
182,Fitzpatrick is too precious for this league. He doesn't deserve to be sacked. Ever.,Bills,7,1574022970,dxphzb
183,He grabbed him up high. That was it.,Bills,2,1574022963,dxphzb
184,"I mean, I get why they called roughing the passer. I don't agree with it, but I get it.",Bills,2,1574022928,dxphzb
185,"Catchable? Who fucking cares if it is a bad pass. Because it turns out catchable passes that are poorly spotted turn into INTs, drops, and injured players more often than good passes do.",Bills,1,1574022921,dxphzb
186,imade that comment just before that play too.,Bills,2,1574022919,dxphzb
187,Play clock or game clock?,,2,1574022904,dxphzb
188,"Wallace, please don't get buried on a routine tackle",Bills,3,1574022841,dxphzb
189,That missed tackle lol!,Bills,2,1574022825,dxphzb
190,"Bills fans got their cranky pants on, talk about sore winners.",,0,1574022814,dxphzb
191,Never met the dude. I just know he is a bottom five QB and you acting like he is top 10 will never not be funny.,Bills,0,1574022805,dxphzb
192,Allen better get that call if hit the same later. Fitz is one of the most protected qbs in the league with those calls (look up stats). No excuse for bias.,Bills,0,1574022803,dxphzb
193,Levi just isn't very good.,Bills,8,1574022787,dxphzb
194,"If the helmet to helmet is so bad to be ""roughing the passer"" then next play the QB should have to come out for concussion analysis.",,1,1574022781,dxphzb
195,"Much like your 5,000 calorie breakfast.",Bills,1,1574022769,dxphzb
196,Wallace has the reaction time of a dead turtle,Bills,5,1574022768,dxphzb
197,Just you wait. The other dude who replied or Impossibills will be saying he should have come up with it. They do it constantly.,Bills,1,1574022762,dxphzb
198,"""He's gotta know better than that""

""...""

""...""

""...does he?""",Bills,18,1574022754,dxphzb
199,Levi Wallace getting exposed game after game. Time to try someone else?,Bills,2,1574022749,dxphzb
200,"20 minutes later, almost cost us the game",,1,1574022737,dxphzb
201,It was neither of those things u said,,2,1574022716,dxphzb
202,The color commentator suuuuuuccckkkksss.,Bills,7,1574022697,dxphzb
203,Explain to me why it should be a touchback,Bills,1,1574022681,dxphzb
204,That was literally nothing...come the fuck on,,5,1574022675,dxphzb
205,Helmet to helmet and pancaked,,-1,1574022673,dxphzb
206,"Gore and Singletary both look miserable on the bench, hopefully something breaks their way soon",Bills,1,1574022643,dxphzb
207,Don't think anyone will be blaming Gore for that.,Bills,1,1574022620,dxphzb
208,Activate Fitzmagic!,,1,1574022616,dxphzb
209,"We get it, you don't like Josh Allen",Bills,1,1574022610,dxphzb
210,No thank you.,Bills,1,1574022609,dxphzb
211,I think a big part of the reason that the RB's don't get screen passes or dumpoffs very often is because Allen has a hard time with that throw. He has the touch of a left tackle with them.,Bills,3,1574022591,dxphzb
212,Is this a haiku,Dolphins,1,1574022585,dxphzb
213,Well our laying an egg gave me time to email my bishops.,Dolphins,0,1574022574,dxphzb
214,Moveable force meets stoppable object.,Bills,3,1574022571,dxphzb
215,Those hiccups from Allen are what keeps people from buying in.,Bills,1,1574022554,dxphzb
216,At his ankles. Can’t wait to hear how it was Gore’s fault.,Bills,1,1574022541,dxphzb
217,"Exactly, I wasn't saying he was better. The Ravens fans were essentially saying how Allen isn't a mobile QB, meaning they don't actually see him play",,1,1574022529,dxphzb
218,"I hope they spend some time meeting the new ST coach.

Between todays all around suck and the blocked punt vs NE that should have been picked up and got an easy 1st or even a TD. Inexcusable.",Bills,2,1574022523,dxphzb
219,We needed a confidence booster.,Bills,1,1574022488,dxphzb
220,"I want to swim with the dolphins

The soft and gentle dolphins

I want to swim with the dolphins",Bills,5,1574022396,dxphzb
221,Oh yeah Allen is a natural runner he’s capable when the play breaks down even design runs.,,1,1574022391,dxphzb
222,It's actually sad to see Fitzpatrick go out like this.,Bills,6,1574022352,dxphzb
223,his ankle was tied up,Bills,2,1574022351,dxphzb
224,lol alright its okay to celebrate that I guess,Dolphins,1,1574022347,dxphzb
225,"The argument was about Lamar Jackson and he said ""Lamar Jackson also has the running capability that's why he's better than Allen""

And I said something like ""Josh Allen was his teams leading rusher last season, he is still a very natural runner""

He was insinuating that Josh Allen isn't mobile is what I'm saying, he was using it as an argument that Josh Allen doesn't run.",,1,1574022339,dxphzb
226,Probably trying to set up a block.,Bills,2,1574022333,dxphzb
227,So how do you suppose the special teams' practices will be this week?,Bills,5,1574022294,dxphzb
228,Why did he stop running on the punt return?,Bills,3,1574022263,dxphzb
229,Hurns looking like a great db on that play,Bills,3,1574022193,dxphzb
230,"You shouldn’t bring them up in the same breath as runners, but Josh Allen is a good runner",,2,1574022178,dxphzb
231,"I'm not denying Lamar Jackson is a better runner. But Ravens fans yelled at me because I said Josh Allen also has really good legs and is a good running QB.

(This was in regards to how Lamar Jackson has dangerous legs vs Josh Allen)",,3,1574022084,dxphzb
232,We are historically bad in the 3rd quarter this year.,Dolphins,5,1574022062,dxphzb
233,He needed a confidence booster. Hopefully the worst of the year is behind him,Bills,4,1574022028,dxphzb
234,Hauschka has been wonderful.,Bills,3,1574022020,dxphzb
235,Your stream is two minutes faster than mine.,Bills,1,1574021988,dxphzb
236,That rule is so incredibly stupid I don't get why they still haven't changed it after all the controversy the last two years.  It should return to the previous spot of the ball.,Bills,1,1574021987,dxphzb
237,then whys he fumble so damn much??!!,Bills,2,1574021967,dxphzb
238,Hauschka having a perfect game is under the radar but big for the bills,,4,1574021962,dxphzb
239,Hasn’t stopped his fumbling issues this year though.,Bills,3,1574021937,dxphzb
240,"Josh ""Big Hands"" Allen.",Bills,2,1574021936,dxphzb
241,3 TDs over 30 pts. Hopefully we can take this offensive momentum with us against a tough Broncos defense.,Bills,1,1574021936,dxphzb
242,He still fumbles frequently unfortunately,Bills,2,1574021932,dxphzb
243,A rollercoaster of emotions,Bills,2,1574021929,dxphzb
244,"A 3rd quarter Bills touch down?

What?",,7,1574021922,dxphzb
245,"Allen, other than a couple bad throws, has been having a decent game today! Still want to see him continue to improve in terms of accuracy, and making quicker decisions, but he’s already so much better than last year.",Bills,7,1574021912,dxphzb
246,Do you see how big his hands are?,Bills,3,1574021890,dxphzb
247,More Bills fans in Miami than the home crowd 😎😎,Bills,1,1574021889,dxphzb
248,[removed],,1,1574021872,dxphzb
249,"great run but those runs when the ball carrier stretched over the pylon make me nervous, such a big difference fumbling right there verse a few yards further.",Bills,7,1574021835,dxphzb
250,"FUCKIN’ ALLEN!! M’BOY!

Edit: NOOOO!!!

2nd Edit: YESSSS!!!!",Bills,3,1574021823,dxphzb
251,Refs look so clueless,Eagles,3,1574021821,dxphzb
252,"The moment I saw how few people were on the near side of the field, I knew Allen was going to run for it.",Bills,5,1574021769,dxphzb
253,Lol,Bills,3,1574021763,dxphzb
254,"Never retire, Gore.  Always good for 3-4 yards. 👍👍",Bills,4,1574021696,dxphzb
255,"Golf cart capital of the world, bud.",,15,1574021681,dxphzb
256,Glad to see the Dolphins showing respect to Nsekhe.,Bills,6,1574021655,dxphzb
257,JB with another 3rd down catch for a 1st down. He's a machine.,Bills,4,1574021631,dxphzb
258,It's going to suck if that's broke.,Bills,1,1574021615,dxphzb
259,I hate that his term fits so well.,Bills,2,1574021580,dxphzb
260,Miami has a working cart!,Bills,7,1574021560,dxphzb
261,And incompletions bouncing into fumbles LOL,,-4,1574021526,dxphzb
262,[deleted],,1,1574021508,dxphzb
263,"Oh, is that one of those inflatable casts on Nsekhe? Oof.",Bills,3,1574021506,dxphzb
264,Kinda makes me wonder if that’s why we haven’t been relying on him too much... maybe coaches saw it in practices.,Bills,3,1574021484,dxphzb
265,"fyi i was referring to

https://www.elitedaily.com/sports/genius-traded-kiko-alonso-jersey-blowjob-bills-game",Bills,2,1574021480,dxphzb
266,"They're not exactly related though, him fumbling doesn't all of a sudden absolve Daboll?",Bills,3,1574021464,dxphzb
267,Par for the course for NFL officials.,Bills,0,1574021438,dxphzb
268,"Singletary, hold onto the ball bro.",Bills,5,1574021419,dxphzb
269,Fumbles really bouncing Buffalo's way today.,Dolphins,5,1574021411,dxphzb
