,body,author_flair_text,score,created_utc,link_id
886,"This just in 

Teams lose to their rivals.",Saints,1,1573418896,duedcw
887,Man where did this Atlanta pass rush come from,,4,1573418894,duedcw
888,"Falcons before today: 7 sacks 

Falcons in this game: 5 sacks",Falcons,8,1573418894,duedcw
889,He is still a bit. He was listed on the injury report with LP some days,Saints,1,1573418893,duedcw
890,The definition of getting caught smelling yourself.,Falcons,0,1573418892,duedcw
891,I'm going to say something nice.  Thomas is legit.,Falcons,5,1573418890,duedcw
892,Saints making the fucking falcons look like the bears in 86 lmao,,3,1573418889,duedcw
893,SAVE US MICHAEL THOMAS,Saints,1,1573418888,duedcw
894,I think we have him on a limited snap count,Saints,1,1573418886,duedcw
895,"Nah, upsetting Saints fans is worth the worse draft pick, and Quinn isn't staying unless we end 9-7 and make the playoffs.",Falcons,1,1573418885,duedcw
896,"Keep brees in, Teddy doesn't deserve this shit.",NFL,0,1573418883,duedcw
897,We stopped running killed us,Saints,1,1573418882,duedcw
898,Where was this Falcons’ team all season?,Falcons,1,1573418881,duedcw
899,"And my friend

Dee ford",49ers,2,1573418880,duedcw
900,Brees about to take all the foot baths he got for his linemen for Christmas back to Bed Bath &amp; Beyond,Rams,3,1573418880,duedcw
901,Just like the Saints' offense,Seahawks,1,1573418879,duedcw
902,Needed to start 15 minutes ago,Saints,1,1573418879,duedcw
903,Now keep running him,Cowboys,1,1573418879,duedcw
904,Go back to the hangover lol,Panthers,1,1573418878,duedcw
905,Quinn's not calling defensive calls today.,Falcons,1,1573418877,duedcw
906,Sack party in New Orleans lmfao,Falcons,3,1573418876,duedcw
907,hahahaha Grady is Bree5 daddy,Falcons,2,1573418875,duedcw
908,Holding like a mf there too. BEAST,Texans,2,1573418875,duedcw
909,Oh y’all do that too? Nice,Panthers,1,1573418872,duedcw
910,Exactly. We fucking suck.,Falcons,1,1573418870,duedcw
911,"Hasn’t to be one of the worst O Line performances ever right? 

Best O Line in the league vs Worst D Line and gave up 5 sacks so far",Saints,3,1573418870,duedcw
912,Our offensive line has been awful today,Saints,1,1573418870,duedcw
913,Even better. They’re 1-7. Doesn’t hurt as much as losing to the Panthers or Bucs.,Saints,1,1573418869,duedcw
914,SACKLANTA,Falcons,3,1573418868,duedcw
915,sit brees. absolutely do not need him getting hurt in garbage time here,Saints,3,1573418865,duedcw
916,"Should we do the ""we're doomed season over""?",Saints,3,1573418865,duedcw
917,"No, we are playing like absolute trash today. We usually look way better than this.",Saints,1,1573418865,duedcw
918,kick faster bro!! (seriously how are you this fucking dense?),Saints,0,1573418863,duedcw
919,Banged up O-line.,Saints,1,1573418861,duedcw
920,Beating a good Saints team &gt; not getting chase young anyways.,Falcons,3,1573418860,duedcw
921,It’s known,Falcons,1,1573418860,duedcw
922,Our O-Line must hate Drew.,Saints,1,1573418858,duedcw
923,Is Kamara still hurt?  Run the ball my dudes,Saints,0,1573418858,duedcw
924,This was truly a trap game,Browns,3,1573418857,duedcw
925,Something is off with our line,Saints,1,1573418854,duedcw
926,Clayborn thinks he's still in that Cowboys game,Falcons,2,1573418852,duedcw
927,Our o line is so fucking bad it’s gonna kill Brees,Saints,2,1573418852,duedcw
928,Nope,Saints,1,1573418848,duedcw
929,"&gt; Man saints getting ~~mad unlucky~~ dad dicked today

Ftfy",Falcons,3,1573418848,duedcw
930,Sacked again! Yo what's happening,Falcons,3,1573418840,duedcw
931,"Get Brees out of the game, I don’t want him hurt",Saints,5,1573418839,duedcw
932,Yes he did. He's also a few weeks out from surgery and took a pounding most of the game. Saying he wasn't hurting during or especially after that game is laughable,,1,1573418829,duedcw
933,[deleted],,2,1573418828,duedcw
934,Haha that lady fell asleep,Packers,4,1573418828,duedcw
935,We can only blame ourselves for this loss. We made big plays only to have them negated by penalties. Need to keep heads up and move on to next game.,Saints,3,1573418828,duedcw
936,Who is ready for soft zone and prevent defense,Falcons,6,1573418825,duedcw
937,You're talking a lot of shit for a team with nothing to play for but a worse draft pick and extending a shitty coach.,Saints,1,1573418824,duedcw
938,I mean.. an eye opening loss could be good for your team. It happens all the time.,Saints,-1,1573418824,duedcw
939,"Yeah it’s just been like, two plays since the last penalty.  We’ll show up on our converted 3rd down here that gets negated by a bullshit call.",Saints,1,1573418824,duedcw
940,Lmaooooo someone gif that lady sleeping,,2,1573418823,duedcw
941,Before the Atlanta Failcons get excited your reminder that you're just fucking up your draft pick for next year and the Panthers are going up against a hot Packers team right after this. Nothing will change in your division and a win here just fucks over next year's team.,Cowboys,-9,1573418822,duedcw
942,lmao,Saints,0,1573418820,duedcw
943,"Agreed they came in not thinking much but again, we been screwing ourselves. See ya in a few weeks !",Saints,1,1573418819,duedcw
944,Plenty of time left for the Falcons to screw this up,Eagles,4,1573418816,duedcw
945,But... Its a loss to the Falcons of all teams.,Ravens,5,1573418816,duedcw
946,Yea that’s right CGM,Saints,0,1573418815,duedcw
947,"Too bad we're beyond the trade deadline, mightve gotten Sanu back for a first.",Falcons,1,1573418814,duedcw
948,Well shut it we lose this game it's all on us not the refs although there plenty of penalties it was all on us. We aren't screwed but jesus guys.,Saints,5,1573418814,duedcw
949,why dont you go read in a mirror,Saints,0,1573418812,duedcw
950,You know what. That's hilarious,Saints,1,1573418811,duedcw
951,Not until that clock is 0:00,Falcons,1,1573418810,duedcw
952,"Saints just aren't getting it done today. Like my Packers last week against the Chargers, Saints haven't looked prepared/executed today.",Packers,4,1573418808,duedcw
953,"So is the Saints O-line always this mediocre?

Asking for a friend.

^...


^^The ^^friend ^^is ^^Nick ^^Bosa.",49ers,12,1573418803,duedcw
954,I recognize that. It’s Japanese for California Roll.,Steelers,3,1573418803,duedcw
955,It's a great day to be a Panthers fan so far,Panthers,1,1573418803,duedcw
956,"Agreed, y'all should fire him",Falcons,1,1573418801,duedcw
957,400 IQ by the saints today,Falcons,1,1573418799,duedcw
958,😂,Falcons,2,1573418799,duedcw
959,Super Bowl LI intensifies.,Falcons,1,1573418792,duedcw
960,If NO is going to somehow pull this off it has to start this drive.,Packers,2,1573418792,duedcw
961,Or we’re really that bad,Saints,1,1573418791,duedcw
962,"lol yup, their delusions are so entertaining",Falcons,5,1573418790,duedcw
963,[deleted],,0,1573418788,duedcw
964,I love them young hoes,Packers,2,1573418788,duedcw
965,I'm here and I will be bitching until the inevitable heartbreaking playoff loss we take,Saints,2,1573418785,duedcw
966,Saints are out-Falconing the Falcons by far. The offense is sputtering.,Saints,2,1573418784,duedcw
967,I mean the subs full of armchair coaches. So they must be right!,Saints,2,1573418781,duedcw
968,One bad game isn’t the end of the world. We good.,Saints,4,1573418775,duedcw
969,you wouldn’t know it from these replies lmao,Saints,1,1573418773,duedcw
970,Yeah literally trying to lose. Fuck off. Fuck you.,Saints,1,1573418772,duedcw
971,[removed],,1,1573418772,duedcw
972,I’m gonna go ahead and call that scenario not likely compared to just finding the end zone twice.,Packers,1,1573418770,duedcw
973,"3-13 won't save him.

6-10 though...",Falcons,1,1573418769,duedcw
974,Ball don’t lie and we playing like we didn’t think this game would be competitive,Saints,5,1573418769,duedcw
975,"Heck yeah, was rooting for them as well!",Falcons,1,1573418765,duedcw
976,"I could do a better job than he’s done this game, penalties, missed tackles, horrible play calls, holy shit. What the fuck did he do during the bye week?",Saints,1,1573418765,duedcw
977,KOOO KOOOOOO,Falcons,4,1573418763,duedcw
978,Progress,Saints,2,1573418759,duedcw
979,bring back teddy lmao,49ers,2,1573418749,duedcw
980,Maybe not be in midair flying toward the punter in that situation chief,Panthers,1,1573418745,duedcw
981,"So...Saints fans are doing that ""this loss is good for us"" bull shit now?",Eagles,17,1573418744,duedcw
982,is that fan falling asleep LMAO,Cowboys,3,1573418742,duedcw
983,Nope,Saints,2,1573418739,duedcw
984,And always relevant lol,Saints,1,1573418738,duedcw
985,Spoken like a true Falcons fan,Falcons,5,1573418734,duedcw
986,Nah he’s gone but just happy to stick it to ya’ll,Falcons,0,1573418733,duedcw
987,안녕하세요 motherfuckers,Falcons,17,1573418731,duedcw
988,"Don't worry business will return as usual.

We might stuck again after this game",Falcons,1,1573418727,duedcw
989,From a Miami fan? Lol bold,Saints,1,1573418726,duedcw
990,"There’s plenty of time for a score, stop, and score still. Especially for Brees. Breathe, man. I know firsthand how easy it is to give up on a game, you just have to breathe right now.",Packers,1,1573418725,duedcw
991,Man saints getting mad unlucky today,Saints,-14,1573418724,duedcw
992,He took a helmet to his plant leg,Falcons,9,1573418722,duedcw
993,4D chess,Falcons,4,1573418721,duedcw
994,Yeah like that hit right there could have easily blown his knee out,Cowboys,2,1573418720,duedcw
995,I like that Salute to service commercial,Saints,1,1573418718,duedcw
996,He was assigned #7 and said he felt uncomfortable asking for something else since he's new on the team,Falcons,1,1573418718,duedcw
997,Love it,Saints,0,1573418710,duedcw
998,I mean we’re probably still picking top 5 and you’re probably still going to the playoffs. Our games are literally the only thing we have to look forward to this season.,Falcons,4,1573418707,duedcw
999,"?

2pt conversion + fg would have been enough",Saints,1,1573418706,duedcw
1000,Ok I'm mad but relax,Saints,1,1573418705,duedcw
1001,it's Saints Falcons so duh,Saints,4,1573418704,duedcw
1002,[removed],,1,1573418703,duedcw
1003,Natural punting motion,49ers,1,1573418699,duedcw
1004,go fuck your own face,Falcons,3,1573418699,duedcw
1005,2 weeks to prepare. More like 2 weeks to forget what your doing on this fucking earth,,8,1573418697,duedcw
1006,*쿠쿠쿠쿠쿠,Falcons,3,1573418697,duedcw
1007,"Always is man, record doesn't matter in these. Gotta relish these Brees vs Ryan games while we can",Falcons,1,1573418694,duedcw
1008,Tua played great,Jaguars,0,1573418693,duedcw
1009,Saints didn’t get a helmet to helmet against the kicker on that FG. Looks like they’re turning a corner.,Steelers,8,1573418692,duedcw
1010,"Not just that, but the motion in which they get hit could seriously take out their legs",49ers,2,1573418691,duedcw
1011,Dude if you expected this thread to not be salty regardless of outcome then you haven’t been paying attention.,Saints,2,1573418689,duedcw
1012,Your guys aren't taking us seriously and that's a big no no,Falcons,4,1573418685,duedcw
1013,Have you ever watched a sport? They tend to be unpredictable.,Saints,1,1573418685,duedcw
1014,I think most of us are more mad with our own team/refs tbh,Saints,2,1573418682,duedcw
1015,Atlanta has Brees and Ron Darby to thank for not joining the Lions and Browns,Patriots,1,1573418682,duedcw
1016,we're still here,Saints,2,1573418682,duedcw
1017,Maybe New Orleans is playing the long game by trying to save Dan Quinn’s job?,49ers,12,1573418681,duedcw
1018,Lmao enjoy your upvote and probable win.,Saints,2,1573418681,duedcw
1019,"""Tactical loss Dan Quinn extension""

(Insert that pic of the guy crying behind the mask)",Saints,3,1573418681,duedcw
1020,Ahhh the Jeff Fisher special.,,2,1573418680,duedcw
1021,Ain't over yet.  Still plenty of time for the falcons to be the falcons.,Falcons,10,1573418680,duedcw
1022,Peyton: bounties are back on the menu boys,Falcons,2,1573418679,duedcw
1023,that helmet to the knee hit looked nasty,49ers,2,1573418676,duedcw
1024,Hopefully if we do lose this can be a wake up call for the discipline and be a net positive down the stretch. Rusty off the bye week is usual but they need some yellin at.,Saints,3,1573418675,duedcw
1025,"Saints defense actually did well...they got unlucky with Lattimore going out and having to shift the defense, but they did well all things considered. It's not their fault the offense hasn't reached the end zone.",Saints,1,1573418675,duedcw
1026,nah bro im doubling down because these clowns think im serious somehow,Saints,-3,1573418672,duedcw
1027,I hate you for this truth.,Falcons,2,1573418670,duedcw
1028,lol wow that’s even more unreal,Falcons,2,1573418668,duedcw
1029,WTF NO?!?!?,Patriots,2,1573418668,duedcw
1030,ㅋㅋㅋㅋㅋㅋㅋㅋㅋㅋ,Falcons,5,1573418668,duedcw
1031,ATL HOE,Falcons,6,1573418667,duedcw
1032,You haven't watched enough Teddy then if you think he's great.,Saints,1,1573418666,duedcw
1033,Falcons were 14 point underdogs,Falcons,6,1573418663,duedcw
1034,Best player I’ve ever seen wear number 7,Falcons,3,1573418662,duedcw
1035,Pats missed up big time passing on that guy,Vikings,3,1573418661,duedcw
1036,Falcons punter can't be that hurt if he's holding the field goal,Saints,-13,1573418661,duedcw
1037,What the fuck? That's the goal of literally any team's ST recieving a punt.,49ers,0,1573418661,duedcw
1038,Based Koo,Seahawks,4,1573418660,duedcw
1039,We lost a good amount of time because of it. It’s over we suck.,Saints,1,1573418654,duedcw
1040,Angle your dive so you don't take out the plant leg.,Falcons,1,1573418653,duedcw
1041,"He didn’t, he said before the game they gave it to him and didn’t have a choice",Rams,5,1573418650,duedcw
1042,Younghoe sliding in,Falcons,11,1573418649,duedcw
1043,[Only one team choked on this day](https://i.imgur.com/L5NuCRR.jpg),Falcons,3,1573418647,duedcw
1044,I haven't been watching the whole game but that TFL on Hooper was just nutty.,Panthers,1,1573418645,duedcw
1045,"
Oopsie",Falcons,1,1573418639,duedcw
1046,lmao yall are great,Saints,-1,1573418639,duedcw
1047,alright guess i gotta start my voodoo rituals,Saints,5,1573418637,duedcw
1048,Dan Quinn reacting like he saved his job. That's the only good news if Saints lose.,Saints,7,1573418636,duedcw
1049,"Looks like all the fairweather Saints fans already left the thread.  
Bitching and moaning slowed down.",Falcons,12,1573418634,duedcw
1050,No I'm pissed bc I had the saints ML,Dolphins,1,1573418634,duedcw
1051,Oh yeah they mad lol,Falcons,5,1573418633,duedcw
1052,Man I just can’t be worried about this ATL team. We’ve been shooting our selves. We deserve the loss playing like this.,Saints,3,1573418633,duedcw
1053,Saints playing the long game,Falcons,4,1573418630,duedcw
1054,Here before delete,Cowboys,5,1573418630,duedcw
1055,KooMatic baby,Falcons,5,1573418629,duedcw
1056,i love how koo took #7,Falcons,4,1573418627,duedcw
1057,₩,Falcons,1,1573418627,duedcw
1058,you must be new to Saints-Falcons,Saints,2,1573418624,duedcw
1059,THATS MY YOUNGHOE,Falcons,8,1573418618,duedcw
1060,Just another Younghoe making a killing in the streets of New Orleans.,Steelers,6,1573418616,duedcw
1061,Are you new to football or something?,Falcons,1,1573418616,duedcw
1062,Saints fans and paper bags,Falcons,3,1573418614,duedcw
1063,And the falcons won’t get the #1 pick,Saints,6,1573418614,duedcw
1064,Dude the rap they made last year was the single cringiest thing I've ever seen in response to a result of a game,49ers,2,1573418614,duedcw
1065,[removed],,1,1573418613,duedcw
1066,It's Drew Brees time now.,Saints,0,1573418612,duedcw
1067,Georgia teams and heartbreaking choke jobs.,Saints,0,1573418611,duedcw
1068,"Didn’t affect anything. Y’all needed two TDs and now you need two TDs. If you actually make that comeback, you’ll have momentum in OT anyway.",Packers,2,1573418609,duedcw
1069,thank you based young hoe,Falcons,4,1573418606,duedcw
1070,Lmao this thread got SALTY real fast.,49ers,12,1573418606,duedcw
1071,Lol the ball kissed the post.,,2,1573418605,duedcw
1072,Rashad Ross,Saints,3,1573418605,duedcw
1073,MY OLD HOE WAS TRIPPING BUT MY YOUNGHOE KOO,Falcons,17,1573418601,duedcw
1074,KoOoOoOoO,Saints,5,1573418593,duedcw
1075,"It’s almost like this is a rivalry game

Kinda like how the dolphins always give the Pats problems

New to sports?",Saints,1,1573418592,duedcw
1076,Yeah that was ugly. I hope he's okay I hate seeing knees get hit,Saints,3,1573418592,duedcw
1077,Koo got these Younghoes MAD,Falcons,9,1573418587,duedcw
1078,YUNG MONEY$$,Falcons,7,1573418586,duedcw
1079,Aw shit that's my AAF boy,Panthers,8,1573418586,duedcw
1080,[deleted],,1,1573418585,duedcw
1081,The good news is that Dan Quinn will probably keep his job after this,,5,1573418585,duedcw
1082,You're just a fucking moron wow.,Saints,8,1573418584,duedcw
1083,Alright Brees be clutch,Saints,-1,1573418582,duedcw
1084,[removed],,1,1573418582,duedcw
1085,Fuck Sean Payton so fucking garbage,Saints,-4,1573418582,duedcw
1086,We should’ve kept him :(,Patriots,1,1573418581,duedcw
1087,Man younghoe looks decent,,2,1573418579,duedcw
1088,If it wasn’t a flag literally every punter would go on IR every season,Cowboys,3,1573418579,duedcw
1089,Dirty af,49ers,1,1573418579,duedcw
1090,Damn Kooze,Rams,2,1573418578,duedcw
1091,Man I'm loving having Panthers fans on our side for this game.,Falcons,2,1573418577,duedcw
1092,Here we see another example of the Lousiana educational system at it's finest,Falcons,10,1573418575,duedcw
1093,Good kick!,Falcons,3,1573418573,duedcw
1094,This ain’t it.,Saints,6,1573418571,duedcw
1095,KOOOOOoooooo......,Panthers,1,1573418570,duedcw
1096,You can’t get CTE from your legs,Falcons,6,1573418570,duedcw
1097,Big mad.,Falcons,6,1573418563,duedcw
1098,YOUNGHOEEEEEE,Falcons,3,1573418563,duedcw
1099,"This ain’t it, Chief",Browns,5,1573418560,duedcw
1100,"Dude, don't be an asshole.",Falcons,2,1573418559,duedcw
1101,He’s been like this since shanny came in 2015.,Falcons,1,1573418558,duedcw
1102,he was in the air flying towards the punter lol is he supposed to change directions mid air?,Saints,-1,1573418557,duedcw
1103,Original lol,Falcons,2,1573418557,duedcw
1104,Get a life idiot,Cowboys,1,1573418556,duedcw
1105,might be the dumbest thing I've read today,Falcons,9,1573418556,duedcw
1106,Stay classy new Orleans,Panthers,10,1573418552,duedcw
1107,We have a statue dedicated to blocking one of your punts lol,Saints,0,1573418551,duedcw
1108,We gonna rough the kicker now?,Saints,5,1573418550,duedcw
1109,With that roughing the kicker call this game is over holy shit what a terrible end to a pathetic performance.,Saints,11,1573418550,duedcw
1110,Oh fuck off lol,Falcons,7,1573418549,duedcw
1111,lmao wtf,Cowboys,8,1573418547,duedcw
1112,Falcons have played much better today....  saints get ready to eat the humble pie,Saints,13,1573418546,duedcw
1113,It's the risk of trying to block one from the middle.,,1,1573418544,duedcw
1114,Lol dolphins talking shit wut,Saints,14,1573418542,duedcw
1115,"What?

If you didn’t have that teams would just be taking out kickers left and right wtf u on",Saints,14,1573418542,duedcw
1116,[deleted],,1,1573418541,duedcw
1117,Lol,Patriots,8,1573418540,duedcw
1118,Do you seriously think Tua wasn't hurt?,,-1,1573418540,duedcw
1119,"Just no, don’t be that guy",Saints,9,1573418540,duedcw
1120,Only villains do that,Packers,3,1573418540,duedcw
1121,"Knee, even worse",Vikings,1,1573418540,duedcw
1122,"you can't try to make that play, that's what it means

the tradeoff of seeing punter's careers ended regularly for a few more punt blocks just isn't worth it",Falcons,2,1573418537,duedcw
1123,You're trash,Saints,14,1573418536,duedcw
1124,"Injuring a player, AND fucking your team over. Can't fuck up much worse than that.",49ers,5,1573418534,duedcw
1125,No we are a step behind man. No malice in their play. They are just fucking sucking it up.,,1,1573418533,duedcw
1126,Did take a helmet right to the knee. I'd imagine that hurt you too,Packers,1,1573418529,duedcw
1127,Are you serious?  He put his helmet right in the punter’s planted leg way after the kick was off,Falcons,2,1573418522,duedcw
1128,Any given sunday,Saints,8,1573418521,duedcw
1129,Won’t need him for this game as long as you’ve got another holder,Saints,1,1573418521,duedcw
1130,Lol I think he actually got got though. He looked like he was in pain the second contact was made.,Falcons,2,1573418518,duedcw
1131,Sarcasm doesn’t translate very well through text but I’m assuming that you’re being sarcastic,Cowboys,11,1573418518,duedcw
1132,[removed],,-54,1573418511,duedcw
1133,You want to uhhh. Check that one again.,Falcons,1,1573418511,duedcw
1134,Huh?,Packers,3,1573418510,duedcw
1135,Oh That could've been nasty,Falcons,6,1573418508,duedcw
1136,Only the ones already too drunk to see the TV.,Saints,2,1573418507,duedcw
1137,Not smash his helmet into our kickers shin.,Falcons,5,1573418507,duedcw
1138,OMG.,Falcons,5,1573418507,duedcw
1139,We all have them,Steelers,1,1573418507,duedcw
1140,[removed],,-25,1573418506,duedcw
1141,They're taking this to Congress!,Falcons,8,1573418506,duedcw
1142,Who’s our 6th punter?,Falcons,2,1573418505,duedcw
1143,This is what I get for cheering for Minny yesterday,Saints,2,1573418505,duedcw
1144,28 and 3,Saints,4,1573418503,duedcw
1145,Like half of them,Saints,4,1573418501,duedcw
1146,I'm not blaming the refs alot of fans in here aren't blaming the refs. You're cherry picking to get your hate in.,Saints,1,1573418498,duedcw
1147,7-1 AND YOU'RE GETTING FUCKED BY A 1 WIN TEAM.,Dolphins,17,1573418497,duedcw
1148,"They say that mimicry is the greatest form of flattery, as you can see with the Saints defense and special teams play.",Falcons,7,1573418496,duedcw
1149,Lucky didn’t get injured,Falcons,2,1573418494,duedcw
1150,"""Automatic first down""

Wow, no matter what we do, we *can't* lose this game.",Falcons,7,1573418493,duedcw
1151,Never seen Matt Ryan move like this in his life,Saints,7,1573418492,duedcw
1152,I hope we wake up now,Saints,1,1573418491,duedcw
1153,gtfo clown,Saints,0,1573418491,duedcw
1154,whyyyyyyyy,Saints,1,1573418489,duedcw
1155,"We are literally trying to lose, we are so bad. Roughing the kicker??? Seriously???",Saints,1,1573418488,duedcw
1156,How the fuck are you guys on your 5th punter?,Panthers,1,1573418488,duedcw
1157,Fuck that guy wow,Falcons,3,1573418487,duedcw
1158,Not arguing we are playing dumb today,Saints,2,1573418484,duedcw
1159,"Saints and injuring players, name a more iconic duo.",Falcons,24,1573418484,duedcw
1160,"Well, fuck.",Saints,0,1573418481,duedcw
1161,How many first downs off of penalties?,Saints,8,1573418481,duedcw
1162,This reminds me of GB's game vs LAC last week,Packers,3,1573418480,duedcw
1163,It's just that type of day huh,Saints,5,1573418479,duedcw
1164,"LMAO. Look at that limp! Geez, he’s selling that injury more than Tua after that L yesterday.",Falcons,0,1573418478,duedcw
1165,"No flair user whining about other teams fans 

More at 11",Saints,1,1573418476,duedcw
1166,the punter carousel continues spinning for atlanta,Falcons,2,1573418476,duedcw
1167,"Demario Davis: 10 total tackles, 6 solo tackles, 3 tackles for loss, 1 sack, 2 QB hits, 1 pass defensed. My dude is beasting, regardless of the rest of the defense.",Saints,5,1573418474,duedcw
1168,How you gonna dive straight on and not expect to hit the punter,,7,1573418474,duedcw
1169,"I feel bad for punters, they’re the one player that fans like to see get hit (obviously don’t want them to get injured but the free first downs are awesome)",Cowboys,4,1573418474,duedcw
1170,Saints couldn't be playing worse,Falcons,4,1573418474,duedcw
1171,OMG the refs keep throwing flags on critical plays for the Saints. So rigged.,Rams,-6,1573418474,duedcw
1172,LOL,Vikings,2,1573418471,duedcw
1173,I don't get roughing the kicker penalties sometimes. Sure it's dangerous but what was our player supposed to do there when he's trying to block one?,Saints,-13,1573418470,duedcw
1174,wOw LoOk aT tHeSe BiAsEd ReFs,Panthers,11,1573418469,duedcw
1175,New Orleans iq right there,Falcons,1,1573418469,duedcw
1176,Saints players getting frustrated and **real** chippy.,Falcons,6,1573418468,duedcw
1177,Give me all the trash talk Falcons fans we deserve it lol,Saints,2,1573418468,duedcw
1178,Omg man why,,1,1573418464,duedcw
1179,I'm surprised the punter walked that off.,Texans,3,1573418463,duedcw
1180,Gimme a fucking break,Falcons,2,1573418462,duedcw
1181,"My god, playing like absolute trash today",Saints,2,1573418461,duedcw
1182,I will be our 6th punter,Falcons,4,1573418459,duedcw
1183,Only when Tua does something poorly,Steelers,0,1573418459,duedcw
1184,This dude dived into the punter and wasn’t even close to blocking it lmao,,4,1573418458,duedcw
1185,injuries starting to fuck us,Falcons,2,1573418456,duedcw
1186,God damn bullshit fucking fuck,Saints,0,1573418453,duedcw
1187,gonna have to call new england to get sanu back to punt before long,Falcons,1,1573418452,duedcw
1188,Saints love flags,Falcons,2,1573418450,duedcw
1189,Oh my god,Packers,1,1573418448,duedcw
1190,"Every team has shitty games, we had ours last week and we were voted the most overrated team in the NFL by this sub lmao",Packers,2,1573418447,duedcw
1191,"No, did you actually watch the game? The offense is the problem.",Saints,1,1573418447,duedcw
1192,We really fucking blew it lol,Saints,5,1573418447,duedcw
1193,"Jeez, helmet in his knee. That's gotta fucking hurt",Panthers,9,1573418446,duedcw
1194,why're you laughing man?,Saints,1,1573418445,duedcw
1195,Fuck you Payton garbage job,Saints,1,1573418444,duedcw
1196,That's exactly why that's a penalty,Panthers,9,1573418442,duedcw
1197,I want you to have it too.,Panthers,1,1573418442,duedcw
1198,That was a very clear penalty,Falcons,1,1573418440,duedcw
1199,He drove his fucking helmet into his plant leg. Dangerous play.,Falcons,9,1573418439,duedcw
