,body,author_flair_text,score,created_utc,link_id
1119,"Anyone who watched Mizzou football isn't scared of Lock. Intrigued he's good enough to maybe make games interesting at best but we will own the west for a while. The other 3 AFCW teams can fight for which 1 of you is relevant year to year, which happens to be none of you this year.",Chiefs,1,1576438958,eb1r02
1120,[deleted],,1,1576438954,eb1r02
1121,Blizzard!!,Seahawks,1,1576438950,eb1r02
1122,"Broncos should’ve stuck with Brandon Allen.

edit- satire. Sheesh ppl",Steelers,-2,1576438945,eb1r02
1123,"Well then, you may not wanna talk with my Uncle.",Bills,1,1576438920,eb1r02
1124,Nah you just can't take any criticism of the golden frog,Broncos,0,1576438897,eb1r02
1125,"I was gonna watch my Pats play the second half, but snow games are more fun so I'm just gonna record it.",Patriots,1,1576438889,eb1r02
1126,don't you have another owen record to put out under the American Football name or something?,Broncos,1,1576438887,eb1r02
1127,"""Could you imagine Lamar playing in the snow.""? 
""He'd be impossible to find."" 
- Booger 2019.",Ravens,3,1576438875,eb1r02
1128,"I saw Young Sheldon's brother last night at league. This kid was unironically rocking a mullet while he had his denim overshirt tucked into his jeans (both free of any work or wear). And to top it off he had on this big-ass fucking gold belt buckle the size of a dinner plate 


Couldn't have been older than 17-18 and clearly thought he was the shit",Chiefs,3,1576438873,eb1r02
1129,I really want to chalk LDTs regression this season up to his ankle injury slowing him down. He was solid before he went down.,Chiefs,1,1576438872,eb1r02
1130,Those Chiefs fans are morons too.,Chiefs,2,1576438858,eb1r02
1131,You might wanna check your flair before you come in complaining about QBs getting flags,Chiefs,0,1576438844,eb1r02
1132,[removed],,1,1576438816,eb1r02
1133,"Black man looks on incredulously at white man's antics.

-This winter on CBS.",Broncos,10,1576438807,eb1r02
1134,"Who cares, still makes him look like a baby. Bunch of Chiefs fans said it in the comments lol.

Luck wasn't that bad.",Broncos,0,1576438805,eb1r02
1135,Pretty sure most of us condemn those hits when our guys do them,Chiefs,1,1576438792,eb1r02
1136,Y O U N G   S H E L D O N,Broncos,2,1576438789,eb1r02
1137,Don't feed the troll. Downvote and move on.,Chiefs,3,1576438732,eb1r02
1138,Dude really wants to coach in the NFL. Someone will grab him.,Cowboys,2,1576438721,eb1r02
1139,"Nope. If he had kept his head up and hit him with the facemask, I'd be mad if he'd had gotten flagged.",Chiefs,1,1576438713,eb1r02
1140,That dude is a hack. Literally has some health problems during or right before NCAA violations. Fuck him.,Steelers,3,1576438702,eb1r02
1141,I do not like the Raiders.,Chiefs,11,1576438685,eb1r02
1142,"Nah, he complains too. Just not very often. But he's fantastic, so not much to complain about.",Chiefs,1,1576438681,eb1r02
1143,Later it was found out to be the patriots scouting team recording tyreek...,Chiefs,3,1576438679,eb1r02
1144,I wouldn't call that fortunate. Our redzone D is one of the best in the league,Broncos,2,1576438672,eb1r02
1145,Players beg for flags on every fucking play.  QBs like Mahomes are just on camera more than anyone else.  Attend a game live and you'll notice it.,Chiefs,3,1576438670,eb1r02
1146,are they really going to build around Dwayne Haskins?,Ravens,1,1576438661,eb1r02
1147,"Both can be true, it's a bitch move but it works and that kinda sucks",Chiefs,4,1576438627,eb1r02
1148,"I'm pretty sure Patrick Mahomes was calling for DPI on that one play, not RTP.",Chiefs,6,1576438612,eb1r02
1149,"Also included in that recording is him saying she lied about abuse and her saying something like ""we ain't talking about that right now.""",Chiefs,4,1576438606,eb1r02
1150,That’s most QBs,Chiefs,5,1576438604,eb1r02
1151,It is annoying as fuck.,Chiefs,1,1576438574,eb1r02
1152,Sir this is an Arby's,Chiefs,9,1576438540,eb1r02
1153,**Imagine Bill Cowher and Terry Bradshaw were Auctioneer's?**,Panthers,0,1576438537,eb1r02
1154,"He wouldn't be doing it if it didn't work out now and again.

Same reason why all soccer players are acting like bitches every single contact, because they get a free kick every single time.",Chiefs,10,1576438536,eb1r02
1155,We need to finish drives,,2,1576438529,eb1r02
1156,"I mean, can’t deny that was helmet to helmet. I don’t love the rule but that’s the rule.",Chiefs,2,1576438527,eb1r02
1157,"Kittle is good. Definitely number 2. Kelce is without a doubt number 1. I mean literally all pro’s agree on this. Kelce has record after record. Kelce is consistently getting 1,000 yard seasons. Kelce has shown for several years now he’s not going anywhere. When you’re so good for so many seasons, you get to this point. Kittle doesn’t have enough time in the league to be considered the best. It’s simple.",Chiefs,1,1576438524,eb1r02
1158,Ya it wasn't a foul,,-1,1576438512,eb1r02
1159,He right tho,Broncos,0,1576438511,eb1r02
1160,"Anyone else see that Urban Meyer sighting in the Washington owners box? 

Interesting, very interesting....",Chiefs,2,1576438504,eb1r02
1161,**Nobody Circles the Drains like the Carolina Panthers**,Panthers,3,1576438490,eb1r02
1162,Nah man people just hate the refs so much that every call is bad,Chiefs,1,1576438490,eb1r02
1163,You should listen to the whole thing.,,10,1576438479,eb1r02
1164,Same,Broncos,4,1576438475,eb1r02
1165,"I'm thinking he was calling for a DPI or something, not RTP.",Chiefs,1,1576438469,eb1r02
1166,"Did he do it on that specific play? No. If you think he'll never complain, you're nuts.",Chiefs,5,1576438459,eb1r02
1167,If you cut the heads off angle cookies they become baby yoda cookies.,Chiefs,1,1576438448,eb1r02
1168,Not sure if this is meant as a compliment or an insult,,1,1576438432,eb1r02
1169,Broncos are very fortunate the chiefs haven’t been getting TDs and only field goals because they are moving the ball at will.,Cowboys,7,1576438426,eb1r02
1170,"Penalties are bad, but we don't have much of an answer to Mahomes chopping up our secondary.",Broncos,3,1576438421,eb1r02
1171,The penalties were all legit except for the hit on defenseless receiver...,Chiefs,4,1576438418,eb1r02
1172,"No wait, dont leave...I need friends",Broncos,2,1576438411,eb1r02
1173,"Don't get me wrong, I love him; but Pat's been acting kind of like a bitch with his looking to the refs and complaining all the time",Chiefs,2,1576438405,eb1r02
1174,"In the recording that surfaced, Hill and his fiancée discuss their son's broken arm, she said that their son is scared of him, to which Hill responds “You should be afraid of me too....”",Eagles,-19,1576438399,eb1r02
1175,"I'm sure that if it was your guy delivering the hit yall would be claiming ""conspiracy"" already",Broncos,-2,1576438379,eb1r02
1176,Literally. Every QB is soft in this league except Lamar. He seems to have a fuck-it attitude I like. Big Ben looks for a flag for breathing near him admittedly.,Steelers,4,1576438379,eb1r02
1177,Don’t disagree,Chiefs,5,1576438371,eb1r02
1178,That's what the refs did with that defenseless receiver call.,Broncos,-2,1576438369,eb1r02
1179,Why do you do my man like this?,Chiefs,2,1576438366,eb1r02
1180,lol I appreciate the awareness,Broncos,1,1576438360,eb1r02
1181,"He had good throws and 2/3 rookie mistakes/miscue with the wr's...And our Oline is ass.

He is doing great ? No but, he is doing ok.

Yall so fucking scared he will be good and your ""reign"" is over lol.",Broncos,0,1576438360,eb1r02
1182,Kelce had a long pass play. During the play there was an illegal blindside block by Thompson. Enforcement is from the spot of the foul and repeat the down. They incorrectly marked it 10 yards which made it 1st and 6. They realized their mistake before the snap and corrected it to a 15 yard penalty which made it 1st and 11.,Chiefs,2,1576438359,eb1r02
1183,Should be two,Chiefs,2,1576438349,eb1r02
1184,"Happened a while ago, but was that unsportsmanlike blindside block spotted correctly at the 46 _or_ at the 49? It looked like the penalty happened at like the 20 yard line.",Chiefs,1,1576438347,eb1r02
1185,Really? Lock got hit while throwing a few times earlier and didn't do it,Broncos,-7,1576438346,eb1r02
1186,Penalties have really hurt the Broncos today. This game should be closer to 9-3.,,4,1576438345,eb1r02
1187,So? He had a great career. Not everybody has to be Tom Brady and play 20 seasons to be great.,Broncos,2,1576438335,eb1r02
1188,Just don’t put your head and you can still lead with your shoulder. If you put your head down and lead with your shoulder you can still get helmet-helmet contact,Chiefs,2,1576438334,eb1r02
1189,"Calling it, final score: 19 to 5",Broncos,2,1576438332,eb1r02
1190,"&gt;Fouts is a moron. 

yes i agree",Ravens,4,1576438330,eb1r02
1191,"Mahomes 15/19, 210 yards, 1 TD in this weather.",Chiefs,7,1576438321,eb1r02
1192,Basically Qb after hit is them looking at the refs wanting a flag if they are a rookie,Broncos,1,1576438305,eb1r02
1193,Aka NFL Quarterback,Chiefs,1,1576438300,eb1r02
1194,Every QB does it.,Chiefs,11,1576438299,eb1r02
1195,"Showing a commercial about avoiding head hits right after a drive when a player took a helmet to helmet, and another slammed his head on the ground after getting hit. Neither got injured thankfully, but still NFL, don't make it sound like you're safe now.",Lions,1,1576438296,eb1r02
1196,Yeah probably just a brain freeze on their part... .... .. I’ll show myself out.,Steelers,3,1576438286,eb1r02
1197,I agree. In real time it looked like the first one was fine second was was the penalty,Chiefs,2,1576438283,eb1r02
1198,ya even if your his shoulder first then there is helmet contact. they will still call it regardless and good luck with that review,Broncos,1,1576438267,eb1r02
1199,Tom Brady?  I agree.,Chiefs,2,1576438259,eb1r02
1200,"Jeff Allen is not good. Also, that sack wasn't Wylie's fault",Chiefs,3,1576438258,eb1r02
1201,When does Andrew play next? Oh.,,3,1576438258,eb1r02
1202,Leading with the crown.... no one teaches that anymore.,Chiefs,5,1576438256,eb1r02
1203,"Yes, exactly. Dude done goofed up the call big time",Broncos,2,1576438249,eb1r02
1204,That's a concussion for Kelce tomorrow...damn.,Chiefs,4,1576438244,eb1r02
1205,Which game are you watching. Crown of the helmet into the ear,Chiefs,1,1576438240,eb1r02
1206,Preach. We’ve let a few good interior linemen walk. And LDT seems to have regressed. Constant pressure up the middle,Chiefs,1,1576438236,eb1r02
1207,"Can't believe Mahomes looked for a flag after getting tackled while he was still throwing the ball. Love watching him play, but it's getting a little hard to watch him complain on every incompletion",Broncos,1,1576438231,eb1r02
1208,I need more points.,Chiefs,2,1576438230,eb1r02
1209,8/15 53.3% completion 91 yards and 43 of those on 1 play. Blame whoever you want but that's not good.,Chiefs,1,1576438225,eb1r02
1210,Really starting to morph into Brady lol,Broncos,5,1576438216,eb1r02
1211,If we win a SB or are dominant for a long time we'll start getting that Patriot hate,Chiefs,4,1576438204,eb1r02
1212,Nothing's more beautiful than football in snow. Those KC jerseys are perfect too,Patriots,5,1576438189,eb1r02
1213,"Okay, so when a player catches a ball then gets tackled its a 15 yards penalty? It hit his hands then was he was hit...",Broncos,1,1576438189,eb1r02
1214,Not Everytime. Remember how Andrew Luck would pay guys on the helmet and tell em good hit? Not all QBs have to be soft.,Broncos,2,1576438176,eb1r02
1215,Lol watch it again.  It was helmet to helmet.,Chiefs,5,1576438174,eb1r02
1216,Leading with the helmet?,Chiefs,2,1576438172,eb1r02
1217,Maybe dont blow up his head,Chiefs,0,1576438171,eb1r02
1218,Buttkicker.com does not miss.,Chiefs,2,1576438166,eb1r02
1219,True! Very valid point.,Chiefs,2,1576438164,eb1r02
1220,"How anyone thinks that is a penalty is beyond me.  What should he do, not hit the receiver because the receiver is going for the ball?",Broncos,1,1576438156,eb1r02
1221,It was pretty clear on the replay.,Chiefs,1,1576438155,eb1r02
1222,Can’t lead with your helmet. Quit crying.,Chiefs,5,1576438152,eb1r02
1223,Perfect kick,,1,1576438145,eb1r02
1224,lol the one that didnt get called actually looked like a penalty,Broncos,3,1576438143,eb1r02
1225,No one can ever convince me why cutting Jeff Allen and keeping Wylie around made any sense,Chiefs,4,1576438137,eb1r02
1226,It was clearly helmet to helmet,Chiefs,6,1576438133,eb1r02
1227,People acting like you can hit a receiver helmet to helmet while they are trying to catch a ball. Fouts is a moron. That's the definition of defenseless reciever,,11,1576438133,eb1r02
1228,There was helmet to helmet contact. It looked like bullshit live but the contact was very clear in the replay,,8,1576438125,eb1r02
1229,They’ve developed a bad habit of giving him a reason to,Raiders,5,1576438117,eb1r02
1230,Honestly my only problem with him other than the ketchup on steak thing. Complains after every play.,Chiefs,4,1576438117,eb1r02
1231,Whatever gimme the 3 points and let’s warm up at halftime,Chiefs,1,1576438116,eb1r02
1232,Dude calls for a flag on almost every play that doesn't go his way,Patriots,-1,1576438114,eb1r02
1233,Yeah he does that on any tackle he throws through,Chiefs,3,1576438114,eb1r02
1234,That was def helmet to helmet on the “defenseless” penalty. Wasn’t defenseless it was just helmet to helmet.,Steelers,3,1576438112,eb1r02
1235,gif request: that Colquitt pass on the failed PAT,Ravens,2,1576438110,eb1r02
1236,Lol Miller being held the whole time too,Broncos,5,1576438109,eb1r02
1237,They can’t figure out where to spot the ball,Chiefs,1,1576438105,eb1r02
1238,Is Butker human?,Chiefs,1,1576438103,eb1r02
1239,"RZ defense has been fire, but the rest....sheeesh",Broncos,5,1576438101,eb1r02
1240,"Extra thicc mascot. 
10/10",Ravens,6,1576438101,eb1r02
1241,I like Vic fangio coaching in denver,Chiefs,1,1576438092,eb1r02
1242,[deleted],,0,1576438087,eb1r02
1243,Butker is such a good kicker,Chiefs,1,1576438083,eb1r02
1244,One of those hits was head to head one of them the DB had an elbow out to make the contact. They were not the same,Chiefs,2,1576438080,eb1r02
1245,Mahomes looking for a flag before he even landed,Raiders,7,1576438080,eb1r02
1246,"After watching the first half in snow, I'm kind of over it lol. Seems like only bad things can happen.

With another 2 scores I wouldn't be against letting Matt Moore play the 4th quarter",Chiefs,2,1576438079,eb1r02
1247,"Foot touchdown is good, Butker is a god",Chiefs,4,1576438076,eb1r02
1248,every qb does it,Broncos,10,1576438076,eb1r02
1249,There was no helmet to helmet there. Commentators just saying stuff to try to justify it. If there was any contact there it was after the initial point of the hit,Chiefs,1,1576438069,eb1r02
1250,"Playing professional football, guy in orange. 15 yards",Broncos,-6,1576438068,eb1r02
1251,I’m a chiefs fan here but that wasn’t a penalty,,1,1576438066,eb1r02
1252,Are snow angels considered a religious statement?,Rams,5,1576438063,eb1r02
1253,Fuck off Kermit not even close to a flag,Broncos,5,1576438062,eb1r02
1254,Fuck off.,Chiefs,5,1576438059,eb1r02
1255,That's helmet to helmet. Dunno why he said defenseless but the flag is good,Chiefs,-1,1576438053,eb1r02
1256,He’s developing a bad habit of looking at and going to the referees after many plays. It’s annoying and a little...pretentious?,Chiefs,12,1576438049,eb1r02
1257,That wasn't a foul,,-1,1576438048,eb1r02
1258,"
2nd &amp; 10 NYG 45
0:06
E.Manning pass deep left intended for G.Tate INTERCEPTED by N.Needham at MIA 24. N.Needham to MIA 47 for 23 yards (W.Hernandez).",Ravens,4,1576438048,eb1r02
1259,And another drive stalls in the redzone.,Chiefs,7,1576438032,eb1r02
1260,Not lead with his helmet.,Chiefs,3,1576438030,eb1r02
1261,What no flag on that one though?,Jaguars,1,1576438027,eb1r02
1262,Thank you but I still don’t understand why it started out 1st 6 not 1st and 10,Ravens,1,1576438024,eb1r02
1263,"&gt;I don't know if he was defenseless, he was going for the ball.

That's literally why he's defenseless, Dan.

Edit: People downvoting need to learn the rules. Rule 12, section 2, article 7 includes in the definition of a defenseless player:

&gt;A receiver attempting to catch a pass who has not had time to clearly become a runner. 

Prohibited contact with a defenseless player includes:

&gt;forcibly hitting the defenseless player’s head or neck area with the helmet

And

&gt;lowering the head and making forcible contact with the crown or ”hairline” parts of the helmet against any part of the defenselessplayer’s body",Chiefs,-4,1576438022,eb1r02
1264,F,Chiefs,2,1576438019,eb1r02
1265,Patty has been watching rivers I see. Crying at the ref any time he gets touched.,Broncos,-3,1576438017,eb1r02
1266,"Low bar, but you’re right",Chiefs,1,1576438016,eb1r02
1267,That wasn't helmet to helmet,Broncos,1,1576438015,eb1r02
1268,"Well, he was turned away from the guy that hit 'em (arguably helmet-to-helmet), had no way to protect himself from the incoming hit...still, I'unno.",Chiefs,4,1576438011,eb1r02
1269,im surprised that wasnt a penalty too,Cowboys,3,1576438011,eb1r02
1270,Mahomes......,Chiefs,3,1576438009,eb1r02
1271,Did Mahomes really look for a roughing the passer penalty there? Threw his arms up at the ref,Broncos,12,1576438006,eb1r02
1272,The ball died. RIP :-(,Steelers,5,1576438003,eb1r02
1273,"What fucking sport is this?  What is Simmons supposed to do in that situation?

Thanks refs!",Broncos,7,1576437996,eb1r02
1274,It was from the spot of the foul,Chiefs,2,1576437996,eb1r02
1275,Classic penalty for playing defense. Simmons should have let him try to catch it then politely curtsy before making the tackle.,49ers,9,1576437994,eb1r02
1276,"Yeah, DEN fans have a legit gripe there.",Saints,4,1576437994,eb1r02
1277,Mahomes is a bitch calling for a flag.,Broncos,-10,1576437994,eb1r02
1278,Late? No sir,Broncos,6,1576437993,eb1r02
1279,Mahomes begs for flags too much. I said it.,Chiefs,26,1576437992,eb1r02
1280,How would that be late?,,2,1576437991,eb1r02
1281,"Yeah, that's helmet to helmet. Not hit on a defenseless receiver.  Bad call.",Chiefs,3,1576437988,eb1r02
1282,[deleted],,1,1576437985,eb1r02
1283,saints fans like that play,Broncos,2,1576437984,eb1r02
1284,"Straight helmet to helmet.  Yup, that's legit.",Chiefs,3,1576437982,eb1r02
1285,That was a dumb foul call,,3,1576437981,eb1r02
1286,Not hit him in the head,Chiefs,-4,1576437981,eb1r02
1287,ehhh idk about that one.,Chiefs,2,1576437980,eb1r02
1288,[deleted],,1,1576437976,eb1r02
1289,BS PENALTY,Broncos,3,1576437976,eb1r02
1290,lol i disagree,Broncos,2,1576437973,eb1r02
1291,Weak ass flag..what the fuck cmon,Broncos,2,1576437969,eb1r02
1292,that was a sensational play by Jackson. timed it perfectly.,Ravens,4,1576437967,eb1r02
1293,Clete Blakeman u fucking suck,,2,1576437965,eb1r02
1294,More ref badness,49ers,4,1576437964,eb1r02
1295,H2H at best,Chiefs,5,1576437963,eb1r02
1296,WTF is he supposed to do? Bad call.,Chiefs,8,1576437960,eb1r02
1297,"Not sure he's defenseless, he's going for the ball, he hit him in the head. - Dan Fouts. 

Fire him.",Chiefs,2,1576437959,eb1r02
1298,Just appreciate the Broncos fans being better than the Patriots and Raiders fans were.,Chiefs,2,1576437959,eb1r02
1299,Offensive players hit defensive players harder every play. In the head.,,1,1576437956,eb1r02
1300,[deleted],,1,1576437955,eb1r02
1301,LOL,Broncos,2,1576437954,eb1r02
1302,Surprised they didn't just throw another flag on that,Rams,4,1576437952,eb1r02
1303,Trash refs,Broncos,1,1576437951,eb1r02
1304,Shitty call,Chiefs,4,1576437951,eb1r02
1305,Mahomes hanging people out to dry,Chiefs,2,1576437947,eb1r02
1306,Ok that’s a bad flag,Chiefs,6,1576437945,eb1r02
1307,Lol you have to throw the flag on this one too then soft ass refs,Ravens,5,1576437942,eb1r02
1308,That's fucking bullshit...what else do you do in that situation,Broncos,8,1576437942,eb1r02
1309,"It's a pretty widely recognized phenomenon across anything with customers...

Measuring what they do is always the best thing.",,1,1576437939,eb1r02
1310,"Fuck these refs. Let's get the stop, boys",Broncos,1,1576437937,eb1r02
1311,Helmet to helmet regardless.,Chiefs,3,1576437933,eb1r02
1312,That's a decent penalty.  Can't target the head.,Chiefs,-1,1576437933,eb1r02
1313,It was a helmet to helmet hit.,Chiefs,1,1576437931,eb1r02
1314,Looked soft live. But clear helmet to helmet on the replay. Fouts is a moron.,Chiefs,5,1576437929,eb1r02
1315,That's pretty weak NGL,Chiefs,4,1576437929,eb1r02
1316,bologna,Broncos,4,1576437928,eb1r02
1317,Bad flag,,2,1576437928,eb1r02
1318,Dunno about defenseless but absolutely led with his head and made head to head contact.,Chiefs,5,1576437923,eb1r02
1319,Lmao fuck that. Call helmet to helmet but he wasn't defenseless at all.,Broncos,11,1576437919,eb1r02
1320,"FYI, if you add a flair, you don't need the qualifier.",Chiefs,5,1576437919,eb1r02
1321,"Yeah, dunno about that one",Saints,2,1576437917,eb1r02
1322,you cant get a defenseless penalty on a ball thats touched fuck off,Broncos,8,1576437915,eb1r02
1323,Fucking soft,Chargers,6,1576437911,eb1r02
1324,Pretty weak,Chiefs,3,1576437911,eb1r02
1325,What kind of call is that,Chiefs,6,1576437911,eb1r02
1326,Yeah that was soft.,Chiefs,4,1576437909,eb1r02
1327,Shut up Dan fouts,Chiefs,3,1576437907,eb1r02
1328,Rigged,Broncos,2,1576437905,eb1r02
1329,Helmet to helmet regardless,Chiefs,3,1576437904,eb1r02
1330,Terrible call,Chiefs,6,1576437904,eb1r02
1331,Stupid fucking rule I hate it.,Chiefs,5,1576437900,eb1r02
1332,That's not great. Maybe helmet helmet. IF that,Chiefs,2,1576437900,eb1r02
1333,[removed],,1,1576437897,eb1r02
1334,Lol fuck the refs,Broncos,5,1576437897,eb1r02
1335,That is a bad flag. Kelce was trying to catch that so it was a good hit,Chiefs,13,1576437890,eb1r02
1336,They marked the penalty in the wrong spot and caught their mistake before the next play.,Chiefs,2,1576437889,eb1r02
1337,2nd fewest penalties for this ref crew right?  Go fuck yourselves.,Broncos,11,1576437887,eb1r02
1338,How is that a penalty?,Broncos,7,1576437886,eb1r02
1339,"As a chiefs fan, that seems ticky tack",,8,1576437869,eb1r02
1340,Lol are you asking for them?,Chiefs,1,1576437868,eb1r02
1341,Why are they so fucking open?,Broncos,1,1576437866,eb1r02
1342,"They just need to restart.  Throw out all of the old lore and start with fresh new characters and forget all of the old tropes from the ""Skywalker Saga""",Chiefs,2,1576437865,eb1r02
1343,"Well, if that's true it honestly wouldn't surprise me for what it's worth",Chiefs,1,1576437855,eb1r02
1344,DPI?,Chiefs,-1,1576437854,eb1r02
1345,Oh fuck these refs man,Broncos,2,1576437846,eb1r02
1346,The penalty wasn’t on Hill,Chiefs,1,1576437840,eb1r02
1347,I'm glad you were the only one who lived through that,Broncos,1,1576437837,eb1r02
1348,"Stupid ass penalty could end up being the difference between a TD and a FG this drive. Totally unnecessary too, our guys are so undisciplined sometimes",Chiefs,3,1576437836,eb1r02
1349,Why was it 1st and 6 then 1st and 11? Why didn’t it start out 1st and 10?,Ravens,1,1576437823,eb1r02
1350,Lol,,1,1576437820,eb1r02
1351,"i mean 3 strip sacks that game but ya, i don't know about the rest of your games.",Broncos,1,1576437811,eb1r02
1352,Growing pains. There's a reason we signed Spencer Ware in a moment of potential weakness. Feels like D-Trains kind of been in the dog house.,Chiefs,1,1576437810,eb1r02
1353,Good call.,Chiefs,0,1576437808,eb1r02
1354,"NFL has gotten so soft. That's just a good blindside block.

He hit him in front.",Chiefs,1,1576437805,eb1r02
1355,"Mahomes looks to be stepping up in the pocket this half, which is a very good sign. Haven't seen any egregious happy feet so far",Chiefs,2,1576437804,eb1r02
1356,If I learned anything from 80s movies. You just need a solid montage to beat the rich kids.,Lions,2,1576437798,eb1r02
1357,I'd be distracted as fuck with the snow too anyways.,Chiefs,1,1576437791,eb1r02
1358,NFL refs are such a fucking joke,Chiefs,2,1576437784,eb1r02
1359,"honestly, for it to be over",NFL,1,1576437779,eb1r02
1360,"No ""Tyreek Hill thought that was his son"" takes in here? Interesting.",Chiefs,2,1576437778,eb1r02
1361,"I don't know if there's an excuse for a block in the back/blindside. This is the NFL. These guys should surely have played enough football in their lives up to this point to know not to make an illegal block. Maybe it's harder to determine things on the field but it just seems that way to me, the armchair coach",Chiefs,4,1576437778,eb1r02
1362,Yiadom shouldn't be on anybody but the bench,Broncos,1,1576437769,eb1r02
1363,1st and 6. That's a new one.,Broncos,5,1576437763,eb1r02
1364,Yeah it's really frustrating to watch.,Chiefs,2,1576437758,eb1r02
1365,"""Defense - don't worry about 87. Focus on Andy Reid's mustache.""

-Vic Fangio",Panthers,2,1576437757,eb1r02
1366,Blindside the guy 10 yards behind Kelce. Jesus christ.,Chiefs,6,1576437754,eb1r02
1367,What defense,Ravens,1,1576437752,eb1r02
1368,Thompson not exactly the hugest guy on the field and throws the guy back like 6 yards lol,Chiefs,2,1576437750,eb1r02
1369,"Thanks Denver, keep letting Kelce get free!",Chiefs,2,1576437744,eb1r02
1370,"I have clicking too dammit who pointed that out 

It’s every 1.25 seconds",Chiefs,1,1576437738,eb1r02
1371,The Mandalorian will bring them back. Just give creative control to Favreau and Filoni,Chiefs,2,1576437733,eb1r02
1372,FUCK Isaac Yiadom,Broncos,1,1576437730,eb1r02
1373,Goddammit Kelce is so good,Broncos,1,1576437719,eb1r02
1374,Why do we even bother putting Yiadom on Kelce,Broncos,1,1576437716,eb1r02
1375,DTrain is a pitbull,Chiefs,1,1576437715,eb1r02
1376,Our secondary is aaasssss lol,Broncos,3,1576437712,eb1r02
