,body,author_flair_text,score,created_utc,link_id
1080,"You must be new to Bears fandom, the Bears never make big changes midseason.",Bears,1,1574623029,e11i4c
1081,You should drink more water then my dude,Giants,1,1574623026,e11i4c
1082,"More like the bears are the hottest girl (defense) married to al bundy, that once scored 4 touchdowns in a single game(Mitch/offense)",Bears,1,1574623025,e11i4c
1083,"wait is the new Call of Duty just called ""Call of Duty Modern Warfare"" are they just repeating the cycle every ten years?",Giants,3,1574623025,e11i4c
1084,"The ref behind the punter watches the direction it flies through the air. Then the sideline official runs up the sideline until his positioning is in line with the direction the ball went. So even if it goes 30 yards out of bounds, they pretty much know where it crossed the sideline.",Bears,2,1574623021,e11i4c
1085,That Bears lady can come to get me any day,Giants,2,1574623021,e11i4c
1086,So who's our kicker next week?,Giants,3,1574623019,e11i4c
1087,bears fans r furries confirmed,Giants,5,1574623016,e11i4c
1088,What is this?,Packers,2,1574623014,e11i4c
1089,I might even think about saying that this game isn’t the best quality football,Giants,2,1574623004,e11i4c
1090,HE MISSED AGAIN,Bears,4,1574623002,e11i4c
1091,THIS IS FOOTBALL!,Patriots,2,1574623000,e11i4c
1092,Oh snap,Bears,1,1574622998,e11i4c
1093,LOL nope just saying a loss aint hurting us tonight,Packers,1,1574622996,e11i4c
1094,"Sup guys, I've been hibernating all fall. How's our superbowl run going?? Mitch still favorite for MVP right??",Bears,3,1574622994,e11i4c
1095,I'll take him as an O-lineman,Bears,1,1574622983,e11i4c
1096,"We're basically out of the playoff hunt. But since we have no first round pick, I can't appreciate a terrible game. I just want competence at this point to -maybe- look forward to next year.

The bar is set, very very low. And still depressing as hell.",,1,1574622978,e11i4c
1097,The giants are about 42 players and 1 coaching staff away from a Super Bowl run. We’re so close.,Giants,4,1574622978,e11i4c
1098,Do people actually drink Bud Lite platinum. It looks like piss.,Packers,0,1574622972,e11i4c
1099,"One ref on each sideline, one behind the punter. The one behind the punter follows the ball to the side in a straight line, and they spot it where he and the sideline guy meet.",Patriots,2,1574622972,e11i4c
1100,[deleted],,1,1574622969,e11i4c
1101,Chase Daniel did better than Trubs this year as well when he’s been in.  Despite the fact that he doesn’t have NFL physical abilities.  It’s sad out here.,Bears,0,1574622962,e11i4c
1102,Yeah I love hockey but football has always been my number one. It's getting old.,Bears,2,1574622956,e11i4c
1103,"We might be evil, but masterminds is a stretch.",Giants,2,1574622947,e11i4c
1104,"All things aside, Chuck Pagano has been really good this year. imagine how much better the defense would be if they weren't on the field the whole game as well as if Hicks and Trevathan weren't out.",Bears,2,1574622939,e11i4c
1105,"In his defense, his TE dropped a wide open TD pass...

And then he threw a pick in the end zone",Giants,1,1574622934,e11i4c
1106,Just have to wait for worst situation for Shurmur to call an outside run.,Giants,4,1574622929,e11i4c
1107,I fucking hate the Bears,Bears,3,1574622913,e11i4c
1108,They’ll never see it coming!,Giants,1,1574622912,e11i4c
1109,Giants clearly trying to break our spirit by forcing us to watch them make a kick... evil masterminds,Bears,6,1574622906,e11i4c
1110,really not setting him up for success...,Bears,1,1574622905,e11i4c
1111,"I never get why coaches decide to move away from what works. If other teams are cottoning on oh, then you still should be using it until it stops working",Packers,1,1574622896,e11i4c
1112,That was not a run up the middle.,Giants,1,1574622893,e11i4c
1113,the bears are like the hs stud dating the hottest girl in school (the defense) but shes saving it for marriage (the offense),Vikings,5,1574622884,e11i4c
1114,Absolute genius 3rd and 1 playcall,Giants,5,1574622883,e11i4c
1115,this playcalling is so bad.,Giants,5,1574622881,e11i4c
1116,That's the play for 3&amp;1?!?!?!,Giants,6,1574622880,e11i4c
1117,Giants coaching staff is big braining this.  All they have to do is not give up a TD to the Bears D and this W is in the books.,Bears,2,1574622878,e11i4c
1118,"&gt;fire a Coach of the Year immediately after his next season

Worked for the raptors

&amp;#x200B;

Although that was literally 2 days after he won the award, not the next season",Vikings,1,1574622876,e11i4c
1119,Anyone got the clip of 47’s pick? I wanna see it again,Bears,1,1574622875,e11i4c
1120,"Okay? That has nothing to do with what I said, but Packer fans and bringing up things like that at any chance they get should be expected. You gonna tell me how many super bowls you've won next? 

Fucking yawn.",Vikings,1,1574622866,e11i4c
1121,"IIRC, he might have been called for more holding penalties than the people blocking him in the past few weeks",Bears,1,1574622862,e11i4c
1122,Saquon's legs could be the left side of an offensive line.,49ers,7,1574622859,e11i4c
1123,A flash of the real Barkley.,Giants,2,1574622852,e11i4c
1124,The one time they don’t run him up the middle is for that shitty pitch with two unblocked guys waiting for him on 3rd and 1,Giants,7,1574622850,e11i4c
1125,Mack has been an absolute no show this year. He gets some pressure every once in a while but i think he only has 5 sacks this year or something.,Bears,1,1574622832,e11i4c
1126,We still have garbage time Mitch to shine in the 4th Q.,Bears,2,1574622830,e11i4c
1127,"Barkley up the middle holy fuck fire bettcher and shurmur, I’ll take Garrett at this rate atleast he knows how to run zeke",Giants,6,1574622825,e11i4c
1128,"The Rick Moranis coached ""Little Giants""  team could beat these Bears.",Browns,3,1574622824,e11i4c
1129,[deleted],,1,1574622823,e11i4c
1130,Chase Daniel did better against us last year,Giants,0,1574622823,e11i4c
1131,does Pat Shurmur *hate* Saquon? like ... what are these calls,Giants,7,1574622821,e11i4c
1132,Best part is that you could be talking about either team.,Giants,2,1574622817,e11i4c
1133,"Raptors did it the very same offseasons, so it can't be worse then that.",Packers,1,1574622817,e11i4c
1134,Well...they finally ran it outside lol,Giants,8,1574622807,e11i4c
1135,[deleted],,2,1574622805,e11i4c
1136,"more recently, do you remember what our record was with fox trying to play that style of offense and relying on defense. The NFL has moved on",Bears,0,1574622803,e11i4c
1137,The INT would have given them worse field pisition... the Bears should literally be wishing that pass was picked off. That's the kind of season we're having.,Bears,7,1574622801,e11i4c
1138,"I had thought that everyone was being too hard on Trubisky, but if he can’t put up points against our defense...",Giants,10,1574622800,e11i4c
1139,I would even go so far as that we aren’t even that good.,Bears,3,1574622787,e11i4c
1140,I have no idea how the defense can still get themselves motivated out there.,Bears,3,1574622786,e11i4c
1141,Hasn’t Eddie always been a poor tackler?,Bears,2,1574622785,e11i4c
1142,Awesome tackle Dix.,Bears,1,1574622782,e11i4c
1143,Slayton has been so good,Giants,2,1574622775,e11i4c
1144,I would gladly have my tax dollars go to dicks getting drawn in foreign countries,Giants,2,1574622770,e11i4c
1145,Slayton makes me feel good inside,Giants,1,1574622768,e11i4c
1146,"We can't run, we can't throw, we can't kick, and now we can't punt. We should forfeit the rest of the season this shit is embarrassing.",Bears,3,1574622765,e11i4c
1147,"No, but it'd be fucking stupid to fire him just because he got saddled with a coach killer QB.

There are open receivers...they're just not the first read, so Mitch never sees them.",Bears,2,1574622763,e11i4c
1148,"I am legit mindblown by how terrible our offense is. Absolutely terrible. If changes are not made immediately following this season and our GM isn’t canned as soon as possible, I don’t know what I can do anymore",Bears,2,1574622761,e11i4c
1149,Bears also had a 15 yard penalty on first kickoff of the game! LOL!,,1,1574622754,e11i4c
1150,The Packers don't play until tonight.,Packers,3,1574622752,e11i4c
1151,Trubisky has secretly been throwing INTs because it's a better play than punting.,Packers,1,1574622752,e11i4c
1152,"Thank you, soldier!",Bears,1,1574622752,e11i4c
1153,hmm the bears are cursed,Bears,1,1574622745,e11i4c
1154,He has one sack since September. No fumbles forced. Almost no QB hits.,Bears,1,1574622745,e11i4c
1155,WOW This game is a complete shit show.  I think we can agree we both suck.,Giants,10,1574622742,e11i4c
1156,They have every right to hate Mitch.  Nobody is hitting any performance based escalators this year.,Bears,2,1574622741,e11i4c
1157,This game somehow keeps getting worse.,Giants,3,1574622740,e11i4c
1158,Bears wyd,Giants,1,1574622738,e11i4c
1159,Both teams*,Giants,1,1574622735,e11i4c
1160,Giants are allowing 29 points per game and bears are getting shutout at almost halftime.,Bears,6,1574622734,e11i4c
1161,I love hearing Soldier Field boo it's team,Packers,-4,1574622724,e11i4c
1162,"This is one of the shittiest games I’ve seen in a long time.

Gotta throw away the whole league",Giants,5,1574622724,e11i4c
1163,Can’t blame that series on the refs,Giants,1,1574622718,e11i4c
1164,Slayton for garbage MVP.  He's been great this year and makes something happen every week.,Giants,4,1574622714,e11i4c
1165,Prince sucks,Bears,1,1574622710,e11i4c
1166,"I see why they're losing, the TE thought he was playing volleyball",Bears,5,1574622710,e11i4c
1167,Ehh still 8-3 and top of the division,Packers,0,1574622699,e11i4c
1168,Is it bad press to fire a Coach of the Year immediately after his next season?,Bears,3,1574622694,e11i4c
1169,Our receivers play like they hate Mitch,Bears,5,1574622694,e11i4c
1170,The Football Gods are with US today!,Giants,2,1574622693,e11i4c
1171,Remember when we had great success with power run and the I-formation? Bc Nagy sure doesn’t remember,Bears,3,1574622691,e11i4c
1172,Boooooooooooooooooooooooooooooooooooooooooooooooooooooooo,Bears,2,1574622689,e11i4c
1173,"Cuz Trub has needs to be able to throw it, so he’s got to make trub better in that regard or prove how big of a bust trub is. A QB needs to throw the ball no matter if he’s good at running or not.",,1,1574622688,e11i4c
1174,"After that punt, same",Bears,2,1574622687,e11i4c
1175,"When a punt goes out of bounds like that, how do they tell where it goes out? Or is it just easier to tell from the sideline at field level?",Bears,3,1574622686,e11i4c
1176,Even I’m starting to lose joy in this,Packers,3,1574622684,e11i4c
1177,Can nothing go right?,Bears,1,1574622684,e11i4c
1178,jesus 13 yard punt,Packers,5,1574622682,e11i4c
1179,"What if I told you this was a PROFESSIONAL football team making and generating millions of dollars? You’d laugh wouldn’t you, yeah you would.",,7,1574622676,e11i4c
1180,Everything that go could go wrong is going wrong,Bears,7,1574622675,e11i4c
1181,"The pick would have been better positioning for the bears, yikes.",Patriots,3,1574622673,e11i4c
1182,"fire nagy he won't run the ball.... we run the ball, oh",Bears,4,1574622672,e11i4c
1183,This is bad football,Giants,3,1574622672,e11i4c
1184,"Rosas is one the only things that went right over the last 3 seasons and of course that turns to shit.


:/",Giants,2,1574622671,e11i4c
1185,"Yeah, pretty excited for us to be real rivals again. Been a while!

I think I agree on the coaches too. I'm honestly souring on Quinn a bit but he's going to get a decent leash because the roster has a lot of issues. The way we play defense is ridiculous though, even given our lack of depth there.",Giants,2,1574622669,e11i4c
1186,"At a certain point, we need to just start enjoying how bad this whole team is.",Bears,4,1574622669,e11i4c
1187,Holy shit.,Bears,2,1574622668,e11i4c
1188,"Ugh, they're making commercials about the tHaNk YoU fOr YoUr SeRvIcE people now.

People have no idea how weird it is to have strangers walk up and thank you for your service.  Well, you're welcome for my service, stranger.  You're welcome for all of the times your tax dollars paid for me to draw dicks on things.  You're welcome for all of the times I jerked off in a rancid port-a-potty in the desert.",Bears,7,1574622667,e11i4c
1189,It’s physically painful to watch this game as a Bears fan,,2,1574622666,e11i4c
1190,[deleted],,1,1574622651,e11i4c
1191,Hawks game on TV. Watching my boy Danny Dimes and Barkley on stream,Seahawks,1,1574622651,e11i4c
1192,I hate football.,Bears,2,1574622645,e11i4c
1193,Receiver literally throwing it up for grabs.,Bears,4,1574622642,e11i4c
1194,Jesus O'Donnell..,Bears,2,1574622640,e11i4c
1195,FUUUUUUUUUCCCCKKKKKK,Bears,2,1574622635,e11i4c
1196,[deleted],,1,1574622633,e11i4c
1197,"Hey Nagy, maybe try and let Montgomery stay on the field for more than once every 6 plays and see what happens?

Nagy's boner for Cohen this year is just laughable.",49ers,2,1574622629,e11i4c
1198,Yea he started in the AHL but got called up. 8 goals and 2 assists in 13 games. And that ridiculous reason is David Quinn haha,Giants,2,1574622622,e11i4c
1199,My wife is a bears fan and the colts already lost...life is pain,Colts,2,1574622616,e11i4c
1200,Yeah I was expecting Daniel Jones to be dead by now,Giants,1,1574622607,e11i4c
1201,The Seahawks are playing and they are good. Why are you here?,Bears,1,1574622607,e11i4c
1202,I like the Bears and I don't like the Giants,Patriots,1,1574622604,e11i4c
1203,[deleted],,1,1574622601,e11i4c
1204,Jesus Christ.,Packers,4,1574622595,e11i4c
1205,2021,Bears,1,1574622593,e11i4c
1206,Stop,Bears,4,1574622592,e11i4c
1207,not having the stats and not doing much of anything is a whole different thing. mack has been good.,Giants,1,1574622586,e11i4c
1208,Seconded.,Bears,1,1574622559,e11i4c
1209,"That was a good kick with the timing thrown off that much IMO. Great job by the holder, good attempt by the kicker, YIKES on the snapper.",Patriots,4,1574622547,e11i4c
1210,This isn’t even entertainingly bad. It’s just poor quality football.,Giants,5,1574622547,e11i4c
1211,It's the only thing on and we play both teams this season.,Packers,1,1574622541,e11i4c
1212,I could have told you that was going to happen before the snap.  Its been a joke for us we might as well go for it  on 4th down,Giants,1,1574622539,e11i4c
1213,Sometimes I even question why I’m watching this,Giants,1,1574622539,e11i4c
1214,He’s had some horrid snaps this year.,Giants,1,1574622532,e11i4c
1215,Does Khalil Mack even play for us or did I just imagine that whole thing,Bears,7,1574622522,e11i4c
1216,"I just don’t know how Nagy survives this season. Just absolutely shit all over the bed. Terrible team and situational mgmt. What he’s done with Trub is a damn travesty. That kid has 17 runs on the season, he had 15 coming into this game and that’s tied with Brady... Trub obviously has his deficiencies but why a coach decided to move away from his most important player’s strongest attributes is criminal.",Bears,6,1574622519,e11i4c
1217,Google Home being a part of the family is  really creepy ad campaign.,Giants,2,1574622515,e11i4c
1218,Lmao let’s go watch rugby,Bears,2,1574622515,e11i4c
1219,"We tend to put ourselves in X and long by dropping passes, getting sacked, or penalties. 

I agree that we need to run more but it’s also tough to point to when we should.",Bears,1,1574622500,e11i4c
1220,lol ~~saquon~~  rosas 1 year wonder.,Giants,2,1574622493,e11i4c
1221,Deossie might be out of a job after this year. Snapping has been awful this year.,Giants,3,1574622489,e11i4c
1222,I do not get that commercial with the Zamboni,Packers,1,1574622488,e11i4c
1223,League needs to ban infographics,Giants,3,1574622482,e11i4c
1224,"I could see Nagy getting fired almost and someone thinking, ""Let's give Trubs another chance!""

Realistically, I think all three will be there next season, but who knows how long they'll make it.",Patriots,1,1574622481,e11i4c
1225,Better on the ground than over their head,Giants,1,1574622479,e11i4c
1226,Did he get called up? I thought you guys sent him down before the season started for some ridiculous reason lol.,Giants,1,1574622478,e11i4c
1227,This thread is basically two fanbases trying to convince each other which one is more ass.,Giants,18,1574622478,e11i4c
1228,We also can’t run effectively.  There is no option that isn’t asking to fail!,Bears,1,1574622474,e11i4c
1229,7-0 and I'm not sure we can come back from such a large deficit.,Bears,3,1574622472,e11i4c
1230,he hasn't done much of anything in a couple of months. He just had a game with no stats,Bears,1,1574622469,e11i4c
1231,"good news, other team misses a kick. bad news, that means it is once again time to watch the Bears offense do Bears offense things",Bears,6,1574622469,e11i4c
1232,How the fuck did Rosas regress so much. He was money in 2018,Giants,7,1574622466,e11i4c
1233,Just go laugh at them later when they lose to the Niners.,Vikings,2,1574622465,e11i4c
1234,Lmao you were saying?,Giants,1,1574622452,e11i4c
1235,"Laughing hysterically, wife has no idea why football would make me laugh.",Packers,1,1574622445,e11i4c
1236,Thought we might go for it with Rosas struggling and being you know 2-8,Giants,5,1574622444,e11i4c
1237,All y'all non bears/giants flair... why are you even watching this dumpster-fire?,Bears,10,1574622442,e11i4c
1238,Just snap the ball 4Head,Giants,3,1574622433,e11i4c
1239,"Stealth snap, keep it low to the ground",Bears,2,1574622433,e11i4c
1240,(Sigh),Giants,1,1574622428,e11i4c
1241,Next level snap techniques,Vikings,3,1574622422,e11i4c
1242,"Nagy is the worst play caller in the league. Good play designer but 4 runs to 17 passes with the worst QB in the league is asking to fail. I don't care what they're giving you, that's just terrible coaching.",Seahawks,3,1574622422,e11i4c
1243,"Yeah, I don't think Trubs would actually be cut, but he'd be replaced.

When's your next first rounder you can trade away, 2022?",Patriots,1,1574622419,e11i4c
1244,It's worth it for sure.,Giants,1,1574622412,e11i4c
1245,Solder standing completely upright,Giants,2,1574622412,e11i4c
1246,Can y’all go circlejerk our downfall somewhere else? We’re hurting,Bears,4,1574622402,e11i4c
1247,"Lol, you assume getting in field goal range is enough.",Packers,1,1574622398,e11i4c
1248,what was that snap? Zak DeOssie gonna lose his job for this shit,Giants,2,1574622394,e11i4c
1249,Did this mother fucker not even get the snap off the ground lmao,,4,1574622388,e11i4c
1250,Someone else missing a field goal at Soldier Field? Do my eyes deceive me?,Bears,4,1574622382,e11i4c
1251,WTF IS WRONG WITH YOU ROSAS???!!,Giants,2,1574622381,e11i4c
1252,No they'll sit on their hands like they always do. George and Sweaty Ted are spineless losers. They're fine with this.,Bears,1,1574622379,e11i4c
1253,When you snap the ball it’s to supposed to go above the ground,Bears,2,1574622376,e11i4c
1254,I'm subscribed to the Devils google calendar lol otherwise I'd forget.,Giants,2,1574622369,e11i4c
1255,And yet still terrible,Giants,2,1574622367,e11i4c
1256,that might be the worst good weather snap I've ever seen,Bears,7,1574622365,e11i4c
1257,Soldier Field strikes again.,Bears,3,1574622364,e11i4c
1258,"Lol that snap, ""fuck it I'm just gonna roll it over!""",Packers,3,1574622363,e11i4c
1259,Landry doing work for my fantasy team.,Giants,1,1574622360,e11i4c
1260,I'm not even sure we could beat the Jets head on. This offense is just so historically bad. One of the worst Bears offenses I've seen and we've fielded some shit offenses.,Bears,1,1574622356,e11i4c
1261,"Wjat a terrible snap, probably worst I've ever seen",Bears,5,1574622356,e11i4c
1262,WE GOT A ROLLER,Bears,1,1574622356,e11i4c
1263,Make it 5!,Bears,1,1574622351,e11i4c
1264,I think that's the first time I heard Mack's name brought up all game.,Giants,2,1574622345,e11i4c
1265,"Losing their job as in cut for Trubs? I doubt he starts next year but he will be on the roster.  If we lose out I could see Nagy and Pace gone, most likely everyone returns next year and they all get the ax after that.  

Just gotta hope pace doesn’t mortgage even more future this offseason in an attempt to save his job.",Bears,2,1574622326,e11i4c
1266,"I want Golden Tate to marry Markus Golden and take his last name so he can be Golden Golden III I don't care about any other logistics or facts in the way, let's make it happen",Giants,3,1574622318,e11i4c
1267,You love to see it.,Packers,-8,1574622304,e11i4c
1268,"Death, taxes, and Barkley up the middle.",Giants,1,1574622302,e11i4c
1269,Yeah I'm starting to think I might put more energy into hockey. I can't stand this refball shit man.,Bears,2,1574622297,e11i4c
1270,"I mean, do you actually think that Trubs was seriously injured?  That hip pointer probably isn't going to just go away in 4 days like when he was confirmed to be starting (sure, he had another two days or so since then to heal, if the injury was real).  The balance of probabilities says no, and that he was either not injured, or he's out there playing injured.",Patriots,1,1574622275,e11i4c
1271,Good god the Lions and Bears are shitshows. Amazing to see,Packers,-7,1574622274,e11i4c
1272,And the holding on Patterson,Bears,3,1574622263,e11i4c
1273,"Giants fans, did I NOT tell you that you were about to be mindblown by how terrible our offense is? A lot of you told me “lol are defense is terrible you’re all good”, it does not matter, our offense is one of the worst you will see in a long time and I told you this",Bears,4,1574622261,e11i4c
1274,"Saw 3 ""blindside blocks"" on that play by the Giants. If you're gonna enforce that dogshit rule, enforce it fairly.",Bears,6,1574622259,e11i4c
1275,LMAO Bears at so ass. I feel bad for both the Bears and Mitch. I think Mitch should deserve another chance somewhere but if the Bears has a QB they would be best team in the NFC North. Shame they continue to be boring as fuck every year.,,0,1574622255,e11i4c
1276,That's ok.  The offense is getting off the field as fast as possible now to try to keep you happy.,Bears,1,1574622247,e11i4c
1277,"I think most people just saw him get benched at the end, they didn't report on the injury until post game.",Packers,1,1574622243,e11i4c
1278,His QB got hit in the head with a helmet just let him vent out his frustrations.,,2,1574622240,e11i4c
1279,"Don’t feel bad, special teams are by far the best part of the Giants",Giants,2,1574622236,e11i4c
1280,"I missed the one last night, watched the game against the caps though which was awesome.  My problem with hockey is I never know when my team is playing and always forget.",Giants,2,1574622234,e11i4c
1281,Giants about to put this one out of reach with a field goal.,Packers,2,1574622233,e11i4c
1282,PSA: Blackhawks play Tuesday at 7,Bears,4,1574622225,e11i4c
1283,"Pretty much same with NJ. Bright futures but crap right now.

Also, I don't think Quinn OR Hynes will be cup winners for either team.",Giants,1,1574622220,e11i4c
1284,"Don't worry Giants fans. Our defense is good, but our offense and special teams are definitely bad enough to lose us the game in spite of that.",Bears,3,1574622196,e11i4c
1285,So breathing gets the bears a flag but a block to the back that injures a bear is nothing?,Bears,9,1574622195,e11i4c
1286,[deleted],,1,1574622195,e11i4c
1287,LT was standing straight up,Giants,1,1574622193,e11i4c
1288,I’m going to show my kids a picture of Trubisky and tell the it’s Ryan Leaf.,Bears,-3,1574622192,e11i4c
1289,We’re about to get blown out by the Giants aren’t we?,Bears,6,1574622189,e11i4c
1290,How Leno is still a starting OL in the NFL boggles my mind.,Bears,3,1574622187,e11i4c
1291,Markus Golden is a GOOD football player,,1,1574622179,e11i4c
1292,"More likely Trubs in being benched.

One more season like this and Nagy &amp; Pace are out of here",Bears,1,1574622174,e11i4c
1293,Give golden a new contract real quick.,Giants,2,1574622169,e11i4c
1294,I hate everything,Bears,1,1574622164,e11i4c
1295,We usually bring ourselves into FG position and then miss it. That’s our specialty.,Bears,1,1574622159,e11i4c
1296,He stepped up into the pocket and got hit from his blind side. The fuck are you talking about?,Bears,4,1574622159,e11i4c
1297,"Good comeback last night.

I'm a Devils fan but honestly more of a fan of the sport than anything.

Especially since both of our teams won't be remotely good for another few years LOL.",Giants,2,1574622158,e11i4c
1298,"Samesies. I realized I used to watch football all day Sunday, now I half watch one or two while doing other shit",Bears,2,1574622153,e11i4c
1299,I would rather sit in heavy Denver traffic than watch this offense right now,Bears,3,1574622146,e11i4c
1300,is Peppers returning punts what,Giants,2,1574622142,e11i4c
1301,CHYTILJUICE CHYTILJUICE CHYTILJUICE!!!,Giants,1,1574622136,e11i4c
1302,Do you understand how getting better from injuries works?,Bears,1,1574622128,e11i4c
1303,"Please, the Giants invented that. Especially when it’s a record setting field goal.",Giants,1,1574622126,e11i4c
1304,also by the transitive property it would mean you also lost to the Jets,Giants,1,1574622116,e11i4c
1305,Fire Charles Leno straight into the sun,Bears,5,1574622115,e11i4c
1306,Zero pocket awareness,Steelers,-8,1574622112,e11i4c
1307,Sick blocking bro,Bears,4,1574622109,e11i4c
1308,Leno fucking suuuuuuck,Bears,3,1574622099,e11i4c
1309,See it’s Trubiskys fault no one can catch and the line can’t block,Bears,7,1574622094,e11i4c
1310,BRICKS FOR FUCKING HANDS,Bears,5,1574622093,e11i4c
1311,\&gt; Implying Trubisky isn't a franchise QB,Vikings,1,1574622084,e11i4c
1312,"[Alright, I'm breaking out the liquor early](https://i.imgur.com/6KakJwu.jpg)",Bears,1,1574622083,e11i4c
