,body,author_flair_text,score,created_utc,link_id
813,"I haven't been able to find it since, but I remember seeing a 538 article on how prior kicking success is not a statistically significant predictor of future kicking success. With that position, shit happens.",Vikings,1,1574624921,e11i4c
814,He’s our 3rd nickel corner that only makes plays in the backfield,Giants,1,1574624917,e11i4c
815,I think I speak for both fanbases when I say the real loser is us for having to watch this game,Bears,13,1574624915,e11i4c
816,Injuries,Bears,3,1574624910,e11i4c
817,That's Snow-Informer,Packers,2,1574624873,e11i4c
818,He straight up stopped and watched Robinson catch it.,Giants,2,1574624865,e11i4c
819,"Mack FF next drive, his motor will suddenly come back now that the Bears have a lead",Rams,2,1574624858,e11i4c
820,"No matter how bad this game gets...

Don't ever forget..

#FOOK THE PACK",Vikings,8,1574624850,e11i4c
821,who’s worse than y’all,Bears,1,1574624846,e11i4c
822,[deleted],,1,1574624845,e11i4c
823,can we blame the snap for the kickoff too?,Giants,1,1574624842,e11i4c
824,Very legal,Bears,5,1574624832,e11i4c
825,"Underthrown, but still good enough.  So...middle of the road.",Bears,1,1574624826,e11i4c
826,I hate it.,Giants,1,1574624825,e11i4c
827,We just need a FG to...oh right yea,Giants,2,1574624819,e11i4c
828,"What is going on with Trubisky’s throws this year? Mechanically, they seem so much worse than in the past.",Bears,3,1574624817,e11i4c
829,I like Ballentine. Growing pains as a rookie. I’m okay with this. Plays with way more heart than Baker.,Giants,2,1574624811,e11i4c
830,Ah the old 30th ranked defense,Giants,5,1574624807,e11i4c
831,Surprising right?  /s,Giants,2,1574624801,e11i4c
832,Robinson has been a nice lone bright spot on the Offense.,Bears,3,1574624799,e11i4c
833,"""I love your poom poom, girl"". Surprised that they played Daddy Yankee like that lol.",Giants,1,1574624797,e11i4c
834,[removed],,1,1574624789,e11i4c
835,"Agreed, although “sometimes” is an understatement",Bears,3,1574624784,e11i4c
836,"He makes mistakes still, but mistakes can be fixed with time. This game again has been solid by Mitch with a few mistakes but the receivers have really screwed him.",Bears,5,1574624778,e11i4c
837,Wonder how many times that's happened this year except it was dropped.,Packers,4,1574624763,e11i4c
838,Our defense makes a play and Jenkins fucks it all up,Giants,5,1574624762,e11i4c
839,Game,Giants,3,1574624761,e11i4c
840,YAY BETTER DRAFT PICK,Giants,1,1574624755,e11i4c
841,My thoughts exactly. He can get bailed out a few times to cancel all the wack shit we do.,Bears,3,1574624753,e11i4c
842,"Good job, Jenkins.",Giants,3,1574624751,e11i4c
843,Yep.,Bears,1,1574624732,e11i4c
844,I like how Robinson didnt execute Ballentine when his helmet came off. Very cool.,Giants,24,1574624730,e11i4c
845,Let's fucking go Bears!,Patriots,4,1574624728,e11i4c
846,God we suck on 3rd down no matter the reason,Giants,5,1574624721,e11i4c
847,ahhhhhh,Bears,1,1574624718,e11i4c
848,Maybe he and Trubisky trained together in the offseason?,Bears,7,1574624714,e11i4c
849,WHAAAAATTT a penalty NOT on the bears?,Bears,6,1574624707,e11i4c
850,See Trubs isn't terrible. Just stupid sometimes,Bears,6,1574624706,e11i4c
851,Throw couldn’t been better but after all these drops he deserves that TD,Bears,10,1574624696,e11i4c
852,"Rosas was 32/33 on field goals, 100% on XPs, and an All Pro last year.

Wtf happened?",Giants,3,1574624676,e11i4c
853,yep!,Bears,3,1574624666,e11i4c
854,"Im calling it now, Daniel Jones turn over next drive",Giants,8,1574624657,e11i4c
855,The fuck was that? He see a ghost WR that nobody else can see?,,3,1574624646,e11i4c
856,Was it vs. the Lions where Trubisky put up 14 in like 20 seconds?,Packers,3,1574624613,e11i4c
857,If you score on this drive we're toast anyway,Giants,3,1574624591,e11i4c
858,But he missed,Giants,3,1574624585,e11i4c
859,Can Trubisky be flagged for unintentional grounding?,Giants,7,1574624579,e11i4c
860,"All teams are suspended for the season, this is now the superbowl, enjoy.",Giants,6,1574624576,e11i4c
861,And somehow missing.,Giants,3,1574624564,e11i4c
862,Rosas needs to see that BMS psychic,Giants,3,1574624563,e11i4c
863,"Are we going to do this thing again where the last drive of the first half and the first two drives of the second half are decent and trick us all into thinking ""well, maybe..."" before sucking for the rest of the game?",Bears,7,1574624547,e11i4c
864,The vinny special,Colts,1,1574624546,e11i4c
865,So is that a bad throw or good? Or middle of the road? (The one to AR),Bears,5,1574624544,e11i4c
866,I don't even know what receiver he was targeting there,Bears,3,1574624539,e11i4c
867,He just now needs a missed point after for the trifecta.,,1,1574624534,e11i4c
868,"Rosas needs a sports psychologist, dude was money last year.",Giants,6,1574624526,e11i4c
869,What if these are just the only two teams that don't use PED's?,Packers,10,1574624524,e11i4c
870,"Rosas is a good kicker I think his head is fucked up, get him a shrink",Giants,1,1574624521,e11i4c
871,"Sounds like more fun to watch than what we're currently stuck with. Silver linings?

On our side, our offense would either light our defense up, or just collapse into a black hole and neither side would look like a pro caliber team.",Giants,1,1574624520,e11i4c
872,Is Josh Brown still beating his wife??,Giants,7,1574624509,e11i4c
873,Rosa kicking hinself over that one,Bears,2,1574624502,e11i4c
874,I'm honestly waiting to walk outside and get hit in the head by a Rosa's kick,Giants,6,1574624501,e11i4c
875,Can't even kickoff yo.,Giants,0,1574624498,e11i4c
876,Holy shit both halves start with a kickoff OOB lmoa,Giants,1,1574624494,e11i4c
877,Huh,Bears,1,1574624491,e11i4c
878,[removed],,1,1574624487,e11i4c
879,Thanks refs we won’t forgive you yet but still,Bears,1,1574624480,e11i4c
880,Yeah that's a pretty clear forward progress situation to me there.,Patriots,2,1574624478,e11i4c
881,how do both halves start with the ball being kicked out of bounds?,Bears,2,1574624467,e11i4c
882,I didn't realize I was watching the Twilight Zone,Bears,1,1574624464,e11i4c
883,"""I'm going to the Windy City. My gameplan as an NFL Head Coach is to air it out 50 times a game, jettison my proven HB to Philly, and have a gadget back as my primary option on every single play. The NFL just ain't ready for this!!""

-Matt Nagy",Panthers,5,1574624462,e11i4c
884,That was way too close,Bears,1,1574624461,e11i4c
885,I wish i loved something as much as Rosas loves hooking his kicks left,Colts,2,1574624452,e11i4c
886,"We got big brain shurmur running the best RB in the league into the ass of the center every run play, we gotta be pretty close on bad play calling",Giants,1,1574624444,e11i4c
887,Rosas lol,Giants,1,1574624436,e11i4c
888,"These moron Giants and their kicking woes , IDIOTS...",Bears,3,1574624430,e11i4c
889,I feel bad for Rosas,Bears,2,1574624429,e11i4c
890,Is Nagy an idiot?,Giants,3,1574624424,e11i4c
891,We both fucking suck.,Bears,1,1574624424,e11i4c
892,"I get if they brought in an unknown(for the Bears at least) like Dalton or Mariota and drafting someone but this is just a combination of everyone shitting the bed and getting unlucky.


Even with that InT Trubs has been one of the best players on offense these past 2 games. If the rest of the Bears were playing even 50% better, which they have the talent to play at, then the Bears win these past two games pretty easily.",Bears,1,1574624422,e11i4c
893,Kickers meltdown game,Bears,1,1574624419,e11i4c
894,Rosas is having a terrible no good horrible day,Bears,1,1574624415,e11i4c
895,"""Rosas day"" 😂",Bears,1,1574624415,e11i4c
896,This game is the Spider-Man pointing at each other meme.,,3,1574624414,e11i4c
897,Holy shit Aldrick Rosas might be the worst kicker alive,Vikings,1,1574624414,e11i4c
898,GUISE ITS COMING DOWN TO OUR KICKERS IM SCURRRRED,Giants,1,1574624413,e11i4c
899,Rosas on suicide watch.,,1,1574624399,e11i4c
900,"Jesus rosas.  
What is you doin baby",Giants,1,1574624390,e11i4c
901,You're sleeping on us here! We're equal parts shit in this!,Giants,1,1574624388,e11i4c
902,Coming here from the halftime show. what in the hell Chicago?,Vikings,1,1574624386,e11i4c
903,That Snap is hilarious.,Bears,1,1574624374,e11i4c
904,"Pat Shurmur is coaching in it, so yes.",Giants,1,1574624356,e11i4c
905,Mitch has Charlie Brown eyes,Bears,3,1574624287,e11i4c
906,You better buy a Lexus man. Universe is saying something,Bears,2,1574624270,e11i4c
907,Coach of the Year with a Pro Bowl Quarterback,Bears,2,1574624235,e11i4c
908,That's NFL Coach of the year to you,Bears,3,1574624209,e11i4c
909,Game of the year,Vikings,4,1574624174,e11i4c
910,Remember the time Matt Nagy was an NFL Head Coach?? 🤣🤣🤣🤣🤣🤣🤣🤣🤣🤣,Panthers,1,1574624140,e11i4c
911,Yea I don't know how much is injury and how much is just regression but he needs a mechanics overhaul... he's really lost the anticipation and timing that he did sometimes show before this year (though not consistently) and I think a lot of that is that he's just doing wonky stuff with his feet and thinking about too many other things and it messes up any rhythm.,Bears,1,1574624110,e11i4c
912,"Yeah, I don't think there's anything close to a controversy. Not sure you can even think about the QB position until the receivers stop dropping. It's infuriating and I'm not even a Bears fan.",Packers,4,1574624099,e11i4c
913,Let’s start by teaching how to wear his chin strap correctly.,Giants,1,1574624084,e11i4c
914,"""you guys""? I'm not on the team",Rams,0,1574624047,e11i4c
915,"Thanks, I hate it.",Giants,7,1574624037,e11i4c
916,Is this the saddest game of coaching this year?,Steelers,7,1574624032,e11i4c
917,Chase slide inbounds with limited time trying to come back against the rams,Bears,3,1574624018,e11i4c
918,Nagy is a horrible play caller.,Bears,3,1574624002,e11i4c
919,The Bears and Giants should swap Pinero and Rosas for the second half just for shits and gigs,Giants,5,1574624000,e11i4c
920,This is pretty much the average Bears game.,Bears,5,1574623994,e11i4c
921,Watching this game on ROKU and it’s been nothing but Lexus commercials since it went to commercial not sure what the fuck is going on lol.,,4,1574623953,e11i4c
922,Least they were IN the superbowl and NFCCG our window ended with the fucking double doink.,Bears,2,1574623952,e11i4c
923,Let's hope they win.,Giants,2,1574623938,e11i4c
924,[deleted],,1,1574623931,e11i4c
925,"drives In the first half

Giants: punt

Bears: punt

Giants: punt

Bears: interception

Giants: punt

Bears: punt

Giants: touchdown

Bears: punt

Giants: missed 42 yd field goal

Bears: punt

Giants: missed 43 yd field goal

Bears: field goal

Halftime",49ers,9,1574623926,e11i4c
926,Chase wouldn’t have even sniffed the redzone,Bears,2,1574623911,e11i4c
927,Browns do too. Kind of shocking,Bears,1,1574623862,e11i4c
928,Like choosing between being constipated or having the skitters.,Bears,2,1574623859,e11i4c
929,But I was told Trubisky had the ultimate practice this week :(,Bears,4,1574623857,e11i4c
930,Playoffs? PLAYOFFS? Are you kidding me?  I just hope we can win a game...,Bears,3,1574623854,e11i4c
931,And you guys went all in on insanely expensive players and now your window is shut with nothing to show for it. So congratulations I guess.,Bears,0,1574623841,e11i4c
932,that visa ad was kinda dry,Bears,1,1574623829,e11i4c
933,The chase Daniel Trubisky QB controversey. Fuck me that's depressing.,Bears,6,1574623776,e11i4c
934,"“Be more Accriate.” -Michael Strahan, truly powerful words.",,4,1574623750,e11i4c
935,Fox presents Bears games like Bears fans don't watch them. It's just brutal.,Packers,4,1574623750,e11i4c
936,"IIRC he's eddy, and bojack is eddie",Bears,2,1574623735,e11i4c
937,I started watching NFL more closely last year. The time management in these games is insane to me. They almost all go into halftime at the exact same time. Less than a minute game time between them.,Giants,3,1574623730,e11i4c
938,"can you even imagine if our offense had to play our defense, it would be complete destruction",Bears,5,1574623690,e11i4c
939,"
“Bring those arms: good things happen.

Arms are made for hugging and wrapping.”

 -	Chris Spielman (NYG vs CHI)",Bears,6,1574623686,e11i4c
940,lmao imagine being a sox fan,Bears,1,1574623684,e11i4c
941,"Pace was when he said ""lol let's pick up this guy with our newly attained 2nd overall""

And then the FO actually sent in the pick",Bears,2,1574623684,e11i4c
942,But then what would the network interns do?,Bears,1,1574623666,e11i4c
943,The winner of this game will have fallen ass first into it,Giants,11,1574623632,e11i4c
944,"Why did my dad make me a Bears, Bulls, and CWS fan?",Bears,1,1574623622,e11i4c
945,[deleted],,1,1574623600,e11i4c
946,202 offense be like,Bears,1,1574623593,e11i4c
947,lol NFL trying to keep us in the hunt just because we have prime time games... you ain't fooling anyone with that graphic,Bears,22,1574623588,e11i4c
948,In other news the Bengals have a lead at halftime.,Giants,10,1574623583,e11i4c
949,Nope,,4,1574623566,e11i4c
950,we tried telling yall,Bears,4,1574623561,e11i4c
951,You cant convince me this Bears offense isnt the worst in the NFL.,Bears,11,1574623557,e11i4c
952,why did my dad make me a bulls and bears fan,Bears,5,1574623556,e11i4c
953,It was a bad read on my part,Steelers,1,1574623552,e11i4c
954,This game is reinforcing the long standing theory that Bears’ fans two least favorite teams are the Green Bay Packers and the Chicago Bears (in some order).,Bears,10,1574623547,e11i4c
955,The Giants kicker looks like a homely Kaepernick,Packers,4,1574623543,e11i4c
956,Bears have no decent TEs,Bears,2,1574623541,e11i4c
957,Bears found their kicker. Last piece before a guaranteed SB,Rams,5,1574623538,e11i4c
958,So is Nagy’s game plan every week to get Trubisky 40+ attempts for like 200 yards and ignore the run game?,Steelers,7,1574623535,e11i4c
959,[deleted],,1,1574623532,e11i4c
960,"Few hiccups this year coming off of an all-pro season. I think he'll be fine, but we could give him some competition at least.",Giants,1,1574623527,e11i4c
961,I don't like booing your own team. I don't ever like it. But sometimes I understand it.,Bears,3,1574623521,e11i4c
962,Yay we're not shut out at the half for the 4th time this year.,Bears,4,1574623515,e11i4c
963,Well at least one of the kickers can make a goal,Bears,3,1574623508,e11i4c
964,"Yeah we shouldn’t have dropped Gould, we’ve had so many shitty qbs, and we drafted Mitch over Mahomes and Watson. Stop showing us these fucking graphics every damn game we get it for fucks sake.",Bears,8,1574623505,e11i4c
965,Bears should just go for it they would probably score on us,Giants,3,1574623496,e11i4c
966,we did something!,Bears,1,1574623496,e11i4c
967,"Trubisky is having a lost season due to injuries. Instead of progressing, he's gaining bad habits. That drift backwards and throw off the back foot thing he does frequently is not doing him any favors.",Packers,4,1574623495,e11i4c
968,Get us the fuck out of the playoff hunt,Bears,6,1574623492,e11i4c
969,Crucial field goal to cut it down to a two-possession game heading into the half,Bears,1,1574623491,e11i4c
970,"Lol sure Bears ""in the hunt""",Bears,2,1574623487,e11i4c
971,I’ll take Connelly on defense.,Giants,1,1574623483,e11i4c
972,Bears offense is actually worse than our defense. People weren't joking.,Giants,9,1574623480,e11i4c
973,"He’s gonna miss, right?",Bears,1,1574623444,e11i4c
974,Hope Rosas is taking notes,Giants,3,1574623442,e11i4c
975,"Thanks, Eddy

Edit: Wrong Ed, Edd n Eddy (Eddie)... my bad",Bears,3,1574623436,e11i4c
976,Does Trubisky ever progress past his first read?  He just stares at them,Broncos,0,1574623432,e11i4c
977,"bad on Mitch to not get it snapped. Also, loving the home town boos on every bears drive",,-3,1574623427,e11i4c
978,Nagy doesn't know. How can we score points against the giants' E L I T E defense??,Bears,6,1574623418,e11i4c
979,Not sure what that was but 2 or 3 players were clearly not on the same page.,Bears,6,1574623413,e11i4c
980,what the fuck,Bears,1,1574623407,e11i4c
981,"Matt Nagy's giant ego won't allow this team to succeed unless it succeeds through his system. He doesnt mold his scheme to the players, he tries to mold the players to his scheme and it doesn't work.",Bears,5,1574623405,e11i4c
982,This is Mack's DPOY statement game,Rams,2,1574623398,e11i4c
983,More like a fumble through the end zone as a reference to the Rams game,Bears,1,1574623396,e11i4c
984,"Gotta risk it for the Trubisquit, right coach?",Patriots,-1,1574623393,e11i4c
985,That was wild lmao,Bears,3,1574623391,e11i4c
986,Just take the penalty...,Packers,6,1574623383,e11i4c
987,Bears wat you doing?,Packers,6,1574623369,e11i4c
988,"Saw that too, literally nothing makes sense",Bears,3,1574623363,e11i4c
989,"Excuse me, but: HOW?!?!?!",,2,1574623359,e11i4c
990,for fucks sake Nagy,Bears,5,1574623350,e11i4c
991,LOL at having to call a timeout there,Bears,7,1574623344,e11i4c
992,Rosas? Pass.,Giants,1,1574623342,e11i4c
993,"it's fine, I'm pretty sure John Mara wished on a monkey's paw that he would be as successful running the Giants as his dad was and so now that he's won the same number of Super Bowls we're going to toil in mediocrity (or worse) until he dies

(Wellington Mara and his brother basically destroyed the team in the 60s and 70s until the league forced them to hire a general manager)

so we may as well take on some curses while we're here!",Giants,2,1574623342,e11i4c
994,lmao I just tuned in and I thought I was the sun,Bears,2,1574623341,e11i4c
995,Maybe your kicker is just a random fan wearing a Rosas jersey. He’s kicking like it,Bears,1,1574623323,e11i4c
996,82 was open and ran back into coverage this team sucks.,,11,1574623316,e11i4c
997,Mitch is actually seeing the open receiver for once.,Bears,2,1574623315,e11i4c
998,Pick 6 inc,Packers,0,1574623311,e11i4c
999,Bears should retire the white C helmet permanently.  Just reinforces the toilet seat joke.,49ers,4,1574623303,e11i4c
1000,I don't think that penalty ptsd is exclusive to Bears fans lol these refs have given us all nightmares,Bears,2,1574623293,e11i4c
1001,Incoming INT or missed field goal to reinforce what a clown show this is,Giants,5,1574623292,e11i4c
1002,We’ll never do no huddle because Nagy,Bears,4,1574623291,e11i4c
1003,you really wanna be on your 5th coach in 9 years?,Packers,1,1574623285,e11i4c
1004,"&gt;	garbage time

Down by 7 with 2 minutes left in the first half",Bears,5,1574623284,e11i4c
1005,One sack since September,Bears,1,1574623269,e11i4c
1006,Don’t be so sure of the Bears offense. Trust me,Bears,1,1574623261,e11i4c
1007,Is Miller the only WR on the field? 4 catches this drive.,Bears,3,1574623254,e11i4c
1008,"Jones, Barkley, Hernandez, Tate, Shepherd, Slayton, Engram on offense.

Peppers, Lawrence, Golden on defense.

Rosas on special teams.

Nobody on coaching staff.

That's 11. Math checks out.",Giants,1,1574623243,e11i4c
1009,"Honestly, for me it's hard to celebrate anything good in a game that happens immediately because my first thought is ""where's the flag?"". I even feel that way in college football. I'm an Illinois fan and a Bears fan so perhaps I've just been conditioned...",Bears,2,1574623240,e11i4c
1010,Rosas/Shurmur is gonna be the reason it’s 7-7 at half instead of 14-0 probably,Giants,4,1574623237,e11i4c
1011,A Rob is a stud but he’s got no qb. Patterson has also been great as a gunner on punts and as kick returner.,Bears,1,1574623236,e11i4c
1012,Someone tell Nagy that every time with the Bears is garbage time; it could really help spark his offense.,Bears,3,1574623235,e11i4c
1013,Two kicks*,Giants,4,1574623231,e11i4c
1014,FEED MILLER,Bears,2,1574623230,e11i4c
1015,Oh my god that is poetry,Bears,1,1574623228,e11i4c
1016,Being a fan of this team will do crazy things to a person,Bears,1,1574623222,e11i4c
1017,"open people everywhere, and Mitch actually sees them and doesn't overthrow them... what torture situation am I being set up for now",Bears,4,1574623218,e11i4c
1018,"Good boys swallow, mr.rosas",Colts,2,1574623218,e11i4c
1019,The Bears offense always looks so much better when they do hurry up. Makes no sense they don’t do it more,Vikings,3,1574623216,e11i4c
1020,"I'm not sure if that reflects worse on them or on the NFL. 

Because they're probably still right more often than they're wrong.",Bears,1,1574623211,e11i4c
1021,WATER SUCKS IT REALLY REALLY SUCKS,Giants,1,1574623211,e11i4c
1022,I would bone Virginia,Packers,0,1574623203,e11i4c
1023,"Nah been a fan since the late 90's, just some false optimism that things will be different this time. As a Bears fan I should know better, nothing ever changes with this franchise.",Bears,1,1574623198,e11i4c
1024,"Everything this team touches turns to shit. 

Bears will drive down the field here and score, get the ball back after halftime, score again, and that will be game.

Thanks Rosas.",Giants,6,1574623193,e11i4c
1025,Wow this Giants D is garbage,Bears,2,1574623184,e11i4c
1026,"So, can we like turn our normal offense into the 2 minute offense?",Bears,1,1574623179,e11i4c
1027,We smoking penis,Giants,1,1574623178,e11i4c
1028,Jets are on channel 2.,Giants,1,1574623173,e11i4c
1029,Soldier field is where kickers go to die,Bears,2,1574623160,e11i4c
1030,I really hope this game doesnt come down to a kick.,Bears,5,1574623149,e11i4c
1031,"Jesus, Mary and Joseph. We had a receiver catch the ball.",Bears,4,1574623148,e11i4c
1032,"We need to change the clocks at Soldier field, have them stuck at 1:57",Bears,3,1574623144,e11i4c
1033,MITCH IS FINALLY RUNNING,Bears,3,1574623142,e11i4c
1034,Hes gone he wont have a chance to miss next week,,1,1574623140,e11i4c
1035,RIP to the guy with the Rosas jersey.,Giants,2,1574623135,e11i4c
1036,WE GOT A FIRST DOWN!,Bears,1,1574623132,e11i4c
1037,"I'm sitting by a group of Bears fans that think every time the ref blows a whistle or make any signals, it's because they're calling a penalty.

Like the refs were signalling Rosas's kick no good, and the guy beside me thought they'd called a roughing the kicker penalty. 

&amp;#x200B;

They're being 100% serious.",Vikings,5,1574623129,e11i4c
1038,"Rosas was all pro like a year ago, bad case of the yips?",Giants,4,1574623124,e11i4c
1039,Mack should have a field day against two backup tackles,Rams,1,1574623123,e11i4c
1040,"he didn't doink it, a moral victory",Bears,1,1574623122,e11i4c
1041,This is the porous defense I remembered....,Giants,2,1574623121,e11i4c
1042,"I missed Bear suit lady, this sucks.",Packers,1,1574623119,e11i4c
1043,2 minute Mitch 😍,Bears,4,1574623119,e11i4c
1044,Or 31 plane crashes,Giants,1,1574623118,e11i4c
1045,You have to stop this Rosas. You missed both fuq that hold.,Giants,5,1574623111,e11i4c
1046,[removed],,1,1574623111,e11i4c
1047,Yeah he's not my favorite. For a young coach you'd expect smart developmental decisions.,Giants,2,1574623111,e11i4c
1048,why do I bother watching,Giants,2,1574623110,e11i4c
1049,Mitch went to the pro bowl last year,Bears,2,1574623109,e11i4c
1050,"This drive looks like it’s going well, let’s see how the refs choose to destroy it.",,5,1574623105,e11i4c
1051,PRO BOWL to SHIT SHOW,Giants,2,1574623103,e11i4c
1052,"This game is the worst game of football, possibly ever. Believe me.",Giants,6,1574623103,e11i4c
1053,The fuck happened to last season Rosas ?,Giants,1,1574623101,e11i4c
1054,"Dude, she was like 8 years old...",Bears,1,1574623098,e11i4c
1055,Cohen ran up the middle and actually got yards. That’s a first,Bears,4,1574623098,e11i4c
1056,Is Cohen the only bright spot on the bears?,,-1,1574623097,e11i4c
1057,Virginia looks disgusted. Shame on the Bears for upsetting such a sexy old lady,Packers,0,1574623094,e11i4c
1058,"Congrats Giants, youve contracted our kicker curse. Its all yours.

No takebacksies.",Bears,8,1574623092,e11i4c
1059,Bye bye Rosas.,Giants,1,1574623089,e11i4c
1060,cut rosas,Giants,2,1574623085,e11i4c
1061,Our Bears team is now influencing opponent kickers. That's when you know you've made it.,,6,1574623076,e11i4c
1062,Looks like someone is going to have to find his own way back to NY today.,Vikings,6,1574623074,e11i4c
1063,That's now six points we've left on the field.,,5,1574623067,e11i4c
1064,"this is where trubisky plays good, 2 min drills.",Bears,3,1574623063,e11i4c
1065,well,Giants,1,1574623063,e11i4c
1066,Whoever wins this game should put an asterisk on their record.,Bears,4,1574623058,e11i4c
1067,Imagine having kicker problems...,Bears,3,1574623055,e11i4c
1068,Unreal....you have 1 job dude. Worst regression ever?,Giants,8,1574623053,e11i4c
1069,Shurmur. HE CAN DO IT ALL,Giants,1,1574623052,e11i4c
1070,"&gt;I've been hibernating all fall

Hey so have the Chicago Bears",Bears,3,1574623051,e11i4c
1071,This game is trash.,Bears,4,1574623047,e11i4c
1072,So disappointing after last year..,Giants,3,1574623045,e11i4c
1073,Visa endorsing childabuse by showing that commercial of the mom letting her daughter be a bears fan.,Bears,15,1574623035,e11i4c
1074,Did they do something to the ball to make kicking more difficult this season?,Bears,4,1574623033,e11i4c
1075,I'll divorce my wife and marry the chick in the weird Bears suit right now.,Bears,5,1574623032,e11i4c
1076,Kicking is very difficult trust me I know,Bears,3,1574623032,e11i4c
1077,"Honestly it’s super hard to judge the D, Opposing O’s don’t have to take any risks because our O can’t score.  Turnovers won’t happen, but points against also come down.",Bears,1,1574623032,e11i4c
1078,"It’s the same as bud light except higher alch %, 6%",,1,1574623031,e11i4c
1079,"On the qb running- obviously is was a critical part of our offense last year and Nagy could call some designed runs to get it going, but it seemed like most of the runs last year were on scrambles and options and so I think Mitch is the one choosing to go with the throw more often this year.",Bears,1,1574623030,e11i4c
