,body,author_flair_text,score,created_utc,link_id
1501,Cowboys treating the Rams like theyre Colby Covington.,Cowboys,3,1576453182,eb4jgo
1502,"""Maintain possession THROUGH the process on the catch.""",Cowboys,1,1576453180,eb4jgo
1503,110 Million QB....,Rams,3,1576453173,eb4jgo
1504,Jesus Christ Goff! Make that throw!,Packers,2,1576453168,eb4jgo
1505,Lol see you at the linc tough guy,Eagles,0,1576453164,eb4jgo
1506,"I guess this is one way for the Rams to get back at the Eagles beating them twice in 2 years at the Coliseum, shit the bed vs the Cowboys hahaha",Eagles,1,1576453164,eb4jgo
1507,who the hell monstar'd Todd Gurley?,Patriots,2,1576453163,eb4jgo
1508,Yeah so secure while the ball was on the ground.,Cowboys,0,1576453154,eb4jgo
1509,Fuckin’ Goff LMAO,Cowboys,1,1576453151,eb4jgo
1510,Gurley is fuxking useless,Rams,3,1576453150,eb4jgo
1511,"Rams just need 4 TDs to tie it and to not allow the Cowboys to score anymore points. It would help if their offense actually made some plays instead of turtling, but we shall see.",Broncos,3,1576453149,eb4jgo
1512,I'm so fucking jealous of Goffs offensive weapons.,Eagles,1,1576453148,eb4jgo
1513,Gurley is beyond shot. He should retire and save that knee from total arthritic destruction.,Eagles,4,1576453148,eb4jgo
1514,Lul,Cowboys,1,1576453147,eb4jgo
1515,Not any wetter than mine,Cowboys,2,1576453145,eb4jgo
1516,Terrible throw,Patriots,1,1576453144,eb4jgo
1517,Gurley you good?,Cowboys,2,1576453143,eb4jgo
1518,Everyone saying he looked down doesn't realize he has to MAINT POSSESSION going to the ground ffs.,Cowboys,0,1576453143,eb4jgo
1519,[deleted],,3,1576453139,eb4jgo
1520,Majority of Americans hate the Cowboys no matter what dumb nickname you want to call yourselves lol,Eagles,1,1576453138,eb4jgo
1521,wide open............ cmon goff,Rams,0,1576453135,eb4jgo
1522,Has Dak even been touched today....,Eagles,2,1576453130,eb4jgo
1523,Were you projecting when you were talking about how the Eagles parents hated them. You seem really upset. Do you need to talk?,Eagles,2,1576453129,eb4jgo
1524,"I am not positive, Don’t think they put out an actual reason",Cowboys,1,1576453115,eb4jgo
1525,"I'm not saying the game is fixed or that the Cowboys get the most bad calls in their favor. But they definitely get more than most. Dak gets way more calls in his favor than Wentz does (the Redskins game today notwithstanding -- the rtp calls today were shocking).

I'm just salty about that bullshit call last year. Plus, Dak does intentionally slide late, and it's really frustrating. Defenses have a choice to either tackle and risk him sliding, or not tackling and risk him making a move for more yards. On the one hand, it's bs that refs call the late hits against him when he does that, but at the same.time, if the reffing is that bad and in his favor, I don't blame him.

But I am confident he does that intentionally and probably practices. He really is an expert at sliding and also baiting defenders into hitting him. It happens every game.",,2,1576453106,eb4jgo
1526,How wet are jerrys trouser right now?,Bills,3,1576453104,eb4jgo
1527,"Spoilers yo.

I'm waiting to pirate that shit.",Chiefs,1,1576453104,eb4jgo
1528,Did he maintain possession going to the ground?,Cowboys,1,1576453103,eb4jgo
1529,"O thanks, I am a old Oiler fan from Houston that lives in Conroe now. I really tried to be a Texan fan, but fuck. I was Warren Moon as a kid playing in my back yard. 

I really wanted to be a Texan fan and cheered the fuck on the Texans first game with Dallas when you guys won. I was a Texan fan that day. Fuck, Carr marched down and scored a TD the first drive.

I Just I dunno. You follow your first love, and I have.",Titans,1,1576453102,eb4jgo
1530,This is the way,,2,1576453102,eb4jgo
1531,"you should consider using that education for good, rather than hate. the world could use it. i'm not so sure many employers would be very impressed with your judgement of character",Cowboys,0,1576453089,eb4jgo
1532,And I can tell you still wear diapers and drink baby formula with all the crying you're doing.,Cowboys,1,1576453087,eb4jgo
1533,100%,,6,1576453085,eb4jgo
1534,Dallas needs to manufacture some fucking pressure,Cowboys,8,1576453080,eb4jgo
1535,Why'd they wear blue today? Was there some reason?,Patriots,1,1576453078,eb4jgo
1536,"I mean they were ready, it was just a good throw and catch.",Cowboys,1,1576453077,eb4jgo
1537,No,Panthers,1,1576453069,eb4jgo
1538,"Jason Garrett is outcoaching the phenom.

10 year extension coming up!!",,-3,1576453065,eb4jgo
1539,Yeah that’s tough either way tbh,Cowboys,1,1576453065,eb4jgo
1540,"I think I heard they were going to wear the whites and the blues, each for half of their games this year.",Buccaneers,2,1576453064,eb4jgo
1541,This aged well.,Cowboys,0,1576453063,eb4jgo
1542,I'm glad they reversed that call. People really hate when the Cowboys get bad calls in their favor even though every team gets bad calls in their favor.,Cowboys,7,1576453056,eb4jgo
1543,Did he maintain possession going to the ground?,Cowboys,-1,1576453056,eb4jgo
1544,Pls defense don’t do this now,Cowboys,3,1576453054,eb4jgo
1545,"5:00 minutes to go now in the third quarter, just wanted everyone to know that win or lose, the Eagles still suck Dick.",Cowboys,10,1576453052,eb4jgo
1546,The catch had two factor authentication,Cowboys,1,1576453051,eb4jgo
1547,"So if the other team creates a turnover due to some stupid mistake, you wouldn't want to take advantage of that?",Rams,0,1576453049,eb4jgo
1548,Dez Caught it,Cowboys,16,1576453043,eb4jgo
1549,I can tell you’re 14,Eagles,2,1576453037,eb4jgo
1550,Lol that is a clear catch,Panthers,1,1576453031,eb4jgo
1551,Troy stfu yes we know for the 10th time they are capable of coming back.,Cowboys,3,1576453026,eb4jgo
1552,He's killing me in Fantasy,Cowboys,1,1576453020,eb4jgo
1553,Yeah I thought it weird that he always needs to be bailed out by some kind of help...but he kicked ass in episode 6,Cowboys,1,1576453020,eb4jgo
1554,Yeah that’s tough,Cowboys,3,1576453019,eb4jgo
1555,Call on the field stands if it was the Cowboys lol,Cowboys,6,1576453002,eb4jgo
1556,Yeah a lot of fans are upset about it,Cowboys,1,1576453000,eb4jgo
1557,Damn refs playing by the rules.,Cowboys,6,1576452999,eb4jgo
1558,Umm no they didn’t and no they weren’t.,Cowboys,1,1576452997,eb4jgo
1559,[removed],,0,1576452997,eb4jgo
1560,That catch was pretty secured,Eagles,0,1576452996,eb4jgo
1561,Rams should put Hekker in at QB,Eagles,3,1576452994,eb4jgo
1562,The Cowboys and crippling mediocrity?,Cowboys,1,1576452994,eb4jgo
1563,Hekkin good throw,Dolphins,3,1576452992,eb4jgo
1564,That's the right call. Annoying though,Cowboys,8,1576452989,eb4jgo
1565,This aged well. Like Jason Garrett,Packers,2,1576452985,eb4jgo
1566,Fucking sad when I'm sitting here saying watch for the fake watch for the fake and fucking Garrett doesn't have them ready for a potential fake.,Cowboys,11,1576452983,eb4jgo
1567,"How do we not see that fake coming? Honestly, so obvious.",Cowboys,2,1576452980,eb4jgo
1568,My fantasy team is blessed,Cowboys,1,1576452978,eb4jgo
1569,Stupid refs and their stupid correct calls,Cowboys,7,1576452977,eb4jgo
1570,Canada I guess,Eagles,0,1576452975,eb4jgo
1571,"That's a catch downed by contact, seems pretty clear

Edit: I'm available to be a ref, call me Goodell",Cowboys,9,1576452970,eb4jgo
1572,[Jerry Jones trying to encourage Jason Garrett](https://www.youtube.com/watch?v=4jmqlJWNKu4),Cowboys,0,1576452963,eb4jgo
1573,I thought the cowboys were like really superstitious about their blue uniforms. Don't they usually wear white at home?,Patriots,6,1576452961,eb4jgo
1574,Baby Yoda ruined the show,,1,1576452961,eb4jgo
1575,And I benched him...,Lions,1,1576452960,eb4jgo
1576,"I do too, but yeah, you're right about the trends of modern tv",Cowboys,2,1576452956,eb4jgo
1577,Jason what are you shaking your head at you dumb fucker,Rams,0,1576452953,eb4jgo
1578,I want a gif of Thomas staring at the sky,Chiefs,5,1576452952,eb4jgo
1579,That is not a fumble.,Cowboys,4,1576452950,eb4jgo
1580,Should put Hekker in at QB,Cowboys,7,1576452950,eb4jgo
1581,"How is that a catch? 

Like are other teams just allowed to not secure the catch? That only applies to Dallas and Detroit?",Cowboys,5,1576452949,eb4jgo
1582,"Imagine if it stood

Rules guy: ""actually fuck what I just said that was a good call because uh...""",Cowboys,6,1576452947,eb4jgo
1583,[removed],,1,1576452946,eb4jgo
1584,"He’s had some drops this year, but that isn’t and had never been his issue.  His issue is that he instantly falls after the catch.",Eagles,1,1576452944,eb4jgo
1585,That was not even remotely close to a fumble.,Eagles,0,1576452940,eb4jgo
1586,That’s the right call.,Packers,2,1576452934,eb4jgo
1587,"No, the boomer part was more-so a joke.",Cowboys,0,1576452924,eb4jgo
1588,No o-line,Cowboys,1,1576452921,eb4jgo
1589,Don't be a moron and try to stand on a technicality.,Cowboys,0,1576452918,eb4jgo
1590,the ball is out by the time his shin hits,Colts,5,1576452918,eb4jgo
1591,Shouldn’t have taken this long,Eagles,0,1576452916,eb4jgo
1592,Personal fanbase attacks? Enjoy the ban. Imagine getting this mad. Are you sure I’m the child?,Eagles,1,1576452914,eb4jgo
1593,And Goff would throw it into the dirt.,Cowboys,2,1576452909,eb4jgo
1594,"Another game, but K. Drake has 4 TDs in one game. That's amazing",Cowboys,3,1576452907,eb4jgo
1595,"People are just primed for ultra serialization now. I kinda like the throwback ""adventure of the week"" style.",Cowboys,2,1576452905,eb4jgo
1596,Mandolorian himself sucks. He lucked his way into the cool armor and gets his ass kicked by everyone he meets,Seahawks,-1,1576452904,eb4jgo
1597,I thought the line of scrimmage was the 38 and they needed to get to the 43?,,1,1576452901,eb4jgo
1598,"Pereria already putting that plausible deniability out there for the refs, Jesus.",Eagles,3,1576452900,eb4jgo
1599,"Yeah, Ertz isn't known for getting a ton of receptions.",Eagles,1,1576452900,eb4jgo
1600,they should put the punter as QB instead of Goff!,Patriots,0,1576452899,eb4jgo
1601,Dude looks high as a kite,Cowboys,5,1576452899,eb4jgo
1602,Record wise? No. Confidence wise? Most definitely.,Cowboys,1,1576452896,eb4jgo
1603,Yes,Packers,1,1576452887,eb4jgo
1604,[deleted],,-2,1576452883,eb4jgo
1605,This should be a first down for the rams as much as I hate to say it,Cowboys,10,1576452881,eb4jgo
1606,"Imagine hiring Chip Kelly. Cry us a river, little Eagles fan.",Cowboys,0,1576452881,eb4jgo
1607,That’s grown man shit,Patriots,1,1576452878,eb4jgo
1608,*Secretly btw. This comment killed so many of my brain cells,Eagles,0,1576452878,eb4jgo
1609,"Oh yeah I complimented your name the other day.  Still great, 10/10, will never get old.",Texans,2,1576452875,eb4jgo
1610,Incomplete or down by his shin.,Cowboys,3,1576452874,eb4jgo
1611,Why dont we just let hekker play some drives,Rams,0,1576452872,eb4jgo
1612,Yea the refs are the ones causing this shitstomping,Cowboys,3,1576452871,eb4jgo
1613,Man I don’t even want the call to go our way,Cowboys,1,1576452871,eb4jgo
1614,And less story. But still awesome,Cowboys,2,1576452870,eb4jgo
1615,Lol I'm not a Boomer. Do you just assume everyone on the internet that says something you don't like is a Boomer?,Panthers,1,1576452868,eb4jgo
1616,Is there a legal way to buy stock in the Ertz's baby? Those genes are gonna be dunking out the womb.,Cowboys,9,1576452867,eb4jgo
1617,[deleted],,1,1576452866,eb4jgo
1618,"How are the Rams 8-5 right now, yet they got destroyed by us in their house while they were undefeated, and now they're getting blown out by a team that hasn't beat a team above .500 all season?

Is it McVay? Is it from overpaying for talent?",Buccaneers,4,1576452862,eb4jgo
1619,"Are you in an ultracompetitive athletics based relationship? Because if so, we have the perfect credit card for you",Steelers,1,1576452858,eb4jgo
1620,He looked down to me,Buccaneers,1,1576452854,eb4jgo
1621,"I’m sure you’re not biased at all, imagine being so spoiled that you want the ball to start both halves",Cowboys,2,1576452854,eb4jgo
1622,[deleted],,3,1576452853,eb4jgo
1623,"Refs are so full of shit, we had that",Cowboys,1,1576452852,eb4jgo
1624,Imagine firing Jimmy Johnson,Eagles,1,1576452851,eb4jgo
1625,I can’t wait for y’all to realize it was a shit play call,Cowboys,3,1576452850,eb4jgo
1626,"I do love Mando, but I get the people who want more of a meta plot. I like a good space Western though",Cowboys,6,1576452847,eb4jgo
1627,Was his knee down when he made that catch with a hand on his back?,Eagles,0,1576452842,eb4jgo
1628,I agree..?,,1,1576452842,eb4jgo
1629,"I don’t think it was wrong to change the ruling. But, they should’ve done it before the Rams were coming out to start the second half expecting to receive the ball.",Rams,2,1576452842,eb4jgo
1630,that ain't hard.,Patriots,2,1576452840,eb4jgo
1631,Yes but he might have been down.,Packers,1,1576452840,eb4jgo
1632,Did he even ever control the ball. It looked like it was constantly moving in his hand.,Cowboys,5,1576452838,eb4jgo
1633,I don't even know what's considered a catch anymore with all of the rules in place.,Cowboys,1,1576452836,eb4jgo
1634,Who else is Julie Ertz supposed to play for?,Cowboys,1,1576452836,eb4jgo
1635,I'm not sure it's a catch.,Cowboys,1,1576452834,eb4jgo
1636,Can you imagine pulling off a successful fake and than fumble the football?,Titans,1,1576452830,eb4jgo
1637,He was still bobbling the ball if they're gonna be anal about it,Patriots,3,1576452827,eb4jgo
1638,And it probably wont get cancelled,Rams,5,1576452824,eb4jgo
1639,This Zach Ertz commercial is inaccurate. He catches the ball in the commercial,Cowboys,6,1576452823,eb4jgo
1640,I can't wait to watch the Cowboys get this call too.,Rams,-10,1576452818,eb4jgo
1641,If they rule catch and down was he even past the line?,Giants,2,1576452816,eb4jgo
1642,[deleted],,-3,1576452816,eb4jgo
1643,I want a do over on the season. Let’s run all our games back.,Cowboys,2,1576452815,eb4jgo
1644,WHAT THE FUCK IS HAPPENING?!?,Cowboys,2,1576452815,eb4jgo
1645,[deleted],,1,1576452814,eb4jgo
1646,I’m just a man on his couch and I knew a fake punt was coming.,Cowboys,2,1576452812,eb4jgo
1647,"The Eagles are that bitchy little brother who demands respect but can't get it because their parents secretely hate them. We're coming for your shitty ass team next week, snowflake. Prepare your emotions, little child.",Cowboys,0,1576452807,eb4jgo
1648,It's what everyone has been saying for years.,Cowboys,2,1576452803,eb4jgo
1649,I know Dak will probably take 35 million of it 😰,Cowboys,1,1576452798,eb4jgo
1650,You can be a stand up person and still be dumb. I'm not impinging his character here. If you don't think what he did was dumb here you might be a remoron as well. I don't live in Green Bay and I went to a much better school than Mississipi state so I'm not too worried about what some random texan thinks.,Packers,-1,1576452797,eb4jgo
1651,Cowboys fans would drop baby yoda,Rams,-9,1576452797,eb4jgo
1652,The Mandalorian is just Firefly with a worse ship,Lions,2,1576452796,eb4jgo
1653,"No, that’s next week baby",Cowboys,1,1576452793,eb4jgo
1654,"No where did I say anything that you're claiming. I don't give a shit who wins this game.

You're the one who is biased here.",,1,1576452792,eb4jgo
1655,"It has no effect on the result of the game, but New York was wrong to give the Cowboys a retroactive deferral to the 2nd half.

The rule about the coin toss states ""A captain’s first choice from any alternative privileges listed above is final and not subject to change."" Dak's first choice was to kick.",Rams,-10,1576452789,eb4jgo
1656,Michael Thomas\*,Eagles,-1,1576452788,eb4jgo
1657,"I'm aware they explained the rule, as I stated above. I was replying to . . . 

&gt;The rule was that dak did say defer

You're wrong. You're confusing ""rule"" with ""ruling."" I'm not sure if you're being intentionally obtuse. But to clarify, Dak's name is not in the NFL rule book.",,0,1576452787,eb4jgo
1658,Shit I missed it. Did we get that?!,Cowboys,2,1576452787,eb4jgo
1659,I'm not even gonna pretend I know how they're gonna rule that. Waaaay too much going on,Packers,7,1576452784,eb4jgo
1660,That’s the question for sure. He was clearly down with the ball.,Cowboys,1,1576452783,eb4jgo
1661,Idk if you can overturn it,Cowboys,1,1576452780,eb4jgo
1662,It's either a fumble or an incomplete pass.,Cowboys,0,1576452777,eb4jgo
1663,It looks like he was down.,Cowboys,3,1576452773,eb4jgo
1664,"Kissing their ass for sucking more than we suck? Okay boomer. I don't think you understand that there isn't anyone in the NFC East that expects to win a single playoff game, nor do I think you understand the hate that we have for each other as competitors, it adds spice to a season that is otherwise hopeless.",Cowboys,1,1576452773,eb4jgo
1665,Kellen Moore&gt;Sean McVay,Cowboys,7,1576452772,eb4jgo
1666,If that's an actual catch he's def down,Panthers,3,1576452770,eb4jgo
1667,Refs already reversed the coin toss. No way they will say they were wrong twice.,Cowboys,6,1576452770,eb4jgo
1668,[deleted],,0,1576452767,eb4jgo
1669,[deleted],,0,1576452766,eb4jgo
1670,Even our own Special Teams is playing well. I'm dizzy guys.,Cowboys,5,1576452765,eb4jgo
1671,"I am glad with it. If we do not make the Playoffs, Just know, I root for AFC South so I will be a Texan homer for the playoffs.",Titans,1,1576452765,eb4jgo
1672,"Rams and trick punt plays, name a more predictable duo?",Cowboys,2,1576452764,eb4jgo
1673,He clearly squoze the ball.,Eagles,1,1576452763,eb4jgo
1674,Sean McVay uses too much hair gel.,Cowboys,1,1576452763,eb4jgo
1675,Zach and Julie seem like nice people who play for two of the most obnoxious teams,Lions,3,1576452761,eb4jgo
1676,The most obvious thing and they still get it off.,Cowboys,1,1576452761,eb4jgo
1677,#cryeaglescry,Cowboys,7,1576452758,eb4jgo
1678,The technically don't need this win,Lions,1,1576452757,eb4jgo
1679,"Gotcha, yeah we're set next year for sure.",Cowboys,1,1576452753,eb4jgo
1680,"I'm gonna need to see that another 30 times in slo mo, please.",Cowboys,3,1576452753,eb4jgo
1681,he’s 100% down,Redskins,4,1576452752,eb4jgo
1682,Was he past the line?,Cowboys,1,1576452747,eb4jgo
1683,"Actually looked like too little too late there, but I think he was down",,2,1576452744,eb4jgo
1684,Down by contact.,Giants,3,1576452743,eb4jgo
1685,That looked like he might have been down before the ball started to move. Hard to tell with him only having the possession with one hand though.,Eagles,0,1576452740,eb4jgo
1686,Here we go for 5 minutes to review frame by frame,Cowboys,1,1576452740,eb4jgo
1687,"Ehhh, I hope it stands, but I feel like that's down",Cowboys,3,1576452738,eb4jgo
1688,If anything maybe an incomplete pass but I don’t think that’s a fumble.,Cowboys,3,1576452738,eb4jgo
1689,America’s Shame of the Week,Eagles,4,1576452737,eb4jgo
1690,LMAOOOOOOOOOOO,Cowboys,1,1576452737,eb4jgo
1691,How does Garrett not get them into coverage on that. It’s fucking Hekker and they need a first,,2,1576452737,eb4jgo
1692,He neve brought the ball in.  Idk how they’re going to call this.  It doesn’t look like it’s coming lose before he’s down but you never know,Patriots,2,1576452736,eb4jgo
1693,"So boy genius McVay refused to acknowledge Gurley's existence all year, and now he Thanos-snapped Kupp too?!",Saints,6,1576452724,eb4jgo
1694,Probably stands,Cowboys,3,1576452722,eb4jgo
1695,Looks like he's down to me,Eagles,2,1576452721,eb4jgo
1696,"I know, I was talking abut us in comparison",Cowboys,2,1576452720,eb4jgo
1697,He is down,Lions,5,1576452720,eb4jgo
1698,Looks like that should get overturned. That dude was like Jay Sean level down before the ball came out,Cowboys,8,1576452719,eb4jgo
1699,shit looks like a catch. not that it matters,Cowboys,2,1576452719,eb4jgo
1700,"He was already losing control of the ball before he was down, that's a fumble",Cowboys,2,1576452717,eb4jgo
1701,That's fair,Rams,2,1576452717,eb4jgo
1702,That's fair,Rams,1,1576452712,eb4jgo
1703,He was down first.,Chargers,5,1576452712,eb4jgo
1704,AHAHAHA nice try rams,Cowboys,1,1576452710,eb4jgo
1705,Looks like he was down,,2,1576452710,eb4jgo
1706,"He had to of been down, right?",,1,1576452709,eb4jgo
1707,Everyone and their mother knew that was gonna be a fake,Cowboys,5,1576452709,eb4jgo
1708,"stop stop, they're already dead",Cowboys,3,1576452709,eb4jgo
1709,That's fair,Rams,1,1576452708,eb4jgo
1710,Looks ass down,Falcons,1,1576452708,eb4jgo
1711,Down,Cowboys,1,1576452707,eb4jgo
1712,"""Dehlus Cowboys""",Cowboys,1,1576452706,eb4jgo
1713,Extra short punt,Cowboys,2,1576452704,eb4jgo
1714,That's fair,Rams,1,1576452703,eb4jgo
1715,He’s down,Cowboys,1,1576452701,eb4jgo
1716,[deleted],,4,1576452701,eb4jgo
1717,That ain't no damn Michael Thomas,Cardinals,3,1576452697,eb4jgo
1718,the Jeff Fisher special,Cowboys,3,1576452697,eb4jgo
1719,Lmao,Cowboys,3,1576452697,eb4jgo
1720,I think most of us knew that was coming,,2,1576452696,eb4jgo
1721,I was talking about the Rams.,Cowboys,1,1576452691,eb4jgo
1722,"I hate the Lakers as much as anyone, but the Cowboys wish they were as successful as the Lakers",Cowboys,1,1576452690,eb4jgo
1723,Pls no,Cowboys,2,1576452688,eb4jgo
1724,Hes clearly down on his ass,Rams,5,1576452687,eb4jgo
1725,He’s down.,Cowboys,8,1576452687,eb4jgo
1726,Not even a little bit,Rams,1,1576452686,eb4jgo
1727,[deleted],,1,1576452684,eb4jgo
1728,It was tough. Kinda how it’s tough for you now. It’s a cycle. One day the bills will not suck and your life will be happier I guess.,Patriots,0,1576452683,eb4jgo
1729,Is McVay playing 4D chess and falling on a grenade so Garrett gets an extension????,Rams,2,1576452677,eb4jgo
1730,"Jourdan you fuckin animal, that was a lovely swat. So nice to see this defense play to it's fuckin potential, god damn",Cowboys,3,1576452675,eb4jgo
1731,Dallas's ball either way.,NFL,8,1576452674,eb4jgo
1732,The cowboys are that older brother that peaked in highschool and dropped out of college while they watch their little brother become the CEO of world bank.,Eagles,2,1576452672,eb4jgo
1733,"Knowing how this team has performed, we'll come out and beat the 9ers next week and turn around and get blasted by Arizona because fuck you that's why.",Rams,9,1576452670,eb4jgo
1734,Should be down by contact.  Or incomplete,Patriots,4,1576452669,eb4jgo
1735,That was a weird outcome for a fake.,Titans,2,1576452669,eb4jgo
1736,Y'all should be kissing the eagles ass right now for allowing you to win the worst division in football with a Max record of 9-7,Panthers,-6,1576452668,eb4jgo
1737,[deleted],,1,1576452667,eb4jgo
1738,Garrett saving his job rn,Eagles,2,1576452665,eb4jgo
1739,Shitty Michael Thomas,Rams,3,1576452662,eb4jgo
1740,Easily.,Cowboys,2,1576452660,eb4jgo
1741,Rams in shambles,Cowboys,7,1576452657,eb4jgo
1742,Cowboys getting hot at the end of the season... I can only become so erect,Cowboys,8,1576452655,eb4jgo
1743,"&gt; we fucking played and did a good job.

Yes they did.  I don't like this QB switch.  Please go back to pineapple boi",Texans,2,1576452655,eb4jgo
1744,Everyone knew that was a pass,Eagles,1,1576452648,eb4jgo
1745,Dak should. He's not a top 5 QB but he's got potential to get there one day and Dak has auch better chance of being successful than taking a draft pick,Cowboys,1,1576452644,eb4jgo
1746,Lmao. Genius McVay y’all,Cowboys,6,1576452640,eb4jgo
1747,Someone please tell Stephen A Smith that shit on the Cowboys day has been cancelled,Falcons,4,1576452638,eb4jgo
1748,I can't even argue with you there,Jaguars,1,1576452637,eb4jgo
1749,Richard doesn’t like small guys,Cowboys,2,1576452636,eb4jgo
1750,It starts up front,Cowboys,2,1576452636,eb4jgo
1751,We have 86.5 million lol,Cowboys,1,1576452636,eb4jgo
1752,Lewis is our best db,Cowboys,4,1576452631,eb4jgo
1753,"Trying to humanize VR, I guess, since it's a hard sell to a casual audience.",Saints,1,1576452628,eb4jgo
1754,at least it didn't take our franslchise 52 years to win a trophy. Cry Eagles cry! It's okay little brother,Cowboys,2,1576452622,eb4jgo
1755,If y’all still had CJ we would be fffffffuuucked,Cowboys,3,1576452621,eb4jgo
1756,Oh... I was thinking total yards.   You are right.,Cowboys,2,1576452619,eb4jgo
1757,Lewis bro why hasn't he started all season again?,Cowboys,5,1576452619,eb4jgo
1758,"Very true. Both Rams and Cowboys are maddeningly inconsistent. World beaters one week, lose to Bucs/Jets the next.",Rams,1,1576452617,eb4jgo
1759,Apparently fans and players are no longer allowed to get hyped when they are winning a game the desperately need.,Cowboys,11,1576452615,eb4jgo
1760,Did cooper kupp fuck sean mcvays wife or what JFC,Falcons,3,1576452614,eb4jgo
1761,Micheal Bennett has been in goffs face all game,Cowboys,5,1576452614,eb4jgo
1762,Offensive genius,Falcons,1,1576452611,eb4jgo
1763,See ya next week. Rent free,,2,1576452609,eb4jgo
1764,"Do you hold the tiebreaker over the Vikings? By record, you'd still be in the hunt--Vikings would have to lose out if they win this game though",Seahawks,1,1576452607,eb4jgo
1765,I'm not in cowboys threads every week. Try again,Eagles,1,1576452606,eb4jgo
1766,This is true,Cowboys,1,1576452592,eb4jgo
1767,[deleted],,-7,1576452592,eb4jgo
1768,They explained the pertinent rule in the book.   You're wrong.,Cowboys,0,1576452580,eb4jgo
1769,"You aren't eliminated, but you have to win out and we have to lose out (after this week)",Vikings,1,1576452573,eb4jgo
1770,Our LBs have not been good at reading em,Cowboys,3,1576452572,eb4jgo
1771,Damn screens.,Cowboys,6,1576452572,eb4jgo
1772,That girl clearly sounds like she should like Da Bears but she likes the cowboys wtf,Panthers,7,1576452572,eb4jgo
1773,because being a lakers fan makes you a bad person,Patriots,2,1576452568,eb4jgo
1774,Try using a blue light filter,Rams,2,1576452568,eb4jgo
1775,"7:00 Minute warning, enough time to remind everyone the the Eagles still suck dick.",Cowboys,31,1576452559,eb4jgo
