,body,author_flair_text,score,created_utc,link_id
0,"Right, dumbfucks bitching for sure",Bears,1,1574746078,e11i4c
1,"I dunno.  Divisional games are always weird.  Anything can go wrong.

My hope is that by the time we play each, the teams are eliminated and the fight is gone.  But I am not confident in any game until it's played.",Packers,1,1574633818,e11i4c
2,Spoiler alert: you win both games,Giants,2,1574633517,e11i4c
3,"LOL it all has to do with HIM not anyone else.   When you turn the ball over than much and make TERRRIBLE decisions where you throw it, you can already tell with the trends.  He is not an NFL QB and needs to go.",Giants,-1,1574631077,e11i4c
4,"He's a rookie QB on a shit team, you're expecting too much",Giants,2,1574630869,e11i4c
5,"He is trash, no pocket presence and bad decisions.  Next year when he does it again, everyone will continue to make excuses.  Then the next year everyone will be out for his head.  Better be done with this BS a year early than 2 years late.  He is a broken record.",Giants,-2,1574630708,e11i4c
6,Give Jones more than 3/4 a season....,Giants,1,1574630522,e11i4c
7,Who knows?,Panthers,1,1574630344,e11i4c
8,Chase Young?  We need a QB,Giants,-1,1574630306,e11i4c
9,GG bears,Giants,3,1574630305,e11i4c
10,Would appreciate it.,Giants,1,1574630120,e11i4c
11,"It’s a professional level, feelings will be running far more hot on criticism.

Anyways, welcome to the Giants losing aftergame party!",Giants,1,1574630100,e11i4c
12,CBS has it,Bears,3,1574629881,e11i4c
13,"You realize how pissed off at their teams fans of both are, right?",Bears,1,1574629802,e11i4c
14,Thanks bro!,Giants,1,1574629750,e11i4c
15,How the fuck did they pick this one over Carolina vs NO?,Packers,2,1574629712,e11i4c
16,"""Bonus Coverage"" of another shitty game.

The 3-6-1 Lions vs. the 1-9 Foreskins.

I can barely contain my excitement.",Panthers,7,1574629617,e11i4c
17,"First NFL game thread and I have to say, a lot more negative than the college games. Go figure.",Bears,6,1574629586,e11i4c
18,OT and we have a fucking chance.,,1,1574629571,e11i4c
19,We can hopefully make that happen for you next week.,Packers,0,1574629538,e11i4c
20,Rosas with the 400 iq so we get Chase Young,Giants,6,1574629516,e11i4c
21,"he makes those two field goals and Pineiro makes the XP, and what's the score again?",Bears,0,1574629485,e11i4c
22,It's the latter. We don't really consistently get open without Engram in.,Giants,2,1574629484,e11i4c
23,I can't wait until Shurmur is fired,Giants,3,1574629480,e11i4c
24,Whatever.,Giants,3,1574629478,e11i4c
25,"Classic Giants, do enough to give a bit of hope at the end, but doing more than enough to ensure we lose.",Giants,5,1574629473,e11i4c
26,Gg Giants; it was truly a match of equals,Bears,9,1574629457,e11i4c
27,"Child abuse is not cute.

Loving parents do not make their children Bears fans.",Bears,3,1574629455,e11i4c
28,It's not like it matters. The Bears are ZERO threat to the Vikes and Pack,Packers,1,1574629453,e11i4c
29,[deleted],,1,1574629451,e11i4c
30,So ain't Virginia McCaskey. She remembers it well...being that she was 11 at the time.,Panthers,3,1574629444,e11i4c
31,I think Rosas playing 4d chess and wants us to draft Chase Young,Giants,2,1574629431,e11i4c
32,GG Giant bros,Bears,3,1574629425,e11i4c
33,Gg bears fans. The GDT was more enjoyable than the game,Giants,6,1574629421,e11i4c
34,Needs some weird tribal tatts.,Bears,1,1574629418,e11i4c
35,Should probably get a new ladder then,Bears,1,1574629410,e11i4c
36,Aldrick Rojas gifted this game to the Bears.,,2,1574629409,e11i4c
37,Nah your tank is good.,Bears,1,1574629402,e11i4c
38,GAME. SET. MITCH.,Bears,2,1574629398,e11i4c
39,Bears really need to win this. We still salty over that 1934 Championship game,Bears,5,1574629389,e11i4c
40,Another win in spite of Nagy,Bears,5,1574629384,e11i4c
41,"Fuck it, challenge for PI.

edit: nvm, inside 2:00.",Giants,3,1574629373,e11i4c
42,[deleted],,1,1574629369,e11i4c
43,[removed],,1,1574629368,e11i4c
44,"Well honestly, I don't think I'd want Rosas kicking a FG with the game on the line.",Giants,4,1574629358,e11i4c
45,There we go.,Bears,4,1574629339,e11i4c
46,You can only survive so many 4th downs,Giants,10,1574629336,e11i4c
47,GAME. SET. MATCH.,Bears,2,1574629331,e11i4c
48,Damn Eli looks like that dude that hangs outside of the 7-11 selling single Newport’s to high schoolers.,,6,1574629330,e11i4c
49,He always seems so hesitant to throw and I can't tell if it's a lack of confidence or no one's open. Probably the ladder.,Giants,8,1574629314,e11i4c
50,DPI,Giants,3,1574629300,e11i4c
51,Scared of Sexy Dexy,Giants,1,1574629294,e11i4c
52,"I mean he is...

That doesn’t mean Nagys using him well.",Bears,1,1574629283,e11i4c
53,Mack just bulled him.,Bears,5,1574629279,e11i4c
54,#THE MUTE IS HEH!#,Panthers,3,1574629265,e11i4c
55,"Damn for a guy who was slated as a late rounder because of his lack of route running ability and not winning on releases, mans just did both on 4th down to keep the game alive. He may not be a 1:1 replacement for OBJ but thats a hell of a steal at round 5.",Giants,3,1574629243,e11i4c
56,"The one thing he's done decently this year is not throw interceptions, he had four coming into today",Bears,3,1574629242,e11i4c
57,That Bears mom is cute AF,Bears,3,1574629236,e11i4c
58,I'm gonna laugh so hard if the bears choke this away,Colts,0,1574629233,e11i4c
59,THE CHAMP IS HERE,Bears,2,1574629230,e11i4c
60,"Put a bow on that nice dub haaa haaa

but yeah we may blow this",Bears,2,1574629218,e11i4c
61,Bears fans are the consumate meatball,Bears,2,1574629199,e11i4c
62,Chicago Bears and Nihilism: Name a better duo.,Bears,2,1574629195,e11i4c
63,Found Matt Nagy,Bears,3,1574629188,e11i4c
64,No Mr. Fumbles will turn it over.,Giants,-2,1574629187,e11i4c
65,#Mute-Mute! I want my Mute-Mute! I want my Mute-Mute! There goes my Mute-Mute!#,Panthers,3,1574629177,e11i4c
66,2 interceptions is a career low in a game isn't it?,Packers,1,1574629177,e11i4c
67,He did,Bears,6,1574629177,e11i4c
68,"Theyre going to score a TD, fake like theyre going for two, but then get a penalty and then shank a 48 yard extra point.",Bears,2,1574629164,e11i4c
69,fuck we are going to bow this aren’t we,Bears,2,1574629145,e11i4c
70,Please stop showing clips of Mitch celebrating. It gives the impression that he's played well,Bears,-6,1574629119,e11i4c
71,‘Which allows a clear path for fix’ ha ha,Bears,1,1574629119,e11i4c
72,At least you didnt use them on a 50 yard XPA,Bears,3,1574629080,e11i4c
73,No.  The dumbfucks complaining about the playcalling are.,Bears,-3,1574629062,e11i4c
74,"I mean what is he supposed to do, he doesnt return punts and fumbling it would be worse than letting it go even if it was downed on the one inch line",Giants,1,1574629057,e11i4c
75,The worst run play possible followed by genius level special teams play.,Packers,8,1574629046,e11i4c
76,Secret Agent Prince,Giants,5,1574629035,e11i4c
77,I fucking hate prince,Bears,-6,1574629030,e11i4c
78,Did solder learn to kick-step at Erick Flowers University?,Giants,2,1574629012,e11i4c
79,He’s a decent RB though,Bears,3,1574629001,e11i4c
80,This TE is falling down before even catching it,Giants,3,1574628999,e11i4c
81,Punt,Bears,2,1574628990,e11i4c
82,I meant Ownership. Not fans.,Panthers,1,1574628984,e11i4c
83,Jones needs to just run for this 1st down,Giants,2,1574628983,e11i4c
84,Are you 12?,Bears,4,1574628976,e11i4c
85,"Patterson was a terrible WR, but it's been good to see him become a premier special teamer.",Giants,7,1574628973,e11i4c
86,Solder’s so bad x4,Giants,3,1574628972,e11i4c
87,"""You better congratulate Matt Nagy for calling a Punt on 4th Down that his Special Teams executed...""

Shut up.",Panthers,3,1574628961,e11i4c
88,How? The Giants are going to kick two field goals in the last 3 minutes?,Bears,1,1574628952,e11i4c
89,"""Matt Nagy bad playcaller, need more runz""

Runs Cohen outside, met at LOS

""Matt Nagy bad playcaller, need more Montgomeryz""

Montgomery takes handoff, is tackled a quarter of a second later before he can finish tucking the ball.

""Matt Nagy bad playcaller need more pazz""

This dude has nothing to work with, lol.",Bears,-2,1574628949,e11i4c
90,That was close.,Bears,1,1574628949,e11i4c
91,Because our coach sucks,Bears,3,1574628948,e11i4c
92,I appreciate this game thread a lot. Because 100% of the comments are essentially about how much we hate our coach. That's solidarity.,Giants,7,1574628941,e11i4c
93,don’t count on it,Bears,2,1574628941,e11i4c
94,Why did people boo not going for it there lol we would have probably lost the game if we did that,Bears,3,1574628939,e11i4c
95,I wonder what it’s like to have any time outs near the end of a game,Giants,3,1574628937,e11i4c
96,That was insane,Giants,1,1574628936,e11i4c
97,We already have. Our GM Pace is even a bigger issue.,Bears,2,1574628933,e11i4c
98,CP for MVP,Bears,3,1574628929,e11i4c
99,God dammit jackrabbit,Giants,2,1574628928,e11i4c
100,"Yea no 

I’m not congratulating Nagy on anything

He did his job there

What he’s supposed to do",Bears,3,1574628926,e11i4c
101,"the giants was my Ex's team. so I love watching them lose. Don't let me down, Bears. (although being let down would be a true bears experience)",NFL,3,1574628926,e11i4c
102,Solder hardly touched him,Giants,1,1574628922,e11i4c
103,bruh.,Giants,1,1574628920,e11i4c
104,5D Tic Tac Toe,Bears,4,1574628918,e11i4c
105,Fuck you Jenkins,Giants,1,1574628915,e11i4c
106,Ya let’s congratulate Nagy for correctly punting on 4th and 2 lmao,Bears,8,1574628902,e11i4c
107,NICE!,Bears,1,1574628890,e11i4c
108,"Jeez, Cohen can't get 1 yard in the open field and that 3rd down play.  Nagy is such a joke of a playcaller.",Bears,1,1574628886,e11i4c
109,Nagys a genius,Bears,3,1574628880,e11i4c
110,That was a neat special teams play. Patterson is easily the best special teamer in the league,Giants,7,1574628868,e11i4c
111,"They went 97 yards last drive, they can certainly go 95 yards",Bears,6,1574628861,e11i4c
112,Why didn't they just QB sneak? They only needed like 3 inches.,Giants,7,1574628858,e11i4c
113,There is the run play on 3rd and short r/chibears has been begging for.,Bears,1,1574628857,e11i4c
114,That was one of the sexiest special teams plays I've ever seen since the Johnny Knox return that got called back on a phantom hold,Bears,5,1574628857,e11i4c
115,I LOVE YOU PATTERSON,Bears,2,1574628850,e11i4c
116,"DAMN, this S/T play was badass!",Colts,5,1574628845,e11i4c
117,That might've just saved the game for them,Giants,4,1574628845,e11i4c
118,"When's Da Bears gonna admit that Nagy ain't ""that dude?""",Panthers,1,1574628845,e11i4c
119,"great save, Patterson",Bears,1,1574628843,e11i4c
120,Nagy trying VERY hard to be Mike McCarthy,Packers,2,1574628843,e11i4c
121,Just go for it on 4th you will get it,Giants,0,1574628843,e11i4c
122,"Jesus Christ okay Nagy is dumber than shurmur, a delay handoff up the middle when they know it’s going up the middle 👏",Giants,7,1574628837,e11i4c
123,The bears are trying to run out the clock and keep fucking throwing wtf,Vikings,3,1574628834,e11i4c
124,lol what just happened there,Giants,3,1574628832,e11i4c
125,Why are we running a run that takes 4 seconds to develop on 3rd and 1,Bears,5,1574628831,e11i4c
126,Bears really bout to blow this,,2,1574628826,e11i4c
127,We are going to lose to that missed pinero XP,Bears,3,1574628820,e11i4c
128,Bet thanks for not judging me lol,Giants,1,1574628819,e11i4c
129,Fuck Nagy,Bears,5,1574628810,e11i4c
130,Matt Nagy is fucking stupid. Holy shit I hate him.,Bears,4,1574628798,e11i4c
131,OFFENSIVE GENIUS MATT NAGY,Bears,7,1574628796,e11i4c
132,Why don't we ever QB sneak,Bears,6,1574628791,e11i4c
133,I don't like where this is going,Bears,3,1574628790,e11i4c
134,I thought so too,Giants,1,1574628784,e11i4c
135,We're about to lose this game,Bears,2,1574628784,e11i4c
136,That was rediculous.,Packers,2,1574628783,e11i4c
137,Counter straight into an overload nice call,Bears,2,1574628781,e11i4c
138,Ed Reed wouldn't do that,Rams,2,1574628775,e11i4c
139,Absolutely pathetic,Bears,2,1574628773,e11i4c
140,Both teams have been off the line early all day. You’re likely right in what you saw but its something that hasn’t been called.,Giants,2,1574628772,e11i4c
141,If it comes down to that Bs OPI call fml,Bears,2,1574628762,e11i4c
142,"We're not lightyears away. We are a coach, offensive line and some impactful defensive players away. Most importantly though we're a coach away.",Giants,2,1574628761,e11i4c
143,do the bears ever run the ball?,Giants,3,1574628760,e11i4c
144,Its now dead when it hits the endzone,Packers,1,1574628753,e11i4c
145,I don't mind him in the slot. But please no cohen in the backfield on first down.,Bears,3,1574628749,e11i4c
146,"Losing out but having Jones look good is best case Ontario, so I'm OK with today.",Giants,5,1574628749,e11i4c
147,It just sucks,Bears,1,1574628738,e11i4c
148,Was there a rule change for kickoffs that make that ball not recoverable for a TD anymore?,Giants,2,1574628689,e11i4c
149,Its all on the biscuit to run a 4 minute offense.,Packers,3,1574628689,e11i4c
150,Imagine if Shurmur was that ballsy the other 59 minutes and 30 seconds of the game.,Giants,3,1574628683,e11i4c
151,Pass protection has been a C run blocking a D-,Bears,2,1574628678,e11i4c
152,One of the worst in pass and run,Bears,1,1574628669,e11i4c
153,We will do just enough to show some flashes and have some highlights while still losing. It’s advanced tanking,Giants,1,1574628669,e11i4c
154,"Not even a question. He has issues with fumbles and handling pressure, but every reasonable coach and analyst thinks hes someone you can build a team around.",Giants,1,1574628666,e11i4c
155,We have to rely on our offense to get a fir... gg Giants,Bears,1,1574628656,e11i4c
156,Wasn't there offsides on the right side of the line on that touchdown throw?,Jets,1,1574628653,e11i4c
157,[deleted],,1,1574628653,e11i4c
158,"To anyone who thinks this is a shitty game...you’re probably right, but it’s closer than the jets game at least. So it could be worse. The jets could be on",,2,1574628652,e11i4c
159,if he doesn't get the fumbles under control he's going to be infuriating. if he does then he could be really good. it could really go either way!,Giants,2,1574628647,e11i4c
160,How is the Bears' Oline btw? Don't watch much of em but are they good?,Colts,1,1574628640,e11i4c
161,I'd like to see our DVOA this season just in the 4th quarter. It's gotta be bottom 10.,Bears,3,1574628627,e11i4c
162,What a throw from Danny,Giants,2,1574628620,e11i4c
163,Watching live it looked like a false start on the right side of the line but I guess it was just timed well,Bears,2,1574628615,e11i4c
164,Does it matter?,Bears,3,1574628615,e11i4c
165,Taking notes from our defense,Giants,1,1574628600,e11i4c
166,We suck,Bears,2,1574628597,e11i4c
167,"Okay, so we just have to rely on our defense to.... good win Bears",Giants,5,1574628591,e11i4c
168,C E R T I F I E D  D I M E,Giants,2,1574628590,e11i4c
169,Dimes!!!!!,Giants,3,1574628588,e11i4c
170,No one is fighting you on that in this thread lol,Bears,5,1574628586,e11i4c
171,"I hope Tate is ok, he hit his head pretty hard",Packers,1,1574628586,e11i4c
172,"Jones is the future. Just imagine if we had an OLine, a defense, and a coach who wasn’t clinically braindead",Giants,5,1574628584,e11i4c
173,Are we going to lose this game? I feel like we're going to lose this game.,Bears,5,1574628581,e11i4c
174,We will still lose.,Giants,3,1574628581,e11i4c
175,Do you think Daniel planned that or just chucked it up?,Giants,3,1574628575,e11i4c
176,Damn fine catch.,Bears,2,1574628572,e11i4c
177,Tell me about it. 🤕,Packers,1,1574628572,e11i4c
178,"Lmao my stream froze, thought Mack was gonna get the sack.

Had to restart it and fml",Bears,4,1574628567,e11i4c
179,Yeah I agree coaching is so important in this league,Giants,1,1574628564,e11i4c
180,Yea no,Bears,-6,1574628563,e11i4c
181,That TD was on Eddie Jackson,Bears,2,1574628562,e11i4c
182,The big bad defense chokes again,Bears,2,1574628561,e11i4c
183,What was Eddie Jackson even doing on that play.,Bears,4,1574628560,e11i4c
184,Hot Take: Jones will be a top 10 QB over the next decade.,Bears,2,1574628554,e11i4c
185,Wow! What a play by Tate!,Giants,2,1574628550,e11i4c
186,"K Dimes, that was great",Giants,2,1574628549,e11i4c
187,Daniel jones &gt; mitch.,Giants,6,1574628545,e11i4c
188,Well I'll be damned. Go Tate! Go DJ!,Giants,3,1574628543,e11i4c
189,Tate is the only saving grace on the Giants.,Giants,2,1574628529,e11i4c
190,You have to go to be fucking kidding me,Bears,1,1574628522,e11i4c
191,Eddie Jackson fucked up. Damn.,Bears,1,1574628520,e11i4c
192,"Tate doesn't get a play but when he does, it's gold.",Giants,5,1574628510,e11i4c
193,Lol,,1,1574628508,e11i4c
194,I thought Jones just threw it up for grabs. I can't believe Tate got open.,Giants,3,1574628506,e11i4c
195,WHAT THE FUCK,Bears,1,1574628505,e11i4c
196,"I’m used to those plays happening against our defense, not the other way around",Giants,1,1574628503,e11i4c
197,That was a dime,Patriots,2,1574628497,e11i4c
198,Idk what \#39 was doing there,Giants,1,1574628495,e11i4c
199,"WOW, great throw under pressure.",Bears,3,1574628493,e11i4c
200,On 4th and 18... defense loves choking,Bears,6,1574628483,e11i4c
201,"Idk about garbage time anymore, man. Y'all might have a chance to win now!",Colts,1,1574628483,e11i4c
202,"wow, damn ridiculous catch by Tate",Giants,3,1574628480,e11i4c
203,HOW,Bears,2,1574628476,e11i4c
204,"Really giving that up on 4th and 18, huh",Bears,3,1574628475,e11i4c
205,Wheres the guys saying Mack doesnt get triple teamed?,Bears,2,1574628467,e11i4c
206,OH COME ON GUYS,Bears,3,1574628464,e11i4c
207,[deleted],,4,1574628460,e11i4c
208,"Mack: ""S'cuse me, pardon me...""",Bears,2,1574628456,e11i4c
209,lol we lost six yards on those last two pass completions,Giants,5,1574628440,e11i4c
210,Lmao another hold not called,Bears,0,1574628427,e11i4c
211,Just drop the ball,Giants,3,1574628423,e11i4c
212,"Goddamn, Mack. Walked all over him lol.",Giants,4,1574628391,e11i4c
213,"so no Eli and they are on their third TE. you know that ELI+TE=elite, which the giants are not",NFL,3,1574628389,e11i4c
214,"Catch 22:  For anti-cigarette drugs to sell, you need cigarettes to sell",Giants,2,1574628372,e11i4c
215,Funny seeing a cold Turkey on that Chantix commercial. They chose an odd time to launch that campaign in November with Thanksgiving around the corner,Packers,3,1574628358,e11i4c
216,chantix lmao. just stop smoking. chantix sounds worse than cigarettes,Giants,5,1574628354,e11i4c
217,Big Nude Saturday,Bears,3,1574628345,e11i4c
218,bro how did that turkey use those coin op binoculars. do those things have a beak hole or something?,Giants,1,1574628325,e11i4c
219,"I think Pace is good and has good potential but he probably needs to be patient and value draft picks even moreso. Don't just plan for today but plan for tomorrow. 

Some people were confused when Ballard keeps trading down in the draft and sitting on $100 mil in cap. It's not fun but it's long term thinking.",Colts,1,1574628322,e11i4c
220,Do ***not*** underestimate our ability to fuck everything up.,Giants,2,1574628313,e11i4c
221,We're world beaters in garbage time,Giants,2,1574628308,e11i4c
222,We will find a way to fuck it up,Giants,3,1574628297,e11i4c
223,This thread is bipolar,Bears,2,1574628294,e11i4c
224,Agree,Giants,1,1574628278,e11i4c
225,Hate to see that.,Bears,2,1574628251,e11i4c
226,I can’t believe we’re throwing that great punt away,Bears,5,1574628248,e11i4c
227,There he is :'),Giants,2,1574628244,e11i4c
228,There we go Barkley!,Giants,2,1574628218,e11i4c
229,Wtf is the Bears defense doing lol,,7,1574628209,e11i4c
230,Giants do not care,Bears,4,1574628200,e11i4c
231,Defense on their way to choking the lead away. Happens everytime.,Bears,6,1574628198,e11i4c
232,We trash,Bears,2,1574628196,e11i4c
233,Interesting tackling.,Bears,4,1574628174,e11i4c
234,.... Are you watching the game? We don't have to tank lol,Giants,2,1574628172,e11i4c
235,I think any time someone asks people to send in videos of their children it sounds like that.,Packers,1,1574628102,e11i4c
236,  bruh what was that,Bears,4,1574628048,e11i4c
237,Giants should pretend like it's 5 mins left in the 4th qtr all game. This drive's been good so far!,Colts,5,1574627993,e11i4c
238,Generous spot.,Bears,2,1574627980,e11i4c
239,Bad spot,Bears,3,1574627978,e11i4c
240,Deion sounds like he smokes a cigar every 20 minutes,Giants,4,1574627961,e11i4c
241,He's doing better than a lot of us expected given our Oline and coaching.,Giants,4,1574627955,e11i4c
242,Yes. He is not the issue on this team,Giants,5,1574627931,e11i4c
243,I mean he needs more than like 9 games before we can evaluate him and he defintely needs to work on not fumbling but there's a lot of potential,Giants,3,1574627926,e11i4c
244,Every one of the women in that Air Force commercial was more intimidating than Blake Bortles,Packers,-2,1574627887,e11i4c
245,"While I dont disagree, I also believe he's a good coach away from being a decent starter in the league. Had he been developed by Andy Reid or Belichick instead of Nagy, I think he'd be much better than he is. If he does get that though, it will be on another team. I wouldn't be surprised if he pulls an Alex Smith like that.",Bears,1,1574627881,e11i4c
246,"I still think he has promise. The problem is coaching and general talent, in which we have Barkley and basically no one else.",Giants,5,1574627865,e11i4c
247,"I assumed because of course you'd go for it on fourth down there, but Nagy is a coward.",Bears,1,1574627858,e11i4c
248,"Ha, I’ve been there. Hope he works out for you guys.",Bears,1,1574627851,e11i4c
249,Off the backs of Beckham and a lockdown D that doesn’t exist anymore.,Giants,1,1574627846,e11i4c
250,"Inept Garrett Cowboys is up next, to get out coached by Bill. Lovely.",,1,1574627844,e11i4c
251,Patterson is so fucking valuable. He’s like Bellamy but he’s better.,Bears,8,1574627811,e11i4c
252,I think he can be. I wanna see him under a different HC tho,Giants,9,1574627803,e11i4c
253,"I know everyone has been hating on Pace for his drafting, but his Free Agent signings have been great, HAHA, Skrine, Patterson. Good group this year",Bears,9,1574627800,e11i4c
254,Patterson has been very good on special teams nice punt.,Bears,6,1574627797,e11i4c
255,"CP has been our best FA this off-season. By far the best STer on one of the worst ST units, and imo was a better RB than Davis.

That being said the Haha deal has been fantastic valur",Bears,8,1574627794,e11i4c
256,Nice fucking play,Bears,4,1574627784,e11i4c
257,"This is my dream. I want a young coach that’s willing to try new ideas, college coach maybe?",Giants,2,1574627783,e11i4c
258,Only if we can use Patterson,Bears,1,1574627781,e11i4c
259,Do the Giants really believe Daniel Jones is their guy?,Packers,4,1574627759,e11i4c
260,[deleted],,1,1574627758,e11i4c
261,"Run up the middle on 3rd and 10?

 Be you!",Packers,3,1574627754,e11i4c
262,Can this game just end already? I wanna watch some football.,Giants,5,1574627725,e11i4c
263,Fuck I'm old.,Packers,1,1574627723,e11i4c
264,nagy don’t go for it we are not that good,Bears,3,1574627722,e11i4c
265,Punting is winning,Bears,4,1574627708,e11i4c
266,[deleted],,1,1574627699,e11i4c
267,"The giants should honestly be considering tanking and a complete coaching reset after this year. Have been absolute garbage all day, have had one good drive",Vikings,3,1574627693,e11i4c
268,No way that was catchable,Bears,1,1574627679,e11i4c
269,Did Nagy really even think about going for it there? With that O?,,4,1574627674,e11i4c
270,"he's not getting fired mid-season. but unless we win way more games than we lose in the last five games (like, probably 4-1 at least) I want to say he's probably gone this offseason",Giants,3,1574627658,e11i4c
271,"&gt; you dont cover dirt area you cover men

Dumb as both of these commentators have been all day this is just about the most accurate summation of the giant’s defensive struggles this year i think I’ve heard.",Giants,5,1574627654,e11i4c
272,Yeah we will see how Jones progresses over the next few years. I think it's safe to say though Trubisky is trash,Giants,2,1574627644,e11i4c
273,[deleted],,0,1574627631,e11i4c
274,Yep. That's the worst part.,Giants,2,1574627608,e11i4c
275,I think this is posted at least once a game,Bears,2,1574627607,e11i4c
276,Sub out Shurmur for McAdoo and Saquon for Odell and it's been the same story for years now,Giants,5,1574627588,e11i4c
277,Why do we have a LB covering Robinson? And why is he 5 yards behind the 1st down line?,Giants,2,1574627570,e11i4c
278,And our best player Eli Manning is on the bench,Giants,6,1574627563,e11i4c
279,hey fun fact that song is *SIXTEEN* years old,Giants,2,1574627555,e11i4c
280,"Even Trubisky did that 300+ yard, 6 TD crap vs bad defenses last year. Daniel Jones doesn't look much different than Trubisky, and it will only get worse once teams adjust next year. Hope he works out for you though.",Bears,1,1574627536,e11i4c
281,Oh yeah.,Bears,2,1574627518,e11i4c
282,"Shurmur got out-coached by ""Let Madden Choose.""",Panthers,2,1574627517,e11i4c
283,"No, Ben McAdoo looks like your girlfriend's cop Dad.",Packers,1,1574627504,e11i4c
284,There's been like 9 missed XPs today,Packers,6,1574627503,e11i4c
285,"Rosen has gotten a couple though- not good ones, not fair ones, but I think there is enough to see that he has had more issues transitioning to the pro game than I thought he would.

I think he's still almost certainly better than Trubisky. But I don't know anymore than Rosen is eventually going to ""make it"" if given another chance.",Bears,3,1574627501,e11i4c
286,"I get what your saying and I want to agree but Barkley is cutting well both ways, jump cutting and doing spin moves. He just doesn't look hurt. Honestly I think its play calling",Giants,1,1574627499,e11i4c
287,Shurmur,Giants,2,1574627488,e11i4c
