,body,author_flair_text,score,created_utc,link_id
270,Singeltary with the 3D lateral pass strats. Allen wasnt into it.,Eagles,3,1574021409,dxphzb
271,what a buttery game we have here,Dolphins,3,1574021402,dxphzb
272,Great now I'm going to be nervous as hell with Singletary's carries,,1,1574021402,dxphzb
273,"Oh no, this doesn't look good. Our OL can't afford losses at this point.",Bills,1,1574021401,dxphzb
274,Id say a game worn jersey but he wore a child’s small and that wouldn’t fit their momma.,Bills,1,1574021391,dxphzb
275,What's strange is all season our fumbles roll right into opponents hands...balancing out now,,1,1574021383,dxphzb
276,"wow I like Singletary but he's got to hold the ball, he's gotten lucky a few times but damn",Bills,2,1574021356,dxphzb
277,2 fumbles for Singletary today for those calling for Dabol's head.,Bills,1,1574021355,dxphzb
278,"That's 2 for Singletary, not ideal",Bills,1,1574021342,dxphzb
279,These Bills fumbles are comedic as hell.,Dolphins,1,1574021329,dxphzb
280,Haha what a silly play.,Dolphins,1,1574021329,dxphzb
281,AFC West too,,1,1574021325,dxphzb
282,Wtf was that LOL,Bills,2,1574021324,dxphzb
283,"No bias here, were just bad at our jobs.",Dolphins,2,1574021274,dxphzb
284,"Yeah, roughing but not in a Bill-Fins game.",Dolphins,1,1574021237,dxphzb
285,"These dback injuries, my goodness ;(",Bills,2,1574021235,dxphzb
286,Well Raiders are gonna win thier game today.,Bills,1,1574021227,dxphzb
287,Which is challengeable. Holding is not.,Dolphins,2,1574021206,dxphzb
288,"I always figure its because its just too easy to not punish hard.

Like how its better to give up PI than a TD pass it would just straight up be better to hold than to let someone beat you on the way to your QB every time.",Dolphins,1,1574021205,dxphzb
289,"Nice pass, this kid’s good.",,1,1574021195,dxphzb
290,I could see Brady getting that call for sure.,Bills,5,1574021150,dxphzb
291,Fair enough,Dolphins,1,1574021144,dxphzb
292,AFC South...what a cluster fuck,Bills,1,1574021143,dxphzb
293,"I fully admit he’s made improvements this year.. I think he’s at 7% better than last year... was higher, but he’s had some bad accuracy games lately. I’m just saying he still has room to improve there. But fans aren’t allowed nuance, it’s either OMG HE’S PERFECT or OMG HE’S TRASH",Bills,1,1574021136,dxphzb
294,"If someone is getting paid that much, they shouldn't screw up so bad. The ball was clearly spotted wrongly and even announcers were like wtf? Least a bogus holding call was given as a make up call as the ref had cost the Bills a crucial stop in a tight game.

Know the rules about kickoffs and fumbles too there. Blatant hold not called and that fumble was textbook.",Bills,-2,1574021117,dxphzb
295,"Problem is if they move it down to 5 it's equal to 12 men or a false start.  I'm thinking 5 yards, loss of down maybe, but that might be a bad idea.",Bills,1,1574021097,dxphzb
296,and she has a Kiko Alonzo jersey,Bills,2,1574021095,dxphzb
297,yup - not taking the L this week lol,Bills,1,1574021091,dxphzb
298,do you believe the refs have been good?,Bills,1,1574021070,dxphzb
299,You literally just got a free first down....,,5,1574021067,dxphzb
300,"Not to say it was, but I'm curious, would that last hit on Fitz usually be called asroughing the passer?",Dolphins,5,1574021049,dxphzb
301,Lmao these refs,,3,1574021048,dxphzb
302,"Oh, your mom is from there?",Bills,3,1574021024,dxphzb
303,What a terrrrrible fucking call. Are you kidding me?,Dolphins,1,1574021023,dxphzb
304,[deleted],,1,1574020997,dxphzb
305,[removed],,1,1574020980,dxphzb
306,These refs must've visited the Bills tailgate section during halftime and got shitty drunk.,Bills,2,1574020969,dxphzb
307,Somebody needs a nap.,,0,1574020967,dxphzb
308,The level of the penalty for holding always seems out of proportion to me.,Bills,3,1574020950,dxphzb
309,Dog shit call. Buffalo blows,,-8,1574020950,dxphzb
310,What a bullshit penalty.,Dolphins,8,1574020932,dxphzb
311,Back to back bad calls against the Bills then Fins.,Bills,5,1574020932,dxphzb
312,Jesus what a terrible call,Dolphins,9,1574020928,dxphzb
313,Hold feels like a makeup call for the spot,Bills,9,1574020918,dxphzb
314,Maybe the hold was a makeup call for the ball spot,Bills,3,1574020899,dxphzb
315,"Terrible spot. Missed text book holding on a kick return td, missed blatant fumble that required a replay to correct and terrible spot. This ref for his first game is an inept blind piece of shit.",Bills,2,1574020896,dxphzb
316,That's not even close to a hold.,Dolphins,4,1574020894,dxphzb
317,It was a full yard short,Packers,1,1574020889,dxphzb
318,Make-up call for the 1st down marking?,Dolphins,7,1574020871,dxphzb
319,That was a make up call,Bills,5,1574020867,dxphzb
320,Man all the effort Fitz put into that run.,Eagles,8,1574020863,dxphzb
321,"Fitzmagic dangling that ball out there, daring somebody to knock it out of his hand.",,2,1574020858,dxphzb
322,That was caught a full yard short of the first down. Terrible spot,Packers,4,1574020855,dxphzb
323,Good yard and a half short,Bills,5,1574020848,dxphzb
324,"Not at all, but why is the ref who was 10 yards from the spot...running down the field to call the spot. If you look where he was when it was caught there is no way he could mark that correctly",,1,1574020846,dxphzb
325,That's no hold.,Bills,3,1574020841,dxphzb
326,Well that was a gift.,Bills,3,1574020837,dxphzb
327,Wtf he was way behind the line,Bills,3,1574020835,dxphzb
328,Bs spot,Bills,3,1574020816,dxphzb
329,Bad spot but good for not challenging it. Not worth the risk imo,Bills,3,1574020781,dxphzb
330,Man no way did we have that first down.,Dolphins,8,1574020762,dxphzb
331,wtf he was at least a yard short,Bills,5,1574020759,dxphzb
332,"Why would the fins extend hurns ? Its a total rebuild, why just hand out money?",Bills,1,1574020749,dxphzb
333,1 point safety,Bills,2,1574020739,dxphzb
334,Hurns almost caught and dropped it,Bills,1,1574020736,dxphzb
335,Tough drop,Bills,1,1574020715,dxphzb
336,Did Arch smoke a fat blunt during the half or something? He looked blitzed.,,1,1574020657,dxphzb
337,yes it was,Bills,1,1574020547,dxphzb
338,It didn’t even hit the ground in the field of play though? Mckenzie catches that ball and stops the clock if that ball is maybe two inches closer to him or a better receiver is there instead of him. I like Mckenzie as a Swiss Army knife player but not as much as a straight up receiver.,Bills,1,1574020542,dxphzb
339,Time for 3rd quarter Bills. Expecting the Dolphins to have the lead by the 4th.,Bills,1,1574020542,dxphzb
340,Lamar sold his soul...only explanation.,Bills,1,1574020492,dxphzb
341,If a ball is caught that makes it a catchable pass? Or am I drunk?,Bills,1,1574020469,dxphzb
342,"Well, every Bills fan wanted a 30 point game. Here we go.",Bills,1,1574020441,dxphzb
343,Good special teams play,Bills,2,1574020429,dxphzb
344,"Bills gonna Bills. Dolphins gonna Dolphins. *shrug, drink, repeat*",Bills,1,1574020327,dxphzb
345,Why has allen thrown 21 passes in a half ?! He could throw that many all game. Pound the fucking ball dabol!,Bills,2,1574020276,dxphzb
346,Mckenzie sucks. Allens inaccurate. But this team desperately needs a wr that can catch. Where the hell duke williams,Bills,2,1574020237,dxphzb
347,Returned 2 point conversation,Bills,1,1574020194,dxphzb
348,Being real what could happen in this game that would surprise you at this point?,Dolphins,1,1574020131,dxphzb
349,Imagine if the Dolphins didn't get that onside. Could be 30-14.,,1,1574020123,dxphzb
350,"The dirt? Nowhere near him. Y’all blind Allen defenders are wild. You somehow think you see something that literally everyone else in the league, every commentator, talking head, and anyone that pays attention doesn’t see.",Bills,0,1574020090,dxphzb
351,Yeah the whole visiting side of the stadium is 80% blue,,1,1574020079,dxphzb
352,What are the odds on blocked punts? We had 1 of those this year that potentially cost us a game.,Bills,2,1574020046,dxphzb
353,"A dude actually said to me earlier that Allen isn’t inaccurate. They like to bring up dropped passes as if two per game forgive it, without mentioning the caught balls that also aren’t good passes. Cuts both ways, but not as they see it.",Bills,1,1574019980,dxphzb
354,"It's crazy how low percentage an onside kick and kick return TD are but we've had both in 1 half.

I hope they work on special teams I feel they haven't been very good all year long.",Bills,6,1574019974,dxphzb
355,[deleted],,2,1574019974,dxphzb
356,Not really into watching dudes dancing in the shower...,Bills,1,1574019915,dxphzb
357,No. Just no. He could have thrown it a yard closer and Neeham still would have been six feet off of him like he was.,Bills,0,1574019890,dxphzb
358,He gave him a great chance. He put the ball the only place he could,Bills,1,1574019848,dxphzb
359,He did it!,,1,1574019838,dxphzb
360,Ah yes the New Jersey Giants,Dolphins,2,1574019837,dxphzb
361,"That beard inside the helmet, looking objectively silly.

That said, he should be playing for the Vikings with that beauty!",Chiefs,1,1574019827,dxphzb
362,Come on refs! That should be 2 min for tripping. Blatant missed call on the sack.,Bills,2,1574019824,dxphzb
363,Allen didn’t even give him a chance to drop it two straight times.,Bills,1,1574019816,dxphzb
364,That would entail we run the ball. Would much rather throw inaccurate balls 30 yards down the field to mckenzie who cant catch.,Bills,2,1574019801,dxphzb
365,The one to Mckenzie was really the only place he could put it. Mckenzie has a shot at it and needham didn’t.,Bills,4,1574019794,dxphzb
366,Its the refs first game and he can't get a textbook fumble call (took more than 3 steps) correct without the assistance of replay. Both teams in for a long day with the ineptitude of NFL officiating.,Bills,2,1574019779,dxphzb
367,I love Fitz...his embarrassed look after that sack was adorable.,Bills,3,1574019767,dxphzb
368,I know I’m late but that Jakeem Grant kick return was amazing,Dolphins,2,1574019757,dxphzb
369,I get downvoted every time in our sub because I still have issues with Allen’s accuracy,Bills,1,1574019752,dxphzb
370,Watch as we don't show the highlight.,Bills,2,1574019749,dxphzb
371,C’mon D. 47s. Hold &amp; half time adjustments. Let’s do this.,Bills,1,1574019747,dxphzb
372,Why throw it to McKenzie at all. His massive 5 yard performance last time you played the Fins?,Bills,2,1574019744,dxphzb
373,Lets keep going to mckenzie he hasnt dropped enough balls,Bills,3,1574019723,dxphzb
374,"Downvoted for saying the same thing. It was right when he cut upfield, was a obvious one too",,-1,1574019640,dxphzb
375,Bills felt like it was getting too easy so they decided to miss every tackle on the kick-off to let the Dolphins back in.,Giants,2,1574019628,dxphzb
376,Hauschka was like “fuck this”,Dolphins,5,1574019627,dxphzb
377,"That pass was like three yards too high. At least let your receivers try to catch it.

*edit: and then he dirts it two yards away from his receiver. This shit is frustrating every week.",Bills,2,1574019610,dxphzb
378,I suspect that we are not talking about the same thing.,Bills,1,1574019606,dxphzb
379,Factual statement,Dolphins,2,1574019604,dxphzb
380,"&gt;If Buffalo wants to play this conservatively 

Buffalo will.",Bills,2,1574019591,dxphzb
381,"You're not wrong, but it also doesn't make the giants play in NY.",Bills,5,1574019591,dxphzb
382,This game is bonkers,Bills,2,1574019584,dxphzb
383,Nice,Bills,1,1574019570,dxphzb
384,"memes, the tank, fitzmagic, ridiculous yolo plays

i am digging this, i had no idea this rebuild could also be fun",Dolphins,1,1574019561,dxphzb
385,Big missed holding call on the return.,Bills,5,1574019561,dxphzb
386,"Be Fearless

Trust the Process

pass the kool-aid",Bills,2,1574019560,dxphzb
387,your cake day is cancelled,Bills,1,1574019540,dxphzb
388,Well Josh. Let’s do it again.,Bills,2,1574019539,dxphzb
389,Yup.,Bills,1,1574019538,dxphzb
390,"seriously though, I need to keep this attitude when we get competitive",Dolphins,2,1574019526,dxphzb
391,Woohoo! Lovely return,Dolphins,3,1574019521,dxphzb
392,"to be fair, we were quite alright in the first game as well and you have a great defense",Dolphins,4,1574019516,dxphzb
393,We need duke. We need a wr besides brown who can catch. McKenzie and foster arent reliable.,Bills,1,1574019512,dxphzb
394,That was one of the prettiest KR TDs I've ever seen,Steelers,7,1574019504,dxphzb
395,"I walked away from the for just a minute, what the hell happened to the score?",Bills,3,1574019502,dxphzb
396,Haha Bills should be up 30,Dolphins,3,1574019492,dxphzb
397,[removed],,1,1574019488,dxphzb
398,this game is so fucked up I wouldn't doubt the Bills put more points up.,Bills,2,1574019481,dxphzb
399,Bills special teams continue to be terrible. It's been bad for a few years now.,Bills,3,1574019475,dxphzb
400,If you have no expectations the Dolphins are much more fun to watch.,,2,1574019474,dxphzb
401,"Bills are not going to make the playoffs - they just keep letting their opponents stay in the game, making the same stupid mistakes over and over and over again. It's maddening to watch them with hope yet they just keep trying to snatch defeat from the jaws of victory every. single. time.",Giants,3,1574019469,dxphzb
402,Holy shit that man fast,Patriots,5,1574019465,dxphzb
403,"M I A M I

H A S 

T H E

D O L P H I N S",Dolphins,4,1574019456,dxphzb
404,Ya I agree y'all fucking garbage.,Dolphins,6,1574019452,dxphzb
405,"I can, that was amazing",Bills,1,1574019452,dxphzb
406,When you no longer need a top-5 pick to draft Tua,Eagles,3,1574019446,dxphzb
407,We dont deserve nice things.,Bills,3,1574019438,dxphzb
408,Yet they are!!,Dolphins,7,1574019432,dxphzb
409,Makes you appreciate Bobby April,Bills,1,1574019430,dxphzb
410,Why are we making the dolphins look like an NFL team,Bills,7,1574019426,dxphzb
411,Haushka shoulda went for the knees and not be a pissy,Bills,4,1574019413,dxphzb
412,He fast.... he make fast people look not so fast.,Seahawks,6,1574019412,dxphzb
413,[removed],,1,1574019402,dxphzb
414,This is easily my favorite season in a decade. Such a ridiculous team,Dolphins,3,1574019402,dxphzb
415,This shit fuckimg team shouldnt be in this game.,Bills,-1,1574019396,dxphzb
416,this game is fun,Dolphins,5,1574019393,dxphzb
417,WHAT THE FUCK IS THIS GAME,Bills,7,1574019387,dxphzb
418,WTF IS HAPPENING IN THIS GAME!?,Dolphins,8,1574019386,dxphzb
419,Jesus christ our special teams unit is trash,Bills,5,1574019385,dxphzb
420,Well.  I cant say I enjoyed that.,Bills,4,1574019382,dxphzb
421,Great for grant,Bills,2,1574019373,dxphzb
422,Our special teams is such dog shit.,Bills,6,1574019366,dxphzb
423,"ok well fuck our special teams. Missed kicks, blocked punts, 101 kickoff returns..wtf Fire Heath Farwell",Bills,4,1574019364,dxphzb
424,Buffalo. Gotta. Buffalo.,Bills,5,1574019359,dxphzb
425,WHAT IS HAPPENING,Bills,2,1574019358,dxphzb
426,Fucking craziness.,Bills,3,1574019349,dxphzb
427,They missed an absolute massive hold on that play right when he changed direction,,0,1574019347,dxphzb
428,This game...,Eagles,3,1574019344,dxphzb
429,Hauschka what the fuck,Bills,5,1574019343,dxphzb
430,"Block in the back but ok

Edit: Yea downvote when there was clearly a block in the back in the replay. Dumbfuck",Bills,-2,1574019342,dxphzb
431,So our ST has fallen apart this game...,Bills,4,1574019331,dxphzb
432,"Oh, wtf! So many missed tackles on that.",Bills,3,1574019327,dxphzb
433,Miami refuses to go away lmao someone give the special teams coach a raise,Bills,2,1574019318,dxphzb
434,Well so much for fucking that.,Bills,4,1574019314,dxphzb
435,Bills fans looking for a flag...,,4,1574019314,dxphzb
436,What the actual fuck,Bills,5,1574019298,dxphzb
437,What the fuck,Bills,4,1574019298,dxphzb
438,We want Duke! We want Duke!,Bills,2,1574019298,dxphzb
439,Wow.,Bills,3,1574019297,dxphzb
440,"He might still be banged up, dunno",Bills,1,1574019294,dxphzb
441,Well phooey.,Bills,5,1574019293,dxphzb
442,"wow, imagine Bills didn't get that fumble? Could have been 14-16 instead of 23-7

and I love Allen with the Dirty Dancing move.",Bills,5,1574019286,dxphzb
443,JuggerKnox baby,,3,1574019285,dxphzb
444,Wheres duke williams ?,Bills,1,1574019268,dxphzb
445,Way to respond!!,Bills,4,1574019227,dxphzb
446,KnoXXX,Bills,6,1574019225,dxphzb
447,Mckenzie cant catch a cold where is duke williams ?,Bills,3,1574019221,dxphzb
448,Nice!!,Bills,1,1574019213,dxphzb
449,I thought he was gonna be down for sure!,Bills,1,1574019203,dxphzb
450,"Dolphins don’t really play at home, it’s usually 50/50 crowds, especially when we play the Pats, the Jets, Buffalo, Steelers...",,1,1574019188,dxphzb
451,Best John Brown since the one who liberated the slave owners from life,Chiefs,3,1574019184,dxphzb
452,Now that’s what I’m fucking talking about,Bills,3,1574019182,dxphzb
453,God bless Knox stiffarms,Bills,3,1574019181,dxphzb
454,Excelllllennnnntt,Bills,1,1574019169,dxphzb
455,Bills really need more wr help next off season,Bills,3,1574019145,dxphzb
456,"McKenzie, make that catch. Allen, hit him in the fucking numbers.",Bills,1,1574019140,dxphzb
457,"He's been earning it all season, he's been an absolute stud.  I love our WR corps, we just need a #1/2 WR to match up with Brown and Beasley and I think this group is gonna be crazy good.",Bills,4,1574019110,dxphzb
458,Yea. Saw him playing Pokémon on the sidelines earlier.,Bills,2,1574019103,dxphzb
459,[removed],,1,1574019078,dxphzb
460,These last 3 mins or so have been a huge fuckin roller coaster,Bills,4,1574019046,dxphzb
461,Believe so,Bills,2,1574019020,dxphzb
462,I love John Brown.,Bills,6,1574019001,dxphzb
463,Damn John Brown is certainly earning his salary this game. Thank god he recovered that.,Bills,8,1574019001,dxphzb
464,John Brown is such a gamer,Bills,6,1574018985,dxphzb
465,Is that his 1st fumble of the year?,Bills,3,1574018984,dxphzb
466,We got lucky advancing a fumble again.,Bills,2,1574018976,dxphzb
467,"Instead of keeping it for two yards and taking a hit, Singletary had space on the sideline and he used him for an obvious pumpfake.",Bills,2,1574018963,dxphzb
468,"Christ, my heart",Bills,7,1574018947,dxphzb
469,Lol no shit we'd love to have Minkah with that production,Dolphins,2,1574018941,dxphzb
470,"The Beas has one or two, but Josh staring down guys a little.",Bills,1,1574018940,dxphzb
471,[Oh no!](https://i.imgur.com/7txeidA.gifv),Dolphins,2,1574018886,dxphzb
472,Allen for the love of god throw it to your RBs. They are good at running,Bills,7,1574018873,dxphzb
473,I don't get why receivers wear those baggy sleeves that Hurns has on - tried it a few times back in high school and they make it so much harder to secure the ball,Dolphins,2,1574018864,dxphzb
474,Happy cake day!,Bills,3,1574018860,dxphzb
475,Hurns earning that extension,Dolphins,2,1574018859,dxphzb
476,"Imagine having consistent rule enforcement, def couldn’t be the nfl. I am not saying I do not think it was a catch, i am saying based on how they have been calling reviews it is not possible to say you are certain he had control of the ball before he lost it.",Dolphins,0,1574018858,dxphzb
477,"Jesus, we can't have anything nice this year can we?",Dolphins,1,1574018858,dxphzb
478,"I mean the stadium is half Bills fans, so probably not",Bills,2,1574018858,dxphzb
479,That was exactly my line of thinking. Still shocked they called it that way,Bills,2,1574018825,dxphzb
480,Run the ball you fat idiot ! Jesus christ,Bills,1,1574018821,dxphzb
481,Did you hear that ovation when Buffalo won the challenge? They’re playing in Miami. Table slam fam is all over the place!,Patriots,6,1574018820,dxphzb
482,Eh Dolphins...stop getting hurt ok,Bills,4,1574018801,dxphzb
483,So many hurt phins... Stay healthy folks,Bills,6,1574018797,dxphzb
484,That's the right call but I'm shocked it was over turned.,Bills,4,1574018789,dxphzb
485,Good call. Ref isn't corrupt.,Bills,4,1574018788,dxphzb
486,"Josh, that pass was still behind Brown. Put it on his numbers or at his hands when he has the middle. It’s not asking too much.",Bills,4,1574018786,dxphzb
487,"Wow, that stadium really hates that correct call.",Bills,3,1574018777,dxphzb
488,There we go,Bills,3,1574018777,dxphzb
489,Ehhhhh the refs called it right,Bills,2,1574018772,dxphzb
490,"Super obvious, sucks to see.",Dolphins,2,1574018767,dxphzb
491,John Brown is literally our only receiver. I have not even seen anyone else get open all game.,Bills,4,1574018766,dxphzb
492,Wow Miami had the momentum,Bills,2,1574018758,dxphzb
493,Holy shit we won a challenge!,Bills,2,1574018757,dxphzb
494,I assume this will be ruled a catch and fumble.,Dolphins,1,1574018756,dxphzb
495,We need td’s,Bills,1,1574018754,dxphzb
496,Wow they did overturn it. Good shit.,Eagles,1,1574018747,dxphzb
497,Did someone say cake,Dolphins,2,1574018745,dxphzb
498,"If that's not Bills ball, ref should never officiate again. Its his first game and that's textbook fumble. No excuse to screw that up.",Bills,0,1574018731,dxphzb
499,That onside kick for nothing,Eagles,6,1574018729,dxphzb
500,"Wow, the right call was actually made in the end. That's rare.",Bills,9,1574018725,dxphzb
501,"I'm shocked that we got that. 

Not that it wasn't a fumble, but I just have no idea how this works anymore.",Bills,5,1574018723,dxphzb
502,I think it's going to be confirmed and the refs are going to inadvertently create a new NFL rule here.,Bills,3,1574018707,dxphzb
503,so bad,,1,1574018697,dxphzb
504,If he caught the ball like that and took those steps before going out of bound it would 100% be ruled a catch. Thats a catch and fumble,Bills,5,1574018689,dxphzb
505,The key factor to me is he turned upfield but who knows,Bills,2,1574018686,dxphzb
506,Let’s fucking go,Bills,2,1574018684,dxphzb
507,Thats a fumble but I wouldn't be surprised if the call is confirmed,Bills,6,1574018655,dxphzb
508,"That was clearly a fumble in my mind, but close enough that they'll probably let it stand. Still a good challenge.",Bills,4,1574018638,dxphzb
509,"If that was a catch, why did he drop it? Eh? Yeah.",,-2,1574018634,dxphzb
510,"Like...I feel like it's a fumble, but I'm not confident enough in that feeling to be mad if it's not called one",Bills,3,1574018618,dxphzb
511,"Bullshit, it was catch, he was running with it for 5 seconds.",Bills,5,1574018597,dxphzb
512,Looks like a catch and fumble to me.,Seahawks,6,1574018595,dxphzb
513,Pat Macafee had one,Bills,5,1574018587,dxphzb
514,"I think that was a catch, but not sure they will over turn it, because it’s debatable if pinning the ball to your body is a “catch” sometimes, and the refs don’t like to overturn themselves.",Bills,3,1574018585,dxphzb
515,"If this is not a catch and fumble, I don't know what is.  He legitimately carried the ball for a few steps.  The ball stayed still until he fumbled.",Bills,9,1574018584,dxphzb
516,Pats have done it multiple time,Bills,3,1574018579,dxphzb
517,Terrible call by the refs. Ball should be to the Bills.,Bills,8,1574018578,dxphzb
518,What are you crying about?  Lmao imagine being down and acting victorious,Bills,2,1574018568,dxphzb
519,That's a fumble,Eagles,7,1574018564,dxphzb
520,"That looks like a fumble, but not going to be shocked if the call stands.",Bills,7,1574018563,dxphzb
521,That's Dolphins football right there,Dolphins,-1,1574018555,dxphzb
522,That's absolutely a fumble; he was holding it in his arm and took like 4 steps before the ball popping out,Giants,15,1574018552,dxphzb
523,I didn't know the kicker could pick up the ball after the onside kick.,Bills,3,1574018549,dxphzb
524,Of fuckin course,Dolphins,3,1574018548,dxphzb
525,That's a fumble for sure. He's got control of that.,Bills,6,1574018547,dxphzb
526,"lol that's like 5 steps with the ball, easy fumble.",Dolphins,8,1574018544,dxphzb
527,Making 2 different calls these refs looking like replacements,Bills,4,1574018539,dxphzb
528,Team's with nothing to lose get to do some fun stuff.,Bills,4,1574018538,dxphzb
529,Fumble,Eagles,3,1574018533,dxphzb
530,Coach of the year Brian Flores,Patriots,2,1574018532,dxphzb
531,That's a fumble,Bills,4,1574018527,dxphzb
532,17-16 just like the jets game,Bills,1,1574018527,dxphzb
533,That looked like a catch but hey,Eagles,2,1574018514,dxphzb
534,That's a catch and a fumble lol,Bills,6,1574018507,dxphzb
535,Control doesn't have to be 2 hands and having the ball cradled.,Bills,6,1574018504,dxphzb
536,Bill's you guys had people in our sub talking shit and downvoting just 10mins ago...  this is what you get,,-6,1574018494,dxphzb
537,That's absolutely a catch,,8,1574018477,dxphzb
538,Why did we stop blitzing?,Bills,3,1574018475,dxphzb
539,Challenge that.  He took like 5 steps!,Bills,4,1574018472,dxphzb
540,Challenge that,Bills,3,1574018465,dxphzb
541,that's a fumble,Bills,1,1574018464,dxphzb
542,"Wow, perfectly executed!",Dolphins,2,1574018454,dxphzb
543,I think he had it.,Bills,3,1574018454,dxphzb
544,We can't lose to this abortion of a team cmon,Bills,-1,1574018453,dxphzb
545,Respect to Flores for those big ol nuts,Bills,6,1574018451,dxphzb
546,Why you drop ball?,,1,1574018439,dxphzb
547,LMAO,Dolphins,2,1574018429,dxphzb
548,"Oh hey, we’re Billsing. 

RAZOR CAKE TIME",Bills,6,1574018403,dxphzb
549,Motherfuck,Bills,2,1574018385,dxphzb
550,Not gettin' shutout today!,Dolphins,3,1574018384,dxphzb
551,"WTF Onsides are like 1 out of 100 now...

guess this makes up for last game with the Phins",Bills,6,1574018378,dxphzb
552,Dolphins welcome to the onside recovery club,Bears,5,1574018376,dxphzb
553,Guess the real Bills were late to the stadium today.,Bills,2,1574018371,dxphzb
554,Buffalo gotta Buffalo.,Bills,2,1574018361,dxphzb
555,"At least it's no longer embarrassing, let's see if we can build on this momentum.",Dolphins,2,1574018361,dxphzb
556,Do they think it’s the 4th quarter?,,1,1574018357,dxphzb
557,"Oh sweet Jesus, a successful onside",Bills,4,1574018352,dxphzb
558,"""new game"" lmao ok",Bills,-1,1574018351,dxphzb
