,body,author_flair_text,score,created_utc,link_id
0,"Yeah I don't stress too much about it. At the end of the day for me, it's just part of the entertainment to hate right? I just don't get the satisfaction in mocking things like that",Saints,1,1573832221,duedcw
1,"Damn idk why it took so long for me to get this reply lol but I appreciate you doing that. Every fan base has those guys that are incapable of human decency, and if public shaming doesn’t make them realize that their actions are incompatible with social standards then maybe it’ll at least make them reconsider commenting.",Falcons,1,1573828653,duedcw
2,"UH OH! Someone has been using stinky language and u/dumbestbell decided to check u/dumbestbell's bad word usage.


I have gone back one thousand posts and comments and reviewed their potty language usage.

 ^NOTE: ^Using ^me ^under ^the ^same ^comment
 ^or ^parent ^will ^cause ^me ^to ^be ^ratelimited, ^please ^be ^gentle.

|Bad Word|Times Used|
:--|:-:|
|ass|13
|asshole|1
|butt|1
|damn|3
|dick|2
|fucking|1
|fuck|15
|fuck off|1
|porn|4
|sexy|1
|shit|10
|shut the fuck up|1
|sex|3",,1,1573576180,duedcw
3,u/profanitycounter,Falcons,1,1573576145,duedcw
4,I’d rather have a champion than a winner,Saints,1,1573539191,duedcw
5,Luckily we have a bona fide winner ready...,Saints,1,1573538000,duedcw
6,What? We wanted you to lose bro.,Falcons,1,1573449697,duedcw
7,That’s a fake picture by the way,Falcons,1,1573449625,duedcw
8,We can usually score our defense just couldn’t stop anyone until today. Dumb comment bro,Falcons,1,1573449515,duedcw
9,[deleted],,1,1573445185,duedcw
10,He can't handle as certain * caused by the Saint's beloved Dcord Gregg Williams.,NFC,2,1573444417,duedcw
11,oh.,49ers,1,1573429692,duedcw
12,It’s an Office reference,Broncos,2,1573428014,duedcw
13,"ha, yeah i've got 3 kids... i guess i involintarily put my dick in my wife.",Saints,1,1573427045,duedcw
14,Hey you came back. Wow,Saints,0,1573426707,duedcw
15,Thank you Atlanta Bro!,,1,1573426345,duedcw
16,[deleted],,1,1573426020,duedcw
17,[deleted],,1,1573425940,duedcw
18,That comeback though.,Falcons,1,1573425697,duedcw
19,Waited nearly an hour after the comment for that zinger. Enjoy that L bruh.,Falcons,1,1573425660,duedcw
20,[deleted],,1,1573425301,duedcw
21,🤷🏾‍♀️,Falcons,1,1573423648,duedcw
22,😂,Falcons,1,1573423600,duedcw
23,Holy fuck,Panthers,2,1573423486,duedcw
24,[removed],,1,1573423333,duedcw
25,Yeah the Goku was a terrible decision 😑,Eagles,1,1573422988,duedcw
26,You mean like the Rams?,,0,1573422583,duedcw
27,You're the incel who has been salty all throughout the thread lol,Falcons,1,1573422151,duedcw
28,[deleted],,1,1573422070,duedcw
29,"You just said the Saints were ""exposed"" and I asked a very clear question about it, nothing more",,0,1573421986,duedcw
30,[deleted],,1,1573421848,duedcw
31,"Why do fans call every team's loss ""expised"" lol",,0,1573421700,duedcw
32,[deleted],,0,1573421528,duedcw
33,"Yep. And while it sucks, I'd rather lose this than to someone who we are trying to fight for the #1 seed",Saints,1,1573421493,duedcw
34,"Saints didn't really play like the Saints. Barely utilized Kamara. Kinda expect less touches just returning from injury tho. But, less screens, less Taysom &amp; idk if im trippin, but I barely saw Rankins on the field. Marcus gave em another chance to win. Oh well. Still 7-2 they gotta figure that shit out and come back swinging next week. Good game dirty birds.

And those damn penalties jesus christ.",,2,1573421413,duedcw
35,"DAMN. I wish I liked playing that game, not a fan of the MvC style fighters.   


Also lol at them having GT Kid Goku as DLC. Gross",Saints,2,1573421244,duedcw
36,It's been a long time,Falcons,1,1573421192,duedcw
37,We've beat all those teams already? Lmao the stupidity.,Saints,1,1573421152,duedcw
38,Haven't watched full games but from scores I've seen y'all are close a lot of times. Too much talent on offense to go 2-14.,Saints,1,1573421146,duedcw
39,"For sure, DIGGS, Marcus Williams wiffed.  it happens.... but what doesnt happen is 28-3.",Saints,1,1573421142,duedcw
40,I genuinely have no idea what our line was doing.,Saints,1,1573421138,duedcw
41,I feel ya,Rams,1,1573421110,duedcw
42,GG failclowns,Saints,3,1573421080,duedcw
43,Fuck you too you swamp monster. Looking forward to another crazy one over thanksgiving,Falcons,6,1573421074,duedcw
44,Falcons will be watching from the couch tho,Packers,4,1573421051,duedcw
45,Yeah with one less loss. You didn’t get the point I was making. It’s one game guy.,,1,1573421008,duedcw
46,"Yeah same here, what song was that?",,1,1573421003,duedcw
47,Seems like it's always a trap game,Packers,2,1573420984,duedcw
48,"Oh boy, the brigade is out. Link works for me.

""dis guy's making fun of us. wah wah wah."" Bunch of losers.",Eagles,0,1573420951,duedcw
49,I just figured the Saints were all hungover after celebrating the LSU win.,Packers,3,1573420941,duedcw
50,"https://youtu.be/g70W6D4l6H8

It's fucking INSANE",Eagles,1,1573420912,duedcw
51,"If this was the only game of ours you watched all year, I'd believe that too. But trust me, outside of today, we straight ass.",Falcons,1,1573420772,duedcw
52,Sorry idk the name lol Darude Sandstorm is just an old internet joke for anytime someone asks “what song was that?”,Cowboys,1,1573420768,duedcw
53,"Lol New Orleans lost to the falcons, imagine",Falcons,2,1573420711,duedcw
54,"It kinda does, thanks man",Panthers,1,1573420696,duedcw
55,"Anytime man. When it comes down to, it we all love the game. 

I mean... I mean.... urgh screw you guys rabble rabble rabble. Haha",Falcons,1,1573420633,duedcw
56, Lol there is no way y'all lose out,Saints,1,1573420618,duedcw
57,Lol check again to what you linked dumbass,Saints,1,1573420610,duedcw
58,Your house or mine?,Falcons,1,1573420604,duedcw
59,"You too, y'all are still a legitimate playoff team and I'm sure you'll have a shot at the SB.",Falcons,1,1573420598,duedcw
60,"Nah, you still gotta beat the Saints one more time.",Panthers,1,1573420592,duedcw
61,[deleted],,3,1573420563,duedcw
62,Just an absolutely pathetic display.,Saints,4,1573420554,duedcw
63,"My bad. You're right, I fixed it.",Packers,1,1573420547,duedcw
64,Gg,Saints,2,1573420547,duedcw
65,[She's a popular Atlanta lingerie model.](https://i.imgur.com/Ie0gj0w.jpg),Saints,1,1573420543,duedcw
66,way before that buddy,Saints,-1,1573420485,duedcw
67,My dude I was talking about the pick. Way to bring something irrelevant up,Saints,1,1573420467,duedcw
68,"Yeah, you guys clearly gave up halfway through the 2nd quarter",Falcons,24,1573420459,duedcw
69,I love that we ended Brees TD in the dome streak!,Falcons,9,1573420431,duedcw
70,"Sloppy play in secondary , really bad oline play, overall the team played like crap and Atlanta played out of their minds.  Especially on defense",Saints,5,1573420430,duedcw
71,subscribe,49ers,2,1573420424,duedcw
72,lmao falcons fans expecting us to give up like it’s the third quarter of a superbowl,Saints,-11,1573420421,duedcw
73,He'll do it in the playoffs.,Saints,0,1573420417,duedcw
74,[deleted],,4,1573420409,duedcw
75,[removed],,1,1573420405,duedcw
76,No one does it better than Brees.,Falcons,4,1573420395,duedcw
77,"GG Falcons. This is why I always dread playing y'all over any other team. It helps keep the rivalry exciting because it's truly ""any given Sunday."" I hate y'all, but I wouldn't want any other rival. But fuck you too.",Saints,24,1573420392,duedcw
78,"Someone forgot to do the voodoo before game. 

Honestly, you guys came to win. GG",Saints,2,1573420387,duedcw
79,I'm losing my FF game to a dude missing 4 players. Eff my life.,Saints,5,1573420379,duedcw
80,I honestly dont even remember the last time we did that. Maybe 10 years?,Falcons,3,1573420375,duedcw
81,"So losing nearly every game except one is a success to you? Damn, must feel bad to take such joy in being a fan of a garbage team.",Saints,1,1573420370,duedcw
82,It’s almost as funny as another 20 something score joke..,Saints,-2,1573420365,duedcw
83,Not that one. The hip hop song.,Falcons,2,1573420358,duedcw
84,Absolutely bossed those Taints! Fantastic game lads.,Falcons,4,1573420351,duedcw
85,"I didn't see it, they're adding DBS version Broly in?",Saints,2,1573420334,duedcw
86,Happy Veterans Day,Saints,4,1573420333,duedcw
87,Kick the field goal,Falcons,1,1573420333,duedcw
88,lol they got their yards atleast I guess,Falcons,2,1573420330,duedcw
89,Those were the hardest earned garbage time stats ever wow,Saints,8,1573420330,duedcw
90,falcons fans: there is nothing wrong with trying to put points on the board. i know it seems strange but it worked for yall this game. keep trying it.,Saints,-4,1573420328,duedcw
91,Falcons scored more points,Saints,9,1573420325,duedcw
92,We’ve played so insanely badly this season. It’s literally insane how bad we’ve looked. Coaching has been horrendous.,Falcons,1,1573420324,duedcw
93,[removed],,1,1573420324,duedcw
94,Stat padding at its best 🙄,Vikings,4,1573420323,duedcw
95,Risking Michael Thomas on a nothing play. Serious levels of stupidity,,8,1573420319,duedcw
96,I love that he's short by half a yard on a pointless stat padding drive,,11,1573420317,duedcw
97,I... Wuh... Uh think you need to check what you were linking lol,Saints,2,1573420317,duedcw
98,[deleted],,10,1573420315,duedcw
99,What a shitshow,Packers,1,1573420312,duedcw
100,Took a butt instead of a knee,Falcons,6,1573420309,duedcw
101,One last flag,Falcons,3,1573420305,duedcw
102,Well that sucks,Saints,3,1573420305,duedcw
103,Winnie from the Wonder Years?,Falcons,1,1573420303,duedcw
104,FUCK YEAH YOU DONT GET A TOUCHDOWN,Falcons,12,1573420302,duedcw
105,Wow what happened to the saints today,Patriots,6,1573420300,duedcw
106,Hey man if Jamies Winston can still be the starter for Tampa Bay then anything can happen,Saints,2,1573420299,duedcw
107,Thanks Southern brother.,Saints,2,1573420296,duedcw
108,good job we got michael thomas injured in garbage time,Saints,3,1573420296,duedcw
109,The call on the field is go the fuck home,49ers,6,1573420293,duedcw
110,Congrats bird boys. Can’t wait to meet again in a few weeks!,Saints,1,1573420292,duedcw
111,26-9..lol,Falcons,3,1573420286,duedcw
112,a microcosm of todays game,Saints,1,1573420284,duedcw
113,I never thought I’d say this but thank you Atlanta!,Panthers,2,1573420277,duedcw
114,"I'm a saints fan

I hope Brees throws a pick 6",,2,1573420268,duedcw
115,A delay of game with 2 seconds left in a 3 score game,Bengals,2,1573420267,duedcw
116,Take a knee,Saints,2,1573420267,duedcw
117,"Lol they're so fucking petty what a bunch of bitches, just end the game",Falcons,2,1573420261,duedcw
118,Take a knee cowards,Falcons,4,1573420246,duedcw
119,WTF you lost just take a knee.,Falcons,1,1573420246,duedcw
120,Try to drag this game out more,Rams,-1,1573420238,duedcw
121,DQ call a timeout lmao,Falcons,4,1573420237,duedcw
122,Not just one pointless play. Three. Goddamn get them off the field!,Eagles,3,1573420234,duedcw
123,"Yeah. Freeman looked really good. And that Hooper catch was great. 

See you guys in a couple weeks. Hope we can make a better play.",Saints,1,1573420234,duedcw
124,https://www.pro-football-reference.com/play-index/team_streak_finder.cgi?request=1&amp;streak_type=games&amp;year_min=1970&amp;year_max=2019&amp;game_type=R&amp;game_num_min=0&amp;game_num_max=99&amp;week_num_min=0&amp;week_num_max=99&amp;streak_event=all_td_opp&amp;streak_event_gtlt=gt&amp;streak_num=1&amp;streak_event_gtlt_2=gt&amp;streak_length=2#team_streak::none,Browns,1,1573420227,duedcw
125,Am i supposed to know who that girl is?,Panthers,5,1573420224,duedcw
126,Sean payton must need some fantasy pts,,9,1573420223,duedcw
127,[removed],,1,1573420221,duedcw
128,Hoping Blank realizes this and doesn't give Quinn the credit for the W,Falcons,1,1573420218,duedcw
129,How the hell did we win this game? lol,Falcons,6,1573420217,duedcw
130,Who’s that girl standing next to 97?,Raiders,1,1573420213,duedcw
131,"Same, hope Latimore is fine. It's always better when we meet up healthy. Good luck in the rest if the season.",Falcons,2,1573420211,duedcw
132,"this game was literally the exact opposite of every other game we played this season. we successfully ran the ball, we sacked the QB, wtf",Falcons,7,1573420211,duedcw
133,"Should've been called holding on the DB there, but at this point it doesn't really matter",Falcons,2,1573420210,duedcw
134,Armstead has been really really bad,Saints,4,1573420207,duedcw
135,no,Falcons,1,1573420207,duedcw
136,There is no place for garbage time tryharding,Saints,5,1573420205,duedcw
137,"Why are you risking your players for no reason, wtf",Falcons,5,1573420199,duedcw
138,1 more chance for a sack,Falcons,2,1573420198,duedcw
139,Saints are petty and want a TD on the scoreboard,Falcons,2,1573420196,duedcw
140,Was pretty sick,Falcons,3,1573420188,duedcw
141,"Thank you Falcons, we will try to take one away from GB.",Panthers,4,1573420185,duedcw
142,Enjoy the fleeting joy of winning a game. You probably won't taste it for the rest of the season,Saints,1,1573420183,duedcw
143,Saints should be fined for wasting everyone's time,,2,1573420178,duedcw
144,for real. no idea what he was talking about there. what do you call 4 hands to the face penalties?,Saints,2,1573420177,duedcw
145,https://image.businessinsider.com/5a2aaf17a3b474a60a8b4a28?width=1100&amp;format=jpeg&amp;auto=webp,Falcons,1,1573420174,duedcw
146,Commentators are very bad today,Saints,1,1573420173,duedcw
147,That was PI doesn’t matter though. It’s garbage time,Saints,9,1573420171,duedcw
148,"i was starting to get worried, looks like thanksgiving will be fun",Saints,1,1573420168,duedcw
149,He ain't going anywhere. I'm calling it.,Falcons,1,1573420167,duedcw
150,2 and 7.,Saints,2,1573420167,duedcw
151,Armstead has gotten beat on every single play I’ve seen,Saints,4,1573420165,duedcw
152,Guess MT is still on pace to break the reception record.,Saints,3,1573420165,duedcw
153,make that 30 and 300+,Saints,1,1573420161,duedcw
154,This is as blatant as stat padding can get. No other reason for your starters to be out there right now.,Bengals,7,1573420153,duedcw
155,Just end it lol,Saints,3,1573420150,duedcw
156,I think Hooper and Freeman are the two that didn’t come back. Neither is great to hear.,Falcons,1,1573420149,duedcw
157,Darude Sandstorm,Cowboys,4,1573420140,duedcw
158,Don't run another play. Don't risk injury for a meaningless touchdown (at best).,Eagles,5,1573420139,duedcw
159,Darude Sandstorm,Patriots,4,1573420139,duedcw
160,Lol y'all salty as fuck.,Packers,2,1573420134,duedcw
161,"We losing out, bro. Still gonna get a top 5 pick, if not top 3",Falcons,1,1573420134,duedcw
162,"Our O Line has been weirdly suspect a few times this season, either penalties or what's happening today",Saints,1,1573420128,duedcw
163,might be the secret to yall’s success. dirty birds should stay dirty,Saints,1,1573420125,duedcw
164,A TD will make me feel a little better. But not much at all,Saints,5,1573420125,duedcw
165,"Can confirm, am stoked",Vikings,1,1573420125,duedcw
166,Wow just run out the clock,Falcons,5,1573420124,duedcw
167,"Bruh, its strictly a rivalry win. We dont care.",Falcons,8,1573420124,duedcw
168,I was going to say.,Saints,2,1573420124,duedcw
169,You could say he's an... Atlanta Legend,Falcons,2,1573420121,duedcw
170,Why spike it?,,3,1573420113,duedcw
171,"Fuck right off, it’s our hated rival and we just beat their ass",Falcons,9,1573420112,duedcw
172,Nobody thinks we’re amazing. But coming in and stomping the saints is literally the best case scenario for our season.,Falcons,8,1573420109,duedcw
173,2-7,Falcons,7,1573420107,duedcw
174,Dude this is their supervowl!,Panthers,5,1573420105,duedcw
175,"Yoooooo, what was the song that played after that last commercial break? Sounded pretty good.",Falcons,3,1573420095,duedcw
176,You do it when you can't give the ball back.,Falcons,0,1573420092,duedcw
177,"I agree, the falcons are done.",Cowboys,1,1573420087,duedcw
178,FYI the Chiefs are down by 1 with like 25 seconds left against the Titans,Patriots,3,1573420087,duedcw
179,Bro your username is lit,Falcons,1,1573420086,duedcw
180,"""youd think the saints made a ton of mistakes but thats not the case""

are we watching the same game announcers?",Saints,12,1573420086,duedcw
181,I'm sure he probably wrote that on the back of whatever sign he did bring,Saints,2,1573420084,duedcw
182,Maybe brees would be better if he took off his thumb bra,Rams,3,1573420074,duedcw
183,"Lol falcons fan in this thread getting crazy. Y'all still 2-7 after this game, dead last or at least the best case is you're tied for 3rd in your division. You had a good game, don't outgrow your hat size.",Packers,-12,1573420067,duedcw
184,Here comes the garbage time plays,Saints,7,1573420067,duedcw
185,Right lol I was like WHY DID HE ALREADY HAVE THAT?!,Saints,2,1573420062,duedcw
186,Yea that’s what I said. Get the ball to him. I wasn’t blaming him.,Saints,1,1573420060,duedcw
187,I feel like there is a weird  trend now to use your time outs before the two minute warning. I've seen it a lot lately.,Eagles,1,1573420057,duedcw
188,[deleted],,1,1573420053,duedcw
189,Would aaaaalmost watch that dumb show for Triumph,Packers,1,1573420053,duedcw
190,Why would you have Kamara out there still? Especially coming off an injury...,Bengals,2,1573420050,duedcw
191,[deleted],,0,1573420046,duedcw
192,If DQ saves his job after this season the fan base will fucking implode.,Falcons,1,1573420046,duedcw
193,pull meal por pibe bucks,Raiders,1,1573420044,duedcw
194,NFC South is just professional ACC Coastal,Falcons,4,1573420037,duedcw
195,"We come prepared for this type of thing. Your team showed up. Hope you don't have any lasting injuries, I saw a few go out.",Saints,3,1573420037,duedcw
196,"30 and 300+. Actually, fuck it, just let him pick the ball up from the line and run.",,1,1573420035,duedcw
197,Bring on the post game thread. I need my last opportunity of the year to shit talk,Falcons,9,1573420028,duedcw
198,"Am I safe to assume we have your support, you get rid of Quinn, you help us get one up on the saints",Panthers,1,1573420024,duedcw
199,ayyy its our turn for garbage time stats!,Saints,2,1573420024,duedcw
200,Panthers,Saints,1,1573420024,duedcw
201,He can’t catch balls that aren’t thrown to him,Saints,1,1573420023,duedcw
202,No positives. Your team lost.,Eagles,5,1573420021,duedcw
203,"Anybody bet on Atlanta? You’re crazy, and congrats lol",Colts,5,1573420013,duedcw
204,You have no power here,Falcons,1,1573420012,duedcw
205,Garbage time stats ACTIVATED,Saints,4,1573420009,duedcw
206,I always wonder what my avid football watching 90 year old grandfather thinks when he hears Migos during games,Rams,4,1573420008,duedcw
207,"Positives: Falcons get a higher pick, Dan Quinn possibly saves his job, Still can't guard mike. hopefully this lights a fire under our ass these next few games 

Negatives: 3rd down defense, o-line play, still no #2 receiver",Saints,-1,1573419990,duedcw
208,Lol losing to the Falcons,Patriots,0,1573419986,duedcw
209,I cant believe Michigan State blew a 28-3 lead last night.,,1,1573419981,duedcw
210,I won’t say no...,Saints,1,1573419973,duedcw
211,Exactly. The rest of the season is totally meaningless..,Saints,0,1573419972,duedcw
212,No.,Saints,1,1573419972,duedcw
213,You say remember as if we ever knew in the first place.,Falcons,4,1573419971,duedcw
214,Can't wait for tomorrow man,Seahawks,1,1573419967,duedcw
215,"Goff goes into Atlanta and destroy the Falcons.  Drew Brees get dominated by the Falcons at home.

Goff outplay Drew Brees in the NFCCG.",,0,1573419966,duedcw
216,Everything will go back to normal next week. You guys will win your game and we will lose. This is just your normal divisional fuckery.,Falcons,1,1573419956,duedcw
217,20 catches and 200+,Panthers,1,1573419956,duedcw
218,speechless,Falcons,2,1573419945,duedcw
219,Who's the Sherman in your username?,Saints,2,1573419939,duedcw
220,DIGGS,,1,1573419937,duedcw
221,Panthers.,Falcons,1,1573419935,duedcw
222,Whoever said that is an idiot anyway.,Saints,3,1573419935,duedcw
223,"Question: Did that “speechless” Saints fan make that sign on the spot, or did he come prepared?",Falcons,6,1573419934,duedcw
224,I don’t care about his stats. I mean on critical third and 4th downs,Saints,1,1573419933,duedcw
225,Is your team all that different from your more successful seasons? I don't think any sane saints fan went into this game expecting it to be ezpz. Ryan is a solid qb and Julio is a beast.,Saints,1,1573419927,duedcw
226,Much less Kamara returning a punt.,49ers,2,1573419926,duedcw
227,Oh hey you're back! I haven't seen your incel ass all year while we've been winning lmfao,Saints,1,1573419926,duedcw
228,And we got like 3 or 4 more in a row,Saints,1,1573419926,duedcw
229,exposed bros?,Saints,1,1573419923,duedcw
230,That speechless guy must’ve known he’d be instantly memed,Packers,9,1573419921,duedcw
231,Just trying to educate to distract me from the misery of this game,Saints,1,1573419918,duedcw
232,"Chin up, man, you know the Falcons hate you and will bring it all to the table.",NFL,1,1573419916,duedcw
233,"Yep, Saints couldnt even get in the endzone against the worst falcons D ive ever seen. Theyre done. Glad we're in agreement.",Falcons,1,1573419912,duedcw
234,"Why is Brees out there?  Why was Kamara returning that?

If either gets hurt, Peyton will deserve to hear about it.",49ers,3,1573419904,duedcw
235,Us,Panthers,1,1573419903,duedcw
236,Panthers,Patriots,1,1573419903,duedcw
237,"Ugh wtf, we gave up 6 sacks to the falcons? Why did they all of sudden remember how to play defense against us? Kabdnakd",Saints,4,1573419896,duedcw
238,He has 10 catches and 100+. What more do you want from the man?,Saints,2,1573419893,duedcw
239,"Well there is no way the saints are a superbowl team, losing to this team.",Falcons,0,1573419885,duedcw
240,*laughs in CMC*,Panthers,2,1573419885,duedcw
241,How can I not love sexy Jimmy G,,4,1573419884,duedcw
242,DIGGS,Falcons,0,1573419883,duedcw
243,Who do the falcons play next week?,Saints,1,1573419882,duedcw
244,Thank you,Falcons,4,1573419879,duedcw
245,yeah today is troubling for sure but im still confident in this team,Saints,1,1573419877,duedcw
246,"""speechless"" lmaoo",Falcons,6,1573419876,duedcw
247,We have different definitions of the word bad,Saints,0,1573419874,duedcw
248,The Bengals?,Packers,3,1573419869,duedcw
249,It's literally the only redeeming quality about New Orleans,Falcons,2,1573419867,duedcw
250,Losing out except wins against the saints will still get him fired,Falcons,5,1573419866,duedcw
251,"You shut your goddamn mouth. I may hate the team, but the city produces some damn fine food.",Falcons,2,1573419864,duedcw
252,We should’ve gotten Thomas the ball more,Saints,2,1573419863,duedcw
253,Especially as mobile QBs,,1,1573419860,duedcw
254,Payton*,Saints,4,1573419853,duedcw
255, https://i.imgur.com/dAH2vtB.jpg,,5,1573419850,duedcw
256,It’s a bad week. Jesus.,Saints,2,1573419850,duedcw
257,"For real, what a complete 180",Cowboys,1,1573419845,duedcw
258,I'm sure you'll beat us in Atlanta,Falcons,0,1573419844,duedcw
259,"Benched Derrick Henry for Kamara...

Can't complain I guess",Falcons,1,1573419841,duedcw
260,"LMAO, that saints fan",Cowboys,7,1573419840,duedcw
261,People were pissed at the blown dead TD. No ones complaining now bc we just look like ass.,,1,1573419832,duedcw
262,Any given Sunday!,NFL,3,1573419829,duedcw
263,Shit that’s not the team I saw today,Saints,0,1573419827,duedcw
264,"I linked to the comment you dope. That was literally a falcons fan, not my alt. You're just some whiny sore loser.",Eagles,-1,1573419825,duedcw
265,Payton is about to play Exodia for the clutch W.,Falcons,3,1573419822,duedcw
266,Why do we even runs play here?  What if someone gets hurt?,Saints,7,1573419822,duedcw
267,"lmao, from a pats fan, yikes.",Saints,4,1573419816,duedcw
268,Peyton with the choke job today.,Falcons,14,1573419815,duedcw
269,SIDELINE,Vikings,2,1573419814,duedcw
270,the other 7 teams we already beat?,Saints,1,1573419803,duedcw
271,Patriots are the #1 seed currently,Patriots,0,1573419803,duedcw
272,Remember when kamara was the dangerous rb in the south. Heh.,Panthers,7,1573419799,duedcw
273,Will Clapp is getting beat on every play still,Saints,5,1573419795,duedcw
274,[deleted],,2,1573419793,duedcw
275,You mean the TD fumble recovery blown dead? That's a legitimate problem.,Saints,0,1573419790,duedcw
276,I just hope the falcons shower extra hard after the game and then again once they are home... wash the wretched filth off,Falcons,8,1573419788,duedcw
277,What the hell is wrong with you,Saints,6,1573419788,duedcw
278,Anytime our injured HOF QB gets sacked 6 times and pressured every time is worrisome.,Saints,1,1573419781,duedcw
279,Defense didn’t do great but they also had tons of terrible penalties after third down stops and offense didn’t bail them out. Such a bad all around performance.,Saints,3,1573419778,duedcw
280,With this game the Falcons are front runners for Super Bowl whole Saints are burying for Burrows. Right? That’s what I’m seeing.,Saints,5,1573419778,duedcw
281,We all thank you for that,Patriots,1,1573419772,duedcw
282,Man I'm thrilled to see Koo succeeding here. He was great in the AAF,Panthers,10,1573419770,duedcw
283,Sure I'm being a baby. You were making shit up to talk shit bruh,Saints,2,1573419767,duedcw
284,takk mckinley has the smoothest brain dude it's like a ball bearing up there,Falcons,9,1573419766,duedcw
285,Lol at the Saints fans that were saying it’s not a rivalry anymore,Falcons,11,1573419766,duedcw
286,So i benched Kirk for Kamara. I mean I can’t be mad bc who wouldnt do the same but that really sucks.,Steelers,4,1573419765,duedcw
287,100% sea salt right there.,,2,1573419756,duedcw
288,28-3,Saints,-3,1573419754,duedcw
