,body,author_flair_text,score,created_utc,link_id
215,I’m not blaming it on them but they literally call anything and everything on the jags every game. It’s wack as fuck,Jaguars,2,1575845723,e7z1lh
216,Poor Minshew is getting eaten alive by our Dline. But yeah I think I've seen one deep look from you guys.,Chargers,2,1575845714,e7z1lh
217,oh we got a positive yardage play? holding. got it. We suck so badly we cannot even get a positive yardage play without committing penalties.,Jaguars,3,1575845704,e7z1lh
218,To be fair this game isn't on the refs,Chargers,4,1575845695,e7z1lh
219,I FUCKING SWEAR. BRUH THEY SRE CALLING EVERYTHING AGAINST JACKSONVILLE. SHIT HAS GOTTEN SO OLD.,Jaguars,2,1575845679,e7z1lh
220,"I don't even get the point of benching rivers, no way we're getting anywhere with anyone else",Chargers,3,1575845674,e7z1lh
221,"Fournette is closing in on 1000 rushing yards for the season, right? At least it’s been a good season for him.",Broncos,1,1575845658,e7z1lh
222,yikes. acting like his receivers smashing bottom tier teams means he isnt shit,Buccaneers,-6,1575845655,e7z1lh
223,"Oh wow, in that case Marrone should be even more fired then he is already. The players don't deserve that shit.",49ers,2,1575845640,e7z1lh
224,But Tyrod is mobile and doesn't throw picks!!! Tyrod is the future!,Chargers,5,1575845626,e7z1lh
225,"There's always been a sect of Chargers fans saying we should dump Rivers, you've got to tune them out lol",Chargers,8,1575845616,e7z1lh
226,I legit don't think we've made a real attempt at even attacking your secondary all day honestly.,Jaguars,3,1575845596,e7z1lh
227,"Agreed. I'd hate to see this be his last season. The Chargers honestly have so many pieces in place, and a smart offseason could turn things around for them.  

I think their real weakness is at head coach. Anthony Lynn doesn't seem to be much good at game planning or adjustment. When the Chargers win, it feels like the talent on the roster just willing it to happen.",49ers,2,1575845581,e7z1lh
228,Just get the first you moron,Packers,3,1575845556,e7z1lh
229,"Hate those fans, fucking disgusting",Chargers,8,1575845556,e7z1lh
230,Just once in my life I wish we could hire a coach who was 100% competent and good at their job. We haven't had any kind of true consistency since prime Coughlin. It just seems fucking impossible to keep hiring promising coaches and they just continuously blow it.,Jaguars,3,1575845553,e7z1lh
231,The last five games have been an absolute tragedy even for Jacksonville’s standards,Jaguars,3,1575845521,e7z1lh
232,yeesh coming back for it sort of dug his grave on that one,Chargers,4,1575845518,e7z1lh
233,Hey guys should we bench Rivers?!,Chargers,8,1575845513,e7z1lh
234,"Also I know we haven't seen him make a ton of plays today, but I'm so happy to see Derwin James back in our secondary. His presence changes the energy of our defense so much.",Chargers,4,1575845512,e7z1lh
235,He actually did help him up and you got downvoted. Jesus Christ Chargers fans what do you have to be pissy about?,Jaguars,2,1575845499,e7z1lh
236,not sure who thought. with what talent? the Bengals have more talent than the jags.,Patriots,2,1575845491,e7z1lh
237,They are trying to one up themselves every week.,Jaguars,2,1575845467,e7z1lh
238,I remember when I thought the Jaguars were a playoff contender,Rams,5,1575845452,e7z1lh
239,I love how we're responding with 1 and 4 yard plays.,Jaguars,3,1575845436,e7z1lh
240,"I know the Chargers' franchise is well known for finishing games, but I hope by the 4th quarter we're playing backups.",Chargers,5,1575845420,e7z1lh
241,Players gave up because Foles lost us several games. They don't respect the coaches and neither does the other team.,Jaguars,3,1575845413,e7z1lh
242,"Jags should just try and run the clock out, sooner this ends the better lmao",Broncos,4,1575845398,e7z1lh
243,"Don't really know enough about the packers to comment on that, but the team just seemed to work so well that I was happy anyway",Chargers,1,1575845390,e7z1lh
244,"They’re playing Jacksonville’s D, I’d pump them brakes a little.",Seahawks,2,1575845385,e7z1lh
245,DC doesn't think he needs to change anything. Teams run all over us and we go down several scores so they can keep running but he'll never put that together so he has to go.,Jaguars,1,1575845323,e7z1lh
246,I mean there are glimpses but he has no time. Our o line look like they aren’t even trying.,Jaguars,1,1575845321,e7z1lh
247,The Jags trying to one up Houston or what?,Cardinals,5,1575845319,e7z1lh
248,"""your mom makes dry biscuits""",,4,1575845312,e7z1lh
249,PAY AUSTIN EKELER 2020,Chargers,5,1575845296,e7z1lh
250,"Not necessarily, just a cruel reminder of how talented and good this team can be. 

I really hope Rivers sticks around next year, he is still solid, just having a bit of a bad year. He deserves to go out on a high note for all he has done for this franchise.",Chargers,2,1575845289,e7z1lh
251,is it wrong to think about how this roster be with Tom Brady?,Chargers,2,1575845286,e7z1lh
252,"I think that game was more a result of the Packers not fixing their shitty O Line either, lol. Bosa and Ingram are elite, and Green Bay couldn't stop them at all.  Chargers had a decent game on offense, but mostly set up by time of possession.  They only scored 26. They have 24 in this one at halftime.  That's because the Jags can't get much pressure on Rivers and definitely can't stop Ekeler and Gordon.",49ers,3,1575845280,e7z1lh
253,all losses will be within 7 points of course,Chargers,3,1575845275,e7z1lh
254,"Phil ""skeet-yeeter"" Rivers",,4,1575845272,e7z1lh
255,What the hell happened to the Jags? They were somewhere between ok to solid a few games back.,49ers,5,1575845264,e7z1lh
256,"Is the Jags defense even out there? Holy fuck, Idk if I’ve seen this many blown plays in 1 game",Broncos,3,1575845260,e7z1lh
257,Looked like he was trying to help Rivers up after he pushed him down. Was Rivers really pissy about that? Why do I even ask,Broncos,-4,1575845248,e7z1lh
258,I hate you Todd Wash. I genuinely do. There is no excuse for a defensive coordinator in this league to be THIS. FUCKING. STUPID. He never has any idea what the other team is going to do and it shows.,Jaguars,4,1575845244,e7z1lh
259,The Chargers are gonna finish 8 games behind the Seahawks with a better point differential,Seahawks,3,1575845233,e7z1lh
260,Ekeler has 92 rushing yards on 4 attempts and 98 yards and a touchdown on 3 receptions.,Jaguars,5,1575845231,e7z1lh
261,Don't get too excited with that play call now.,Ravens,2,1575845225,e7z1lh
262,"This is just comical at this point

I give up",Jaguars,3,1575845214,e7z1lh
263,lmao philip talking that non expletive trash,Chargers,11,1575845204,e7z1lh
264,Illegal men down field? Holy shit that one lineman was on our corner back before the pass,Jaguars,3,1575845196,e7z1lh
265,Just send the Jags off to England already,Steelers,2,1575845193,e7z1lh
266,damn 61 was running pretty fast,Chargers,2,1575845186,e7z1lh
267,wtf is this stupid team,Jaguars,2,1575845183,e7z1lh
268,That was the most boring call on the TD ive ever heard.,Bears,7,1575845183,e7z1lh
269,That play design was so freaking good.,Chargers,3,1575845170,e7z1lh
270,That would've been a pick any day before today,Chargers,4,1575845148,e7z1lh
271,Please drop a 50 burger on us. Anything less and I will chalk it up as a chargers loss.,Jaguars,11,1575845139,e7z1lh
272,"Aiming for that draft pick?

Makes sense from a strategic standpoint, but it sucks seeing Philip Rivers sad. He's one of my favorite NFL players.",49ers,2,1575845122,e7z1lh
273,what the fuck,Chargers,6,1575845102,e7z1lh
274,[deleted],,-3,1575845080,e7z1lh
275,Henry how could u,Chargers,5,1575845070,e7z1lh
276,"Man Rivers has been dropping dimes all game, where was this the past few weeks?",Chargers,5,1575845059,e7z1lh
277,[and some eagles fans want him as our OC](https://www.reddit.com/r/eagles/comments/e6ivfq/would_you_be_in_favor_of_john_defilippo_being_the/),Eagles,1,1575845054,e7z1lh
278,Jokes on you we had already seen that team in the win against the packers.,Chargers,4,1575845002,e7z1lh
279,"On the upside, the Chargers have two blowout wins this season, so it isn't like they don't have the capacity to do it. 

They only fuck up the close ones, but the Jaguars would need a real pass rush and run defense to do that.",49ers,3,1575844999,e7z1lh
280,Honestly a blow out win feels worse than a loss,Chargers,2,1575844997,e7z1lh
281,Dareus injury. He is our run defense,Jaguars,3,1575844949,e7z1lh
282,Chargers fans getting a bittersweet look at what this team would have looked like if the front office or the coaching staff would have invested in an Offensive Line instead of Thomas Davis and wasting $4M on a backup to a QB who has never missed a game since becoming starter.   Then blowing their 2nd round pick on a safety and taking a D2 project LT in the 3rd.,49ers,4,1575844836,e7z1lh
283,"""I don't know if pocket QBs work anymore"" - Tony Gonzales

Somewhere Tom Brady just smirked",Chargers,6,1575844744,e7z1lh
284,:( &lt;3,Chargers,3,1575844607,e7z1lh
285,"The Jaguars fucking suck, and I just know they won't fire Coughlin. I've been in my fantasy league with my best friends for 6 years and don't have a single playoff win.

I've invested so much emotionally into this sport and I can't describe how unbelievably depressed I feel. It used to be about my divorce, then it was about my unemployment.... but no, I just hate my fucking life.

I hate myself.

I know this thread moves fast so whatever, I just had to say it.",Jaguars,3,1575844543,e7z1lh
286,"I care about this shit team less and less every single week, but maybe we'll get lucky and Marrone will be fired after a fifth consecutive blowout loss.",Jaguars,3,1575844489,e7z1lh
287,Was just wondering how you guys are going to blow it by 2 in the last 2 minutes.,NFL,1,1575844481,e7z1lh
288,"Wtf happened to Jacksonville's defense? Losing Ramsey that badly?

Also how many medical/police/crime drama TV shows do we fucking need?",Texans,5,1575844406,e7z1lh
289,I fully blame Tom Brady for the Chiefs bags getting sent elsewhere,Chargers,5,1575844405,e7z1lh
290,"If someone isn't fired after this game, ownership doesn't give a shit.",Jaguars,3,1575844210,e7z1lh
291,We fucking suck,Jaguars,3,1575844201,e7z1lh
292,I’m so happy with how we’ve been playing but I’m ready to give up 28 unanswered points and lose.,Chargers,10,1575844165,e7z1lh
293,Don't forget the Browns.,Buccaneers,2,1575844161,e7z1lh
294,"Not to my knowledge haha, wouldn't be surprised if it did happen though.",,5,1575844123,e7z1lh
295,"Jags need a new coach desperately, probably a team that needs a new coach the most next to the Jets",Buccaneers,3,1575844109,e7z1lh
296,"Someone in another thread said there was a 2nd and 61, is this true and how",Patriots,3,1575844056,e7z1lh
297,I mean both those plays were better than running out of time,Chargers,2,1575844056,e7z1lh
298,money vag,Chargers,5,1575844036,e7z1lh
299,Someone should tell Phil he needs to throw the ball in the field of play to complete passes,Rams,1,1575843995,e7z1lh
300,Holy shit what is this discipline. I thought we were bad but man Jags fans have it way worse.,Chargers,6,1575843964,e7z1lh
301,He's for sure gone though. You can't do the things he does and expect to remain employed.,Jaguars,1,1575843922,e7z1lh
302,bosa is wrecking this O-line so no minshew magic so far,Chargers,5,1575843861,e7z1lh
303,"oops not Patton, I meant Pope",Chargers,1,1575843830,e7z1lh
304,Haven't been watching the game but I take it that Minshew Mania is taking some time off?,Chiefs,2,1575843826,e7z1lh
305,Payne is living up to his name. Inflicting pain on Jags fans.,Chargers,2,1575843813,e7z1lh
306,no FM though. I was about to say that's bold af to reach for both lol.,Chargers,3,1575843781,e7z1lh
307,Give it to me,Jaguars,1,1575843747,e7z1lh
308,"hey man, Patton fucked it up too and at least it ain't Benji out there.",Chargers,5,1575843715,e7z1lh
309,No worries it's all good!,Chargers,2,1575843674,e7z1lh
310,"How the chargers will charge this one up: Myles Jack says screw the IR, shows up at halftime and goes back to offense at RB. Rushes 10 times for 239 yards and 4 touchdowns and the Jags win 31-28",Chargers,6,1575843642,e7z1lh
311,How is King still our main punter returner? He must be an athletic freak in open space because the dude has messed up so many returns.,Chargers,7,1575843635,e7z1lh
312,"Honestly, I feel like the players aren’t calling out the coaches and higher-ups because of the control coughlin has over the roster",Jaguars,1,1575843622,e7z1lh
313,"I love Minshew's cadence, he's got a dope voice",Ravens,3,1575843614,e7z1lh
314,omg that ref just touched Dad,Chargers,4,1575843609,e7z1lh
315,Are you in a headspace to hear potentially hurtful information?,Chargers,1,1575843604,e7z1lh
316,We'll panic and stop running the ball despite it working so well and they'll catch back up,Chargers,3,1575843575,e7z1lh
317,I'm so sorry DeFlippio ended up here,Vikings,1,1575843567,e7z1lh
318,Jags should just kneel out the half and let the Chargers open up with a TD to make it 28-3.  Guaranteed victory.,Cowboys,3,1575843558,e7z1lh
319,still expecting a loss,Chargers,2,1575843556,e7z1lh
320,Jags run defense and o-line are MIA.,Chargers,1,1575843552,e7z1lh
321,"If the players aren't going to try, that's a sign that the coaches are ineffective. Fuck it. Stop protecting them already. They're going to make fans resent the team more for wasting their time.",Jaguars,5,1575843551,e7z1lh
322,Bosa just ruined that mans life,Chargers,1,1575843550,e7z1lh
323,They lose draft position,Jaguars,3,1575843548,e7z1lh
324,Talk about a dead gdt,Eagles,1,1575843542,e7z1lh
325,So how will the Chargers lose this one?,Bears,2,1575843530,e7z1lh
326,"at some point it has to be put on Doug Marrone and the rest of the coaching. they need to be gone. like after today. 

fire coughlin and fire doug",Patriots,4,1575843514,e7z1lh
327,Hmm...at least last season's game vs the chargers was entertaining... shit show but an entertaining shit show.,Jaguars,2,1575843507,e7z1lh
328,sustainable,Chargers,2,1575843464,e7z1lh
329,yeah I was holding my breath for that Ekeler run to be called back,Chargers,3,1575843453,e7z1lh
330,that's ucla level bad,Chargers,3,1575843452,e7z1lh
331,"Announcers seem confident we will have the lead at half, but if any team can give up 18 points in 1:30 it's us.",Chargers,5,1575843426,e7z1lh
332,My bad,Chargers,3,1575843421,e7z1lh
333,"Now you need to get creative with play-calling to score, so we're not going to do that. Fucking hate our coaches.",Jaguars,5,1575843420,e7z1lh
334,Defense giving up 10.3 yards per play today.,Jaguars,4,1575843409,e7z1lh
335,"respect to that jags fan, she's still feelin it",Chargers,7,1575843364,e7z1lh
336,"No way, that name is so extremely difficult to spell",Chargers,4,1575843364,e7z1lh
337,Dolphins would beat us by 30.,Jaguars,3,1575843303,e7z1lh
338,A toddler could shed some of our defense’s tackles and run for a 200 yard game,Jaguars,3,1575843301,e7z1lh
339,"Just tuning in, what's up with our team so far",Jaguars,4,1575843269,e7z1lh
340,[deleted],,1,1575843262,e7z1lh
341,"He's a veteran QB and regardless of how good his arm is or isn't, running the same dumb shit out there that isn't working and then never fixing it is something so stupid you shouldn't be hired anywhere, ever.",Jaguars,5,1575843258,e7z1lh
342,[deleted],,3,1575843255,e7z1lh
343,Jags tryin to out-Charger the Chargers,,3,1575843250,e7z1lh
344,Normally all of our nice plays come back too so I'm shocked,Chargers,7,1575843238,e7z1lh
345,Come on man at least spell his name right,Chargers,9,1575843231,e7z1lh
346,This is the worst disciplined team by a wide margin.,Jaguars,3,1575843220,e7z1lh
347,"I hope by the time next season kicks off everyone will have figured out how to spell **""Ekeler""**",Chargers,5,1575843219,e7z1lh
348,Thats like the Nick Chubb special under Hue Jackson,Chargers,3,1575843213,e7z1lh
349,...am I watching the chargers? I don’t know how to feel right now.,Chargers,3,1575843212,e7z1lh
350,Ekeler has 3 rushes for 85 yards,,9,1575843167,e7z1lh
351,"See that’s just crazy. If that’s the jags, they are calling five different holds",Jaguars,5,1575843163,e7z1lh
352,Jags run defense making Austin Ekeler look like Ladainian Tomlinson.,Chargers,14,1575843133,e7z1lh
353,Sorry Jag bros. I love you but that was the worst tackling I've ever seen.,Chargers,6,1575843131,e7z1lh
354,Lmao that tackling,Jaguars,3,1575843128,e7z1lh
355,Ek's so short he made those last two essentially tackle eachother just by ducking,Chargers,3,1575843126,e7z1lh
356,Austin holy hell that run,Chargers,3,1575843106,e7z1lh
357,It wasn’t PI. Great defensive play.,Jaguars,2,1575843063,e7z1lh
358,"happy birthday, philip",Cardinals,3,1575843016,e7z1lh
359,"Commercials. Punt. Commercials. 

Awesome. Too bad that :05 of football interrupted the real reason we’re watching.  😒",Jaguars,3,1575842980,e7z1lh
360,I think that's just good coverage but I'm also extremely biased so idk,Chargers,3,1575842925,e7z1lh
361,"I feel guilty that we're leading right now. That's how fucked up it is being a Charger fan. Like i'm conditioned to feel like we don't deserve to be happy.


I'm sorry Jags fans.",Chargers,8,1575842858,e7z1lh
362,We're the most penalized team in the league. That's coaching 100% of the time.,Jaguars,6,1575842821,e7z1lh
363,"i think its both talent and coaching, they just have no big names anywhere. like none. no big defensive names, no big offensive names. 

Josh Lambo is their best player lol. and not a knock on him hes the 2nd or best kicker this season in NFL.

but I agree. Doug Marrone is an ass. hes horrific . playcalling is shit.",Patriots,1,1575842814,e7z1lh
364,Any run that’s more than 5 yards I just assume at this point is getting called back for holding,Jaguars,6,1575842765,e7z1lh
365,"I **love** that we can't get anything done offensively without some kind of penalty. Even if we don't commit a penalty, they'll call something extremely weak on Linder or something just for good measure.",Jaguars,5,1575842734,e7z1lh
366,Theyve got so many good picks the past few years that i really dont think its a talent issue. I think that none of the players are being coached to their talent level.,Texans,2,1575842699,e7z1lh
367,the officials sound like they're speaking through a paper towel tube,Chargers,3,1575842649,e7z1lh
368,"I really enjoy Minshew and the Jags. I thought Maurice Jones Drew and Fred Taylor were so cool when I was a kid. I fell in love with the Chargers because I like RBs and uh Ladainian Tomlinson, but I was rooting for the Jags in their 07 run.",Chargers,4,1575842642,e7z1lh
369,Commentators talk about My Cause My Cleats as the cameraman desperately scans the field for somebody wearing cleats for the cause,Jaguars,7,1575842588,e7z1lh
370,"all you need to know about why Jags are so bad, Fournette 10 carries 30 yards (horrific oline). horrific defense and they give up too many penalties. and nobody that can catch passes besides DJ Chark. 

its really hard to blame Minshew for it tbh if you put a typical rookie QB at helm they would have won 2 games max. they are the least talented team in NFL imo. even worse than fins.",Patriots,5,1575842552,e7z1lh
371,"Also, a great steady mount.",Jaguars,2,1575842525,e7z1lh
372,[removed],,1,1575842516,e7z1lh
373,"&gt;1st down within reach


&gt;Derwin closing in


&gt;fuckitslide",Chargers,7,1575842468,e7z1lh
374,"I feel like you guys have the right to be upset. You have all the pieces, have close losses.

We just suck and we know it. It's all we know.",Jaguars,10,1575842435,e7z1lh
375,"If we don't get at least a FG here as a response, I'm full on ""fire Marrone, fire Flip, fire Wash"". There is literally zero excuse for the playcalling to this point. Your literal career is to not do stupid shit like constant run-run-pass or passing on 3rd and 1 when you have Leonard Fournette.

There is a reason you don't see teams like the Chiefs, Ravens, and Patriots doing this shit.",Jaguars,3,1575842412,e7z1lh
376,"Ahh yes.  Because epic cinematography is just about having a good iPhone, and not about knowing how to properly select and set up camera angles and block scenes, then edit them together.",49ers,3,1575842382,e7z1lh
377,"I get that our line sucks, but I did absolutely no film study of our offense since gamepass is $100 but I still know what we're going to do.",Jaguars,5,1575842360,e7z1lh
378,shit lemme get a piece,Chargers,3,1575842347,e7z1lh
379,smh the absolute disrespect for GONZO THE GREAT,Eagles,1,1575842342,e7z1lh
380,we all know Melvin just wanted to grab Watt's ass,Chargers,4,1575842303,e7z1lh
381,"He has to watch this game, I don't blame him",Chargers,2,1575842287,e7z1lh
382,"From reading comments in this thread I'm starting to feel like Chargers and Jags fans are basically the same, we all suffer the same way",Chargers,16,1575842277,e7z1lh
383,"Nah man, it's time to go full 2008, we'll win the last 4 and the Chiefs will lose the last 4 and we'll win the division",Chargers,3,1575842276,e7z1lh
384,"He looked trash until he got back into football shape. When he is on he is a beast, but paying a RB big money is dumb.",Chargers,1,1575842267,e7z1lh
385,Absolutely. You guys look like a super bowl contender versus us.,Jaguars,5,1575842260,e7z1lh
386,Some good tackling out there. You can tell they don't respect the coaches if they're doing everything as lazily as possible.,Jaguars,3,1575842256,e7z1lh
387,commentator too drunk to pick up that Watt was Melvin's leashed dog in that celebration,Chargers,3,1575842255,e7z1lh
388,"You are watching how bad we are, right?",Jaguars,2,1575842252,e7z1lh
389,"They’re going to the halfback on every single play

You’d think our defensive coordinator would realize this. But nope",Jaguars,3,1575842231,e7z1lh
390,The best Watt!!!!!!!!!,Chargers,1,1575842219,e7z1lh
391,Our defense is so bad,Jaguars,3,1575842216,e7z1lh
392,Watt's gotten the ball a decent amount of times this season actually.,Chargers,2,1575842205,e7z1lh
393,"Maybe Melvin holding out was smart in the end, looks like he’s gonna have his 5th straight game with 100 total yards and is averaging 4.7 ypc over that span",Patriots,2,1575842190,e7z1lh
394,I like how they're using motion men to set up patterns and we're not smart enough to do that. Wonderful.,Jaguars,5,1575842177,e7z1lh
395,Is this color analyst drunk? He straight up sounds drunk,Chargers,5,1575842168,e7z1lh
396,"OO BOY I know you ain't talking about us, not this season.",Chargers,4,1575842159,e7z1lh
397,I’m pretty sure a high school team could do it.,Jaguars,1,1575842117,e7z1lh
398,I only watch these games because it's nice to see what a real football team looks like.,Jaguars,6,1575842106,e7z1lh
399,Don't waste your time throwing lmao you know we can't stop the run.,Jaguars,4,1575842080,e7z1lh
400,Running against the Jags just looks so easy...sigh.,Jaguars,3,1575842068,e7z1lh
401,a little sunday morning gin slows the tongue a bit,Chargers,7,1575842021,e7z1lh
402,The OL doesn't give him a hole to run into. It's a waste.,Jaguars,2,1575841910,e7z1lh
403,"You’ve called our game 2 weeks in a row now

How do you not know how to pronounce Bouye’s name?",Jaguars,4,1575841885,e7z1lh
404,hey maybe it's biodegradable,Seahawks,2,1575841844,e7z1lh
405,"Seems fair to me, turtles as bros, as evidenced by Finding Nemo. Meanwhile, bears maul people. It's a win win",Chargers,4,1575841821,e7z1lh
406,His second mistake was thinking the Jaguars would do good.,Jaguars,7,1575841816,e7z1lh
407,Polar Bears say fuck the Turtles. We got to melt the ice to save the turtles!!!!!!!,Chargers,4,1575841770,e7z1lh
408,Yeah chargers our big guys cant block so just run the ball all game protecc rivers,Jaguars,3,1575841737,e7z1lh
409,Your first mistake was thinking the Chargers would do good.,Chargers,6,1575841715,e7z1lh
410,"Is that a STRAW in that Coca Cola commercial?

YALL GOING TO JAIL NOW",Chargers,5,1575841705,e7z1lh
411,That's an indication our oline is bad.,Jaguars,1,1575841651,e7z1lh
412,"why is kermit afraid of gonzo

kermit would destroy that long nose freak",Patriots,3,1575841637,e7z1lh
413,"I picked the Chargers and Jags to make the playoffs in preseason.

I'm a bit butthurt.",49ers,4,1575841629,e7z1lh
414,Or at least recognize when it's broken and cut hard to the line to not take a 5 yard loss. Trying the edge when it's not there only loses yards,Seahawks,2,1575841590,e7z1lh
415,Agreed.  Bosa had an easy shot because he had pressure from the other side.,Jaguars,4,1575841578,e7z1lh
416,Bosa is a freak,Chargers,3,1575841564,e7z1lh
417,Jeesh....Minshew had like 2 seconds tops there. Oline has to be better,Seahawks,6,1575841543,e7z1lh
418,"""Don't be so predictable on 3rd down""

*Does what everyone thinks we're going to do.*",Jaguars,5,1575841530,e7z1lh
419,To pass it to him. He's a dangerous receiver,Chargers,4,1575841504,e7z1lh
420,Robinson looked like he was offside.,Jaguars,3,1575841490,e7z1lh
421,What the fuck was the point of drafting Fournette if we're not going to run on any fucking 3rd and short?,Jaguars,3,1575841483,e7z1lh
422,"""A terrific play made by Facyson""

...I'm not familiar with that set of words",Chargers,4,1575841450,e7z1lh
423,I hate those tricky running plays. We don't have the blocking to do that.,Jaguars,1,1575841440,e7z1lh
424,"Yikes, north south guys, north south....",Seahawks,1,1575841433,e7z1lh
425,.,Jaguars,1,1575841419,e7z1lh
426,Mobile Minshew is best Minshew,Seahawks,1,1575841402,e7z1lh
427,I love Derwin,Chargers,4,1575841398,e7z1lh
428,"I honestly don't think the Chargers are good this season.  Their O Line is even worse than it was last season when it was bad.  

They have some phenomenal individual players, but it's missing the key to a successful offense: pass protection and run blocking.  Their middle is pretty soft on defense too.",49ers,1,1575841347,e7z1lh
