,body,author_flair_text,score,created_utc,link_id
0,Pete Carrol never coached at Florida lol.,Buccaneers,1,1574643273,e11i34
1,"Are we sure he was, or was it Pete Carrol, because I have watched this putrid D for 5 years.  Players not communicating, players out of position, players being undisciplined.  In one drive, the same DT got defensive holding on run plays, not once but twice.  A hold when the other team is running the ball, twice.  And DQ smiles and fist bumps him after the other team scored a TD, helped by two defensive holding calls on a run play on 3rd down.

Does this sound like a guy you want running your D?  Because it sure as hell is someone I want running the Gators D.  He reminds me of the really bad Todd Grantham, back in the day the players would be looking at the sideline when the ball was snapped.",Falcons,1,1574636394,e11i34
2,Gg Falcons. See ya at the end of the year,Buccaneers,1,1574631008,e11i34
3,Yes,Buccaneers,2,1574630898,e11i34
4,So is Matt Ryan hot garbage or is Matt Ryan hot garbage?,NFL,1,1574630737,e11i34
5,GG,Buccaneers,1,1574630667,e11i34
6,Which is basically where Ryan has had all of his yards and TDs this season anyway.  He's been terrible early in games until they fall behind by 2+ scores.,Patriots,0,1574630641,e11i34
7,"Holy shit Lions, wtf happened to you guys? Losing to the Redskins now after starting out decently this year?",Buccaneers,1,1574630600,e11i34
8,Bruh they're playing prevent defense. Stfu,Falcons,4,1574630598,e11i34
9,Holy shit good catch Ridley!,Buccaneers,2,1574630532,e11i34
10,there is no one in the stands,Falcons,1,1574630508,e11i34
11,"Lmao, thats some heinous shit right there",Buccaneers,2,1574630493,e11i34
12,Just goes to show you can put any chump into Atlanta's offense and they can make plays. Ryan is part of the problem.,Patriots,-3,1574630489,e11i34
13,"As great as it is to win, is anyone else a tiny bit frustrated that we can't get Evans or Godwin to 200 yards whenever they get *so* close? It's like they hit 180 and it's time to stop using them.",Buccaneers,2,1574630447,e11i34
14,"Our secondary has been awful but they are all are first or second year players, we need o-lineman desperately maybe need one more corner and would prefer a vet",Buccaneers,1,1574630380,e11i34
15,"I don't understand what's happening, I don't like change!",Buccaneers,1,1574630302,e11i34
16,The refs just called PI on review on 3rd and goal in a tied game with 2 minutes left on the Saints to give the Panthers 1st and goal again. Holy shit. NOLA is losing their minds.,Panthers,2,1574630243,e11i34
17,Edward's hair... /r/JustFuckMyShitUp,Patriots,3,1574630237,e11i34
18,Theres enough to overturn that? Really?,Buccaneers,1,1574630227,e11i34
19,Are the saints that good or the falcons this bad?,Buccaneers,1,1574630132,e11i34
20,LOL the falcons are godawful,Buccaneers,2,1574630099,e11i34
21,This feels good.,Buccaneers,4,1574630060,e11i34
22,Another Interception  boiz,Buccaneers,4,1574630055,e11i34
23,"When you have the best receiving unit in the league and your QB looks average, it's never going to work.",Patriots,1,1574629987,e11i34
24,O-line would be my first and maybe second round pick. It's so much harder to get O-line talent in free agency than any other position.,Buccaneers,1,1574629936,e11i34
25,"Nah, the spot for the kickoff is moved up 15 yards",Buccaneers,3,1574629905,e11i34
26,"~~Weren't the Falcons supposed to start from the 10 instead of the 25?~~

Edit: Cheers, /u/KouRien that'll teach me for taking my eye off the game",Buccaneers,3,1574629834,e11i34
27,We had 10 beautiful ~~games~~ quarters this season.,Falcons,2,1574629797,e11i34
28,"Corners looking great today, after that I'm inclined to say the Oline",Buccaneers,2,1574629737,e11i34
29,"Suh: Cmon Vea, you already *got* your TD today!",Buccaneers,4,1574629735,e11i34
30,"Suh, why didn't you let Vea pick it up for the double TD!!",Buccaneers,3,1574629707,e11i34
31,"That's it. 

Dann Quinn, Thomas Dimitroff, and all of their staff must go. Clean house. There is no excuse for the continual implosions when we know this team can compete. This season has made it all too obvious.",Falcons,3,1574629706,e11i34
32,Gene Deckerhoff just said there's no need to leave the stadium to beat traffic as the stadium is almost empty already,Buccaneers,7,1574629704,e11i34
33,"*an illegal stream, giving the NFL no revenue*

Bet it felt good to be condescending, though, huh?",,0,1574629703,e11i34
34,Remember those 3 extra points? The O/U total was 51.5,Buccaneers,3,1574629701,e11i34
35,"Veteran corner, no more drafting. Then a LT",Buccaneers,3,1574629696,e11i34
36,That's what happens when you're the failcons lol,Buccaneers,1,1574629651,e11i34
37,"You knew this before now, surely.",Falcons,4,1574629630,e11i34
38,"So what’s a bigger need for the Buccs, o-line help or corners?",Patriots,2,1574629615,e11i34
39,Defensive tackles*,Buccaneers,5,1574629606,e11i34
40,Hot damn the Falcons are bad,Buccaneers,3,1574629599,e11i34
41,Well we suck again,Falcons,4,1574629597,e11i34
42,This franchise is a dumpster fire.,Falcons,3,1574629582,e11i34
43,2 defensive ends score touchdowns in the same game?,Buccaneers,7,1574629578,e11i34
44,Fucking fade me lmao,Falcons,5,1574629577,e11i34
45,HAHA! Nice!!,Buccaneers,2,1574629556,e11i34
46,"Falcon fans, this is how Bucs felt during those TNF games.",Buccaneers,5,1574629549,e11i34
47,Suh loves him some fumble TDs!,Buccaneers,7,1574629547,e11i34
48,Damn that stadium is empty.,Buccaneers,5,1574629542,e11i34
49,A fitting end to the Dan Quinn era.,Falcons,3,1574629525,e11i34
50,#FIRE THE CANNONS ANYWHERE AND EVERYWHEER,Buccaneers,6,1574629476,e11i34
51,Vea is a gamewrecker.,Buccaneers,3,1574629457,e11i34
52,Close is out boys.,Buccaneers,2,1574629385,e11i34
53,\*continues to watch*,Buccaneers,1,1574629344,e11i34
54,"Commerical playing over the game again. Man, they really think we're fucking idiots that can just be treated like shit lol.",,3,1574629210,e11i34
55,Man apart from that one play early in the game every receiver is completely blanketed. Wtf I was told there would be no secondary,Falcons,2,1574629099,e11i34
56,"4th and long near your own endzone i guess, but i kinda agree",Buccaneers,1,1574629096,e11i34
57,someone let Dan Quinn know there isnt a 5th quarter,,2,1574629095,e11i34
58,why would you punt there????,Saints,2,1574629067,e11i34
59,tampa has 432 yards of offensive in this game,Buccaneers,3,1574629043,e11i34
60,Why the fuck are we punting with 6 minutes left?,Falcons,2,1574629035,e11i34
61,lol Falcons with the awful clock management,Buccaneers,3,1574629015,e11i34
62,"Not even Matt ""17 MPH"" Ryan can escape all this pressure",Falcons,5,1574628904,e11i34
63,Guess we suck again,Falcons,3,1574628887,e11i34
64,"Lol, technically yeah but woooooow",Buccaneers,3,1574628825,e11i34
65,I hate the Pats and Cowboys but want to watch that game for some reason,Buccaneers,4,1574628521,e11i34
66,Absolutely. TD has had 4 years to build an O-line. All he has accomplished is giving Matt Ryan shell-shock.,Falcons,1,1574628472,e11i34
67,The weather is comfy af,Buccaneers,2,1574628432,e11i34
68,"Commentators saying Suh shouldn't jump for the pass... but from Suh's perspective, there could well be an offensive player leaping for it too. Sucks but I get it.",Buccaneers,1,1574628405,e11i34
69,"Good job by the Falcons there, in a 2-possession game, to kick the field goal to make it a 2-possession game",Jaguars,2,1574628388,e11i34
70,I love that the franchise spent all this effort in the off-season trying to fix the offensive line and its still among the worst in the NFL. And somehow I still meet Falcons fans from time to time who don't think the state of our franchise is in any way the fault of Dimitroff.,Falcons,2,1574628325,e11i34
71,Love the Polynesian wrecking ball!,Buccaneers,1,1574628298,e11i34
72,Wtf,Buccaneers,1,1574628280,e11i34
73,He hurtinf?,,1,1574628270,e11i34
74,Damn Vea can do it all. Lets Jameis rest and put him under center.,Buccaneers,3,1574628201,e11i34
75,God bless all the knees.,Falcons,2,1574628172,e11i34
76,"""Good coverage""

What...is that?",Buccaneers,1,1574628009,e11i34
77,Julio just sit out Jesus Christ,Falcons,3,1574627998,e11i34
78,Well this isn’t fun.,Falcons,1,1574627995,e11i34
79,"Wtf, Falcons? This is the worst passing DEF in the league... Why did you force me to choose Ryan over Brees with this formerly delicious matchup? :(",Packers,1,1574627983,e11i34
80,"If we can beat them after they stopped panthers and saints from scoring any TDs and losing, then 49ers should have no problem lol",Buccaneers,1,1574627930,e11i34
81,Imagine being terrified of playing this Falcons team.,Falcons,1,1574627843,e11i34
82,"I'm not watching this game, but I'm terrified thinking about playing the Falcons after they've been eliminated from playoff contention and Dan Quinn is fighting for his job.",49ers,3,1574627701,e11i34
83,I'm glad we win two meaningless games to ruin our draft order and get everyone's hopes up,Falcons,3,1574627667,e11i34
84,"Ack, he made it!  I'm just sitting here [with this](https://media1.tenor.com/images/93c7fa1c9f86113d98469513580cddeb/tenor.gif?itemid=12292550) for no reason.",49ers,3,1574627664,e11i34
85,"Thank god for that FG, but damn, Gay, you should have us at 31!",Buccaneers,1,1574627654,e11i34
86,I'm having a bad time,Falcons,1,1574627644,e11i34
87,"There wasnt a hold in that?

I doubt it, but ill take it",Buccaneers,2,1574627607,e11i34
88,He did it!,Buccaneers,2,1574627597,e11i34
89,"Dan Quinn should lose his job right after this game for getting beat this badly by this Bucs team, led by this joke of a QB. But knowing Blank, I fully expect Quinn to  be here week 1 of next season.",Falcons,-2,1574627591,e11i34
90,https://i.imgur.com/CdJl0yX.gifv,Buccaneers,3,1574627586,e11i34
91,Nice.,Buccaneers,1,1574627567,e11i34
92,https://i.imgur.com/gJUAktV.gifv,Buccaneers,2,1574627557,e11i34
93,Wtf he threw it away,Buccaneers,1,1574627530,e11i34
94,Bless your heart,Falcons,1,1574627487,e11i34
95,Tanking is back on the menu boys,Falcons,4,1574627486,e11i34
96,Winston's pocket presence outstanding today.,Jaguars,3,1574627471,e11i34
97,Godwin destroying the falcons makes sense. God hates Georgia sports 😂,Falcons,3,1574627457,e11i34
98,We're watching the ascension of Godwin,49ers,7,1574627382,e11i34
99,"I know Michael Thomas is leading the NFL in Rec YDs but if Mike Evans and Chris Godwin were 1 person they'd have 2000+ YDs and 17 TDs. They'd be the best WR in America and probably be the captain of our offense. Together, they'd be Chris Evans; Captain America.",Buccaneers,9,1574627262,e11i34
100,"Commentary coming in with that sweet Harry Potter reference

*nice*",Buccaneers,3,1574627246,e11i34
101,Godwinnnn,Buccaneers,1,1574627172,e11i34
102,Yasss boys slayyyy,Buccaneers,1,1574627158,e11i34
103,"I'll take 3 over 7 but it was off that ""hands to the face"" when the defense earned the stop.",Buccaneers,3,1574626976,e11i34
104,FFS that's like 6 penalties on Jake Matthews alone today,Falcons,3,1574626870,e11i34
105,"Only when his team is down by mutliple scores and he's playing against soft zone prevents. Also, with his receivers, he should be doing more. Hell Schaub came in and the offense hardly missed a beat. Dude is so overated.",Patriots,-2,1574626762,e11i34
106,The offense didn't miss a beat when he missed a game.  He hasn't been good.,Patriots,-2,1574626680,e11i34
107,Guess the Falcons suck again.,Vikings,1,1574626655,e11i34
108,He's been better than Brady this year.,Saints,0,1574626649,e11i34
109,You can't be serious.,Falcons,3,1574626597,e11i34
110,I'm tired of these weak ass trick plays. I don't even care if that one actually worked,Falcons,1,1574626585,e11i34
111,I think he is talking about their kicker...,Eagles,1,1574626573,e11i34
112,Devin White is huge...holy shit,Buccaneers,2,1574626533,e11i34
113,And the emmy goes to,Buccaneers,0,1574626474,e11i34
114,"Wow, what a shit flag on 3rd and long",Buccaneers,2,1574626451,e11i34
115,He's been terrible this year. The offense didn't really even fall off when he missed a game.,Patriots,1,1574626444,e11i34
116,Also Cavs a few years ago,Falcons,1,1574626428,e11i34
117,Ryan looks terrible. Put Schaub in.,Patriots,-6,1574626402,e11i34
118,wINSTON ELITE?,Seahawks,1,1574626387,e11i34
119,Can we throw Koetter off the roof of the dome,Falcons,1,1574626385,e11i34
120,BS penalty,Buccaneers,1,1574626384,e11i34
121,Refs and calling phantom hands to the face name a more iconic duo,Buccaneers,3,1574626376,e11i34
122,"Being a Georgia sports fan has to be one of the most painful things ever.

At least Ohio has college football as a release valve for the depression.",Ravens,2,1574626319,e11i34
123,It should. The past two wins only have impacted DQs job status and not our season,Falcons,1,1574626221,e11i34
124,Not at all,Falcons,2,1574626118,e11i34
125,If Falcons score here they will win the game!,,1,1574626034,e11i34
126,At least this pretty much nails the coffin on DQ,Falcons,3,1574625975,e11i34
127,Jameis shouldve run out of the pocket and ran it,Buccaneers,1,1574625972,e11i34
128,"Not if possession is being fought for, Ridley never really had it.",Buccaneers,2,1574625951,e11i34
129,That was the best pick Ive seen in long time,Buccaneers,1,1574625939,e11i34
130,What's up with all these once a season plays?,Falcons,1,1574625912,e11i34
131,"yea   
edit: fuxk yea",Buccaneers,1,1574625868,e11i34
132,Would that not be down by contact? He had possession when he fell,Falcons,-1,1574625857,e11i34
133,Our secondary has been so bad that I don't recognize this gif.,Buccaneers,3,1574625839,e11i34
134,Fuck yeah.,Buccaneers,1,1574625818,e11i34
135,Ridley has nothing on Godwin,Buccaneers,1,1574625818,e11i34
136,He's all right... no FG opportunities.,,1,1574625813,e11i34
137,"I still have faith in Gay, we can't keep having the kicker be a revolving door, need to commit to somebody for a bit.  He's just a rookie still.",Buccaneers,1,1574625813,e11i34
138,My fantasy league had a rule when it was short that a missed PAT was -10 for the kicker.  We never changed it after the PAT was moved back.,Falcons,3,1574625787,e11i34
139,I swear this game has been on for a week,Falcons,2,1574625782,e11i34
140,Not getting FG opportunities.,,1,1574625774,e11i34
141,I don't want to watch no more,Falcons,3,1574625742,e11i34
142,What a Jameis Winston throw by Ryan,Buccaneers,2,1574625733,e11i34
143,https://i.imgur.com/3bnwtjf.gifv,Buccaneers,2,1574625722,e11i34
144,I think they're checking him for a concussion since it looked for a moment like he was KO'd but then he popped back up.,Buccaneers,3,1574625697,e11i34
145,Please be okay,Buccaneers,3,1574625583,e11i34
146,"Oh for sure, 5-11 here we come!",Falcons,2,1574625538,e11i34
147,Buccs trying to kill each other,Falcons,4,1574625494,e11i34
148,Julio is out? fuckk,Falcons,3,1574625490,e11i34
149,"The decision to move the extra point back is probably one of my favorites in recent memory.

They used to be as automatic as they come, now there's absolutely an element of uncertainty to them. To miss 3 is unheard of, back maybe 6-7? (I can't remember how long ago) seasons ago it would be simply unspeakable. 

Definitely stinks for the Bucs. So much volatility at the kicker position, for years now.",Packers,7,1574625467,e11i34
150,Backfired I guess...,Vikings,1,1574625465,e11i34
151,[deleted],,3,1574625427,e11i34
152,"And then y’all will beat us at home, because NFCS",Buccaneers,2,1574625421,e11i34
153,[deleted],,1,1574625407,e11i34
154,"Gay, such a good season so far, what are you doinggggg!",Buccaneers,2,1574625369,e11i34
155,"And that is game and I'am out.  Never fell for the phonyness of this team.  There still bad and DQ needs to be gone, 2 win streak didn't do shit but play us out of a top 5 pick (Thanks for that btw)  Classic Falcons win some meaningless games at the end of the season to ruin our draft position.",Falcons,5,1574625349,e11i34
156,I feel bad for Matt.,Buccaneers,3,1574625341,e11i34
157,Also the most Falcons play,Falcons,2,1574625339,e11i34
158,"Especially considering the missed XPs, you're going to leave with 6 no matter what, might as well go for 2.",Buccaneers,1,1574625339,e11i34
159,I think not going for two may have been more about giving Gay a chance to get some confidence back.,Buccaneers,1,1574625339,e11i34
160,"I knew we would be losing to the Bucs, have been saying it all week. It is the most Falcons' of ways",Falcons,5,1574625333,e11i34
161,Wow Gay caught up to him. Respect even if he couldn't make the tackle,Buccaneers,4,1574625312,e11i34
162,😂😂,Buccaneers,1,1574625301,e11i34
163,Nah hes been great all year. His blemish is the Giants miss and this game. We cant be changing kickers every year.,Buccaneers,1,1574625298,e11i34
164,3 missed extra points wtf man,Buccaneers,4,1574625294,e11i34
165,What is this division lol,Saints,4,1574625276,e11i34
166,that was the most bucs play ive ever seen in my life,Buccaneers,7,1574625275,e11i34
167,What’s happening,NFL,3,1574625263,e11i34
168,Cant blame that last one on Gay but 3 missed XPs is not good.,Buccaneers,4,1574625263,e11i34
169,[The Kicker Curse still haunts us...](https://i.imgur.com/fVRZOBj.jpg),Buccaneers,7,1574625255,e11i34
170,"Serves them right for not going for two, which they absolutely should have done to possibly go up 3 scores no matter what",Buccaneers,7,1574625255,e11i34
171,Oh no we suck again,Falcons,1,1574625233,e11i34
172,The NFC South is absolutely schizophrenic,49ers,3,1574625229,e11i34
173,[deleted],,2,1574625223,e11i34
174,Holy shit what a blocked kick and return,Falcons,1,1574625220,e11i34
175,get off OF ME AHHHHHHHHHHHHHHHHHHHHHHHHHHHHHHHHHHHHHHHHHHHHHHHHHHHHHHHHHHHHHHHHHHHHHHHHHHH,Buccaneers,1,1574625213,e11i34
176,Ahh yes the Falcons are back.,Falcons,1,1574625203,e11i34
177,Just go for 2,Buccaneers,1,1574625180,e11i34
178,Ronald fuckin Jones baby,Buccaneers,1,1574625177,e11i34
179,Good drive for Rojo.,Buccaneers,1,1574625159,e11i34
180,[**ROJO TD!**](https://i.imgur.com/uxetkKl.gifv),Buccaneers,4,1574625143,e11i34
181,We imploded months ago,Falcons,2,1574625109,e11i34
182,I swear our team finds new penalties to take each week,Buccaneers,1,1574625061,e11i34
183,They are who we thought they were,49ers,2,1574625061,e11i34
184,Fuck yeah Rojo,Buccaneers,1,1574625042,e11i34
185,Falcons are imploding,Buccaneers,1,1574624982,e11i34
186,Anyone see Arians looking at his play card after the 25 yard JW run? *Hmmm where's that play on my 3rd down chart?*,Buccaneers,1,1574624974,e11i34
187,[ROJO!](https://i.imgur.com/Anebajo.gifv),Buccaneers,1,1574624971,e11i34
188,Let's foo Falcons they're going to come back and win this game!,,0,1574624954,e11i34
189,Good run Jameis,Buccaneers,1,1574624927,e11i34
190,Smith didnt even bother to block anyone lol,Buccaneers,1,1574624915,e11i34
191,Wtf? lmao,Buccaneers,1,1574624853,e11i34
192,Now I know how Packers fans felt with Favre all those years minus the winning,Buccaneers,1,1574624736,e11i34
193,"He's such a standout player, and seeing this versatility is great!",Buccaneers,2,1574624609,e11i34
194,Neither do the Falcons. Shanahan understood the falcons.,Falcons,4,1574624581,e11i34
195,I don’t understand the falcons.,49ers,2,1574624485,e11i34
196,"Tony Gonzalez roasting Winston, calling him Microwave because he heats up but it doesn't last long.",Buccaneers,4,1574624470,e11i34
197,is this as much of an - Jameis special - as numbers indicate?,Patriots,1,1574624303,e11i34
198,"Destroys Saints and Panthers but losing to the Bucs, well that’s just normal NFCS football for ya",Falcons,4,1574624127,e11i34
199,i wrote a long piece about why vea is gonna be your anchor on /r/buccaneers and showed videos of him in high school absolutely juking kids as an RB,Seahawks,1,1574624059,e11i34
200,Will the Falcons make adjustments and stop running this soft as shit zone D on third and long.  Been nailed with the same basic seam route three times now on third and long.,Broncos,3,1574624026,e11i34
201,That was a pretty fun half.,Buccaneers,1,1574624004,e11i34
202,Just feed him the rock every play and let's see how many guys it'll take to bring him down.,Buccaneers,1,1574623999,e11i34
203,[deleted],,1,1574623950,e11i34
204,Lmao at the guy yelling DONT TOUCH IT,Buccaneers,2,1574623948,e11i34
205,I've never not been able to tell if the QB is the problem or not as much as with Matt Ryan.,Jaguars,2,1574623922,e11i34
206,Matt Ryan is pissed off about something. He threw all short passes there just to end the half.,Falcons,2,1574623898,e11i34
207,just make vita vea the qb,Seahawks,1,1574623890,e11i34
208,"The amount of times I've heard that Jameis needs to ""yeet the ball away""",Packers,1,1574623829,e11i34
209,You know what I don’t care. I would be more than happy sacrificing to trade up and draft Chase Young. Dude is a generational talent and we need a pass rush in the worst of ways.,Falcons,3,1574623809,e11i34
210,"This game is our season in a nutshell. Wtf plays from Winston. Oh my god throws from Winston. One of our WRs having a monster day. Oopsie coverage by our back end. Shaq popping off on the pass rush. Kicking woes...

My body is ready for the last second gg fg",Buccaneers,10,1574623798,e11i34
211,He's got 1k yards receiving but no one addresses that's from like 5  games lol,Packers,-1,1574623793,e11i34
212,Falcons football doesn't make sense,Falcons,6,1574623774,e11i34
213,"I really like Matt, but I wish he would stop missing kicks.",Buccaneers,3,1574623761,e11i34
214,Make that a triple for that big boy,Buccaneers,1,1574623754,e11i34
215,"Fox put the extra point on the board before the kick?  
So unprofessional.",Falcons,3,1574623740,e11i34
216,"YO, HUGE UW FAN AND VITA VEA STAN HERE!!! I NEED VIDEO OR FOOTAGE OF MY SON",Seahawks,1,1574623721,e11i34
217,I want to pull my ear drums out. This commentating crew is cancer.,Falcons,1,1574623717,e11i34
218,"He's been playing so well until today, wtf is going on...?",Buccaneers,1,1574623713,e11i34
219,"Buccaneers TDs in November

Vita Vea: 1

Mike Evans: 1",Cowboys,5,1574623691,e11i34
220,FUCKING MATT GAY,Buccaneers,5,1574623677,e11i34
221,Dirk cursing our kickers again. That’s the only explanation at this point.,Buccaneers,3,1574623677,e11i34
222,why do our kickers miss everything,Buccaneers,4,1574623675,e11i34
223,Gay wtf,Buccaneers,3,1574623670,e11i34
224,"Hey that's not cool, I have Rojo and Evans in my lineup... we aren't playing IDP!!",Buccaneers,3,1574623661,e11i34
225,Wtf are we sitting in this soft ass zone......,Falcons,4,1574623656,e11i34
226,LETS GOOOOO ITS BIG BOY TIME,Buccaneers,2,1574623656,e11i34
227,Y'all need to double big chungus Vea,Jaguars,4,1574623652,e11i34
228,Holy shit Vita!!!!,Buccaneers,3,1574623650,e11i34
229,that was a very gay kick,Buccaneers,3,1574623648,e11i34
230,Defensive Lineman touchdowns are best touchdowns,49ers,2,1574623639,e11i34
231,BIG MAN TD,Buccaneers,1,1574623634,e11i34
232,"Attaboy Gay, thanks for missing 2 XP",Falcons,0,1574623631,e11i34
233,[removed],,1,1574623630,e11i34
234,All right Matt Gay... that's two.,,2,1574623627,e11i34
235,FAT GUY TD ALERT,Buccaneers,5,1574623627,e11i34
236,VIT FUCKING VEA,Buccaneers,4,1574623623,e11i34
237,**LMFAOOO LETS GO VITA**,Buccaneers,6,1574623621,e11i34
238,Chase Young back on the menu boys,Falcons,2,1574623620,e11i34
239,Yes!,Patriots,1,1574623616,e11i34
240,Garbage Falcons back in the building,Falcons,0,1574623614,e11i34
241,Yeah we’re getting blown out here. And next week as well seeing as how we went back to the way we’ve been playing all year and the Saints will be our for blood in that game.,Falcons,1,1574623614,e11i34
242,FUCKING FIRE GAY,Buccaneers,2,1574623613,e11i34
243,#FIRE THE PANTS CANNONS 6 TIMES AT A RANDOM TAMPA HATER,Buccaneers,3,1574623606,e11i34
244,Yo fuck this kicker,Buccaneers,1,1574623598,e11i34
245,VEA,,2,1574623587,e11i34
246,So can we double goodwin please,Falcons,2,1574623582,e11i34
247,FAT GUY TD,49ers,2,1574623574,e11i34
248,[**FIRE THE CANNONS!!**](https://i.imgur.com/JYS9aoK.gifv),Buccaneers,1,1574623566,e11i34
249,"Falcons are getting beat by the exact same play over and over and over and they aren't even close to stopping it, just leaving the seam wiiiiiide open",Titans,3,1574623535,e11i34
250,"Another cheesy Visa halftime promo by fox, never change",Falcons,1,1574623509,e11i34
251,Jameis -&gt; Godwin = Beautiful things,Buccaneers,1,1574623491,e11i34
252,[deleted],,1,1574623485,e11i34
253,I’d be ok if everyone was gone after this game.,Falcons,0,1574623478,e11i34
254,GODWIN IS UNREAL,Buccaneers,4,1574623456,e11i34
255,Pass rush didn’t show up today,Falcons,2,1574623288,e11i34
256,"3rd and long, Falcons D greatest weakness.",Broncos,3,1574623211,e11i34
257,I’m beginning to think that Quinn took over playcalling again. Defense is playing a lot of zone right now when they were playing a lot of man the previous two games.,Falcons,3,1574623195,e11i34
258,"Evans over 1,000 yards for his 6th consecutive season",Buccaneers,1,1574623192,e11i34
259,"Warned us. Bro he came from us. I was baffled the moment we brought him back. Shows that Quinn gives two shits about the offense which is sad, given the talent on that side of the ball. 

We need a really good offensive minded HC so desperately right now it isn’t even funny. Our defense doesn’t need to be an all time great. It just needs to be good if the offense can play at the level their capable of.",Falcons,2,1574623132,e11i34
260,Pertinent is the only reciever in the league that can make a wide open catch contestable,Buccaneers,1,1574623124,e11i34
261,"Does Dan not have anyone upstairs who looks at this shit to tell him to challenge or not? He seems to go based on his gut, which is always, always wrong",Falcons,1,1574623076,e11i34
262,Wonderful.,Buccaneers,1,1574623060,e11i34
263,this game would be a heck of a lot more entertaining if fans could randomly throw things at players,Buccaneers,1,1574623004,e11i34
