,body,author_flair_text,score,created_utc,link_id
530,"That entire sequence, from the fumble, to the endzone penalty on the 2pt try, and finally the missed XP....was peak big ten football.",Colts,16,1574626334,e11i4c
531,This game is what you get when a stoppable force meets a movable object,Giants,4,1574626330,e11i4c
532,[removed],,1,1574626327,e11i4c
533,He needs eyes in the back of his head with Solder at LT,Giants,1,1574626326,e11i4c
534,The NFL officiating is a disaster,Bears,3,1574626325,e11i4c
535,That kick just summed up the Nagy Era.,Panthers,7,1574626324,e11i4c
536,Both of these teams are awful,Giants,2,1574626323,e11i4c
537,Really starting to lean on the 'fire nagy' wagon...,Bears,5,1574626322,e11i4c
538,Eddy fucking sucks now. Where's Jesus when you need him?,Bears,4,1574626321,e11i4c
539,I'd take Nagy over Shurmur.,Giants,0,1574626315,e11i4c
540,Eddy P is trash,Bears,7,1574626313,e11i4c
541,48 yard XP lmao,Bears,4,1574626313,e11i4c
542,bears football,Bears,9,1574626312,e11i4c
543,Nagy is a genius,Bears,4,1574626310,e11i4c
544,48 yard extra point attempt lol,Bears,9,1574626309,e11i4c
545,What a cow chip toss this is,Giants,1,1574626308,e11i4c
546,What the fuck is even happening,Packers,11,1574626297,e11i4c
547,This team is a disaster,Bears,6,1574626297,e11i4c
548,Jesus christ,Bears,2,1574626296,e11i4c
549,That doesn't necessarily help.,Vikings,1,1574626292,e11i4c
550,Why didn't Nagy challenge that pass interference call?,Bears,4,1574626290,e11i4c
551,"Only the Bears can get a strip sack, a TD, and then deflate the entire fan base.",Bears,14,1574626290,e11i4c
552,They are the Bungles for a reason,Giants,1,1574626287,e11i4c
553,"This is a clown show, these aren’t professional football teams. These coaches are showing it very clearly today",Giants,3,1574626284,e11i4c
554,What a fucking shitshow,Bears,9,1574626284,e11i4c
555,"What the fuck is this, just give us the fucking ball",Giants,2,1574626279,e11i4c
556,Even when things are going well dumb shit still happens in Bears games.,Bears,11,1574626273,e11i4c
557,Holy Shit we score a touchdown and the wheels fall off...,Bears,6,1574626271,e11i4c
558,Why Robinson? Just pretend you’re turning to catch the ball!,,3,1574626269,e11i4c
559,"""It's still the try""",Patriots,3,1574626266,e11i4c
560,Please fire Matt Nagy please fire Matt Nagy please fire Matty Nagy,Bears,-4,1574626266,e11i4c
561,That’s your own damn fault for trusting the Giants,Giants,2,1574626262,e11i4c
562,"My god, this game is so fucking pathetic. The Bears are lucky the Giants are more inept.",Packers,3,1574626259,e11i4c
563,John Fox would blush at that coaching performance,Bears,5,1574626258,e11i4c
564,"That was the most bears thing I’ve ever seen. Penalty, penalty, missed kick. BE YOU.",,11,1574626252,e11i4c
565,Fire Eddie into the sun,Bears,0,1574626252,e11i4c
566,Time to draft a kicker in the draft,Bears,1,1574626251,e11i4c
567,What a mess,Bears,1,1574626249,e11i4c
568,If the ball doinks now Nagy might choke someone,,4,1574626246,e11i4c
569,"Yep,  refs passing the blame",Bears,2,1574626241,e11i4c
570,I can't imagine anyone in their right mind would take Findley over Burrows. Tua has probably dropped now but I won't be surprised if he goes in the top 10,Giants,1,1574626241,e11i4c
571,This is a god awful football game lol,Giants,4,1574626232,e11i4c
572,"&gt;Is it flagrant? No

WELL THEN IT SHOULDN’T BE A PENALTY",Bears,15,1574626232,e11i4c
573,Jesus fuck this is absolutely absurd lmao,Colts,6,1574626231,e11i4c
574,And lose another TO?  They aren’t going to overturn shit,Bears,2,1574626228,e11i4c
575,GIVE TRUBISKY A SUPERMAX EXTENSION YOU COWARDS!,Patriots,2,1574626219,e11i4c
576,Gotta execute that shit better,Bears,1,1574626219,e11i4c
577,ITS A TWO POINT CONVERSION YOU ASSBUTT WE WILL NOT COME BACK,Giants,4,1574626215,e11i4c
578,THE LEAGUE IS A FUCKING JOKE,Bears,4,1574626207,e11i4c
579,That's my Bears,Bears,2,1574626205,e11i4c
580,This is comical,Bears,1,1574626205,e11i4c
581,"""Come on you gotta review that!""",Bears,3,1574626204,e11i4c
582,"What an absolute mess, good thing we wasted a timeout on this shitshow",Bears,3,1574626203,e11i4c
583,lolol how does that happen?,Bears,1,1574626202,e11i4c
584,"And a flag. And we'll move back.

...If we miss this FG now",Bears,3,1574626200,e11i4c
585,[deleted],,1,1574626190,e11i4c
586,okay that’s fucking bullshit,Bears,4,1574626188,e11i4c
587,"Gotta say, Nagy has some pipes",Giants,4,1574626186,e11i4c
588,I think he said something like “c’mon you’ve gotta review that”,,3,1574626184,e11i4c
589,Stop that's not funny,Bears,2,1574626183,e11i4c
590,"Don't know what all that's about, with how we play games dusted either way",Giants,1,1574626182,e11i4c
591,Nate Solder sucks and in general we just dont have very functional pass pro,Giants,1,1574626179,e11i4c
592,"Correct, more of Solders fault and Mack doing what he does but it is just a broken record for Jones.  All he does is turn the ball over.  He is still unaware of anything goin on in the pocket causing turn overs.  We need to draft another QB in the draft otherwise being stuck with Jones will be the death of this franchise for years to come.",Giants,1,1574626173,e11i4c
593,"How is that not a pick play , Nagy???",Bears,2,1574626167,e11i4c
594,The ball was 10 yards the opposite direction if that’s OPI then that defender is actually the fucking flash.,,19,1574626163,e11i4c
595,I’d say to challenge it but that won’t get reversed,Bears,3,1574626162,e11i4c
596,Mentally handicapped fans,Bears,0,1574626155,e11i4c
597,[All scoring plays are reviewed... up in the booth](https://i.imgur.com/YR9R1OX.jpg),Bears,5,1574626147,e11i4c
598,Enjoy the contract extension lol,Giants,1,1574626147,e11i4c
599,You’re welcome for that big service,Giants,2,1574626138,e11i4c
600,[deleted],,1,1574626124,e11i4c
601,Foh thats bullshit,Bears,7,1574626124,e11i4c
602,Of course,Bears,3,1574626122,e11i4c
603,lmao just get an extra point it’s like the giants are doing anything anyway,Bears,3,1574626115,e11i4c
604,It's really not a surprise. Most of us giants fans expected it with how shitty our defense is this year,Giants,4,1574626108,e11i4c
605,Because he trained under Andy Reid,Bears,1,1574626107,e11i4c
606,Nagy is gonna Nagy,Bears,1,1574626099,e11i4c
607,Lies,Giants,1,1574626095,e11i4c
608,Did Nagy yell something about music?,Packers,5,1574626094,e11i4c
609,He’s also hit at one of the highest rates in the league. Plenty of his fumbles are his own fault but he is consistently hit while throwing the ball,Giants,1,1574626091,e11i4c
610,"Well Matt Nagy is a moron 

We already knew that",Bears,1,1574626090,e11i4c
611,That's nice because I dislike the Bears,Rams,1,1574626088,e11i4c
612,Damn I'm genuinely surprised by the number of Biscuit lovers coming out of the woodwork all the sudden...,Bears,3,1574626083,e11i4c
613,If the Bengals like Findley they might draft Young.,Giants,1,1574626083,e11i4c
614,"Nice little QB power there, in college it would sometimes take him taking a hit while running to get him in a rhythm",Panthers,2,1574626080,e11i4c
615,I like how Gabriel is dwarfed by the refs,Bears,2,1574626080,e11i4c
616,He is way more accurate than Tebow ever was.,Giants,1,1574626078,e11i4c
617,Mack needed that shit,Bears,4,1574626061,e11i4c
618,Lol Giants making Trubisky look elite 😂😂,Bears,2,1574626059,e11i4c
619,make it 21 to 7?,Bears,5,1574626059,e11i4c
620,"Nah.  2-14 for a draft pick, fire everyone on this coaching staff.",Giants,1,1574626057,e11i4c
621,The line is terrible. Pretty simple. Plus teams haven't been afraid of the pass,Bears,1,1574626055,e11i4c
622,Because we can,Bears,2,1574626055,e11i4c
623,Oh my a good red zone play WTF?,Bears,2,1574626047,e11i4c
624,We're collapsing for Chase Young. That's what I tell myself.,Giants,3,1574626047,e11i4c
625,I'm just saying he fumbles at a historical rate. Hes not the first QB to have line issues. He just doesnt hold onto the ball.,Bears,1,1574626042,e11i4c
626,[deleted],,0,1574626042,e11i4c
627,"Mitch kissed some titties at halftime, didn't he",Texans,3,1574626041,e11i4c
628,**Mitchell Tebowski pounds it in!**,Panthers,1,1574626039,e11i4c
629,Don’t worry our RB scored,Bears,1,1574626038,e11i4c
630,Wtb Mack FF Gif.,Packers,2,1574626036,e11i4c
631,If giants lose I am going to drink very very very very very very heavily tonight. I switched from bucs to giants at the last minute in my elimination bracket. I’m losing a lot of money here because I’m indecisive fuck fuck fuck me,Steelers,3,1574626033,e11i4c
632,You are a good person. I like you,Bears,1,1574626026,e11i4c
633,A time out on a 2PA?????,Bears,2,1574626023,e11i4c
634,WHY ARE WE USING A TIMEOUT,Bears,1,1574626023,e11i4c
635,Janoris soft as fuck on that hit,Giants,2,1574626019,e11i4c
636,.......wasn't even worried,Bears,2,1574626016,e11i4c
637,I just look at it as every loss gets us closer to Chase Young,Giants,3,1574626013,e11i4c
638,Im not sure why we dont have him wearing a glove. Wouldnt of helped there but may help some of them..,Giants,2,1574626012,e11i4c
639,Can we opt out of completing the season? Can the whole team just disappear and come back for training camp?,Giants,2,1574626012,e11i4c
640,"How are people blaming Jones for that fumble? That was all Solder’s fault.

He definitely has a fumbling issue but that one was not on him",Giants,6,1574626007,e11i4c
641,WE KISSING TITTIES,Bears,2,1574625996,e11i4c
642,[removed],,1,1574625995,e11i4c
643,I still think he’ll fix it in the off season. Mack is still good at causing fumbles,Bears,1,1574625993,e11i4c
644,"And it would be less infuriating if I could figure out why

(no it probably wouldn't)",Bears,2,1574625990,e11i4c
645,"Sup, not a hard prediction to make.

1 on 1 with Solder vs a QB who holds the ball",Rams,1,1574625987,e11i4c
646,"Trubisky probably could have done that on the previous play, too. Good to see him using his legs a little more",Bears,2,1574625981,e11i4c
647,"Pack it up boys, Giants are done. GG Bears",,1,1574625977,e11i4c
648,The suffering will not end.,Giants,1,1574625977,e11i4c
649,"lmao we are not gonna score on this will we

edit: nm",Bears,2,1574625967,e11i4c
650,I can’t get upset if I expect nothing.,Giants,4,1574625956,e11i4c
651,"Imagine Daniel Jones as your QB and Chris Carson at RB

Your offense would be coughing up the ball left and right",Bears,2,1574625955,e11i4c
652,He needed that.,Packers,2,1574625951,e11i4c
653,THATS MY QUARTERBACK,Bears,3,1574625951,e11i4c
654,[deleted],,2,1574625950,e11i4c
655,ATTA BOY TRUBS!!!! NEVER DOUBtED YOU For A SECOND,Bears,1,1574625948,e11i4c
656,Yeah I dont really blame that on Jones.,Giants,2,1574625944,e11i4c
657,FOOTBALL TOUCHDOWN,Bears,1,1574625942,e11i4c
658,"Close enough, it was bound to happen",Giants,1,1574625939,e11i4c
659,It’s hard not to when you’re hit from behind immediately while throwing,Giants,1,1574625930,e11i4c
660,It’s times like these when the Bears would really benefit from having a decent run game,,5,1574625925,e11i4c
661,Our run game leaves a lot to be desired.,Bears,8,1574625923,e11i4c
662,That 1934 game had more exciting offense than this 2019 game.,Bears,3,1574625921,e11i4c
663,"no pocket presense, oh god comparing him to tebow",Giants,1,1574625917,e11i4c
664,This season is over... but it'a nice to relive some of last season's magic.,Bears,1,1574625917,e11i4c
665,So thats why we paid this guy a trillion dollars.,Bears,1,1574625913,e11i4c
666,Almost right.  A drive out.,Bears,1,1574625910,e11i4c
667,"Wait.

Jones has lost 10 fumbles already?  Jesus Christ.

Tom Coughlin would have taken him to the vet and had him put down .",Bears,5,1574625905,e11i4c
668,"If he gets back to his rookie form that got me to buy a Walsh jersey, then he'd be competing for the title of best in the league.

Unfortunately, he was below 80% in 3 of his last 4 years in the league, and hasn't made a team since 2017, despite getting a number of tryouts. He should probably go talk to Daniel Carlson's kicking coach or something, because what he's doing hasn't been working.",Vikings,1,1574625901,e11i4c
669,"Cool, this is really cool. 10 lost fumbles for Jones...",Giants,2,1574625901,e11i4c
670,Danny out there Droppin' Dimes again.,Panthers,2,1574625891,e11i4c
671,Daniel Jones looks pretty okay for a rookie but man I'm pretty sure he fumbles more than any QB ever.,Bears,4,1574625890,e11i4c
672,"What a play by Mack, god damn",Patriots,2,1574625879,e11i4c
673,MAC DADDY STRIKES :(,Giants,2,1574625864,e11i4c
674,[deleted],,1,1574625859,e11i4c
675,Solder doesn’t block at all then misses the loose ball by about five feet. The fuck is Jones supposed to do about that,Giants,4,1574625854,e11i4c
676,Where's the MFer that called the Mack FF!! Come here you beautiful fucker,Bears,1,1574625854,e11i4c
677,Damn they go from the giants high IQ beating the bears in black and white to a close up of Virginia saying she was 11 at the time. That’s the most subtle roast I’ve ever seen.,,2,1574625853,e11i4c
678,They're not gonna have Aikman call this shit show of a game,Bears,1,1574625852,e11i4c
679,Mack was saving himself,Patriots,1,1574625848,e11i4c
680,Good day to get a strip sack back,Bears,3,1574625835,e11i4c
681,Classic Solder. I was wondering when he’d royally fuck up,Giants,4,1574625833,e11i4c
682,It was just a matter of time for our oline to get blown up,Giants,5,1574625833,e11i4c
683,"MACK

HE DID IT HE FINALLY SACKED SOMEONE.",Bears,6,1574625825,e11i4c
684,aaaand there it is,Giants,2,1574625817,e11i4c
685,"We have a new WR activated from the practice squad, his name is Soldier Field Grass",Bears,1,1574625816,e11i4c
686,OH MACK I'VE MISSED YOU,Bears,6,1574625811,e11i4c
687,I was literally thinking during the last Bears' drive that it's been a while since we had a DJ turnover lol,Giants,1,1574625809,e11i4c
688,"There you go, Mack! I was waiting for you to get one from 'ole fumble fingers!",Bears,3,1574625807,e11i4c
689,Danny couldn’t even go one game without a fumble.,Giants,3,1574625804,e11i4c
690,"Chis Spielman?

The dude that played for the Lions during his career?

I promise you he is not a Bears fan.",Bears,1,1574625801,e11i4c
691,Now this is a Giants game!,Giants,3,1574625799,e11i4c
692,So the guy who predicted the Mack FF was a series early,Bears,6,1574625791,e11i4c
693,BIG DICK NICK WILLIAMS,Bears,2,1574625788,e11i4c
694,MACK DOES EXIST!,Bears,5,1574625786,e11i4c
695,MCcaskey drinking that whole milk,Bears,3,1574625779,e11i4c
696,"Jordan Howard trade. Bizarre. Is there more to that decision than the basics, it seems like a bruiser like Howard to keep d honest and drag defenders into 5 yd gains would be valuable in red zone. A 6th rounder next draft is a lotto ticket, which is fine. But unhelpful this season and likely the next as well, if the pick develops it'll be in 2nd or 3rd season.",Packers,-2,1574625779,e11i4c
697,Can we for once try a designed screen to saquon? Plz,Giants,2,1574625764,e11i4c
698,Do as I did after the Illinois-Wisconsin game and numb yourself to it,Bears,1,1574625749,e11i4c
699,He did. People thinking that was a missed throw are crazy.,Bears,3,1574625747,e11i4c
700,"Those were shit throws, but I still hate being pass happy in the redzone.",Bears,1,1574625744,e11i4c
701,"Bruh there were four defenders on two receivers in the corner, if he throws that higher it’s a pick. That’s all on Nagy’s play call",Bears,3,1574625737,e11i4c
702,I'm just here because I have a side bet with my friend in fantasy and I have the Bears D and Montgomery,Texans,1,1574625732,e11i4c
703,"&gt; I know it’s easy to shit on Nagy, but I firmly believe Mitch needs to take the majority of the shit

I feel like you easily could've reversed that statement and no one would blink twice. They've been equally shit on lately.",Giants,2,1574625727,e11i4c
704,I think Blair Walsh is a better kicker than a good amount of the league has rights now.,Giants,1,1574625723,e11i4c
705,[deleted],,1,1574625717,e11i4c
706,Burger King is nasty and no one can change my mind about that.,Bears,1,1574625715,e11i4c
707,"Looked like he just threw it away there,  that whole left side of the field was covered pretty well",Panthers,5,1574625698,e11i4c
708,as is bears way,Bears,3,1574625698,e11i4c
709,"Don't look now, but 8 RB runs all game",Bears,2,1574625695,e11i4c
710,We made Sam Darnold look good,Giants,1,1574625694,e11i4c
711,In general I agree with you but I would like to know if there were any runs called there that Mitch checked out of or if Nagy didn't even want to try.,Bears,1,1574625680,e11i4c
712,[deleted],,1,1574625672,e11i4c
713,Clenching my ass for a 25 yard kick lol,Bears,3,1574625671,e11i4c
714,"Beautiful pass to the dirt, Mitch.

See, all that time with Mark Sanchez his rookie year is paying off.",Bears,-2,1574625669,e11i4c
715,Mitch Trubisky then spotted with his topless girlfriend while smoking a Marlboro Red after the game,Bears,1,1574625667,e11i4c
716,He’s not an idiot,Bears,3,1574625664,e11i4c
717,"Redskins please win, we need chase young",Giants,1,1574625661,e11i4c
718,"This team can’t ruin my good mood

They just can’t 

ASU has made me too happy this weekend",Bears,3,1574625648,e11i4c
719,"Miller was open, post route to the corner.",,1,1574625635,e11i4c
720,He jadevion clowney-ed cohen earlier,Giants,1,1574625627,e11i4c
721,"I know it’s easy to shit on Nagy, but I firmly believe Mitch needs to take the majority of the shit when our offense plays bad. His missed throws destroy drives and puts Nagy in a bind",Bears,2,1574625603,e11i4c
722,Conversely our QB makes any defense look good so I think they cancel out.,Bears,3,1574625597,e11i4c
723,Ugly throw there,Vikings,1,1574625586,e11i4c
724,who the fuck was he throwing to,Bears,1,1574625577,e11i4c
725,Now that was a professional football team caliber drive,Bears,2,1574625576,e11i4c
726,Our GM is bad,Giants,3,1574625571,e11i4c
727,3 straight passes at the goal line ? I get riding the hot hand but cmon,Bears,8,1574625567,e11i4c
728,Whoever the color guy is isn't even pretending he's not a Bears fan. I think Aikman is less biased.,Giants,8,1574625551,e11i4c
729,"You might want some of our DBs and LBs, that much is true. But do you really want anyone who's ever played **kicker** for us?",Vikings,2,1574625543,e11i4c
730,Our Defense makes any QB look good,Giants,2,1574625535,e11i4c
731,Go for it!,Patriots,2,1574625519,e11i4c
732,Go for it,Bears,2,1574625518,e11i4c
733,Why do we have to play the Giants. Mitch about to play himself into an extension...,Bears,-2,1574625509,e11i4c
734,"I think the Vikings, Seahawks, and saints are all legitimately good.",,1,1574625506,e11i4c
735,"Is leonard Williams on this team? Can someone explain why we gave up draft capital for a guy who is ""just there"" at best?",Giants,3,1574625505,e11i4c
736,not playing one of the worst defenses in the nfl,Bears,2,1574625494,e11i4c
737,"Hey, if we're going to lose at least one team can look presentable.",Giants,3,1574625489,e11i4c
738,"That’s every game against the giants this year, I hope he is your guy but our secondary and pass rush.. and linebackers are atrocious. Our up the middle run defense is about the only good part of this D",Giants,3,1574625485,e11i4c
739,"Please fill it with DBs, LBs and kickers",Giants,5,1574625473,e11i4c
740,Playing better defenses than ours,Giants,1,1574625467,e11i4c
741,Was Miller churning butter? Lol wtf was that,,3,1574625465,e11i4c
742,And there it is... everything about that throw was stupid.,Bears,3,1574625465,e11i4c
743,"Trubisky starts hitting the open receivers that are always there and all of sudden no one's calling Nagy a bad playcaller anymore.  

Really activates the ol' almonds.",Bears,4,1574625461,e11i4c
744,Mitch channeling Jay 🔮,Bears,3,1574625459,e11i4c
745,Lol we'll take it man,Bears,2,1574625448,e11i4c
746,Just been resting from last year.,Bears,1,1574625442,e11i4c
747,I warned Bears fans all week about this lol,Giants,4,1574625435,e11i4c
748,"If this game gets Trubisky a big extension, we'll have to send the Giants a massive gift basket.",Vikings,1,1574625434,e11i4c
749,Horstead BAYBEEE,Bears,2,1574625432,e11i4c
750,"Bears need to beat Lions, grind out a win against Dak, and upset one of GB on the road or Kansas City in our house. 

Vikings lose to Seahawks, packers, Kirk chokes against one of Chargers/Lions. 

Suddenly it’s week 17 and we’re playing the Vikings, winner goes 9-7 for the 6 seed.",Bears,1,1574625427,e11i4c
751,Trubisky 3 yards from his season high in passing yards,Bears,6,1574625426,e11i4c
752,"Oh no please Mitch I've already moved on from you, don't tug my heart strings like this.",Bears,1,1574625420,e11i4c
753,That’s gotta be double digit consecutive completions against Ballentine at this point,Giants,4,1574625407,e11i4c
754,"Oh great. This is gunna be the ""Mitch is our QB!"" Game, isnt it?",Bears,3,1574625406,e11i4c
755,Goat,Bears,1,1574625405,e11i4c
756,Where has this offense been?,Bears,2,1574625401,e11i4c
757,[deleted],,1,1574625390,e11i4c
758,Mitch Dimes,Patriots,1,1574625389,e11i4c
759,[removed],,1,1574625389,e11i4c
760,People are gonna tell you you’re crazy and maybe you are. (you definitely are) However there’s enough of us pessimistic fans that it’s nice to know there’s still some people hoping.,,2,1574625387,e11i4c
761,👀,Bears,1,1574625381,e11i4c
762,"There we go, those are the throws I’ve been missing",Bears,1,1574625374,e11i4c
763,Our defense makes Trubisky look like Drew Brees lol,Giants,5,1574625373,e11i4c
764,The poise with a defender in his face. Wow.,Packers,2,1574625368,e11i4c
765,Who replaced Trubs?,Bears,2,1574625366,e11i4c
766,Do y’all not have enough fucking commercials already? The fuck are we coming back halfway through a play for,Giants,3,1574625362,e11i4c
767,You mean the one gashing our defense?,Giants,1,1574625361,e11i4c
768,See?,Giants,1,1574625359,e11i4c
769,So go Lions?,Vikings,1,1574625358,e11i4c
770,I think the Bears take the “game of inches” expression waaaaay too literally. So many plays seemed designed to get like a yard.,Redskins,3,1574625357,e11i4c
771,Good ball placement for the catch and run- good catch... it's crazy!,Bears,1,1574625352,e11i4c
772,"On God, that’s 200 yds passing",Bears,3,1574625335,e11i4c
773,"""We're just barely off our own Goaline. Let's pass it!""

-Matt Nagy",Panthers,0,1574625323,e11i4c
774,[deleted],,1,1574625305,e11i4c
775,scared the shit out of me running with the ball like that,Bears,2,1574625302,e11i4c
776,WTF was that??? was that football,Bears,2,1574625301,e11i4c
777,"If you watched our Defense when there is a slight crack like last drive, we will break.",Giants,1,1574625299,e11i4c
778,Holy shit that looked like a football play!,Bears,4,1574625273,e11i4c
779,Let is go man. Let it go.,Bears,2,1574625269,e11i4c
780,"...are they? 

It feels like there are 4 truly good teams (Pats, Pack, Ravens, 49ers), 4 truly bad teams (Dolphins, Skins, Bungles, Jets), and everyone else is just varying degrees of suck.",Bears,2,1574625254,e11i4c
781,[deleted],,2,1574625248,e11i4c
782,Have you watched our offense?,Bears,3,1574625235,e11i4c
783,Honestly its like half the league at this point,Giants,2,1574625232,e11i4c
784,"Mitch literally had one solid drive and I’ve already googled ours and the Vikings’ schedules and talked myself into a playoff spot at 9-7.


Existence is pain.",Bears,7,1574625229,e11i4c
785,"yep

edit: I thought u were talking about the giants",Bears,2,1574625224,e11i4c
786,I can think of something worse.,Bears,1,1574625211,e11i4c
787,The roll snap still might make it all worth it.,Packers,2,1574625177,e11i4c
788,Don’t let our defense fool you,Giants,1,1574625172,e11i4c
789,Fuck Anish Kapoor,Patriots,2,1574625171,e11i4c
790,Ready for a 90 something drive for a TD?,Giants,4,1574625156,e11i4c
791,The punter is the best player on our team,Giants,4,1574625146,e11i4c
792,Damn this commentator really coming here with earth shattering news that people do indeed call the bean “the bean” (don’t come at with this cloud gate shit I know),Bears,6,1574625130,e11i4c
793,how is oakland losing against the jets lmao they’re actually good this season,Bears,2,1574625121,e11i4c
794,[deleted],,1,1574625113,e11i4c
795,Bullshit,Bears,3,1574625109,e11i4c
796,Stats prove he only faces a double team on 21% of snaps but ok,Rams,-1,1574625103,e11i4c
797,Yeah agree its too early to hate him but hes absolutely not ready yet. We’re just kinda done with grant Haley and trying to get playing time for the young dbs,Giants,1,1574625066,e11i4c
798,Solder hip checked Mack when he got beat lol,Giants,4,1574625065,e11i4c
799,Nothing is worse than Vikings fans when they are above. 500.,Packers,1,1574625064,e11i4c
800,How in the fuck is Shurmur still a head coach in the NFL,Giants,3,1574625038,e11i4c
801,Everyone in the secondary does this.,Giants,1,1574625028,e11i4c
802,"Has nothing to do with this game, but Kyler Murray is going to be a top-tier QB within three years. I look forward to the Lamar Jackson/Kyler Murray super bowl we'll hopefully experience at some point.",Bears,3,1574625022,e11i4c
803,Crazy how all you talk about is the Bears. Seriously crazy.,Bears,3,1574625015,e11i4c
804,He’s a rookie who hasn’t played a ton in the secondary. I’m okay with it.,Giants,1,1574625007,e11i4c
805,Bring back Minshew,Bears,3,1574624970,e11i4c
806,makes sense,Bears,1,1574624969,e11i4c
807,"I’m going to be Nostradamus here and say a saquon run up the middle followed by a jones INT, let’s fucking go",Giants,4,1574624968,e11i4c
808,Agreed.,Giants,5,1574624962,e11i4c
809,"I mean at this point, I wish he weren't",Bears,1,1574624950,e11i4c
810,Bengals and redskins iirc.,Giants,1,1574624941,e11i4c
811,Mitch is really gonna suck me back in today huh..,Bears,5,1574624932,e11i4c
812,His motor has never left he’s just been getting double and triple teamed on nearly every play since Hicks has been injured.,,2,1574624925,e11i4c
