,body,author_flair_text,score,created_utc,link_id
888,Uhhg joshie what was that?,Bills,1,1574622236,e11i3w
889,Definitely a WTF pass but I follow Broncos  so I like it.,Packers,2,1574622231,e11i3w
890,I really wish new era would sell McDermott's hat.,Bills,1,1574622226,e11i3w
891,That was a terrible pass,Bills,1,1574622226,e11i3w
892,The ghost of Beasley.,Broncos,4,1574622223,e11i3w
893,Um ok,Broncos,3,1574622221,e11i3w
894,"hahaha, what the hell was that throw?",Broncos,0,1574622205,e11i3w
895,Oh Josh,Bills,1,1574622203,e11i3w
896,Who was that pass to what,Bills,1,1574622200,e11i3w
897,At least it wasn't a hero ball?,Bills,2,1574622200,e11i3w
898,Beasley gets injured right before his revenge game wtf,Bills,3,1574622193,e11i3w
899,Lol they aren't going to correct the mistake,49ers,3,1574622191,e11i3w
900,Shit game coverage,,1,1574622180,e11i3w
901,"They did mention the center going down, thumb",Bills,1,1574622178,e11i3w
902,SHOW THE PENALTIES CBS!,Patriots,6,1574622175,e11i3w
903,God please no Allen,Bills,1,1574622167,e11i3w
904,The fuck kind of pass was that?,Bills,2,1574622154,e11i3w
905,"I love the gameplan this week. We should be running the ball like this every week, it sets up the pass for allen. 

Would like to see more passes and screens for singleterry",Bills,1,1574622151,e11i3w
906,"The streak is dead, rip Josh",Bills,3,1574622148,e11i3w
907,"Horrible coverage of this game today from CBS. Not replaying key penalties, announcers didn't mention the Bills C went out with injury in the first quarter, just noticeably really really poor TV coverage",,7,1574622137,e11i3w
908,What the hell was that??,Bills,3,1574622126,e11i3w
909,Need him undsrneath so bad.,Bills,2,1574622106,e11i3w
910,Not Beasley. Hopefully it's not serious. I had a big feeling he was going to have a crazy game playing angry on Thursday.,Bills,2,1574622072,e11i3w
911,"Did he just say ""into the secondtary""?",Bills,2,1574622021,e11i3w
912,Singletary is best tary.,Bills,2,1574622017,e11i3w
913,"I can’t believe we have the fewest ST penalties, feels like we get a holding or BITB every third punt. Oh yeah and Heath farewell sucks",Bills,3,1574622015,e11i3w
914,"Resign Shaq and J Phillips, cut Lotulelei and Murphy",Bills,0,1574621994,e11i3w
915,"IDK, we do have the cap space to keep him. He seems like somebody who would be worth keeping around in my mind",Bills,1,1574621991,e11i3w
916,Lol just ran him back.,Packers,1,1574621985,e11i3w
917,That is one bad picture of Beasley.,Bills,6,1574621982,e11i3w
918,Either a safety or a touchdown lol,Bills,1,1574621976,e11i3w
919,Oh man not Beasley...,Bills,9,1574621970,e11i3w
920,D looks great. Let's get six.,Bills,1,1574621965,e11i3w
921,"Beasley like, ""Why the fuck was that not blown dead? I didn't want to be tackled."" Lol",Bills,5,1574621963,e11i3w
922,Oh my god no,Bills,2,1574621961,e11i3w
923,CBS has been terrible about this,Patriots,3,1574621937,e11i3w
924,Agreed.  He would have HATED these commercials.,Bills,5,1574621937,e11i3w
925,It's better to take what's there than trying to force it in the end zone. Forcing it makes turnovers more likely. If they were trailing and it was later in the game I'd agree with being more aggressive but as it stands I see no reason not to settle for 3 there.,Bills,1,1574621931,e11i3w
926,"If this method I just tried is at all accurate:   
&gt; 1. Show all comments   
&gt; 2. Show source code   
&gt; 3. Count instances of ""flair-bills"" (251 instances)   
&gt; 4. Count instances of ""flair-broncos"" (103 instances)   
   
Then the ratio is about 2.5:1 in favor of Bills, which means /u/Ellimem is pretty much spot-on.   
Edit: Actually, that is total comment count, not unique user count.",Broncos,1,1574621929,e11i3w
927,Beat the Pats and kets the Skins out of playoff contention.  Sure go cowboys.,Bills,1,1574621929,e11i3w
928,He let it happen in the 80s,Broncos,0,1574621919,e11i3w
929,Cole wondering what took so long for that whistle,Bills,4,1574621919,e11i3w
930,Is the Bills average starting position their own 10?,Bills,1,1574621903,e11i3w
931,A big part of that will be what the DE market looks like this off-season. Shaqs been playing well enough the past couple years that he might be one of the top DE this off-season and just cost too much to justify,Bills,2,1574621898,e11i3w
932,I'm sure Jim Henson would loooove all of his characters being used for all these advertisements.,Broncos,10,1574621861,e11i3w
933,Another blocking in the back im pretty sure,Bills,3,1574621860,e11i3w
934,Special teams killing us with field position,Bills,2,1574621856,e11i3w
935,"Yeah, I really like Shaq. Might not give you big sack numbers, but he's pretty damn good all around.",Bills,3,1574621853,e11i3w
936,Probably block in the back,Broncos,2,1574621845,e11i3w
937,"For who, Rypien?  Against this Defense?",Broncos,1,1574621840,e11i3w
938,Come on Zo. That's twice now. You know better than that.,Bills,4,1574621830,e11i3w
939,block in the back apparently.,Bills,3,1574621826,e11i3w
940,To be fair it seems like he has no one to throw to,Bills,1,1574621822,e11i3w
941,That's kind of a problem. You need to be able to score against top defenses to win against good teams. We kinda don't do that.,Bills,1,1574621817,e11i3w
942,"When I think of a company that I def want having a huge camera in my house, it’s always Facebook.",,7,1574621810,e11i3w
943,http://www.nfl.com/videos/nfl-game-highlights/0ap3000000521354/Who-was-Simms-passing-to,Bills,1,1574621810,e11i3w
944,What even was that penalty.  They were trying to cut to commercial so hard they didn't even say.,Bills,4,1574621796,e11i3w
945,Josh or Brandon?,Bills,1,1574621796,e11i3w
946,I don't even want Shaq looking at free Agency this year. Sign him first thing this off season.,Bills,3,1574621789,e11i3w
947,"Okay, let's wear their D down",Bills,2,1574621785,e11i3w
948,I've been rooting for dallas all year because Dak and Cooper are carrying my fantasy team. It's been painful.,Bills,3,1574621784,e11i3w
949,Have they shown a replay of a flag all day?  It's annoying,Bills,3,1574621783,e11i3w
950,I think Josh is playing great today,Bills,3,1574621773,e11i3w
951,Might want to bench the entire O-Line,,0,1574621772,e11i3w
952,Shaq Lawsons best game this season? Hes in the backfield every play,Bills,2,1574621766,e11i3w
953,Yikes that was a huge sack,Broncos,1,1574621766,e11i3w
954,Let's maybe not commit a penalty on ever play,Bills,4,1574621757,e11i3w
955,Wtf is going on with penalties today?? They’ve been throwing flags like crazy against us,Bills,7,1574621750,e11i3w
956,These punt penalties are making these drives way harder than they need to be,Bills,4,1574621748,e11i3w
957,Bench Allen right the fuck now,Broncos,3,1574621738,e11i3w
958,WOOOOOOOOOOOOO,Bills,1,1574621737,e11i3w
959,Is the inferior Allen completely unaware of the pass rush?,Bills,3,1574621736,e11i3w
960,Hugeeeee sack,Bills,1,1574621732,e11i3w
961,~1:2 but I think it has a lot to do with the team records at this point in the season.,Bills,1,1574621730,e11i3w
962,I know Lindsay is our best RB but I wish we used Freeman more when Lindsay isn’t getting it going,Broncos,3,1574621726,e11i3w
963,Fant remembered that penalty von got for fake helping him up,Broncos,3,1574621714,e11i3w
964,That was the dumbest QB play I've seen since Flacco,Broncos,2,1574621714,e11i3w
965,I’m here right now.  Maybe a few thousand broncos fans.,Bills,1,1574621713,e11i3w
966,"60/40 bills/broncos 

shooting from the hip.",Bills,2,1574621711,e11i3w
967,Seems 3:2 Buffalo?,Bills,2,1574621708,e11i3w
968,3:1 at least,Broncos,2,1574621691,e11i3w
969,Get em Big Shaq,Bills,4,1574621676,e11i3w
970,Dallas vs pats?  Then...fuck yes I guess so.,Broncos,5,1574621648,e11i3w
971,Ratio of Broncos to Bills fans ITT?  Any guesses?,Broncos,3,1574621646,e11i3w
972,He gets NBA games but i think its his contract with Westwood one radio that keeps him from calling big nfl games,Bills,1,1574621646,e11i3w
973,"Go Frank's team, beat not Frank's team!",49ers,4,1574621637,e11i3w
974,that looked more like the WR got caught up on Edmunds and it caused Tre to collide with him a little rather than a hold,Bills,0,1574621622,e11i3w
975,My brightside is long drives early wear down defenses,Bills,1,1574621610,e11i3w
976,Are we really forced to root for the jets and dallas today?,Bills,4,1574621597,e11i3w
977,Let’s go Jete!!,Bills,1,1574621593,e11i3w
978,That is kind of a weak call.,Bills,1,1574621585,e11i3w
979,This ref has the type of voice you don't want to introduce to your children,Broncos,2,1574621579,e11i3w
980,Brandon Allen does have a good hard count.,Broncos,1,1574621578,e11i3w
981,Go Jets!,Broncos,1,1574621574,e11i3w
982,Broncos: we need a qb who can run...for his life behind this OLine,,1,1574621557,e11i3w
983,Go J-E-T-E,Broncos,4,1574621527,e11i3w
984,We passed the turnover bug on to Wentz when we played the Eagles. That man is having a rough few weeks.,Bills,1,1574621525,e11i3w
985,Well yeah...,Bills,1,1574621524,e11i3w
986,"Ya, very true",,1,1574621519,e11i3w
987,"Ya bro, come on over",,1,1574621506,e11i3w
988,"Okay Joe from Tonawanda, thanks for calling in",Bills,10,1574621486,e11i3w
989,I'll see your 3rd quarter woes and raise you a completely non-scoring Broncos 4th quarter.,Broncos,1,1574621476,e11i3w
990,This commercial has unnecessary bass,Bills,1,1574621447,e11i3w
991,"Although this season has been an obvious disappointment, I have faith in him, and I feel that's the general consensus.",Broncos,1,1574621429,e11i3w
992,The Broncos have a top 5 D and on most of these plays there hasn't been an option. It's not like the Bills have an open man who isn't being hit.,Bills,2,1574621426,e11i3w
993,The worst part was the holding. I didn’t mind the run,Bills,1,1574621425,e11i3w
994,Pass interference on Stephon Gilmore,Bills,1,1574621404,e11i3w
995,Another 80+ yard drive ending with a field goal. Would be nice to have a touchdown but it's nice to see us getting points and just falling short of touchdowns,Bills,1,1574621404,e11i3w
996,If teams went for in situations like these they would win more games imo.,Broncos,1,1574621403,e11i3w
997,"Yeah, would’ve been 6 for sure without that",Bills,2,1574621397,e11i3w
998,"Needs more time for everything to really click.  We have had some halves where we dominate and then don't adjust as well and lose a close game.  I think we have a good base to build on, and he still has everyone going all out even with a losing record.  Not as happy as I wanted to be but I wanna give him another year or two for sure to see how this team can grow.",Broncos,1,1574621396,e11i3w
999,If our offense keeps playing like this the TDs will come.  You see the Patriots start like this all the time.,Bills,2,1574621385,e11i3w
1000,Holding call screwed us.,Bills,4,1574621375,e11i3w
1001,Penalties showing how much of the difference they can make.,Bills,2,1574621371,e11i3w
1002,Let's get this 3 and out and put pressure on their Def.,Bills,1,1574621359,e11i3w
1003,Just embarrassing. Put it in the fucking endzone like a real team. This is why we'll lose in the wildcard round,,-2,1574621349,e11i3w
1004,I don't think it's fair for us to just churn through head coaches and blame it on them.  The front office is more the issue at this point imo.,Broncos,1,1574621347,e11i3w
1005,Vote for them to get in the Rock Hall of Fame!,Bills,1,1574621347,e11i3w
1006,Ty Hauschka.,Bills,1,1574621346,e11i3w
1007,This drive deserved 6.,Bills,3,1574621327,e11i3w
1008,"Good drive, too bad it only ended in 3 points though",Bills,2,1574621325,e11i3w
1009,I’d give him a D+ or C- at best so far. Defense falls apart when they need a stop but you can’t win in this league without a QB.,Broncos,1,1574621323,e11i3w
1010,That holding fucked us,Bills,2,1574621318,e11i3w
1011,gr8 b8 m8,Broncos,1,1574621312,e11i3w
1012,I hate how we waste 1 play every red zone drive to a designed QB run. Fucking unreal,Bills,6,1574621310,e11i3w
1013,Judas Priest is the best,Broncos,2,1574621298,e11i3w
1014,Somewhere around 1985.,Bills,4,1574621296,e11i3w
1015,Disappointing to keep coming away with field goals after good drives,Bills,2,1574621295,e11i3w
1016,Hes old. Having Singletary really helps him to be able to have those bursts when he comes in,Bills,3,1574621293,e11i3w
1017,"I couldn't tell if he was out of the pocket but apparently he was, so yea good throw away with Von coming in on him.",Broncos,1,1574621290,e11i3w
1018,Gonna have to score from outside of the redzone it seems,Bills,1,1574621278,e11i3w
1019,Old Man Speed.,Bills,2,1574621269,e11i3w
1020,Glad we could stop them from the TD but God damn we need our offense to move better.,Broncos,1,1574621258,e11i3w
1021,"Can we please make our halftime adjustments now?

Oh wait, I forgot, we don't make adjustments at halftime, or at any other time.",Broncos,1,1574621256,e11i3w
1022,Good throw away,Bills,3,1574621248,e11i3w
1023,Kevin Harlan is the most underrated announcer in sports. A shame that he rarely gets marquee games on TV.,Bills,3,1574621242,e11i3w
1024,Can we fucking score some goddamn touchdowns?,Bills,4,1574621239,e11i3w
1025,I hope he lights Dallas up on thursday.,Bills,2,1574621234,e11i3w
1026,I’m rooting for y’all to make a splash in the playoffs,Broncos,2,1574621234,e11i3w
1027,"Squish the fish, but I will always root for Fitz",Bills,1,1574621230,e11i3w
1028,I think it was 40-something coming into today.,Bills,2,1574621212,e11i3w
1029,I wish I could hear it,Broncos,1,1574621206,e11i3w
1030,Don't jinx us. We still have to make it through the 3rd quarter.,Bills,2,1574621201,e11i3w
1031,Off sides on Kroft,,1,1574621198,e11i3w
1032,"Josh, in the early holiday mood, decided to give a game-used football to a fan that last play. Truly, a man of the people.",Bills,5,1574621196,e11i3w
1033,How do Broncos fans feel about Fangio as HC? Feel like he has potential as HC or has been a disappointment?,Eagles,2,1574621190,e11i3w
1034,"Gore looks explosive today, when did he get so fast?",Bills,3,1574621189,e11i3w
1035,Do you have a guest room?,,1,1574621181,e11i3w
1036,How many more yards does Gore need for that all time stat?,Bills,1,1574621171,e11i3w
1037,"Not Duffs or Anchor (good but not best)

Gabriel's Gate, Bar Bill, or if you go south of Buffalo, BJ's in Fredonia or Sportsman in Sunset Bay.",,1,1574621169,e11i3w
1038,"I really hope Beasley likes it here, I was always a fan of his game",Bills,3,1574621160,e11i3w
1039,I love kevin Harlans enthusiasm when calling games,Bills,5,1574621150,e11i3w
1040,"I'll take 1 non-embarrassment of a game please, thank you.",Broncos,1,1574621146,e11i3w
1041,Holding on Feliciano. Tell me another new story.,Bills,5,1574621145,e11i3w
1042,Cole really wanted that TD lol,Bills,2,1574621129,e11i3w
1043,"Good game Bills, y’all are the superior team.",Broncos,2,1574621122,e11i3w
1044,I got downvoted for saying our defense isn’t good. People are in denial.,Broncos,0,1574621113,e11i3w
1045,I still don’t tbh,Broncos,0,1574621106,e11i3w
1046,robert foster is the most lethal weapon the bills have besides allen,Bills,3,1574621106,e11i3w
1047,Good touch pass.,Bills,1,1574621098,e11i3w
1048,Beasley with a huge smile,Bills,1,1574621095,e11i3w
1049,dEnveR is bEttEr tHan thEir ReCorD iNdiCatEs,Bills,-1,1574621094,e11i3w
1050,Me,,1,1574621087,e11i3w
1051,Foster!!!!!!,Bills,1,1574621087,e11i3w
1052,Duffs/Bar Bill/Elmos depending on who you ask,Bills,2,1574621076,e11i3w
1053,"Why was AJ on Cole, he's way to shifty in the slot for a Mike to cover.",Broncos,1,1574621073,e11i3w
1054,"Ya boy, fuck that ballerina shit, just pound Gore",,1,1574621057,e11i3w
1055,Im kinda stoked to see him play in a dome tbh. Hope he airs it out.,Bills,1,1574621056,e11i3w
1056,Frank Gore is a grown ass man.,Bills,2,1574621054,e11i3w
1057,"The biggest ""good wing"" place would be Duffs",Bills,2,1574621047,e11i3w
1058,I made it this far without cracking a beer this game!,Bills,1,1574621041,e11i3w
1059,"You trying to start a fight? 

Duffs are really good.",Bills,2,1574621034,e11i3w
1060,Wow he was FAST when he rounded that corner he took off,Bills,2,1574621020,e11i3w
1061,These guys watch Mountain West Football.,Bills,2,1574621012,e11i3w
1062,Who has the best wings in Buffalo?,,1,1574620993,e11i3w
1063,Yep,Broncos,2,1574620988,e11i3w
1064,"Gore rumbles for about 3 or 4 yards. As it is today, as it was yesterday, as it shall be for all time.",Bills,3,1574620983,e11i3w
1065,"I went to some of his games at UW.  Most of us think he's good, he just had a shaky rookie season.",Broncos,2,1574620977,e11i3w
1066,Same with that colts game....,Broncos,1,1574620976,e11i3w
1067,Josh Allen is a good player. Full stop.,Bills,1,1574620958,e11i3w
1068,Josh “Lamar Jackson” Allen,Broncos,3,1574620949,e11i3w
1069,"I hate the design runs, Allen's mobility is much better utilitized during pass plays where no one gets open.",Bills,3,1574620942,e11i3w
1070,I’ve liked this guy since Wyoming,Broncos,2,1574620932,e11i3w
1071,How in the fuck did that happen,Bills,1,1574620932,e11i3w
1072,Bazoonga!,Bills,1,1574620930,e11i3w
1073,⬆️,Bills,1,1574620928,e11i3w
1074,More of a Young Sheldon guy myself. To each their own,Bills,1,1574620913,e11i3w
1075,Just imagine if he has a good day against the Cowboys on Thanksgiving.,Bills,4,1574620911,e11i3w
1076,I'm not even surprised by stuff like that anymore.,Broncos,1,1574620894,e11i3w
1077,[deleted],,2,1574620891,e11i3w
1078,This fucking stream keeps buffering can't even enjoy the fucking game for 3 seconds without an interruption,Broncos,3,1574620890,e11i3w
1079,I bet he can jump over one of your linebackers,Bills,5,1574620890,e11i3w
1080,Had like 2 guys get their hands on him and... that,Broncos,6,1574620885,e11i3w
1081,"welp, add the broncos fanbase to the growing list fans that finally actually watched josh play and now think he's a good player",Bills,5,1574620881,e11i3w
1082,Damn Josh,Bills,6,1574620849,e11i3w
1083,Holy shit he broke that dude's ankles in the backfield,Bills,7,1574620843,e11i3w
1084,He always fumbles on the designed plays though,Bills,4,1574620841,e11i3w
1085,Holy shit that was maddening.,Broncos,7,1574620831,e11i3w
1086,Man josh is on his game today,Bills,8,1574620829,e11i3w
1087,"Josh ""Russell Wilson"" Allen",Bills,8,1574620824,e11i3w
1088,What’s tackling,Broncos,4,1574620822,e11i3w
1089,bet he can't do that twice...,Broncos,3,1574620820,e11i3w
1090,[removed],,1,1574620818,e11i3w
1091,Allen 😍😍😍😍,Bills,6,1574620818,e11i3w
1092,That's sad.,Broncos,2,1574620817,e11i3w
1093,"Mobile QBs always gash us when plays break down, it's infuriating.",Broncos,4,1574620799,e11i3w
1094,Allen didn't fumble on a scramble upvote party.,Bills,26,1574620799,e11i3w
1095,Singletary is going to bust one for 70 today,Bills,5,1574620794,e11i3w
1096,Todd Davis is getting fucking used today,Broncos,3,1574620774,e11i3w
1097,"Josh isn't Lamar, but damn is he mobile and can run.",Bills,3,1574620773,e11i3w
1098,"Fuck yes, Josh.",Bills,4,1574620770,e11i3w
1099,What a block by 73 wow,Bills,5,1574620765,e11i3w
1100,"...ok, sure!",Bills,2,1574620763,e11i3w
1101,Jesus Josh holy fuck,Bills,3,1574620763,e11i3w
1102,That was such a Josh Allen play.,Bills,4,1574620758,e11i3w
1103,I'm waiting for the spinoff Satan poked me.,Bills,1,1574620757,e11i3w
1104,"I feel dirty rooting for the 'phins, Jete and Cowboys today.",Bills,5,1574620714,e11i3w
1105,I think that has more to do with passing on Allen. Like Allen fits his archetype for QBs. He could have gotten his boy.,Bills,1,1574620703,e11i3w
1106,Back to back shit field position drives,Bills,1,1574620659,e11i3w
1107,"Wow, I can’t wait for God Friended Me tonight!",Bills,3,1574620650,e11i3w
1108,Honestly I won't even be mad if Josh Allen sacks Josh Allen.,Bills,1,1574620639,e11i3w
1109,Seems like it. I swear for the first few weeks it was called on just about every punt return,Broncos,2,1574620630,e11i3w
1110,[deleted],,1,1574620616,e11i3w
1111,id like to muffle his muff,Broncos,1,1574620605,e11i3w
1112,All power be to the Long Snapper,Broncos,1,1574620595,e11i3w
1113,I really wanted to draft Sutton.,Bills,1,1574620591,e11i3w
1114,"""He's a very good returner""

*Muffs the punt*",Bills,9,1574620591,e11i3w
1115,Keep the playoff hopes alive please!,Bills,1,1574620587,e11i3w
1116,"Muffed 

Going to the sideline to take a blow

His coming out party



Man, I love old announcers lol",,2,1574620570,e11i3w
1117,"if they got the same last name it's going to get cray cray, everyone knows that. Just wait till the Bills play the Jags.",Bills,4,1574620562,e11i3w
1118,Did they change block in the back rules this year? Seems to be called more now than ever before.,Bills,5,1574620548,e11i3w
1119,I get tired of penalties. It probably should have been a penalty by rule but I also don't really agree with the rule to begin with,Broncos,3,1574620538,e11i3w
1120,Sutton has been double covered every play for games now. Someone else needs to step up.,Broncos,2,1574620537,e11i3w
1121,Where did Tre run to after that?,Bills,2,1574620516,e11i3w
1122,I can wait for Alzheimers Sheldon,Bills,7,1574620516,e11i3w
1123,"When you see the ""Olive Star"" make a wish because it will be your last.",Bills,2,1574620515,e11i3w
1124,No one NCIS carries cbs with the four different variations,AFC,2,1574620512,e11i3w
1125,What was he so upset about getting up?,Bills,2,1574620509,e11i3w
1126,"&gt; He's not the tallest Quarterback

John Elway turning more and more red...",Bills,4,1574620505,e11i3w
1127,"Nope, the racial slur made it a fair play",Bills,2,1574620503,e11i3w
1128,He jumped when he threw the ball wtf are you talking about,Bills,2,1574620502,e11i3w
1129,If that hit were on Brady they would have ended the season early and declared the pats SB winners.,Bills,1,1574620494,e11i3w
1130,Only if the QB didn't use a slur according to the Garret defense. The ref was right there he probably heard it and didn't grab his flag for good reason.,Bills,1,1574620491,e11i3w
1131,Nice work Ed &amp; Star.,Bills,1,1574620469,e11i3w
1132,WHO WATCHES THESE CBS SHOWS,Broncos,3,1574620431,e11i3w
1133,I see.,,2,1574620424,e11i3w
1134,Not gonna lie...I for sure thought that was going to be 15.   ¯\\_(ツ)_/¯,Bills,1,1574620418,e11i3w
1135,That's the whole thing with the new RTP rules though. It's unfair to the defender but it is what it is,Bills,5,1574620408,e11i3w
1136,"A couple of my black coworkers say their parents watch it religiously.  Anecdotal I know but it's a data point.  I think a lot of TV is marketed to 50 year olds now, people my age don't watch live TV anymore.  I'm 30.",Bills,5,1574620407,e11i3w
1137,"That's what happens hen you have a QB name Allen, you never get those calls.",Bills,1,1574620396,e11i3w
1138,"I mean it wasn't called, sooo....",Broncos,3,1574620392,e11i3w
1139,I agree that they could have called a penalty for RTP there but Risner did more than just fall. He purposefully dropped on a defender after the defender was blocked into the ground. He's a young player and it was just a lapse in judgement so no harm no foul but god forbid if he hurt someone doing that it'd be a problem.,Bills,1,1574620388,e11i3w
1140,I thought roughing the passer is when you rip his helmet off and beat him with it?,Bills,6,1574620384,e11i3w
1141,Are they really trying to push a battle of the Allens narrative?,Bills,2,1574620359,e11i3w
1142,Not if it's Brandon Allen apparently. If that was Brady they would've ended the game right there,Bills,5,1574620356,e11i3w
1143,Except that it was basically a jump pass. Lawson didn't even have to pick him up.,,2,1574620346,e11i3w
1144,Why are you glad it wasn't? I'm glad it wasn't but I think it should have been.,Bills,1,1574620343,e11i3w
1145,Right? Refs trash. As always.,Packers,0,1574620332,e11i3w
1146,Refs usually throw a flag when the qb gets touched,Bills,1,1574620331,e11i3w
1147,"A square clean hit to the body, what's Lawson supposed to do, know it wasn't a pump fake?",Bills,5,1574620316,e11i3w
1148,"Looked like Allen jumped, he wasn't picked up, but yeah was definitely roughing",Bills,0,1574620311,e11i3w
1149,he didn't feel as in he didn't sense.  He was unawares. Caught with his pants down.,Broncos,2,1574620308,e11i3w
1150,"Agreed, he dove for that pancake and that was the correct call.",Broncos,2,1574620295,e11i3w
1151,"It seemed as soon as he let go of the ball lawson let go and tried rolling off, had his arms off to the side.  He didn’t try to drive him into the ground but his momentum took him that was",Bills,1,1574620293,e11i3w
1152,Yeah it definitely isn't roughing to pick up a QB and body slam them.,Broncos,0,1574620283,e11i3w
1153,Alright alright alright the under for the first half of 19.5 looking very nice,Bills,1,1574620278,e11i3w
1154,Listen here ya little shit.....yeah....you're right....,Bills,2,1574620276,e11i3w
1155,Yeah that's a RTP on any other QB,Bills,3,1574620273,e11i3w
1156,Surprised that wasn't a flag. Kinda glad it wasn't but that was pretty brutal,Broncos,3,1574620260,e11i3w
1157,"Na, Risner didn't just fall on him.",,3,1574620254,e11i3w
1158,Surprised they didn’t call roughing the passer.,Packers,3,1574620245,e11i3w
1159,Canada is a suburb of Buffalo,Bills,6,1574620238,e11i3w
1160,Damn that was a big hit.,Broncos,3,1574620234,e11i3w
1161,"We get a 15 yarder for an OLineman falling on a pass rusher, but the refs are fine with that?",Broncos,6,1574620229,e11i3w
1162,That had to hurt,Broncos,1,1574620226,e11i3w
1163,Surprised they didn’t flag Lawson for driving Allen into the turf,Bills,4,1574620223,e11i3w
1164,Glad it wasn't called tbh.  Could have been but that defender had like no way to change his route or wrap up on Allen.,Broncos,1,1574620222,e11i3w
1165,Damn that Seattle play was dope,AFC,2,1574620202,e11i3w
1166,Ouch,Bills,2,1574620201,e11i3w
1167,"Yeah I so, it just sucks that it hurt us there when we could've had a better chance at getting a TD",Bills,1,1574620199,e11i3w
1168,"I mean, if we are in the endzone it DOES usually mean a touchdown.",Bills,2,1574620194,e11i3w
